"astro-ph/9807024","Sabine Frink","Sabine Frink, Siegfried Roeser, Juan M. Alcala, Elvira Covino,
  Wolfgang Brandner","Kinematics of T Tauri stars in Chamaeleon","11 pages, 4 figures, accepted for publication in Astronomy &
  Astrophysics",,,"ARI preprint series No. 85","astro-ph",,"  We study the kinematics of T Tauri stars (TTS) located in the cores of the
Chamaeleon clouds as well as far off these clouds. Our sample comprises 2 early
type stars known to be related to Cha I, 6 classical (CTTS) and 6 weak-line T
Tauri stars (WTTS) known before the ROSAT mission, and 8 bona-fide pre-main
sequence (PMS) stars as well as 23 presumably older stars discovered with ROSAT
(Alcala et al. 1995; Covino et al. 1997). Altogether we present proper motions
for 45 stars, taken from the Hipparcos, ACT and STARNET catalogues. For 12
stars of our sample parallaxes measured by Hipparcos are available, and we use
them to derive constraints on the distance distribution of the other stars in
our sample. Our analysis of the proper motions allows us to divide the sample
into several subgroups. We analyse the motions of the stars in connection with
different star formation scenarios and find them consistent with both the high
velocity cloud (HVC) impact model (Lepine & Duvert 1994) and the cloudlet model
(Feigelson 1996), whereas the data seem to be inconsistent with any kind of a
dynamical ejection model.
","[{""version"":""v1"",""created"":""Thu, 2 Jul 1998 10:43:46 GMT""}]","2007-05-23"
"astro-ph/9807025","David Eichler","S.L. Pistinner & D. Eichler","Self Inhibiting Heat-Flux",,,"10.1046/j.1365-8711.1998.01770.x",,"astro-ph",,"  Heat-transfer through weakly magnetized diffuse astrophysical plasmas excites
whistlers. This leads to electron whistler resonant scattering, a reduction of
the electron mean-free path, and heat-flux inhibition. However, only whistlers
propagating at a finite angle to the magnetic field (off-axis) can scatter the
heat-flux carrying electrons. Thus, the level of heat flux-inhibition along the
magnetic field lines depends on the presence of off-axis whistlers.
","[{""version"":""v1"",""created"":""Thu, 2 Jul 1998 11:30:33 GMT""}]","2009-10-30"
"astro-ph/9807026","Chris J. Willott","C. J. Willott, S. Rawlings, K. M. Blundell and M. Lacy","The radio luminosity function of radio-loud quasars from the 7C Redshift
  Survey","28 pages with 13 figures. To appear in MNRAS","Mon.Not.Roy.Astron.Soc. 300 (1998) 625-648","10.1046/j.1365-8711.1998.01946.x",,"astro-ph",,"  We present a complete sample of 24 radio-loud quasars (RLQs) from the new 7C
Redshift Survey. Every quasar with a low-frequency (151 MHz) radio flux-density
S_151 > 0.5 Jy in two regions of the sky covering 0.013 sr is included; 23 of
these have sufficient extended flux to meet the selection criteria, 18 of these
have steep radio spectra (hereafter denoted as SSQs). The key advantage of this
sample over most samples of RLQs is the lack of an optical magnitude limit. By
combining the 7C and 3CRR samples, we have investigated the properties of RLQs
as a function of redshift z and radio luminosity L_151.
  We derive the radio luminosity function (RLF) of RLQs and find that the data
are well fitted by a single power-law with slope alpha_1=1.9. We find that
there must be a break in the RLQ RLF at log_10(L_151 / W Hz^-1 sr^-1) < 27, in
order for the models to be consistent with the 7C and 6C source counts. The
z-dependence of the RLF follows a one-tailed gaussian which peaks at z=1.7. We
find no evidence for a decline in the co-moving space density of RLQs at higher
redshifts.
  A positive correlation between the radio and optical luminosities of SSQs is
observed, confirming a result of Serjeant et al. (1998). We are able to rule
out this correlation being due to selection effects or biases in our combined
sample. The radio-optical correlation and best-fit model RLF enable us to
estimate the distribution of optical magnitudes of quasars in samples selected
at low radio frequencies. We conclude that for samples with S_151 < 1 Jy one
must use optical data significantly deeper than the POSS-I limit (R approx 20),
in order to avoid severe incompleteness.
","[{""version"":""v1"",""created"":""Thu, 2 Jul 1998 11:38:03 GMT""}]","2015-06-24"
"astro-ph/9807027","Yuri A. Golubkov","K. M. Belotsky (1 and 4), Yu. A. Golubkov (2 and 4), M. Yu. Khlopov (1
  and 3 and 4), R. V. Konoplich (3 and 4), A. S. Sakharov (3 and 4) ((1)
  Institute of Applied Mathematics, (2) Moscow state University, Institute of
  Nuclear Physics, (3) Moscow Engineering Physics Institute, (4) Center for
  Cosmoparticle Physics ""Cosmion"")","Antihelium flux signature for antimatter globular cluster in our Galaxy","20 pages, 3 Postscript figures, Latex2e",,,"INP MSU 98-31/532","astro-ph hep-ph",,"  The AMS experiment is shown to be sensitive to test the hypothesis on the
existence of antimatter globular cluster in our Galaxy. The hypothesis follows
from the analysis of possible tests for the mechanisms of baryosynthesis and
uses antimatter domains in the matter dominated Universe as the probe for the
physics underlying the origin of the matter. The interval of masses for the
antimatter in our Galaxy is fixed from below by the condition of antimatter
domain survival in the matter dominated Universe and from above by the observed
gamma ray flux. For this interval the expected fluxes of antihelium-3 and
antihelium-4 are calculated with the account for their interaction with the
matter in the Galaxy.
","[{""version"":""v1"",""created"":""Thu, 2 Jul 1998 12:40:30 GMT""}]","2007-05-23"
"astro-ph/9807028","Robert Popham","Robert Popham (1), S. E. Woosley (1,2), Chris Fryer (2) ((1)
  Max-Planck-Institut fuer Astrophysik, (2) Lick Observatory, UC Santa Cruz)","Hyper-Accreting Black Holes and Gamma-Ray Bursts","46 pages, includes 9 figures, LaTeX (uses aaspp4.sty), accepted by
  The Astrophysical Journal. Additional solutions in Tables and Figs. 4 and 5,
  minor revisions to text, references added","Astrophys.J.518:356-374,1999","10.1086/307259","MPA 1100","astro-ph",,"  A variety of current models for gamma-ray bursts (GRBs) suggest a common
engine - a black hole of several solar masses accreting matter from a disk at a
rate 0.01 to 10 solar masses per second. Using a numerical model for
relativistic disk accretion, we have studied steady-state accretion at these
high rates. Inside a radius ~ 10**8 cm, for accretion rates greater than about
0.01 solar masses per second, a global state of balanced power comes to exist
between neutrino losses, chiefly pair capture on nucleons, and dissipation.
Energy emitted in neutrinos is less, and in the case of low accretion rates,
very much less, than the maximum efficiency factor for black hole accretion
(0.057 for no rotation; 0.42 for extreme Kerr rotation) times Mdot c**2. The
efficiency for producing a pair fireball along the rotational axis by neutrino
annihilation is calculated and found to be highly variable and very sensitive
to the accretion rate. For some of the higher accretion rates studied, it can
be several per cent or more; for accretion rates less than 0.05 solar masses
per second, it is essentially zero. The efficiency of the Blandford-Znajek
mechanism in extracting rotational energy from the black hole is also
estimated. In light of these results, the viability of various gamma-ray burst
models is discussed and the sensitivity of the results to disk viscosity, black
hole rotation rate, and black hole mass explored. A diverse range of GRB
energies seems unavoidable and neutrino annihilation in hyper-accreting black
hole systems can explain bursts up to 10**52 erg. Larger energies may be
inferred for beaming systems.
","[{""version"":""v1"",""created"":""Thu, 2 Jul 1998 13:07:40 GMT""},{""version"":""v2"",""created"":""Fri, 22 Jan 1999 15:10:10 GMT""}]","2011-07-18"
"astro-ph/9807029",,"Michael Blanton, Renyue Cen, Jeremiah P.Ostriker, and Michael A.
  Strauss (Princeton University Observatory)","The Physical Origin of Scale Dependent Bias in Cosmological Simulations","38 pages of text and figures; accepted by ApJ; revised text",,"10.1086/307660","POPe-769","astro-ph",,"  Using large-scale hydrodynamic simulations with heuristic criteria for galaxy
formation, we investigate how the galaxy field is related to the mass density
and the gas temperature. We find that the bias b(R) = sigma_g(R)/sigma(R),
where sigma_g(R) is the variance of galaxy counts in spheres of radius R and
sigma(R) is the same for mass, varies from 2.6 at 1 h^{-1} Mpc to 1.2 at 30
h^{-1} Mpc. Including the dependence of the galaxy density on local gas
temperature as well as on local mass density can fully account for this scale
dependence. Galaxy density depends on temperature because gas which is too hot
cannot cool to form galaxies; this causes scale dependence of b(R) because
local gas temperature is related to the gravitational potential, and thus
contains information about the large scale density field. We show that
temperature dependence generally causes b(R) to vary on quasilinear and
nonlinear scales, indicating that scale dependence of bias may be a generic
effect in realistic galaxy formation scenarios. We find that the relationship
between the galaxy and mass density fields is also a function of galaxy age. On
large scales, the older galaxies are highly biased (b ~ 1.7) and highly
correlated (r ~ 1.0) with the mass density field; younger galaxies are not
biased (b ~ 0.8) and are poorly correlated (r ~ 0.5) with the mass. We argue
that linear bias is inadequate to describe the relationship between galaxies
and mass. (Abridged)
","[{""version"":""v1"",""created"":""Thu, 2 Jul 1998 13:49:47 GMT""},{""version"":""v2"",""created"":""Fri, 18 Jun 1999 17:29:24 GMT""}]","2009-10-30"
"astro-ph/9807030","Claes Fransson","Claes Fransson and Claes-Ingvar Bj\""ornsson (Stockholm Observatory)","Radio Emission and Particle Acceleration in SN 1993J","accepted for Ap. J",,"10.1086/306531",,"astro-ph",,"  The radio light curves of SN 1993J are found to be well fit by a synchrotron
spectrum, suppressed by external free-free absorption and synchrotron
self-absorption. A standard r^-2 circumstellar medium is assumed, and found to
be adequate. The magnetic field and number density of relativistic electrons
behind the shock are determined. The strength of the magnetic field argues
strongly for turbulent amplification behind the shock. The ratio of the
magnetic and thermal energy density behind the shock is ~0.14. Synchrotron and
Coulomb cooling dominate the losses of the electrons. The injected electron
spectrum has a power law index -2.1, consistent with diffusive shock
acceleration, and the number density scales with the thermal electron energy
density. The total energy density of the relativistic electrons is, if
extrapolated to gamma ~ 1, ~ 5x10^-4 of the thermal energy density. The
free-free absorption required is consistent with previous calculations of the
circumstellar temperature of SN 1993J, T_e ~ (2-10)x10^5 K. The relative
importance of free-free absorption, Razin suppression, and the synchrotron
self-absorption effect for other supernovae are briefly discussed. Guidelines
for the modeling and interpretation of VLBI observations are given.
","[{""version"":""v1"",""created"":""Thu, 2 Jul 1998 14:13:56 GMT""}]","2009-10-30"
"chao-dyn/9807006","Baowen Li","Bambi Hu, Baowen Li, and Weng-ge Wang (Department of Physics and
  Center for Nonlinear Studies, Hong Kong Baptist University, Hong Kong, China)","Universal statistics of wave functions in chaotic and disordered systems","6 Europhys pages, 2 Ps figures, new version to appear in Europhys.
  Lett",,,"HKBU-CNS-9815","chao-dyn cond-mat nlin.CD",,"  We study a new statistics of wave functions in several chaotic and disordered
systems: the random matrix model, band random matrix model, the Lipkin model,
chaotic quantum billiard and the 1D tight-binding model. Both numerical and
analytical results show that the distribution function of a generalized Riccati
variable, defined as the ratio of components of eigenfunctions on basis states
coupled by perturbation, is universal, and has the form of Lorentzian
distribution.
","[{""version"":""v1"",""created"":""Thu, 2 Jul 1998 06:19:49 GMT""},{""version"":""v2"",""created"":""Mon, 6 Jul 1998 01:42:36 GMT""},{""version"":""v3"",""created"":""Mon, 28 Feb 2000 04:15:29 GMT""}]","2007-05-23"
"chao-dyn/9807007","C. Chandre","C. Chandre and H.R. Jauslin","Critical Attractor and Universality in a Renormalization Scheme for
  Three Frequency Hamiltonian Systems","4 pages, 3 figures, REVTeX","Phys. Rev. Lett. 81, 5125 (1998)","10.1103/PhysRevLett.81.5125",,"chao-dyn nlin.CD",,"  We study an approximate renormalization-group transformation to analyze the
breakup of invariant tori for three degrees of freedom Hamiltonian systems. The
scheme is implemented for the spiral mean torus. We find numerically that the
critical surface is the stable manifold of a critical nonperiodic attractor. We
compute scaling exponents associated with this fixed set, and find that they
can be expected to be universal.
","[{""version"":""v1"",""created"":""Thu, 2 Jul 1998 12:08:58 GMT""},{""version"":""v2"",""created"":""Tue, 24 Nov 1998 08:26:48 GMT""}]","2009-10-31"
"cond-mat/9807021","Sven Lubeck","S. Lubeck, K. D. Usadel","SOC in a class of sandpile models with stochastic dynamics","6 pages, including 4 figures","Fractals 1, 1030 (1993)",,,"cond-mat.stat-mech",,"  We have studied one-dimensional cellular automata with updating rules
depending stochastically on the difference of the heights of neighbouring
cells. The probability for toppling depends on a parameter lambda which goes to
one with increasing slope, i.e. the dynamics can be varied continuously. We
have investigated the scaling properties of the model using finite-size scaling
analysis. A robust power-law behavior is observed for the probability density
of the size of avalanches in a certain range of lambda values. The two
exponents which determine the dependence of the probability density on time and
system size both depend continuously on lambda, i.e. the model exhibits
nonuniversal behavior. We also measured the roughness of the surface of the
sandpile and here we obtained an universal behavior, i.e. a roughness exponent
of about 1.75 for all values of lambda. For the temporal behavior of the mass a
$f^{-\phi}$ spectrum is obtained with an exponent phi close to 2 again for all
lambda-values.
","[{""version"":""v1"",""created"":""Wed, 1 Jul 1998 16:51:15 GMT""}]","2007-05-23"
"cond-mat/9807022","Dr. Andrew Ward","J. Arriaga, A.J. Ward and J.B. Pendry","Order N photonic band structures for metals and other dispersive
  materials","Four pages, plus seven postscript figures. Submitted to Physical
  Review Letters",,"10.1103/PhysRevB.59.1874",,"cond-mat.mtrl-sci",,"  We show, for the first time, how to calculate photonic band structures for
metals and other dispersive systems using an efficient Order N scheme. The
method is applied to two simple periodic metallic systems where it gives
results in close agreement with calculations made with other techniques.
Further, the approach demonstrates excellent numerical stablity within the
limits we give. Our new method opens the way for efficient calculations on
complex structures containing a whole new class of material.
","[{""version"":""v1"",""created"":""Wed, 1 Jul 1998 17:31:24 GMT""}]","2009-10-31"
"cond-mat/9807023","Roubtsov Danila","D. Roubtsov, Y. Lepine (Physics Department, Universite de Montreal)","On Reduction of Critical Velocity in a Model of Superfluid Bose-gas with
  Boundary Interactions","9 pages (RevTeX), two figures (.ps) incorporated by epsf. submitted
  to Phys. Lett. A",,"10.1016/S0375-9601(98)00480-0","UdM-GCM-98-0630","cond-mat.stat-mech cond-mat.soft",,"  The existence of superfluidity in a 3D Bose-gas can depend on boundary
interactions with channel walls. We study a simple model where the dilute
moving Bose-gas interacts with the walls via hard-core repulsion. Special
boundary excitations are introduced, and their excitation spectrum is
calculated within a semiclassical approximation. It turns out that the state of
the moving Bose-gas is unstable with respect to the creation of these boundary
excitations in the system gas + walls, i.e. the critical velocity vanishes in
the semiclassical (Bogoliubov) approximation. We discuss how a condensate wave
function, the boundary excitation spectrum and, hence, the value of the
critical velocity can change in more realistic models, in which ``smooth''
attractive interaction between the gas and walls is taken into account. Such a
surface mode could exist in ``soft matter'' containers with flexible walls.
","[{""version"":""v1"",""created"":""Wed, 1 Jul 1998 17:44:26 GMT""}]","2009-10-31"
"cond-mat/9807024","Efrain J. Ferrer","E. J. Ferrer and V. de la Incera","Magnetic Response in Anyon Fluid at High Temperature","7 pages, Talk presented at SILAFAE'98. April 8-11, 1998, San Juan,
  Puerto Rico",,"10.1063/1.56624","SUNY-FREDONIA-98-06","cond-mat.supr-con cond-mat.str-el hep-th",,"  The magnetic response of the charged anyon fluid at temperatures lower and
larger than the fermion enery gap $\omega_{c}$ is investigated in the
self-consistent field approximation. We prove that the anyon system with
boundaries exhibits a total Meissner effect at temperatures smaller than the
fermion energy gap ($T\ll \omega_{c}$). The London penetration length at $T$
$\sim 200K$ is of the order $\lambda \sim 10^{-5}cm$. At $T\gg \omega_{c}$ a
new phase, characterized by an inhomogeneous magnetic penetration, is found. We
conclude that the energy gap, $\omega_{c},$ defines a scale that separates two
phases: a superconducting phase at $T\ll \omega_{c}$, and a non-superconducting
one at $T\gg \omega_{c}$.
","[{""version"":""v1"",""created"":""Wed, 1 Jul 1998 19:35:04 GMT""}]","2009-10-31"
"cond-mat/9807025","Peter Young","J. Kisker and A. P. Young","Dynamical Critical Properties of the Random Transverse-Field Ising Spin
  Chain","5 pages, 5 postscript figures included","Phys. Rev. B58, 14397 (1998)","10.1103/PhysRevB.58.14397",,"cond-mat.dis-nn",,"  We study the dynamical properties of the random transverse-field Ising chain
at criticality using a mapping to free fermions, with which we can obtain
numerically exact results for system sizes, L, as large as 256. The probability
distribution of the local imaginary time correlation function S(tau) is
investigated and found to be simply a function of alpha = -log S(tau) /
log(tau). This scaling behavior implies that the typical correlation function
decays algebraically where the exponent is determined from the distribution of
alpha. The precise value for the exponent depends on exactly how the
``typical'' correlation function is defined. The form of P(alpha) for small
alpha gives a contribution to the average correlation function, which varies as
a power of the logarithm of time, which was obtained recently in Europhys.
Lett. 39, 135 (1997). These results represent a type of ``multiscaling''
different from the well-known ``multifractal'' behavior.
","[{""version"":""v1"",""created"":""Wed, 1 Jul 1998 21:52:19 GMT""}]","2009-10-31"
"cond-mat/9807026","Guillermo Cabrera","W. Tavera and G. G. Cabrera","Diamagnetic Effects, Spin Dependent Fermi Surfaces, and the Giant
  Magnetoresistance in Metallic Multilayers","11 pages, 3 figures, 17 references, submitted to Phys. Rev. Lett.,
  RevTex file",,,,"cond-mat.mtrl-sci",,"  We study the role of diamagnetic effects on the transport properties of
metallic magnetic multilayers to elucidate whether they can explain the Giant
Magnetoresistance (GMR) effect observed in those systems. Realistic Fermi
surface topologies in layered ferromagnets are taken into account, with the
possibilities of different types of orbits depending on the electron spin. Both
configurations, with ferromagnetic and anti-ferromagnetic couplings between
magnetic layers, are considered and the transmission coefficient for scattering
at the interface boundary is modelled to include magnetic and roughness
contributions. We assume that scattering processes conserve the electron spin,
due to large spin diffusion lengths in multilayer samples. Scattering from the
spacer mixes different orbit topologies in a way similar to magnetic
`breakdown' phenomena. For antiferromagnetic coupling, majority and minority
spins are interchanged from one magnetic layer to the next. Cyclotron orbits
are also traveled in opposite directions, producing a compensation-like effect
that yields a huge GMR, particularly for closed orbits. For open orbits, one
may get the `inverse' magnetoresistance effect along particular directions.
","[{""version"":""v1"",""created"":""Thu, 2 Jul 1998 02:59:18 GMT""}]","2007-05-23"
"cond-mat/9807027","C. T. Shih","C.T. Shih, Y.C. Chen, H.Q. Lin, and T.K. Lee","d-Wave Pairing Correlation in the Two-Dimensional t-J Model","4 pages, 6 figures, accepted by PRL",,"10.1103/PhysRevLett.81.1294","SC-01-98","cond-mat.supr-con cond-mat.str-el",,"  The pair-pair correlation function of the two-dimensional t-J model is
studied by using the power-Lanczos method and an assumption of monotonic
behavior. In comparison with the results of the ideal Fermi gas, we conclude
that the 2D t-J model does not have long range d-wave superconducting
correlation in the interesting parameter range of $J/t \leq 0.5$. Implications
of this result will also be discussed.
","[{""version"":""v1"",""created"":""Thu, 2 Jul 1998 07:04:23 GMT""}]","2009-10-31"
"cond-mat/9807029","Yoshifumi Morita","Y. Morita and Y. Hatsugai (Dept.of Applied Physics, Univ. of Tokyo)","Scaling near random criticality in two-dimensional Dirac fermions","RevTeX with 4 postscript figures, To appear in Physical Review B",,"10.1103/PhysRevB.58.6680",,"cond-mat.dis-nn",,"  Recently the existence of a random critical line in two dimensional Dirac
fermions is confirmed. In this paper, we focus on its scaling properties,
especially in the critical region. We treat Dirac fermions in two dimensions
with two types of randomness, a random site (RS) model and a random hopping
(RH) model. The RS model belongs to the usual orthogonal class and all states
are localized. For the RH model, there is an additional symmetry expressed by
${\{}{\cal H},{\gamma}{\}}=0$. Therefore, although all non-zero energy states
localize, the localization length diverges at the zero energy. In the weak
localization region, the generalized Ohm's law in fractional dimensions,
$d^{*}(<2)$, has been observed for the RH model.
","[{""version"":""v1"",""created"":""Thu, 2 Jul 1998 09:14:33 GMT""}]","2009-10-31"
"cond-mat/9807030","Jose A. Cuesta","Jose A. Cuesta","Demixing in a single-peak distributed polydisperse mixture of hard
  spheres","4 pages, 2 figures, needs revtex, multicol, epsfig and amstex style
  files","Europhys. Lett. 46, 197 (1999)","10.1209/epl/i1999-00244-6","MA/UC3M/11/1998","cond-mat.soft cond-mat.mtrl-sci cond-mat.stat-mech",,"  An analytic derivation of the spinodal of a polydisperse mixture is
presented. It holds for fluids whose excess free energy can be accurately
described by a function of a few moments of the size distribution. It is shown
that one such mixture of hard spheres in the Percus-Yevick approximation never
demixes, despite its size distribution. In the
Boublik-Mansoori-Carnahan-Starling-Leland approximation, though, it demixes for
a sufficiently wide log-normal size distribution. The importance of this result
is twofold: first, this distribution is unimodal, and yet it phase separates;
and second, log-normal size distributions appear in many experimental contexts.
The same phenomenon is shown to occur for the fluid of parallel hard cubes.
","[{""version"":""v1"",""created"":""Thu, 2 Jul 1998 11:29:42 GMT""}]","2009-10-31"
"cond-mat/9807031","D. S. Ray","S. K. Banik and D. S. Ray","Linear systems with adiabatic fluctuations","Plain Latex, no figure, 21 pages","J. Phys. A., vol. 31, 3937-3948 (1998)","10.1088/0305-4470/31/17/005",,"cond-mat.stat-mech",,"  We consider a dynamical system subjected to weak but adiabatically slow
fluctuations of external origin. Based on the ``adiabatic following''
approximation we carry out an expansion in \alpha/|\mu|, where \alpha is the
strength of fluctuations and 1/|\mu| refers to the time scale of evolution of
the unperturbed system to obtain a linear differential equation for the average
solution. The theory is applied to the problems of a damped harmonic oscillator
and diffusion in a turbulent fluid. The result is the realization of
`renormalized' diffusion constant or damping constant for the respective
problems. The applicability of the method has been critically analyzed.
","[{""version"":""v1"",""created"":""Thu, 2 Jul 1998 12:03:26 GMT""}]","2009-10-31"
"cond-mat/9807032","Eduardo Jagla","E. A. Jagla (Bariloche, Argentina)","Melting of Hard Cubes","5 pages, 3 figures included. To appear in Phys. Rev. E",,"10.1103/PhysRevE.58.4701",,"cond-mat.stat-mech",,"  The melting transition of a system of hard cubes is studied numerically both
in the case of freely rotating cubes and when there is a fixed orientation of
the particles (parallel cubes). It is shown that freelly rotating cubes melt
through a first-order transition, whereas parallel cubes have a continuous
transition in which positional order is lost but bond-orientational order
remains finite. This is interpreted in terms of a defect-mediated theory of
melting
","[{""version"":""v1"",""created"":""Thu, 2 Jul 1998 12:25:55 GMT""}]","2009-10-31"
