"astro-ph/9807007","Ludovic van Waerbeke","L. Van Waerbeke (1,2,3), F. Bernardeau (4), Y. Mellier (5,6) ((1) CITA
  Toronto, (2) MPA Garching, (3) OMP Toulouse, (4) SPhT Saclay (5) IAP Paris
  (6) Obs de Paris)","Efficiency of weak lensing surveys to probe cosmological models","22 pages, latex. Replaced by the accepted version, A&A in press","Astron.Astrophys. 342 (1999) 15-33",,"CITA-98-19","astro-ph",,"  We apply a mass reconstruction technique to simulated large-scale structure
gravitational distortion maps, from 2.5' to 10 degree scales, for different
cosmological scenarii. The projected mass is reconstructed using a
non-parametric least square method after noise due to the galaxy intrinsic
ellipticities has been added on. The shearing of the galaxies is performed
using the full lensing equation, without any hypothesis like the weak lensing
approximation, or other linearization. It is shown that, in the reconstructed
maps the noise acts as a perfect uncorrelated Poisson noise, with no
propagation at large scales. The measured power spectrum and first four moments
of the convergence can be corrected accurately for this source of noise. Using
60 realizations for each model, we show that a weak lensing survey of 5x5
degrees with a typical sheared background population of 30 gal/arcmin^2 at a
redshift z_s=1, is able to probe the amplitude of the power spectrum with a few
percents accuracy. Such a survey would lead to a 6 sigma separation between
open (Omega=0.3) and flat (Omega=1) model. This separation is shown to be
robust against different hypothesis for the normalization or the shape of the
power spectrum, and does not require very deep surveys. The observational
strategy for an optimal measurement of the power spectrum and the moments of
the convergence is discussed.
","[{""version"":""v1"",""created"":""Wed, 1 Jul 1998 16:14:49 GMT""},{""version"":""v2"",""created"":""Thu, 12 Nov 1998 14:20:14 GMT""}]","2007-05-23"
"astro-ph/9807008","Adam G. Riess","Alexei V. Filippenko and Adam G. Riess (Department of Astronomy,
  University of California at Berkeley)","Results from the High-Z Supernova Search Team","17 pages, latex, plus 2 figures, to appear in the Proceedings of the
  3rd International Symposium on Sources and Detection of Dark Matter in the
  Universe (DM98), Feb. 1998, ed. D. Cline","Phys.Rept. 307 (1998) 31-44","10.1016/S0370-1573(98)00052-0",,"astro-ph",,"  We review the use of Type Ia supernovae for cosmological distance
determinations. Low-redshift SNe Ia ($z \lesssim 0.1$) demonstrate that (a) the
Hubble expansion is linear, (b) $H_0 = 65 \pm 2$ (statistical) km s$^{-1}$
Mpc$^{-1}$, (c) the bulk motion of the Local Group is consistent with the COBE
result, and (d) the properties of dust in other galaxies are similar to those
of dust in the Milky Way. We find that the light curves of high-redshift SNe Ia
are stretched in a manner consistent with the expansion of space; similarly,
their spectra exhibit slower temporal evolution (by a factor of $1 + z$) than
those of nearby SNe Ia. The luminosity distances of our 16 high-redshift SNe Ia
are, on average, 10--15% farther than expected in a low mass-density
($\Omega_M=0.2$) universe without a cosmological constant. Our analysis
strongly supports eternally expanding models with positive cosmological
constant and a current acceleration of the expansion. We address many potential
sources of systematic error; at present, none of them reconciles the data with
$\Omega_\Lambda=0$ and $q_0 \geq 0$. The dynamical age of the Universe is
estimated to be $14.2 \pm 1.7$ Gyr, consistent with the ages of globular star
clusters.
","[{""version"":""v1"",""created"":""Wed, 1 Jul 1998 19:30:16 GMT""}]","2009-10-30"
"astro-ph/9807009","Bruce T. Draine","B. T. Draine and A. Lazarian","Magnetic Dipole Microwave Emission from Dust Grains","38 pages, 9 eps figures, uses aaspp4.sty package. Submitted to Ap. J",,"10.1086/306809","POPe-770","astro-ph",,"  Thermal fluctuations in the magnetization of interstellar grains will produce
magnetic dipole emission at frequencies below ~100 GHz. We show how to
calculate absorption and emission from small particles composed of magnetic
materials. The Kramers-Kronig relations for a dusty medium are generalized to
include the possibility of magnetic grains. The frequency-dependent magnetic
permeability is discussed for candidate grain materials, including iron and
magnetite.
  We calculate emission spectra for various interstellar grain candidates.
While paramagnetic grains or magnetite grains cannot account for the observed
""anomalous"" emission from dust in the 14-90 GHz range, stronger magnetic dipole
emission will result if a fraction of the grain material is ferromagnetic, as
could be the case given the high Fe content of interstellar dust. The observed
emission from dust near 90 GHz implies that not more than 5% of interstellar Fe
is in the form of metallic iron grains or inclusions (e.g., in ""GEMS"").
However, we show that if most interstellar Fe is in a moderately ferromagnetic
material, it could contribute a substantial fraction of the observed 14-90 GHz
emission, perhaps comparable to the contribution from spinning ultrasmall dust
grains. The two emission mechanisms can be distinguished by measuring the
emission from dark clouds. The expected polarization of magnetic dipole
emission is discussed
","[{""version"":""v1"",""created"":""Wed, 1 Jul 1998 19:30:49 GMT""}]","2009-10-30"
"astro-ph/9807010","Jerry Sellwood","J. A. Sellwood and E. M. Moore (Rutgers University)","On The Formation of Disk Galaxies and Massive Central Objects","38 pages, 6 figures, to appear in ApJ, LaTeX uses aasms4.sty","Astrophys.J. 510 (1999) 125-135","10.1086/306557","Rutgers astrophysics preprint #230","astro-ph",,"  We propose that massive central objects form in the centers of the bars which
must develop in young high-surface density galactic disks. Large-scale dynamics
shuts off the growth of the central mass before it reaches $\sim 2%$ of the
disk mass at the time, but this mass is sufficient to weaken the bar
substantially. Subsequent evolution of the galaxy can either complete the
destruction of the bar or cause it to recover, depending upon the angular
momentum distribution of later infalling material. We produce massive, fully
self-gravitating disks having roughly flat rotation curves which are quite
stable. If at least part of the central masses we require constitute the
engines of QSOs, then our picture naturally accounts for their redshift
dependence, since the fuel supply is shut off by the development of an inner
Lindblad resonance. A prediction is that massive objects should not be found in
halo dominated galaxies, such as low-luminosity, or low-surface brightness
galaxies.
","[{""version"":""v1"",""created"":""Wed, 1 Jul 1998 19:49:37 GMT""}]","2009-10-30"
"astro-ph/9807011","Dale Frail","Dale A. Frail and George F. Mitchell","OH(1720 MHz) Masers As Signposts of Molecular Shocks","ApJ (in press)",,"10.1086/306452",,"astro-ph",,"  We present observations of molecular gas made with the 15-m James Clark
Maxwell Telescope toward the sites of OH(1720 MHz) masers in three supernova
remnants: W28, W44 and 3C391. Maps made in the 12CO J=3-2 line reveal that the
OH masers are preferentially located along the edges of thin filaments or
clumps of molecular gas. There is a strong correlation between the morphology
of the molecular gas and the relativistic gas traced by synchrotron emission at
centimeter wavelengths. Broad CO line widths (dV=30-50 km/s) are seen along
these gaseous ridges, while narrow lines are seen off the ridges. The ratio of
H2CO line strengths is used to determine temperatures in the broad-line gas of
80 K, and the 13CO J=3-2 column density suggests densities of 10^4-10^5 cm{-3}.
These observations support the hypothesis that the OH(1720 MHz) masers
originate in post-shock gas, heated by the passage of a supernova remnant shock
through dense molecular gas. From the observational constraints on the density,
velocity and magnetic field we examine the physical properties of the shock and
discuss the shock-production of OH. These OH(1720 MHz) masers are useful
``signposts'', which point to the most promising locations to study supernova
remnant/molecular cloud interactions.
","[{""version"":""v1"",""created"":""Wed, 1 Jul 1998 20:32:07 GMT""}]","2009-10-30"
"astro-ph/9807012","Lars Bildsten","Lars Bildsten and Andrew Cumming (University of California, Berkeley)","Hydrogen Electron Capture in Accreting Neutron Stars and the Resulting
  g-Mode Oscillation Spectrum","46 pages, LaTex, 20 figures, to Appear in The Astrophysical Journal,
  October 20, 1998",,"10.1086/306279",,"astro-ph",,"  We investigate hydrogen electron capture in the oceans of neutron stars
accreting at rates appropriate for most Low-Mass X-Ray Binaries. These stars
burn the accreted hydrogen and helium unstably in the upper atmosphere and
accumulate material which usually contains some small amount of hydrogen (mass
fractions are typically 10%) mixed in with the heavier iron group ashes. The
subsequent evolution of this matter is determined by compression towards higher
densities until electron capture on the hydrogen occurs. We construct
steady-state models of the electron captures and the subsequent neutron
recombinations onto the heavy nuclei. The density discontinuity from these
captures gives rise to a new g-mode (much like a surface wave), which has a
lowest order (l=1) frequency of 35 Hz when X=0.1 on a slowly rotating star. We
also discuss, for the first time, a new set of non-radial g-modes unique to
these neutron stars. These modes have most of their nodes in the finite
thickness layer where the electron captures are occurring. The lowest order
mode frequencies are in the 1-10 Hz range for a few radial nodes on a slowly
rotating star. We conclude by discussing how the dispersion relations for these
modes are modified for a rapidly rotating neutron star. Whether any of these
modes are observable depends on their excitation and damping mechanisms and the
ability to excite them, issues we will address in a future paper.
","[{""version"":""v1"",""created"":""Wed, 1 Jul 1998 20:46:53 GMT""}]","2009-10-30"
"astro-ph/9807013","Uyaniker Buelent","B. Uyaniker, E. Fuerst, W. Reich, P. Reich, R. Wielebinski
  (Max-Planck-Institut fuer Radioastronomie, Bonn-Germany)","A 1.4 GHz radio continuum and polarization survey at medium Galactic
  latitudes: I. Observation and reduction technique","12 pages, 9 figures, Accepted for publication in Astronomy and
  Astrophysics Supp. Ser",,"10.1051/aas:1998449","Max-Planck-Institut fuer Radioastronomie preprint Nr. 3090","astro-ph",,"  A radio continuum survey at medium Galactic latitudes with the Effelsberg
100-m telescope is being carried out at a centre frequency of 1.4 GHz in total
power and linear polarization. Areas up to +/- 20 degree of Galactic latitude
are now being observed at a sensitivity of 15 mK TB total intensity and 8 mK TB
in linear polarization with an angular resolution of 9'35. This paper describes
the observing and reduction technique applied which results in absolutely
calibrated maps. The methods are illustrated by examples of images from the
survey.
","[{""version"":""v1"",""created"":""Thu, 2 Jul 1998 00:09:17 GMT""}]","2009-10-30"
"astro-ph/9807014","Nagataki Shigehiro","S. Nagataki, M. Hashimoto, and S. Yamada","Initial Shock Waves for Explosive Nucleosynthesis in Type II Supernova","20 pages, 6 figures, LaTex","Publ.Astron.Soc.Jap. 50 (1998) 67","10.1093/pasj/50.1.67","UTAP-260/97","astro-ph",,"  We have performed 1-dimensional calculations for explosive nucleosynthesis in
collapse-driven supernova and investigated its sensitivity to the initial form
of the shock wave. We have found the tendency that the peak temperature becomes
higher around the mass cut if the input energy is injected more in the form of
kinetic energy rather than internal energy. Then, the mass cut becomes larger,
and, as a result, neutron-rich matter is less included in the ejecta; this is
favorable for producing the observational data compared with a previous model.
Our results imply that the standard method to treat various processes for
stellar evolution, such as convection and electron capture during the silicon
burning stage, are still compatible with the calculation of explosive
nucleosynthesis.
","[{""version"":""v1"",""created"":""Thu, 2 Jul 1998 06:02:09 GMT""}]","2015-06-24"
"astro-ph/9807015","Nagataki Shigehiro","S. Nagataki, M. Hashimoto, K. Sato, S. Yamada, and Y. S. Mochizuki","High Ratio of 44Ti/56Ni in Cas A and Axisymmetric Collapse-Driven
  Supernova Explosion","10 pages, LaTeX text and 3 postscript figures","Astrophys.J. 492 (1998) L45","10.1086/311089","UTAP-261/97","astro-ph",,"  The large abundance ratio of $^{44}Ti/^{56}Ni$ in Cas A is puzzling. In fact,
the ratio seems to be larger than the theoretical constraint derived by Woosley
& Hoffman (1991). However, this constraint is obtained on the assumption that
the explosion is spherically symmetric, whereas Cas A is famous for the
asymmetric form of the remnant. Recently, Nagataki et al. (1997) calculated the
explosive nucleosynthesis of axisymmetrically deformed collapse-driven
supernova. They reported that the ratio of $^{44}Ti/^{56}Ni$ was enhanced by
the stronger alpha-rich freezeout in the polar region. In this paper, we apply
these results to Cas A and examine whether this effect can explain the large
amount of $^{44}Ti$ and the large ratio of $^{44}Ti/^{56}Ni$. We demonstrate
that the conventional spherically symmetric explosion model can not explain the
$^{44}$Ti mass produced in Cas A if its lifetime is shorter than $\sim$ 80
years and the intervening space is transparent to the gamma-ray line from the
decay of $^{44}$Ti. On the other hand, we show the axisymmetric explosion
models can solve the problem. We expect the same effect from a three
dimensionally asymmetric explosion, since the stronger alpha-rich freezeout
will also occur in that case in the region where the larger energy is
deposited.
","[{""version"":""v1"",""created"":""Thu, 2 Jul 1998 07:48:56 GMT""}]","2009-10-30"
"astro-ph/9807016","Nagataki Shigehiro","S. Nagataki, M. Hashimoto, and K. Sato","Dispersion of Inferred SNe Ia/SNe II Ratios for Current Models of
  Supernova Nucleosynthesis","15 pages, including LaTeX text and 3 postscript figures","Publ.Astron.Soc.Jap. 50 (1998) 75","10.1093/pasj/50.1.75","UTAP-269/97","astro-ph",,"  We have estimated the dispersion of the inferred relative frequencies of
Type-Ia and Type- II supernovae ($N_{Ia}/ N_{II}$) in our Galaxy by fitting the
numerical results of supernova nucleosynthesis to the solar-system abundances.
The ratio $N_{Ia}/ N_{II}$ is estimated to be 0.056--0.14, which is consistent
with the observation, if the model of Woosley and Weaver (1995, WW95) is
adopted for Type-II supernovae (SNe II). On the other hand, the upper limit of
$N_{Ia}/ N_{II}$ becomes too large for the model of Hashimoto (1995, Ha95).
However, Ha95 can fit the solar values better than WW95 as far as the abundant
nuclei are concerned. These results mean that Ha95 can reproduce the main
nuclei of the solar-system well and that WW95 can reproduce the solar values
over a wide mass-number range. We also note that $N_{Ia}/ N_{II}$ tends to
become smaller if the delayed detonation model is adopted for Type-Ia
supernovae (SNe Ia). The dispersion of $N_{Ia}/ N_{II}$ obtained in the present
investigation is larger than that concluded by Tsujimoto et al. (1995), which
will have an influence on the estimate of the average life time of SNe Ia's
progenitors and/or the star-formation rate history in our galaxy.
","[{""version"":""v1"",""created"":""Thu, 2 Jul 1998 08:00:06 GMT""}]","2015-06-24"
"astro-ph/9807017","Arkadiusz Olech","Arkadiusz Olech, Marcin Gajos and Michal Jurek (Warsaw University
  Observatory)","Alpha Cygnids - a possible July minor meteor shower","accepted for publication in Astronomy and Astrophysics, Supplement
  Series, 8 pages with 4 figures",,"10.1051/aas:1999176",,"astro-ph",,"  We present a comprehensive study of a possible $\alpha$-Cygnid meteor shower.
Based on visual and telescopic observations made by Polish observers we
estimate basic parameters of the stream. Activity of $\alpha$-Cygnids lasts
from around June 30 to July 31 with clear maximum near July 18 (solar longitude
$\lambda_\odot=116.5^\circ$). Maximal Zenithal Hourly Rates (ZHRs) are equal to
$3.6\pm1.2$. The structure of the radiant analyzed by {\sc radiant} software is
most compact for geocentric velocity of the events equal to 41 km/s, and for
the drift of the radiant (in units $^\circ$/day) equal to $\Delta\alpha=+0.6$
$\Delta\delta=+0.2$. Center of the radiant for the moment of maximum is
$\alpha=302.5^\circ$ $\delta=+46.3^\circ$.We derive population index $r$ equal
to $2.55\pm0.14$ from magnitude distribution of 738 possible members of the
stream. Comparing the velocity distributions of 754 possible $\alpha$-Cygnids
and 4339 sporadic events by $\chi^2$ and Kolmogorov-Smirnov tests we conclude
that both distributions are different with probability very close to 1.0.
Telescopic observations strictly confirm the results obtained from visual
observations. The smallest values of $\chi^2$ parameter we obtained for the
geocentric velocity equal to 40 km/s and for the drift of the radiant (in units
$^\circ$/day) equal to $\Delta\alpha=+0.6$ $\Delta\delta=+0.2$. The center of
the radiant for moment of maximum is $\alpha=304.9^\circ$ $\delta=+46.2^\circ$.
  In spite of making many photographic exposures we still have no photographic
or video confirmation of the existence of this stream.
","[{""version"":""v1"",""created"":""Thu, 2 Jul 1998 08:19:06 GMT""},{""version"":""v2"",""created"":""Fri, 18 Dec 1998 10:04:17 GMT""}]","2016-08-30"
"astro-ph/9807018","Kunihito Ioka","Kunihito Ioka, Takeshi Chiba, Takahiro Tanaka, and Takashi Nakamura","Black Hole Binary Formation in the Expanding Universe --- Three Body
  Problem Approximation ---","Revtex, 25 pages, 10 figures, to appear in PRD","Phys.Rev. D58 (1998) 063003","10.1103/PhysRevD.58.063003","KUNS-1493","astro-ph gr-qc",,"  We study black hole MACHO binary formation through three-body interactions in
the early universe at $t\sim 10^{-5}$s. The probability distribution functions
of the eccentricity and the semimajor axis of binaries as well as of the
coalescence time are obtained assuming that the black holes are randomly formed
in space. We confirm that the previous order-of-magnitude estimate for the
binary parameters is valid within $\sim 50%$ error. We find that the
coalescence rate of the black hole MACHO binaries is $\sim 5 \times 10^{-2}
\times 2^{\pm 1}$ events/year/galaxy taking into consideration several possible
factors which may affect this estimate. This suggests that the event rate of
coalescing binary black holes will be at least several events per year within
15 Mpc. The first LIGO/VIRGO interferometers in 2001 will be able to verify
whether the MACHOs are black holes or not.
","[{""version"":""v1"",""created"":""Thu, 2 Jul 1998 08:28:10 GMT""}]","2009-10-30"
"astro-ph/9807019","Lesgourgues","J. Lesgourgues (Tours), D. Polarski (Tours, Meudon) and A. A.
  Starobinsky (Landau I.)","Large primordial gravitational wave background in a class of BSI
  Lambda-CDM models","Final (revised and shortened) version to appear in MNRAS. Title
  changed, conclusion unchanged. 9 pages, 2 color ps figures, uses mn.sty","Mon.Not.Roy.Astron.Soc. 308 (1999) 281-288","10.1046/j.1365-8711.1999.02709.x",,"astro-ph gr-qc hep-th",,"  We consider the primordial gravitational wave (GW) background in a class of
spatially-flat inflationary cosmological models with cold dark matter (CDM), a
cosmological constant, and a broken-scale-invariant (BSI) steplike primordial
(initial) spectrum of adiabatic perturbations produced in an exactly solvable
inflationary model where the inflaton potential has a rapid change of its first
derivative at some point. In contrast to inflationary models with a scale-free
initial spectrum, these models may have a GW power spectrum whose amplitude
(though not its shape) is arbitrary for fixed amplitude and shape of the
adiabatic perturbations power spectrum. In the presence of a positive
cosmological constant, the models investigated here possess the striking
property that a significant part of the large-angle CMB temperature anisotropy
observed in the COBE experiment is due to primordial GW. Confronting them with
existing observational data on CMB angular temperature fluctuations, galaxy
clustering and peculiar velocities of galaxies, we find that for the best
parameter values Omega_Lambda=0.7 and h=0.7, the GW contribution to the CMB
anisotropy can be as large as that of the scalar fluctuations.
","[{""version"":""v1"",""created"":""Thu, 2 Jul 1998 09:26:14 GMT""},{""version"":""v2"",""created"":""Mon, 5 Apr 1999 09:25:00 GMT""}]","2009-10-30"
"astro-ph/9807020","Lesgourgues","J. Lesgourgues (Tours), S. Prunet (IAS) and D. Polarski (Tours,
  Meudon)","Parameter extraction by Planck for a CDM model with broken scale
  invariance and cosmological constant","Final version to appear in MNRAS. Minor changes. 5 pages, 1 LaTeX
  figure, uses mn.sty","Mon.Not.Roy.Astron.Soc. 303 (1999) 45-49","10.1046/j.1365-8711.1999.02186.x",,"astro-ph gr-qc hep-th",,"  We consider a class of spatially flat cold dark matter (CDM) models, with a
cosmological constant and a broken-scale-invariant (BSI) steplike primordial
spectrum of adiabatic perturbations, previously found to be in very good
agreement with observations. Performing a Fisher matrix analysis, we show that
in case of a large gravitational waves (GW) contribution some free parameters
(defining the step) of our BSI model can be extracted with remarkable accuracy
by the Planck satellite, thanks to the polarisation anisotropy measurements.
Further, cosmological parameters can still be found with very good precision,
despite a larger number of free parameters than in the simplest inflationary
models.
","[{""version"":""v1"",""created"":""Thu, 2 Jul 1998 09:42:39 GMT""},{""version"":""v2"",""created"":""Mon, 5 Apr 1999 11:16:31 GMT""}]","2009-10-30"
"astro-ph/9807021","Wolfgang Steffen","W. Steffen and A. Lopez","Jets and the shaping of the giant bipolar envelope of the planetary
  nebula KjPn 8","20 pages + 8 figures (in 1 tar-file 0.67 Mb)",,"10.1086/306441",,"astro-ph",,"  A hydrodynamic model involving cooling gas in the stagnation region of a
collimated outflow is proposed for the formation of the giant parsec-scale
bipolar envelope that surrounds the planetary nebula KjPn 8. Analytical
calculations and numerical simulations are presented to evaluate the model. The
envelope is considered to consist mainly of environmental gas swept-up by
shocks driven by an episodic, collimated, bipolar outflow. In this model, which
we call the ``free stagnation knot'' mechanism, the swept-up ambient gas
located in the stagnation region of the bow-shock cools to produce a high
density knot. This knot moves along with the bow-shock. When the central
outflow ceases, pressurization of the interior of the envelope stops and its
expansion slows down. The stagnation knot, however, has sufficient momentum to
propagate freely further along the axis, producing a distinct nose at the end
of the lobe. The model is found to successfully reproduce the peculiar shape
and global kinematics of the giant bipolar envelope of KjPn 8.
","[{""version"":""v1"",""created"":""Thu, 2 Jul 1998 09:49:52 GMT""}]","2009-10-30"
"astro-ph/9807022","Nagataki Shigehiro","S. Nagataki and K. Sato","Contribution of Type Ia and Type II Supernovae for Intra-Cluster Medium
  Enrichment","20 pages, LaTeX text and 15 postscript figures. Accepted for
  publication in Astrophysical Journal",,"10.1086/306097","UTAP-273/97","astro-ph",,"  The origin of the chemical composition of the intracluster medium (ICM) is
discussed in this paper. In particular, the contribution from Type Ia
supernovae (SNe Ia) to the ICM enrichment is shown to exist by adopting the
fitting formulas which have been used in the analysis of the solar system
abundances. Our analysis means that we can use the frequency of SNe Ia relative
to SNe II as the better measure than $M_{Fe, SN Ia}/M_{Fe, total}$ for
estimating the contribution of SNe Ia. Moreover, the chemical compositions of
ICMs are shown to be similar to that of the solar system abundances. We can
also reproduce the sulfur/iron abundance ratio within a factor of 2, which
means that the abundance problem of sulfur needs not to be emphasized too
strongly. We need more precise observations to conclude whether ICMs really
suffer the shortage problem of sulfur or not.
","[{""version"":""v1"",""created"":""Thu, 2 Jul 1998 09:51:04 GMT""}]","2009-10-30"
"astro-ph/9807023","R. H. Sanders","R.H. Sanders (Kapteyn Astronomical Institute, Groningen, NL)","Resolving the virial discrepancy in clusters of galaxies with modified
  Newtonian dynamics","Submitted to A&A, 4 pages, 3 figures, A&A macros",,"10.1086/311865",,"astro-ph",,"  A sample of 197 X-ray emitting clusters of galaxies is considered in the
context of Milgrom's modified Newtonian dynamics (MOND). It is shown that the
gas mass, extrapolated via an assumed $\beta$ model to a fixed radius of 3 Mpc,
is correlated with the gas temperature as predicted by MOND ($M_g \propto
T^2$). The observed temperatures are generally consistent with the inferred
mass of hot gas; no substantial quantity of additional unseen matter is
required in the context of MOND. However, modified dynamics cannot resolve the
strong lensing discrepancy in those clusters where this phenomenon occurs. The
prediction is that additional baryonic matter may be detected in the central
regions of rich clusters.
","[{""version"":""v1"",""created"":""Thu, 2 Jul 1998 10:05:04 GMT""}]","2009-10-30"
