"hep-th/9807008","Bjoern Andreas","B. Andreas, G. Curio and D. Lust","The Neveu-Schwarz Five-Brane and its Dual Geometries","18pp, added references","JHEP 9810:022,1998","10.1088/1126-6708/1998/10/022",,"hep-th",,"  In this paper we discuss two aspects of duality transformations on the
Neveu-Schwarz (NS) 5-brane solutions in type II and heterotic string theories.
First we demonstrate that the non-extremal NS 5-brane background is U-dual to
its CGHS limit, a two-dimensional black hole times $S^3\times T^5$; an
intermediate step is provided by the near horizon geometry which is given by
the three-dimensional $BTZ_3$ black hole (being closely related to $AdS_3$)
times $S^3\times T^4$. In the second part of the paper we discuss the T-duality
between $k$ NS 5-branes and the Taub-NUT spaces respectively ALE spaces, which
are related to the resolution of the $A_{k-1}$ singularities of the non-compact
orbifold ${\bf C}^2/{\bf Z}_{k}$. In particular in the framework of N=1
supersymmetric gauge theories related to brane box constructions we give the
metric dual to two sets of intersecting NS 5-branes. In this way we get a
picture of a dual orbifold background ${\bf C}^3/ \Gamma$ which is fibered
together out of two N=2 models ($\Gamma={\bf Z}_k\times {\bf Z}_{k'}$). Finally
we also discuss the intersection of NS 5-branes with D branes, which can serve
as probes of the dual background spaces.
","[{""version"":""v1"",""created"":""Wed, 1 Jul 1998 16:33:38 GMT""},{""version"":""v2"",""created"":""Tue, 21 Jul 1998 14:42:15 GMT""}]","2009-10-31"
"hep-th/9807009","Herrera Aguilar Alfredo","Alfredo Herrera-Aguilar and Oleg Kechkin","IWP Solutions for Heterotic String in Five Dimensions","8 pages in LaTex. We have corrected some signs and two Eqs. of
  formula (29)","Mod.Phys.Lett.A13:1979-1986,1998","10.1142/S0217732398002084",,"hep-th",,"  We obtain extremal stationary solutions that generalize the
Israel-Wilson-Perj\'es class for the low-energy limit of heterotic string
theory with n>=3 U(1) gauge fields toroidally compactified from five to three
dimensions. A dyonic solution is obtained using the matrix Ernst potential
(MEP) formulation and expressed in terms of a single real 3X3-matrix harmonic
function. By studying the asymptotic behaviour of the field configurations we
define the physical charges of the field system. The extremality condition
makes the charges to saturate the Bogomol'nyi-Prasad-Sommerfield (BPS) bound.
","[{""version"":""v1"",""created"":""Wed, 1 Jul 1998 19:25:03 GMT""},{""version"":""v2"",""created"":""Tue, 28 Jul 1998 13:12:11 GMT""}]","2010-11-19"
"hep-th/9807010","Mario Rocca","C. G. Bollini, M. C. Rocca","The Wheeler Propagator","20 pages latex. No figures","Int.J.Theor.Phys. 37 (1998) 2877-2893",,,"hep-th",,"  We study the half advanced and half retarded Wheeler Green function and its
relation to Feynman propagators. First for massless equation. Then, for
Klein-Gordon equations with arbitrary mass parameters; real, imaginary or
complex. In all cases the Wheeler propagator lacks an on-shell free
propagation. The Wheeler function has support inside the light-cone (whatever
the mass). The associated vacuum is symmetric with respect to annihilation and
creation operators.
  We show with some examples that perturbative unitarity holds, whatever the
mass (real or complex). Some possible applications are discussed.
","[{""version"":""v1"",""created"":""Wed, 1 Jul 1998 20:37:11 GMT""}]","2007-05-23"
"hep-th/9807012","Marek Rogatko","Marek Rogatko","Extrema of Mass, First Law of Black Hole Mechanics and Staticity Theorem
  in Einstein-Maxwell-axion-dilaton Gravity","17 pages, Revtex, a few comments (introduction) and references added","Phys.Rev. D58 (1998) 044011","10.1103/PhysRevD.58.044011","Pl/2/98","hep-th gr-qc",,"  Using the ADM formulation of the Einstein-Maxwell axion-dilaton gravity we
derived the formulas for the variation of mass and other asymptotic conserved
quantities in the theory under consideration. Generalizing this kind of
reasoning to the initial dota for the manifold with an interior boundary we got
the generalized first law of black hole mechanics. We consider an
asymptotically flat solution to the Einstein-Maxwell axion-dilaton gravity
describing a black hole with a Killing vector field timelike at infinity, the
horizon of which comprises a bifurcate Killing horizon with a bifurcate
surface. Supposing that the Killing vector field is asymptotically orthogonal
to the static hypersurface with boundary S and compact interior, we find that
the solution is static in the exterior world, when the timelike vector field is
normal to the horizon and has vanishing electric and axion- electric fields on
static slices.
","[{""version"":""v1"",""created"":""Thu, 2 Jul 1998 07:01:07 GMT""},{""version"":""v2"",""created"":""Thu, 9 Jul 1998 08:51:21 GMT""}]","2009-10-31"
"hep-th/9807013","Kazuo Gouroku","Kazuo Ghoroku","Interactions of two D-branes and String--D-brane with Quantum Correction","26 pages, Latex, including 8 eps figures. This paper has been
  withdrawn by the author due to a misunderstanding",,,"FIT-HE-98-09","hep-th",,"  This paper has been withdrawn by the author due to a misunderstanding.
","[{""version"":""v1"",""created"":""Thu, 2 Jul 1998 07:07:57 GMT""},{""version"":""v2"",""created"":""Sat, 3 Jun 2000 06:13:34 GMT""}]","2007-05-23"
"hep-th/9807014","Thomas Mohaupt","Ingo Gaida, Swapna Mahapatra, Thomas Mohaupt and Wafic A. Sabra","Black Holes and Flop Transitions in M-Theory on Calabi-Yau Threefolds","19 pp, LaTeX","Class.Quant.Grav. 16 (1999) 419-433","10.1088/0264-9381/16/2/008","DAMTP-98-76, IC/98/66, QMW-PH-98-29","hep-th",,"  We present fivedimensional extreme black hole solutions of M-theory
compactified on Calabi-Yau threefolds and study these solutions in the context
of flop transitions in the extended Kahler cone. In particular we consider a
specific model and present black hole solutions, breaking half of N=2
supersymmetry, in two regions of the extended Kahler cone, which are connected
by a flop transition. The conditions necessary to match both solutions at the
flop transition are analysed. Finally we also discuss the conditions to obtain
massless black holes at the flop transition.
","[{""version"":""v1"",""created"":""Thu, 2 Jul 1998 10:12:01 GMT""}]","2009-10-31"
"hep-th/9807015","Vadim Zeitlin","I.V.Tyutin and Vadim Zeitlin (Lebedev Phys. Inst.)","Curing Fermion Mass Gauge Variance in QED$_{2+1}$","6 pages, to appear in Phys. Lett. B","Phys.Lett. B430 (1998) 326-331","10.1016/S0370-2693(98)00523-1","FIAN/TD/97-28","hep-th hep-ph",,"  The problem of the gauge dependence of the fermion mass in the
Maxwell-Chern-Simons QED$_{2+1}$ is revisited. Using Proca mass term as an
intermediate infrared regulator we are demonstrating gauge-invariance of the
fermion mass shell in QED$_{2+1}$ in all orders of the perturbation theory.
","[{""version"":""v1"",""created"":""Thu, 2 Jul 1998 10:24:28 GMT""}]","2009-10-31"
"hep-th/9807016","Bernard Knaepen","J. Antonio Garcia and Bernard Knaepen","Couplings between generalized gauge fields","13 pages, Latex, requires multibox.sty","Phys.Lett. B441 (1998) 198-204","10.1016/S0370-2693(98)01199-X","ULB-TH-98/13","hep-th",,"  We analyze the BRST field-antifield construction for generalized gauge fields
consisting of massless mixed representations of the Lorentz Group and we
calculate all the strictly gauge invariant interactions between them. All these
interactions are higher derivative terms constructed out from the derivatives
of the curl of field strength.
","[{""version"":""v1"",""created"":""Thu, 2 Jul 1998 13:23:32 GMT""}]","2009-10-31"
"hep-th/9807018","Esposito Giampiero","Giampiero Esposito","Scattering from Singular Potentials in Quantum Mechanics","19 pages, plain Tex. In this revised version, the analysis of Eq.
  (5.29) has been amended, and an appendix has been added for completeness","J.Phys.A31:9493-9504,1998","10.1088/0305-4470/31/47/010","DSF preprint 98/22","hep-th",,"  In non-relativistic quantum mechanics, singular potentials in problems with
spherical symmetry lead to a Schrodinger equation for stationary states with
non-Fuchsian singularities both as r tends to zero and as r tends to infinity.
In the sixties, an analytic approach was developed for the investigation of
scattering from such potentials, with emphasis on the polydromy of the wave
function in the r variable. The present paper extends those early results to an
arbitrary number of spatial dimensions. The Hill-type equation which leads, in
principle, to the evaluation of the polydromy parameter, is obtained from the
Hill equation for a two-dimensional problem by means of a simple change of
variables. The asymptotic forms of the wave function as r tends to zero and as
r tends to infinity are also derived. The Darboux technique of intertwining
operators is then applied to obtain an algorithm that makes it possible to
solve the Schrodinger equation with a singular potential containing many
negative powers of r, if the exact solution with even just one term is already
known.
","[{""version"":""v1"",""created"":""Thu, 2 Jul 1998 15:49:31 GMT""},{""version"":""v2"",""created"":""Wed, 30 Sep 1998 17:24:38 GMT""}]","2008-11-26"
"math-ph/9807001","Jorge Berger","J. E. Avron and J. Berger","Quantum Transport in Molecular Rings and Chains","Final version. 26 pages, 8 figs",,"10.1098/rspa.1999.0424",,"math-ph math.MP",,"  We study charge transport driven by deformations in molecular rings and
chains. Level crossings and the associated Longuet-Higgins phase play a central
role in this theory. In molecular rings a vanishing cycle of shears pinching a
gap closure leads, generically, to diverging charge transport around the ring.
We call such behavior homeopathic. In an infinite chain such a cycle leads to
integral charge transport which is independent of the strength of deformation.
In the Jahn-Teller model of a planar molecular ring there is a distinguished
cycle in the space of uniform shears which keeps the molecule in its manifold
of ground states and pinches level crossing. The charge transport in this cycle
gives information on the derivative of the hopping amplitudes.
","[{""version"":""v1"",""created"":""Thu, 2 Jul 1998 06:17:55 GMT""},{""version"":""v2"",""created"":""Wed, 20 Jan 1999 10:17:43 GMT""}]","2009-10-31"
"math/9807001","Yair Minsky","Yair N. Minsky","The classification of punctured-torus groups","67 pages, published version","Ann. of Math. (2) 149 (1999), no. 2, 559-626",,"Stony Brook IMS 1997/6; Dynamical Systems 5/15/97; Annals migration
  4-2001","math.GT math.DS",,"  Thurston's ending lamination conjecture proposes that a finitely generated
Kleinian group is uniquely determined (up to isometry) by the topology of its
quotient and a list of invariants that describe the asymptotic geometry of its
ends. We present a proof of this conjecture for punctured-torus groups. These
are free two-generator Kleinian groups with parabolic commutator, which should
be thought of as representations of the fundamental group of a punctured torus.
  As a consequence we verify the conjectural topological description of the
deformation space of punctured-torus groups (including Bers' conjecture that
the quasi-Fuchsian groups are dense in this space) and prove a rigidity
theorem: two punctured-torus groups are quasi-conformally conjugate if and only
if they are topologically conjugate.
","[{""version"":""v1"",""created"":""Wed, 1 Jul 1998 17:52:16 GMT""},{""version"":""v2"",""created"":""Tue, 11 Aug 1998 15:47:20 GMT""},{""version"":""v3"",""created"":""Mon, 1 Mar 1999 00:00:00 GMT""}]","2007-05-23"
"math/9807002","Takeshi Kawachi","Takeshi Kawachi","Effective base point freeness on normal surfaces","AmS-TeX 2.1 with 4 PostScript figures, 14pages",,,,"math.AG",,"  We give the new effective criterion for the global generation of the adjoint
bundle on normal surfaces with a boundary. We could make the invariant \delta
small a bit more on log-terminal singular point, and then we could prove the
theorem described in my previous paper ""alg-geom/9612018"" as a corollary.
","[{""version"":""v1"",""created"":""Thu, 2 Jul 1998 05:12:35 GMT""}]","2007-05-23"
"math/9807003","Gigel Militaru","Gigel Militaru","The Hopf modules category and the Hopf equation","30 pages, Letax2e, Comm. Algebra in press","Comm. in Algebra, 26(1998), 3071-3097","10.1080/00927879808826329",,"math.QA math.RA",,"  We study the Hopf equation which is equivalent to the pentagonal equation,
from operator algebras. A FRT type theorem is given and new types of quantum
groups are constructed. The key role is played now by the classical Hopf
modules category. As an application, a five dimensional noncommutative
noncocommutative bialgebra is given.
","[{""version"":""v1"",""created"":""Thu, 2 Jul 1998 10:40:42 GMT""}]","2014-03-18"
"math/9807004","Gigel Militaru","Gigel Militaru","New types of bialgebras arising from the Hopf equation","Latex2e, Comm Algebra, in press","Comm. in Algebra, 26(1998), 3099-3117","10.1080/00927879808826330",,"math.QA math.RA",,"  New types of bialgebras arising from the Hopf equation (pentagonal equation)
are introduced and studied. They will play from the Hopf equation the same role
as the co-quasitriangular do from the quantum Yang Baxter equation.
","[{""version"":""v1"",""created"":""Thu, 2 Jul 1998 10:51:37 GMT""}]","2014-03-18"
"math/9807005",,"P.Kosi\'nski, P.Ma\'slanka","The contraction of $SU_\mu(2)$ and its differential structures to
  $E_\kappa(2)$","30 pages Latex file",,,,"math.QA",,"  The deformed double covering of E(2) group, denoted by $\tilde{E}_\kappa(2)$,
is obtained by contraction from the $SU_\mu(2)$. The contraction procedure is
then used for producing a new examples of differential calculi: 3D-left
covariant calculus on both $\tilde{E}_\kappa(2)$ and the deformed Euclidean
group $E_\kappa(2)$ and two different 4D-bicovariant calculi on
$\tilde{E}_\kappa(2)$ which correspond to the one 4D-bicovariant calculi on
$E_\kappa(2)$ described in Ref.\cite{b14}.
","[{""version"":""v1"",""created"":""Thu, 2 Jul 1998 13:02:37 GMT""}]","2007-05-23"
"math/9807006","Rita Pardini","M. Mendes Lopes, R. Pardini","Triple canonical surfaces of minimal degree","LaTeX 2.09, 38 pages",,,,"math.AG",,"  We classify completely the surfaces of general type whose canonical map is
3-to-1 onto a surface of minimal degree in projective space. These surfaces
fall into 5 distinct classes and we give explicit examples belonging to each of
these classes. As far as we know, one of the examples thus constructed was
unknown and it is a surface whose canonical system has two infinitely near base
points.
","[{""version"":""v1"",""created"":""Thu, 2 Jul 1998 14:38:33 GMT""}]","2007-05-23"
"math/9807007","Dan Burghelea","Dan Burghelea (Ohio-State University, Columbus, OH)","Removing Metric Anomalies from Ray Singer Torsion","10 pages, AMSTEX,typos corrected, thanks added",,,,"math.DG",,"  Ray Singer torsion is a numerical invariant associated with a compact
Riemannian manifold equipped with a flat bundle and a Hermitian structure on
this bundle. In this note we show how one can remove the dependence on the
Riemannian metric and on the Hermitian structure with the help of a base point
and of an Euler structure, in order to obtain a topological invariant. A
numerical invariant for an Euler structure and additional data is also
constructed.
","[{""version"":""v1"",""created"":""Thu, 2 Jul 1998 15:22:47 GMT""},{""version"":""v2"",""created"":""Wed, 29 Jul 1998 10:16:46 GMT""}]","2007-05-23"
"math/9807008","Dan Burghelea","Dan Burghelea (Ohio-Staye University, Columbus, OH)","Lectures on Witten Helffer Sj\""ostrand Theory","17 pages, AMStex, minor grammar corrections",,,,"math.DG",,"  Witten- Helffer-Sj\""ostrand theory is a considerable addition to the De Rham-
Hodge theory for Riemannian manifolds and can serve as a general tool to prove
results about comparison of numerical invariants associated to compact
manifolds analytically, i.e. by using a Riemannian metric, or combinatorially,
i.e by using a triangulation. In this presentation a triangulation, or a
partition of a smooth manifold in cells, will be viewed in a more analytic
spirit, being provided by the stable manifolds of the gradient of a nice Morse
function. WHS theory was recently used both for providing new proofs for known
but difficult results in topology, as well as new results and a positive
solution for an important conjecture about $L_2-$torsion, cf [BFKM]. This
presentation is a short version of a one quarter course I have given during the
spring of 1997 at OSU.
","[{""version"":""v1"",""created"":""Thu, 2 Jul 1998 15:51:51 GMT""},{""version"":""v2"",""created"":""Wed, 29 Jul 1998 14:38:42 GMT""}]","2007-05-23"
"math/9807187","Brian Conrey","J. Brian Conrey (AIM), Amit Ghosh (Oklahoma State University)","A conjecture for the sixth power moment of the Riemann zeta-function","Abstract added in migration.","IMRN, Issue 15, 1998, Pages 775-780,","10.1155/S1073792898000476",,"math.NT",,"  The authors conjecture an asymptotic expression for the sixth power moment of
the Riemann zeta function. They establish related results on the asymptotics of
the zeta function that support the conjecture.
","[{""version"":""v1"",""created"":""Thu, 2 Jul 1998 00:00:00 GMT""}]","2022-01-19"
"nucl-th/9807003","Nilmani Mathur","Nimai C. Mukhopadhyay, Nilmani Mathur","Extraction of Electrostrong Parameters of $N^{*}(1520)$ from Eta
  Photoproduction","ReVTeX, 5 pages, corrected Table II and corresponding text","Phys.Lett.B444:7-13,1998","10.1016/S0370-2693(98)01372-0","RPI-N123-98","nucl-th hep-ph",,"  Recently obtained polarized target and photon asymmetry data in eta
photoproduction are shown to be very powerful, in conjunction with the
differential cross-section data, in yielding model-insensitive constraints on
the electrostrong parameters for the excitation and decay of the $N^{*}(1520)$
resonance. The extracted ratio of its electromagnetic helicity amplitudes,
$A_{3/2}/A_{1/2}$, provides a critical test for the QCD-inspired hadron models.
","[{""version"":""v1"",""created"":""Wed, 1 Jul 1998 17:46:50 GMT""},{""version"":""v2"",""created"":""Mon, 17 Aug 1998 22:25:45 GMT""}]","2008-11-26"
"nucl-th/9807004","Sandhya","S. Choubey, K. Kar, G. M. J. Gomez and V. R. Manfredi","Spectral Distribution Studies with Modified Kuo-Brown Interaction in the
  Upper Half of the fp Shell","15 pages LaTeX, no figures","Phys.Rev.C58:597-600,1997","10.1103/PhysRevC.58.597",,"nucl-th",,"  The spectral distribution method with modified Kuo-Brown interaction is
extended to the study of the upper half as well as to odd-A nuclei, of the fp
shell. The calculations show similar success to that obtained for the lower
half.
","[{""version"":""v1"",""created"":""Thu, 2 Jul 1998 11:34:53 GMT""}]","2008-11-26"
"nucl-th/9807005","GuoQiang Li","G.Q. Li (Stony Brook) and C. Gale (McGill)","Intermediate-mass dilepton spectra and the role of secondary hadronic
  processes in heavy-ion collisions","25 pages, including 20 postscript figures","Phys.Rev.C58:2914-2927,1998","10.1103/PhysRevC.58.2914",,"nucl-th hep-ph nucl-ex",,"  We carry out a study of intermediate-mass (between 1 and 2.5 GeV) dilepton
spectra from hadronic interactions in heavy-ion collisions. The processes
considered are $\pi\pi\to l{\bar l}$, $\pi\rho\to l{\bar l}$, $\pi a_1\to
l{\bar l}$, $\pi\omega\to l{\bar l}$, $K{\bar K}\to l{\bar l}$, and $K{\bar
K^*}+c.c \to l{\bar l}$. The elementary cross sections for those are obtained
from chiral Lagrangians involving pseudoscalar, vector, and axial-vector
mesons. The respective electromagnetic form factors are determined by fitting
to experimental data for the reverse processes of $e^+e^-\to hadrons$. Based on
this input we calculate cross sections and thermal dilepton emission rates and
compare our results with those from other approaches. Finally we use these
elementary cross sections with a relativistic transport model and calculate
dilepton spectra in S+W collisions at SPS energies. The comparison of our
results with experimental data from the HELIOS-3 collaboration indicates the
importance of the secondary hadronic contributions to the intermediate-mass
dilepton spectra.
","[{""version"":""v1"",""created"":""Thu, 2 Jul 1998 15:01:16 GMT""}]","2008-11-26"
"physics/9807001","Gerhard Hummer","G. Hummer, S. Garde, A. E. Garc\'ia, M. E. Paulaitis, and L. R. Pratt","Hydrophobic Effects on a Molecular Scale","RevTeX; 18 pages; 15 postscript figures",,,"LA-UR 98-2758","physics.chem-ph physics.bio-ph q-bio",,"  A theoretical approach is developed to quantify hydrophobic hydration and
interactions on a molecular scale, with the goal of gaining insight into the
molecular origins of hydrophobic effects. The model is based on the fundamental
relation between the probability for cavity formation in bulk water resulting
from molecular-scale density fluctuations, and the hydration free energy of the
simplest hydrophobic solute, a hard particle. This probability is estimated
using an information theory (IT) approach, incorporating experimentally
available properties of bulk water -- the density and radial distribution
function. The IT approach reproduces the simplest hydrophobic effects:
hydration of spherical nonpolar solutes, the potential of mean force between
methane molecules, and solvent contributions to the torsional equilibrium of
butane. Applications of this approach to study temperature and pressure effects
provide new insights into the thermodynamics and kinetics of protein folding.
The IT model relates the hydrophobic-entropy convergence observed in protein
unfolding experiments to the macroscopic isothermal compressibility of water. A
novel explanation for pressure denaturation of proteins follows from an
analysis of the pressure stability of hydrophobic aggregates, suggesting that
water penetrates the hydrophobic core of proteins at high pressures. This
resolves a long-standing puzzle, whether pressure denaturation contradicts the
hydrophobic-core model of protein stability. Finally, issues of ``dewetting''
of molecularly large nonpolar solutes are discussed in the context of a
recently developed perturbation theory approach.
","[{""version"":""v1"",""created"":""Wed, 1 Jul 1998 20:15:14 GMT""},{""version"":""v2"",""created"":""Fri, 18 Sep 1998 22:26:01 GMT""}]","2016-08-15"
"physics/9807007","Stefano Curtarolo","A.D.Capobianco, M.Midrio, C.G.Someda and S.Curtarolo","Lossless Tapers, Gaussian Beams, Free-Space Modes: Standing Waves Versus
  Through-Flowing Waves","19 pages and 6 figures",,"10.1117/12.347921","AO 014121","physics.optics cond-mat.mtrl-sci",,"  It was noticed in the past that, to avoid physical inconsistencies, in
Marcatili's lossless tapers through-flowing waves must be drastically different
from standing waves. First, we reconfirm this by means of numerical results
based on an extended BPM algorithm. Next, we show that this apparently
surprising behavior is a straightforward fallout of Maxwell's equations. Very
similar remarks apply to Gaussian beams in a homogeneous medium. As a
consequence, Gaussian beams are shown to carry reactive powers, and their
active power distributions depart slightly from their standard pictures.
Similar conclusions hold for free-space modes expressed in terms of Bessel
functions.
","[{""version"":""v1"",""created"":""Wed, 1 Jul 1998 17:36:18 GMT""}]","2015-06-26"
"physics/9807008","Peter I. Melnikov","P.I.Melnikov, J.B.Greenly, D.A.Hammer","Active Stark Atomic Spectroscopy","12 pages, 7 figures",,,,"physics.atom-ph physics.acc-ph",,"  Active Stark Atomic Spectroscopy (ASAS) method can be used to determine a
high electric field in the diode of an ion or electron accelerator as a
function of position and time, including the positions of anode and cathode
plasma emission surfaces (in order to obtain the effective accelerating gap).
As possible probe beams, we suggest the use of lithium and sodium atoms. The
diagnostic provides a means to measure diode quantities spectroscopically with
excellent spatial resolution.
","[{""version"":""v1"",""created"":""Thu, 2 Jul 1998 03:55:47 GMT""},{""version"":""v2"",""created"":""Fri, 3 Jul 1998 04:09:02 GMT""},{""version"":""v3"",""created"":""Tue, 15 Sep 1998 04:27:27 GMT""}]","2009-09-25"
"physics/9807009","Luigi Foschini","Luigi Foschini","Is Science going through a critical stage?","8 pages; no figures. Revised version: only minor corrections to
  English","AEI 83, (1996), 455-458",,,"physics.hist-ph quant-ph",,"  The unexpected discoveries at the beginning of the century, particularly
thanks to Heisenberg, Bohr, and Godel, has driven the science to drastic
changes, opening new, extraordinary, and infinite research fields. After this,
many scientists saw, and still today see, a crisis, with dreadful meaning, in
the science. However, this crisis is only present in that type of science,
driven by determinism, which is strictly linked to the common sense.
","[{""version"":""v1"",""created"":""Thu, 2 Jul 1998 13:20:08 GMT""},{""version"":""v2"",""created"":""Fri, 21 Aug 1998 11:29:51 GMT""}]","2007-05-23"
