"cond-mat/9807033","Norbert Elstner","N. Elstner and H. Monien (University of Bonn)","Dynamics and Thermodynamics of the Bose-Hubbard model","RevTex, 4 pages, 4 figures (eps format)",,"10.1103/PhysRevB.59.12184",,"cond-mat",,"  We report results from a systematic analytic strong-coupling expansion of the
Bose-Hubbard model in one and two spatial dimensions. We obtain numerically
exact results for the dispersion of single particle and single hole excitations
in the Mott insulator. The boundary of the Mott phase can be determined with
previously unattainable accuracy in one and two dimensions. In one dimension we
observe the occurrence of reentrant behavior from the compressible to the
insulating phase in a region close to the critical point which was conjectured
in earlier work. Our calculation can be used as a benchmark for the development
of new numerical techniques for strongly correlated systems.
","[{""version"":""v1"",""created"":""Thu, 2 Jul 1998 12:55:05 GMT""}]","2009-10-31"
"cond-mat/9807034","Charlie Buhler","Charles Buhler and Adriana Moreo","Study of Spin and Charge Fluctuations in the U-t-t' Model","6 pages revtex with 3 figures embedded",,"10.1103/PhysRevB.59.9882",,"cond-mat.str-el",,"  As additional neutron scattering experiments are performed on a variety of
high temperature superconducting compounds it appears that magnetic
incommensuration is a phenomenon common to all of the samples studied. The
newest experimental results indicate that incommensurate peaks exist at
momentum ${\bf q}=\pi(1,1\pm\delta)$ and $\pi(1\pm\delta,1)$ in
$La_{2-x}Sr_xCuO_4}$ (LSCO) and ${\rm YBa_2Cu_3O_{7-\delta}}$ (YBCO). The
dependence of $\delta$ with hole doping appears to be similar in both
materials. In addition, new ARPES data for LSCO as a function of doping show
that its Fermi surface is qualitatively similar to the one of YBCO, contrary to
what was previously believed. Early theoretical attempts to explain LSCO and
YBCO behavior usually relied on one- or three-band Hubbard models or the t-J
model with electron hopping beyond nearest-neighbor and with different
parameter values for each material. In this paper it is shown that using a one
band Hubbard U-t-$t'$ model with a unique set of parameters, U/t=6 and
$t'$/t=-0.25, good agreement is obtained between computational calculations and
neutron scattering and ARPES experiments for LSCO and YBCO. It is also shown
that using a more negative $t'$/t will induce short-range magnetic
incommensuration along the diagonal direction in the Brillouin zone, in
qualitative disagreement with the experimental results. At the finite
temperatures of the present Monte Carlo simulation it is also observed that in
this model the tendency to incommensuration appears to be more related to the
shape of the two-dimensional Fermi surface and the strength of the interaction,
rather than to charge order.
","[{""version"":""v1"",""created"":""Thu, 2 Jul 1998 13:41:30 GMT""}]","2009-10-31"
"cond-mat/9807035","Peter Olmsted","Peter D. Olmsted and Ian W. Hamley","Lifshitz points in blends of AB and BC diblock copolymers","5 pages ReVTEX, 3 figures (epsf), submitted to Europhysics Letters","Europhysics Letters 45 (1999) 83-89.","10.1209/epl/i1999-00135-4",,"cond-mat.soft",,"  We consider micro- and macro- phase separation in blends of AB and BC diblock
copolymers. We show that, depending on architecture, a number of phase diagram
topologies are possible. Microphase separation or macrophase separation can
occur, and there are a variety of possible Lifshitz points. Because of the rich
parameter space, Lifshitz points of multiple order are possible. We demonstrate
Lifshitz points of first and second order, and argue that, in principle, up to
5th order Lifshitz points are possible.
","[{""version"":""v1"",""created"":""Thu, 2 Jul 1998 14:27:21 GMT""}]","2009-10-31"
"cond-mat/9807036","Pedro L. de Andres","P.L. de Andres and J.A. Verges","Manifestation of quantum chaos on ordered structures by scattering
  techniques: application to Low-Energy Electron Diffraction","LaTex, 8 pages, 13 figures, http://www.icmm.csic.es/Pandres/pedro.htm",,"10.1103/PhysRevB.59.3086",,"cond-mat.mtrl-sci cond-mat.stat-mech",,"  We analyze statistical probability distributions of intensities collected by
diffraction techniques like Low-Energy Electron Diffraction. A simple
theoretical model based in hard-sphere potentials and LEED formalism is
investigated for different values of relevant parameters: energy, angle of
incidence, muffin-tin potential radius, maximum spherical component $l_{max}$,
number of stacked layers, and full multiple-scattering or kinematic model.
Given a complex enough system (e.g., including multiple scattering by at least
two Bravais lattices), the computed probability distributions agree rather well
with a $\chi^{2}_{2}$ one, characteristic of the Gaussian Unitary Ensemble
universality class associated to quantum chaos. A hypothesis on the possible
impact of the chaoticity of wavefunctions on correlation factors is tested
against the behaviour of the Pendry R-factor and the Root Mean Squared
Deviation factor.
","[{""version"":""v1"",""created"":""Thu, 2 Jul 1998 14:36:24 GMT""}]","2009-10-31"
"cond-mat/9807037","Kamran Behnia","H. Aubin, K. Behnia (Orsay), S. Ooi and T. Tamegai (Tokyo)","Evidence for field-induced excitations in low-temperature thermal
  conductivity of Bi_2Sr_2CaCu_2O_8","4 pages including 4 eps figures, submitted to Phys. Rev. Lett",,"10.1103/PhysRevLett.82.624",,"cond-mat.supr-con",,"  The thermal conductivity ,$\kappa$, of Bi_2Sr_2CaCu_2O_8 was studied as a
function of magnetic field. Above 5 K, after an initial decrease, $\kappa(H)$
presents a kink followed by a plateau, as recently reported by Krishana et al..
By contrast, below 1K, the thermal conductivity was found to \emph{increase}
with increasing field. This behavior is indicative of a finite density of
states and is not compatible with the existence of a field-induced fully gapped
$d_{x^{2}-y^{2}}+id_{xy}$ state which was recently proposed to describe the
plateau regime. Our low-temperature results are in agreement with recent works
predicting a field-induced enhancement of thermal conductivity by Doppler shift
of quasi-particle spectrum.
","[{""version"":""v1"",""created"":""Thu, 2 Jul 1998 14:41:26 GMT""}]","2009-10-31"
"cond-mat/9807038","Doron Cohen","Doron Cohen and Yoseph Imry","Dephasing at Low Temperatures","4 pages, 1 figure, clearer presentation","Phys. Rev. B 59, 11143 (1999).","10.1103/PhysRevB.59.11143",,"cond-mat",,"  We discuss the significance and the calculation of dephasing at low
temperatures. The particle is moving diffusively due to a static disorder
configuration, while the interference between classical paths is suppressed due
to the interaction with a dynamical environment. At high temperatures we may
use the `white noise approximation' (WNA), while at low temperatures we
distinguish the contribution of `zero point fluctuations' (ZPF) from the
`thermal noise contribution' (TNC). We study the limitations of the above
semiclassical approach and suggest the required modifications. In particular we
find that the ZPF contribution becomes irrelevant for thermal motion.
","[{""version"":""v1"",""created"":""Thu, 2 Jul 1998 14:48:02 GMT""},{""version"":""v2"",""created"":""Wed, 25 Nov 1998 19:21:59 GMT""}]","2009-10-31"
"cond-mat/9807039","Claudio Castellano","Federico Corberi and Claudio Castellano","Phase-ordering of conserved vectorial systems with field-dependent
  mobility","RevTeX, 8 pages, 13 figures, to be published in Phys. Rev. E",,"10.1103/PhysRevE.58.4658",,"cond-mat.stat-mech",,"  The dynamics of phase-separation in conserved systems with an O(N) continuous
symmetry is investigated in the presence of an order parameter dependent
mobility M(\phi)=1-a \phi^2. The model is studied analytically in the framework
of the large-N approximation and by numerical simulations of the N=2, N=3 and
N=4 cases in d=2, for both critical and off-critical quenches. We show the
existence of a new universality class for a=1 characterized by a growth law of
the typical length L(t) ~ t^{1/z} with dynamical exponent z=6 as opposed to the
usual value z=4 which is recovered for a<1.
","[{""version"":""v1"",""created"":""Thu, 2 Jul 1998 15:40:58 GMT""}]","2009-10-31"
"gr-qc/9807003","Sean Hayward","Sean A. Hayward","Inequalities relating area, energy, surface gravity and charge of black
  holes","3 pages, revtex","Phys.Rev.Lett.81:4557-4559,1998","10.1103/PhysRevLett.81.4557",,"gr-qc",,"  The Penrose-Gibbons inequality for charged black holes is proved in spherical
symmetry, assuming that outside the black hole there are no current sources,
meaning that the charge e is constant, with the remaining fields satisfying the
dominant energy condition. Specifically, for any achronal hypersurface which is
asymptotically flat at spatial or null infinity and has an outermost marginal
surface of areal radius r, the asymptotic mass m satisfies 2m >= r + e^2/r.
Replacing m by a local energy, the inequality holds locally outside the black
hole. A recent definition of dynamic surface gravity k also satisfies
inequalities 2k <= 1/r - e^2/r^3 and m >= r^2 k + e^2/r. All these inequalities
are sharp in the sense that equality is attained for the Reissner-Nordstrom
black hole.
","[{""version"":""v1"",""created"":""Thu, 2 Jul 1998 04:53:23 GMT""}]","2010-11-19"
"gr-qc/9807004","Gavrilov Valery","V.R. Gavrilov and V.N. Melnikov","Toda Chains with Type Am Lie Algebra for Multidimensional Classical
  Cosmology with Intersecting p-Branes","13 pages, Latex",,,,"gr-qc",,"  We consider a D-dimensional cosmological model describing an evolution of
(n+1) Einstein factor spaces in the theory with several dilatonic scalar fields
and generalized electro-magnetic forms, admitting an interpretation in terms of
intersecting p-branes. The equations of motion of the model are reduced to the
Euler-Lagrange equations for the so called pseudo-Euclidean Toda-like system.
We consider the case, when characteristic vectors of the model, related to
p-branes configuration and their couplings to the dilatonic fields, may be
interpreted as the root vectors of a Lie algebra of the type Am. The model is
reduced to the open Toda chain and integrated. The exact solution is presented
in the Kasner-like form.
","[{""version"":""v1"",""created"":""Thu, 2 Jul 1998 10:36:44 GMT""}]","2007-05-23"
"gr-qc/9807005","Keisuke Taniguchi","Keisuke Taniguchi and Masaru Shibata","Gravitational radiation from corotating binary neutron stars of
  incompressible fluid in the first post-Newtonian approximation of general
  relativity","26 pages, revtex, 9 figures(eps), accepted for publication in Phys.
  Rev. D","Phys.Rev. D58 (1998) 084012","10.1103/PhysRevD.58.084012","KUNS 1464, OU-TAP 68","gr-qc",,"  We analytically study gravitational radiation from corotating binary neutron
stars composed of incompressible, homogeneous fluid in circular orbits. The
energy and the angular momentum loss rates are derived up to the first
post-Newtonian (1PN) order beyond the quadrupole approximation including
effects of the finite size of each star of binary. It is found that the leading
term of finite size effects in the 1PN order is only $O(GM_{\ast}/c^2
a_{\ast})$ smaller than that in the Newtonian order, where $GM_{\ast}/c^2
a_{\ast}$ means the ratio of the gravitational radius to the mean radius of
each star of binary, and the 1PN term acts to decrease the Newtonian finite
size effect in gravitational radiation.
","[{""version"":""v1"",""created"":""Thu, 2 Jul 1998 12:53:04 GMT""}]","2009-10-31"
"hep-lat/9807001","Alistair Hart","Giuseppe Di Cecio, Alistair Hart and Richard W. Haymaker","Ehrenfest theorems and charge antiscreening in Abelian projected gauge
  theories","18 pages, latex, no figures","Phys.Lett. B441 (1998) 319-329","10.1016/S0370-2693(98)01170-8","LSUHE No. 269-1998","hep-lat hep-th",,"  We derive exact relations for SU(2) lattice gauge theory in 3+1 dimensions.
In terms of Abelian projection, these are the expectation values of Maxwell
equations that define a new field strength operator and conserved, dynamic
electric currents formed from the charged matter and ghost fields. The effect
of gauge fixing is calculated, and in the maximally Abelian gauge we find
antiscreening of U(1) Wilson loop source charges. We discuss the importance of
these quantities in the dual superconducting vacuum mechanism of confinement.
","[{""version"":""v1"",""created"":""Wed, 1 Jul 1998 16:29:25 GMT""}]","2009-10-31"
"hep-ph/9807212","Sharon Jensen","Stanley J. Brodsky","QCD Phenomena and the Light-Cone Wavefunction of Hadrons","LaTex, 14 pages",,,"SLAC-PUB-7870","hep-ph",,"  Light-cone Fock-state wavefunctions encode the properties of a hadron in
terms of its fundamental quark and gluon degrees of freedom. A recent
experiment at Fermilab, E791, demonstrates that the color coherence and shape
of light-cone wavefunctions in longitudinal momentum fraction can be directly
measured by the high energy diffractive jet dissociation of hadrons on nuclei.
Given the proton's light-cone wavefunctions, one can compute not only the quark
and gluon distributions measured in deep inelastic lepton-proton scattering,
but also the multi-parton correlations which control the distribution of
particles in the proton fragmentation region and dynamical higher twist
effects. First-principle predictions can be made for structure functions at
small and large light-cone momentum fraction $x$. Light-cone wavefunctions also
provide a systematic framework for evaluating exclusive hadronic matrix
elements, including timelike heavy hadron decay amplitudes and form factors. In
principle, light-cone wavefunctions can be computed in nonperturbative QCD by
diagonalizing the light-cone Hamiltonian using the DLCQ method, as in
dimensionally reduced collinear QCD.
","[{""version"":""v1"",""created"":""Wed, 1 Jul 1998 16:30:37 GMT""}]","2007-05-23"
"hep-ph/9807213","Jorge Eduardo Cieza Montalvo","Jorge Eduardo Cieza Montalvo","Pair Production of Heavy-Exotic-Fermions","13 pages, 10 figures","Phys.Rev. D59 (1999) 095007","10.1103/PhysRevD.59.095007",,"hep-ph",,"  We study the production and signatures of heavy exotic fermion pairs in the
framework of the vector singlet model (VSM), vector doublet model (VDM) and
fermion-mirror-fermion (FMF) model. We show that the pair production cross
sections are competitive with the ones for the single production of exotic
fermions due to the exchange of a photon in the $s$ channel and to the vector
component of the $Z$ - boson coupling to exotic fermions. We also exhibit some
kinematical distributions.
","[{""version"":""v1"",""created"":""Wed, 1 Jul 1998 16:50:21 GMT""}]","2009-10-31"
"hep-ph/9807214","Myriam Mondragon","A. Mondragon and E. Rodriguez-Jauregui (IF, Nat. Autonomous Univ. of
  Mexico)","The breaking of the flavour permutational symmetry: Mass textures and
  the CKM matrix","21 pages, 1 fig. Content enlarged, references added and typos
  corrected. To be published in Phys Rev D","Phys.Rev.D59:093009,1999","10.1103/PhysRevD.59.093009","IFUNAM-FT98-12","hep-ph",,"  Different ansaetze for the breaking of the flavour permutational symmetry
according to S(3)L X S(3)R in S(2)L X S(2) give different Hermitian mass
matrices of the same modified Fritzsch type, which differ in the symmetry
breaking pattern. In this work we obtain a clear and precise indication on the
preferred symmetry breaking scheme from a fit of the predicted theoretical Vckm
to the experimentally determined absolute values of the elements of the CKM
matrix. The preferred scheme leads to simple mass textures and allows us to
compute the CKM mixing matrix, the Jarlskog invariant J, and the three inner
angles of the unitarity triangle in terms of four quark mass ratios and only
one free parameter: the CP violating phase Phi. Excellent agreement with the
experimentally determined absolute values of the entries in the CKM matrix is
obtained for Phi = 90 deg. The corresponding computed values of the Jarlskog
invariant and the inner angles are J = 3.00 X 10^-5, alpha= 84 deg, beta= 24
deg and gamma =72 deg in very good agreement with current data on CP violation
in the neutral kaon-antikaon system and oscillations in the B-Bbar system.
","[{""version"":""v1"",""created"":""Wed, 1 Jul 1998 17:37:08 GMT""},{""version"":""v2"",""created"":""Thu, 4 Feb 1999 19:10:52 GMT""}]","2008-11-26"
"hep-ph/9807215","Momchil Velkovsky","Momchil Velkovsky","Mean Field, Instantons and Finite Baryon Density","7 pages LaTeX, 3 eps-figures included, to appear in the Proc. of the
  'QCD at Finite Baryon Density'-Workshop (Bielefeld, 27.-30.04.98)","Nucl.Phys. A642 (1998) 58-64","10.1016/S0375-9474(98)00499-0",,"hep-ph",,"  Instantons create a non-local interaction between the quarks, which at finite
baryon density leads to the formation of a scalar diquark condensate and color
superconductivity. A mean field approach leads to a self-consistent description
of the $<\bar q q>$ and $<q q>$ condensates and shows the inevitability of a
BCS type instability at the Fermi surface. The role of the rearrangement of the
instanton ensemble for the QCD phase transitions is also discussed.
","[{""version"":""v1"",""created"":""Wed, 1 Jul 1998 20:49:30 GMT""},{""version"":""v2"",""created"":""Fri, 3 Jul 1998 18:14:49 GMT""}]","2009-10-31"
"hep-ph/9807217","Basim Kamal","Basim Kamal (Brookhaven)","Transversity and Mass Singularities in Dimensional Regularization","11 pages with figures included, Latex, includes style files;
  shortened somewhat",,,"BNL-HET-98/24","hep-ph",,"  The proton's transversity distribution will be measured at BNL's Relativistic
Heavy Ion Collider in upcoming experiments using the transverse Drell-Yan
process. Understanding the one-loop corrections is therefore important. Here,
the collinear structure in transverse Drell-Yan is investigated in detail using
dimensional regularization and the correct behaviour is found, although the
mechanism is non-trivial. The resulting n-dimensional transversity splitting
function (and consequently the one-loop transversity distribution and its
two-loop evolution) is found to be the same in both the anticommuting-gamma_5
scheme and the HVBM scheme. Alternative schemes are considered.
","[{""version"":""v1"",""created"":""Thu, 2 Jul 1998 01:07:36 GMT""},{""version"":""v2"",""created"":""Thu, 5 Nov 1998 23:29:28 GMT""}]","2009-09-25"
"hep-ph/9807218","Passeram","M. Passera and A. Sirlin (New York University)","Radiative Corrections to W and Quark Propagators in the Resonance Region","16 pages, 7 figures, LaTeX. Uses epsfig. Talk given at Zeuthen
  Workshop on Elementary Particle Theory: Loops and Legs in Gauge Theories,
  Rheinsberg, Germany, 19-24 Apr 1998","Acta Phys.Polon. B29 (1998) 2901-2915",,"NYU-TH/98-06-01","hep-ph",,"  It is shown that conventional mass renormalization, when applied to photonic
or gluonic corrections to unstable particle propagators, leads to
non-convergent series in the resonance region. A solution of this problem,
based on the concepts of pole mass and width, is presented. In contrast with
the Z case, the conventional on-shell definition of mass for W bosons and
unstable quarks contains an unbounded gauge dependence in next-to-leading
order. The on-shell and pole definitions of width are shown to coincide if
terms of O(\Gamma^2) and higher are neglected, but not otherwise.
","[{""version"":""v1"",""created"":""Thu, 2 Jul 1998 05:45:25 GMT""}]","2007-05-23"
"hep-ph/9807219","Gregory W. Carter","Gregory W. Carter and Dmitri Diakonov","Towards a Theory of Instantons at Non-zero Fermion Density","12 pages LaTeX, 3 figures incl.; to appear in Proceedings of the Intl
  Workshop on QCD at Finite Baryon Density, Bielefeld, Germany, April 1998","Nucl.Phys. A642 (1998) 78-89","10.1016/S0375-9474(98)00502-8",,"hep-ph",,"  A formalism to study light fermions at non-zero chemical potential in the
instanton medium is presented. It is then applied to investigate chiral
symmetry restoration and diquark condensation at finite baryon density.
","[{""version"":""v1"",""created"":""Thu, 2 Jul 1998 07:27:39 GMT""}]","2009-10-31"
"hep-ph/9807220",,"Jia-Sheng Xu (Peking University), Hong-An Peng (CCAST and Peking
  University)","Associated jpsi + gamma diffractive production: the nature of Pomeron
  and test of hard diffractive factorization","15 pages, LaTeX, 5 PS figures","Phys.Rev. D59 (1999) 014028","10.1103/PhysRevD.59.014028",,"hep-ph",,"  We present a study of diffractive associated jpsi + gamma production at the
Fermilab Tevatron and LHC based on the Ingelman-Schlein model for hard
diffractive scattering and the factorization formalism of NRQCD for quarkonia
production. We find that this process (p + pbar to p + jpsi + gamma + X) can be
used to probe the gluon content of the Pomeron and test the assumption of
diffractive hard scattering factorization. Using the renormalized Pomeron flux
factor D simeq 0.11 (0.052), the single diffractive jpsi + gamma production
cross section at 4<P_T< 10 GeV, -1<eta<1 region is found to be of the order of
3.0 pb (8.5 pb), the ratio of single diffractive to inclusive production is
0.50% (0.15%) in central region at the Tevatron (LHC) for the gluon fraction in
the Pomeron f_g = 0.7, independent of the values of color-octet matrix
elements.
","[{""version"":""v1"",""created"":""Thu, 2 Jul 1998 13:45:03 GMT""}]","2009-10-31"
"hep-ph/9807221","Jos Vermaseren","J. A. M. Vermaseren","Some problems in loop calculations","8 pages, LaTeX, uses appb.sty and axodraw.sty, talk given at 'Loops
  and Legs in gauge theories', Rheinsberg 1998","Acta Phys.Polon. B29 (1998) 2599-2609",,"NIKHEF-98-021","hep-ph",,"  We discuss some of the problems that may occur in the calculation of
complicated Feynman diagrams. These include the group independent evaluation of
color factors, and the summation techniques that are needed for the expansion
of diagrams into their Mellin moments.
","[{""version"":""v1"",""created"":""Thu, 2 Jul 1998 12:41:32 GMT""}]","2007-05-23"
"hep-ph/9807222","Georg Weiglein","G. Weiglein","Results for Precision Observables in the Electroweak Standard Model at
  Two-Loop Order and Beyond","8 pages, 2 figures, presented at the Zeuthen Workshop on Elementary
  Particle Physics, ""Loops and Legs in Gauge Theories"", Rheinsberg, April
  19-24, 1998, to appear in Acta Phys Pol","Acta Phys.Polon. B29 (1998) 2735-2741",,"KA-TP-11-1998","hep-ph",,"  Higher-order contributions to the precision observables \Delta r,
\sin^2\theta_eff and \Gamma_l are discussed. The Higgs-mass dependence of the
observables is investigated at the two-loop level, and exact results are
derived for the Higgs-dependent two-loop corrections associated with fermions.
The top-quark corrections are compared with the results obtained by an
expansion in the top-quark mass up to next-to-leading order. For the pure
fermion-loop contributions to \Delta r results up to four-loop order are
derived. They allow to investigate the validity of the commonly used
resummation of the leading fermionic contributions to \Delta r.
","[{""version"":""v1"",""created"":""Thu, 2 Jul 1998 12:59:57 GMT""}]","2007-05-23"
"hep-ph/9807223","Melikhov","M. Beyer and D. Melikhov","Form factors of exclusive $b\to u$ transitions","revtex, 6 pages, 1 figure","Phys.Lett.B436:344-350,1998","10.1016/S0370-2693(98)00847-8",,"hep-ph",,"  We present the form factors of the $B\to\pi,\rho$ transitions induced by the
$b\to u$ quark currents at all kinematically accessible $q^2$. Our analysis is
based on the spectral representations of the form factors within the
constituent quark picture: we fix the soft meson wave functions and the
constituent quark masses by fitting $A_1(q^2)$ and $T_2(q^2)$ to the lattice
results at small recoils ($17\lesssim q^2\lesssim 20 GeV^2$). We then calculate
the $B\to\pi,\rho$ transition form factors down to $q^2=0$. For the $B\to\pi$
case the region $q^2\lesssim 20 GeV^2$ however does not cover the whole
kinematically accessible range. Due to the smallness of the pion mass the
region of small recoils is close to the nearby $B^*(5234)$ resonance. We
develop a parametrization which includes the $B^*$ dominance of the form
factors $f_+$ and $f_-$ at small recoils and numerically reproduces the results
of calculations at $q^2\lesssim 20 GeV^2$. We find
$\Gamma(B\to\pi\ell\nu)=8.0^{+0.8}_{-0.2} |V_{ub}|^2 $ps$^{-1}$ and
$\Gamma(B\to\rho\ell\nu)=15.8\pm 2.3 |V_{ub}|^2 $ps$^{-1}$.
","[{""version"":""v1"",""created"":""Thu, 2 Jul 1998 14:16:17 GMT""}]","2011-07-19"
