"astro-ph/9807117","Mark R. Krumholz","Mark R. Krumholz (1), S. E. Thorsett (1), Fiona A. Harrison (2) ((1)
  Princeton University, (2) California Institute of Technology)","Gamma-Ray Bursts and the Cosmic Star Formation Rate","12 pages, 2 postscript figures, uses AAS LaTex macros v4.0. To be
  published in Astrophysical Journal Letters, accepted August 20, 1998. Revised
  for publication",,"10.1086/311657",,"astro-ph",,"  We have tested several models of GRB luminosity and redshift distribution
functions for compatibility with the BATSE 4B number versus peak flux relation.
Our results disagree with recent claims that current GRB observations can be
used to strongly constrain the cosmic star formation history. Instead, we find
that relaxing the assumption that GRBs are standard candles renders a very
broad range of models consistent with the BATSE number-flux relation. We
explicitly construct two sample distributions, one tracing the star formation
history and one with a constant comoving density. We show that both
distributions are compatible with the observed fluxes and redshifts of the
bursts GRB970508, GRB971214, and GRB980703, and we discuss the measurements
required to distinguish the two models.
","[{""version"":""v1"",""created"":""Sun, 12 Jul 1998 20:23:31 GMT""},{""version"":""v2"",""created"":""Sun, 23 Aug 1998 00:32:52 GMT""}]","2009-10-30"
"astro-ph/9807118","Michael Drinkwater","M.J. Drinkwater (University of New South Wales), Q.A. Parker
  (Anglo-Australian Observatory), D. Proust (Observatoire de Meudon), H.
  Quintana (Universidad Catolica de Chile), E. Slezak (Observatoire de Nice)","New Structure In The Shapley Supercluster","LaTex: 2 pages, 1 figure, includes conf_iap.sty style file. To appear
  in proceedings of The 14th IAP Colloquium: Wide Field Surveys in Cosmology,
  held in Paris, 1998 May 26--30, eds. S.Colombi, Y.Mellier",,"10.1071/AS99113",,"astro-ph",,"  We present new radial velocities for 189 galaxies in a 91 sq. deg region of
the Shapley supercluster measured with the FLAIR-II spectrograph on the UK
Schmidt Telescope. The data reveal two sheets of galaxies linking the major
concentrations of the supercluster. The supercluster is not flattened in
Declination as was suggested previously and it may be at least 30 percent
larger than previously thought with a correspondingly larger contribution to
the motion of the Local Group.
","[{""version"":""v1"",""created"":""Mon, 13 Jul 1998 01:49:54 GMT""}]","2015-06-24"
"astro-ph/9807119","Werner Hofmann","HEGRA Collaboration, F. Aharonian et al","Measurement of the radial distribution of Cherenkov light generated by
  TeV gamma-ray air showers","15 Pages, 8 figures, Latex","Astropart.Phys.10:21-29,1999","10.1016/S0927-6505(98)00039-5",,"astro-ph",,"  Using air showers induced by TeV gamma-rays from Mrk 501, the radial
distribution of Cherenkov light is investigated. The shower geometry is
reconstructed from the stereoscopic shower images obtained with the telescopes
of the HEGRA IACT system. We observe a change in the shape of the light pool
with shower energy, and with zenith angle. Data are well reproduced by
Monte-Carlo air shower simulations.
","[{""version"":""v1"",""created"":""Mon, 13 Jul 1998 07:53:57 GMT""}]","2011-05-23"
"astro-ph/9807120","Yutaka Fujita","Yutaka Fujita (Osaka Univ.)","Quantitative Estimates of Environmental Effects on the Star Formation
  Rate of Disk Galaxies in Clusters of Galaxies","12 pages, 13 figures. To be published in ApJ",,"10.1086/306518","OU-TAP 80","astro-ph",,"  A simple model is constructed to evaluate the change of star formation rate
of a disk galaxy due to environmental effects in clusters of galaxies. Three
effects, (1) tidal force from the potential well of the cluster, (2) increase
of external pressure when the galaxy plows into the intracluster medium, (3)
high-speed encounters between galaxies, are investigated. General analysis
indicates that the star formation rate increases significantly when the
pressure of molecular clouds rises above $\sim 3\times 10^5 cm^{-3} K$ in $\sim
10^8$ yr. The tidal force from the potential well of the cluster increases
pressures of molecular clouds in a disk galaxy infalling towards the cluster
center. Before the galaxy reaches the cluster center, the star formation rate
reaches a maximum. The peak is three to four times larger than the initial
value. If this is the main mechanism of the Butcher-Oemler effect, blue
galaxies are expected to be located within $\sim 300$ kpc from the center of
the cluster. However this prediction is inconsistent with the recent
observations. The increase of external pressure when the galaxy plows into the
intracluster medium does not change star formation rate of a disk galaxy
significantly. The velocity perturbation induced by a single high-speed
encounter between galaxies is too small to affect star formation rate of a disk
galaxy, while successive high-speed encounters (galaxy harassment) trigger star
formation activity because of the accumulation of gas in the galaxy center.
Therefore, the galaxy harassment remains as the candidate for a mechanism of
the Butcher-Oemler effect.
","[{""version"":""v1"",""created"":""Mon, 13 Jul 1998 12:42:53 GMT""}]","2009-10-30"
"astro-ph/9807121","Michael L. Norman","Michael L. Norman and Greg L. Bryan","Cosmological Adaptive Mesh Refinement","14 pages, 3 figures (incl. one large color PS) to appear in
  ""Numerical Astrophysics 1998"", eds. S. Miyama & K. Tomisaka, Tokyo, March
  10-13, 1998",,"10.1007/978-94-011-4780-4_3",,"astro-ph",,"  We describe a grid-based numerical method for 3D hydrodynamic cosmological
simulations which is adaptive in space and time and combines the best features
of higher order--accurate Godunov schemes for Eulerian hydrodynamics with
adaptive particle--mesh methods for collisionless particles. The basis for our
method is the structured adaptive mesh refinement (AMR) algorithm of Berger &
Collela (1989), which we have extended to cosmological hydro + N-body
simulations. The resulting multiscale hybrid method is a powerful alternative
to particle-based methods in current use. The choices we have made in
constructing this algorithm are discussed, and its performance on the Zeldovich
pancake test problem is given. We present a sample application of our method to
the problem of first structure formation. We have achieved a spatial dynamic
range $L_{box}/\Delta x > 250,000$ in a 3D multispecies gas + dark matter
calculation, which is sufficient to resolve the formation of primordial
protostellar cloud cores starting from linear matter fluctuations in an
expanding FRW universe.
","[{""version"":""v1"",""created"":""Mon, 13 Jul 1998 15:25:26 GMT""}]","2016-01-27"
"cmp-lg/9807002","Min-Yen Kan","Judith L. Klavans (Center for Research on Information Access, Columbia
  University), Min-Yen Kan (Computer Science, Columbia University)","The Role of Verbs in Document Analysis","7 + 1 pages, US Letter, LaTeX (+2 eps figures). To appear in
  Proceedings of the 17th International Conference on Computational Linguistics
  (COLING-ACL '98). Tool license available at
  http://www.cs.columbia.edu/nlp/licenses/verberLicenseDownload.html","Proceedings of the 17th International Conference on Computational
  Linguistics (COLING-ACL '98), Montreal, Canada: Aug. 1998. pp. 680-686.",,,"cmp-lg cs.CL",,"  We present results of two methods for assessing the event profile of news
articles as a function of verb type. The unique contribution of this research
is the focus on the role of verbs, rather than nouns. Two algorithms are
presented and evaluated, one of which is shown to accurately discriminate
documents by type and semantic properties, i.e. the event profile. The initial
method, using WordNet (Miller et al. 1990), produced multiple
cross-classification of articles, primarily due to the bushy nature of the verb
tree coupled with the sense disambiguation problem. Our second approach using
English Verb Classes and Alternations (EVCA) Levin (1993) showed that
monosemous categorization of the frequent verbs in WSJ made it possible to
usefully discriminate documents. For example, our results show that articles in
which communication verbs predominate tend to be opinion pieces, whereas
articles with a high percentage of agreement verbs tend to be about mergers or
legal cases. An evaluation is performed on the results using Kendall's Tau. We
present convincing evidence for using verb semantic classes as a discriminant
in document classification.
","[{""version"":""v1"",""created"":""Mon, 13 Jul 1998 13:29:26 GMT""}]","2007-05-23"
"cond-mat/9807177","Zhang Yu Qian","Fan Zhong (Nanjing U, Hong Kong U, China) et al","Theory of Coupled Phase Transitions: Phase Separation and Variation of
  Order Parameter","Revtex, two columns, four pages, no figure",,,,"cond-mat",,"  A simplified Ginzburg-Landau theory is presented to study generally a
coupling of a first-order phase transition (FOPT) to a second-order phase
transition (SOPT). We show analytically that, due to the coupling between the
two phase transitions, the SOPT may exhibit a FOPT-like phase separation in
which an ordered phase is separated from a disordered one. This phase
separation results in a distinct behavior in the variation of the order
parameter of the SOPT, namely, it is primarily the proportion of the ordered
phase that contributes to the total order of the whole system during the FOPT.
This growth mode may turn a mean-field critical exponent from 1/2 to 1 or even
bigger.
","[{""version"":""v1"",""created"":""Mon, 13 Jul 1998 08:30:35 GMT""}]","2007-05-23"
"cond-mat/9807178","Johann Blatter","Gordey B. Lesovik and Gianni Blatter (ETH Zurich)","Nonlinear Transport through NS Junctions due to Imperfect Andreev
  Reflection","4 pages, RevTeX, three postscript figures",,"10.1134/1.567914",,"cond-mat.mes-hall cond-mat.supr-con",,"  We investigate a normal metal -- superconductor (point) contact in the limit
where the number of conducting channels in the metallic wire is reduced to few
channels. As the effective Fermi energy drops below the gap energy, a
conducting band with a width twice the Fermi energy is formed. Depending on the
mode of operation, the conduction band can be further squeezed, leading to
various non-linear effects in the current-voltage characteristics such as
current saturation, a N-shaped negative differential resistance, bistability,
and hysteresis.
","[{""version"":""v1"",""created"":""Mon, 13 Jul 1998 09:10:44 GMT""}]","2009-10-31"
"cond-mat/9807179","Beat Frischmuth","Beat Frischmuth, Frederic Mila, Matthias Troyer","Thermodynamics of the one-dimensional SU(4) symmetric spin-orbital model","4 pages, 4 figures, RevTeX","Phys. Rev. Lett. 82, 000835 (1999)","10.1103/PhysRevLett.82.835",,"cond-mat",,"  The ground state properties and the thermodynamics of the one-dimensional
SU(4) symmetric spin system with orbital degeneracy are investigated using the
quantum Monte Carlo loop algorithm. The spin-spin correlation functions exhibit
a 4-site periodicity, and their low temperature behavior is controlled by two
correlation lengths that diverge like the inverse temperature, while the
entropy is linear in temperature and its slope is consistent with three gapless
modes of velocity $\pi/2$. The physical implications of these results are
discussed.
","[{""version"":""v1"",""created"":""Mon, 13 Jul 1998 09:14:20 GMT""}]","2007-05-23"
"cond-mat/9807180","Ryoichi Yamamoto","Ryoichi Yamamoto and Akira Onuki","Heterogeneous Diffusion in Highly Supercooled Liquids","4 pages, 5 figures",,"10.1103/PhysRevLett.81.4915",,"cond-mat.soft cond-mat.dis-nn",,"  The diffusivity of tagged particles is demonstrated to be very heterogeneous
on time scales comparable to or shorter than the $\alpha$ relaxation time
$\tau_{\alpha}$ ($\cong$ the stress relaxation time) in a highly supercooled
liquid via 3D molecular dynamics simulation. The particle motions in the
relatively active regions dominantly contribute to the mean square
displacement, giving rise to a diffusion constant systematically larger than
the Einstein-Stokes value. The van Hove self-correlation function $G_s(r,t)$ is
shown to have a long distance tail which can be scaled in terms of $r/t^{1/2}$
for $t \ls 3\tau_{\alpha}$. Its presence indicates heterogeneous diffusion in
the active regions. However, the diffusion process eventually becomes
homogeneous on time scales longer than the life time of the heterogeneity
structure ($\sim 3 \tau_{\alpha}$).
","[{""version"":""v1"",""created"":""Mon, 13 Jul 1998 12:06:23 GMT""},{""version"":""v2"",""created"":""Fri, 24 Jul 1998 05:34:35 GMT""}]","2009-10-31"
"cond-mat/9807181","Antonello Sindona","Antonio Sindona and Giovanni Falcone","Deep Level Promotion Mechanism in Sputtering","33 pages, elsart is used, 8 Eps-figures, to appear in Surface Science","Surface Science 423, 99 (1999)","10.1016/S0039-6028(98)00917-0",,"cond-mat",,"  We have applied a double decoupled localized level Anderson-Newns Hamiltonian
to the analysis of surface effects upon the ionized fraction $\mathcal{R}_{+}$
of sputtered atoms from a metal surface. Electronic excitations, induced in the
conduction band by the transient formation of quasi molecular systems, between
substrate and emitted atoms, in the collision cascade generated by the primary
incident beam, have been explicitly included into an instantaneous transition
matrix peaked at the Fermi level of the material. The interaction dynamics seem
to take place over two different time scales, one related to sputtered atom
trajectories and the other to recoiled substrate particles. Finite temperature
calculations have suggested, at very low ejection energies, a power law
dependence of the final charge state of the sputtered beam on its detected
velocity. This result is in agreement, in the zero temperature limit, with some
previously published papers and its validity has been compared to other
theoretical outcomes and tested on SIMS data.
","[{""version"":""v1"",""created"":""Mon, 13 Jul 1998 14:27:42 GMT""},{""version"":""v2"",""created"":""Mon, 26 Oct 1998 19:32:27 GMT""},{""version"":""v3"",""created"":""Tue, 27 Oct 1998 19:07:44 GMT""},{""version"":""v4"",""created"":""Mon, 28 Dec 1998 14:34:15 GMT""},{""version"":""v5"",""created"":""Tue, 29 Dec 1998 13:04:47 GMT""},{""version"":""v6"",""created"":""Wed, 30 Dec 1998 12:52:41 GMT""}]","2013-06-27"
"cond-mat/9807182","Mauro S. Ferreira","M. S. Ferreira, J. d'Albuquerque e Castro, R. B. Muniz and L. C. Lopes","Exponential behavior of the interlayer exchange coupling across
  non-magnetic metallic superlattices","To appear in Phys. Rev. B",,"10.1103/PhysRevB.58.8198",,"cond-mat.mes-hall",,"  It is shown that the coupling between magnetic layers separated by
non-magnetic metallic superlattices can decay exponentially as a function of
the spacer thickness $N$, as opposed to the usual $N^{-2}$ decay. This effect
is due to the lack of constructive contributions to the coupling from extended
states across the spacer. The exponential behavior is obtained by properly
choosing the distinct metals and the superlattice unit cell composition.
","[{""version"":""v1"",""created"":""Mon, 13 Jul 1998 14:48:33 GMT""}]","2009-10-31"
"cond-mat/9807183","Andrew Kent","U. Ruediger, J. Yu, S. S. P. Parkin and A. D. Kent","Magnetoresistance of Epitaxial Fe Wires with Varied Domain Wall
  Structure","To appear in Journal of Magnetism and Magnetic Materials, 3 pages, 3
  figures and a table","JMMM 198-199, 261 (1999)","10.1016/S0304-8853(98)01090-7","ADK-698","cond-mat.mes-hall",,"  The low temperature negative domain wall (DW) contribution to the resistivity
observed in expitaxial Fe microstructures has been investigated as a function
of film thickness. The DW spin structure changes from Bloch to Neel-like with
decreasing film thickness. Results suggest that an interplay between orbital
effects in the internal magnetic fields near DWs and thin film surface
scattering are at the origin of the observed negative wall contribution.
","[{""version"":""v1"",""created"":""Mon, 13 Jul 1998 15:20:32 GMT""}]","2009-10-31"
"cond-mat/9807184","Oshanin","G.Oshanin(1), S.Nechaev(2,3), A.M.Cazabat(4) and M.Moreau(1) ((1)
  LPTL, Universite de Paris VI, France; (2) IPN, Orsay, France and Landau
  Institute, Moscow, Russia; (3) LPMC, College de France, Paris, France)","Kinetics of Anchoring of Polymer Chains on Substrates with Chemically
  Active Sites","Latex file, 19 pages, one ps figure, to appear in PRE","Phys. Rev. E 58, 6134 (1998)","10.1103/PhysRevE.58.6134",,"cond-mat.soft cond-mat.mtrl-sci",,"  We consider dynamics of an isolated polymer chain with a chemically active
end-bead on a 2D solid substrate containing immobile, randomly placed
chemically active sites (traps). For a particular situation when the end-bead
can be irreversibly trapped by any of these sites, which results in a complete
anchoring of the whole chain, we calculate the time evolution of the
probability $P_{ch}(t)$ that the initially non-anchored chain remains mobile
until time $t$. We find that for relatively short chains $P_{ch}(t)$ follows at
intermediate times a standard-form 2D Smoluchowski-type decay law $ln P_{ch}(t)
\sim - t/ln(t)$, which crosses over at very large times to the
fluctuation-induced dependence $ln P_{ch}(t) \sim - t^{1/2}$, associated with
fluctuations in the spatial distribution of traps. We show next that for long
chains the kinetic behavior is quite different; here the intermediate-time
decay is of the form $ln P_{ch}(t) \sim - t^{1/2}$, which is the
Smoluchowski-type law associated with subdiffusive motion of the end-bead,
while the long-time fluctuation-induced decay is described by the dependence
$ln P_{ch}(t) \sim - t^{1/4}$, stemming out of the interplay between
fluctuations in traps distribution and internal relaxations of the chain.
","[{""version"":""v1"",""created"":""Mon, 13 Jul 1998 15:23:44 GMT""}]","2009-10-31"
"hep-lat/9807027","E. Terry Tomboulis","T. G. Kov\'acs (U. of Colorado) and E. T. Tomboulis (UCLA)","Vortices and the SU(3) string tension","8 pages, LaTeX file with 6 eps figures","Phys.Lett. B443 (1998) 239-243","10.1016/S0370-2693(98)01312-4","UCLA/98/TEP/15, COLO-HEP-412","hep-lat",,"  We present simulation results comparing the SU(3) heavy quark potential
extracted from the full Wilson loop expectation to that extracted from the
expectation of the Wilson loop fluctuation solely by elements of Z(3). The two
potentials are found to coincide. This agreement is stable under multiple
smoothings of the configurations which remove short distance fluctuations, and
thus reflects long-distance physics. It strongly indicates that the asymptotic
string tension arises from thick center vortices linking with the Wilson loop.
","[{""version"":""v1"",""created"":""Mon, 13 Jul 1998 00:59:53 GMT""}]","2009-10-31"
"hep-lat/9807029","Pavlos Vranas","P. Chen, N. Christ, G. Fleming, A. Kaehler, C. Malureanu, R.
  Mawhinney, C. Sui, P. Vranas and Y. Zhestkov","Domain wall fermion zero modes on classical topological backgrounds","Updated fig. 3-7, small changes in sect. 3, added fig. 8, added more
  references","Phys.Rev. D59 (1999) 054508","10.1103/PhysRevD.59.054508","CU-TP-906","hep-lat",,"  The domain wall approach to lattice fermions employs an additional dimension,
in which gauge fields are merely replicated, to separate the chiral components
of a Dirac fermion. It is known that in the limit of infinite separation in
this new dimension, domain wall fermions have exact zero modes, even for gauge
fields which are not smooth. We explore the effects of finite extent in the
fifth dimension on the zero modes for both smooth and non-smooth topological
configurations and find that a fifth dimension of around ten sites is
sufficient to clearly show zero mode effects. This small value for the extent
of the fifth dimension indicates the practical utility of this technique for
numerical simulations of QCD.
","[{""version"":""v1"",""created"":""Mon, 13 Jul 1998 03:20:13 GMT""},{""version"":""v2"",""created"":""Thu, 24 Sep 1998 18:31:40 GMT""}]","2009-10-31"
"hep-lat/9807030","Andras Pap","A. Pap and P. Suranyi","Simulation of an Abelian Higgs theory in world line (polymer)
  representation","14 pages with 6 figures",,,"UCTP-110-98","hep-lat",,"  In World Line Path Integral representation Abelian Higgs theories admit a
curvature term in the Hamiltonian. Using Monte Carlo simulations we show that
the curvature term drives a phase transition at sufficiently strong coupling.
In quenched approximation this phase transition is smooth, with implications
that the model reduces to a Goldstone theory. Critical properties of the system
near the transition are investigated and found to be consistent with mean field
behavior.
","[{""version"":""v1"",""created"":""Mon, 13 Jul 1998 13:42:17 GMT""}]","2007-05-23"
"hep-ph/9807347","Gorbunov","S.L.Dubovsky, D.S.Gorbunov","Flavor violation and $\tan{\beta}$ in gauge mediated models with
  messenger-matter mixing","25 pages, 3 figures; the cases of high and low $\tan{\beta}$ are
  considered separately, the limits are stronger for high $\tan{\beta}$","Nucl.Phys. B557 (1999) 119-145","10.1016/S0550-3213(99)00346-6","INR-SD-14-98","hep-ph",,"  We consider the Minimal Gauge Mediated Model (MGMM) with either fundamental
or antisymmetric messenger multiplets and study consequences of
messenger-matter mixing. We find that in these models, unlike MGMM without
mixing, wide range of $\tan\beta$ is allowed. It is shown that existing
experimental limits on processes with lepton flavor violation, and on
$K^0-\bar{K}^0$, $D^0-\bar{D}^0$ and $B^0-\bar{B}^0$ - mixing place significant
constraints on relevant coupling constants and mixing parameters. On the other
hand, the contributions of the messenger-matter mixing to the rates of $\tau
\to e\gamma$, $\tau \to \mu\gamma$ and $b\to s\gamma$ may be well below the
present experimental limits depending on the value of $\tan\beta$. We also
point out the possibility of sizeable slepton oscillations in this model.
","[{""version"":""v1"",""created"":""Sun, 12 Jul 1998 19:47:34 GMT""},{""version"":""v2"",""created"":""Fri, 19 Mar 1999 17:16:21 GMT""}]","2009-10-31"
"hep-ph/9807349","Hong-Jian He","C. Balazs, J.L. Diaz-Cruz, H.-J. He, T. Tait, C.-P. Yuan","Probing Higgs Bosons with Large Bottom Yukawa Coupling at Hadron
  Colliders","Version to be published in Phys. Rev. D, RevTex, 52 pages, including
  16 EPS figures, typos corrected plus minor refinements for discussions","Phys.Rev.D59:055016,1999","10.1103/PhysRevD.59.055016","MSUHEP-80515, FermiLab-Pub-98/182-T, ANL-HEP-PR-98-55","hep-ph",,"  The small mass of the bottom quark, relative to its weak isospin partner, the
top quark, makes the bottom an effective probe of new physics in Higgs and top
sectors. We study the Higgs boson production associated with bottom quarks,
ppbar/pp to phi+b+bbar to 4b, at the Fermilab Tevatron and the CERN LHC. We
find that strong and model-independent constraints on the size of the
phi-b-bbar coupling can be obtained for a wide range of Higgs boson masses.
Their implications for the composite Higgs models with strong dynamics
associated with the third family quarks (such as the top-condensate/topcolor
models with naturally large bottom Yukawa couplings), and for the
supersymmetric models with large tan(beta), are analyzed. We conclude that the
Tevatron and the LHC can put stringent bounds on these models, if the
phi+b+bbar signal is not found.
","[{""version"":""v1"",""created"":""Mon, 13 Jul 1998 04:42:51 GMT""},{""version"":""v2"",""created"":""Tue, 14 Jul 1998 00:12:52 GMT""},{""version"":""v3"",""created"":""Tue, 17 Nov 1998 05:11:35 GMT""}]","2009-09-25"
"hep-ph/9807350",,"C. Hamzaoui, M. Pospelov and M. Toharia","Higgs-mediated FCNC in Supersymmetic Models with Large $\tan\beta$","15 pages, latex, 3 figures","Phys.Rev. D59 (1999) 095005","10.1103/PhysRevD.59.095005",,"hep-ph",,"  In the supersymmetric models with nontrivial flavour structure in the
soft-breaking sector the exchange of neutral Higgses mediates $\Delta F=2$
transitions. This mechanism is studied for $\Delta S, \Delta B=2$ processes and
for a generic form of the soft-breaking terms. We find that Higgs-mediated FCNC
amplitudes increase very rapidly with $\tan\beta$ and can exceed $SUSY$ box
contribution by up to two orders of magnitude when $\tan\beta\sim m_t/m_b$.
","[{""version"":""v1"",""created"":""Mon, 13 Jul 1998 04:36:25 GMT""}]","2009-10-31"
"hep-ph/9807351","Joern Knoll","Yu. B. Ivanov, J. Knoll and D. N. Voskresensky","Self-Consistent Approximations to Non-Equilibrium Many-Body Theory","31 pages, Latex elsart-style","Nucl.Phys.A657:413-445,1999","10.1016/S0375-9474(99)00313-9","GSI-Preprint-98-34","hep-ph cond-mat.stat-mech nucl-th",,"  Within the non-equilibrium Green's function technique on the real time
contour, the Phi-functional method of Baym is reviewed and generalized to
arbitrary non-equilibrium many-particle systems. The scheme may be closed at
any desired order in the number of loops or vertices of the generating
functional. It defines effective theories, which provide a closed set of
coupled classical field and Dyson equations, which are self-consistent,
conserving and thermodynamically consistent. The approach permits to include
unstable particles and therefore unifies the description of resonances with all
other particles, which obtain a mass width by collisions, decays or creation
processes in dense matter. The inclusion of classical fields enables the
treatment of soft modes and phase instabilities. The method can be taken as a
starting point for adequate and consistent quantum improvements of the
in-medium rates in transport theories.
","[{""version"":""v1"",""created"":""Mon, 13 Jul 1998 09:56:01 GMT""}]","2008-11-26"
