"astro-ph/9807122","Philip Mannheim","Philip D. Mannheim (University of Connecticut)","How We Got Into The Dark Matter Fix And How We Can Get Out","LaTeX, 5 pages. To appear in the Proceedings of ""PASCOS 98"", the 6th
  International Symposium on Particles, Strings and Cosmology, Northeastern
  University, Boston, March 1998",,,,"astro-ph gr-qc hep-ph",,"  The recent discovery of cosmic repulsion represents a major challenge to
standard gravity, adding an apparent missing energy problem to its still not
yet adequately resolved missing mass one, while simultaneously requiring the
current universe to be a very special, fine-tuned one. We suggest that the
resolution of these difficulties lies not in the existence of more and more
exotic gravitational sources, but rather in the lack of reliability of the
extrapolation of standard gravity from its solar system origins to the
altogether larger distance scales associated with cosmology. We suggest a very
different such extrapolation, namely that associated with conformal gravity, to
find that all of these issues are then readily and naturally resolved.
","[{""version"":""v1"",""created"":""Mon, 13 Jul 1998 16:24:43 GMT""}]","2007-05-23"
"astro-ph/9807123","Marcus Bruggen","M.Cunha, M.Bruggen, D.O.Gough","On Solar Frequency Changes","6 pages, 5 figures, to appear in Structure and Dynamics of the
  Interior of the Sun and Sun-like Stars (Eds. S.G. Korzennik & A. Wilson), ESA
  SP- 418, ESA Publications Division, Noordwijk, The Netherlands (1998)",,,,"astro-ph",,"  The structure of the surface layers of the Sun is changed by magnetic
activity which, in turn, changes the eigenfrequencies of the acoustic modes.
These frequency shifts have been observed both in low- and high-degree data,
and are found to be correlated with the solar cycle. Time-distance
helioseismology has shown that waves travelling through sunspots suffer time
delays. Also it is known that sunspots induce phase shifts between inwardly and
outwardly propagating waves.
  In the present work we show how these phase shifts are related to the
observed time delays by treating the scattering of acoustic waves off sunspots
as a diffraction problem.
  These time delays are then related to the frequency shifts of the modes. From
this relation we obtain a lower limit for the contribution of sunspots to the
observed frequency variations with the solar cycle. Moreover, we predict the
frequency dependence of the time delays suffered by rays travelling through a
sunspot.
","[{""version"":""v1"",""created"":""Mon, 13 Jul 1998 16:41:03 GMT""}]","2007-05-23"
"astro-ph/9807124","John Blakeslee","John P. Blakeslee, Edward A. Ajhar, John L. Tonry","Distances from Surface Brightness Fluctuations","Invited review article to appear in: `Post-Hipparcos Cosmic Candles',
  A. Heck & F. Caputo (Eds), Kluwer Academic Publ., Dordrecht, in press. 22
  pages, including 3 postscript figures; uses Kluwer's crckapb.sty LaTex macro
  file, enclosed",,"10.1007/978-94-011-4734-7_11",,"astro-ph",,"  The practice of measuring galaxy distances from their spatial fluctuations in
surface brightness is now a decade old. While several past articles have
included some review material, this is the first intended as a comprehensive
review of the surface brightness fluctuation (SBF) method. The method is
conceptually quite simple, the basic idea being that nearby (but unresolved)
star clusters and galaxies appear ""bumpy"", while more distant ones appear
smooth. This is quantified via a measurement of the amplitude of the Poisson
fluctuations in the number of unresolved stars encompassed by a CCD pixel
(usually in an image of an elliptical galaxy). Here, we describe the technical
details and difficulties involved in making SBF measurements, discuss
theoretical and empirical calibrations of the method, and review the numerous
applications of the method from the ground and space, in the optical and
near-infrared. We include discussions of stellar population effects and the
""universality"" of the SBF standard candle. A final section considers the future
of the method.
","[{""version"":""v1"",""created"":""Mon, 13 Jul 1998 17:33:55 GMT""}]","2016-01-27"
"astro-ph/9807125","Douglas C.-J. Bock","D. C.-J. Bock, A. J. Turtle, and A. J. Green","A high-resolution radio survey of the Vela supernova remnant","18 pages, 7 jpg figures (version with ps figures at
  http://astro.berkeley.edu/~dbock/papers/); AJ, in press","Astron.J. 116 (1998) 1886","10.1086/300563","ADP 26/98","astro-ph",,"  This paper presents a high-resolution radio continuum (843 MHz) survey of the
Vela supernova remnant. The contrast between the structures in the central
pulsar-powered nebula of the remnant and the synchrotron radiation shell allows
the remnant to be identified morphologically as a member of the composite
class. The data are the first of a composite remnant at spatial scales
comparable with those available for the Cygnus Loop and the Crab Nebula, and
make possible a comparison of radio, optical and soft X-ray emission from the
resolved shell filaments. The survey, made with the Molonglo Observatory
Synthesis Telescope, covers an area of 50 square degrees at a resolution of
43'' x 60'', while imaging structures on scales up to 30'.
","[{""version"":""v1"",""created"":""Mon, 13 Jul 1998 19:13:53 GMT""}]","2009-10-30"
"astro-ph/9807126","Luisa Rebull","L. M. Rebull, D. K. Duncan, S. Johansson, J. Thorburn, and B. Fields","Limits on the Boron Isotopic Ratio in HD 76932","Accepted for Nov 1998 ApJ",,"10.1086/306315",,"astro-ph",,"  Data in the 2090 A B region of HD 76932 have been obtained at high S/N using
the HST GHRS echelle at a resolution of 90,000. This wavelength region has been
previously identified as a likely candidate for observing the B11/B10 isotopic
splitting.
  The observations do not match a calculated line profile extremely well at any
abundance for any isotopic ratio. If the B abundance previously determined from
observations at 2500 A is assumed, the calculated line profile is too weak,
indicating a possible blending line. Assuming that the absorption at 2090 A is
entirely due to boron, the best-fit total B abundance is higher than but
consistent with that obtained at 2500 A, and the best-fit isotopic ratio
(B11/B10) is in the range ~10:1 to ~4:1. If the absorption is not entirely due
to B and there is an unknown blend, the best-fit isotopic ratio may be closer
to 1:1. Future observations of a similar metal-poor star known to have
unusually low B should allow us to distinguish between these two possibilities.
The constraints that can be placed on the isotopic ratio based on comparisons
with similar observations of HD 102870 and HD 61421 (Procyon) are also
discussed.
","[{""version"":""v1"",""created"":""Mon, 13 Jul 1998 21:06:25 GMT""}]","2009-10-30"
"astro-ph/9807127","Hugo Martel","Premana W. Premadi (Tohoku University), Hugo Martel (University of
  Texas) and Richard A. Matzner (University of Texas)","Light Propagation in inhomogeneous Universes","2 pages, gzip'ed tar file, including Latex source file, and style
  files. To be published in the proceedings of the Tokyo conference on
  Numerical Astrophysics (1998)",,,,"astro-ph",,"  Using a multi-plane lensing method that we have developed, we follow the
evolution of light beams as they propagate through inhomogeneous universes. We
use a P3M code to simulate the formation and evolution of large-scale
structure. The resolution of the simulations is increased to sub-Megaparsec
scales by using a Monte Carlo method to locate galaxies inside the
computational volume according to the underlying particle distribution.
  We consider cold dark matter models normalized to COBE, and perform a large
parameter survey by varying the cosmological parameters Omega_0, lambda_0, H_0,
and n (the tilt of the primordial power spectrum).
","[{""version"":""v1"",""created"":""Mon, 13 Jul 1998 22:20:47 GMT""}]","2007-05-23"
"astro-ph/9807128","Joanne D. Cohn","J.D. Cohn","Living with Lambda","16 pages, uses epsfig,prd, aps style files, 5 figures included in
  text, final version to appear as invited review in Astrophysics and Space
  Science","Astrophys.J.Suppl. 259 (1998) 213","10.1023/A:1001796011627","UIUC-THC/98/6","astro-ph gr-qc hep-ph",,"  A short pedagogical note about the consequences of a nonzero cosmological
constant in physical cosmology.
","[{""version"":""v1"",""created"":""Mon, 13 Jul 1998 22:42:34 GMT""},{""version"":""v2"",""created"":""Mon, 26 Oct 1998 20:26:39 GMT""}]","2009-10-30"
"astro-ph/9807129","Hugo Martel","Premana W. Premadi (Tohoku University), Hugo Martel (University of
  Texas) and Richard A. Matzner (University of Texas)","Light Propagation in inhomogeneous Universes","3 pages, gzip'ed tar file, including TeX source (not Latex). To be
  published in a periodical of the Yukawa Institute for Theoretical Physics
  (1998)",,"10.1007/978-94-011-4780-4_7",,"astro-ph",,"  Using a multi-plane lensing method that we have developed, we follow the
evolution of light beams as they propagate through inhomogeneous universes. We
use a P3M code to simulate the formation and evolution of large-scale
structure. The resolution of the simulations is increased to sub-Megaparsec
scales by using a Monte Carlo method to locate galaxies inside the
computational volume according to the underlying particle distribution. The
galaxies are approximated by isothermal spheres, with each morphological type
having its own distribution of masses and core radii. The morphological types
are chosen in order to reproduce the observed morphology-density relation. This
algorithm has an effective resolution of 9 orders of magnitudes in length, from
the size of superclusters down to the core radii of the smallest galaxies.
  We consider cold dark matter models normalized to COBE, and perform a large
parameter survey by varying the cosmological parameters Omega_0, lambda_0, H_0,
and n (the tilt of the primordial power spectrum). The values of n are chosen
by imposing particular values or sigma_8, the rms mass fluctuation at a scale
of 8/h Mpc. We use the power spectrum given by Bunn & White. This is the
largest parameter survey ever done is this field.
","[{""version"":""v1"",""created"":""Mon, 13 Jul 1998 22:56:17 GMT""}]","2016-01-27"
"astro-ph/9807131","Chris Churchill","Christopher W. Churchill (1), Jane R. Rigby (1), Jane C. Charlton (1),
  and Steven S. Vogt (2) ((1) Penn State University, (2) UCO/Lick UCSC)","The Population of Weak Mg II Absorbers I. A Survey of 26 QSO HIRES/Keck
  Spectra","Accepted Version: 43 pages, PostScript figures embedded; accepted to
  ApJ; updated version includes analysis of CIV absorption","Astrophys.J.Suppl. 120 (1999) 51","10.1086/313168",,"astro-ph",,"  We present a search for ""weak"" MgII absorbers [those with W_r(2796) < 0.3 A
in the HIRES/Keck spectra of 26 QSOs. We found 30, of which 23 are newly
discovered. The spectra are 80% complete to W_r(2796) = 0.02 A and have a
cumulative redshift path of ~17.2 for the redshift range 0.4 < z < 1.4. The
number of absorbers per unit redshift, dN/dz, is seen to increase as the
equivalent width threshold is decreased; we obtained dN/dz = 1.74+/-0.10 for
our 0.02 <= W_r(2796) < 0.3 A sample. The equivalent width distribution follows
a power law with slope -1.0; there is no turnover down to W_r(2796) = 0.02 A at
<z> = 0.9. Weak absorbers comprise at least 65% of the total MgII absorption
population, which outnumbers Lyman limit systems (LLS) by a factor of
3.8+/-1.1; the majority of weak MgII absorbers must arise in sub-LLS
environments. Tentatively, we predict that ~5% of the Lyman-alpha forest clouds
with W_r(1215) > 0.1 A will have detectable MgII absorption to W_r,min(2796) =
0.02 A and that this is primarily a high-metallicity selection effect (Z/Z_sun]
> -1). This implies that MgII absorbing structures figure prominently as
tracers of sub-LLS environments where gas has been processed by stars. We
compare the number density of W_r(2796) > 0.02 A absorbers with that of both
high and low surface brightness galaxies and find a fiducial absorber size of
35h^-1 to 63h^-1 kpc, depending upon the assumed galaxy population and their
absorption properties. The individual absorbing ""clouds"" have W_r(2796) <= 0.15
A and their narrow (often unresolved) line widths imply temperatures of ~25,000
K. We measured W_r(1548) from CIV in FOS/HST archival spectra and, based upon
comparisons with FeII, found a range of ionization conditions (low, high, and
multi-phase) in absorbers selected by weak MgII.
","[{""version"":""v1"",""created"":""Tue, 14 Jul 1998 00:48:14 GMT""},{""version"":""v2"",""created"":""Mon, 10 Aug 1998 15:46:52 GMT""}]","2009-10-30"
"astro-ph/9807132","Kienzle Francesco","F. Kienzle, P. Moskalik, D. Bersier, F. Pont","Structural Properties of s-Cepheid Velocity Curves","8 pages, 6 figures, accepted by Astronomy and Astrophysics",,,,"astro-ph",,"  The light curves of the first overtone Pop. I Cepheids (s-Cepheids) show a
discontinuity in their phi_21 vs. P diagram, near P=3.2 day. This feature,
commonly attributed to the 2:1 resonance between the first and the fourth
overtones (omega_4=2 omega_1), is not reproduced by the hydrodynamical models.
With the goal of reexamining the resonance hypothesis, we have obtained new
CORAVEL radial velocity curves for 14 overtone Cepheids. Together with 10
objects of Krzyt et al. (1999), the combined sample covers the whole range of
overtone Cepheid periods. The velocity Fourier parameters display a strong
characteristic resonant behavior. In striking contrast to photometric ones,
they vary smoothly with the pulsation period and show no jump at 3.2 day. The
existing radiative hydrodynamical models match the velocity parameters very
well. The center of the omega_4 = 2 omega_1 resonance is estimated to occur at
P_r = 4.58+-0.04 day, i.e. at a period considerably longer than previously
assumed (3.2 day). We identify two new members of the s-Cepheid group: MY Pup
and V440 Per.
","[{""version"":""v1"",""created"":""Tue, 14 Jul 1998 07:38:55 GMT""},{""version"":""v2"",""created"":""Thu, 22 Oct 1998 15:19:27 GMT""}]","2007-05-23"
"astro-ph/9807133","Itay Furman","O.Biham, I.Furman, N.Katz, V. Pirronello and G. Vidali","H2 Formation on Interstellar Grains in Different Physical Regimes","4 pages, MN style","Mon. Not. R. Astron. Soc, Vol. 296, 869 (1998)","10.1046/j.1365-8711.1998.01427.x",,"astro-ph physics.chem-ph",,"  An analysis of the kinetics of H2 formation on interstellar dust grains is
presented using rate equations. It is shown that semi-empirical expressions
that appeared in the literature represent two different physical regimes. In
particular, it is shown that the expression given by Hollenbach, Werner and
Salpeter [ApJ, 163, 165 (1971)] applies when high flux, or high mobility, of H
atoms on the surface of a grain, makes it very unlikely that H atoms evaporate
before they meet each other and recombine. The expression of Pirronello et al.\
[ApJ, 483, L131 (1997)] -- deduced on the basis of accurate measurements on
realistic dust analogue -- applies to the opposite regime (low coverage and low
mobility). The implications of this analysis for the understanding of the
processes dominating in the Interstellar Medium are discussed.
","[{""version"":""v1"",""created"":""Tue, 14 Jul 1998 08:30:44 GMT""}]","2009-10-30"
"astro-ph/9807134","A. Dolgov","A.D. Dolgov","Nonequilibrium cosmic neutrinos and nucleosynthesis","20 pages, latex twice. Presented at the Yanada conference ``Black
  Holes and High Energy Astrophysics'', Kyoto, April, 1998 (to be published in
  the Proceedings)",,,,"astro-ph hep-ph",,"  The neutrino role in primordial nucleosynthesis is reviewed. The importance
of nonequilibrium effects is emphasized both for the standard massless and
possibly massive neutrinos. The upper bound on tau neutrino mass is presented.
A spatial variation of primordial abundances and a possibility of observing
them by precise measurements of the CMB anisotropy are considered.The
nucleosynthesis bounds on the parameters of neutrino oscillations into sterile
neutrinos are discussed.
","[{""version"":""v1"",""created"":""Tue, 14 Jul 1998 11:04:07 GMT""}]","2007-05-23"
"astro-ph/9807135","Norbert Christlieb","D. Reimers, S. Jordan, V. Beckmann, N. Christlieb and L. Wisotzki","Four magnetic DB white dwarfs discovered by the Hamburg/ESO survey","4 pages plus 2 Postscript figures. A&A Letters, in press",,,"We don't have official report numbers, so take: Norbi 08-15/4711","astro-ph",,"  We report on seven peculiar faint blue stars found in the course of the
Hamburg/ESO survey (HES) which appear to be magnetic white dwarfs (WDs) with
non-hydrogen spectra. We show in particular that four of them (HE 0338-3853, HE
0107-0158, HE 0026-2150, and HE 0003-5701) have He I lines split by magnetic
fields of roughly 20MG, since the \pi components of He I 5876 Angstroem and He
I 4929 Angstroem can be identified unambiguously in their spectra, and the
$\sigma^+$, $\sigma^-$ components can be identified in the spectra of two of
these stars (HE 0338-3853 and HE 0003-5701). Besides GD 229, these are the
first magnetic DB white dwarfs discovered so far.
  In addition, three further WDs with broad, unidentifiable features have been
found: HE 1043-0502, HE 0236-2656, and HE 0330-0002. We argue that in all three
of these stars H I can not be responsible for the broad features, and He I most
probably not for the features in HE 0236-2656 and HE 0330-0002, while it still
remains possible that the broad features of HE 1043-0502 are due to He I.
","[{""version"":""v1"",""created"":""Tue, 14 Jul 1998 11:55:50 GMT""}]","2007-05-23"
"astro-ph/9807136","Roger Coziol","R. Coziol (ON), C. A. O. Torres (LNA/CNPq), G. R. Quast (LNA/CNPq), T.
  Contini (School of Physics & Astronomy, Tel Aviv Univ.), E. Davoust
  (Observatoire Midi-Pyrenees)","The PDS starburst galaxies","38 pages including 4 tables, 7 postscript figures. To appear in ApJS,
  December 1998 Vol. 119 #2 issue",,,,"astro-ph",,"  (Abridged) We discuss the nature of the galaxies found in the Pico dos Dias
Survey (PDS) for young stellar objects. The PDS galaxies were selected from the
IRAS Point Source catalog. They have flux density of moderate or high quality
at 12, 25 and 60 $\mu$m and spectral indices in the ranges $-3.00 \leq
\alpha(25,12) \leq +0.35$ and $-2.50 \leq \alpha(60,25) \leq +0.85$. These
criteria allowed the detection of 382 galaxies, which are a mixture of
starburst and Seyfert galaxies.
  The starburst galaxies show an excess of FIR luminosity and their IRAS colors
are significantly different from those of Seyfert galaxies -- 99% of the
starburst galaxies in our sample have a spectral index $\alpha(60,25) < -1.9$.
As opposed to Seyfert galaxies, very few PDS starbursts are detected in X-rays.
  In the infrared, the starburst galaxies form a continuous sequence with
normal galaxies. But they generally can be distinguished from normal galaxies
by their spectral index $\alpha(60,25) > -2.5$. This color cut--off also marks
a change in the dominant morphologies of the galaxies: the normal IRAS galaxies
are preferentially late--type spirals (Sb and later), while the starbursts are
more numerous among early--type spirals (earlier than Sbc).
  No difference is found between the starbursts detected in the FIR and those
detected on the basis of UV excess. The PDS starburst galaxies represent the
FIR luminous branch of the UV-bright starburst nucleus galaxies, with mean FIR
luminosity $\log({\rm L}_{\rm IR}/{\rm L}_\odot) = 10.3 \pm 0.5$ and redshifts
smaller than 0.1. They form a complete sample limited in flux in the FIR at
$2\times10^{-10}$ erg cm$^{-2}$ s$^{-1}$.
","[{""version"":""v1"",""created"":""Tue, 14 Jul 1998 12:42:43 GMT""}]","2007-05-23"
"astro-ph/9807137","Patrick McDonald","Patrick McDonald and Jordi Miralda-Escude","Measuring the Cosmological Geometry from the Lyman Alpha Forest along
  Parallel Lines of Sight","submitted to ApJ",,"10.1086/307264",,"astro-ph",,"  We discuss the feasibility of measuring the cosmological metric using the
redshift space correlation function of the Lya forest in multiple lines of
sight, as a function of angular and velocity separation. The geometric
parameter that is measured is f(z) = H(z) D(z)/c, where H(z) is the Hubble
constant and D(z) the angular diameter distance at redshift z. The correlation
function is computed in linear theory. We describe a method to measure it from
observations with the Gaussianization procedure of Croft et al (1998) to map
the Lya forest transmitted flux to an approximation of the linear density
field. The effect of peculiar velocities on the shape of the recovered power
spectrum is pointed out. We estimate the error in recovering the f(z) factor
from observations due to the variance in the Lya absorbers. We show that ~ 20
pairs of quasars (separations < 3') are needed to distinguish a flat \Omega_0=1
universe from a universe with \Omega_0=0.2, \Omega_\Lambda=0.8. A second
parameter that is obtained from the correlation function of the Lya forest is
\beta \simeq \Omega(z)^{0.6}/b (affecting the magnitude of the peculiar
velocities), where b is a linear theory bias of the Lya forest. The statistical
error of f(z) is reduced if b can be determined independently from numerical
simulations, reducing the number of quasar pairs needed for constraining
cosmology to approximately six. On small scales, where the correlation function
is higher, f(z) should be measurable with fewer quasars, but non-linear effects
must then be taken into account. The anisotropy of the non-linear redshift
space correlation function as a function of scale should also provide a precise
quantitative test of the gravitational instability theory of the Lya forest.
","[{""version"":""v1"",""created"":""Tue, 14 Jul 1998 13:30:26 GMT""}]","2009-10-30"
"astro-ph/9807138","Sylos-Labini Francesco","Luciano Pietronero and Francesco Sylos Labini","Scale invariance in galaxy structures: general concepts and application
  to the most recent data","30 pages, latex, 9 postscript figures,also available at
  http://www.phys.uniroma1.it/DOCS/PIL/pil.html. To appear in the proceedings
  of the ""VI Colloque de Cosmologie"" Paris 4-6 June 1998",,,,"astro-ph",,"  The debate on the correlation properties of galaxy structures has having an
increasing interest during the last year. In this lecture we discuss the claims
of different authors who have criticized our approach and results. In order to
have a clear cut of the situation, we focus mainly on galaxy distribution in
the intermediate range of distances ~ 100 - 200 Mpc/h. In particular we
discuss: (i) the validity of the actual data and the concept of ""fair sample"",
(ii) the shift of r_0 with sample depth and luminosity bias, (iii) the value of
the fractal dimension, (iv) the problem of the counts from a single point and
the case of ESP, (iv) uniformity of angular catalogs. The detection of fractal
behavior up to ~ 100 - 200 Mpc/h is enough to rise serious problems to the
usual statistical methods used for the characterization of galaxy correlations,
standard interpretation of galaxy distribution and theoretical models develoed.
The clarification of the intermediate scale behavior is very instructive for
the subsequent interpretation of the very large scale galaxy distribution.
","[{""version"":""v1"",""created"":""Tue, 14 Jul 1998 13:48:42 GMT""}]","2007-05-23"
"astro-ph/9807139","Andrei Beloborodov","A.M. Beloborodov, B.E. Stern, R. Svensson","Self-Similar Temporal Behavior of Gamma-Ray Bursts","accepted to ApJ Letters","Astrophys.J. 508 (1998) L25-L27","10.1086/311710",,"astro-ph",,"  We apply Fourier analysis to 214 light curves of long gamma-ray bursts and
study the statistical properties of their power density spectra (PDSs). The
averaged PDS is found to follow a power law of index -5/3 over almost 2 decades
of frequency with a break at about 2 Hz. Individual PDSs are exponentially
distributed around the power law. It provides evidence that the diversity of
the bursts is due to random realizations of the same process which is
self-similar over the full range of time-scales. The -5/3 slope of the average
spectrum may indicate that gamma-ray bursts are related to a phenomenon well
studied in hydrodynamics - fully developed turbulence.
","[{""version"":""v1"",""created"":""Tue, 14 Jul 1998 14:09:35 GMT""},{""version"":""v2"",""created"":""Thu, 11 Mar 1999 09:53:54 GMT""}]","2009-10-30"
"cmp-lg/9807003","Daniel Hardt","Daniel Hardt","Centering in Dynamic Semantics",,"Proceedings of COLING 96, Copenhagen, Denmark",,,"cmp-lg cs.CL",,"  Centering theory posits a discourse center, a distinguished discourse entity
that is the topic of a discourse. A simplified version of this theory is
developed in a Dynamic Semantics framework. In the resulting system, the
mechanism of center shift allows a simple, elegant analysis of a variety of
phenomena involving sloppy identity in ellipsis and ``paycheck pronouns''.
","[{""version"":""v1"",""created"":""Tue, 14 Jul 1998 09:08:33 GMT""}]","2007-05-23"
