"cond-mat/9807207","Uwe Taeuber","Uwe C. T\""auber (TU M\""unchen), Jaime E. Santos (TU M\""unchen), and
  Zolt\'an R\'acz (University of Oxford and E""otv""os University Budapest)","Non-equilibrium critical behavior of O(n)-symmetric systems: Effect of
  reversible mode-coupling terms and dynamical anisotropy","EPJ style LaTex2e (style files included), 22 pages, eps file for one
  figure included; final version (misprints corrected), to appear in EPJB","Eur. Phys. J. B 7 (1999) 309; e: Eur. Phys. J. B 9 (1999) 567",,,"cond-mat.stat-mech",,"  Phase transitions in non-equilibrium steady states of O(n)-symmetric models
with reversible mode couplings are studied using dynamic field theory and the
renormalization group. The systems are driven out of equilibrium by dynamical
anisotropy in the noise for the conserved quantities, i.e., by constraining
their diffusive dynamics to be at different temperatures T^\par and T^\perp in
d_\par- and d_\perp-dimensional subspaces, respectively. In the case of the
Sasv'ari-Schwabl-Sz'epfalusy (SSS) model for planar ferro- and isotropic
antiferromagnets, we assume a dynamical anisotropy in the noise for the
non-critical conserved quantities that are dynamically coupled to the
non-conserved order parameter. We find the equilibrium fixed point (with
isotropic noise) to be stable with respect to these non-equilibrium
perturbations, and the familiar equilibrium exponents therefore describe the
asymptotic static and dynamic critical behavior. Novel critical features are
only found in extreme limits, where the ratio of the effective noise
temperatures T^\par/T^\perp is either zero or infinite. On the other hand, for
model J for isotropic ferromagnets with a conserved order parameter, the
dynamical noise anisotropy induces effective long-range elastic forces, which
lead to a softening only of the d_\perp-dimensional sector in wavevector space
with lower noise temperature T^\perp < T^\par. The ensuing static and dynamic
critical behavior is described by power laws of a hitherto unidentified
universality class, which, however, is not accessible by perturbational means
for d_\par \geq 1. We obtain formal expressions for the novel critical
exponents in a double expansion about the static and dynamic upper critical
dimensions and d_\par, i.e., about the equilibrium theory.
","[{""version"":""v1"",""created"":""Tue, 14 Jul 1998 13:14:11 GMT""},{""version"":""v2"",""created"":""Mon, 28 Sep 1998 08:37:17 GMT""}]","2011-12-24"
"cond-mat/9807208","Henrik Bruus","Peter Boggild, Anders Kristensen, Henrik Bruus, Stephanie M. Reimann,
  and Poul Erik Lindelof","Periodic magnetoconductance fluctuations in triangular quantum dots in
  the absence of selective probing","RevTex 8 pages, including 5 postscript figures","Phys. Rev. B 57, 15408 (1998)","10.1103/PhysRevB.57.15408",,"cond-mat.mes-hall",,"  We have studied the magnetoconductance of quantum dots with triangular
symmetry and areas down to 0.2 square microns, made in a high mobility
two-dimensional electron gas embedded in a GaAs-AlGaAs heterostructure.
Semiclassical simulations show that the gross features in the measured
magnetoconductance are caused by ballistic effects. Below 1 K we observe a
strong periodic oscillation, which may be explained in terms of the
Aharanov-Bohm flux quantization through the area of a single classical periodic
orbit. From a numerical and analytical analysis of possible trajectories in
hard- and soft-walled potentials, we identify this periodic orbit as the
enscribed triangle. Contrary to other recent experiments, this orbit is not
accessible by classical processes for the incoming collimated beam.
","[{""version"":""v1"",""created"":""Tue, 14 Jul 1998 13:27:01 GMT""}]","2009-10-31"
"cond-mat/9807209","Jai Seok Ahn","J. S. Ahn, J. Bak, H. S. Choi, T. W. Noh (Seoul Nat'l U., Korea), J.
  E. Han (Max-Planck Inst., Germany), Yunkyu Bang (Chonnam Nat'l U., Korea), J.
  H. Cho (Pusan Nat'l U., Korea), and Q. X. Xia (LANL, USA)","Spectral evolution in (Ca,Sr)RuO_3 near the Mott-Hubbard transition","REVTEX 4 pages, 5 EPS figures, submitted to Phys. Rev. Lett",,"10.1103/PhysRevLett.82.5321",,"cond-mat.str-el",,"  We investigated the optical properties of (Ca,Sr)RuO_3 films on the
borderline of a metal-insulator (M-I) transition. Our results show all of the
predicted characteristics for a metallic Mott-Hubbard system, including (i) a
mass enhancement in dc-limit, (ii) an U/2 excitation, and (iii) an U
excitation. Also, a self-consistency is found within the
Gutzwiller-Brinkman-Rice picture for the Mott transition. Our finding displays
that electron correlation should be important even in 4d materials.
","[{""version"":""v1"",""created"":""Tue, 14 Jul 1998 15:48:42 GMT""}]","2009-10-31"
"cond-mat/9807210","H. Rieger","H. Rieger","Ground state properties of fluxlines in a disordered environment","4 pages RevTeX, 3 eps-figures included","Phys. Rev. Lett. 81, 4488 (1998)","10.1103/PhysRevLett.81.4488","HLRZ-40/98","cond-mat.supr-con cond-mat.dis-nn",,"  A new numerical method to calculate exact ground states of multi-fluxline
systems with quenched disorder is presented, which is based on the minimum cost
flow algorithm from combinatorial optimization. We discuss several models that
can be studied with this method including their specific implementations,
physically relevant observables and results: 1) the N-line model with N
fluxlines (or directed polymers) in a d-dimensional environment with point
and/or columnar disorder and hard or soft core repulsion; 2) the vortex glass
model for a disordered superconductor in the strong screening limit and 3) the
Sine-Gordon model with random pase shifts in the strong coupling limit.
","[{""version"":""v1"",""created"":""Tue, 14 Jul 1998 15:37:41 GMT""}]","2009-10-31"
"cond-mat/9807211","Yuhai Tu","Yuhai Tu, J. Tersoff, G. Grinstein and David Vanderbilt","Properties of a continuous-random-network model for amorphous systems","Revtex file with 4 figures",,"10.1103/PhysRevLett.81.4899",,"cond-mat.stat-mech cond-mat.mtrl-sci",,"  We use a Monte Carlo bond-switching method to study systematically the
thermodynamic properties of a ""continuous random network"" model, the canonical
model for such amorphous systems as a-Si and a-SiO$_2$. Simulations show
first-order ""melting"" into an amorphous state, and clear evidence for a glass
transition in the supercooled liquid. The random-network model is also extended
to study heterogeneous structures, such as the interface between amorphous and
crystalline Si.
","[{""version"":""v1"",""created"":""Tue, 14 Jul 1998 14:50:08 GMT""}]","2009-10-31"
"cond-mat/9807212","Fred Hucht","P. B\""odeker, A. Hucht, A. Schreyer, J. Borchers, F. G\""uthoff, H.
  Zabel","Reorientation of Spin Density Waves in Cr(001) Films induced by Fe(001)
  Cap Layers","4 pages (RevTeX), 3 figures (EPS)","Phys. Rev. Lett. 81, 914 (1998)","10.1103/PhysRevLett.81.914",,"cond-mat.mtrl-sci cond-mat.stat-mech",,"  Proximity effects of 20 \AA thin Fe layers on the spin density waves (SDWs)
in epitaxial Cr(001) films are revealed by neutron scattering. Unlike in bulk
Cr we observe a SDW with its wave vector Q pointing along only one {100}
direction which depends dramatically on the film thickness t_{Cr}. For t_{Cr} <
250 \AA the SDW propagates out-of-plane with the spins in the film plane. For
t_{Cr} > 1000 \AA the SDW propagates in the film plane with the spins
out-of-plane perpendicular to the in-plane Fe moments. This reorientation
transition is explained by frustration effects in the antiferromagnetic
interaction between Fe and Cr across the Fe/Cr interface due to steps at the
interface.
","[{""version"":""v1"",""created"":""Tue, 14 Jul 1998 14:50:54 GMT""},{""version"":""v2"",""created"":""Wed, 23 Sep 1998 17:19:56 GMT""}]","2009-10-31"
"hep-ph/9807348","Raman Sundrum","Raman Sundrum","Compactification for a Three-Brane Universe","Latex, 18 pages","Phys.Rev.D59:085010,1999","10.1103/PhysRevD.59.085010","BUHEP-98-20","hep-ph gr-qc hep-th",,"  A fully realistic and systematic effective field theory model of a 3-brane
universe is constructed. It consists of a six-dimensional gravitating
spacetime, containing several, approximately parallel (3+1)-dimensional
defects, or ``3-branes''. The Standard Model particles are confined to live on
one of the 3-branes while different four-dimensional field theories may inhabit
the others, in literally a case of ``parallel universes''. The effective field
theory is valid up to the six-dimensional Planck scale, where it must be
replaced by a more fundamental theory of gravity and 3-brane structure. Each
3-brane induces a conical geometry in the two dimensions transverse to it.
Collectively, the curvature induced by the 3-branes can compactify the extra
dimensions into a space of spherical topology. It is possible to take the
six-dimensional Planck scale to be not much larger than the weak scale, and the
compact space not much smaller than a millimeter, thereby realizing the recent
proposal by Arkani-Hamed, Dimopoulos and Dvali for eliminating the Gauge
Hierearchy Problem. In this case, an extra force is required to stabilize the
compact space against collapse. This is provided by a six-dimensional (compact)
U(1) gauge field with a magnetic flux quantum trapped in the compact space. The
nature of the Cosmological Constant Problem in this scenario is discussed.
","[{""version"":""v1"",""created"":""Mon, 13 Jul 1998 20:56:54 GMT""}]","2009-09-15"
"hep-ph/9807354","Andre Likhoded","V.V. Kiselev, A.K. Likhoded, A.I. Onishchenko","Lifetimes of doubly charmed baryons: $\Xi_{cc}^{+}$ and $\Xi_{cc}^{++}$","15 pages, Latex file, 3eps figes","Phys.Rev. D60 (1999) 014007","10.1103/PhysRevD.60.014007","DESY-98-079","hep-ph",,"  We have performed a detailed investigation of total lifetimes for the
$\Xi_{cc}^{++}$ and $\Xi_{cc}^{+}$ baryons in the framework of operator product
expansion over the inverse mass of charmed quark, whereas, to estimate matrix
elements of operators obtained in OPE, some approximations of nonrelativistic
QCD are used. This approach allows one to take into account the corrections to
the spectator decays of $c$-quarks, which reflect the fact, that these quarks
are bound, as well as the contributions, connected to the effects of both the
Pauli interference for the $\Xi_{cc}^{++}$-baryon and the weak scattering for
the $\Xi_{cc}^{+}$-baryon. The realization of such program leads to the
following estimates for the total lifetimes of doubly charmed baryons:
$\tau_{\Xi_{cc}^{++}}=0.43\pm 0.1~ps$ and $\tau_{\Xi_{cc}^{+}}=0.11\pm
0.01~ps$.
","[{""version"":""v1"",""created"":""Mon, 13 Jul 1998 17:00:56 GMT""}]","2009-10-31"
"hep-ph/9807360","Villante Francesco","F.L. Villante, G. Fiorentini, E. Lisi","Solar neutrino interactions: Using charged currents at SNO to tell
  neutral currents at Super-Kamiokande","14 pages (RevTeX), incl. 3 figures (epsf), submitted to Phys. ReV. D","Phys.Rev.D59:013006,1999","10.1103/PhysRevD.59.013006","INFNFE-06-98, BARI-TH/306-98","hep-ph astro-ph",,"  In the presence of flavor oscillations, muon and tau neutrinos can contribute
to the Super-Kamiokande (SK) solar neutrino signal through the neutral current
process \nu_{\mu,\tau} e^{-}\to \nu_{\mu,\tau} e^{-}. We show how to separate
the \nu_e and \nu_{\mu,\tau} event rates in SK in a model independent way, by
using the rate of the charged current process \nu_e d \to p p e^{-} from the
Sudbury Neutrino Observatory (SNO) experiment, with an appropriate choice of
the SK and SNO energy thresholds. Under the additional hypothesis of no
oscillations into sterile states, we also show how to determine the absolute
^{8}B neutrino flux from the same data set, independently of the \nu_e survival
probability.
","[{""version"":""v1"",""created"":""Mon, 13 Jul 1998 16:21:10 GMT""}]","2009-10-07"
"hep-ph/9807361","Emilio Torrente Lujan","E. Torrente-Lujan","Finite dimensional systems with random external fields and Neutrino
  propagation in fluctuating media","12 pags., Latex. 1 fig., ps. epsfig macro. minor typo errors
  corrected","Phys.Rev.D59:073001,1999","10.1103/PhysRevD.59.073001","IFIC-9831, FTUV-9831, PETL-9801","hep-ph",,"  We develop the general formalism for the study of neutrino propagation in
presence of stochastic media. This formalism allows the systematic derivation
of evolution equations for averaged quantities as survival probabilities and
higher order distribution moments. The formalism applies equally to any finite
dimensional Schroedinger equation in presence of a stochastic external force.
New integro-differential equations valid for finite correlated processes are
obtained for the first time. For the particular case of exponentially
correlated processes a second order ordinary equation is obtained. As a
consequence, the Redfield equation valid for Gaussian delta-correlated noise is
rederived in a simple way. The formalism, together with the quantum correlation
theorem is applied to the computation of higher moments and correlation
functions of practical interest in forthcoming high precision neutrino
experiments. It is shown that equal and not equal time correlators follow
similar differential equations.
","[{""version"":""v1"",""created"":""Mon, 13 Jul 1998 19:08:49 GMT""},{""version"":""v2"",""created"":""Fri, 17 Jul 1998 15:05:54 GMT""},{""version"":""v3"",""created"":""Fri, 31 Jul 1998 15:47:13 GMT""}]","2009-12-30"
"hep-ph/9807362","Juergen Berges","J. Berges","QCD at high Baryon Density and Temperature: Competing Condensates and
  the Tricritical Point","Talk given at the Workshop on QCD at Finite Baryon Density: A Complex
  System with a Complex Action, Bielefeld, Germany, 27-30 Apr 1998; 7 pages;
  references added","Nucl.Phys.A642:51-57,1998","10.1016/S0375-9474(98)00498-9","MIT-CTP-2758","hep-ph",,"  The phase diagram of strongly interacting matter is explored as a function of
temperature and baryon number density. We investigate the possible simultaneous
formation of condensates in the conventional quark--anti-quark channel
(breaking chiral symmetry) and in a quark--quark channel leading to color
superconductivity: the spontaneous breaking of color symmetry via the formation
of quark Cooper pairs. We point out that for two massless quark flavors a
tricritical point in the phase diagram separates a chiral symmetry restoring
first order transition at high densities from the second order transition at
high temperatures. Away from the chiral limit this tricritical point becomes a
second order phase transition with Ising model exponents, suggesting that a
long correlation length may develop in heavy ion collisions in which the phase
transition is traversed at the appropriate density.
","[{""version"":""v1"",""created"":""Mon, 13 Jul 1998 18:26:48 GMT""},{""version"":""v2"",""created"":""Thu, 16 Jul 1998 15:29:55 GMT""}]","2010-02-04"
"hep-ph/9807363","Photis Moulatsiotis","Mark Hindmarsh and Photis Moulatsiotis (Sussex)","Constraints on Axion Models from $K^+\to\pi^+ a$","15pp RevTeX, 1 eps fig, uses graphics style. Expanded discussion on
  massive scalars and pseudoscalars, typos. To appear in Physical Review D","Phys. Rev. D 59, 055015 (1999)","10.1103/PhysRevD.59.055015","SUSX-TH-98-017","hep-ph",,"  We explore a new class of axion models in which some, but not all, of the
left-handed quarks have a Peccei-Quinn symmetry. These models are potentially
afflicted by flavour changing neutral currents. We derive the bounds on the
Peccei-Quinn symmetry-breaking scale from bounds on the $K^+\to \pi^+ a$
branching ratio, showing that in some cases they are even stronger than the
astrophysical ones, but still not strong enough to kill off the models.
","[{""version"":""v1"",""created"":""Mon, 13 Jul 1998 18:48:12 GMT""},{""version"":""v2"",""created"":""Wed, 16 Dec 1998 11:13:51 GMT""}]","2016-08-25"
"hep-ph/9807364","Joao P. Silva","A. Amorim, Mario G. Santos and Joao P. Silva","New CP-violating parameters in cascade decays","22 pages, latex, 5 figures, corrected missing signs in the discussion
  of the CP conservation limit","Phys.Rev. D59 (1999) 056001","10.1103/PhysRevD.59.056001","CFNUL/98-07","hep-ph",,"  We consider decay chains of the type P -> M + ... -> f + ..., where M is a
neutral meson that may mix with its antiparticle Mbar, before decaying into the
final state f. P may be either a heavier neutral meson or a charged meson. We
perform a rephasing-invariant analysis of the quantities that show up in such
cascade decays. If the decay P -> M + ... (or the decay P -> Mbar + ...) is
forbidden, we find the usual lambda_f parameters describing the interference
between the mixing of a neutral meson system and the decay from that system
into the final state f. However, when both the P -> M + ... and P -> Mbar + ...
decays are allowed, we find a new class of rephasing-invariant parameters,
xi_i, that measure the interference between the mixing of a neutral meson
system and the decay from the initial state *into that system*. We show that
the quantities lambda_f and xi_i are necessary and sufficient to describe all
the interference effects present in the most general cascade decay. We discuss
the various cascade decays in turn, highlighting the special features of each
one.
","[{""version"":""v1"",""created"":""Mon, 13 Jul 1998 22:14:53 GMT""},{""version"":""v2"",""created"":""Tue, 8 Sep 1998 19:54:07 GMT""}]","2009-10-31"
"hep-ph/9807365","Atsushi Hosaka","A. Hosaka (Numazu College of Technology)","Phenomenological Study of Excited Baryons","9 pages, 2 eps figures ""Talk given at the workshop Future Directions
  in Quark Nuclear Physics"", Adelaide, March (1998)",,,,"hep-ph",,"  We study baryon excited states for quark confinement and chiral symmetry
breaking. In the first part we discuss spatially deformed baryon excitations.
As signals of deformation, we study masses and electromagnetic transitions.
Such a study of spatial structure is expected to provide information on quark
binding mechanism and hence quark confinement. In the second part, we consider
the chiral symmetry for baryons and study positive and negative parity baryons.
We show that there are two distinctive representations of chiral symmetry for
baryons. We investigate their phenomenological consequences in terms of linear
sigma models.
","[{""version"":""v1"",""created"":""Tue, 14 Jul 1998 03:09:00 GMT""}]","2007-05-23"
"hep-ph/9807366","Francesco Murgia","Mauro Anselmino (1) and Francesco Murgia (2) ((1) University and INFN,
  Torino, Italy, (2) University and INFN, Cagliari, Italy)","Single spin asymmetries and vector meson production in DIS","5 pages, LaTeX, no figures; talk delivered by M. Anselmino at the
  Workshop on ""Physics and Instrumentation with 6-12 GeV Beams"", June 15-18,
  1998, Jefferson Lab, Newport News, Virginia",,,"DFTT 38/98, INFNCA-TH9808","hep-ph",,"  We discuss possible measurements and origins of single spin asymmetries in
DIS and of some unusual spin properties of vector mesons produced in lepton-
nucleon, photon-nucleon and photon-photon interactions. Such effects have
already been observed in other processes.
","[{""version"":""v1"",""created"":""Tue, 14 Jul 1998 08:20:17 GMT""}]","2007-05-23"
"hep-ph/9807367","Thorsten Feldmann","Thorsten Feldmann (Univ. Wuppertal)","Mixing and decay constants of pseudoscalar mesons: Octet-singlet vs.
  quark flavor basis","4 pages Latex, uses espcrc2.sty, contribution to ""QCD 98"",
  Montpellier 2-8 July 1998","Nucl.Phys.Proc.Suppl. 74 (1999) 151-154","10.1016/S0920-5632(99)00152-8","WUB 98-25","hep-ph hep-ex nucl-th",,"  Although eta-eta' mixing is qualitatively well understood as a consequence of
the U(1)_A anomaly in QCD together with a broken SU(3) flavor symmetry, until
recently the values of decay and mixing parameters of the eta and eta' were
only approximately known, e.g. values for the octet-singlet mixing angle
between -20 degrees and -10 degrees could be found in the literature. New
experimental data, especially for the reactions gamma gamma* -> eta, eta' and B
-> eta' K, together with new theoretical results from higher order corrections
in chiral perturbation theory stimulated a phenomenological re-analysis of this
subject, which led to a coherent qualitative and quantitative picture of
eta-eta' mixing and even of eta-eta'-eta_c mixing.
","[{""version"":""v1"",""created"":""Tue, 14 Jul 1998 09:00:15 GMT""}]","2009-10-31"
"hep-ph/9807368","Yurii Shil'nov","E. Elizalde, S. P. Gavrilov, S. D. Odintsov, Yu. I. Shil'nov","Dynamical symmetry restoration for a higher-derivative four-fermion
  model in an external electromagnetic field","LaTeX, 14 pages, 4 ps-figures","Braz.J.Phys.30:573-580,2000","10.1590/S0103-97332000000300015",,"hep-ph hep-th",,"  A four-fermion model with additional higher-derivative terms is investigated
in an external electromagnetic field. The effective potential in the leading
order of large-N expansion is calculated in external constant magnetic and
electric fields.
  It is shown that, in contrast to the former results concerning the universal
character of ""magnetic catalysis"" in dynamical symmetry breaking, in the
present higher-derivative model the magnetic field restores chiral symmetry
broken initially on the tree level. Numerical results describing a second-order
phase transition that accompanies the symmetry restoration at the quantum level
are presented.
","[{""version"":""v1"",""created"":""Tue, 14 Jul 1998 11:19:54 GMT""}]","2017-08-23"
"hep-ph/9807369","Andreas Vogt","Andreas Vogt (W""urzburg Univ.)","DIS'98 Structure Functions Summary, Part II","9 pages Latex including 5 figures (9 eps-files), uses sprocl.sty.
  Talk presented at DIS'98, Brussels, April 1998. To appear in the proceedings",,,"WUE-ITP-98-031","hep-ph",,"  Recent results presented in the structure functions working group are briefly
summarized for the following topics: The theoretical treatment of heavy quarks
in structure functions, higher-order corrections for the leading-twist
evolution (including small-x resummations), the present status of the proton's
parton densities, and the impact of higher twists on determinations of the
strong coupling constant. The reader is referred to Part I for accounts of the
transition to the photoproduction region, pion and photon structure results,
and high-Q^2 phenomena.
","[{""version"":""v1"",""created"":""Tue, 14 Jul 1998 14:49:04 GMT""}]","2007-05-23"
"hep-th/9807091","Matthias R. Gaberdiel","Matthias R. Gaberdiel and Horst G. Kausch","A Local Logarithmic Conformal Field Theory","29 pages, LaTeX, minor changes, reference added","Nucl.Phys.B538:631-658,1999","10.1016/S0550-3213(98)00701-9","DAMTP-1998-74, DTP-98/37","hep-th",,"  The local logarithmic conformal field theory corresponding to the triplet
algebra at c=-2 is constructed. The constraints of locality and crossing
symmetry are explored in detail, and a consistent set of amplitudes is found.
The spectrum of the corresponding theory is determined, and it is found to be
modular invariant. This provides the first construction of a non-chiral
rational logarithmic conformal field theory, establishing that such models can
indeed define bona fide conformal field theories.
","[{""version"":""v1"",""created"":""Mon, 13 Jul 1998 19:14:43 GMT""},{""version"":""v2"",""created"":""Thu, 8 Oct 1998 13:58:27 GMT""}]","2011-09-29"
"hep-th/9807092","Kirill Krasnov","Laurent Freidel and Kirill Krasnov (Penn State)","Spin Foam Models and the Classical Action Principle","65 pages, many figures (published version)","Adv.Theor.Math.Phys.2:1183-1247,1999",,"CGPG-98/4-5","hep-th gr-qc",,"  We propose a new systematic approach that allows one to derive the spin foam
(state sum) model of a theory starting from the corresponding classical action
functional. It can be applied to any theory whose action can be written as that
of the BF theory plus a functional of the B field. Examples of such theories
include BF theories with or without cosmological term, Yang-Mills theories and
gravity in various spacetime dimensions. Our main idea is two-fold. First, we
propose to take into account in the path integral certain distributional
configurations of the B field in which it is concentrated along lower
dimensional hypersurfaces in spacetime. Second, using the notion of generating
functional we develop perturbation expansion techniques, with the role of the
free theory played by the BF theory. We test our approach on various theories
for which the corresponding spin foam (state sum) models are known. We find
that it exactly reproduces the known models for BF and 2D Yang-Mills theories.
For the BF theory with cosmological term in 3 and 4 dimensions we calculate the
terms of the transition amplitude that are of the first order in the
cosmological constant, and find an agreement with the corresponding first order
terms of the known state sum models. We discuss implications of our results for
existing quantum gravity models.
","[{""version"":""v1"",""created"":""Mon, 13 Jul 1998 21:54:01 GMT""},{""version"":""v2"",""created"":""Fri, 14 May 1999 14:24:56 GMT""}]","2008-11-26"
