"cond-mat/9807176","Viatcheslav V. Dobrovitski","M. I. Katsnelson, V. V. Dobrovitski and B. N. Harmon","Many-Spin Interactions and Spin Excitations in Mn12","REVTeX, 9 pages, 4 figures","Phys. Rev. B 59, No. 10, 6919 - 6926 (1 March 1999-II)","10.1103/PhysRevB.59.6919",,"cond-mat.mtrl-sci",,"  In this work, the many-spin interactions taking place in Mn12 large-spin
clusters are extensively studied using the 8-spin model Hamiltonian, for which
we determine the possible parameters based on experimental data. Account of the
many-spin excitations satisfactorily explains positions of the neutron
scattering peaks, results of EPR measurements and the temperature dependence of
magnetic susceptibility. In particular, strong Dzyaloshinsky-Morya interactions
are found to be important for description of neutron scattering data. The role
of these interactions for the relaxation of the magnetization is qualitatively
discussed.
","[{""version"":""v1"",""created"":""Mon, 13 Jul 1998 17:30:15 GMT""}]","2009-10-31"
"cond-mat/9807185","A. S. Alexandrov","A.S. Alexandrov","Comment on `Experimental and Theoretical Constraints of Bipolaronic
  Superconductivity in High $T_{c}$ Materials: An Impossibility'","1 page, no figures",,"10.1103/PhysRevLett.82.2620",,"cond-mat.supr-con",,"  We show that objections raised by Chakraverty $et$ $al$ (Phys. Rev. Lett. 81,
433 (1998)) to the bipolaron model of superconducting cuprates are the result
of an incorrect approximation for the bipolaron energy spectrum and misuse of
the bipolaron theory. The consideration, which takes into account the multiband
energy structure of bipolarons and the unscreened electron-phonon interaction
clearly indicates that cuprates are in the Bose-Einstein condensation regime
with mobile charged bosons.
","[{""version"":""v1"",""created"":""Mon, 13 Jul 1998 16:48:15 GMT""}]","2009-10-31"
"cond-mat/9807186","Bruce Normand","G. S. Uhrig and B. Normand","Magnetic Properties of (VO)_2P_2O_7 from Frustrated Interchain Coupling","RevTeX, 5 pages, 6 figures, compressed from first version","PRB 58, R14705 (1998)","10.1103/PhysRevB.58.R14705",,"cond-mat.str-el",,"  Neutron-scattering experiments on (VO)_2P_2O_7 reveal both a gapped magnon
dispersion and an unexpected, low-lying second mode. The proximity and
intensity of these modes suggest a frustrated coupling between the alternating
spin chains. We deduce the minimal model containing such a frustration, and
show that it gives an excellent account of the magnon dispersion, static
susceptibility and electron spin resonance absorption. We consider two-magnon
states which bind due to frustration, and demonstrate that these may provide a
consistent explanation for the second mode.
","[{""version"":""v1"",""created"":""Mon, 13 Jul 1998 17:00:13 GMT""},{""version"":""v2"",""created"":""Fri, 11 Dec 1998 19:24:11 GMT""}]","2009-10-31"
"cond-mat/9807187","Dmitri A. Ivanov","D. A. Ivanov and Patrick A. Lee","Staggered-spin contribution to nuclear spin-lattice relaxation in
  two-leg antiferromagnetic spin-1/2 ladders","6 pages, 2 figures, REVTeX, uses epsf","Phys. Rev. B 59, 4803 (1999)","10.1103/PhysRevB.59.4803",,"cond-mat",,"  We study the nuclear spin-lattice relaxation rate $1/T_1$ in the two-leg
antiferromagnetic spin-1/2 Heisenberg ladder. More specifically, we consider
the contribution to $1/T_1$ from the processes with momentum transfer
$(\pi,\pi)$. In the limit of weak coupling between the two chains, this
contribution is of activation type with gap $2\Delta$ at low temperatures
($\Delta$ is the spin gap), but crosses over to a slowly-decaying temperature
dependence at the crossover temperature $T\approx\Delta$. This crossover
possibly explains the recent high-temperature NMR results on ladder-containing
cuprates by T. Imai et al.
","[{""version"":""v1"",""created"":""Mon, 13 Jul 1998 17:37:03 GMT""}]","2009-10-31"
"cond-mat/9807188","Rava da Silveira","Rava da Silveira and Mehran Kardar","Critical Hysteresis for n-Component Magnets","Some brief clarifications added in the text; to appear in Phys. Rev.
  E",,,,"cond-mat.stat-mech cond-mat.dis-nn",,"  Earlier work on dynamical critical phenomena in the context of magnetic
hysteresis for uniaxial (scalar) spins, is extended to the case of a
multicomponent (vector) field. From symmetry arguments and a perturbative
renormalization group approach (in the path integral formalism), it is found
that the generic behavior at long time and length scales is described by the
scalar fixed point (reached for a given value of the magnetic field and of the
quenched disorder), with the corresponding Ising-like exponents. By tuning an
additional parameter, however, a fully rotationally invariant fixed point can
be reached, at which all components become critical simultaneously, with
O(n)-like exponents. Furthermore, the possibility of a spontaneous
non-equilibrium transverse ordering, controlled by a distinct fixed point, is
unveiled and the associated exponents calculated. In addition to these central
results, a didactic ``derivation'' of the equations of motion for the spin
field are given, the scalar model is revisited and treated in a more direct
fashion, and some issues pertaining to time dependences and the problem of
multiple solutions within the path integral formalism are clarified.
","[{""version"":""v1"",""created"":""Mon, 13 Jul 1998 18:59:55 GMT""},{""version"":""v2"",""created"":""Thu, 5 Nov 1998 16:27:38 GMT""}]","2016-08-31"
"cond-mat/9807189","Piet Brouwer","P. W. Brouwer, C. Mudry, B. D. Simons, and A. Altland","Delocalization in coupled one-dimensional chains","4 pages, RevTeX; 1 figure included; to appear in Phys. Rev. Letters","Phys. Rev. Lett. 81, 862 (1998)","10.1103/PhysRevLett.81.862",,"cond-mat.dis-nn cond-mat.mes-hall",,"  A weakly disordered quasi-one-dimensional tight-binding hopping model with
$N$ rows is considered. The probability distribution of the Landauer
conductance is calculated exactly in the middle of the band, $\epsilon=0$, and
it is shown that a delocalization transition at this energy takes place if and
only if $N$ is odd. This even-odd effect is explained by level repulsion of the
transmission eigenvalues.
","[{""version"":""v1"",""created"":""Mon, 13 Jul 1998 19:51:06 GMT""}]","2009-10-31"
"cond-mat/9807190","Vincenzo Fiorentini","Antonella Fara, Fabio Bernardini (INFM Cagliari), Vincenzo Fiorentini
  (INFM Cagliari and WSI Munich)","Theoretical evidence for the semi-insulating character of AlN","RevTeX 3 pages, 1 figure",,"10.1063/1.369197",,"cond-mat.mtrl-sci",,"  We present ab initio density-functional calculations for acceptors, donors,
and native defects in aluminum nitride, showing that acceptors are deeper (Be ~
0.25 eV, Mg_ 0.45 eV) and less soluble than in GaN; at further variance with
GaN, both the extrinsic donors Si_Al and C_Al, and the native donor V_N (the
anion vacancy) are found to be deep (about 1 to 3 eV below the conduction). We
thus predict that doped AlN will generally turn out to be semi-insulating in
the normally achieved Al-rich conditions, in agreement with the known doping
difficulties of high-x AlGaN alloys.
","[{""version"":""v1"",""created"":""Mon, 13 Jul 1998 20:23:21 GMT""}]","2009-10-31"
"cond-mat/9807191","Joseph Rudnick","Joseph Rudnick and Robijn Bruinsma (Department of Physics, UCLA)","DNA-Protein Cooperative Binding through Long-Range Elastic Coupling","21 pages LATEX, 9 eps figures. Submitted to Biophysical Journal",,"10.1016/S0006-3495(99)77334-0",,"cond-mat.soft physics.bio-ph q-bio.BM",,"  Cooperativity plays an important role in the action of proteins bound to DNA.
A simple, mechanical mechanism for cooperativity, in the form of a
tension-mediated interaction between proteins bound to DNA at two different
locations is proposed. These proteins are not in direct physical contact. DNA
segments intercalating bound proteins are modeled as a Worm-Like Chain, which
is free to deform in two dimensions. The tension-controlled protein-protein
interaction is the consequence of two effects produced by the protein binding.
The first is the introduction of a bend in the host DNA and the second is the
modification of the bending modulus of the DNA in the immediate vicinity of the
bound protein. The interaction between two bound proteins may be either
attractive or repulsive, depending on their relative orientation on the DNA.
Applied tension controls both the strength and the range of protein-protein
interactions in this model. Properties of the cooperative interaction are
discussed, along with experimental implications.
","[{""version"":""v1"",""created"":""Mon, 13 Jul 1998 21:13:50 GMT""}]","2009-10-31"
"cond-mat/9807192","Priya Mahadevan","D.D. Sarma and Priya Mahadevan (Solid State and Structural Chemistry
  Unit, Indian Institute of Science, Bangalore, India)","Auger transition from orbitally degenerate systems: Effects of screening
  and multielectron excitations","To appear in Phy. Rev. Lett",,"10.1103/PhysRevLett.81.1658",,"cond-mat.str-el",,"  We calculate Auger spectra given by the two-hole Green's function from
orbitally degenerate Hubbard-like models as a function of correlation strength
and band filling. The resulting spectra are qualitatively different from those
obtained from fully-filled singly degenerate models due to the presence of
screening dynamics and multielectron excitations. Application to a real system
shows remarkable agreement with experimental results leading to
reinterpretation of spectral features.
","[{""version"":""v1"",""created"":""Tue, 14 Jul 1998 03:15:13 GMT""}]","2009-10-31"
"cond-mat/9807193","Kahng Byung Nam","S. Park and B. Kahng","Nonequilibrium roughening transition by two-species particles","4 pages, source TeX file and 3 PS figures are tarred and compressed
  via uufiles",,,,"cond-mat.stat-mech",,"  We introduce an interface growth model exhibiting a nonequilibrium roughening
transition (NRT). In the model, particles consist of two species, and deposit
or evaporate on one dimensional substrate according to a given dynamic rule.
When the dynamics is limited to occur on monolayer, this model has two
absorbing states, belonging to the directed Ising (DI) universality class. At
criticality, the density of vacant sites at the bottom layer in the growth
model decays faster than the DI behavior, however, the dynamic exponent is
close to the DI value, suggesting that the dynamics is related to the DI
universality class. We also consider an asymmetric version of the growth
dynamics, which is according to the directed percolation behavior.
","[{""version"":""v1"",""created"":""Tue, 14 Jul 1998 04:53:11 GMT""},{""version"":""v2"",""created"":""Mon, 9 Nov 1998 10:05:31 GMT""}]","2007-05-23"
"cond-mat/9807194","Jeong Hawoong","H. Jeong, B. Kahng and D. Kim","Facet Formation in the Negative Quenched Kardar-Parisi-Zhang Equation","4 pages, source TeX file and 7 PS figures are tarred and compressed
  via uufiles",,"10.1103/PhysRevE.59.1570",,"cond-mat.stat-mech",,"  The quenched Kardar-Parisi-Zhang (QKPZ) equation with negative non-linear
term shows a first order pinning-depinning (PD) transition as the driving force
$F$ is varied. We study the substrate-tilt dependence of the dynamic transition
properties in 1+1 dimensions. At the PD transition, the pinned surfaces form a
facet with a characteristic slope $s_c$ as long as the substrate-tilt $m$ is
less than $s_c$. When $m<s_c$, the transition is discontinuous and the critical
value of the driving force $F_c(m)$ is independent of $m$, while the transition
is continuous and $F_c(m)$ increases with $m$ when $m>s_c$. We explain these
features from a pinning mechanism involving a localized pinning center and the
self-organized facet formation.
","[{""version"":""v1"",""created"":""Tue, 14 Jul 1998 05:02:36 GMT""}]","2009-10-31"
"cond-mat/9807195","Ilya V. Ponomarev","I. V. Ponomarev, V. V. Flambaum, O. P. Sushkov","Spin-spin interaction and magnetic state of 2-D Wigner crystal","RevTeX, 9 pages, 4 figures, Submitted to Phys. Rev. B",,,"unsw-98029","cond-mat.str-el",,"  It is demonstrated that there is anti-ferromagnetic spin-spin interaction
between nearest electrons in the 2D Wigner crystal. This is also valid for the
Wigner liquid - the state with destroyed long-range order but preserved
short-range one. We calculate the value of the anti-ferromagnetic interaction
(both analytically and numerically) and discuss a possible magnetic state of
the Wigner crystal. This state can be strongly influenced by the spin-Peierls
mechanism.
","[{""version"":""v1"",""created"":""Tue, 14 Jul 1998 07:21:54 GMT""}]","2007-05-23"
"cond-mat/9807196","Vladimir Osipov","V.A.Osipov and S.E.Krasavin","Towards the grain boundary phonon scattering problem: an evidence for a
  low-temperature crossover","4 pages, 2 figures, submitted to J.Phys.:Condens.Matter","J.Phys.:Cond.Mat. 10, L639 (1998)","10.1088/0953-8984/10/36/002",,"cond-mat.mtrl-sci",,"  The problem of phonon scattering by grain boundaries is studied within the
wedge disclination dipole (WDD) model. It is shown that a specific q-dependence
of the phonon mean free path for biaxial WDD results in a low-temperature
crossover of the thermal conductivity, $\kappa$. The obtained results allow to
explain the experimentally observed deviation of $\kappa$ from a $T^3$
dependence below $0.1K$ in $LiF$ and $NaCl$.
","[{""version"":""v1"",""created"":""Tue, 14 Jul 1998 09:22:07 GMT""}]","2009-10-31"
"cond-mat/9807197","Dr. Juergen Schnack","K. Baerwinkel, J. Schnack and U. Thelker (U. of Osnabrueck)","Quasi-Particle Picture for Monatomic Gases","11 pages, 2 postscript figures, uses 'epsfig.sty'. Submitted to
  PHYSICA A. More information available at
  http://obelix.physik.uni-osnabrueck.de/~schnack/","Physica A 262 (1999) 496-504",,,"cond-mat.stat-mech",,"  A quasi-particle theory for monatomic gases in equilibrium is formulated and
evaluated to yield the exact virial contributions to the thermodynamic state
functions in lowest order of the density. Van der Waals blocking has
necessarily to be accounted for in occupation number statistics. The
quasi-particle distribution function differs from the Wigner function by a
bilinear functional thereof. The progress made so far is promising with respect
to a corresponding version of kinetic theory.
","[{""version"":""v1"",""created"":""Tue, 14 Jul 1998 09:14:14 GMT""}]","2007-05-23"
"cond-mat/9807198","Max Petersen","Jianjun Xie, Stefano de Gironcoli, Stefano Baroni, and Matthias
  Scheffler","Temperature dependent surface relaxations of Ag(111)","6 pages, 7 figures, submitted to Phys. Rev. B (May 1998). Other
  related publications can be found at
  http://www.rz-berlin.mpg.de/th/paper.html",,"10.1103/PhysRevB.59.970",,"cond-mat",,"  The temperature dependent surface relaxation of Ag(111) is calculated by
density-functional theory. At a given temperature, the equilibrium geometry is
determined by minimizing the Helmholtz free energy within the quasiharmonic
approximation. To this end, phonon dispersions all over the Brillouin zone are
determined from density-functional perturbation theory. We find that the
top-layer relaxation of Ag(111) changes from an inward contraction (-0.8 %) to
an outward expansion (+6.3%) as the temperature increases from T=0 K to 1150 K,
in agreement with experimental findings. Also the calculated surface phonon
dispersion curves at room temperature are in good agreement with helium
scattering measurements. The mechanism driving this surface expansion is
analyzed.
","[{""version"":""v1"",""created"":""Tue, 14 Jul 1998 09:38:16 GMT""}]","2009-10-31"
"cond-mat/9807199","Vincenzo Fiorentini","Alessio Filippetti (UC Davis) and Vincenzo Fiorentini (INFM
  Cagliari/WSI Munich)","Faceting and stress transfer in the missing-row reconstruction of Ir
  (110)","RevTeX 4 pages, 3 figures",,,,"cond-mat.mtrl-sci",,"  We present ab initio total energy and stress calculations for the
unreconstructed and (2x1)-missing-row reconstructed Ir (110) and Rh (110)
surfaces. We use a model based on ab initio results to show that the (Nx1)
reconstruction is a faceting transition to a long-wavelength--corrugated
(111)-like surface, and find the 3x1 structure to be the most stable for Ir in
accordance with experiment. We then use the stress density to analyze the
stress increase upon reconstruction, and find it to be due to a changed balance
of tensile and compressive contributions in the near-surface region.
","[{""version"":""v1"",""created"":""Tue, 14 Jul 1998 09:35:17 GMT""}]","2007-05-23"
"cond-mat/9807200","Max Petersen","N. Moll, M. Scheffler, and E. Pehlke","The influence of surface stress on the equilibrium shape of strained
  quantum dots","7 pages, 8 figures, submitted to Phys. Rev. B (February 2, 1998).
  Other related publications can be found at
  http://www.rz-berlin.mpg.de/th/paper.html",,"10.1103/PhysRevB.58.4566",,"cond-mat.mtrl-sci",,"  The equilibrium shapes of InAs quantum dots (i.e., dislocation-free, strained
islands with sizes >= 10,000 atoms) grown on a GaAs (001) substrate are studied
using a hybrid approach which combines density functional theory (DFT)
calculations of microscopic parameters, surface energies, and surface stresses
with elasticity theory for the long-range strain fields and strain relaxations.
In particular we report DFT calculations of the surface stresses and analyze
the influence of the strain on the surface energies of the various facets of
the quantum dot. The surface stresses have been neglected in previous studies.
Furthermore, the influence of edge energies on the island shapes is briefly
discussed. From the knowledge of the equilibrium shape of these islands, we
address the question whether experimentally observed quantum dots correspond to
thermal equilibrium structures or if they are a result of the growth kinetics.
","[{""version"":""v1"",""created"":""Tue, 14 Jul 1998 09:58:19 GMT""},{""version"":""v2"",""created"":""Wed, 15 Jul 1998 09:02:52 GMT""}]","2009-10-31"
"cond-mat/9807201","Aste Tomaso","Tomaso Aste and David Sherrington","Glass transition in self organizing cellular patterns","Added references, text minor changes","J.Phys A 1999","10.1088/0305-4470/32/41/301",,"cond-mat.dis-nn",,"  We have considered the dynamical evolution of cellular patterns controlled by
a stochastic Glauber process determined by the deviations of local cell
topology from that of a crystalline structure. Above a critical temperature
evolution is towards a common equilibrium state from any initial configuration,
but beneath this temperature there is a dynamical phase transition, with a
start from a quasi-random state leading to non-equilibrium glassy freezing
whereas an ordered start rests almost unchanged. A temporal persistence
function decays exponentially in the high temperature equilibrating state but
has a characteristic slow non-equilibrium aging-like behaviour in the low
temperature glassy phase.
","[{""version"":""v1"",""created"":""Tue, 14 Jul 1998 10:17:33 GMT""},{""version"":""v2"",""created"":""Thu, 16 Jul 1998 11:44:15 GMT""},{""version"":""v3"",""created"":""Tue, 28 Sep 1999 10:18:11 GMT""}]","2009-10-31"
"cond-mat/9807202","Max Petersen","X.-G. Wang, W. Weiss, Sh. K. Shaikhutdinov, M. Ritter, M. Petersen, F.
  Wagner, R. Schloegl, and M. Scheffler","The hematite (alpha-Fe_2 O_3) (0001) surface: evidence for domains of
  distinct chemistry","4 pages, 3 figures, appears in Phys. Rev. Lett. (August 1998). Other
  related publications can be found at
  http://www.rz-berlin.mpg.de/th/paper.html",,"10.1103/PhysRevLett.81.1038",,"cond-mat.mtrl-sci",,"  Using spin-density functional theory we investigated various possible
structures of the hematite (0001) surface. Depending on the ambient oxygen
partial pressure, two geometries are found to be particularly stable under
thermal equilibrium: one being terminated by iron and the other by oxygen. Both
exhibit huge surface relaxations (-57 % for the Fe- and -79 % for the
O-termination) with important consequences for the surface electronic and
magnetic properties. With scanning tunneling microscopy we observe two
different surface terminations coexisting on single crystalline alpha-Fe_2 O_3
(0001) films, which were prepared in high oxygen pressures.
","[{""version"":""v1"",""created"":""Tue, 14 Jul 1998 10:25:15 GMT""}]","2009-10-31"
"cond-mat/9807203","D. S. Ray","S.K.Banik, J.R.Chaudhuri and D.S.Ray","Theory of Adiabatic fluctuations : third-order noise","Plain Latex, no figures, 28 pages; to appear in J. Phys. A",,"10.1088/0305-4470/31/36/005",,"cond-mat.stat-mech",,"  We consider the response of a dynamical system driven by external adiabatic
fluctuations. Based on the `adiabatic following approximation' we have made a
systematic separation of time-scales to carry out an expansion in $\alpha
|\mu|^{-1}$, where $\alpha$ is the strength of fluctuations and $|\mu|$ is the
damping rate. We show that probability distribution functions obey the
differential equations of motion which contain third order terms (beyond the
usual Fokker-Planck terms) leading to non-Gaussian noise. The problem of
adiabatic fluctuations in velocity space which is the counterpart of Brownian
motion for fast fluctuations, has been solved exactly. The characteristic
function and the associated probability distribution function are shown to be
of stable form. The linear dissipation leads to a steady state which is stable
and the variances and higher moments are shown to be finite.
","[{""version"":""v1"",""created"":""Tue, 14 Jul 1998 10:35:07 GMT""}]","2009-10-31"
"cond-mat/9807204","Yoshifumi Morita","Y. Otsuka, Y. Morita and Y. Hatsugai (Dept.of Applied Physics, Univ .
  of Tokyo)","Collapse of Charge Gap in Random Mott Insulators","RevTeX with 3 postscript figures",,"10.1103/PhysRevB.58.15314",,"cond-mat.str-el cond-mat.dis-nn",,"  Effects of randomness on interacting fermionic systems in one dimension are
investigated by quantum Monte-Carlo techniques. At first, interacting spinless
fermions are studied whose ground state shows charge ordering. Quantum phase
transition due to randomness is observed associated with the collapse of the
charge ordering. We also treat random Hubbard model focusing on the Mott gap.
Although the randomness closes the Mott gap and low-lying states are created,
which is observed in the charge compressibility, no (quasi-) Fermi surface
singularity is formed. It implies localized nature of the low-lying states.
","[{""version"":""v1"",""created"":""Tue, 14 Jul 1998 11:01:06 GMT""}]","2009-10-31"
"cond-mat/9807205","Toru Ohira","Toru Ohira and Yuzuru Sato","Resonance between Noise and Delay","4 pages, 5 figures, submitted to Phys.Rev.Lett Expanded and Added
  References",,"10.1103/PhysRevLett.82.2811","Sony Computer Science Lab TR: SCSL-TR-98-016","cond-mat.stat-mech",,"  We propose here a stochastic binary element whose transition rate depends on
its state at a fixed interval in the past. With this delayed stochastic
transition this is one of the simplest dynamical models under the influence of
``noise'' and ``delay''. We demonstrate numerically and analytically that we
can observe resonant phenomena between the oscillatory behavior due to noise
and that due to delay.
","[{""version"":""v1"",""created"":""Tue, 14 Jul 1998 12:15:42 GMT""},{""version"":""v2"",""created"":""Thu, 3 Dec 1998 08:31:10 GMT""}]","2009-10-31"
"cond-mat/9807206","D. S. Ray","Jyotipratim Ray Chaudhuri, Gautam Gangopadhyay and Deb Shankar Ray","Theory of non-stationary activated rate processes : nonexponential
  relaxation kinetics","Plain Latex, no figure, 31 pages, to appear in J. Chem. Phys",,"10.1063/1.477174",,"cond-mat.stat-mech physics.chem-ph",,"  We have explored a simple microscopic model to simulate a thermally activated
rate process where the associated bath which comprises a set of relaxing modes
is not in an equilibrium state. The model captures some of the essential
features of non-Markovian Langevin dynamics with a fluctuating barrier. Making
use of the Fokker-Planck description we calculate the barrier dynamics in the
steady state and non-stationary regimes. The Kramers-Grote-Hynes reactive
frequency has been computed in closed form in the steady state to illustrate
the strong dependence of the dynamic coupling of the system with the relaxing
modes. The influence of nonequilibrium excitation of the bath modes and its
relaxation on the kinetics of activation of the system mode is demonstrated. We
derive the dressed time-dependent Kramers rate in the nonstationary regime in
closed analytical form which exhibits strong non-exponential relaxation
kinetics of the reaction co-ordinate. The feature can be identified as a
typical non-Markovian dynamical effect.
","[{""version"":""v1"",""created"":""Tue, 14 Jul 1998 12:18:46 GMT""}]","2009-10-31"
