"astro-ph/9807305","Eelco van Kampen","Eelco van Kampen (TAC, Copenhagen)","Cluster mass estimation from lens magnification","18 pages, including 12 figures, TeX with special macros included,
  accepted for publication in MNRAS, also available at
  http://www.tac.dk/~eelco/papers/mag.ps.gz (with better looking figures !)",,"10.1046/j.1365-8711.1998.01997.x","1998-015","astro-ph",,"  The surface mass density of a cluster of galaxies, and thus its total mass,
can be estimated from its lens magnification. The magnification can be
determined from the variation in number counts of its background galaxies. In
the weak lensing approximation the surface mass density is a linear function of
the magnification. However, most observational data is concentrated in the
central parts of clusters, so one needs to go beyond the weak lensing
approximation, and consider the lens shear as well, which is unknown from the
variation in number counts alone. We studied the lensing properties of a
catalogue of numerical cluster models in order to find the best possible
approximation for the shear which still allows straightforward determination of
the surface mass density. We show that by using such an approximation one can
fairly well reconstruct the surface mass distribution from the magnification
alone. It is demonstrated that the mass estimated using the weak lens
magnification approximation is usually at least twice the true mass. We
illustrate our technique on existing data, and show that the resulting masses
compare well to other estimates.
","[{""version"":""v1"",""created"":""Wed, 29 Jul 1998 16:33:14 GMT""}]","2009-10-30"
"astro-ph/9807306","Jeremy S. Heyl","Jeremy S. Heyl and S. R. Kulkarni","How Common Are Magnetars? The Consequences of Magnetic-Field Decay","7 pages, 1 figure, accepted for publication in Ap. J. Letters","1998, ApJ, 506, L61","10.1086/311628",,"astro-ph",,"  Ultramagnetized neutron stars or magnetars have been invoked to explain
several astrophysical phenomena. We examine how the magnetic field of a
magnetar will decay over time and how this decay affects the cooling of the
object. We find that for sufficiently strong nascent fields, field decay alters
the cooling evolution significantly relative to similarly magnetized neutron
stars with constant fields. As a result, old magnetars can be expected to be
bright in the soft X-ray band. The soft X-ray source RXJ~0720.4$-$3125 may well
be the nearest such old magnetar.
","[{""version"":""v1"",""created"":""Wed, 29 Jul 1998 18:34:03 GMT""}]","2009-10-30"
"astro-ph/9807307","Geoffrey W. Marcy","G.W. Marcy, R.P. Butler, S.S. Vogt, D.A. Fischer, J.J. Lissauer","A Planetary Companion to the Nearby M4 Dwarf, Gliese 876","13 pages, 3 Figures","Astrophys.J.505:L147-L149,1998","10.1086/311623",,"astro-ph",,"  Doppler measurements of the M4 dwarf star, Gliese 876, taken at both Lick and
Keck Observatory reveal periodic, Keplerian velocity variations with a period
of 61 days. The orbital fit implies that the companion has a mass of, M = 2.1
MJUP /sin i, an orbital eccentricity of, e = 0.27+-0.03, and a semimajor axis
of, a = 0.21 AU. The planet is the first found around an M dwarf, and was drawn
from a survey of 24 such stars at Lick Observatory. It is the closest
extrasolar planet yet found, providing opportunities for follow--up detection.
The presence of a giant planet on a non-circular orbit, 0.2 AU from a 1/3 M_Sun
star, presents a challenge to planet formation theory. This planet detection
around an M dwarf suggests that giant planets are numerous in the Galaxy.
","[{""version"":""v1"",""created"":""Wed, 29 Jul 1998 19:49:53 GMT""}]","2008-11-26"
"astro-ph/9807308","Stephen P. Boughn","Stephen P. Boughn","Evidence for Hot, Diffuse Gas in the Local Supercluster","29 pages, 7 figures, submitted to ApJ",,,,"astro-ph",,"  Using the HEAO1 A2 full sky, 2-10 keV X-ray map evidence is found for the
presence of diffuse X-ray emission in the plane of the local supercluster.
Fitting this diffuse component with a simple ``pillbox'' model implies a volume
X-ray emissivity of 3.0 +- 0.3 x 10**39 (20 Mpc/R) erg/s/Mpc**3 where R is the
radius of the supercluster and the error is photon counting noise only. If one
considers fluctuations in the X-ray background as an additional component of
noise then the significance of the detection is reduced to 2 to 3 sigma. This
is consistent with fits of the model to data sets obtained by rotating the
original data. The distribution of these rotated fits indicates that the
detection is signficant at the 99% confidence level. If the source of the X-ray
emission is Bremsstrahlung from a uniformly distributed plasma with temperature
T_e then the implied electron number density is N_e = 2.5 x 10**-6
(R/20Mpc)**-1/2 (kT_e /10 keV)**-1/4 cm**-3. This value is about an order of
magnitude larger than the average baryon number density implied by
nucleosynthesis and is consistent with a collapse factor of 10. A search for
similar structure in the COBE 53 GHz microwave background map yielded a
marginal 1 sigma detection of -17 microKelvin which is consistent with the
Sunyaev-Zel'dovich (SZ) effect expected from 10 keV gas.
","[{""version"":""v1"",""created"":""Wed, 29 Jul 1998 20:30:11 GMT""}]","2007-05-23"
"astro-ph/9807309","David Burstein","J. M. Ponder, D. Burstein, R. W. O'Connell, J. A. Rose, J. A. Frogel,
  C.-C. Wu, D. M. Crenshaw, M. Rieke and M. Tripicco","UV Spectra, Line Indices of M31 Globular Clusters and E Galaxy Cores","31 pages, LaTex (aaspp4), 5 tables in 7 pages; 17 jpeg figures.
  Alternate copy of tar.gz file available at URL:
  ftp://samuri.la.asu.edu/pub/burstein/ponderpap",,,,"astro-ph",,"  Observations in integrated light (2200-4800 A, 8 to 11 A resolution, S/N >
20) of 4 M31 globular clusters and of the cores of six gE galaxies made with
the HST/FOS are presented and analyzed. These data are supplemented by IUE
observations of M32, Galactic globulars and stars. From these data we measure
UV colors and absorption line strength (ALS) indices, including the key NH
feature at 3360 A. We find that our data divide the M31 globular clusters,
Galactic globular clusters/Galactic stars, and gE galaxies into three different
stellar populations. The old stellar populations of M31 globular clusters and
elliptical galaxies are more similar to each other than each is to the Galactic
stellar population. Of special note is that the NH feature is so strong in the
spectra of M31 globulars that a large (>20) overabundance in nitrogen in these
stars, relative to that in Galactic stars, is likely required. Other ALS
indices (of Mg, Al) also show significant differences.
","[{""version"":""v1"",""created"":""Wed, 29 Jul 1998 21:03:52 GMT""}]","2007-05-23"
"astro-ph/9807310","Alexander R. R. Casti","A.R.R. Casti (1), P.J. Morrison (2), E.A. Spiegel (3) ((1) Dept. of
  Applied Mathematics, Columbia Univ., (2) Dept. of Physics and Institute for
  Fusion Studies, Univ. of Texas at Austin, (3) Dept. of Astronomy, Columbia
  Univ.)","Negative Energy Modes and Gravitational Instability of Interpenetrating
  Fluids","21 Latex pages, 4 postscript figures. To appear in Volume 867 of the
  Annals of the New York Academy of Sciences; typos and grammatical errors
  corrected","Annals of the NY Academy of Sciences, 867, 93-108 (1998)","10.1111/j.1749-6632.1998.tb11252.x",,"astro-ph",,"  We study the longitudinal instabilities of two interpenetrating fluids
interacting only through gravity. When one of the constituents is of relatively
low density, it is possible to have a band of unstable wave numbers well
separated from those involved in the usual Jeans instability. If the initial
streaming is large enough, and there is no linear instability, the indefinite
sign of the free energy has the possible consequence of explosive interactions
between positive and negative energy modes in the nonlinear regime. The effect
of dissipation on the negative energy modes is also examined.
","[{""version"":""v1"",""created"":""Wed, 29 Jul 1998 21:58:15 GMT""},{""version"":""v2"",""created"":""Sun, 8 Nov 1998 03:03:51 GMT""}]","2013-03-06"
"astro-ph/9807311","Neil John Cornish","Neil J. Cornish (DAMTP, Cambridge) and Jeffrey R. Weeks (Canton)","Measuring the shape of the Universe","18 pages, 8 figures, AMS LaTeX, Accepted for publication as a Feature
  Article in the Notices of the American Mathematical Society",,,"Canton-98-2","astro-ph gr-qc",,"  Since the dawn of civilization, humanity has grappled with the big questions
of existence and creation. Modern cosmology seeks to answer some of these
questions using a combination of mathematics and measurement. The questions
people hope to answer include ``how did the universe begin?''; ``how will the
universe end?''; ``is space finite or infinite?''. After a century of
remarkable progress, cosmologists may be on the verge of answering at least one
of these questions -- is space finite? Using some simple geometry and a NASA
satellite set for launch in the year 2000, the authors and their colleagues
hope to measure the size and shape of space. This review article explains the
mathematics behind the measurement, and the cosmology behind the observations.
","[{""version"":""v1"",""created"":""Thu, 30 Jul 1998 00:00:39 GMT""},{""version"":""v2"",""created"":""Wed, 5 Aug 1998 14:04:14 GMT""}]","2007-05-23"
"astro-ph/9807312","Erik Leitch","E. M. Leitch, A. C. S. Readhead, T. J. Pearson, S. T. Myers, S.
  Gulkis, C. R. Lawrence","A Measurement of Anisotropy in the Cosmic Microwave Background on 7-22
  Arcminute Scales","Revisions to match the published version, ApJ, 532: 37-56. Latex,
  emulateapj.sty, 22 pages, 21 Postscript figures",,,,"astro-ph",,"  We report a measurement of anisotropy in the cosmic microwave background
radiation (CMBR) on 7-22 arcminute scales. Observations of 36 fields near the
North Celestial Pole (NCP) were made at 31.7 and 14.5 GHz, using the 5.5-meter
and 40-meter telescopes at the Owens Valley Radio Observatory (OVRO) from 1993
to 1996.
  Multi-epoch VLA observations at 8.5 and 15 GHz allow removal of discrete
source contamination. After point-source subtraction, we detect significant
structure, which we identify with emission from a combination of a
steep-spectrum foreground and the CMBR. The foreground component is found to
correlate with IRAS 100 micron dust emission. Lack of H-alpha emission near the
NCP suggests that this foreground is either high-temperature thermal
bremsstrahlung (T_e ~ 10^6 K), flat-spectrum synchrotron or an exotic component
of dust emission. On the basis of low-frequency maps of the NCP, we can
restrict the spectral index of the foreground to beta >= -2.2.
  Although the foreground signal dominates at 14.5 GHz, the extracted CMBR
component contributes 88\% of the variance at 31.7 GHz, yielding an rms
fluctuation amplitude of 82^{+12.1}_{-9.1} microKelvin, including 4.3%
calibration uncertainty and 12% sample variance (68% confidence). The
equivalent broadband amplitude is dT_{l_e} = 59^{+8.6}_{-6.5} microKelvin at
l_e = 589. This measurement, when combined with small angular-scale upper
limits obtained at the OVRO, indicates that the CMBR angular power spectrum
decreases between l ~ 600 and l ~ 2000 and is consistent with flat cosmological
models.
","[{""version"":""v1"",""created"":""Thu, 30 Jul 1998 00:21:14 GMT""},{""version"":""v2"",""created"":""Fri, 19 Feb 1999 17:16:48 GMT""},{""version"":""v3"",""created"":""Wed, 18 Oct 2000 22:50:17 GMT""}]","2007-05-23"
"astro-ph/9807313","Chris Simpson","Chris Simpson and Vikki Meadows","The nuclear spectrum of the radio galaxy NGC 5128 (Centaurus A)","12 pages including 2 figures, accepted by ApJ Letters",,"10.1086/311616",,"astro-ph",,"  We present near-infrared spectra of the nuclear disk in the nearby radio
galaxy NGC 5128 (Centaurus A). On the basis of the observed strengths of the [S
III] 0.9532um and [Fe II] 1.2567um lines, we classify NGC 5128 as a LINER.
Modeling of the strengths of these and additional lines suggests that the
nuclear region is powered by shocks rather than photoionization.
","[{""version"":""v1"",""created"":""Thu, 30 Jul 1998 03:17:57 GMT""}]","2009-10-30"
"astro-ph/9807314","Jean in 't Zand","J.J.M. in 't Zand, L. Amati, L.A. Antonelli, R.C. Butler, A.J.
  Castro-Tirado, A. Coletta, E. Costa, M. Feroci, F. Frontera, J. Heise, S.
  Molendi, L. Nicastro, A. Owens, E. Palazzi, E. Pian, L. Piro, G. Pizzichini,
  M.J.S. Smith, M. Tavani","Gamma-Ray Burst 980329 and its X-Ray Afterglow","13 pages with 3 figures. Accepted for publication in ApJ Lett",,"10.1086/311620","SRON","astro-ph",,"  GRB 980329 is the brightest gamma-ray burst detected so far with the Wide
Field Cameras aboard BeppoSAX, both in gamma-rays and X-rays. With respect to
its fluence (2.6 X 10**-5 erg/s/cm**2 in 50 to 300 keV) it would be in the top
4% of gamma-ray bursts in the 4B catalog (Meegan et al. 1998). The
time-averaged burst spectrum from 2 to 20 and 70 to 650 keV can be well
described by the empirical model of Band et al. (1993). The resulting photon
index above the break energy is exceptionally hard at -1.32 +/- 0.03. An X-ray
afterglow was detected with the narrow-field instruments aboard BeppoSAX 7 h
after the event within the error box as determined with the Wide Field Cameras.
Its peak flux is (1.4 +/- 0.2) X 10**-12 erg/s/cm**2 (2 to 10 keV). The
afterglow decayed according to a power law function with an index of -1.35 +/-
0.03. GRB 980329 is characterized by being bright and hard, and lacking strong
spectral evolution.
","[{""version"":""v1"",""created"":""Thu, 30 Jul 1998 07:14:20 GMT""}]","2009-10-30"
"astro-ph/9807315","Joshua S. Bloom","J. S. Bloom (CIT), S. G. Djorgovski (CIT), S. R. Kulkarni (CIT), and
  D. A. Frail (NRAO)","The Host Galaxy of GRB 970508","Submitted to the Astrophysical Journal Letters (30 July 1998). Five
  pages including one table and two figures, written in LaTeX using the
  emulateapj and psfig macros","Astrophys.J. 507 (1998) L25-L28","10.1086/311682",,"astro-ph",,"  We present late-time imaging and spectroscopic observations of the optical
transient (OT) of gamma-ray burst (GRB) 970508. Imaging observations roughly
200 and 300 days after the burst provide unambiguous evidence for the
flattening of the light-curve. The spectroscopic observations reveal two
persistent features which we identify with [O II] 3727 Angstrom and [Ne III]
3869 Angstrom at a redshift of z= 0.835 -- the same redshift as the absorption
system seen when the transient was bright. The OT was coincident with the
underlying galaxy to better than 370 milliarcsec or a projected radial
separation of less than 2.7 kpc. The luminosity of the [O II] line implies a
minimum star-formation rate of > 1 M_solar per year. In our assumed cosmology,
the implied restframe absolute magnitude is M_B = -18.55, or L_B = 0.12 L_*.
This object, the likely host of GRB 970508, can thus be characterized as an
actively star-forming dwarf galaxy. The close spatial connection between this
dwarf galaxy and the GRB requires that at least some fraction of progenitors be
not ejected in even the weakest galactic potentials.
","[{""version"":""v1"",""created"":""Thu, 30 Jul 1998 07:41:33 GMT""}]","2009-10-30"
"astro-ph/9807316","Dorodnitsyn Anton","G.S.Bisnovatyi-Kogan, A.V.Dorodnitsyn","Application of the Galerkin method to the problem of stellar stability,
  gravitational collapse and black hole formation","18 pages, 1 figure","Grav.Cosmol. 4 (1998) 174-182",,,"astro-ph",,"  Approximate approach based on the Galerkin method is suggested for the
investigation of equilibrium stellar models, a relativistic collapse problem
and black hole formation. Some results of its simplified version - energetic
method- are reviewed, and equations for general Gelerkin method are presented.
","[{""version"":""v1"",""created"":""Thu, 30 Jul 1998 12:31:22 GMT""}]","2007-05-23"
"astro-ph/9807317","Gabriele Ghisellini","G. Ghisellini, A. Celotti, G. Fossati, L. Maraschi, A. Comastri","A theoretical unifying scheme for gamma-ray bright blazars","25 pages, 11 figures, uses mn.sty and psfig.tex. Accepted for
  publication in MNRAS","Mon.Not.Roy.Astron.Soc.301:451,1998","10.1046/j.1365-8711.1998.02032.x",,"astro-ph",,"  The phenomenology of gamma-ray bright blazars can be accounted for by a
sequence in the source power and intensity of the diffuse radiation field
surrounding the relativistic jet. Correspondingly, the equilibrium particle
distribution peaks at different energies. This leads to a trend in the observed
properties: an increase of the observed power corresponds to: 1) a decrease in
the frequencies of the synchrotron and inverse Compton peaks; 2) an increase in
the ratio of the powers of the high and low energy spectral components. Objects
along this sequence would be observationally classified respectively as high
frequency BL Lac objects, low frequency BL Lac objects, highly polarized
quasars and lowly polarized quasars. The proposed scheme is based on the
correlations among the physical parameters derived in the present paper by
applying to 51 gamma ray loud blazars two of the most accepted scenarios for
the broad band emission of blazars, namely the synchrotron self--Compton and
external Compton models, and explains the observational trends presented by
Fossati et al. (1998) in a companion paper, dealing with the spectral energy
distributions of all blazars. This gives us confidence that our scheme applies
to all blazars as a class.
","[{""version"":""v1"",""created"":""Thu, 30 Jul 1998 10:58:03 GMT""}]","2009-10-30"
"astro-ph/9807318","Arvind Parmar","A.P. Reynolds, A.N. Parmar, P.J. Hakala, A.M.T. Pollock, O.R.
  Williams, A. Peacock, B.G. Taylor (Astrophysics Division, Space Science
  Department of ESA, ESTEC)","The EXOSAT medium-energy slew survey catalog","52 pages. 22 Figures. To be published in A&AS. For more information,
  see http://astro.estec.esa.nl/SA-general/Projects/Exosat/exmsintro.html",,"10.1051/aas:1999140","ESLAB 1997/118/SA","astro-ph",,"  We present a catalog of X-ray sources observed during slew maneuvers by the
Medium Energy Detector Array onboard the EXOSAT Observatory. The EXOSAT Medium
Energy slew-survey catalog (EXMS) provides a unique record of the 1--8 keV
X-ray sky between 1983 and 1986. 98% of the sky was observed, with 85%
receiving an exposure of >60 s. 1210 sources were detected. By comparing these
source positions with other catalogs, identifications are given for 992
detections (82% of the sample). These identifications consist of 250 distinct
objects, including 95 different X-ray binary systems, and 14 different AGN. A
further 58 detections have multiple candidates, while 160 detections remain
unidentified. Collimator transmission corrected 1-8 keV count rates are given
for the identified sources, together with raw count rates for the other
detections. The construction of the EXMS and the checks performed to ensure the
validity of the derived source properties are discussed. A publically available
version of this catalog is maintained on the EXOSAT database and archive system
(telnet://xray@exosat.estec.esa.nl).
","[{""version"":""v1"",""created"":""Thu, 30 Jul 1998 14:57:30 GMT""}]","2009-10-30"
"astro-ph/9807319","Robert Caldwell","R. R. Caldwell (U Penn), Marc Kamionkowski, and Leven Wadley
  (Columbia)","The First Space-Based Gravitational-Wave Detectors","5 pages, 3 postscript figures","Phys.Rev. D59 (1999) 027101","10.1103/PhysRevD.59.027101",,"astro-ph",,"  Gravitational waves provide a laboratory for general relativity and a window
to energetic astrophysical phenomena invisible with electromagnetic radiation.
Several terrestrial detectors are currently under construction, and a
space-based interferometer is envisioned for launch early next century to
detect test-mass motions induced by waves of relatively short wavelength.
Very-long-wavelength gravitational waves can be detected using the plasma in
the early Universe as test masses; the motion induced in the plasma by a wave
is imprinted onto the cosmic microwave background (CMB). While the signature of
gravitational waves on the CMB temperature fluctuations is not unique, the
polarization pattern can be used to unambiguously detect gravitational
radiation. Thus, forthcoming CMB polarization experiments, such as MAP and
Planck, will be the first space-based gravitational-wave detectors.
","[{""version"":""v1"",""created"":""Thu, 30 Jul 1998 14:45:15 GMT""}]","2016-08-30"
"astro-ph/9807320","Volker Springel","Volker Springel and Simon D. M. White (Max-Planck-Institute for
  Astrophysics, Garching)","Tidal tails in CDM cosmologies","17 pages, mn.sty, 13 included eps-figures, submitted to MNRAS","Mon.Not.Roy.Astron.Soc. 307 (1999) 162-178","10.1046/j.1365-8711.1999.02613.x","MPA preprint 1104","astro-ph",,"  We study the formation of tidal tails in pairs of merging disk galaxies with
structural properties motivated by current theories of cold dark matter (CDM)
cosmologies. In a recent study, Dubinski, Mihos & Hernquist (1996) showed that
the formation of prominent tidal tails can be strongly suppressed by massive
and extended dark haloes. For the large halo-to-disk mass ratio expected in CDM
cosmologies their sequence of models failed to produce strong tails like those
observed in many well-known pairs of interacting galaxies. In order to test
whether this effect can constrain the viability of CDM cosmologies, we
construct N-body models of disk galaxies with structural properties derived in
analogy to the analytical work of Mo, Mao & White (1998). With a series of
self-consistent collisionless simulations of galaxy-galaxy mergers we
demonstrate that even the disks of very massive dark haloes have no problems
developing long tidal tails, provided the halo spin parameter is large enough.
We show that the halo-to-disk mass ratio is a poor indicator for the ability to
produce tails. Instead, the relative size of disk and halo, or alternatively,
the ratio of circular velocity to local escape speed at the half mass radius of
the disk are more useful criteria. This result holds in all CDM cosmologies.
The length of tidal tails is thus unlikely to provide useful constraints on
such models.
","[{""version"":""v1"",""created"":""Thu, 30 Jul 1998 15:48:10 GMT""}]","2011-11-01"
"cond-mat/9807385","Thomas Vojta","Michael Schreiber, Frank Epperlein, and Thomas Vojta","Transport in disordered interacting systems: Numerical results for
  one-dimensional spinless electrons","Invited talk presented at Percolation 98, submitted to Physica A, 8
  pages, elsart style, 4 eps figures included","Physica A 266, 443 (1999)","10.1016/S0378-4371(98)00628-1",,"cond-mat.mes-hall cond-mat.dis-nn",,"  The combined influence of disorder and interactions on the transport
properties of electrons in one dimension is investigated. The numerical
simulations are carried out by means of the Hartree-Fock-based diagonalization
(HFD), a very efficient method to determine the low-energy properties of a
disordered many-particle system. We find that the conductance of a strongly
localized system can become considerably enhanced by the interactions. The
enhancement for long-range interactions is significantly larger than for
short-range interactions. In contrast, the conductance of weakly localized
systems becomes suppressed by the interactions.
","[{""version"":""v1"",""created"":""Wed, 29 Jul 1998 16:20:27 GMT""}]","2015-06-25"
"cond-mat/9807386","Serguei N. Dorogovtsev","S. N. Dorogovtsev (Ioffe Physico-Technical Institute, St. Petersburg,
  Russia)","Avalanche mixing of granular solids in a rotating 2D drum: diffusion and
  fractionality","7 pages (epsf-LaTeX) and 2 EPS figures, a misprint is corrected",,,,"cond-mat math-ph math.MP",,"  The dynamics of the avalanche mixing in a slowly rotated 2D upright drum is
studied in the situation where the difference $\delta$ between the angle of
marginal stability and the angle of repose of the granular material is finite.
An analytical solution of the problem is found for a half filled drum, that is
the most interesting case. The mixing is described by a simple linear
difference equation. We show that the mixing looks like linear diffusion of
fractions under consideration with the diffusion coefficient vanishing when
$\delta$ is an integer part of $\pi$. The characteristic mixing time tends to
infinity in these points. A full dependence of the mixing time on $\delta$ is
calculated and predictions for an experiment are made.
","[{""version"":""v1"",""created"":""Wed, 29 Jul 1998 16:41:48 GMT""},{""version"":""v2"",""created"":""Mon, 3 Aug 1998 17:19:56 GMT""}]","2007-05-23"
"cond-mat/9807387","Ganpathy Murthy","Ganpathy Murthy, K. Park, R. Shankar, and J. K. Jain","Scaling Relations for Gaps in Fractional Quantum Hall States",,,"10.1103/PhysRevB.58.15363","BU-CMT2","cond-mat.mes-hall",,"  The microscopic approach of Murthy and Shankar, which has recently been used
to calculate the transport gaps of quantum Hall states with fractions
p/(2ps+1), also implies scaling relations between gaps within a single sequence
(fixed s) as well as between gaps of corresponding states in different
sequences. This work tests these relations for a system of electrons in the
lowest Landau level interacting with a model potential cutoff at high momenta
due to sample thickness.
","[{""version"":""v1"",""created"":""Wed, 29 Jul 1998 17:14:35 GMT""}]","2009-10-31"
