"cond-mat/9807388","Martin Kochmanski","Martin S. Kochman'ski","Jordan-Wigner transformations and their generalizations for
  multidimensional systems","22 pages, REVTEX","Journal Tech.Phys., v.36, 485 (1995)/partly/",,,"cond-mat.stat-mech",,"  In the paper nonlinear transformations of the Jordan-Wigner (JW) type are
introduced in the form different from the ones known previously, for the
purpose of expressing multi-index Pauli operators in terms of multi-index Fermi
creation and annihilation operators. These JW transformations in the general
case being a subject of a rather complicated algebra of transposition relations
between various sets of Fermi creation and annihilation operators, depending on
the common multiindex of the latter, is shown. As an example, the two- and
three- dimensional transformations of the JW type are investigated, their
properties and possible applications in analysis of a couple of lattice models
of statistical mechanics and also an example of application of these
transformations to problems of self-avoiding walks in graph theory, are
discussed. The relation of the obtained transformations to the previously known
transformations of the JW type for higher dimensions is shown.
","[{""version"":""v1"",""created"":""Wed, 29 Jul 1998 18:43:30 GMT""}]","2007-05-23"
"cond-mat/9807389","Lutfi Ozyuzer","Lutfi Ozyuzer, John F. Zasadzinski, Chris Kendziora, Kenneth E. Gray","Tunneling Spectroscopy of Overdoped Bi2Sr2CaCu2O8+d Single Crystals","9 pages, 13 figures","Phys. Rev. B 61 (2000) pp. 3629-3640","10.1103/PhysRevB.61.3629",,"cond-mat.supr-con",,"  The point contact tunneling technique is used to examine quasiparticle and
Josephson currents in overdoped Bi$_{2}$Sr$_{2}$CaCu$_{2}$O$_{8+\delta}$
(Bi-2212) single crystals with bulk T$_{c}$ values near 62 K. High quality
superconductor-insulator-normal metal (SIN) tunnel junctions are formed between
Bi-2212 crystals and a Au tip, which display well-resolved quasiparticle gap
features including sharp conductance peaks. Reproducible superconductor-
insulator-superconductor (SIS) tunnel junctions are also obtained between two
pieces of the Bi-2212 crystals, resulting in simultaneous quasiparticle and
Josephson currents. Superconducting gap values are obtained from the SIS data
using a model with d-wave symmetry. The SIS tunneling conductances also show
very pronounced symmetric dips and humps at high bias voltages. The high bias
conductance data reveal that the dip and hump features are part of a larger
spectrum that extends out to 300-400 mV. The dynamic conductances of both SIN
and SIS junctions are qualitatively similar to those found on optimally-doped
Bi-2212 but with reduced gap values ($\Delta$=15-20 meV). The maximum Josephson
current depends on junction resistance in a manner consistent with
Ambegaokar-Baratoff theory but with a reduced $I_{c}R_{n}$ product of $\sim$2.4
mV.
","[{""version"":""v1"",""created"":""Wed, 29 Jul 1998 18:53:07 GMT""},{""version"":""v2"",""created"":""Thu, 30 Jul 1998 14:28:47 GMT""}]","2009-10-31"
"cond-mat/9807390","Luca Salasnich","L. Reatto, A. Parola, L. Salasnich","Bosonic clouds with attractive interaction beyond the local interaction
  approximation","Latex, 6 pages, 2 figure, 1 table, presented to the International
  Symposium of Quantum Fluids and Solids 98, Amherst (USA), 9-14 June 1998",,,,"cond-mat quant-ph",,"  We study the properties of a Bose-Einstein condensed cloud of atoms with
negative scattering length confined in a harmonic trap. When a realistic non
local (finite range) effective interaction is taken into account, we find that,
besides the known low density metastable solution, a new branch of Bose
condensate appears at higher density. This state is self-bound but its density
can be quite low if the number $N$ of atoms is not too big. The transition
between the two classes of solutions as a function of $N$ can be either sharp
or smooth according to the ratio between the range of the attractive
interaction and the length of the trap. A tight trap leads to a smooth
transition. In addition to the energy and the shape of the cloud we study also
the dynamics of the system. In particular, we study the frequencies of
collective oscillation of the Bose condensate as a function of the number of
atoms both in the local and in the non local case. Moreover, we consider the
dynamics of the cloud when the external trap is switched off.
","[{""version"":""v1"",""created"":""Wed, 29 Jul 1998 19:07:12 GMT""}]","2007-05-23"
"cond-mat/9807391","Christopher Mudry","Christopher Mudry, P. W. Brouwer, B. I. Halperin, V. Gurarie, A. Zee","Density of states in the non-hermitian Lloyd model","6 pages, RevTex, two-columns","Phys. Rev. B 58, 13539 (1998)","10.1103/PhysRevB.58.13539",,"cond-mat.dis-nn",,"  We reconsider the recently proposed connection between density of states in
the so-called ``non-hermitian quantum mechanics'' and the localization length
for a particle moving in random potential. We argue that it is indeed possible
to find the localization length from the density of states of a non-hermitian
random ``Hamiltonian''. However, finding the density of states of a
non-hermitian random ``Hamiltonian'' remains an open problem, contrary to
previous findings in the literature.
","[{""version"":""v1"",""created"":""Wed, 29 Jul 1998 20:23:46 GMT""}]","2009-10-31"
"cond-mat/9807392","Oliver Zobay","E. V. Goldstein, M. G. Moore, O. Zobay, P. Meystre","Nonlinear optics of matter waves","13 pages, 1 figure",,,,"cond-mat",,"  We give a brief overview of the way atomic physics is now developing in a way
reminiscent of the optics revolution of the 1960's. Thanks in particular to
recent developments in atomic trapping and cooling, the new field of atom
optics is rapidly leading to exciting new developments such as nonlinear atom
optics and quantum atom optics. We illustrate these developments with examples
out of our own research.
","[{""version"":""v1"",""created"":""Wed, 29 Jul 1998 21:36:46 GMT""}]","2007-05-23"
"cond-mat/9807393","Matthias Troyer","Matthias Troyer and Subir Sachdev","Universal critical temperature for Kosterlitz-Thouless transitions in
  bilayer quantum magnets","5 pages, 4 figures","Phys.Rev.Lett. 81 (1998) 5418","10.1103/PhysRevLett.81.5418",,"cond-mat.str-el cond-mat.mes-hall cond-mat.stat-mech hep-lat physics.comp-ph",,"  Recent experiments show that double layer quantum Hall systems may have a
ground state with canted antiferromagnetic order. In the experimentally
accessible vicinity of a quantum critical point, the order vanishes at a
temperature T_{KT} = \kappa H, where H is the magnetic field and \kappa is a
universal number determined by the interactions and Berry phases of the thermal
excitations. We present quantum Monte Carlo simulations on a model spin system
which support the universality of \kappa and determine its numerical value.
This allows experimental tests of an intrinsically quantum-mechanical universal
quantity, which is not also a property of a higher dimensional classical
critical point.
","[{""version"":""v1"",""created"":""Thu, 30 Jul 1998 03:53:33 GMT""},{""version"":""v2"",""created"":""Mon, 3 Aug 1998 08:52:48 GMT""},{""version"":""v3"",""created"":""Tue, 4 Aug 1998 02:44:12 GMT""}]","2016-08-31"
"cond-mat/9807394","Karin Dahmen","Karin A. Dahmen, David R. Nelson, and Nadav M. Shnerb","Life and Death near a Windy Oasis","18 pages, 9 figures",,,,"cond-mat.dis-nn q-bio",,"  We propose a simple experiment to study delocalization and extinction in
inhomogeneous biological systems. The nonlinear steady state for, say, a
bacteria colony living on and near a patch of nutrient or favorable
illumination (``oasis'') in the presence of a drift term (``wind'') is
computed. The bacteria, described by a simple generalization of the Fisher
equation, diffuse, divide A -> A+A, die A -> 0, and annihilate A+A -> 0. At
high wind velocities all bacteria are blown into an unfavorable region
(``desert''), and the colony dies out. At low velocity a steady state
concentration survives near the oasis. In between these two regimes there is a
critical velocity at which bacteria first survive. If the ``desert'' supports a
small nonzero population, this extinction transition is replaced by a
delocalization transition with increasing velocity. Predictions for the
behavior as a function of wind velocity are made for one and two dimensions.
","[{""version"":""v1"",""created"":""Thu, 30 Jul 1998 08:02:02 GMT""}]","2007-05-23"
"cond-mat/9807395","Steven C. Erwin","Steven C. Erwin (Naval Research Laboratory) and Hanno H. Weitering
  (University of Tennessee-Knoxville and Oak Ridge National Lab)","Theory of the ""honeycomb chain-channel"" reconstruction of Si(111)3x1","4 pages, 4 figures, submitted to Phys. Rev. Lett (the ugly postscript
  error on page 4 has now been repaired)","Phys. Rev. Lett. 81, 2296 (1998)","10.1103/PhysRevLett.81.2296",,"cond-mat.mtrl-sci",,"  First-principles electronic-structure methods are used to study a structural
model for Ag/Si(111)3x1 recently proposed on the basis of transmission electron
diffraction data. The fully relaxed geometry for this model is far more
energetically favorable than any previously proposed, partly due to the unusual
formation of a Si double bond in the surface layer. The calculated electronic
properties of this model are in complete agreement with data from
angle-resolved photoemission and scanning tunneling microscopy.
","[{""version"":""v1"",""created"":""Thu, 30 Jul 1998 11:40:57 GMT""},{""version"":""v2"",""created"":""Fri, 31 Jul 1998 11:58:12 GMT""}]","2009-10-31"
"cond-mat/9807396","Stringari Sandro","L. Pitaevskii and S. Stringari","Elementary excitations in trapped Bose gases beyond mean field
  approximation","4 pages, 1 Postscript figure",,"10.1103/PhysRevLett.81.4541",,"cond-mat",,"  Using hydrodynamic theory of superfluids and the Lee-Huang-Yang equation of
state for interacting Bose gases we derive the first correction to the
collective frequencies of a trapped gas, due to effects beyond mean field
approximation. The corresponding frequency shift, which is calculated at zero
temperature and for large N, is compared with other corrections due to finite
size, non-linearity and finite temperature. We show that for reasonable choices
of the relevant parameters of the system, the non-mean field correction is the
leading contribution and amounts to about 1%. The role of the deformation of
the trap is also discussed.
","[{""version"":""v1"",""created"":""Thu, 30 Jul 1998 09:25:50 GMT""}]","2009-10-31"
"cond-mat/9807397","Sergei Fedotov","Sergei Fedotov and Sergei Mikhailov","Option Pricing Model for Incomplete Market",,,,,"cond-mat.stat-mech q-fin.PR",,"  The problem of determining the European-style option price in the incomplete
market has been examined within the framework of stochastic optimization. An
analytic method based on the discrete dynamic programming equation (Bellman
equation) has been developed that gives the general formalism for determining
the option price and the optimal trading strategy (optimal control policy) that
reduces total risk inherent in writing the option.
  The basic purpose of paper is to present an effective algorithm that can be
used in practice.
  Keywords: option pricing, incomplete market, transaction costs, stochastic
optimization, Bellman equation.
","[{""version"":""v1"",""created"":""Thu, 30 Jul 1998 10:00:14 GMT""},{""version"":""v2"",""created"":""Fri, 7 Aug 1998 15:13:35 GMT""}]","2016-08-31"
"cond-mat/9807398","Franco Bagnoli","F. Bagnoli and M. Bezzi","Eigen's Error Threshold and Mutational Meltdown in a Quasispecies Model","7 pages, two figure","Int. Journ. Mod. Phys. C 9, 999 (1998)","10.1142/S0129183198000935",,"cond-mat.stat-mech q-bio",,"  We introduce a toy model for interacting populations connected by mutations
and limited by a shared resource. We study the presence of Eigen's error
threshold and mutational meltdown. The phase diagram of the system shows that
the extinction of the whole population due to mutational meltdown can occur
well before an eventual error threshold transition.
","[{""version"":""v1"",""created"":""Thu, 30 Jul 1998 14:32:46 GMT""},{""version"":""v2"",""created"":""Mon, 3 Aug 1998 18:01:47 GMT""},{""version"":""v3"",""created"":""Wed, 21 Apr 1999 09:36:05 GMT""}]","2007-05-23"
"cond-mat/9807399","Stephane Metens","S. Metens, D. Lima, P. Borckmans, G. Dewel","Fringe patterns of Bose condensates","9 pages, 3 figures, submitted",,,"Cenoli 98-08-01","cond-mat.stat-mech",,"  We investigate within the Gross-Pitaevski (GP) theory the formation of fringe
patterns between two Bose condensates stored in a double well potential
modelling the forces applied to the experimental systems. In the case of
repulsive interactions between the atoms, we report the onset of interference
structures similar to those observed in the experiments, after the release of
the confining potential. Conversely, attractive interactions lead to the
collapse of the condensate when the number of particles is larger than a
critical value. We show that a bias field introduced in the center of the trap
allows the system to avoid the blow-up of the density and gives rise to a
periodic behavior of growth and decay of spatial modulations reminiscent of the
Fermi-Pasta-Ulam recurrence.
","[{""version"":""v1"",""created"":""Thu, 30 Jul 1998 15:01:46 GMT""}]","2007-05-23"
"cond-mat/9807400","Didier Sornette","D. Sornette","Mechanochemistry: an hypothesis for shallow earthquakes","36 pages, 2 ps figures, to appear in ""Earthquake Thermodynamics and
  Phase Transformations in the Earth's Interior"" - Roman Teisseyre and
  Eugeniusz Majewski (eds), Cambridge University Press",,,,"cond-mat.mtrl-sci",,"  We advance the novel hypothesis that water in the presence of finite
localized strain within fault gouges may lead to the phase transformation of
stable minerals into metastable polymorphs of higher free energy density. Under
increasing strain, the transformed minerals eventually become unstable, as
shown from an application of Landau theory of structural phase transitions. We
propose that this instability leads to an explosive transformation, creating a
slightly supersonic shock wave propagating along the altered fault core leaving
a wake of shaking fragments. As long as the resulting high-frequency acoustic
waves remain of sufficient amplitude to lead to a fluidization of the fault
core, the fault is unlocked and free to slip under the effect of the tectonic
stress, thus releasing the elastic part of the stored energy. We briefly
discuss observations that could be understood within this theory.
","[{""version"":""v1"",""created"":""Thu, 30 Jul 1998 15:03:30 GMT""}]","2007-05-23"
"cond-mat/9807401","Yurij Holovatch","Yu. Holovatch, T. Yavors'kii","Critical exponents of the diluted Ising model between dimensions 2 and 4","25 pages, latex, 1 latex picture, 5 eps-figures included",,"10.1023/A:1023032307964",,"cond-mat",,"  Within the massive field theoretical renormalization group approach the
expressions for the beta- and gamma-functions of the anisotropic mn-vector
model are obtained for general space dimension d in three-loop approximation.
Resumming corresponding asymptotic series, critical exponents for the case of
the weakly diluted quenched Ising model (m=1, n=0), as well as estimates for
the marginal order parameter component number m_c of the weakly diluted
quenched m-vector model are calculated as functions of d in the region 2 =< d
<4. Conclusions concerning the effectiveness of different resummation
techniques are drawn.
","[{""version"":""v1"",""created"":""Thu, 30 Jul 1998 15:40:17 GMT""}]","2015-06-25"
"cond-mat/9807402","Adolfo Avella","A. Avella, F. Mancini and D. Villani (University of Salerno, Italy)","Comment on ""Symmetry properties of magnetization in the Hubbard model at
  finite temperature""","4 pages, 4 embedded Postscript figures, RevTeX, submitted to Phys.
  Rev. B",,,,"cond-mat.str-el",,"  The results of G. Su and M. Suzuki [Phys. Rev. B 54, 8291 (1996); ibidem 57,
13367 (1998)] for the spin and pseudo-spin symmetry properties of the Hubbard
model are reexamined. We point out that the exact relations they have found are
valid down to zero temperature and that their solutions for both spin and
pseudo-spin correlation functions are incorrect.
","[{""version"":""v1"",""created"":""Thu, 30 Jul 1998 15:44:49 GMT""}]","2007-05-23"
"cond-mat/9807403","Jose Manuel Gomez Vilar","J. M. G. Vilar and A. Corral","Synchronization of Short-Range Pulse-Coupled Oscillators","4 pages, 2 figures",,,,"cond-mat",,"  We explore systems of pulse-coupled oscillators beyond the mean-field limit
[R.E. Mirollo and S.H. Strogatz, {SIAM J. Appl. Math.} {\bf 50}, 1645 (1990)]
by means of a manageable description which leads to a great simplification of
the dynamics. Sufficient conditions for synchronization are exactly obtained
for a ring with nearest-neighbor directed interactions, turning out to be the
same as in the all-to-all case. Our analysis shows new synchronization
mechanisms occurring when the interactions are local.
","[{""version"":""v1"",""created"":""Thu, 30 Jul 1998 15:53:17 GMT""}]","2007-05-23"
"gr-qc/9807082","Shyan-Ming Perng","Shyan-Ming Perng","On Conserved Quantities at Spatial Infinity","42 pages, submitted to J. Math. Physics","J.Math.Phys.40:1923-1950,1999","10.1063/1.532841",,"gr-qc",,"  There is a well-known short list of asymptotic conserved quantities for a
physical system at spatial infinity. We search for new ones.This is carried
outwithin the asymptotic framework of Ashtekar and Romano, in which spatial
infinity is represented as a smooth boundary of space-time. We first introduce,
for physical fields on space-time,a characterization of their asymptotic
behavior as certain fields on this boundary. Conserved quantities at spatial
infinity, in turn, are constructed from these fields. We find,in Minkowski
space-time, that each of a Klein-Gordon field, a Maxwell field, and a
linearized gravitational field yields an entire hierarchy of conserved
quantities. Only certain quantities in this hierarchy survive into curved
space-time.
","[{""version"":""v1"",""created"":""Thu, 30 Jul 1998 06:35:09 GMT""}]","2011-06-20"
"gr-qc/9807083","Hyeong-Chan Kim","Hyeong-Chan Kim, Yoonbai Kim, Phillial Oh","Black Hole Entropy and Exclusion Statistics","REVTeX file, 12 pages",,,"SNUTP/98-065, MIT-CTP/2766","gr-qc",,"  We compute the entropy of systems of quantum particles satisfying the
fractional exclusion statistics in the space-time of 2+1 dimensional black hole
by using the brick-wall method. We show that the entropy of each effective
quantum field theory with a Planck scale ultraviolet cutoff obeys the area law,
irrespective of the angular momentum of the black hole and the statistics
interpolating between Bose-Einstein and Fermi-Dirac statistics.
","[{""version"":""v1"",""created"":""Thu, 30 Jul 1998 14:46:26 GMT""}]","2007-05-23"
"hep-ex/9807029","Dmitri Denisov","B. Abbott, et al. (D0 Collaboration)","Small Angle J/Psi Production in ppbar Collisions at sqrt(s)=1.8TeV","6 pages, 3 figures, text file REVTEX, figures encapsulated
  postscript. PACS: 13.20.Gd, 13.25.Gv, 13.85.Qk, 12.38.Qk","Phys.Rev.Lett.82:35-40,1999","10.1103/PhysRevLett.82.35","Fermilab-Pub-98/237-E","hep-ex",,"  This paper presents the first measurement of the inclusive J/Psi production
cross section in the forward pseudorapidity region 2.5<|eta|<3.7 in ppbar
collisions at sqrt(s)=1.8TeV. The results are based on 9.8 pb-1 of data
collected using the D0 detector at the Fermilab Tevatron Collider. The
inclusive J/Psi cross section for transverse momenta between 1 and 16 GeV/c is
compared with theoretical models of charmonium production.
","[{""version"":""v1"",""created"":""Wed, 29 Jul 1998 17:17:24 GMT""}]","2008-11-26"
"hep-ex/9807030","Preprints Libr/pam","B. Gittelman","An Update on CLEO's Study of B Meson Decays","11 pages, postscript file also available through
  http://w4.lns.cornell.edu/public/CLNS",,,"CLNS 98/1575","hep-ex",,"  This is a discussion of the main branching fractions of B Meson decays $(b\to
cW^{-})$. A summary of what has been measured and what remains unmeasured is
presented.
","[{""version"":""v1"",""created"":""Wed, 29 Jul 1998 18:55:47 GMT""}]","2007-05-23"
"hep-ex/9807031","Preprints Libr/pam","A. Anastassov, et al. (CLEO Collaboration)","First Observation of $\Upsilon(1S)\to \gamma\pi\pi$","9 pages, postscript file also available through
  http://w4.lns.cornell.edu/public/CLNS","Phys.Rev.Lett.82:286-290,1999","10.1103/PhysRevLett.82.286","CLNS 98/1572, CLEO 98-9","hep-ex",,"  We report on a study of exclusive radiative decays of the Upsilon(1S)
resonance collected with the CLEO-II detector operating at CESR. We present the
first observation of the radiative decays Upsilon(1S)->gamma pi+pi- and
Upsilon(1S)->gamma pi0pi0. For the dipion mass regime m(pipi)>1.0 GeV, we
obtain Br(Upsilon(1S)->gamma pi+pi-=(6.3+/-1.2+/-1.3) x 10^(-5), and
Br(Upsilon(1S)->gamma pi0pi0=(1.7+/-0.6+/-0.3) x 10^(-5). The observed gamma
pipi events are consistent with the hypothesis Upsilon(1S)->gamma f2(1270).
","[{""version"":""v1"",""created"":""Thu, 30 Jul 1998 15:38:43 GMT""}]","2010-04-08"
"hep-lat/9807040","Slavnov Andrei Alexeevich","A.A.Slavnov","Lattice QCD with Exponentially Small Chirality Breaking","14 pages, no figures; typos corrected","Nucl.Phys. B544 (1999) 759-774","10.1016/S0550-3213(99)00051-6","UTCCP-P-43","hep-lat",,"  A new multifermion formulation of lattice QCD is proposed. The model is free
of spectrum doubling and preserves all nonanomalous chiral symmetries up to
exponentially small corrections. It is argued that a small number of fermion
fields may provide a good approximation making computer simulations feasible.
","[{""version"":""v1"",""created"":""Thu, 30 Jul 1998 06:11:54 GMT""}]","2009-10-31"
"hep-lat/9807041","Elmar Bittner","E. Bittner, A. Hauke, C. Holm, W. Janke, H. Markum, J. Riedler","Lattice Models of Quantum Gravity","4 pages, 1 figures","Frontiers in Quantum Physics (Springer 1998) pp. 303",,,"hep-lat",,"  Standard Regge Calculus provides an interesting method to explore quantum
gravity in a non-perturbative fashion but turns out to be a CPU-time demanding
enterprise. One therefore seeks for suitable approximations which retain most
of its universal features. The $Z_2$-Regge model could be such a desired
simplification. Here the quadratic edge lengths $q$ of the simplicial complexes
are restricted to only two possible values $q=1+\epsilon\sigma$, with
$\sigma=\pm 1$, in close analogy to the ancestor of all lattice theories, the
Ising model. To test whether this simpler model still contains the essential
qualities of the standard Regge Calculus, we study both models in two
dimensions and determine several observables on the same lattice size. In order
to compare expectation values, e.g. of the average curvature or the Liouville
field susceptibility, we employ in both models the same functional integration
measure. The phase structure is under current investigation using mean field
theory and numerical simulation.
","[{""version"":""v1"",""created"":""Thu, 30 Jul 1998 10:36:52 GMT""}]","2007-05-23"
"hep-lat/9807042","Arttu Rajantie","A. Rajantie, K. Kajantie, M. Karjalainen, M. Laine and J. Peisa","Vortices in equilibrium scalar electrodynamics","4 pages. Talk given by A. Rajantie at PASCOS-98, March 1998",,,"HIP-1998-47/TH","hep-lat astro-ph",,"  Scalar electrodynamics can be used to investigate the formation of cosmic
strings in the early universe. We present the results of lattice Monte Carlo
simulations of an effective three-dimensional U(1)+Higgs theory that describes
the equilibrium properties of finite-temperature scalar electrodynamics near
the transition. A gauge-invariant criterion for the existence of a vortex is
used in measuring the properties of the vortex network in the equilibrium state
both in the Coulomb and in the Higgs phase of the system. The naive definition
of the vortex density becomes meaningless in the continuum limit and special
care is needed in extracting physical quantities. Numerical evidence for a
physical discontinuity in the vortex density is given.
","[{""version"":""v1"",""created"":""Thu, 30 Jul 1998 12:24:05 GMT""}]","2007-05-23"
"hep-ph/9807525","John N. Bahcall","John Bahcall and Plamen Krastev","Do hep neutrinos affect the solar neutrino energy spectrum?","Accepted Phyics Letters B. Related information at
  http://www.sns.ias.edu/~jnb . LaTeX file. 12 pages including 2 figures. Typo
  in Table 2 corrected","Phys.Lett.B436:243-250,1998","10.1016/S0370-2693(98)00920-4",,"hep-ph astro-ph hep-ex nucl-ex nucl-th",,"  If the low energy cross section for 3He + p goes to 4He + e + nu_e, the `hep'
reaction, is > 20 times larger than the best (but uncertain) theoretical
estimates, then this reaction could significantly influence the electron energy
spectrum produced by solar neutrino interactions and measured in the
SuperKamiokande, SNO, and ICARUS experiments. We compare predicted energy
spectra for different assumed hep fluxes and different neutrino oscillation
scenarios with the observed SuperKamiokande spectrum. The spectra with enhanced
hep contributions provide better fits to the SuperKamiokande data.
","[{""version"":""v1"",""created"":""Wed, 29 Jul 1998 19:40:13 GMT""},{""version"":""v2"",""created"":""Thu, 30 Jul 1998 20:26:27 GMT""}]","2009-03-02"
