"hep-ph/9807540","Bronislav ZakharovLandau","B.G.Zakharov","Light-cone path integral approach to the Landau-Pomeranchuk-Migdal
  effect",,"Phys.Atom.Nucl. 61 (1998) 838-854; Yad.Fiz. 61 (1998) 924-940",,,"hep-ph",,"  A new rigorous light-cone path integral approach to the
Landau-Pomeranchuk-Migdal effect in QED and QCD is discussed. The rate of
photon (gluon) radiation by an electron (quark) in a medium is expressed
through the Green's function of a two-dimensional Schrodinger equation with an
imaginary potential. In QED this potential is proportional to the dipole cross
section for scattering of e+e- pair off an atom, in QCD it is proportional to
the cross section of interaction of the color singlet quark-antiquark-gluon
system with a medium constituent. In QED our predictions agree well with the
photon spectrum measured recently at SLAC for 25 GeV electrons. In QCD for a
sufficiently energetic quark produced inside a medium we predict the radiative
energy loss proportional L^{2}, where L is the distance passed by the quark in
the medium. It has a weak dependence on the initial quark energy. The L^{2}
dependence transforms into L^{1} as the quark energy decreases. We also give
new formulas for nuclear shadowing in hard reactions.
","[{""version"":""v1"",""created"":""Wed, 29 Jul 1998 16:32:21 GMT""},{""version"":""v2"",""created"":""Thu, 30 Jul 1998 10:54:21 GMT""}]","2016-09-06"
"hep-ph/9807541","Markus Ringner","B. Andersson, G. Gustafson, J. Hakkinen, M. Ringner and Peter Sutton
  (Lund University)","Is there screwiness at the end of the QCD cascades?","21+1 pages","JHEP 9809 (1998) 014","10.1088/1126-6708/1998/09/014","LU TP 98-14","hep-ph",,"  We discuss what happens at the end of the QCD cascades. We show that, with
just a few reasonable assumptions, the emission of soft gluons is constrained
to produce an ordered field in the form of a helix. We describe how to modify
the Lund fragmentation scheme in order to fragment such a field. Our modified
fragmentation scheme yields results which are consistent with current
experimental measurements, but predicts at least one signature which should be
observable.
","[{""version"":""v1"",""created"":""Wed, 29 Jul 1998 16:40:27 GMT""}]","2009-10-31"
"hep-ph/9807542","Vito Antonelli","V. Antonelli","Discussion about the orthopositronium decay rate and analysis of some
  $O(\alpha^2)$ contributions","Extended version of the talk given at the International Workshop
  ""HADRONIC ATOMS AND POSITRONIUM IN THE STANDARD MODEL"", DUBNA, 26-31 MAY 1998
  11 pages, latex, 4 figures",,,"BUTP-98/17","hep-ph hep-ex physics.atom-ph",,"  I consider the problem of the evaluation of the orthopositronium decay rate,
including second order radiative corrections. I present a brief theoretical
discussion of this problem and a review of the results available in literature,
and, then, I analyze some $O(\alpha^2)$ annihilation-type contributions,
recently computed.
","[{""version"":""v1"",""created"":""Wed, 29 Jul 1998 19:33:01 GMT""}]","2007-05-23"
"hep-ph/9807543","Allan Widom","Y. N. Srivastava, S. Palit, A.Widom and E. Sassaroli","Neutrino Mass Difference Induced Oscillations in Observed Muon Decays","LaTeX 4 pages and two figures",,,"MQT 610","hep-ph",,"  The recent real time KARMEN anomaly for the electron neutrino counting rates
(obtained from stopped muon decays) is analyzed by employing a neutrino flavor
rotation model in which the muon neutrino is in a superposition of only two
mass eigenstates. On the basis of experimental electron neutrino counting
oscillations, we find a neutrino mass splitting $|m_2^2-m_1^2|=(0.22\pm
0.02)(eV/c^2)^2$ and a flavor rotation angle $\phi =0.34\pm 0.10$, both within
a 95% confidence interval.
","[{""version"":""v1"",""created"":""Wed, 29 Jul 1998 21:12:12 GMT""}]","2007-05-23"
"hep-ph/9807544","Masahiro Kawasaki","M. Kawasaki and T. Yanagida","Primordial Black Hole Formation in Supergravity","15pages (RevTeX file), final version to be published in Phys. Rev. D","Phys.Rev.D59:043512,1999","10.1103/PhysRevD.59.043512",,"hep-ph astro-ph",,"  We study a double inflation model (a preinflation + a new inflation) in
supergravity and discuss the formation of primordial black holes which may be
identified with massive compact halo objects (MACHOs) observed in the halo of
our galaxy. The preinflation drives an inflaton for the new inflation close to
the origin through supergravity effects and the new inflation naturally occurs.
If the total e-fold number of the new inflation is smaller than $\sim 60$, both
inflations produce cosmologically relevant density fluctuations. If the
coherent inflaton oscillation after the preinflation continues until the
beginning of the new inflation, density fluctuations on small cosmological
scales can be set suitably large to produce black holes MACHOs of masses $\sim
1 M_{\odot}$ in a wide region of parameter space in the double inflation model.
","[{""version"":""v1"",""created"":""Thu, 30 Jul 1998 06:33:14 GMT""},{""version"":""v2"",""created"":""Fri, 31 Jul 1998 08:01:22 GMT""},{""version"":""v3"",""created"":""Fri, 18 Dec 1998 01:28:44 GMT""}]","2011-07-19"
"hep-ph/9807545","Bernd Kniehl","B.A. Kniehl and A. Sirlin (MPI Munich)","Mass and Width of a Heavy Higgs Boson","8 pages (Latex), 1 figure (Postscript)","Phys.Lett. B440 (1998) 136-140","10.1016/S0370-2693(98)01071-5","MPI/PhT/98-056","hep-ph",,"  The gauge dependence of the Higgs-boson mass and width in the on-shell scheme
of renormalization is studied in the heavy-Higgs-boson approximation. The
corresponding expansions in the pole scheme are analyzed adopting three
frequently employed parametrizations. The convergence properties and other
theoretical features of the on-shell and pole expansions, as well as their
relative merits, are discussed.
","[{""version"":""v1"",""created"":""Thu, 30 Jul 1998 09:09:40 GMT""}]","2009-10-31"
"hep-ph/9807546","Nils Hammon","N. Hammon, L. Gerland, H. St\""ocker, W. Greiner","Charmonium suppression from purely geometrical effects","corrected some typos, improved shadowing ratios","Phys.Rev. C59 (1999) 2744-2752","10.1103/PhysRevC.59.2744",,"hep-ph",,"  The extend to which geometrical effects contribute to the production and
suppression of the $J/\psi$ and $q\bar{q}$ minijet pairs in general is
investigated for high energy heavy ion collisions at SPS, RHIC and LHC
energies. For the energy range under investigation, the geometrical effects
referred to are shadowing and anti-shadowing, respectively. Due to those
effects, the parton distributions in nuclei deviate from the naive
extrapolation from the free nucleon result; $f_{A}\neq A f_{N}$. The strength
of the shadowing/anti-shadowing effect increases with the mass number. The
consequences of gluonic shadowing effects for the $x_F$ distribution of
$J/\psi$'s at $\sqrt s =20$ GeV, $\sqrt s =200$ GeV and $\sqrt s =6$ TeV are
calculated for some relevant combinations of nuclei, as well as the $p_T$
distribution of minijets at midrapidity for $N_f=4$ in the final state.
","[{""version"":""v1"",""created"":""Thu, 30 Jul 1998 09:24:10 GMT""},{""version"":""v2"",""created"":""Wed, 28 Oct 1998 15:19:27 GMT""}]","2009-10-31"
"hep-ph/9807547","Alexei Gladyshev","A.S.Belyaev, A.V.Gladyshev","Could we learn more about HERA high $Q^2$ anomaly from LEP200 and
  TEVATRON? R-parity violation scenario","15 pages, LaTeX file with 9 eps figures",,,,"hep-ph",,"  The excess of high $Q^2$ events at HERA reported in the early 1997 by H1 and
ZEUS collaborations has become the subject of extensive studies in the
framework of several models related to new physics. Here we concentrate on the
most promising, from our point of view, model describing HERA anomaly. We
update our previous analysis and take into account new HERA statistics of the
1997 year. HERA events are considered within the R-parity broken SUSY model for
a specific scenario with several non-zero couplings. R-parity broken SUSY with
several non-zero couplings could explain both high $Q^2 e^+ + jets$ and $\mu^+
+ jets$ observed at HERA. The consequence of such a particular scenario is the
excess of high $Q^2$ di- or tri-jet events at HERA. The relation of this
scenario for LEP and TEVATRON colliders is considered. This study shows that if
a squark resonance does take place at HERA, supersymmetry with broken R-parity
can be revealed at either LEP200 or TEVATRON in the near future.
","[{""version"":""v1"",""created"":""Thu, 30 Jul 1998 10:02:21 GMT""}]","2016-09-06"
"hep-ph/9807548","Elisabeth Kraus","Elisabeth Kraus (1), Georg Weiglein (2) ((1) Univ. Bonn, (2) Univ.
  Karlsruhe)","The Callan-Symanzik equation of the electroweak Standard Model and its
  1-loop functions","39 pages, LaTeX","Nucl.Phys. B551 (1999) 117-154","10.1016/S0550-3213(99)00202-3","Bonn-TH-98-16, KA-TP-12-1998","hep-ph hep-th",,"  We derive the Callan-Symanzik equation of the electroweak Standard Model in
the QED-like on-shell parameterization. The various coefficient functions, the
$\beta$-functions and anomalous dimensions, are determined in one-loop order in
the most general linear gauge compatible with rigid symmetry. In this way the
basic elements for a systematic investigation of higher-order leading
logarithmic contributions in the Standard Model are provided. The one-loop
$\beta$-function of the electromagnetic coupling turns out to be independent of
mass ratios and it is QED-like in this sense. Besides the QED-contributions of
fermions it contains non-abelian contributions from vectors and ghosts with
negative sign, which overcompensate the contributions of the fermions if one
restricts the latter to one fermion generation. We also compare our results
with the symmetric theory and give relations between the $\beta$-functions of
the spontaneously broken and the symmetric theory valid in one-loop order.
","[{""version"":""v1"",""created"":""Thu, 30 Jul 1998 10:21:15 GMT""}]","2009-10-31"
"hep-ph/9807549","Joaquim Inacio da Silva Marcos","J. I. Silva-Marcos","Special Symmetric Quark Mass Matrices","13 pages, LaTex","Phys.Lett. B443 (1998) 276-284","10.1016/S0370-2693(98)01345-8","NIKHEF 98-008","hep-ph",,"  We give a procedure to construct a special class of symmetric quark mass
matrices near the democratic limit of equal Yukawa couplings for each sector.
It is shown that within appropriate weak-bases, the requirements of symmetry
and arg(det[M])=0 are very strong conditions, that necessarily lead to a
Cabibbo angle given by |V_us|=Sqrt[md/ms], and to |V_cb|~ms/mb, in first order.
In addition, we prove that the recently classified ansatze, which also
reproduce these mixing relations, and which were based on the hypothesis of the
Universal Strength for Yukawa couplings, where all Yukawa couplings have equal
moduli while the flavour dependence is only in their phases, are, in fact,
particular cases of the generalized symmetric quark mass matrix ansatze we
construct here. In an excellent numerical example, the experimental values on
all quark mixings and masses are accommodated, and the CP violation phase
parameter is shown to be crucially dependent on the values of mu and V_us.
","[{""version"":""v1"",""created"":""Thu, 30 Jul 1998 10:32:18 GMT""},{""version"":""v2"",""created"":""Tue, 20 Oct 1998 12:21:02 GMT""}]","2009-10-31"
"hep-ph/9807550","Gabor Papp","Romuald A. Janik, Maciej A. Nowak, Gabor Papp and Ismail Zahed","Chiral Disorder and QCD Phase Transitions","5 pages RevTeX","Phys.Lett. B442 (1998) 300-306","10.1016/S0370-2693(98)01210-6",,"hep-ph cond-mat hep-lat nucl-th",,"  If QCD is to undergo a second order phase transition, the light quark return
probability is universal for large times at the critical point. We show that
this behavior is distinct from the one expected at the mobility edge of a
metal-insulator transition or a percolation transition in d$\leq 4$. Our
results are accessible to current lattice QCD simulations.
","[{""version"":""v1"",""created"":""Thu, 30 Jul 1998 11:46:37 GMT""}]","2009-10-31"
"hep-ph/9807551","Bodenmueller","Harald Fritzsch","Mass Hierarchies, Hidden Symmetry and Maximal CP-Violation","11 latex pages",,,"LMU 05/98","hep-ph",,"  In view of the observed strong hierarchy of the quark and lepton masses and
of the flavor mixing angles it is argued that the description of flavor mixing
must take this into account. One particular interesting way to describe the
flavor mixing, which, however, is not the one used today, emerges, which is
particularly suited for models of quark mass matrices based on flavor
symmetries. We conclude that the unitarity triangle important for B physics
should be close to or identical to a rectangular triangle. CP violation is
maximal in this sense.
","[{""version"":""v1"",""created"":""Thu, 30 Jul 1998 12:00:03 GMT""}]","2007-05-23"
"hep-ph/9807552","Haba Naoyuki","Naoyuki Haba","Composite model with neutrino large mixing","20 pages, Latex, no figures","Phys.Rev.D59:035011,1999","10.1103/PhysRevD.59.035011",,"hep-ph",,"  We suggest a simple composite model that induces the large flavor mixing of
neutrino in the supersymmetric theory. This model has only one hyper-color in
addition to the standard gauge group, which makes composite states of preons.
In this model, {\bf 10} and {\bf 1} representations in SU(5) grand unified
theory are composite states and produce the mass hierarchy. This explains why
the large mixing is realized in the lepton sector, while the small mixing is
realized in the quark sector. This model can naturally solve the atmospheric
neutrino problem. We can also solve the solar neutrino problem by improving the
model.
","[{""version"":""v1"",""created"":""Thu, 30 Jul 1998 12:32:26 GMT""}]","2011-03-10"
"hep-ph/9807553","M. V. Libanov","M.V. Libanov, V.A. Rubakov and P.G. Tinyakov","Cosmology with non-minimal scalar field: graceful entrance into
  inflation","LaTeX, uses axodraw style, 7 pages, 1 ps-figure","Phys.Lett. B442 (1998) 63-67","10.1016/S0370-2693(98)01269-6","INR-ML-15-98","hep-ph astro-ph",,"  We propose a scenario of the beginning of inflation in which the non-vacuum
value of the scalar field that drives inflation develops dynamically due to the
non-minimal coupling to gravity. In this scenario, inflation emerges as an
intermediate stage of the evolution of the Universe, well after the Planck
epoch, from a fairly general initial state.
","[{""version"":""v1"",""created"":""Thu, 30 Jul 1998 12:35:27 GMT""}]","2016-09-06"
"hep-ph/9807554","Rajiv V. Gavai","Rajiv V. Gavai (TIFR, Mumbai and CCP, Tsukuba)","Re-assessing the anomalous J/psi-suppression in the CERN NA50 data","7 pages, Latex with epsfig, 2 figures (PS-files)","Mod.Phys.Lett. A14 (1999) 821-826","10.1142/S0217732399000869","TIFR/TH/98-31, UTCCP-P-42","hep-ph",,"  A systematic analysis of the L-dependence of the J/psi-suppression in the
data of the CERN NA38 and NA50 experiments shows that the anomalous suppression
in the 1995 Pb-Pb data is at best a 4$\sigma$ effect at any of the L-values for
the Pb-Pb data, where L is the geometrical mean path length of the J/psi in the
colliding nuclei. Possible implications for the 1996 data are discussed.
","[{""version"":""v1"",""created"":""Thu, 30 Jul 1998 12:35:51 GMT""}]","2009-10-31"
"hep-ph/9807556","George Siopsis","George Siopsis","First-Order QCD Effects in t-tbar Production at the NLC Above Threshold","4 pages, sprocl + 2 figures (included with psfig). Presented at
  PASCOS 98, Boston, MA, March 1998; to appear in the Proceedings of PASCOS 98
  (World Scientific)",,,,"hep-ph",,"  We study the effects of gluon interference in the production and
semi-leptonic decay of a t-tbar pair above threshold at the Next Linear
Collider (NLC). We calculate all matrix elements to next-to-leading order and
use the resulting expressions for the development of a Monte Carlo event
generator. Our results show effects at the level of 10% in differential
cross-sections. We thus extend previous results obtained by analytical means in
the soft-gluon limit.
","[{""version"":""v1"",""created"":""Thu, 30 Jul 1998 13:38:52 GMT""}]","2007-05-23"
"hep-ph/9807557","Michael Pluemacher","M. Plumacher","Baryon Asymmetry, Neutrino Mixing and Supersymmetric SO(10) Unification","Ph.D. thesis, latex2e, 109 pages, 26 figures",,,"DESY-THESIS 1998-009","hep-ph",,"  The baryon asymmetry of the universe can be explained by the
out-of-equilibrium decays of heavy right-handed neutrinos. We analyse this
mechanism in the framework of a supersymmetric extension of the Standard Model
and show that lepton number violating scatterings are indispensable for
baryogenesis, even though they may wash-out a generated asymmetry. By assuming
a similar pattern of mixings and masses for neutrinos and up-type quarks, as
suggested by SO(10) unification, we can generate the observed baryon asymmetry
without any fine tuning, if (B-L) is broken at the unification scale
\Lambda_{GUT}\sim 10^{16} GeV and, if m_{\nu_\mu} \sim 3\cdot 10^{-3} eV as
preferred by the MSW solution to the solar neutrino deficit.
","[{""version"":""v1"",""created"":""Thu, 30 Jul 1998 15:21:56 GMT""}]","2007-05-23"
"hep-th/9807220","Antonio Lima Santos","A. Lima-Santos","Exact solutions of graded Temperley-Lieb Hamiltonians","39 pages, LaTex","Nucl.Phys. B522 (1998) 503-532","10.1016/S0550-3213(98)00240-5",,"hep-th nlin.SI solv-int",,"  Orthosympletic Hamiltonians derived from representations of the
Temperley-Lieb algebra are presented and solved via the coordinate Bethe
Ansatz. The spectra of these Hamiltonians are obtained using open and closed
boundary conditions.
","[{""version"":""v1"",""created"":""Wed, 29 Jul 1998 16:08:24 GMT""}]","2009-10-31"
"hep-th/9807221","L. L. Salcedo","L.L. Salcedo","Temperature dependence of the anomalous effective action of fermions in
  two and four dimensions","RevTex, 19 pages, no figures. References added","Phys. Rev. D 58, 125007 (1998)","10.1103/PhysRevD.58.125007","ugr-dfm-3/98","hep-th",,"  The temperature dependence of the anomalous sector of the effective action of
fermions coupled to external gauge and pseudo-scalar fields is computed at
leading order in an expansion in the number of Lorentz indices in two and four
dimensions. The calculation preserves chiral symmetry and confirms that a
temperature dependence is compatible with axial anomaly saturation. The result
checks soft-pions theorems at zero temperature as well as recent results in the
literature for the pionic decay amplitude into static photons in the chirally
symmetric phase. The case of chiral fermions is also considered.
","[{""version"":""v1"",""created"":""Wed, 29 Jul 1998 16:25:35 GMT""},{""version"":""v2"",""created"":""Mon, 5 Oct 1998 13:54:21 GMT""}]","2016-08-25"
"hep-th/9807222","Csaba Csaki","Csaba Csaki (Berkeley)","The Confining N=1 Supersymmetric Gauge Theories: a Review","12 pages, LaTeX. Talk presented at the 3rd Workshop on Continuous
  Advances in QCD, Minneapolis, MN, 16-19 April 1998. To appear in the
  proceedings",,,"LBNL-42126","hep-th",,"  We give a classification and overview of the confining N=1 supersymmetric
gauge theories. For simplicity we consider only theories based on simple gauge
groups and no tree-level superpotential. Classification of these theories can
be done according to whether or not there is a superpotential generated for the
confined degrees of freedom. The theories with the superpotential include
s-confining theories and also theories where the gauge fields participate in
the confining spectrum, while theories with no superpotential include theories
with a quantum deformed moduli space and theories with an affine moduli space.
","[{""version"":""v1"",""created"":""Wed, 29 Jul 1998 19:11:17 GMT""}]","2007-05-23"
"hep-th/9807223","Dr Ian Kogan","Ian. I. Kogan, O. A. Soloviev","Gravitationally dresed RG flows and zig-zag invariant strings","16 pages, corrected typos, version to be published in Phys.Lett. B","Phys.Lett. B442 (1998) 136-144","10.1016/S0370-2693(98)01211-8","OU-TP-98-41P,QMW-PH-98-35","hep-th",,"  We propose a world-sheet realization of the zigzag-invariant bosonic and
fermionic strings as a perturbed Wess-Zumino-Novikov-Witten model at large
negative level $k$ on a group manifold $G$ coupled to 2D gravity. In the large
$k$ limit the zigzag symmetry can be obtained as a result of a self-consistent
solution of the gravitationally dressed RG equation. The only solution found
for simple group is $G=SL(2)$. More general target-space geometries can be
obtained via tensoring of various cosets based on SL(2). In the supersymmetric
case the zigzag symmetry fixes the maximal target-space dimension of the
confining fermionic string to be seven.
","[{""version"":""v1"",""created"":""Wed, 29 Jul 1998 21:16:18 GMT""},{""version"":""v2"",""created"":""Wed, 30 Sep 1998 12:07:44 GMT""}]","2009-10-31"
"hep-th/9807224","Andrei Johansen","A. Johansen","Positivity Constraints on Anomalies and Supersymmetry","8 pages, uses sprocl.sty, talk given at PASCOS-98",,,,"hep-th",,"  The relation between the trace and R-current anomalies in 4D supersymmetric
theories implies that the U(1)$_R$F$^2$, U(1)$_R$ and U(1)$^3_R$ anomalies
which matched in studies of N=1 Seiberg duality satisfy positivity constraints.
These constraints are tested in a large number of N=1 supersymmetric gauge
theories in the non-Abelian Coulomb phase, and they are satisfied in all
renormalizable models with unique anomaly-free R-current, including those with
accidental symmetry. Most striking is the fact that the flow of the Euler
anomaly coefficient, $a_{UV}-a_{IR}$, is always positive, as conjectured by
Cardy.
","[{""version"":""v1"",""created"":""Wed, 29 Jul 1998 21:25:57 GMT""}]","2007-05-23"
"hep-th/9807225","Michael Douglas","Michael R. Douglas and Washington Taylor IV","Branes in the bulk of Anti-de Sitter space","latex, 8 pp. (v2) Added references and a comment on other base
  spaces. (v3) fixed sign error",,,"PUPT-1806, RU-98-32","hep-th",,"  We consider (3 + 1)-dimensional N=4 super Yang-Mills theory with a
nonvanishing scalar Higgs vacuum expectation value, and compare this theory to
AdS supergravity with branes in the bulk. We show that the one-loop effective
potential for excitations of the Yang-Mills field agrees with the classical
linearized potential for brane waves in the AdS picture in the limit of long
wavelengths. This supports the idea that the AdS/CFT correspondance fits into
string theory as expected from previous work.
","[{""version"":""v1"",""created"":""Wed, 29 Jul 1998 21:42:26 GMT""},{""version"":""v2"",""created"":""Fri, 31 Jul 1998 17:27:02 GMT""},{""version"":""v3"",""created"":""Fri, 14 Aug 1998 19:55:11 GMT""}]","2007-05-23"
"hep-th/9807226","Enrique Alvarez","Enrique Alvarez and Cesar Gomez","Geometric Holography, the Renormalization Group and the c-Theorem","28 pages, Latex, 2 figures","Nucl.Phys. B541 (1999) 441-460","10.1016/S0550-3213(98)00752-4","IFT-UAM/CSIC-98-20","hep-th",,"  In this paper the whole geometrical set-up giving a conformally invariant
holographic projection of a diffeomorphism invariant bulk theory is clarified.
By studying the renormalization group flow along null geodesic congruences a
holographic version of Zamolodchikov's c-theorem is proven.
","[{""version"":""v1"",""created"":""Thu, 30 Jul 1998 08:39:49 GMT""}]","2009-10-31"
"hep-th/9807227","Andreas Opfermann","A. Opfermann","Supersymmetric extensions of affine Toda theories","latex, 13 pages",,,"DAMTP-1998-95","hep-th",,"  It is shown that all affine Toda theories admit (1,0) supersymmetric
extensions. The construction is based on classical Lie algebras and
supersymmetric massive sigma models. The supersymmetrized affine Toda theories
have a unique, supersymmetric vacuum, their mass matrix is well defined and
their energy functional is positive semi-definite.
","[{""version"":""v1"",""created"":""Thu, 30 Jul 1998 10:09:48 GMT""}]","2007-05-23"
"hep-th/9807228","Antti Niemi","Antti J. Niemi, Kaupo Palo and Sami Virtanen","(Meta)stable closed vortices in 3+1 dimensional gauge theories with an
  extended Higgs sector","major revisions, 4 pages and 1 figure",,,,"hep-th astro-ph hep-ph",,"  In gauge theories with an extended Higgs sector the classical equations of
motion can have solutions that describe stable, closed finite energy vortices.
Such vortices separate two disjoint Higgs vacua, with one of the vacua embedded
in the other in a manner that forms a topologically nontrivial knot. The
knottedness stabilizes the vortex against shrinkage in 3+1 dimensional
space-time. But in a world with extra large dimensions we expect the
configuration to decay by unknotting. As an example we consider the semilocal
$\theta_W \to \frac{\pi}{2}$ limit of the Weinberg-Salam model. We present
numerical evidence for the existence of a stable closed vortex, twisted into a
toroidal configuration around a circular Higgs vacuum at its core.
","[{""version"":""v1"",""created"":""Thu, 30 Jul 1998 10:47:07 GMT""},{""version"":""v2"",""created"":""Fri, 26 Nov 1999 17:51:45 GMT""},{""version"":""v3"",""created"":""Mon, 29 Nov 1999 13:22:03 GMT""}]","2007-05-23"
