"cond-mat/9812113",,"Perez Moses and Ross H. McKenzie (University of New South Wales,
  Sydney, Australia)","Comparison of coherent and weakly incoherent transport models for the
  interlayer magnetoresistance of layered Fermi liquids","21 pages, RevTeX + epsf, 4 figures. Published version. Subsection
  added. References updated","Phys. Rev. B 60, 7988 (1999)","10.1103/PhysRevB.60.7998","QE2-98-04","cond-mat.str-el cond-mat.supr-con",,"  The interlayer magnetoresistance of layered metals in a tilted magnetic field
is calculated for two distinct models for the interlayer transport. The first
model involves coherent interlayer transport and makes use of results of
semi-classical or Bloch-Boltzmann transport theory. The second model involves
weakly incoherent interlayer transport where the electron is scattered many
times within a layer before tunneling into the next layer. The results are
relevant to the interpretation of experiments on angular-dependent
magnetoresistance oscillations (AMRO) in quasi-one- and quasi-two-dimensional
metals. We find that the dependence of the magnetoresistance on the direction
of the magnetic field is identical for both models except when the field is
almost parallel to the layers. An important implication of this result is that
a three-dimensional Fermi surface is not necessary for the observation of the
Yamaji and Danner oscillations seen in quasi-two- and quasi-one-dimensional
metals, respectively. A universal expression is given for the dependence of the
resistance at AMRO maxima and minima on the magnetic field and scattering time
(and thus the temperature). We point out three distinctive features of coherent
interlayer transport: (i) a beat frequency in the magnetic oscillations of
quasi-two-dimensional systems, (ii) a peak in the angular-dependent
magnetoresistance when the field is sufficiently large and parallel to the
layers, and (iii) a crossover from a linear to a quadratic field dependence for
the magnetoresistance when the field is parallel to the layers. Properties (i)
and (ii) are compared with published experimental data for a range of
quasi-two-dimensional organic metals and for Sr2RuO4.
","[{""version"":""v1"",""created"":""Tue, 8 Dec 1998 01:01:44 GMT""},{""version"":""v2"",""created"":""Tue, 7 Sep 1999 11:42:19 GMT""}]","2009-10-31"
"cond-mat/9812114","Enno Schloesser","E Schloesser (1), D Saad (2), and M Biehl (1) ((1) Universitaet
  Wuerzburg, (2) Aston University, Birmingham)","Optimisation of on-line principal component analysis","10 pages, 5 figures",,"10.1088/0305-4470/32/22/306",,"cond-mat.dis-nn",,"  Different techniques, used to optimise on-line principal component analysis,
are investigated by methods of statistical mechanics. These include local and
global optimisation of node-dependent learning-rates which are shown to be very
efficient in speeding up the learning process. They are investigated further
for gaining insight into the learning rates' time-dependence, which is then
employed for devising simple practical methods to improve training performance.
Simulations demonstrate the benefit gained from using the new methods.
","[{""version"":""v1"",""created"":""Tue, 8 Dec 1998 10:00:08 GMT""}]","2009-10-31"
"cond-mat/9812115","Thomas Boigs","K. Rejmer (1 and 2), S. Dietrich (1), and M. Napiorkowski (2) ((1)
  University of Wuppertal, (2) University of Warsaw)","Filling transition for a wedge","48 pages (RevTex), 14 figures (ps), submitted to PRE",,"10.1103/PhysRevE.60.4027",,"cond-mat.soft cond-mat.stat-mech",,"  We study the formation and the shape of a liquid meniscus in a wedge with
opening angle $2\phi$ which is exposed to a vapor phase. By applying a suitable
effective interface model, at liquid-vapor coexistence and at a temperature
$T_{\phi}$ we find a filling transition at which the height of the meniscus
becomes macroscopically large while the planar walls of the wedge far away from
its center remain nonwet up to the wetting transition occurring at
$T_w>T_{\phi}$. Depending on the fluid and the substrate potential the filling
transition can be either continuous or discontinuous. In the latter case it is
accompanied by a prefilling line extending into the vapor phase of the bulk
phase diagram and describing a transition from a small to a large, but finite,
meniscus height. The filling and the prefilling transitions correspond to
nonanalyticities in the surface and line contributions to the free energy of
the fluid, respectively.
","[{""version"":""v1"",""created"":""Tue, 8 Dec 1998 11:28:37 GMT""}]","2009-10-31"
"cond-mat/9812116","Weixue Li","Weixue Li and Tzuchiang Wang","Elasticity, Stability and Ideal Strength of $\beta $-SiC in
  plane-wave-based ab initio calculations","9 pages, 10 figures","Phys. Rev. B., Feb. 1, 1999","10.1103/PhysRevB.59.3993",,"cond-mat.mtrl-sci",,"  On the basis of the pseudopotential plane-wave(PP-PW) method and the
local-density-functional theory(LDFT), this paper studies energetics,
stress-strain relation, stability and ideal strength of $\beta $-SiC under
various loading modes, where uniform uniaxial extension and tension, biaxial
proportional extension are considered along directions [001] and [111]. The
lattice constant, elastic constants and moduli of equilibrium state are
calculated, and the results agree well with the experimental data. As the four
Si-C bonds along directions [111], [$\bar{1}$11], [11$\bar{1}$] and
[1$\bar{1}$1] are not the same under the loading along [111], internal
relaxation and the corresponding internal displacements must be considered. We
find that, at the beginning of loading, the effect of internal displacement
through shuffle and glide plane diminishes the difference among the four Si-C
bonds length, but will increase the difference at the subsequent loading, which
will result in a crack nucleated on \{111\} shuffle plane and a subsequently
cleavage fracture. Thus the corresponding theoretical strength is 50.8 GPa,
which agrees well with the recent experiment value, 53.4 GPa. However, with the
loading along [001], internal relaxation is not important for tetragonal
symmetry. Elastic constants during the uniaxial tension along [001] are
calculated. Based on the stability analysis with stiffness coefficients, we
find that the spinodal and Born instabilities are triggered almost at the same
strain, which agrees with the previous molecular dynamics simulation. During
biaxial proportional extension, stress and strength vary proportionally with
the biaxial loading ratio at the same longitudinal strain.
","[{""version"":""v1"",""created"":""Tue, 8 Dec 1998 10:31:50 GMT""}]","2009-10-31"
"cond-mat/9812117","Felix Naef","F. Naef X. Wang, X. Zotos, and W. von der Linden","Autocorrelations from the transfer matrix DMRG method","10 pages, 9 figures",,,,"cond-mat.str-el",,"  Extending the transfer matrix DMRG algorithm, we are able to calculate
imaginary time spin autocorrelations with high accuracy (absolute error
$<10^{-6}$) over a wide temperature range ($0<\beta J<20$). After analytic
continuation using the rules of probability theory along with the entropic
prior (MaxEnt), we obtain real frequency spectra for the XY model, the
isotropic Heisenberg and the gaped Heisenberg-Ising model. Available exact
results in some limits allow for a critical evaluation of the quality of
answers expected from this procedure. We find that high precision data are
still insufficient for resolving specific lineshapes such as low frequency
divergences. However, the method is appropriate for identifying low temperature
gaps and peak positions.
","[{""version"":""v1"",""created"":""Tue, 8 Dec 1998 12:45:19 GMT""}]","2007-05-23"
"cond-mat/9812118","Antonio de Candia","L. Cannavacciuolo, A. de Candia, A. Coniglio","Crossover properties from random percolation to frustrated percolation","5 pages, 7 figs, RevTeX","Int. J. Mod. Phys. C 10, 555 (1999)","10.1142/S0129183199000425",,"cond-mat.stat-mech",,"  We investigate the crossover properties of the frustrated percolation model
on a two-dimensional square lattice, with asymmetric distribution of
ferromagnetic and antiferromagnetic interactions. We determine the critical
exponents nu, gamma and beta of the percolation transition of the model, for
various values of the density of antiferromagnetic interactions pi in the range
0<pi<0.5. Our data are consistent with the existence of a crossover from random
percolation behavior for pi=0, to frustrated percolation behavior,
characterized by the critical exponents of the ferromagnetic 1/2-state Potts
model, as soon as pi>0.
","[{""version"":""v1"",""created"":""Tue, 8 Dec 1998 11:58:25 GMT""}]","2015-06-25"
"cond-mat/9812119","Christian von Ferber","Christian von Ferber (Duesseldorf, Tel Aviv) and Yurij Holovatch
  (Lviv)","Multifractality of Brownian motion near absorbing polymers","18 pages, revtex, 6 ps-figures","Phys. Rev. E 59 (1999) 6914","10.1103/PhysRevE.59.6914",,"cond-mat",,"  We characterize the multifractal behavior of Brownian motion in the vicinity
of an absorbing star polymer. We map the problem to an O(M)-symmetric
phi^4-field theory relating higher moments of the Laplacian field of Brownian
motion to corresponding composite operators. The resulting spectra of scaling
dimensions of these operators display the convexity properties which are
necessarily found for multifractal scaling but unusual for power of field
operators in field theory. Using a field-theoretic renormalization group
approach we obtain the multifractal spectrum for absorbtion at the core of a
polymer star as an asymptotic series. We evaluate these series using
resummation techniques.
","[{""version"":""v1"",""created"":""Tue, 8 Dec 1998 12:20:30 GMT""}]","2016-08-31"
"cond-mat/9812121","Thomas Gramespacher","Thomas Gramespacher and Markus Buttiker","Local non-equilibrium distribution of charge carriers in a
  phase-coherent conductor","4 pages, 2 figures, submitted to ""Comptes Rendus de l'Academie des
  Sciences""","C. R. Acad. Sci. Paris 327, Serie II b, p. 877-884, 1999.","10.1016/S1287-4620(99)80150-1",,"cond-mat.mes-hall",,"  We use the scattering matrix approach to derive generalized Bardeen-like
formulae for the conductances between the contacts of a phase-coherent
multiprobe conductor and a tunneling tip which probes its surface. These
conductances are proportional to local partial densities of states, called
injectivities and emissivities. The current and the current fluctuations
measured at the tip are related to an effective local non-equilibrium
distribution function. This distribution function contains the
quantum-mechanical phase-coherence of the charge carriers in the conductor and
is given as products of injectivities and the Fermi distribution functions in
the electron reservoirs. The results are illustrated for measurements on
ballistic conductors with barriers and for diffusive conductors.
","[{""version"":""v1"",""created"":""Tue, 8 Dec 1998 13:49:09 GMT""}]","2009-10-31"
"cond-mat/9812122","Victor M. Burlakov","V.M.Burlakov, M.Goeppert, A.Jolk, A.Dinger, R.Becker, and
  C.F.Klingshirn","On a biphononic origin of the 1125 cm^(-1) absorption band in cuprous
  oxide","5 pages, 5 figures (to appear in Phys.Lett. A)",,"10.1016/S0375-9601(99)00052-3",,"cond-mat.dis-nn",,"  We report on the IR spectroscopic studies in both reflection (50-900 cm^{-1})
and transmission (900-3000 cm^{-1}) mode of the vibration spectrum of the
cuprous oxide. A detailed analysis based on a comparison of the temperature
dependences of the absorption band at 1125 cm^{-1} and of IR and Raman active
fundamental vibrations results in assignment of the former to a biphonon.
","[{""version"":""v1"",""created"":""Tue, 8 Dec 1998 15:25:36 GMT""},{""version"":""v2"",""created"":""Wed, 9 Dec 1998 06:47:18 GMT""},{""version"":""v3"",""created"":""Mon, 11 Jan 1999 15:01:38 GMT""}]","2009-10-31"
"cond-mat/9812123","J. van den Brink","Jeroen van den Brink, Peter Horsch, Frank Mack and Andrzej M. Oles","Orbital dynamics in ferromagnetic transition metal oxides","13 pages, 12 figures, to appear in Phys. Rev. B","Phys. Rev. B 59, 6795 (1999)","10.1103/PhysRevB.59.6795",,"cond-mat.str-el",,"  We consider a model of strongly correlated $e_g$ electrons interacting by
superexchange orbital interactions in the ferromagnetic phase of LaMnO$_3$. It
is found that the classical orbital order with alternating occupied $e_g$
orbitals has a full rotational symmetry at orbital degeneracy, and the
excitation spectrum derived using the linear spin-wave theory is gapless. The
quantum (fluctuation) corrections to the order parameter and to the ground
state energy restore the cubic symmetry of the model. By applying a uniaxial
pressure orbital degeneracy is lifted in a tetragonal field and one finds an
orbital-flop phase with a gap in the excitation spectrum. In two dimensions the
classical order is more robust near the orbital degeneracy point and quantum
effects are suppressed. The orbital excitation spectra obtained using finite
temperature diagonalization of two-dimensional clusters consist of a
quasiparticle accompanied by satellite structures. The orbital waves found
within the linear spin-wave theory provide an excellent description of the
dominant pole of these spectra.
","[{""version"":""v1"",""created"":""Tue, 8 Dec 1998 15:49:25 GMT""}]","2009-10-31"
"gr-qc/9812025","Robert D. Klauber","Robert D. Klauber","Relativistically Rotating Frames and Non-time-orthogonality","4 pages, no figures. Brief overview of more extensive article
  published in Found. Phys. Lett. 11 (5) 405, Oct 98. Rev includes both LaTeX
  and HTML files","Am.J.Phys. 67 (1999) 158-159","10.1119/1.19213",,"gr-qc",,"  This paper is a brief overview of a more extensive article recently published
in Found. Phys. Lett. [2]. Apparent disagreement with experiment as well as
internal inconsistencies found in the traditional analysis of relativistically
rotating frames/disks are summarized. As one example, a point p at 0 degrees on
the circumference of a rotating disk does not, according to the standard
theory, exist at the same moment in time as the same point p at 360 degrees.
This and other problems with the standard theory are completely resolved by a
novel analysis that directly addresses, apparently for the first time, the
non-time-orthogonal nature of rotating frames. Though ultimately consonant with
the special and general theories of relativity, due to non-time-orthogonality,
the analysis predicts several peculiar (i.e., not traditionally relativistic)
results. For example, the local circumferential speed of light is not invariant
(thereby agreeing with the Sagnac experiment), and no Lorentz contraction
exists along the disk rim. Other experimental results, including time dilation,
mass-energy dependence on speed, and what has heretofore been considered a
""spurious"" signal in the most accurate Michelson-Morley experiment performed to
date, are accurately predicted. Further, the widely accepted postulate for the
equivalence of co-moving inertial and non-inertial rods, used liberally with
prior rotating frame analyses, is shown to be invalid for non-time-orthogonal
frames. This understanding of the ramifications of non-time-orthogonality
resolves paradoxes inherent in the traditional theory.
","[{""version"":""v1"",""created"":""Mon, 7 Dec 1998 16:09:21 GMT""},{""version"":""v2"",""created"":""Sun, 10 Jan 1999 18:05:20 GMT""},{""version"":""v3"",""created"":""Fri, 1 Jun 2001 21:28:51 GMT""}]","2009-10-31"
"gr-qc/9812026","Mihaela Time","Mihaela Time","Static Cylindrically Symmetric Solution","6 pages, http://users.warpnet.ro/~mtime/",,,,"gr-qc",,"  A static axisymmetric solution with an additional cylindrical symmetry is
considered and that the matter consists in a cosmological and a dust term.
","[{""version"":""v1"",""created"":""Mon, 7 Dec 1998 20:38:38 GMT""},{""version"":""v2"",""created"":""Wed, 30 Dec 1998 17:24:14 GMT""}]","2007-05-23"
"gr-qc/9812027","Alexander Vilenkin","Alexander Vilenkin (Tufts University)","The quantum cosmology debate","Contribution to the debate on quantum cosmology at the COSMO-98
  meeting. 9 pages, 6 figures",,"10.1063/1.59443",,"gr-qc astro-ph hep-th",,"  I review the tunneling, Hartle-Hawking and Linde proposals for the wave
function of the universe and comment on the recent work on quantum creation of
open universes.
","[{""version"":""v1"",""created"":""Mon, 7 Dec 1998 21:32:09 GMT""}]","2009-10-31"
"gr-qc/9812028","K. Srinivasan","K. Srinivasan and T. Padmanabhan","Particle production and complex path analysis","26 pages, Latex file, one eps figure","Phys.Rev.D60:024007,1999","10.1103/PhysRevD.60.024007","IUCAA-44/98","gr-qc hep-th",,"  This paper discusses particle production in Schwarzchild-like spacetimes and
in an uniform electric field. Both problems are approached using the method of
complex path analysis. Particle production in Schwarzchild-like spacetimes with
a horizon is obtained here by a new and simple semi-classical method based on
the method of complex paths. Hawking radiation is obtained in the (t,r)
co-ordinate system of the standard Schwarzchild metric {\it without} requiring
the Kruskal extension. The co-ordinate singularity present at the horizon
manifests itself as a singularity in the expression for the semi-classical
propagator for a scalar field. We give a prescription whereby this singularity
is regularised with Hawking's result being recovered. In the case of the
electric field, standard quantum field theoretic methods can be used to obtain
particle production in a purely time-dependent gauge. In a purely
space-dependent gauge, however, the tunnelling interpretation has to be
resorted to. We attempt, in this paper, to provide a tunnelling description for
both the time and space dependent gauges. The usefulness of such a common
description becomes evident when `mixed' gauges, which are functions of both
space and time variables, are analysed. We report, in this paper, certain mixed
gauges which have the interesting property that mode functions in these gauges
are found to be a combination of {\it elementary} functions unlike the standard
modes. Finally, we present an attempt to interpret particle production by the
electric field as a tunnelling process between the two sectors of the Rindler
spacetime.
","[{""version"":""v1"",""created"":""Tue, 8 Dec 1998 13:11:38 GMT""}]","2008-11-26"
"hep-ex/9812010","Ashutosh V. Kotwal","B. Abbott, et al (D0 Collaboration)","Measurement of the High-Mass Drell-Yan Cross Section and Limits on
  Quark-Electron Compositeness Scales","6 pages, 2 figures, submitted to PRL","Phys.Rev.Lett.82:4769-4774,1999","10.1103/PhysRevLett.82.4769","Fermilab-Pub-98/391-E","hep-ex",,"  We present a measurement of the Drell-Yan cross section at high dielectron
invariant mass using 120/pb of data collected in pbar-p collisions at sqrt(s) =
1.8 TeV by the D0 collaboration during 1992-96. No deviation from standard
model expectations is observed. We use the data to set limits on the energy
scale of quark-electron compositeness with common constituents. The 95%
confidence level lower limits on the compositeness scale vary between
  3.3 TeV and 6.1 TeV depending on the assumed form of the effective contact
interaction.
","[{""version"":""v1"",""created"":""Mon, 7 Dec 1998 23:17:46 GMT""}]","2016-08-31"
"hep-ex/9812011","Masayuki Nakahata","The Super-Kamiokande collaboration","Measurement of the solar neutrino energy spectrum using
  neutrino-electron scattering","12 pages, 3 figures","Phys.Rev.Lett. 82 (1999) 2430-2434","10.1103/PhysRevLett.82.2430",,"hep-ex",,"  A measurement of the energy spectrum of recoil electrons from solar neutrino
scattering in the Super--Kamiokande detector is presented. The results shown
here are obtained from 504 days of data taken between the 31st of May, 1996 and
the 25th of March, 1998. The shape of the measured spectrum is compared with
the expectation for solar B8 neutrinos. The comparison takes into account both
kinematic and detector related effects in the measurement process. The spectral
shape comparison between the observation and the expectation gives a chi-square
of 25.3 with 15 degrees of freedom, corresponding to a 4.6% confidence level.
","[{""version"":""v1"",""created"":""Tue, 8 Dec 1998 02:25:38 GMT""}]","2015-06-25"
"hep-lat/9812006","Margarita Garcia Perez","Margarita Garcia Perez, Owe Philipsen, Ion Olimpiu Stamatescu","Cooling, Physical Scales and Topology","25 pages, 8 figures, minor corrections, references added","Nucl.Phys.B551:293-313,1999","10.1016/S0550-3213(99)00211-4","CERN-TH-98-380, HD-THEP-98-60, FTUAM-98-26","hep-lat hep-ph",,"  We develop a cooling method controlled by a physical cooling radius that
defines a scale below which fluctuations are smoothed out while leaving physics
unchanged at all larger scales. We apply this method to study topological
properties of lattice gauge theories, in particular the behaviour of
instantons, dislocations and instanton--anti-instanton pairs. Monte Carlo
results for the SU(2) topology are presented. We find that the method provides
a means to prevent instanton--anti-instanton annihilation under cooling. While
the instanton sizes are largely independent from the smoothing scale, the
density and pair separations are determined by the particular choice made for
this quantity. We discuss the questions this raises for the ""physicality"" of
these concepts.
","[{""version"":""v1"",""created"":""Mon, 7 Dec 1998 17:36:23 GMT""},{""version"":""v2"",""created"":""Fri, 11 Dec 1998 17:12:07 GMT""}]","2010-12-14"
"hep-lat/9812007","Norikazu Yamada","K-I. Ishikawa, T. Onogi and N. Yamada","$O(a\alpha_s)$ matching coefficients for the $\Delta B$=2 operators in
  the lattice static theory","14 pages, no figures, uses REVTeX; added references, corrected typos","Phys.Rev. D60 (1999) 034501","10.1103/PhysRevD.60.034501","HUPD-9831","hep-lat",,"  We present the perturbative matching coefficient to $O(a\alpha_s)$ which
relates the $\Delta B$=2 operator in the continuum to that of the lattice
static theory, which is important in the accurate extraction of the continuum
value of the $B_B$ from lattice simulations. The coefficients are obtained by
the one-loop calculations in both of the continuum and lattice theory. We find
that two new dimension seven operators appear at the $O(a\alpha_s)$ with the
O(1) coefficients. We also discuss the possible cancellation of $O(a\alpha_s)$
correction in the ratio $B_B=<\bar{B}|\Op_L|B>/ ((8/3)(f_{B}M_{B})^2)$
qualitatively.
","[{""version"":""v1"",""created"":""Mon, 7 Dec 1998 21:20:33 GMT""},{""version"":""v2"",""created"":""Tue, 15 Dec 1998 07:11:43 GMT""}]","2009-10-31"
"hep-ph/9812269","Thorsten Feldmann","T. Feldmann (U Wuppertal), P. Kroll (U Wuppertal and U Adelaide), and
  B. Stech (U Heidelberg)","Mixing and Decay Constants of Pseudoscalar Mesons: The Sequel","9 pages","Phys.Lett. B449 (1999) 339-346","10.1016/S0370-2693(99)00085-4","WUB 98-40, ADP-98-75/T342, HD-THEP-98-59","hep-ph",,"  We present further tests and applications of the new eta-eta' mixing scheme
recently proposed by us. The particle states are decomposed into orthonormal
basis vectors in a light-cone Fock representation. Because of flavor symmetry
breaking the mixing of the decay constants can be identical to the mixing of
particle states at most for a specific choice of this basis. Theoretical and
phenomenological considerations show that the quark flavor basis has this
property and allows, therefore, for a reduction of the number of mixing
parameters. A detailed comparison with other mixing schemes is also presented.
","[{""version"":""v1"",""created"":""Mon, 7 Dec 1998 16:47:27 GMT""},{""version"":""v2"",""created"":""Thu, 28 Jan 1999 09:38:48 GMT""}]","2009-10-31"
"hep-ph/9812270","Fredrick Olness","Fredrick I. Olness","Heavy Quark Production","Latex, 10 pages, 7 Figures. Talk presented at 4th Workshop on Heavy
  Quarks at Fixed Target (HQ 98), Fermilab, Batavia, IL, 10-12 Oct 1998",,"10.1063/1.57766","SMU-HEP/98-07","hep-ph",,"  We provide a brief overview of some current experimental and theoretical
issues of heavy quark production.
","[{""version"":""v1"",""created"":""Mon, 7 Dec 1998 19:49:46 GMT""}]","2009-10-31"
"hep-ph/9812271","Fredrick Olness","B. I. Ermolaev, F. I. Olness, A. G. Shuvaev","Asymptotic high energy behavior of the deeply virtual Compton scattering
  amplitude","Latex, 22 pages, 5 Figures; references enhanced; typos corrected","Phys. Rev. D 60, 034013 (1999)","10.1103/PhysRevD.60.034013","SMU-HEP/98-08","hep-ph",,"  We compute the deeply virtual Compton scattering (DVCS) amplitude for forward
and backward scattering in the asymptotic limit. Since this calculation does
not assume ordering of the transverse momenta, it includes important
logarithmic contributions that are beyond those summed by the DGLAP evolution.
These contributions lead to a power-like behavior for the forward DVCS
amplitude.
","[{""version"":""v1"",""created"":""Mon, 7 Dec 1998 18:00:49 GMT""},{""version"":""v2"",""created"":""Thu, 25 Mar 1999 16:16:40 GMT""}]","2016-08-25"
