"astro-ph/9812141","Tom Theuns","Tom Theuns (IoA, Cambridge), Anthony Leonard (Oxford), Joop Schaye
  (IoA, Cambridge), George Efstathiou (IoA, Cambridge)","Dependencies of QSO Lyman-alpha absorption line statistics on
  cosmological parameters","5 pages, latex (mn.sty), 3 figures, to be published in MNRAS","Mon.Not.Roy.Astron.Soc. 303 (1999) L58","10.1046/j.1365-8711.1999.02393.x",,"astro-ph",,"  We have performed high-resolution hydrodynamic simulations of the Lyman-alpha
forest in a variety of popular cold dark matter dominated cosmologies,
including a low density and a vacuum-dominated model. The fluctuation amplitude
of these models is chosen to match the observed abundance of galaxy clusters at
low redshift. We assume that the intergalactic medium is photoionized and
photoheated by a uniform UV-background with the required amplitude to give the
observed mean hydrogen absorption. We produce simulated spectra, analyze them
by fitting Voigt profiles and compare line statistics with those obtained from
high resolution observations. All models give column density distributions in
good agreement with observations. However, the distribution of line widths (the
b-parameter distribution) reflects differences in the temperature of the
intergalactic medium between the models, with colder models producing more
narrow lines. All the models with a low baryon density, Omega_b h^2=0.0125, are
too cold to produce a b-parameter distribution in agreement with observations.
Models with a higher baryon density, Omega_b h^2=0.025, are hotter and provide
better fits. Peculiar velocities contribute significantly to the line widths in
models with low matter density, and this improves the agreement with
observations further. We briefly discuss alternative mechanisms for reconciling
the simulations with the observed b-parameter distributions.
","[{""version"":""v1"",""created"":""Tue, 8 Dec 1998 13:52:49 GMT""}]","2009-10-31"
"astro-ph/9812142","Rene Oudmaijer","R.D. Oudmaijer (Imperial College, London), M.A.T. Groenewegen
  (Max-Planck-Institut fur Astrophysik, Garching), H. Schrijver (SRON, Utrecht)","The absolute magnitude of K0V stars from HIPPARCOS parallaxes","4 pages, 4 figures, A&A Letters, January 1999","Astron.Astrophys.341:L55-L58,1999",,,"astro-ph",,"  We investigate the properties of K0V stars with Hipparcos parallaxes and
spectral types taken from the Michigan Spectral Survey. The sample of 200
objects allows the empirical investigation of the magnitude selection
(Malmquist) bias, which appears clearly present. By selecting those objects
that are not affected by bias, we find a mean absolute magnitude of Mv~5.7, a
downward revision from 5.9 mag. listed in Schmidt-Kaler (1982). Some objects
have absolute magnitudes far brighter than Mv~5.7, and it is suggested that
these objects (~20% of the total sample) are K0IV stars which may have been
mis-classified as a K0V star. The presence of the Malmquist bias in even this
high quality sample suggests that no sample can be expected to be bias-free.
","[{""version"":""v1"",""created"":""Tue, 8 Dec 1998 14:23:04 GMT""}]","2014-10-13"
"astro-ph/9812143","Peter Kahabka","P. Kahabka (University of Amsterdam), W. Pietsch (MPE), M.D. Filipovic
  (University of Western Sydney), and F. Haberl (MPE)","A ROSAT PSPC X-Ray Survey of the Small Magellanic Cloud","Accepted by A&AS, 13 pages, 2 Postscript figures",,"10.1051/aas:1999199",,"astro-ph",,"  We present the results of a systematic search for point-like and moderately
extended soft (0.1-2.4 keV) X-ray sources in a raster of nine pointings
covering a field of 8.95 deg^2 and performed with the ROSAT PSPC between
October 1991 and October 1993 in the direction of the Small Magellanic Cloud.
We detect 248 objects which we include in the first version of our SMC
catalogue of soft X-ray sources. We set up seven source classes defined by
selections in the count rate, hardness ratio and source extent. We find five
high luminosity super-soft sources (1E 0035.4-7230, 1E 0056.8-7146, RX
J0048.4-7332, RX J0058.6-7146 and RX J0103-7254), one low-luminosity super-soft
source RX J0059.6-7138 correlating with the planetary nebula L357, 51 candidate
hard X-ray binaries including eight bright hard X-ray binary candidates, 19
supernova remnants, 19 candidate foreground stars and 53 candidate background
active galactic nuclei (and quasars). We give a likely classification for ~60%
of the catalogued sources. The total count rate of the detected point-like and
moderately extended sources in our catalogue is 6.9+/-0.3 s^-1, comparable to
the background subtracted total rate from the integrated field of ~6.1+/-0.1
s^-1.
","[{""version"":""v1"",""created"":""Tue, 8 Dec 1998 14:30:09 GMT""}]","2009-10-31"
"astro-ph/9812144","Halton Arp","Halton Arp","Redshifts of New Galaxies","Invited review talk at the 194th IAU Symp. on ""Activity in galaxies
  and related phenomena"", held in Byurakan, Armenia, August 17-21, 1998, Eds.
  Y.Terzian, E.Khachikian, and D.Weedman, PASP Conf. Series, in press",,,,"astro-ph",,"  Observations increasingly demonstrate the spatial association of high
redshift objects with larger, low redshift galaxies. These companion objects
show a continuous range of physical properties - from very compact, high
redshift quasars, through smaller active galaxies and finally to only slightly
smaller companion galaxies of slightly higher redshift. The shift in energy
distribution from high to low makes it clear that are seeing an empirical
evolution from newly created to older, more normal galaxies.
  In order to account for the evolution of intrinsic redshift we must conclude
that matter is initially born with low mass particles whose mass increase with
time (age). This requires a physics which is non-local (Machian) and which is
therefore more applicable to the cosmos than the Big Bang extrapolation of
local physics. Ambartsumian's ""superfluid"" foresaw some of the properties of
the new, low particle mass, protogalactic plasma which is required,
demonstrating again the age-old lesson that open minded observation is much
more powerful than theoretical assumptions.
  Since the ejected plasma, which preferentially emerges along the minor axis
of the parent galaxy, develops into an entire galaxy, accretion disks cannot
supply sufficient material. New matter must be created within a ""white hole""
rather than bouncing old matter off a ""black hole"".
","[{""version"":""v1"",""created"":""Tue, 8 Dec 1998 14:41:55 GMT""}]","2007-05-23"
"astro-ph/9812145","Scott Tremaine","S. Tremaine and J. P. Ostriker (Princeton University Observatory)","Relaxation in stellar systems and the shape and rotation of the inner
  dark halo","7 pages, Latex, no figures. Submitted to MNRAS","Mon.Not.Roy.Astron.Soc. 306 (1999) 662-668","10.1046/j.1365-8711.1999.02558.x","POPe-781","astro-ph",,"  Why do galactic bars rotate with high pattern speeds, when dynamical friction
should rapidly couple the bar to the massive, slowly rotating dark halo? This
longstanding paradox may be resolved by considering the dynamical interactions
between the galactic disk and structures in the dark halo. Dynamical friction
between small-scale halo structure and the disk spins up and flattens the inner
halo, thereby quenching the dynamical friction exerted by the halo on the bar;
at the same time the halo heats and thickens the disk, perhaps forming a
rapidly rotating bulge. Two possible candidates for the required halo
structures are massive black holes and tidal streamers from disrupted precursor
halos. More generally, gravitational scattering from phase-wrapped
inhomogeneities represents a novel relaxation process in stellar systems,
intermediate between violent relaxation and two-body relaxation, which can
isotropize the distribution function at radii where two-body relaxation is not
effective.
","[{""version"":""v1"",""created"":""Tue, 8 Dec 1998 14:44:49 GMT""}]","2009-10-31"
"astro-ph/9812146","Scott Tremaine","S. Tremaine","The geometry of phase mixing","14 pages, Latex, 4 figures. Submitted to MNRAS","Mon.Not.Roy.Astron.Soc. 307 (1999) 877-883","10.1046/j.1365-8711.1999.02690.x","POPe-782","astro-ph",,"  Partially phase-mixed structures in galaxies occupy a complex surface of
dimension D in six-dimensional phase space. The appearance of such structures
to observers is determined by their projection into a subspace whose
dimensionality K is determined by the number of observables (e.g. sky position,
distance, radial velocity, etc.). We discuss the expected dimensionality of
phase-space structures and suggest that the most prominent features in surveys
with K=D or K>D will be stable singularities (catastrophes). The simplest of
these are the shells seen in the outer parts of elliptical galaxies.
","[{""version"":""v1"",""created"":""Tue, 8 Dec 1998 15:16:18 GMT""}]","2009-10-31"
"astro-ph/9812147","Sabine Moehler","S. Moehler (Dr. Remeis-Sternwarte Bamberg)","Hot Stars in Globular Clusters","26 pages, 11 Postscript figures, to appear in Reviews in Modern
  Astronomy (Astronomische Gesellschaft)",,,,"astro-ph",,"  Blue horizontal branch and UV bright stars in several globular clusters are
analysed spectroscopically and the results are compared with predictions of
stellar evolutionary theory. We find that the distribution of temperatures and
surface gravities of the blue HB stars may be explained by the effects of deep
mixing. The masses derived for these stars are too low unless one uses the long
distance scale for globular clusters. First results on blue HB stars in metal
rich clusters are presented.
  Analyses of hot UV bright stars in globular clusters uncovered a lack of
genuine post-asymptotic giant branch stars which may explain the lack of
planetary nebulae in globular clusters seen by Jacoby et al. (1997). Abundance
analyses of post-AGB stars in two globular clusters suggest that gas and dust
may separate during the AGB phase.
","[{""version"":""v1"",""created"":""Tue, 8 Dec 1998 15:52:43 GMT""}]","2007-05-23"
"chao-dyn/9812014","A. Mary Selvam","A. M. Selvam, D. Sen and S.M.S. Mody","A Study of Circadian Rhythm and Meteorological Factors Influencing Acute
  Myocardial Infarction","31 pages, 8 figures",,,"Indian Institute of tropical meteorology, Pune, India, research
  report no. RR-073, April 1997","chao-dyn nlin.CD physics.med-ph",,"  The circadian rhythm in the occurrence of acute myocardial infarction (AMI)
was assessed in three hundred and twenty three patients admitted with AMI
during the two-year period June 1992 to May 1994. The influence of the
following meteorological, solar-geophysical and cosmic parameters in the
causation of an infarct was also considered : (1) surface pressure (2) maximum
temperature (3) minimum temperature (4) relative humidity (5) cosmic ray index
(6) geomagnetic aa index (7) solar flares and (8) sunspot number. A well
pronounced diurnal variability in AMI with a peak in the morning hours (6-12
a.m.) was seen. Further analysis of the data by considering one-hour periods
revealed the presence of a smaller evening (10 p.m.) increase in incidence,
i.e., the existence of a bimodal circadian rhythm. The simultaneous occurrence
of the well documented semi-diurnal rhythm in surface pressure and incidence of
acute myocardial infarction were evident. This may be one of the factors
involved in the causation of the smaller evening peak-the reasons for which
were unclear till now. Month-to-month variation in surface pressure was also
found to be significantly correlated with incidence of acute myocardial
infarction. Recognition of a circadian rhythm in the onset of AMI suggests the
need for enhanced pharmacological protection during the vulnerable periods.
Significant correlations were also found between monthly incidence of AMI and
month-to-month variation of cosmic ray index and solar flare counts. The
pattern of incidence of AMI was seen to be modified by full moon and new moon.
There was no association between maximum temperature, minimum temperature or
relative humidity and incidence of AMI.
","[{""version"":""v1"",""created"":""Tue, 8 Dec 1998 06:04:14 GMT""}]","2007-05-23"
"cond-mat/9812093","Dmitri Khveshchenko","D.V.Khveshchenko","Phonon Mediated Transresistivity in a Double Layer Composite Fermion
  System","Latex, 13 pages, Nordita report",,,,"cond-mat",,"  We consider the fractional drag in a double layer system of two-dimensional
electrons in the half-filled lowest Landau level. At sufficiently large
inter-layer separations the drag is dominated by exchange of acoustic phonons
and exhibits novel temperature and inter-layer distance dependences. At low
temperatures the phonon mediated drag is strongly enhanced with respect to the
case of zero magnetic field.
","[{""version"":""v1"",""created"":""Mon, 7 Dec 1998 16:02:51 GMT""}]","2007-05-23"
"cond-mat/9812104","Friederike Schmid","A. Werner, F. Schmid, M. Mueller","Monte Carlo simulations of copolymers at homopolymer interfaces:
  Interfacial structure as a function of the copolymer density","to appear in J. Chem. Phys","J. Chem. Phys. 110, 5370 (1999).","10.1063/1.478432",,"cond-mat.soft cond-mat.mtrl-sci",,"  By means of extensive Monte Carlo simulations of the bond fluctuation model,
we study the effect of adding AB diblock copolymers on the properties of an
interface between demixed homopolymer phases. The parameters are chosen such
that the homopolymers are strongly segregated, and the whole range of copolymer
concentrations in the two phase coexistence region is scanned. We compare the
``mushroom'' regime, in which copolymers are diluted and do not interact with
each other, with the ``wet brush'' regime, where copolymers overlap and
stretch, but are still swollen by the homopolymers. A ``dry brush'' regime is
never entered for our choice of chain lengths. ``Intrinsic'' profiles are
calculated using a block analysis method introduced by us in earlier work. We
discuss density profiles, orientational profiles and contact number profiles.
In general, the features of the profiles are similar at all copolymer
concentrations, however, the profiles in the concentrated regime are much
broader than in the dilute regime. The results compare well with
self-consistent field calculations.
","[{""version"":""v1"",""created"":""Mon, 7 Dec 1998 16:24:15 GMT""}]","2009-10-31"
"cond-mat/9812105","Giuseppe A. Falci","G. Falci (Catania), G. Giaquinta (Catania) and U. Weiss (Stuttgart)","The Quantum Dissipative Villain Model","5 pages, 1 figure, Proceedings of the Conference ""Path Integrals from
  peV to TeV"", Firenze, August 1998, to be published by World Scientific",,,"SMT-02-98","cond-mat.mes-hall",,"  We introduce the Quantum Dissipative Villain (QDV) model as a prototype model
to study tunneling in dissipative quantum mechanics. Dissipation is provided by
a coupled linear environment. In the QDV model, the discrete character of a
tunneling degree of freedom coupled to an environment is explicit, leading to a
rich dual structure.
  We derive general exact mappings of the QDV model on several dual discrete
representations, including pairs of self-dual models, for general linear
environments and arbitrary temperatures. Self-duality allows to write exact
equations for each correlation function of each representation.
  Analogies with the theory of classical network transformations are also
presented. Finally we discuss the fundamental character of the QDV model.
  For instance, the standard Caldeira-Leggett model, which describes mesoscopic
Josephson junctions in a circuit and many other physical systems, is a special
QDV model. The self-dual structure of the QDV model allows then the exact
generalization of the Schmid approximate self-duality to general linear
environments and arbitrary temperatures.
","[{""version"":""v1"",""created"":""Mon, 7 Dec 1998 16:28:39 GMT""}]","2007-05-23"
"cond-mat/9812106","A. Mobius","A. Mobius, C. Frenzel, R. Thielsch, R. Rosenbaum, C.J. Adkins, M.
  Schreiber, H.-D. Bauer, R. Grotzschel, V. Hoffmann, T. Krieg, N. Matz, H.
  Vinzelberg, and M. Witcomb","The metal-insulator transition in amorphous Si_{1-x}Ni_x: Evidence for
  Mott's minimum metallic conductivity","RevTex-file: 25 pages, 17 Postscript figures, 1 GIF figure (original
  Ps file can be obtained on request). Published version. Changes of v2: Sec.
  VII completed by two paragraphs on nature of transition, several refs. added","Phys. Rev. B 60, 14209 (1999)","10.1103/PhysRevB.60.14209",,"cond-mat.dis-nn",,"  We study the metal-insulator transition in two sets of amorphous Si_{1-x}Ni_x
films. The sets were prepared by different, electron-beam-evaporation-based
technologies: evaporation of the alloy, and gradient deposition from separate
Ni and Si crucibles. The characterization included electron and scanning
tunneling microscopy, glow discharge optical emission spectroscopy, and
Rutherford back scattering. Investigating the logarithmic temperature
derivative of the conductivity, w = d ln sigma / d ln T, we observe that, for
insulating samples, w(T) shows a minimum increasing at both low and high T.
Both the minimum value of w and the corresponding temperature seem to tend to
zero as the transition is approached. The analysis of this feature of w(T,x)
leads to the conclusion that the transition in Si_{1-x}Ni_x is very likely
discontinuous at zero temperature in agreement with Mott's original views.
","[{""version"":""v1"",""created"":""Mon, 7 Dec 1998 20:32:47 GMT""},{""version"":""v2"",""created"":""Wed, 3 Feb 1999 09:51:07 GMT""},{""version"":""v3"",""created"":""Mon, 29 Oct 2001 15:46:05 GMT""}]","2009-10-31"
"cond-mat/9812107","Antonio de Candia","A. de Candia, V. Cataudella, and A. Coniglio","Cluster formulation of spin glasses and the frustrated percolation
  model: statics and dynamics","10 pages, 19 figs, RevTeX","J. Phys. A 32, 4817 (1999)","10.1088/0305-4470/32/26/302",,"cond-mat.stat-mech",,"  We study the properties of the q-state frustrated bond percolation model by a
Monte Carlo ""bond flip"" dynamics, using an algorithm originally devised by
Sweeny and suitably modified to treat the presence of frustration. We analyze
the percolation transition of the model, and find that it falls in the
universality class of the q/2-state ferromagnetic Potts model. We then
investigate the bond flip dynamics of the model, and find that for temperatures
lower than the percolation transition Tp the relaxation functions show a two
step decay, reminiscent of the relaxation of glass forming liquids. The long
time decay (alpha-relaxation) is well fitted for T<Tp by a stretched
exponential function, showing that in this model the relevant mechanism for the
appearing of stretched exponentials is the percolation transition. At very low
temperatures the relaxation functions develop a long plateau, as observed in
glass forming liquids.
","[{""version"":""v1"",""created"":""Mon, 7 Dec 1998 17:20:17 GMT""}]","2009-10-31"
"cond-mat/9812108","Nikolas Provatas","Nikolas Provatas, Nigel Goldenfeld and Jonathan Dantzig, Jeffrey C.
  LaCombe, Afina Lupulescu, Matthew B. Koss, and Martin E.Glicksman","Crossover Scaling in Dendritic Evolution at Low Undercooling",,,"10.1103/PhysRevLett.82.4496",,"cond-mat.mtrl-sci cond-mat.dis-nn cond-mat.soft",,"  We examine scaling in two-dimensional simulations of dendritic growth at low
undercooling, as well as in three-dimensional pivalic acid dendrites grown on
NASA's USMP-4 Isothermal Dendritic Growth Experiment. We report new results on
self-similar evolution in both the experiments and simulations. We find that
the time dependent scaling of our low undercooling simulations displays a
cross-over scaling from a regime different than that characterizing Laplacian
growth to steady-state growth.
","[{""version"":""v1"",""created"":""Mon, 7 Dec 1998 18:43:14 GMT""},{""version"":""v2"",""created"":""Mon, 10 May 1999 15:54:39 GMT""}]","2009-10-31"
"cond-mat/9812109","Christophe Josserand","Christophe Josserand (James Franck Institute, University of Chicago,
  USA)","Cavitation induced by explosion in a model of ideal fluid","21 pages,13 figures, other comments",,"10.1103/PhysRevE.60.482",,"cond-mat",,"  We discuss the problem of an explosion in the cubic-quintic superfluid model,
in relation to some experimental observations. We show numerically that an
explosion in such a model might induce a cavitation bubble for large enough
energy. This gives a consistent view for rebound bubbles in superfluid and we
indentify the loss of energy between the successive rebounds as radiated waves.
We compute self-similar solution of the explosion for the early stage, when no
bubbles have been nucleated. The solution also gives the wave number of the
excitations emitted through the shock wave.
","[{""version"":""v1"",""created"":""Mon, 7 Dec 1998 20:31:40 GMT""}]","2009-10-31"
"cond-mat/9812110","Hubert Saleur","H. Saleur","Lectures on Non Perturbative Field Theory and Quantum Impurity Problems","56 pages, 17 figures",,,,"cond-mat hep-th",,"  These are lectures presented at the Les Houches Summer School ``Topology and
Geometry in Physics'', July 1998. They provide a simple introduction to non
perturbative methods of field theory in 1+1 dimensions, and their application
to the study of strongly correlated condensed matter problems - in particular
quantum impurity problems. The level is moderately advanced, and takes the
student all the way to the most recent progress in the field: many exercises
and additional references are provided.
  In the first part, I give a sketchy introduction to conformal field theory. I
then explain how boundary conformal invariance can be used to classify and
study low energy, strong coupling fixed points in quantum impurity problems. In
the second part, I discuss quantum integrability from the point of view of
perturbed conformal field theory, with a special emphasis on the recent ideas
of massless scattering. I then explain how these ideas allow the computation of
(experimentally measurable) transport properties in cross-over regimes. The
case of edge states tunneling in the fractional quantum Hall effect is used
throughout the lectures as an example of application.
","[{""version"":""v1"",""created"":""Mon, 7 Dec 1998 22:28:58 GMT""}]","2007-05-23"
"cond-mat/9812111","Carlos Wexler","K. Tsemekhman, V. Tsemekhman, and C. Wexler","Quantum Hall Effect: Current Distribution and Existence of Extended
  States","12 pages, 8 eps figures (in paper)",,,,"cond-mat.mes-hall",,"  We present a consistent description of the current distribution in the
quantum Hall effect, based on two main ingredients: the location of the
extended states and the distribution of the electric field. We show that the
interaction between electrons produces a boundary line below the Fermi energy,
which extends from source to drain. The existence of this line and that of a
physical boundary are responsible for the formation of a {\em band} of extended
states that carry the Hall current. The number and density of these extended
states are determined by the difference between the energy of this
equipotential boundary line and the energy of the single extended state that
would exist in an infinite system. This is used to prove that the band of
extended states is distributed through the bulk of the sample. We explore the
distribution of the Hall currents and electric fields in by presenting a model
that captures the main features of the charge relaxation processes. Theoretical
predictions based on this model and on the preceding theory are used to
unambiguously explain recent experimental findings.
","[{""version"":""v1"",""created"":""Mon, 7 Dec 1998 23:28:27 GMT""},{""version"":""v2"",""created"":""Tue, 15 Dec 1998 19:11:58 GMT""}]","2007-05-23"
"cond-mat/9812112","Suncica Elezovic Hadjic","Suncica Elezovic-Hadzic (Faculty of Physics, University of Belgrade),
  Natasa Vasiljevic (Institute of Biophysics, University of Belgrade)","Crossover exponent for piecewise directed walk adsorption on Sierpinski
  fractals","19 pages, 10 figures, Latex2.09 using ioplppt.sty","J.Phys.A:Math.Gen., 32 (1999) 1","10.1088/0305-4470/32/8/004",,"cond-mat.stat-mech",,"  We study the problem of critical adsorption of piecewise directed random
walks on a boundary of fractal lattices that belong to the Sierpinski gasket
family. By applying the exact real space renormalization group method, we
calculate the crossover exponent $\phi$, associated with the number of adsorbed
steps, for the complete fractal family. We demonstrate that our results are
very close to the results obtained for ordinary self-avoiding walk, and discuss
the asymptotic behaviour of $\phi$ at the fractal to Euclidean lattice
crossover.
","[{""version"":""v1"",""created"":""Mon, 7 Dec 1998 23:56:06 GMT""}]","2009-10-31"
