"adap-org/9812003","Bronius Kaulakys","B. Kaulakys and T. Meskauskas","Modeling 1/f noise","RevTex, 10 pages, 3 PostScript figures","Phys. Rev. E 58 (6), p.7013-7019 (1998)","10.1103/PhysRevE.58.7013",,"adap-org cond-mat.stat-mech cond-mat.str-el math.DS math.SP nlin.AO",,"  The noise of signals or currents consisting from a sequence of pulses,
elementary events or moving discrete objects (particles) is analyzed. A simple
analytically solvable model is investigated in detail both analytically and
numerically. It is shown that 1/f noise may result from the statistics of the
pulses transit times with random increments of the time intervals between the
pulses. The model also serves as a basis for revealing parameter dependences of
1/f noise and allows one to make some generalizations. As a result the
intensity of 1/f noise is expressed through the distribution and characteristic
functions of the time intervals between the subsequent transit times of the
pulses. The conclusion that 1/f noise may result from the clustering of the
signal pulses, elementary events or particles can be drawn from the analysis of
the model systems.
","[{""version"":""v1"",""created"":""Tue, 8 Dec 1998 10:58:28 GMT""}]","2009-10-30"
"astro-ph/9812126","Daniela Villani","D. Villani and S. di Serego Alighieri","Infrared imaging of WENSS radio sources","8 pages, 54 Postscript figures, to be published in Astronomy and
  Astrophysics, Supplement Series",,"10.1051/aas:1999177",,"astro-ph",,"  We have performed deep imaging in the IR J- and K-bands for three sub-samples
of radio sources extracted from the Westerbork Northern Sky Survey, a large
low-frequency radio survey containing Ultra Steep Spectrum (USS), Gigahertz
Peaked Spectrum (GPS) and Flat Spectrum (FS) sources. We present the results of
these IR observations, carried out with the ARcetri Near Infrared CAmera
(ARNICA) at the Nordic Optical Telescope (NOT), providing photometric and
morphologic information on high redshift radio galaxies and quasars. We find
that the radio galaxies contained in our sample do not show the pronounced
radio/IR alignment claimed for 3CR sources. IR photometric measurements of the
gravitational lens system 1600+434 are also presented.
","[{""version"":""v1"",""created"":""Mon, 7 Dec 1998 16:09:34 GMT""}]","2009-10-31"
"astro-ph/9812127","Christian Surace","C. Surace, P. Heraudeau, D. Lemke, S. Oliver, M. Rowan-Robinson and
  the ELAIS consortium","The European Large Area ISO Survey - ISOPHOT results using the
  MPIA-pipeline","4 pages, 5 figures, to appear in the ISO conference ""The Universe as
  seen by ISO"", 1998, UNESCO, Paris",,,,"astro-ph",,"  The European Large Area ISO Survey (ELAIS) will provide Infrared observations
of 4 regions in the sky with ISO. Around 2000 Infrared sources have been
detected at 7 and 15 microns (with ISOCAM), 90 and 175 microns (with ISOPHOT))
over 13 square degrees of the sky. We present the source extraction pipeline of
the 90 microns ISOPHOT observations, describe and discuss the results obtained
and derive the limits of the ELAIS observational strategy.
","[{""version"":""v1"",""created"":""Mon, 7 Dec 1998 16:31:39 GMT""}]","2007-05-23"
"astro-ph/9812128","Beate Stelzer","B. Stelzer (1,2), J. Wilms (1), R. Staubert (1), D. Gruber (3), R.
  Rothschild (3) ((1) Institut fuer Astronomie und Astrophysik, Tuebingen,
  Astronomie, (2) Max-Planck-Institut fuer extraterrestrische Physik, Garching,
  (3) CASS, University of California at San Diego)","Evolution of spectral parameters during a pre-eclipse dip of Her X-1","9 pages, 8 figures, accepted for publication in Astronomy &
  Astrophysics",,,,"astro-ph",,"  We report on a pre-eclipse dip of the X-ray binary Her X-1 observed by the
Rossi X-ray Timing Explorer (RXTE) in July 1996. We present the evolution of
the spectral parameters in the 3-18 keV range with a temporal resolution of 16
s and show that the varying flux of the spectrum can be interpreted solely by a
time varying column density. We also find that the lightcurve is characterized
by symmetric substructures with recurrence time of a few minutes that can be
successfully modeled by Gaussian profiles.
","[{""version"":""v1"",""created"":""Mon, 7 Dec 1998 16:48:21 GMT""}]","2007-05-23"
"astro-ph/9812129","Avery Meiksin","A. Meiksin (IfA, Edinburgh) and Martin White (UIUC)","The Growth of Correlations in the Matter Power Spectrum","7 pages, 6 Figures, accepted for publication to MNRAS. Revised","1999 MNRAS v.308 p.1179","10.1046/j.1365-8711.1999.02825.x",,"astro-ph",,"  We find statistically significant correlations in the cosmological matter
power spectrum over the full range of observable scales. While the correlations
between individual modes are weak, the band-averaged power spectrum shows
strong non-trivial correlations. The correlations are significant when the
modes in either one or both bands are in the non-linear regime, and approach
100% for pairs of bands in which all the modes are non-linear. The correlations
are weaker, but not absent, when computed in redshift space. Since estimates of
the power spectrum from galaxy surveys require band-averaging, the correlations
must be taken into account when comparing a measured power spectrum with
theoretical models.
","[{""version"":""v1"",""created"":""Mon, 7 Dec 1998 17:57:08 GMT""},{""version"":""v2"",""created"":""Mon, 10 May 1999 19:17:16 GMT""}]","2009-10-31"
"astro-ph/9812130","Esteban Roulet","Luis N. Epele, Silvia Mollerach and Esteban Roulet","On the disintegration of cosmic ray nuclei by solar photons","15 pages","JHEP 9903:017,1999","10.1088/1126-6708/1999/03/017",,"astro-ph hep-ph",,"  We discuss in detail the possibility of observing pairs of simultaneous
parallel air showers produced by the fragments of cosmic ray nuclei which
disintegrated in collisions with solar photons. We consider scenarios with
different cosmic ray compositions, exploring the predicted rates for existing
and planned detectors and looking for methods to extract information on the
initial composition from the characteristics of the signal. In particular, we
find that fluorescence detectors, such as HiRes or the Telescope Array, due to
their low threshold ($\sim 10^{17}$ eV) and large area ($\sim 10^4 km^2$) may
observe several events per year if cosmic rays at those energies are indeed
heavy nuclei. The possibility of exploiting the angular orientation of the
plane containing the two showers to further constrain the cosmic ray
composition is also discussed.
","[{""version"":""v1"",""created"":""Mon, 7 Dec 1998 18:46:16 GMT""},{""version"":""v2"",""created"":""Fri, 11 Jun 1999 12:10:51 GMT""}]","2010-11-04"
"astro-ph/9812131",,"Tahir Yaqoob (1) ((1) Lhea, NASA/GSFC)","On the Unusually High Temperature of the Cluster of Galaxies 1E 0657-56","14 pages plus 2 figures. Latex with separate postscript figure files.
  AASTEX 4.0 macro. Accepted for the Astrophysical Journal Letters",,"10.1086/311842",,"astro-ph",,"  A recent X-ray observation of the cluster 1E0657-56 (z=0.296) with ASCA
implied an unusually high temperature of ~17 keV. Such a high temperature would
make it the hottest known cluster and severely constrain cosmological since, in
a Universe with critical density Omega=1 the probability of observing such a
cluster is only 4e-5. Here we test the robustness of this observational result
since it has such important implications. We analysed the data using a variety
of different data analysis methods and spectral analysis assumptions and find a
temperature of ~11-12 keV in all cases, except for one class of spectral fits.
These are fits in which the absorbing column density is fixed at the Galactic
value. We show that a high temperature of ~17 keV is artificially obtained if
the true spectrum has a stronger low- energy cut-off than that for Galactic
absorption only. The extra absorption may be astrophysical in origin, or it may
be a problem with the low-energy CCD efficiency. Although significantly lower
than previous measurements, this temperature of kT ~11-12 keV is still
relatively high since only a few clusters have been found to have temperatures
higher than 10 keV and the data therefore still present some difficulty for an
Omega=1 Universe. Our results will also be useful to anyone who wants to
estimate the systematic errors involved in different methods of background
subtraction of ASCA data for sources with similar S/N to that of the 1E0657-56
data reported here.
","[{""version"":""v1"",""created"":""Mon, 7 Dec 1998 19:24:17 GMT""}]","2009-10-31"
"astro-ph/9812132","Jose Gaite Cuesta","Jose Gaite, Alvaro Dominguez and Juan Perez-Mercader","The fractal distribution of galaxies and the transition to homogeneity","10 pages, 2 large PS figures, AAS macros. Substantial additions as
  regards the implications for cosmology, including the prospective observation
  of critical phenomena, and new references. Version to appear in ApJL","Astrophys. J. 522 (1999) L5","10.1086/312204",,"astro-ph cond-mat.stat-mech",,"  There is an ongoing debate in cosmology about the value of the length scale
at which ``homogeneity'' in the matter distribution is reached or even if such
a scale exists. In the wake of this debate, we intend in this letter to clarify
the meaning of the statement transition to homogeneity and of the concept of
correlation length. We show that there are two scales each associated to the
fractal and to the homogeneous regimes of the matter distribution,
respectively. The distinction between both scales has deep consequences, for
there can be a regime which despite having small fluctuations around the
average density exhibits large clusters of galaxies.
","[{""version"":""v1"",""created"":""Mon, 7 Dec 1998 20:14:00 GMT""},{""version"":""v2"",""created"":""Wed, 21 Jul 1999 19:39:36 GMT""}]","2009-10-31"
"astro-ph/9812133","Saul Perlmutter","S. Perlmutter, G. Aldering, G. Goldhaber, R.A. Knop, P. Nugent, P.G.
  Castro, S. Deustua, S. Fabbro, A. Goobar, D.E. Groom, I. M. Hook, A.G. Kim,
  M.Y. Kim, J.C. Lee, N.J. Nunes, R. Pain, C.R. Pennypacker, R. Quimby, C.
  Lidman, R.S. Ellis, M. Irwin, R.G. McMahon, P. Ruiz-Lapuente, N. Walton, B.
  Schaefer, B.J. Boyle, A.V. Filippenko, T. Matheson, A.S. Fruchter, N.
  Panagia, H.J.M. Newberg, W.J. Couch (The Supernova Cosmology Project)","Measurements of Omega and Lambda from 42 High-Redshift Supernovae","21 pages and 10 figures. Accepted for publication in the
  Astrophysical Journal. Individual color figures, supplementary tables, and
  preprint also available at http://www-supernova.lbl.gov/","Astrophys.J.517:565-586,1999","10.1086/307221","LBNL-41801","astro-ph hep-ex hep-ph",,"  We report measurements of the mass density, Omega_M, and
cosmological-constant energy density, Omega_Lambda, of the universe based on
the analysis of 42 Type Ia supernovae discovered by the Supernova Cosmology
Project. The magnitude-redshift data for these SNe, at redshifts between 0.18
and 0.83, are fit jointly with a set of SNe from the Calan/Tololo Supernova
Survey, at redshifts below 0.1, to yield values for the cosmological
parameters. All SN peak magnitudes are standardized using a SN Ia lightcurve
width-luminosity relation. The measurement yields a joint probability
distribution of the cosmological parameters that is approximated by the
relation 0.8 Omega_M - 0.6 Omega_Lambda ~= -0.2 +/- 0.1 in the region of
interest (Omega_M <~ 1.5). For a flat (Omega_M + Omega_Lambda = 1) cosmology we
find Omega_M = 0.28{+0.09,-0.08} (1 sigma statistical) {+0.05,-0.04}
(identified systematics). The data are strongly inconsistent with a Lambda = 0
flat cosmology, the simplest inflationary universe model. An open, Lambda = 0
cosmology also does not fit the data well: the data indicate that the
cosmological constant is non-zero and positive, with a confidence of P(Lambda >
0) = 99%, including the identified systematic uncertainties. The best-fit age
of the universe relative to the Hubble time is t_0 = 14.9{+1.4,-1.1} (0.63/h)
Gyr for a flat cosmology. The size of our sample allows us to perform a variety
of statistical tests to check for possible systematic errors and biases. We
find no significant differences in either the host reddening distribution or
Malmquist bias between the low-redshift Calan/Tololo sample and our
high-redshift sample. The conclusions are robust whether or not a
width-luminosity relation is used to standardize the SN peak magnitudes.
","[{""version"":""v1"",""created"":""Tue, 8 Dec 1998 03:27:34 GMT""}]","2008-11-26"
"astro-ph/9812134","Tiziana Di Matteo","T. Di Matteo (1)(2), A. Esin (2)(3), A.C. Fabian (1), R. Narayan (2)
  ((1) IOA, Cambridge, UK, (2) CFA, (3) Caltech)","On the Origin of the Hard X-Ray Background","revised version, submitted to MNRAS, 6 pages, 3 figures in MNRAS
  LaTex style",,"10.1046/j.1365-8711.1999.02541.x",,"astro-ph",,"  Several models for the hard X-ray Background (XRB) suggest that it is due to
the emission from heavily obscured AGN. Recent studies have revealed the
presence of a new population of hard X-ray sources which must contribute
significantly to the XRB. However, whether the majority of these sources are
obscured AGN or some other type of object at present remains unclear. Here, we
further examine the possibility that a significant fraction of the XRB comes
from a population of galaxies undergoing advection-dominated accretion in the
high-\mdot regime and thus produce intrinsically hard spectra. When the
accretion rate is close to its critical value, above which an
advection-dominated accretion flow (ADAF) no longer exists, the major
contribution to X-ray emission is due to inverse Compton scattering of the soft
seed photons produced by cyclo-synchrotron radiation. In this regime, the
resulting ADAF spectra are relatively hard with a fairly constant X-ray
spectral index \alpha \sim 0.2-0.4 and a spectral cut-off at \sim 200 keV. We
show that the integrated emission from such sources can provide a good fit to
the hard (> 2 keV) X-ray background, provided that the spectrum is dominated by
the contribution from objects located at redshifts z \sim 2-3. The model
requires most of the contribution to the XRB to be due to objects accreting at
the critical rate.
","[{""version"":""v1"",""created"":""Tue, 8 Dec 1998 04:11:44 GMT""}]","2009-10-31"
"astro-ph/9812135","Dr. A. K. Mitra","Abhas Mitra","On the Nature of the Compact Objects in the AGNs","Preliminary draft of paper to be presented in the 19th Texas Symp, 4
  pages, additional e-address: mitra_abhas@hotmail.com",,,,"astro-ph",,"  If the cores of Galaxies and AGNs comprise Supermassive Stars (SMSs) (Hoyle
and Fowler 1963), nuclear energy generation may not be ignited for masses $M >
6\times 10^4 M_\odot$, and highly supermassive stars are likely to generate
their luminosity, $L_{KH}$ slow gravitational contraction. We show that for
such massive Newtonian SMSs, both the value of $L_{KH}$ and the the accretion
luminosity, $L_{acc}$, could be much less than the appropriate Eddington value.
Such highly SMSs will have a surface density as low as $10^{-14}$ g/cm$^3$ and
they will not behave like a compact object with a ``hard surface'. For all such
reasons, it is indeed possible to have $L_{SMS} \ll L_{ed}$. And this effect
may be incorrectly interpreted as the evidence for the existence of central
Super Massive Black Holes with Event Horizons.
  In fact, in a very detailed work, and from various angles, we have recently
shown that, the General Theory of Relativity does not permit the occurrenes of
``trapped surfaces'' and Black Holes (Mitra 1998a, gr-qc/9810038).
","[{""version"":""v1"",""created"":""Tue, 8 Dec 1998 06:38:01 GMT""}]","2007-05-23"
"astro-ph/9812136","Ryoichi Nishi","Ryoichi Nishi, Hajime Susa, Hideya Uehara, Masako Yamada and Kazuyuki
  Omukai","Thermal and Dynamical Evolution of Primordial Gas Clouds - On the
  Formation of First Luminous Objects -","PTP Tex file 23 pages, 10 figures","Prog.Theor.Phys. 100 (1998) 881","10.1143/PTP.100.881","KUNS 1548","astro-ph",,"  We investigate the thermal and dynamical evolution of primordial gas clouds
in the universe after decoupling. Comparing the time-scale of dynamical
evolution with that of fragmentation, we can estimate the typical fragmentation
scale. We propose the following scenario of the formation process of first
luminous objects consisting of large number stars. First, by pancake collapse
of the overdensity regions in the expanding universe or collision between
clouds in potential wells, quasi-plane shocks form. If the shock-heated
temperature is higher than about $10^4$ K, the postshock gas cools down to
several hundred K by \Hbun line cooling, and the shock-compressed layer
fragments into filamentary clouds. The filamentary cloud collapses dynamically
once more and fragments into cloud cores. Finally, a primordial star forms in a
cloud core. We show that the minimum mass of the first star is essentially
determined by the Chandrasekhar mass. Also, we investigate the dynamical
collapse of cloud cores by numerical simulation and show that the evolution
paths of the central regions of the cores depend only very weakly on the total
core mass. After mass accretion, a massive star may be formed in a core, since
the estimated mass accretion rate is very large. In such a case, it may be
possible for many massive stars form almost simultaneously. Then the clouds can
be luminous objects. On the other hand, if the shock-heated temperature is
lower, effective star formation is delayed significantly.
","[{""version"":""v1"",""created"":""Tue, 8 Dec 1998 09:00:36 GMT""}]","2009-10-31"
"astro-ph/9812137","Fiona Hoyle","F. Hoyle, C. M. Baugh, T. Shanks, A. Ratcliffe (Durham)","The Durham/UKST Galaxy Redshift Survey - VI. Power spectrum analysis of
  clustering","14 pages, 14 figures, avaliable at
  http://star-www.dur.ac.uk/~fhoyle/ukst.html Minor revisions to match
  published version","MNRAS 309 659","10.1046/j.1365-8711.1999.02904.x",,"astro-ph",,"  We present the power spectrum analysis of clustering in the Durham/UKST
Galaxy Redshift Survey, which covers 1450 square degrees and consists of 2501
galaxy redshifts sampled at a rate of 1 in 3 to b_J = 17. The fluctuations that
we measure can be expressed as sigma_{8} = 1.01 +/- 0.17 . We find remarkably
good agreement between the power spectrum measured for the Durham/UKST Survey
and those from other optical studies, in spite of the very different sampling
rates, magnitude limits and survey geometries employed, on scales up to lambda
= (2 pi)/k = 80/h Mpc. On scales larger than this we find good agreement with
the power measured from the Stromlo-APM Survey (Tadros & Efstathiou), but find
more power than estimated from the Las Campanas Redshift Survey (Lin et al). We
apply a simple model for redshift space distortions to the real space APM
Galaxy Survey power spectrum and find a shape and amplitude that is in very
good agreement with the power spectrum of the Durham/UKST Survey. This implies
beta=Omega^{0.6}/b=0.60 +/- 0.35, where Omega is the density parameter and b is
the bias between fluctuations in the galaxy and mass distributions, and also
suggests a one dimensional velocity dispersion of sigma = 320 +/-140 km/s. We
find that for any choice of normalisation, the standard CDM model has a shape
that cannot be reconciled with the Durham/UKST Survey power spectrum, unless
either unacceptably high values of the one dimensional velocity dispersion are
adopted or the assumption that bias is constant is invalid on scales greater
than 20/h Mpc. Over the range of wavenumbers for which we have a robust
measurement of the power spectrum, we find the best agreement is obtained for a
critical density CDM model in which the shape of the power spectrum is
modified. (Abridged)
","[{""version"":""v1"",""created"":""Tue, 8 Dec 1998 10:03:26 GMT""},{""version"":""v2"",""created"":""Mon, 4 Oct 1999 13:48:14 GMT""}]","2009-10-31"
"astro-ph/9812138","Jesus Maiz-Apellaniz","J. Maiz-Apellaniz, C. Munoz-Tunon, G. Tenorio-Tagle & J. M. Mas-Hesse","Kinematical analysis of the ionized gas in the nuclear region of NGC
  4214","18 pages, 13 figures, accepted for publication in Astronomy &
  Astrophysics",,,,"astro-ph",,"  We present in this paper a detailed study of the kinematical properties of
the ionized gas around the young massive star clusters in the nucleus of NGC
4214. The analysis is based on bidimensional spectroscopical data, allowing to
derive the spatial variation of different properties (intensity, velocity and
width / line splitting) of the emission lines H\alpha and [O III] \lambda 5007
along the nuclear region. We have found that the Giant H II region around the
two most massive clusters in NGC 4214 (A and B) is resolved into two clearly
separated regions. We have not detected superbubbles with the properties we
would expect according to the evolutionary state of the stellar clusters, but
just a partial ring feature around the most massive one and two expanding
shells around cluster B. The first expanding shell seems to have experienced
blowout, whereas the second one is still complete. A possible explanation to
this phenomenon is that the most massive stars in a starburst spend a large
fraction of their lives buried inside their original molecular clouds.
Champagne flows might have formed at the borders of the regions, especially on
the SE complex, explaining the existence of the diffuse ionized gas around the
galaxy. As a consequence of these results we postulate that NGC 4214 is indeed
a dwarf spiral galaxy, with a thin (around 200 pc) disk that inhibits the
formation of large scale structures in the ISM. The mechanical input deposited
by the star formation complexes, in a variety of physical processes that
include the free expanding bubbles liberated after blowout and photoevaporation
of the parent clouds, have succeeded in generating the structures now detected
far from the disk, giving place to the large-scale structure which now enriches
the optical appearance of the galaxy.
","[{""version"":""v1"",""created"":""Tue, 8 Dec 1998 10:40:35 GMT""},{""version"":""v2"",""created"":""Wed, 9 Dec 1998 08:36:05 GMT""}]","2007-05-23"
"astro-ph/9812139","M. Vivekanand","M. Vivekanand and B. C. Joshi","Competing Drifting Radio Subpulses in PSR B0031-07","14 pages, 6figures, to appear in April 10, 1999 issue of
  Astrophysical Journal",,"10.1086/307013",,"astro-ph",,"  The pair of drifting subpulses of the radio pulsar PSR B0031-07 appear to be
well separated from each other on the average, overlapping at less than one
thirtieth of the peak energy. Strictly, the integrated profile of the pair
(after removing the drift) does not show more than two subpulses; however this
result is likely to be modified with the availability of more data. On the
other hand, rare instances of three simultaneous subpulses in a single period
have been noticed. This is consistent with the Ruderman and Sutherland model of
the drifting phenomenon in which several sparks, uniformly spaced on a circle,
rotate around the polar cap. The third subpulse appears to show up strongly
when subpulses belonging to the primary drift bands weaken. Although this
conclusion is based mainly on two reliable examples, it suggests an anti
correlation of the subpulse energies. The normalised correlation coefficient
between the energies of the two subpulses in a period is -0.16 +- 0.02, after
accounting for a known selection effect. Simulations suggest that this result
could not be an artefact. This suggests the idea of competing drifting
subpulses which, if true, will have important ramifications for the growth and
breakdown of the particle acceleration zones in pulsars.
","[{""version"":""v1"",""created"":""Tue, 8 Dec 1998 10:22:52 GMT""}]","2009-10-31"
"astro-ph/9812140",,"Sandip K. Chakrabarti (S. N. Bose National Centre For Basic Sciences,
  Calcutta)","Global Inflow and Outflow Solutions (GIOS) around a Black Hole","15 pages of Latex with 6 figures. To appear in the Proceedings of the
  Miniworkshop on Fluid Dynamics at Dacca University (August-1998). Ed. A.
  Hosain (DU). Result will be presented at the 19th Texas Symposium",,,"SNB/ASTRO/8-98","astro-ph gr-qc",,"  Twenty five years have passed by since models of accretions and jets have
separately emerged. Today, it is understood that these two objects are related
to each other in a fundamental way. In a binary system, matter from an
accretion disk enters into a black hole. A part of it is bounced back because
of the centrifugal barrier, radiation pressure or magnetohydrodynamic effects,
to form jets and bipolar outflows which carry away excess angular momentum. In
the case of AGNs containing black holes, accretion disks form out of stellar
winds and similar processes as above form cosmic radio jets. We present a
general review of the study of the accretion disks and outflows in a coherent
manner, especially emphasizing global inflow-outflow solutions (GIOS). We also
present a few observational consequences of wind production from the accretion
disks on spectral properties of the accretion disks.
","[{""version"":""v1"",""created"":""Tue, 8 Dec 1998 12:29:38 GMT""},{""version"":""v2"",""created"":""Wed, 9 Dec 1998 08:10:43 GMT""}]","2009-09-25"
