"hep-ph/9812339","Gunn Quznetsov A.","G. Quznetsov","Probability and QCD","LaTex, 30 pages, 3 figures, changed content",,,,"hep-ph quant-ph","http://arxiv.org/licenses/nonexclusive-distrib/1.0/","  The probabilities of point events in space 3 + 1 obey an equation of Dirac
type. Masses, moments, energies, spins, etc. are the parameters of the
probability distribution of such events. The terms and equations of quark-gluon
theories turn out theoretically probabilistic terms and theorems. Confinement
and asymptotic freedom are explained by behaviour of such probabolities. And
here we have the probabilistic foundations of the theory of gravitation.
Knowledge of the elements of linear algebra and differential calculus is
sufficient to understand the content of this article.
","[{""version"":""v1"",""created"":""Fri, 11 Dec 1998 22:20:53 GMT""},{""version"":""v2"",""created"":""Wed, 16 Dec 1998 16:37:49 GMT""},{""version"":""v3"",""created"":""Sun, 10 Jan 1999 12:47:44 GMT""},{""version"":""v4"",""created"":""Thu, 13 Feb 2003 03:05:04 GMT""},{""version"":""v5"",""created"":""Mon, 26 Apr 2004 16:58:06 GMT""},{""version"":""v6"",""created"":""Wed, 12 Jan 2005 11:41:18 GMT""},{""version"":""v7"",""created"":""Thu, 28 Sep 2017 16:00:06 GMT""}]","2017-10-02"
"hep-ph/9812340","Louis J. Clavelli","L. Clavelli (U. of Alabama)","Light Gluino Predictions for Jet Cross Sections in Tevatron Run II","10 pages including 4 PS figures, revtex.sty, Run II Conference report",,,"UAHEP9812","hep-ph",,"  The CDF inclusive jet transverse energy cross section at 1.8 TeV suggests
anomalous behavior at both low and high transverse energies. In addition the
scaled ratio of the 0.63 TeV to 1.8 TeV data lies significantly below the
standard model prediction and suggests structure not attributable to standard
model processes. These anomalies are in line with what would be expected in the
light gluino scenario. We perform a unified fit and extrapolate to two TeV to
predict the results at run II.
","[{""version"":""v1"",""created"":""Fri, 11 Dec 1998 23:02:49 GMT""}]","2007-05-23"
"hep-ph/9812341","Gunther Piller","G. Piller, L. Ferreira, and W. Weise","Note on Shadowing and Diffraction in Deep-Inelastic Lepton Scattering","6 pages, Latex, to be published in Eur. Phys. J. A","Eur.Phys.J. A4 (1999) 287-289","10.1007/s100500050232","TUM/T39-98-28","hep-ph",,"  We discuss the close relation between shadowing in deep-inelastic
lepton-nucleus scattering and diffractive photo- and leptoproduction of hadrons
from free nucleons. We show that the magnitude of nuclear shadowing at small
Bjorken-x, as measured by the E665 and NMC collaborations, is directly related
to HERA data on the amount of diffraction in the scattering from free nucleons.
","[{""version"":""v1"",""created"":""Sat, 12 Dec 1998 01:10:48 GMT""}]","2009-10-31"
"hep-ph/9812342","Atsushi Taruya","A.Taruya","Parametric Amplification of Density Perturbation in the Oscillating
  inflation","11 pages, 5 Encapsulated postscript figures, RevTeX, submitted to
  Phys.Rev.D","Phys.Rev. D59 (1999) 103505","10.1103/PhysRevD.59.103505",,"hep-ph astro-ph gr-qc",,"  We study the adiabatic density perturbation in the {\it oscillating
inflation}, proposed by Damour and Mukhanov. The recent study of the
cosmological perturbation during reheating shows that the adiabatic fluctuation
behaves like as the perfect fluid and no significant amplification occurs on
super-horizon scales. In the oscillating inflation, however, the accelerated
expansion takes place during the oscillating stage and there might be a
possibility that the parametric amplification on small scales affects the
adiabatic long-wavelength perturbation. We analytically show that the density
perturbation neglecting the metric perturbation can be amplified by the
parametric resonance and the instability band becomes very broad during the
oscillating inflation. We examined this issue by solving the evolution equation
for perturbation numerically. We found that the parametric resonance is
strongly suppressed for the long wave modes comparable to the Hubble horizon.
The result indicates that the metric perturbation plays a crucial role for the
evolution of scalar field perturbation. Therefore, in the single field case,
there would be no significant imprint of the oscillating inflation on the
primordial spectrum of the adiabatic perturbation. However, it could be
expected that the oscillating inflation in the multi-field system gives the
enormous amplification on large scales, which may lead to the production of the
primordial black holes.
","[{""version"":""v1"",""created"":""Sat, 12 Dec 1998 02:36:17 GMT""}]","2009-10-31"
"hep-ph/9812343","Helen Bukina","E.N. Bukina","Octet Magnetic Moments with Null Instantons and Semibosonized
  Nambu-Jona-Lasinio Model","RevTex, 6 pages, submitted to Progr.Theor.Phys","Mod.Phys.Lett. A14 (1999) 2525-2530","10.1142/S0217732399002637",,"hep-ph",,"  It is shown that the difference between the magnetic moment results in the
quark model with null instantons and semibosonized Nambu-Jona-Lasinio model
lies in the description of the magnetic moment of the $ \Lambda$-hyperon.
","[{""version"":""v1"",""created"":""Sat, 12 Dec 1998 13:40:30 GMT""}]","2009-10-31"
"hep-th/9812097","Radu Tatar","Robert de Mello Koch, Kyungho Oh and Radu Tatar","Moduli Space for Conifolds as Intersection of Orthogonal D6 branes","23 pages, Latex, final version to appear in Nuclear Physics B","Nucl.Phys. B555 (1999) 457-476","10.1016/S0550-3213(99)00385-5","BROWN-HET-1162","hep-th",,"  We show that a system of parallel D3 branes near a conifold singularity can
be mapped onto an intersecting configuration of orthogonal branes in type IIA
string theory. Using this brane configuration, we analyze the Higgs moduli
space of the associated field theory. The dimension of the Higgs moduli space
is computed from a geometrical analysis of the conifold singularity. Our
results provide evidence for an extended s-rule. In addition, a discrepancy
between the prediction of the brane configuration and the result obtained from
a geometrical anaysis is noted. This discrepancy is traced back to worldsheet
instanton effects.
","[{""version"":""v1"",""created"":""Fri, 11 Dec 1998 20:09:28 GMT""},{""version"":""v2"",""created"":""Sat, 16 Jan 1999 17:48:49 GMT""},{""version"":""v3"",""created"":""Tue, 29 Jun 1999 17:24:42 GMT""}]","2009-10-31"
"hep-th/9812098","Vincent G. J. Rodgers","Thomas P. Branson, V.G.J.Rodgers, Takeshi Yasuda","Interactions of a String Inspired Graviton Field","12 pages, more readable, references added","Int.J.Mod.Phys. A15 (2000) 3549-3562","10.1142/S0217751X0000121X",,"hep-th",,"  We continue to explore the possibility that the graviton in two dimensions is
related to a quadratic differential that appears in the anomalous contribution
of the gravitational effective action for chiral fermions. A higher dimensional
analogue of this field might exist as well. We improve the defining action for
this diffeomorphism tensor field and establish a principle for how it interacts
with other fields and with point particles in any dimension. All interactions
are related to the action of the diffeomorphism group. We discuss possible
interpretations of this field.
","[{""version"":""v1"",""created"":""Fri, 11 Dec 1998 20:10:09 GMT""},{""version"":""v2"",""created"":""Wed, 19 Apr 2000 20:20:07 GMT""}]","2016-12-28"
"hep-th/9812099","Jim Wheeler","A. Wehner (Utah State University) and J.T. Wheeler (Utah State
  University)","Conformal actions in any dimension","35 pages, now includes comparisons with other theories; one added
  reference","Nucl.Phys. B557 (1999) 380-406","10.1016/S0550-3213(99)00367-3","USU-FTG-117","hep-th gr-qc",,"  Biconformal gauging of the conformal group has a scale-invariant volume form,
permitting a single form of the action to be invariant in any dimension. We
display several 2n-dim scale-invariant polynomial actions and a dual action. We
solve the field equations for the most general action linear in the curvatures
for a minimal torsion geometry. In any dimension n>2, the solution is foliated
by equivalent n-dim Ricci-flat Riemannian spacetimes, and the full 2n-dim space
is symplectic. Two fields defined entirely on the Riemannian submanifolds
completely determine the solution: a metric, and a symmetric tensor.
","[{""version"":""v1"",""created"":""Fri, 11 Dec 1998 20:33:52 GMT""},{""version"":""v2"",""created"":""Tue, 4 May 1999 19:28:19 GMT""},{""version"":""v3"",""created"":""Thu, 13 May 1999 02:57:54 GMT""}]","2009-10-31"
"hep-th/9812100","Kazuo Hosomiti","K. Hosomichi (Univ. of Tokyo), Y. Sugawara (Univ. of Tokyo)","Hilbert Space of Space-time SCFT in AdS_3 Supersting and T^{4kp}/S_{kp}
  SCFT","23pages, no figures, LaTeX. Some discussions added. The final version
  to be published in JHEP","JHEP 9901:013,1999","10.1088/1126-6708/1999/01/013","UT-832","hep-th",,"  We explore the superstring theory on AdS_3 x S^3 x T^4 in the framework given
in hep-th/9806194. We argue on the Hilbert space of ""space-time CFT"", and
especially construct a suitable vacuum of this CFT from the physical degrees of
freedom of the superstring theory in bulk. We first construct it explicitly in
the case of p=1, and then present a proposal for the general cases of p>1.
  After giving some completion of the GKS's constructions of the higher mode
operators (in particular, of those including spin fields), we also make some
comparison between the space-time CFT and T^{4kp}/S_{kp} SCFT, namely, with
respect to the physical spectrum of chiral primaries and some algebraic
structures of bosonic and fermionic oscillators in both theories. We also
observe how our proposal about the Hilbert space of space-time CFT leads to a
satisfactory correspondence between the spectrum of chiral primaries of both
theories in the cases of p>1.
","[{""version"":""v1"",""created"":""Fri, 11 Dec 1998 23:50:22 GMT""},{""version"":""v2"",""created"":""Mon, 21 Dec 1998 05:58:15 GMT""},{""version"":""v3"",""created"":""Thu, 14 Jan 1999 05:13:24 GMT""}]","2010-02-03"
"hep-th/9812101","pt2817 Aalok Misra fc phy","S. D. Joglekar, A. Misra (Department of Physics, Indian Institute of
  Technology, Kanpur, UP, India)","Relating Green's Functions in Axial and Lorentz Gauges using Finite
  Field-Dependent BRS Transformations","20 pages, LaTex, Section 4 expanded, typos corrected; last 2
  references modified; (this) revised version to appear in J. Math. Phys","J.Math.Phys. 41 (2000) 1755-1767","10.1063/1.533209",,"hep-th hep-ph",,"  We use finite field-dependent BRS transformations (FFBRS) to connect the
Green functions in a set of two otherwise unrelated gauge choices. We choose
the Lorentz and the axial gauges as examples. We show how the Green functions
in axial gauge can be written as a series in terms of those in Lorentz gauges.
Our method also applies to operator Green's functions. We show that this
process involves another set of related FFBRS transfomations that is derivable
from infinitesimal FBRS. We suggest possible applications.
","[{""version"":""v1"",""created"":""Sat, 12 Dec 1998 12:49:27 GMT""},{""version"":""v2"",""created"":""Tue, 15 Dec 1998 08:38:23 GMT""},{""version"":""v3"",""created"":""Wed, 17 Mar 1999 08:16:39 GMT""},{""version"":""v4"",""created"":""Sat, 9 Oct 1999 14:41:53 GMT""}]","2009-10-31"
"math/9812072","Olivier Debarre","O. Debarre","Lieux de d\'eg\'en\'erescence (Degeneracy loci)","In French. 21 pages. PlainTeX v 1.2; typeset for references",,,,"math.AG",,"  We prove Lefschetz type theorems for cohomology groups and Picard groups of
degeneracy loci for vector bundle maps. We also treat the case of antisymmetric
maps.
","[{""version"":""v1"",""created"":""Fri, 11 Dec 1998 16:26:21 GMT""}]","2007-05-23"
"math/9812073","Miklos Bona","Mikl\'os B\'ona, Daniel A. Spielman","An Infinite Antichain of Permutations",,,,,"math.CO",,"  We constructively prove that the partially ordered set of finite permutations
ordered by deletion of entries contains an infinite antichain.
","[{""version"":""v1"",""created"":""Fri, 11 Dec 1998 17:48:37 GMT""}]","2007-05-23"
"math/9812074","Ovsienko","C. Roger, V. Ovsienko","Deforming the Lie algebra of vector fields on $S^1$ inside the Lie
  algebra of pseudodifferential symbols on $S^1$","19 pages, LaTex",,,"CPT-98/P3726","math.QA math.DG",,"  We classify nontrivial deformations of the standard embedding of the Lie
algebra $\Vect(S^1)$ of smooth vector fields on the circle, into the Lie
algebra~$\PD(S^1)$ of pseudodifferential symbols on $S^1$. This approach leads
to deformations of the central charge induced on $\Vect(S^1)$ by the canonical
central extension of $\PD(S^1)$. As a result we obtain a quantized version of
the second Bernoulli polynomial.
","[{""version"":""v1"",""created"":""Fri, 11 Dec 1998 19:37:03 GMT""}]","2007-05-23"
"math/9812075","Miklos Bona","Noga Alon, Mikl\'os B\'ona, Joel Spencer","Packing Ferrers Shapes","7 pages, 4 figures",,,,"math.CO",,"  Answering a question of Wilf, we show that if $n$ is sufficiently large, then
one cannot cover an $n \times p(n)$ rectangle using each of the $p(n)$ distinct
Ferrers shapes of size $n$ exactly once. Moreover, the maximum number of
pairwise distinct, non-overlapping Ferrers shapes that can be packed in such a
rectangle is only $\Theta(p(n)/ \log n).$
","[{""version"":""v1"",""created"":""Fri, 11 Dec 1998 21:09:51 GMT""}]","2007-05-23"
"physics/9812019","George Bertsch","K. Yabana and G.F. Bertsch","Application of time-dependent density functional theory to optical
  activity","17 pages and 13 PostScript figures","Phys. Rev. A 60 (1999) 1271","10.1103/PhysRevA.60.1271","DOE/ER/40561-39-INT98","physics.chem-ph",,"  As part of a general study of the time-dependent local density approximation
(TDLDA), we here report calculations of optical activity of chiral molecules.
The theory automatically satisfies sum rules and the Kramers-Kronig relation
between circular dichroism and optical rotatory power. We find that the theory
describes the measured circular dichroism of the lowest states in methyloxirane
with an accuracy of about a factor of two. In the chiral fullerene C_76 the
TDLDA provides a consistent description of the optical absorption spectrum, the
circular dichroism spectrum, and the optical rotatory power, except for an
overall shift of the theoretical spectrum.
","[{""version"":""v1"",""created"":""Fri, 11 Dec 1998 23:20:59 GMT""}]","2009-10-31"
"quant-ph/9812024","R. E. Kastner","R. E. Kastner","TSQT `Elements of Possibility'?","4 pages, latex","Stud.Hist.Philos.Mod.Phys. 30 (1999) 399-402",,,"quant-ph",,"  I defend my arguments in quant-ph/9806002, which have recently been
criticized by L. Vaidman (quant-ph/9811092). I emphasize that the correct usage
of the ABL rule applies not to a genuine counterfactual statement but rather to
a conjunction of material conditionals. I argue that the only kind of valid
counterfactual statement one can make using the ABL rule is a ``might''
counterfactual, which is not adequate for the attribution of `elements of
reality' to a quantum system.
","[{""version"":""v1"",""created"":""Sat, 12 Dec 1998 06:09:09 GMT""}]","2007-05-23"
"quant-ph/9812025","Luis Santos","L. Santos, M. Lewenstein, J. I. Cirac and Y. Castin","Laser Induced Condensation of Trapped Bosonic Gases","LaTeX, 4 pages, 3 eps figures",,,,"quant-ph",,"  We demonstrate that an appropriate sequence of laser pulses allows to
condense a gas of trapped bosonic atoms into an arbitrary trap level.
  Such condensation is robust, can be achieved in experimentally feasible
traps, and may lead to multistability and hysteresis phenomena.
","[{""version"":""v1"",""created"":""Sat, 12 Dec 1998 09:58:53 GMT""}]","2016-09-08"
"solv-int/9812013","Lafortune","S.Lafortune, P.Winternitz and C.R.Menyuk","Solutions to the Optical Cascading Equations","21 pages","Physical Review E 58, 2518-2825 (1998)","10.1103/PhysRevE.58.2518",,"solv-int nlin.SI physics.optics",,"  Group theoretical methods are used to study the equations describing
\chi^{(2)}:\chi^{(2)} cascading. The equations are shown not to be integrable
by inverse scattering techniques. On the other hand, these equations do share
some of the nice properties of soliton equations. Large families of explicit
analytical solutions are obtained in terms of elliptic functions. In special
cases, these periodic solutions reduce to localized ones, i.e., solitary waves.
All previously known explicit solutions are recovered, and many additional ones
are obtained
","[{""version"":""v1"",""created"":""Fri, 11 Dec 1998 20:16:33 GMT""}]","2009-10-31"
