"cond-mat/9812202","Wentao T. Lu","F. Y. Wu, C. King and W. T. Lu (Northeastern University)","On the rooted Tutte polynomial","plain latex, 14 pages, 2 figs., to appear in Annales de l'Institut
  Fourier (1999)","Ann. Inst. Fourier (Grenoble) 49, 1103-1114 (1999).",,,"cond-mat.stat-mech",,"  The Tutte polynomial is a generalization of the chromatic polynomial of graph
colorings. Here we present an extension called the rooted Tutte polynomial,
which is defined on a graph where one or more vertices are colored with
prescribed colors. We establish a number of results pertaining to the rooted
Tutte polynomial, including a duality relation in the case that all roots
reside around a single face of a planar graph. The connection with the Potts
model is also reviewed.
","[{""version"":""v1"",""created"":""Fri, 11 Dec 1998 18:13:59 GMT""}]","2007-05-23"
"cond-mat/9812203","Wentao T. Lu","F. Y. Wu (Northeastern University) and H. Kunz (Ecole Polytechnique
  Federale, Lausanne)","Restricted random walks on a graph","plain latex, 10 pages, 1 fig., submitted to Ann. Combinatorics","Ann. Combinatorics 3, 475-481 (1999)",,,"cond-mat.stat-mech math.CO",,"  The problem of a restricted random walk on graphs which keeps track of the
number of immediate reversal steps is considered by using a transfer matrix
formulation. A closed-form expression is obtained for the generating function
of the number of n-step walks with r reversal steps for walks on any graph. In
the case of graphs of a uniform valence, we show that our result has a
probabilistic meaning, and deduce explicit expressions for the generating
function in terms of the eigenvalues of the adjacency matrix. Applications to
periodic lattices and the complete graph are given.
","[{""version"":""v1"",""created"":""Fri, 11 Dec 1998 18:29:27 GMT""}]","2007-05-23"
"cond-mat/9812204","Aharonov Einat","Einat Aharonov and David Sparks","On Phase Transition and Self-Organized Critical State in Granular
  Packings",,,,,"cond-mat.dis-nn cond-mat.mtrl-sci",,"  We model two-dimensional systems of granular aggregates confined between two
planes and demonstrate that at a critical grain volume fraction an abrupt
rigidity transition occurs. This transition is observed both in static and
shear tests. The grain volume fraction at which the transition occurs, $\nu_c$,
decreases with increasing friction between the grains. Densely packed grains,
with a volume fraction $\nu> \nu_c$, display an elastic-plastic rheology.
Dilute packings, with $\nu<\nu_c$, display gas-like characteristics. Packings
with $\nu=\nu_c$ display phase coexistance. It is shown that when volume
fraction is allowed to change freely (using constant normal stress boundary
condition), it evolves spontaneously to $\nu_c$ under a wide range of boundary
conditions, exhibiting 'self-organized criticality'.
","[{""version"":""v1"",""created"":""Fri, 11 Dec 1998 18:36:37 GMT""}]","2007-05-23"
"cond-mat/9812205","Sergei Nechaev","Sergei Nechaev","Statistics of knots and entangled random walks","Extended version of lectures presented at Les Houches 1998 summer
  school ""Topological Aspects of Low Dimensional Systems"", July 7 - 31, 1998;
  revtex, 79 pages, 16 eps-figures",,,,"cond-mat.stat-mech cond-mat.soft math.PR",,"  The lectures review the state of affairs in modern branch of mathematical
physics called probabilistic topology. In particular we consider the following
problems: (i) We estimate the probability of a trivial knot formation on the
lattice using the Kauffman algebraic invariants and show the connection of this
problem with the thermodynamic properties of 2D disordered Potts model; (ii) We
investigate the limit behavior of random walks in multi-connected spaces and on
non-commutative groups related to the knot theory. We discuss the application
of the above mentioned problems in statistical physics of polymer chains. On
the basis of non-commutative probability theory we derive some new results in
statistical physics of entangled polymer chains which unite rigorous
mathematical facts with more intuitive physical arguments.
","[{""version"":""v1"",""created"":""Fri, 11 Dec 1998 19:12:11 GMT""}]","2007-05-23"
"cond-mat/9812206","Jaroslav Fabian","J. Fabian and S. Das Sarma","Band-Structure Effects in the Spin Relaxation of Conduction Electrons","10 pages, 2 figures; to appear in the 43rd MMM Conference Proceedings
  published in the JAP",,"10.1063/1.370095",,"cond-mat",,"  Spin relaxation of conduction electrons in metals is significantly influenced
by the Fermi surface topology. Electrons near Brillouin zone boundaries,
special symmetry points, or accidental degeneracy lines have spin flip rates
much higher than an average electron. A realistic calculation and analytical
estimates show that these regions dominate the spin relaxation, explaining why
polyvalent metals have much higher spin relaxation rates (up to three orders of
magnitude) than similar monovalent metals. This suggests that spin relaxation
in metals can be tailored by band-structure modifications like doping,
alloying, reducing the dimensionality, etc.
","[{""version"":""v1"",""created"":""Fri, 11 Dec 1998 20:35:10 GMT""}]","2009-10-31"
"cond-mat/9812207","Vladimir Privman","Dima Mozyrsky, Vladimir Privman","Diffusional Growth of Colloids","23 pages in plain TeX and 1 JPG figure","Journal of Chemical Physics 110 (1999) 9254-9258","10.1063/1.478849",,"cond-mat.mtrl-sci cond-mat.soft cond-mat.stat-mech",,"  We consider incorporation of particle detachment in Smoluchowski model of
colloidal growth. Two approaches are considered, utilizing phenomenological
rate equation and exact large-time results. Our main conclusion is that the
value of the large-time diffusing particle concentration at the aggregate
surface is the only parameter needed to describe the added effect of
detachment. Explicit expression is given for the particle intake rate.
","[{""version"":""v1"",""created"":""Fri, 11 Dec 1998 20:53:39 GMT""}]","2010-09-22"
"cond-mat/9812208","Fil","D.V. Fil (Kharkov)","Screening of electrostatic potential in a composite fermion system","5 pages, 2 eps figures included","Low Temp. Phys. 24 (1998) 858","10.1063/1.593516",,"cond-mat.mes-hall",,"  Screening of the electric field of a test charge by monolayer and
double-layer composite fermion systems is considered. It is shown that the
electric field of the test charge is partly screened at distances much large
then the magnetic length. The value of screening as a function of the distance
depends considerably on the filling factor. The effect of variation of the
value of screening in the double-layer system upon a transition to a state
described by the Halperin wave function is determined.
","[{""version"":""v1"",""created"":""Sat, 12 Dec 1998 01:09:26 GMT""}]","2009-10-31"
"cond-mat/9812209","Felix Izrailev","F.M.Izrailev and A.A.Krokhin","Localization and Mobility Edge in One-Dimensional Potentials with
  Correlated Disorder","4 pages in RevTex and 2 Postscript figures; revised version published
  in Phys. Rev. Lett. 82 (1999) 4062",,"10.1103/PhysRevLett.82.4062",,"cond-mat.dis-nn",,"  We show that a mobility edge exists in 1D random potentials provided specific
long-range correlations. Our approach is based on the relation between binary
correlator of a site potential and the localization length. We give the
algorithm to construct numerically potentials with mobility edge at any given
energy inside allowed zone. Another natural way to generate such potentials is
to use chaotic trajectories of non-linear maps. Our numerical calculations for
few particular potentials demonstrate the presence of mobility edges in 1D
geometry.
","[{""version"":""v1"",""created"":""Sat, 12 Dec 1998 01:30:31 GMT""},{""version"":""v2"",""created"":""Tue, 23 Nov 1999 23:31:26 GMT""}]","2009-10-31"
"cond-mat/9812210","Yehuda Naveh","Y. Naveh, A.N. Korotkov, and K.K. Likharev (SUNY - Stony Brook)","Shot noise suppression in multimode ballistic Fermi conductors","4 pages","Phys. Rev. B 60, R2169 (1999)","10.1103/PhysRevB.60.R2169",,"cond-mat.mes-hall",,"  We have derived a general formula describing current noise in multimode
ballistic channels connecting source and drain electrodes with Fermi electron
gas. In particular (at $eV\gg k_{B}T$), the expression describes the
nonequilibrium ''shot'' noise, which may be suppressed by both Fermi
correlations and space charge screening. The general formula has been applied
to an approximate model of a 2D nanoscale, ballistic MOSFET. At large negative
gate voltages, when the density of electrons in the channel is small, shot
noise spectral density $S_{I}(0)$ approaches the Schottky value $2eI$, where
$I$ is the average current. However, at positive gate voltages, when the
maximum potential energy in the channel is below the Fermi level of the
electron source, the noise can be at least an order of magnitude smaller than
the Schottky value, mostly due to Fermi effects.
","[{""version"":""v1"",""created"":""Sat, 12 Dec 1998 03:59:02 GMT""}]","2009-10-31"
"cond-mat/9812211","Bruce Normand","B. Normand, D. F. Agterberg and T. M. Rice","On possible superconductivity in the doped ladder compound
  La_(1-x)Sr_xCuO_2.5","RevTex, 4 pages, 7 figures","Phys. Rev. Lett. 82, 4296 (1999).","10.1103/PhysRevLett.82.4296",,"cond-mat.str-el cond-mat.supr-con",,"  LaCuO_2.5 is a system of coupled, two-chain, cuprate ladders which may be
doped systematically by Sr substitution. Motivated by the recent synthesis of
single crystals, we investigate theoretically the possibility of
superconductivity in this compound. We use a model of spin fluctuation-mediated
superconductivity, where the pairing potential is strongly peaked at \pi in the
ladder direction. We solve the coupled gap equations on the bonding and
antibonding ladder bands to find superconducting solutions across the range of
doping, and discuss their relevance to the real material.
","[{""version"":""v1"",""created"":""Sat, 12 Dec 1998 10:55:12 GMT""}]","2009-10-31"
"cond-mat/9812212","Sven Lubeck","L. Roters, S. Lubeck, K. D. Usadel","Critical behavior of a traffic flow model","5 pages, 7 figures, accepted for publication in Physical Review E","Physical Review E 59, 2672 (1999)","10.1103/PhysRevE.59.2672",,"cond-mat.stat-mech",,"  The Nagel-Schreckenberg traffic flow model shows a transition from a free
flow regime to a jammed regime for increasing car density. The measurement of
the dynamical structure factor offers the chance to observe the evolution of
jams without the necessity to define a car to be jammed or not. Above the
jamming transition the dynamical structure factor exhibits for a given k-value
two maxima corresponding to the separation of the system into the free flow
phase and jammed phase. We obtain from a finite-size scaling analysis of the
smallest jam mode that approaching the transition long range correlations of
the jams occur.
","[{""version"":""v1"",""created"":""Sat, 12 Dec 1998 14:21:57 GMT""}]","2009-10-31"
"cs/9812013","Babak Hodjat","Babak Hodjat and Makoto Amamiya","The Self-Organizing Symbiotic Agent","12 pages, 2 figures",,,,"cs.NE cs.CC",,"  In [N. A. Baas, Emergence, Hierarchies, and Hyper-structures, in C.G. Langton
ed., Artificial Life III, Addison Wesley, 1994.] a general framework for the
study of Emergence and hyper-structure was presented. This approach is mostly
concerned with the description of such systems. In this paper we will try to
bring forth a different aspect of this model we feel will be useful in the
engineering of agent based solutions, namely the symbiotic approach. In this
approach a self-organizing method of dividing the more complex ""main-problem""
to a hyper-structure of ""sub-problems"" with the aim of reducing complexity is
desired. A description of the general problem will be given along with some
instances of related work. This paper is intended to serve as an introductory
challenge for general solutions to the described problem.
","[{""version"":""v1"",""created"":""Fri, 11 Dec 1998 20:51:38 GMT""}]","2007-05-23"
"cs/9812014","Babak Hodjat","Babak Hodjat, Christopher J. Savoie, and Makoto Amamiya","An Adaptive Agent Oriented Software Architecture","14 pages, 5 figures. Presemted at PRICAI '98 (5th Pacific Rim
  Conference on Artificial Intelligence)",,,,"cs.DC cs.MA",,"  A new approach to software design based on an agent-oriented architecture is
presented. Unlike current research, we consider software to be designed and
implemented with this methodology in mind. In this approach agents are
considered adaptively communicating concurrent modules which are divided into a
white box module responsible for the communications and learning, and a black
box which is the independent specialized processes of the agent. A distributed
Learning policy is also introduced for adaptability.
","[{""version"":""v1"",""created"":""Fri, 11 Dec 1998 22:36:37 GMT""}]","2007-05-23"
"cs/9812015","Babak Hodjat","Babak Hodjat and Makoto Amamiya","Adaptive Interaction Using the Adaptive Agent Oriented Software
  Architecture (AAOSA)","14 pages, 4 figures",,,,"cs.HC cs.DC",,"  User interfaces that adapt their characteristics to those of the user are
referred to as adaptive interfaces. We propose Adaptive Agent Oriented Software
Architecture (AAOSA) as a new way of designing adaptive interfaces. AAOSA is a
new approach to software design based on an agent-oriented architecture. In
this approach agents are considered adaptively communicating concurrent modules
which are divided into a white box module responsible for the communications
and learning, and a black box which is responsible for the independent
specialized processes of the agent. A distributed learning policy that makes
use of this architecture is used for purposes of system adaptability.
","[{""version"":""v1"",""created"":""Fri, 11 Dec 1998 23:05:51 GMT""}]","2007-05-23"
"gr-qc/9812039","Leonardo Fernandez-Jambrina","L. Fernandez-Jambrina, L. M. Gonzalez-Romero","Exterior Differential System for Cosmological G2 Perfect Fluids and
  Geodesic Completeness","27 pages, 0 figures, LaTeX2e, to be published in Classical and
  Quantum Gravity","Class.Quant.Grav. 16 (1999) 953-972","10.1088/0264-9381/16/3/023",,"gr-qc",,"  In this paper a new formalism based on exterior differential systems is
derived for perfect-fluid spacetimes endowed with an abelian orthogonally
transitive G2 group of motions acting on spacelike surfaces. This formulation
allows simplifications of Einstein equations and it can be applied for
different purposes. As an example a singularity-free metric is rederived in
this framework. A sufficient condition for a diagonal metric to be geodesically
complete is also provided.
","[{""version"":""v1"",""created"":""Fri, 11 Dec 1998 16:45:12 GMT""}]","2009-10-31"
"gr-qc/9812040","Ken D. Olum","Ken D. Olum and J. J. Blanco-Pillado","Field theory simulation of Abelian-Higgs cosmic string cusps","9 pages, RevTeX, 13 figures with epsf","Phys.Rev. D60 (1999) 023503","10.1103/PhysRevD.60.023503",,"gr-qc astro-ph hep-ph",,"  We have performed a lattice field theory simulation of cusps in Abelian-Higgs
cosmic strings. The results are in accord with the theory that the portion of
the strings which overlaps near the cusp is released as radiation. The radius
of the string cores which must touch to produce the evaporation is
approximately $r = 1$ in natural units. In general, the modifications to the
string shape due to the cusp may produce many cusps later in the evolution of a
string loop, but these later cusps will be much smaller in magnitude and more
closely resemble kinks.
","[{""version"":""v1"",""created"":""Fri, 11 Dec 1998 22:46:28 GMT""}]","2009-10-31"
"gr-qc/9812041","John T. Whelan","John T. Whelan (Uni. Bern) and Joseph D. Romano (U Texas-Brownsville)","Quasistationary binary inspiral. I. Einstein equations for the two
  Killing vector spacetime","37 pages, REVTeX, one PostScript Figure included with epsfig; minor
  formatting changes and copyright notice added for journal publication","Phys. Rev. D 60, 084009 (1999)","10.1103/PhysRevD.60.084009",,"gr-qc",,"  The geometry of two infinitely long lines of mass moving in a fixed circular
orbit is considered as a toy model for the inspiral of a binary system of
compact objects due to gravitational radiation. The two Killing fields in the
toy model are used, according to a formalism introduced by Geroch, to describe
the geometry entirely in terms of a set of tensor fields on the two-manifold of
Killing vector orbits. Geroch's derivation of the Einstein equations in this
formalism is streamlined and generalized. The explicit Einstein equations for
the toy model spacetime are derived in terms of the degrees of freedom which
remain after a particular choice of gauge.
","[{""version"":""v1"",""created"":""Sat, 12 Dec 1998 07:28:26 GMT""},{""version"":""v2"",""created"":""Tue, 13 Apr 1999 21:31:03 GMT""},{""version"":""v3"",""created"":""Fri, 17 Sep 1999 12:41:15 GMT""}]","2016-08-25"
"gr-qc/9812042","Mohammad Nouri-Zonoz","Mohammad Nouri-Zonoz, Naresh Dadhich and D. Lynden-Bell","A spacetime dual to the NUT spacetime","10 pages, Latex. Accepted for publication in Classical and Quantum
  Gravity","Class.Quant.Grav. 16 (1999) 1021-1026","10.1088/0264-9381/16/3/028",,"gr-qc",,"  By decomposing the Riemann curvature into electric and magnetic parts, a
duality transformation, which involves interchange of active and passive
electric parts, has recently been proposed. It was shown that the Schwarzschild
solution is dual to the one that describes the Schwarzschild particle with
cloud of string dust or a global monopole. Following the same procedure we
obtain the solution dual to the NUT spacetime.
","[{""version"":""v1"",""created"":""Sat, 12 Dec 1998 13:15:39 GMT""}]","2009-10-31"
"hep-ex/9812015","Gerardo Iovane","G.Iovane","The OPERA Experiment","DARK98-Second International Conference on Dark Matter in Astro and
  Particle Physics (Heidelberg, Germany)",,,,"hep-ex",,"  OPERA(Oscillation Project with Emulsion-tRacking Apparatus) is a new detector
concept, iron(lead)-emulsion for a long-baseline neutrino oscillation
experiment. This experiment would perform an appearance search for nu_mu-nu_tau
oscillation in the parameter region indicated by the atmospheric neutrino
anomaly. OPERA can run at the Gran Sasso Laboratory in the proposed NGS
(Neutrino to Gran Sasso) Beam from CERN.
","[{""version"":""v1"",""created"":""Fri, 11 Dec 1998 19:00:48 GMT""},{""version"":""v2"",""created"":""Thu, 17 Dec 1998 15:11:16 GMT""},{""version"":""v3"",""created"":""Fri, 18 Dec 1998 09:55:37 GMT""}]","2007-05-23"
"hep-ex/9812016",,"J. Z. Bai, et al. (BES Collaboration)","Study of the Hadronic Decays of \chi_c States","24 pages, 12 figures, 6 tables, use revtex, submitted to Phys. Rev. D","Phys.Rev.D60:072001,1999","10.1103/PhysRevD.60.072001","BIHEP-EP1-98-05","hep-ex hep-ph",,"  Hadronic decays of the P-wave spin-triplet charmonium states \chi_cJ
(J=0,1,2) are studied using a sample of \psi(2S) decays collected by the BES
detector operating at the BEPC storage ring. Branching fractions for the decays
\chi_c1 going to K_s^0 K^+ \pi^- + c.c., \chi_c0 going to K_s^0 K_s^0, \chi_c2
going to K_s^0 K_s^0, \chi_c0 going to \phi \phi, \chi_c2 going to \phi \phi
and \chi_cJ going to K^+ K^- K^+ K^- are measured for the first time, and those
for \chi_cJ going to \pi^+ \pi^- \pi^+ \pi^-, $ \chi_cJ going to \pi^+ \pi^-
K^+ K^-, \chi_cJ going to \pi^+ \pi^- p \bar{p} and \chi_cJ going to 3(\pi^+
\pi^-) are measured with improved precision. In addition, we determine the
masses of the \chi_c0 and \eta_c to be M_{\chi_{c0}}=3414.1 \pm 0.6(stat) \pm
0.8 (sys) MeV and M_{\eta_c}=2975.8 \pm 3.9(stat) \pm 1.2 (sys) MeV.
","[{""version"":""v1"",""created"":""Sat, 12 Dec 1998 08:02:35 GMT""}]","2008-11-26"
"hep-lat/9812012",,"M.N. Chernodub, M.I. Polikarpov and A.I. Veselov","Effective Monopole Potential for SU(2) Lattice Gluodynamics in Spatial
  Maximal Abelian Gauge","LaTeX2e, 8 pages with 3 EPS figures, uses epsf.sty","JETP Lett. 69 (1999) 174-179","10.1134/1.568002","ITEP-TH-76/98, FISIST/18-98/CFIF","hep-lat hep-ph hep-th",,"  We investigate the dual superconductor hypothesis in finite-temperature SU(2)
lattice gluodynamics in the Spatial Maximal Abelian gauge. This gauge is more
physical than the ordinary Maximal Abelian gauge due to absence of
non-localities in temporal direction. We show numerically that in the Spatial
Maximal Abelian gauge the probability distribution of the abelian monopole
field is consistent with the dual superconductor mechanism of confinement: the
abelian condensate vanishes in the deconfinement phase and is not zero in the
confinement phase.
","[{""version"":""v1"",""created"":""Fri, 11 Dec 1998 19:57:57 GMT""}]","2009-10-31"
"hep-ph/9812335","Nicos Stefanis","A. I. Karanikas, C. N. Ktorides (Athens U.), N. G. Stefanis (Ruhr U.,
  Bochum), and S. M. H. Wong (Athens U.)","Off-mass-shell Sudakov-like suppression factor for the fermionic
  four-point function in QCD","13 pages in RevTeX; 2 figures as PS files; modified text; added
  references. To appear in Phys. Lett. B","Phys.Lett. B455 (1999) 291-299","10.1016/S0370-2693(99)00397-4","UA/NPPS-16-98, RUB-TPII-18/98","hep-ph",,"  We consider a four-point process, associated with a wide-angle elastic
scattering of two off-mass-shell spin-1/2 matter particles, in a non-abelian
gauge theory. On the basis of a worldline approach, which reverts the
functional to a path-integral description of the system, we factorize an
eikonal (``soft'') subsector of the full theory and calculate the Sudakov-like
suppression factor for the four-point function as a whole, once we have
extracted the associated anomalous dimensions and taken into account the
renormalization-group controlled evolution.
","[{""version"":""v1"",""created"":""Fri, 11 Dec 1998 16:00:17 GMT""},{""version"":""v2"",""created"":""Fri, 28 May 1999 10:40:39 GMT""}]","2009-10-31"
"hep-ph/9812336","Lev Lipatov","L.N. Lipatov","Duality symmetry of Reggeon interactions in multicolour QCD","32 pages, latex, modified section","Nucl.Phys. B548 (1999) 328-362","10.1016/S0550-3213(99)00133-9","CERN-TH/98-360","hep-ph",,"  The duality symmetry of the Hamiltonian and integrals of motion for Reggeon
interactions in multicolour QCD is formulated as an integral equation for the
wave function of compound states of $n$ reggeized gluons. In particular the
Odderon problem in QCD is reduced to the solution of the one-dimensional
Schr\""odinger equation. The Odderon Hamiltonian is written in a normal form,
which gives a possibility to express it as a function of its integrals of
motion.
","[{""version"":""v1"",""created"":""Fri, 11 Dec 1998 17:51:31 GMT""},{""version"":""v2"",""created"":""Mon, 14 Dec 1998 13:08:01 GMT""},{""version"":""v3"",""created"":""Tue, 2 Mar 1999 10:30:19 GMT""}]","2009-10-31"
"hep-ph/9812337","Oscar Vives","D.A. Demir (1), A. Masiero (2) and O. Vives (2), ((1) ICTP, Trieste,
  (2) SISSA-ISAS and INFN, Trieste)","Fully Supersymmetric CP Violation in K and B Systems","Erratum added at the end of the paper. Additional constrains diminish
  the observable effects. A complete analysis will be presented in a short
  time. 6 pages, 2 eps figures","Phys.Rev.Lett. 82 (1999) 2447-2450","10.1103/PhysRevLett.82.2447","SISSA/EP/140/98, IC/98/228","hep-ph",,"  We analyze CP violation in supersymmetric extensions of the Standard Model
with heavy scalar fermions of the first two generations. Neglecting
intergenerational mixing in the sfemion mass matrices and thus considering only
chargino, charged Higgs and W--boson diagrams we show that it is possible to
fully account for CP violation in the kaon system even in the absence of the
standard CKM phase. This opens new possibilities for large supersymmetric
contributions to CP violation in the B system.
","[{""version"":""v1"",""created"":""Fri, 11 Dec 1998 18:19:09 GMT""},{""version"":""v2"",""created"":""Sat, 12 Dec 1998 09:03:28 GMT""},{""version"":""v3"",""created"":""Mon, 11 Jan 1999 15:29:06 GMT""},{""version"":""v4"",""created"":""Thu, 10 Jun 1999 18:04:38 GMT""}]","2009-10-31"
"hep-ph/9812338","Nikolaos Irges","Nikolaos Irges","Anomalous U(1), holomorphy, supersymmetry breaking and dilaton
  stabilization","14 pages, no figures; wording of the abstract is changed","Phys.Rev. D59 (1999) 115008","10.1103/PhysRevD.59.115008",,"hep-ph",,"  We argue that in certain models with family symmetries the implementation of
the alignment mechanism for the supression of the flavor changing neutral
currents requires mass matrices with holomorphic zeros in the down quark
sector. Holomorphic zeros typically open flat directions that potentially spoil
the uniqueness of the supersymmetric vacuum. We then present an anomalous U(1)
model without holomorphic zeros in the quark sector that can reproduce the
fermion mass hierarchies, provided that $\tan{\beta}$ is of order one. To avoid
undesired flavor changing neutral currents we propose a supersymmetry breaking
mechanism and a dilaton stabilization scenario that result in degenerate
squarks at $M\sim M_{GUT}$ and a calculable low energy spectrum. We present the
numerical predictions of this model for the Higgs mass for different values of
$M$ and $\tan{\beta}$.
","[{""version"":""v1"",""created"":""Fri, 11 Dec 1998 20:32:09 GMT""},{""version"":""v2"",""created"":""Tue, 16 Feb 1999 16:16:58 GMT""},{""version"":""v3"",""created"":""Wed, 14 Apr 1999 14:35:04 GMT""},{""version"":""v4"",""created"":""Sat, 17 Jul 2004 07:21:42 GMT""}]","2009-10-31"
