"cond-mat/9812316","Tatsumi","Rie Tatsumi and George Chikenji","The Origin of the Designability of Protein Structures","17 pages, 2 figures",,"10.1103/PhysRevE.60.4696","OUCMT-98-9","cond-mat.soft cond-mat.mtrl-sci q-bio",,"  We examined what determines the designability of 2-letter codes (H and P)
lattice proteins from three points of view. First, whether the native structure
is searched within all possible structures or within maximally compact
structures. Second, whether the structure of the used lattice is bipartite or
not. Third, the effect of the length of the chain, namely, the number of
monomers on the chain. We found that the bipartiteness of the lattice structure
is not a main factor which determines the designability. Our results suggest
that highly designable structures will be found when the length of the chain is
sufficiently long to make the hydrophobic core consisting of enough number of
monomers.
","[{""version"":""v1"",""created"":""Fri, 18 Dec 1998 13:20:55 GMT""},{""version"":""v2"",""created"":""Wed, 5 May 1999 11:01:29 GMT""}]","2009-10-31"
"cond-mat/9812317","Andreas Osteroh","A. Osterloh, L. Amico, and U. Eckern","Bethe Ansatz solution of a new class of Hubbard-type models","4 pages, revtex. Essentially modified version","J. Phys. A, Vol 33, L87 (2000)","10.1088/0305-4470/33/9/101",,"cond-mat.str-el",,"  We define one-dimensional particles with generalized exchange statistics. The
exact solution of a Hubbard-type Hamiltonian constructed with such particles is
achieved using the Coordinate Bethe Ansatz. The chosen deformation of the
statistics is equivalent to the presence of a magnetic field produced by the
particles themselves, which is present also in a ``free gas'' of these
particles.
","[{""version"":""v1"",""created"":""Fri, 18 Dec 1998 13:22:58 GMT""},{""version"":""v2"",""created"":""Tue, 6 Apr 1999 16:26:00 GMT""},{""version"":""v3"",""created"":""Tue, 14 Dec 1999 12:55:29 GMT""}]","2007-05-23"
"cond-mat/9812318","Matthias Otto","Matthias Otto (Institute of Theoretical Physics, University of
  Goettingen, Germany)","Using path integrals to price interest rate derivatives","15 pages, no figures, typos corrected, references added",,,,"cond-mat.stat-mech q-fin.PR",,"  We present a new approach for the pricing of interest rate derivatives which
allows a direct computation of option premiums without deriving a
(Black-Scholes type) partial differential equation and without explicitly
solving the stochastic process for the underlying variable. The approach is
tested by rederiving the prices of a zero bond and a zero bond option for a
short rate environment which is governed by Vasicek dynamics. Furthermore, a
generalization of the method to general short rate models is outlined. In the
case, where analytical solutions are not accessible, numerical implementations
of the path integral method in terms of lattice calculations as well as path
integral Monte Carlo simulations are possible.
","[{""version"":""v1"",""created"":""Fri, 18 Dec 1998 13:50:18 GMT""},{""version"":""v2"",""created"":""Mon, 14 Jun 1999 12:54:50 GMT""}]","2008-12-02"
"cond-mat/9812319","Mariusz Lisowski","M. Lisowski, E. Zipper, and M. Stebelski","Possibility of long-range order in clean mesoscopic cylinders","14 pages, REVTeX, 5 figures, in print in Phys. Rev. B",,"10.1103/PhysRevB.59.8305",,"cond-mat.mes-hall",,"  A microscopic Hamiltonian of the magnetostatic interaction is discussed. This
long-range interaction can play an important role in mesoscopic systems leading
to an ordered ground state.
  The self-consistent mean field approximation of the magnetostatic interaction
is performed to give an effective Hamiltonian from which the spontaneous,
self-sustaining currents can be obtained.
  To go beyond the mean field approximation the mean square fluctuation of the
total momentum is calculated and its influence on self-sustaining currents in
mesoscopic cylinders with quasi-1D and quasi-2D conduction is considered. Then,
by the use of the microscopic Hamiltonian of the magnetostatic interaction for
a set of stacked rings, the problem of long-range order is discussed. The
temperature $T^{*}$ below which the system is in an ordered state is
determined.
","[{""version"":""v1"",""created"":""Fri, 18 Dec 1998 13:55:59 GMT""}]","2009-10-31"
"cond-mat/9812320","Tetsuro Nikuni","T. Nikuni, E. Zaremba and A. Griffin","Two-fluid dynamics for a Bose-Einstein condensate out of local
  equilibrium with the non-condensate","4 pages, revtex, 1 postscript figure, Fig.1 has been corrected",,"10.1103/PhysRevLett.83.10",,"cond-mat",,"  We extend our recent work on the two-fluid hydrodynamics of a Bose-condensed
gas by including collisions involving both condensate and non-condensate atoms.
These collisions are essential for establishing a state of local thermodynamic
equilibrium between the condensate and non-condensate. Our theory is more
general than the usual Landau two-fluid theory, to which it reduces in the
appropriate limit, in that it allows one to describe situations in which a
state of complete local equilibrium between the two components has not been
reached. The exchange of atoms between the condensate and non-condensate is
associated with a new relaxational mode of the gas.
","[{""version"":""v1"",""created"":""Fri, 18 Dec 1998 14:53:12 GMT""},{""version"":""v2"",""created"":""Tue, 20 Apr 1999 05:22:13 GMT""}]","2009-10-31"
"gr-qc/9812063","Rosario Martin","Rosario Martin and Enric Verdaguer","An effective stochastic semiclassical theory for the gravitational field","33 pages, LaTeX, no figures; v2: Eqs. (2.28) and (2.31) of subsection
  II C have been generalized","Int.J.Theor.Phys.38:3049-3089,1999","10.1023/A:1026668418065",,"gr-qc hep-th",,"  Assuming that the mechanism proposed by Gell-Mann and Hartle works as a
mechanism for decoherence and classicalization of the metric field, we formally
derive the form of an effective theory for the gravitational field in a
semiclassical regime. This effective theory takes the form of the usual
semiclassical theory of gravity, based on the semiclassical Einstein equation,
plus a stochastic correction which accounts for the back reaction of the lowest
order matter stress-energy fluctuations.
","[{""version"":""v1"",""created"":""Thu, 17 Dec 1998 19:43:34 GMT""},{""version"":""v2"",""created"":""Mon, 21 Dec 1998 19:36:27 GMT""}]","2011-04-15"
"gr-qc/9812064","Elizabeth Winstanley","E. Winstanley","Existence of stable hairy black holes in su(2) Einstein-Yang-Mills
  theory with a negative cosmological constant","22 pages, 10 figures (1 ps file), LaTeX2e, uses amssymb, graphicx
  Minor changes, version to appear in Classical and Quantum Gravity","Class.Quant.Grav. 16 (1999) 1963-1978","10.1088/0264-9381/16/6/325","OUTP-98-92-P","gr-qc",,"  We consider black holes in EYM theory with a negative cosmological constant.
The solutions obtained are somewhat different from those for which the
cosmological constant is either positive or zero. Firstly, regular black hole
solutions exist for continuous intervals of the parameter space, rather than
discrete points. Secondly, there are non-trivial solutions in which the gauge
field has no nodes. We show that these solutions are linearly stable.
","[{""version"":""v1"",""created"":""Thu, 17 Dec 1998 17:35:42 GMT""},{""version"":""v2"",""created"":""Thu, 29 Apr 1999 16:49:33 GMT""}]","2009-10-31"
"gr-qc/9812065","Christopher Beetle","Abhay Ashtekar, Christopher Beetle and Stephen Fairhurst","Isolated Horizons: A Generalization of Black Hole Mechanics","9 pages, LaTeX2e, 3 eps figures","Class.Quant.Grav.16:L1-L7,1999","10.1088/0264-9381/16/2/027",,"gr-qc",,"  A set of boundary conditions defining a non-rotating isolated horizon are
given in Einstein-Maxwell theory. A space-time representing a black hole which
itself is in equilibrium but whose exterior contains radiation admits such a
horizon . Physically motivated, (quasi-)local definitions of the mass and
surface gravity of an isolated horizon are introduced. Although these
definitions do not refer to infinity, the quantities assume their standard
values in Reissner-Nordstrom solutions. Finally, using these definitions, the
zeroth and first laws of black hole mechanics are established for isolated
horizons.
","[{""version"":""v1"",""created"":""Fri, 18 Dec 1998 00:24:24 GMT""}]","2010-04-06"
"gr-qc/9812066","Garcia","L.C.Garcia de Andrade","Chern-Simons electrodynamics in (2+1)-spacetime with torsion","5 pages latex",,,,"gr-qc",,"  Chern-Simons electrodynamics in 2+1-spacetimes with torsion is investigated.
We start from the usual Chern-Simons (CS) electrodynamics Lagrangian and Cartan
torsion is introduced in the covariant derivative and by a direct coupling of
torsion vector to the CS field. Variation of the Lagrangian with respect to
torsion shows that Chern-Simons field is proportional to the product of the
square of the scalar field and torsion. The electric field is proportional to
torsion vector and the magnetic flux is computed in terms of the time-component
of the two dimensional torsion. Contrary to early massive electrodynamics in
the present model the photon mass does not depend on torsion.
","[{""version"":""v1"",""created"":""Fri, 18 Dec 1998 03:07:47 GMT""}]","2007-05-23"
"gr-qc/9812067","Robert J. Low","Robert J Low","Speed Limits in General Relativity","7 pages; AMS-LaTeX; accepted for publication by Classical and Quantum
  Gravity","Class.Quant.Grav. 16 (1999) 543-549","10.1088/0264-9381/16/2/016",,"gr-qc",,"  Some standard results on the initial value problem of general relativity in
matter are reviewed. These results are applied first to show that in a well
defined sense, finite perturbations in the gravitational field travel no faster
than light, and second to show that it is impossible to construct a warp drive
as considered by Alcubierre (1994) in the absence of exotic matter.
","[{""version"":""v1"",""created"":""Fri, 18 Dec 1998 14:06:01 GMT""}]","2009-10-31"
"gr-qc/9812068","Willy Kley","Willy Kley, Gerhard Schaefer (TPI, University of Jena)","Relativistic dust disks and the Wilson-Mathews approach","4 Pages, 5 eps-figures, uses revtex.sty. Submitted to PRL","Phys.Rev.D60:027501,1999","10.1103/PhysRevD.60.027501",,"gr-qc astro-ph",,"  Treating problems in full general relativity is highly complex and frequently
approximate methods are employed to simplify the solution. We present
comparative solutions of a infinitesimally thin relativistic, stationary,
rigidly rotating disk obtained using the full equations and the approximate
approach suggested by Wilson & Mathews. We find that the Wilson-Mathews method
has about the same accuracy as the first post-Newtonian approximation.
","[{""version"":""v1"",""created"":""Fri, 18 Dec 1998 15:10:46 GMT""}]","2008-11-26"
"gr-qc/9812069","Ruth Lazkoz","Ruth Lazkoz","G1 Cosmologies with Gravitational and Scalar Waves","24 pages, 2 figures","Phys. Rev. D 60, 104008 (1999)","10.1103/PhysRevD.60.104008",,"gr-qc",,"  I present here a new algorithm to generate families of inhomogeneous massless
scalar field cosmologies. New spacetimes, having a single isometry, are
generated by breaking the homogeneity of massless scalar field $G_2$ models
along one direction. As an illustration of the technique I construct
cosmological models which in their late time limit represent perturbations in
the form of gravitational and scalar waves propagating on a non-static
inhomogeneous background. Several features of the obtained metrics are
discussed, such as their early and late time limits, structure of singularities
and physical interpretation.
","[{""version"":""v1"",""created"":""Fri, 18 Dec 1998 15:56:20 GMT""}]","2016-08-25"
"hep-ex/9812021","Siegfried Hahn","DELPHI Collaboration (Siegfried Hahn for the Collaboration)","The Strong Coupling: Measurements and Running","Plenary talk given at the Hadron Structure 98, Stara Lesna, Slovakia,
  7-13 Sep 98 (24 pp.)",,,"DELPHI 98-174 PHYS 813, WU B 98-39","hep-ex",,"  Measurements of \alpha_s from event shapes in e^{+} e^{-} annihilation are
discussed including recent determinations using experimentally optimized
scales, studies of theoretically motivated scale setting prescriptions, and
recently observed problems with predictions in Next to Leading Logarithmic
Approximation. Other recent precision measurements of \alpha_s are briefly
discussed. The relevance of power terms for the energy evolution of event shape
means and distributions is demonstrated. Finally a summary on the current
results on \alpha_s(M_Z) and its running is given.
","[{""version"":""v1"",""created"":""Thu, 17 Dec 1998 21:07:03 GMT""}]","2012-08-27"
"hep-lat/9812015","Jan Ambjorn","J. Ambjorn, P. Bialas and J. Jurkiewicz","Connected Correlators in Quantum Gravity","21 pages, 8 figures","JHEP 9902 (1999) 005","10.1088/1126-6708/1999/02/005","MPS-RR 1998-33, BI-TP 98/39, NBI-HE-98-23","hep-lat gr-qc hep-th",,"  We discuss the concept of connected, reparameterization invariant matter
correlators in quantum gravity. We analyze the effect of discretization in two
solvable cases: branched polymers and two-dimensional simplicial gravity. In
both cases the naively defined connected correlators for a fixed volume display
an anomalous behavior, which could be interpreted as a long-range order. We
suggest that this is in fact only a highly non-trivial finite-size effect and
propose an improved definition of the connected correlator, which reduces the
effect. Using this definition we illustrate the appearance of a long-range spin
order in the Ising model on a two-dimensional random lattice in an external
magnetic field $H$, when $H \to 0$ and $\beta=\beta_C$.
","[{""version"":""v1"",""created"":""Fri, 18 Dec 1998 11:00:27 GMT""}]","2009-10-31"
"hep-lat/9812016","Wolfgang Bietenholz","W. Bietenholz and H. Dilger","The Schwinger Model with Perfect Staggered Fermions","30 pages, 16 figures. Following the referee's suggestions, we have
  incorporated the material of hep-lat/9803018 in this comprehensive paper","Nucl.Phys. B549 (1999) 335-363","10.1016/S0550-3213(99)00113-3","NORDITA-98/67 HE","hep-lat",,"  We construct and test a quasi-perfect lattice action for staggered fermions.
The construction starts from free fermions, where we suggest a new blocking
scheme, which leads to excellent locality of the perfect action. An adequate
truncation preserves a high quality of the free action. An Abelian gauge field
is inserted in d=2 by effectively tuning the couplings to a few short-ranged
lattice paths, based on the behavior of topological zero modes. We simulate the
Schwinger model with this action, applying a new variant of Hybrid Monte Carlo,
which damps the computational overhead due to the non-standard couplings. We
obtain a tiny ``pion'' mass down to very small \beta, while the ``\eta'' mass
follows very closely the prediction of asymptotic scaling. The observation that
even short-ranged quasi-perfect actions can yield strong improvement is most
relevant in view of QCD.
","[{""version"":""v1"",""created"":""Fri, 18 Dec 1998 14:59:26 GMT""}]","2009-10-31"
"hep-ph/9812416","Dmitry Ostrovsky","A.V. Leonidov (1,2), D.M. Ostrovsky (1) ((1) Theoretical Department,
  Lebedev Physics Institute, Moscow, Russia; (2) Service de Physique Theorique,
  C.E.Saclay, Gif-sur-Yvette, France)","Angular pattern of minijet transverse energy flow in hadron and nuclear
  collisions","25 LaTeX pages, 11 figures embedded with epsf; expanded version","Eur.Phys.J.C16:683-693,2000; Phys.Atom.Nucl.65:886-897,2002;
  Yad.Fiz.65:918-929,2002","10.1134/1.1481483","FIAN/TD-28/98, SPhT-98/145","hep-ph nucl-th",,"  The azimuthal asymmetry of minijet system produced at the early stage of
nucleon-nucleon and nuclear collisions in a central rapidity window is studied.
We show that in pp collisions the minijet transverse energy production in a
central rapidity window is essentially unbalanced in azimuth due to asymmetric
contributions in which only one minijet hits the acceptance window. We further
study the angular pattern of transverse energy flow generated by semihard
degrees of freedom at the early stage of high energy nuclear collisions and its
dependence on the number of semihard collisions in the models both including
and neglecting soft contributions to the inelastic cross section at RHIC and
LHC energies as well as on the choice of the infrared cutoff.
","[{""version"":""v1"",""created"":""Thu, 17 Dec 1998 17:26:33 GMT""},{""version"":""v2"",""created"":""Tue, 25 Jan 2000 09:38:31 GMT""},{""version"":""v3"",""created"":""Wed, 26 Jan 2000 11:47:11 GMT""}]","2011-09-13"
"hep-ph/9812417","Matthias Jamin","H.G. Dosch, M. Eidemueller, M. Jamin","QCD sum rule analysis of the field strength correlator","16 pages, 1 figure","Phys.Lett.B452:379-386,1999","10.1016/S0370-2693(99)00224-5","HD-THEP-98-51","hep-ph",,"  The gauge invariant two-point correlator for the gluon field strength tensor
is analysed by means of the QCD sum rule method. To this end, we make use of a
relation of this correlator to a two-point function for a quark-gluon hybrid in
the limit of the quark mass going to infinity. From the sum rules a relation
between the gluon correlation length and the gluon condensate is obtained. We
briefly compare our results to recent determinations of the field strength
correlator on the lattice.
","[{""version"":""v1"",""created"":""Thu, 17 Dec 1998 17:49:39 GMT""}]","2008-11-26"
"hep-ph/9812418","Sheldon Lee Glashow, Hpop","Sidney Coleman and Sheldon L. Glashow","High-Energy Tests of Lorentz Invariance","33 pages, uses harvmac. This 2nd revision corrects two typos, an
  error in the Appendix, and includes further acknowledgements","Phys.Rev.D59:116008,1999","10.1103/PhysRevD.59.116008","HUTP-98/A082","hep-ph",,"  We develop a perturbative framework with which to discuss departures from
exact Lorentz invariance and explore their potentially observable
ramifications. Tiny non-invariant terms introduced into the standard model
Lagrangian are assumed to be renormalizable (dimension $\le 4$), invariant
under $SU(3)\otimes SU(2)\otimes U(1)$ gauge transformations, and rotationally
and translationally invariant in a preferred frame. There are a total of 46
independent TCP-even perturbations of this kind, all of which preserve anomaly
cancellation. They define the energy-momentum eigenstates and their maximal
attainable velocities in the high-energy limit. The effects of these
perturbations increase rapidly with energy in the preferred frame, more rapidly
than those of TCP-odd perturbations. Our analysis of Lorentz-violating
kinematics reveals several striking new phenomena that are relevant both to
cosmic-ray physics ({\it e.g.,} by undoing the GZK cutoff) and neutrino physics
({\it e.g.,} by generating novel types of neutrino oscillations). These may
lead to new and sensitive high-energy tests of special relativity.
","[{""version"":""v1"",""created"":""Thu, 17 Dec 1998 20:00:31 GMT""},{""version"":""v2"",""created"":""Thu, 31 Dec 1998 19:36:08 GMT""},{""version"":""v3"",""created"":""Wed, 20 Jan 1999 20:11:16 GMT""}]","2008-11-26"
"hep-ph/9812419","Fabrizio Gabbiani","Fabrizio Gabbiani","Unitarity corrections to K+ -> pi+ gamma l+l-","18 pages, 13 eps figures. LaTeX, uses epsfig.sty. Version accepted
  for publication on Phys. Rev. D. Misprints corrected","Phys.Rev.D59:094022,1999","10.1103/PhysRevD.59.094022",,"hep-ph",,"  We perform a chiral one-loop calculation of the unitarity corrections to the
processes K+ -> pi+ gamma l+l- up to O(E^6), taking into account pi+pi-
intermediate states. Branching ratios and differential branching ratios are
computed and presented to demonstrate the importance of the above corrections.
","[{""version"":""v1"",""created"":""Thu, 17 Dec 1998 20:05:32 GMT""},{""version"":""v2"",""created"":""Fri, 5 Mar 1999 15:08:59 GMT""}]","2011-08-17"
"hep-ph/9812420","Michel C. Vetterli","Michel C. Vetterli (TRIUMF)","The Spin Structure of the Nucleon (Lectures at the 13th Lake Louise
  Winter Institute)","51 pages, 24 figures, Latex, psfigure.sty, rotating.sty, sprocl.sty",,,,"hep-ph",,"  This paper gives a pedagogical introduction to our knowledge of the spin
structure of the nucleon. In particular, polarised deep inelastic lepton
scattering is presented as a tool to study how the nucleon's constituents
combine to generate its spin. The importance of semi-inclusive measurements is
discussed and a window on future experiments in the field is given.
","[{""version"":""v1"",""created"":""Thu, 17 Dec 1998 20:24:09 GMT""}]","2007-05-23"
"hep-ph/9812421","Bhaskar Dutta","K. S. Babu, B. Dutta and R. N. Mohapatra","Partial Yukawa unification and a supersymmetric origin of flavor mixing","19 pages, 2 figures","Phys.Rev. D60 (1999) 095004","10.1103/PhysRevD.60.095004","OSU-HEP-98-10, CTP-TAMU-50-98, UMD-PP-99-057","hep-ph",,"  In a large class of supersymmetric SO(10) and left-right models, requiring
that the effective theory below the scale of $SU(2)_R$ breaking be the MSSM
implies partial Yukawa unification with $Y_u=Y_d$ and $Y_e=Y_{\nu^D}$. The same
result also emerges in models with a horizontal $SU(3)_H$ symmetry. As a
result, at the tree level, these models lead to vanishing quark mixing angles.
We show that the correct mixing pattern can be generated in these models at the
loop level from the flavor structure associated with the supersymmetry breaking
terms. We generalize the constraints on supersymmetric parameters from flavor
changing neutral current (FCNC) processes to include several squark mass
insertions and confirm the consistency of the scheme. The expectations of this
scheme for CP violating observables in the $B$ meson system are quiet different
from the KM model, so it can be tested at the B factories.
","[{""version"":""v1"",""created"":""Thu, 17 Dec 1998 21:03:56 GMT""}]","2009-10-31"
"hep-ph/9812422","Ster Andras","T. Csorgo (KFKI-RMKI), B. Lorstad (University of Lund), J.
  Schmidt-Sorensen (University of Lund), A. Ster (KFKI-MFA)","Partial coherence in the core/halo picture of Bose-Einstein n-particle
  correlations","15 pages, Latex, 3 EPS files, 1 table","Eur.Phys.J.C9:275-281,1999","10.1007/s100529900024","RMKI-98-12","hep-ph",,"  We study the influence of a possible coherent component in the boson source
on the two-, three- and $n$-particle correlation functions in a generalized
core/halo type of boson-emitting source. In particular, a simple formula is
presented for the strengh of the $n$-particle correlation functions for such
systems. Graph rules are obtained to evaluate the correlation functions of
arbitrary high order. The importance of experimental determination of the 4-th
and 5-th order Bose-Einstein correlation function is emphasized.
","[{""version"":""v1"",""created"":""Thu, 17 Dec 1998 22:06:35 GMT""},{""version"":""v2"",""created"":""Mon, 4 Jan 1999 16:47:35 GMT""}]","2009-02-10"
"hep-ph/9812423","Johan Rathsman","Johan Rathsman","A Generalised Area Law for Hadronic String Reinteractions","11 pages, 5 figures, see also http://www3.tsl.uu.se/~rathsman/gal/
  Slightly shortened version with minor modifications for publication","Phys.Lett. B452 (1999) 364-371","10.1016/S0370-2693(99)00291-9","SLAC-PUB-8034","hep-ph",,"  A new model for hadronic string reinteractions based on a generalised area
law is presented. The model describes both the hadronic final states in
$e^+e^-$ annihilation and the diffractive structure function in deep inelastic
scattering. The model also predicts a shift in the W-mass reconstructed from
hadronic decays of W-pairs of the order 65 MeV.
","[{""version"":""v1"",""created"":""Thu, 17 Dec 1998 22:41:54 GMT""},{""version"":""v2"",""created"":""Thu, 18 Mar 1999 22:27:05 GMT""}]","2009-10-31"
"hep-ph/9812425","Alexander Ya. Parkhomenko","N.V. Mikheev, A.Ya. Parkhomenko and L.A. Vassilevskaya","Field-induced axion decay $a \to e^+ e^-$ in plasma","9 pages, latex, 2 PS figures, corrected some typos","Phys.Lett. B439 (1998) 345-349","10.1016/S0370-2693(98)01068-5","YARU-HE-98/09","hep-ph",,"  The axion decay $a \to e^+ e^-$ is investigated in the presence of a plasma
and an external magnetic field. The results demonstrate a strong catalyzing
influence of medium. The axion lifetime in the magnetic field of order
$10^{15}$ G and at the temperature of order 10 MeV is reduced to $10^4$ s.
","[{""version"":""v1"",""created"":""Fri, 18 Dec 1998 12:32:22 GMT""},{""version"":""v2"",""created"":""Sun, 3 Jan 1999 09:11:13 GMT""}]","2009-10-31"
"hep-ph/9812426","Christof Wetterich","C.Wetterich","Natural Maximal ny_my - ny_tau Mixing","13 pages,LaTex","Phys.Lett.B451:397-405,1999","10.1016/S0370-2693(99)00192-6","HD-THEP-98-61","hep-ph",,"  The naturalness of maximal mixing between myon- and tau-neutrinos is
investigated. A spontaneously broken nonabelian generation symmetry can explain
a small parameter which governs the deviation from maximal mixing. In many
cases all three neutrino masses are almost degenerate. Maximal
ny_my-ny_tau-mixing would indicate that the leading contribution to the light
neutrino masses arises from the expectation value of a heavy weak triplet
rather than from the seesaw mechanism. In this scenario the deviation from
maximal mixing is predicted to be less than about 1%.
","[{""version"":""v1"",""created"":""Fri, 18 Dec 1998 13:29:38 GMT""}]","2008-11-26"
