"adap-org/9812004","Rui Vilela Mendes","R. Vilela Mendes (Grupo de Fisica Matematica, Lisboa, Portugal)","Clustering and synchronization with positive Lyapunov exponents","10 pages Latex, 2 ps figures","Physics Letters A 257 (1999) 132","10.1016/S0375-9601(99)00319-9",,"adap-org nlin.AO",,"  Clustering and correlation effects are frequently observed in chaotic systems
in situations where, because of the positivity of the Lyapunov exponents, no
dimension reduction is to be expected. In this paper, using a globally coupled
network of Bernoulli units, one finds a general mechanism by which strong
correlations and slow structures are obtained at the synchronization edge. A
structure index is defined, which diverges at the transition points. Some
conclusions are drawn concerning the construction of an ergodic theory of
self-organization.
","[{""version"":""v1"",""created"":""Fri, 18 Dec 1998 13:58:47 GMT""}]","2009-10-30"
"astro-ph/9812331","Keith Horne","Keith Horne","Echo Mapping of AGN Emission Regions","Invited review to appear in ``Quasars and Cosmology'', 18-22 May
  1998, La Serena Chile. A.S.P. Conference Series~1999. eds. G.Ferland,
  J.Baldwin. (San Francisco: ASP) 23 pages, 10 figures",,,,"astro-ph",,"  Echo mapping exploits light travel time delays, revealed by multi-wavelength
variability studies, to map the geometry, kinematics, and physical conditions
of reprocessing sites in photo-ionized gas flows. In AGNs, the ultra-violet to
near infra-red light arises in part from reprocessing of EUV and X-ray light
from a compact and erratically variable source in the nucleus. The observed
time delays, 0.1-2 days for the continuum, 1-100 days for the broad emission
lines, probe regions only micro-arcseconds away from the nucleus. The continuum
time delays map the temperature-radius profiles of the AGN accretion discs. The
emission-line delays reveal radially stratified ionization zones, identify the
nature of the gas motions, and estimate the masses of the central black holes.
By using light travel time to measure the sizes of AGN accretion discs and
photo-ionized zones, echo mapping offers two independent ways to measure
redshift-independent distances to AGNs.
","[{""version"":""v1"",""created"":""Thu, 17 Dec 1998 17:17:23 GMT""}]","2007-05-23"
"astro-ph/9812332",,"V.I. Dokuchaev, Yu.N. Eroshenko, L.M. Ozernoy","GRB Redshift Distribution is Consistent with GRB Origin in Evolved
  Galactic Nuclei","LaTeX, 4 pages (incl. 1 figure), to appear in ""After the Dark Ages:
  When Galaxies Were Young (the Universe at 2<z<5)"", eds. S.S. Holt and E.P.
  Smith",,"10.1063/1.58626",,"astro-ph",,"  Recently we have elaborated a new cosmological model of gamma-ray burst (GRB)
origin (1998, ApJ 502, 192), which employs the dynamical evolution of central
dense stellar clusters in the galactic nuclei. Those clusters inevitably
contain a large fraction of compact stellar remnants (CSRs), such as neutron
stars (NSs) and stellar mass black holes (BHs), and close encounters between
them result in radiative captures into short-living binaries, with subsequent
merging of the components, thereby producing GRBs (typically at large distances
from the nucleus).
  In the present paper, we calculate the redshift distribution of the rate of
GRBs produced by close encounters of NSs in distant galactic nuclei. To this
end, the following steps are undertaken: (i) we establish a connection between
the parameters of the fast evolving central stellar clusters (i.e. those for
which the time of dynamical evolution exceeds the age of the Universe) with
masses of the forming central supermassive black holes (SMBHs) using a
dynamical evolution model; (ii) we connect these masses with the inferred mass
distributions of SMBHs in the galactic nuclei and the redshift distribution of
quasars by assuming a certain `Eddington luminosity phase' in their activity;
(iii) we incorporate available observational data on the redshift distribution
of quasars as well as a recently found correlation between the masses of
galaxies and their central SMBHs. The resulting redshift distribution of the
GRB rate, which accounts for both fast and slowly evolving galactic nuclei is
consistent with that inferred from the BATSE data if the fraction of fast
evolving galactic nuclei is in the range $0.016-0.16$.
","[{""version"":""v1"",""created"":""Thu, 17 Dec 1998 18:30:05 GMT""}]","2009-10-31"
"astro-ph/9812333","Teresa Montaruli","T. Montaruli and F. Ronga (for the MACRO Collaboration)","Search for a possible space-time correlation between high energy
  neutrinos and gamma-ray bursts","3 pages, 2 figures, Proc. of Gamma-Ray Bursts in the Afterglow Era,
  Rome, November 3-6 1998, submitted to Astronomy and Astrophysics (Supplement
  Series)",,,,"astro-ph",,"  We look for space-time correlations between 2233 gamma-bursts in the Batse
Catalogs and 894 upward-going muons produced by neutrino interactions in the
rock below or inside MACRO. Considering a search cone of 10 degrees around GRB
directions and a time window of 200 s we find 0 events to be compared to 0.035
expected background events due to atmospheric neutrinos. The corresponding
upper limit (90% c.l.) is 0.87 * 10^-9 cm^-2 upward-going muons per average
burst.
","[{""version"":""v1"",""created"":""Thu, 17 Dec 1998 18:32:39 GMT""}]","2019-08-14"
"astro-ph/9812334","Yannick Giraud-Heraud","R. Ansari, M. Auriere, P. Baillon, A. Bouquet, G. Coupinot, Ch.
  Coutures, C. Ghesquiere, Y. Giraud-Heraud, P. Gondolo, J. Hecquet, J. Kaplan,
  A. Kim, Y. Le Du, A.L. Melchior, M. Moniez, J.P. Picat, and G. Soucail","AgapeZ1: a Large Amplification Microlensing Event or an Odd Variable
  Star Towards the Inner Bulge of M31","4 pages with 5 figures",,,"PCC 98 23","astro-ph",,"  AgapeZ1 is the brightest and the shortest duration microlensing candidate
event found in the Agape data. It occured only 42"" from the center of M31. Our
photometry shows that the half intensity duration of the event6 is 4.8 days and
at maximum brightness we measure a stellar magnitude of R=18.0 with B-R=0.80
mag color. A search on HST archives produced a single resolved star within the
projected event position error box. Its magnitude is R=22.
","[{""version"":""v1"",""created"":""Thu, 17 Dec 1998 19:14:26 GMT""}]","2007-05-23"
"astro-ph/9812335","Robert J. Brunner","A.S. Szalay and R.J. Brunner","Astronomical Archives of the Future: A Virtual Observatory","14 pages, 3 figures, Accepted to a special issue of the Elsevier
  journal ""Future Generation Computer Systems""",,,,"astro-ph",,"  Astronomy is entering a new era as multiple, large area, digital sky surveys
are in production. The resulting datasets are truly remarkable in their own
right; however, a revolutionary step arises in the aggregation of complimentary
multi-wavelength surveys (i.e. the cross-identification of a billion sources).
Federating these different datasets, however, is an extremely challenging task.
With this task in mind, we have identified several areas where community
standardization can provide enormous benefits in order to develop the
techniques and technologies necessary to solve the problems inherent in
federating these large databases, as well as the mining of the resultant
aggregate data. Several of these areas are domain specific, however, the
majority of them are not. We feel that the inclusion of non-astronomical
partnerships can provide tremendous insights.
","[{""version"":""v1"",""created"":""Thu, 17 Dec 1998 19:19:58 GMT""}]","2007-05-23"
"astro-ph/9812336","Robert Ehrlich","R. Ehrlich","Implications for the Cosmic Ray Spectrum of a Negative Electron Neutrino
  Mass^2","Published in Phys. Rev. D 60, 17302 (1999), 4 pages and 3 figures","Phys.Rev. D60 (1999) 17302",,,"astro-ph",,"  The features and problems of a speculative model based on the electron
neutrino being a tachyon are discussed. The model is consistent with five
properties of the cosmic ray spectrum, and it predicts a flux of neutrons in a
narrow energy region centered on 4.5 +/- 2.2 x 10^{15} eV.
","[{""version"":""v1"",""created"":""Thu, 17 Dec 1998 19:59:08 GMT""},{""version"":""v2"",""created"":""Tue, 2 Mar 1999 13:42:36 GMT""},{""version"":""v3"",""created"":""Sun, 5 Sep 1999 19:56:08 GMT""}]","2007-05-23"
"astro-ph/9812337","Dipak Munshi","Dipak Munshi (QMW, SISSA), Peter Coles (QMW, Univ of Nottingham),
  Adrian L. Melott (Univ of Kansas)","From Snakes to Stars, the Statistics of Collapsed Objects - I.
  Lower--order Clustering Properties","16 pages including 3 figures, MNRAS, submitted",,"10.1046/j.1365-8711.1999.02589.x",,"astro-ph",,"  The highly nonlinear regime of gravitational clustering is characterized by
the presence of scale-invariant form of many-body correlation functions. Useful
insights can be obtained by investigating the consequences of a generic scaling
{\em ansatz}. Extending earlier studies by Bernardeau & Schaeffer (1992) we
calculate the detailed consequences of such scaling. We generalise the
two-point cumulant correlators to a hierarchy of multi-point cumulant
correlators (MCC). We introduce the concept of reduced cumulant correlators
(RCC) and their related generating functions. Using analytical and diagrammatic
method we show that every new vertex of the tree representation of higher-order
correlations has its own reduced cumulant correlator. In the limit of large
separations, MCCs of arbitrary order can be expressed in terms of RCCs of the
same and lower order. We relate the generating functions of RCCs with the
statistics of {\em collapsed} objects. We develop the hierarchy for the
correlation functions of overdense regions. In this vein, we compute the
lower-order cumulants and cumulant correlators for overdense regions. Our study
shows how they vary as a function of the initial power spectrum of primordial
density fluctuations (abridged).
","[{""version"":""v1"",""created"":""Thu, 17 Dec 1998 23:48:36 GMT""}]","2009-10-31"
"astro-ph/9812338","Geza Gyuk","Geza Gyuk, Chris Flynn, and N. Wyn Evans","Star Counts and the Warped and Flaring Milky Way Disk","15 pages, submitted to ApJ",,"10.1086/307542",,"astro-ph",,"  This paper reports the star count predictions of warped and flaring models of
the outer Milky Way disk. These have been suggested as possible locations of
the lenses responsible for the microlensing events towards the Large Magellanic
Cloud (LMC). Three such models are investigated in detail and the theoretical
predictions are confronted with {\it Hubble Space Telescope} (HST) star count
data in 7 low latitude fields ($30^\circ < | b| < 40^\circ$). If the warped and
flaring disk population has the same characteristics as disk stars in the solar
neighbourhood, then the models can be unambiguously ruled out. Metallicity
gradients are well-known in disk galaxies and may cause the outer disk
population to differ in colors and luminosity from that locally. This effect is
studied using a simple ansatz for the variation in the color-magnitude relation
with position and while it is shown to lead to better agreement with the star
counts, upper limits on the contribution of the warped and flaring disk to the
optical depth are still below the value measured towards the LMC. Only if the
warp is very asymmetric or if the luminosity function changes strongly with
Galactocentric radius can the models be made consistent with the starcounts.
","[{""version"":""v1"",""created"":""Fri, 18 Dec 1998 00:17:55 GMT""}]","2009-10-31"
"astro-ph/9812339","Kenneth M. Lanzetta","Hsiao-Wen Chen, Alberto Fernandez-Soto, Kenneth M. Lanzetta, Sebastian
  M. Pascarelle, Richard C. Puetter, Noriaki Yahata, and Amos Yahil","Photometry and Photometric Redshifts of Galaxies in the Hubble Deep
  Field South Nicmos Field","1 page",,,,"astro-ph",,"  We present an electronic catalog of infrared and optical photometry and
photometric redshifts of 323 galaxies in the Hubble Deep Field South NICMOS
field at http://www.ess.sunysb.edu/astro/hdfs/home.html. The analysis is based
on infrared images obtained with the Hubble Space Telescope using the Near
Infrared Camera and Multi-Object Spectrograph and the Space Telescope Imaging
Spectrograph together with optical images obtained with the Very Large
Telescope. The infrared and optical photometry is measured by means of a new
quasi-optimal photometric technique that fits model spatial profiles of the
galaxies determined by Pixon image reconstruction techniques to the images. In
comparison with conventional methods, the new technique provides higher
signal-to-noise-ratio measurements and accounts for uncertainty correlations
between nearby, overlapping neighbors. The photometric redshifts are measured
by means of our redshift likelihood technique, incorporating six
spectrophotometric templates which, by comparison with spectroscopic redshifts
of galaxies identified in the Hubble Deep Field North, are known to provide
redshift measurements accurate to within an RMS relative uncertainty of (Delta
z)/(1 + z) < 0.1 at all redshifts z < 6. The analysis reaches a peak H-band
sensitivity threshold of AB(16000) = 28.3 and covers 1.02 acrmin^2 to AB(16000)
= 27, 1.27 arcmin^2 to AB(16000) = 26, and 1.44 arcmin^2 to AB(16000) = 25. The
analysis identifies galaxies at redshifts ranging from z near 0 through z
greater than 10, including 17 galaxies of redshift 5 < z < 10 and five
candidate galaxies of redshift z > 10.
","[{""version"":""v1"",""created"":""Fri, 18 Dec 1998 00:56:24 GMT""}]","2007-05-23"
"astro-ph/9812340","Jongsoo Kim","Alfredo Santillan(1,2), Jose Franco(2), Marco Martos(2), Jongsoo
  Kim(3) ((1)Computo Aplicado-DGSCA, UNAM, (2)Instituto de Astronomia, UNAM,
  (3)Korea Astronomy Observatory)","The Collisions of HVCs with a Magnetized Gaseous Galactic Disk","Accepted for publication in ApJ, 22 text pages with 8 figures",,"10.1086/307065",,"astro-ph",,"  We present two-dimensional MHD numerical simulations for the interaction of
high-velocity clouds with both magnetic and non-magnetic Galactic thick gaseous
disks. For the magnetic models, the initial magnetic field is oriented parallel
to the disk, and we consider two different field topologies (with and without
tension effects): parallel and perpendicular to the plane of motion of the
clouds. The impinging clouds move in oblique trajectories and fall toward the
central disk with different initial velocities. The $B$-field lines are
distorted and compressed during the collision, increasing the field pressure
and tension. This prevents the cloud material from penetrating into the disk,
and can even transform a high-velocity inflow into an outflow, moving away from
the disk. The perturbation creates a complex, turbulent, pattern of MHD waves
that are able to traverse the disk of the Galaxy, and induce oscillations on
both sides of the plane. Thus, the magnetic field efficiently transmits the
perturbation over a large volume, but also acts like a shield that inhibits the
mass exchange between the halo and the disk. For the non-magnetized cases, we
also uncover some novel features: the evolution of the shocked layer generates
a tail that oscillates, creating vorticity and turbulent flows along its
trajectory.
","[{""version"":""v1"",""created"":""Fri, 18 Dec 1998 02:45:23 GMT""}]","2009-10-31"
"astro-ph/9812341","Werner Hofmann","HEGRA Collaboration, M. Hess et al","The time structure of Cherenkov images generated by TeV gamma-rays and
  by cosmic rays","25 Pages, 16 figures, Latex","Astropart.Phys. 11 (1999) 363-377","10.1016/S0927-6505(99)00003-1",,"astro-ph",,"  The time profiles of Cherenkov images of cosmic-ray showers and of gamma-ray
showers are investigated, using data gathered with the HEGRA system of imaging
atmospheric Cherenkov telescopes during the 1997 outbursts of Mrk 501. Photon
arrival times are shown to vary across the shower images. The dominant feature
is a time gradient along the major axis of the images. The gradient varies with
the distance between the telescope and the shower core, and is maximal for
large distances. The time profiles of cosmic-ray showers and of gamma-ray
showers differ in a characteristic fashion. The main features of the time
profiles can be understood in terms of simple geometrical models. Use of the
timing information towards improved shower reconstruction and cosmic-ray
suppression is discussed.
","[{""version"":""v1"",""created"":""Fri, 18 Dec 1998 07:52:55 GMT""}]","2009-10-31"
"astro-ph/9812342","Stasinska","G. Stasinska","The analysis of giant HII regions using photoionization models","the models used in this paper, including the intensities of IR,
  optical and UV lines, are available from
  ftp://ftp.obspm.fr/pub/obs/grazyna/cd-crete",,,,"astro-ph",,"  After briefly reviewing the impact of various parameters on photoionization
models, we illustrate the importance of the nebular geometry by two examples:
we first compare the results from models with thin shell and full shell
geometry, and we study the influence of a diffuse ionized medium in the
integrated spectra of galaxies at large redshift. Finally, we show how the
calibration of the strong line method for deriving oxygen abundances depends on
the assumed average properties of the ionizing star cluster and on the density
distribution of the nebular gas.
","[{""version"":""v1"",""created"":""Fri, 18 Dec 1998 09:17:34 GMT""}]","2007-05-23"
"astro-ph/9812343","Hans Ritter","A.R. King, H. Ritter","Cygnus X-2, super-Eddington mass transfer, and pulsar binaries","9 pages, 4 encapsulated figures, LaTeX, revised version with a few
  typos corrected and an appendix added, accepted by MNRAS",,"10.1046/j.1365-8711.1999.02862.x",,"astro-ph",,"  We consider the unusual evolutionary state of the secondary star in Cygnus
X-2. Spectroscopic data give a low mass ($M_2 \simeq 0.5 - 0.7\msun$) and yet a
large radius ($R_2 \simeq 7\rsun$) and high luminosity ($L_2 \simeq 150\lsun$).
We show that this star closely resembles a remnant of early massive Case B
evolution, during which the neutron star ejected most of the $\sim 3\msun$
transferred from the donor (initial mass $M_{\rm 2i}\sim 3.6\msun$) on its
thermal time-scale $\sim 10^6$ yr. As the system is far too wide to result from
common-envelope evolution, this strongly supports the idea that a neutron star
efficiently ejects the excess inflow during super--Eddington mass transfer.
Cygnus X-2 is unusual in having had an initial mass ratio $q_{\rm i} = M_{\rm
2i}/M_1$ in a narrow critical range near $q_{\rm i}\simeq 2.6$. Smaller $q_{\rm
i}$ lead to long-period systems with the former donor near the Hayashi line,
and larger $q_{\rm i}$ to pulsar binaries with shorter periods and relatively
massive white dwarf companions. The latter naturally explain the surprisingly
large companion masses in several millisecond pulsar binaries. Systems like
Cygnus X-2 may thus be an important channel for forming pulsar binaries.
","[{""version"":""v1"",""created"":""Fri, 18 Dec 1998 09:36:39 GMT""},{""version"":""v2"",""created"":""Tue, 20 Jul 1999 09:57:30 GMT""}]","2009-10-31"
"astro-ph/9812344","Michele Bellazzini","M. Bellazzini (1), F.R. Ferraro (1), R. Buonanno (2) ((1) Oss.
  Astronomico di Bologna, (2) Oss. Astronomico di Roma)","The Sagittarius Dwarf Galaxy Survey (SDGS) I: CMDs, Reddening and
  Population Gradients. First evidences of a very metal poor population","26 pages, 9 postscript figures + 7 size-reduced .gif figures. Full
  resolution ps file available at http://boas3.bo.astro.it/bap/BAPhome.html
  Accepted by MNRAS",,"10.1046/j.1365-8711.1999.02377.x","BAP-12-1998-042-OAB","astro-ph",,"  We present first results of a large photometric survey devoted to study the
star formation history of the Sagittarius dwarf spheroidal galaxy (Sgr dSph).
Three wide strips (9 X 35 arcmin^2) located at l~5 and b=-16, -14, -12 have
been observed. Each strip is roughly EW oriented, nearly along the major axis
of the galaxy. A control field (~9 X 24 arcmin^2), located outside the body of
Sgr dSph has also been observed for statistic decontamination purposes.
Accurate and well calibrated V,I photometry down to V~22 have been obtained for
\~90000 stars toward the Sgr dSph, and ~8000 stars in the control field. This
is the largest photometric sample (covering the widest spatial extension) ever
observed in the Sgr dSph up to now. The main new results presented in this
paper are: (1) the possible discovery of a strong asymmetry in the distribution
of stars along the major axis, since the north-western arm of the Sgr galaxy
(i.e. the region nearer to the Galactic Bulge) apparently shows a significant
deficiency of Sgr stars and (2) the first direct detection of a very metal poor
(and presumably old) population in the Sgr stellar content. Hints for a
metallicity gradient toward the densest region of the galaxy are also reported.
","[{""version"":""v1"",""created"":""Fri, 18 Dec 1998 09:58:27 GMT""}]","2009-10-31"
"astro-ph/9812345","Daniel Schaerer","Daniel Schaerer (STScI)","New light on the origin of nebular HeII emission in young starbursts","To appear in ""Dwarf Galaxies: Probes for Galaxy Formation and
  Evolution'', Ed. J. Andersen, Highlights of Astronomy, Vol. 11, in press. 2
  pages, including 1 figure. (Sept 97)",,,,"astro-ph",,"  We review the observations of nebular HeII 4686 emission in Local Group
objects and extra-galactic HII regions. Different ionization mechanisms
proposed to explain the unusually high excitation are summarized. The models of
Schaerer (1996) and Schaerer & Vacca (1998) predict nebular HeII emission due
to hot WN and WC/WO stars, in good agreement with observations of Wolf-Rayet
(WR) galaxies showing WR signatures and/or nebular HeII. Comparisons of
synthesis models with observations suggest that nebular HeII emission may be
related to WR stars in all cases. The case of I Zw 18 is discussed. It is shown
that the observed WR lines and nebular HeII can be reproduced with an
instantaneous burst model and a Salpeter IMF. This supports the suggestion that
WR stars are responsible for nebular HeII emission.
","[{""version"":""v1"",""created"":""Fri, 18 Dec 1998 11:12:48 GMT""}]","2007-05-23"
"astro-ph/9812346","Eva Isaksson","K. Mattila, K. Lehtinen, D. Lemke","Detection of widely distributed UIR band emission in the disk of NGC 891","13 pages, 9 figures, 2 tables",,,,"astro-ph",,"  The spectrum of the unidentified infrared (UIR) emission bands between 5.9
and 11.7 [micro]m has been observed for the first time in the disk of an
external galaxy. We have used the low-resolution spectrometer of the ISOPHOT
instrument aboard ISO. The UIR bands at 6.2, 7.7 and 11.3 [micro]m have
absolute intensities which are similar to the values observed for the diffuse
emission of our own Galaxy. The UIR bands between 5.9 and 11.7 [micro]m
contribute ~9% of the total IR radiation of NGC 891. The intensity ratios and
band widths in the NGC 891 disk emissions are similar to the diffuse emission
of the Milky Way, pointing to a common carrier for the UIR bands in the two
galaxies. However, there are some notable variations of the band ratios along
the major axis of the galaxy.
","[{""version"":""v1"",""created"":""Fri, 18 Dec 1998 11:13:21 GMT""}]","2007-05-23"
"astro-ph/9812347","Daniel Schaerer","Daniel Schaerer (OMP, Toulouse), Thierry Contini (School of Physics &
  Astronomy, Tel Aviv Univ.; ESO), Maximilien Pindao (Geneva Obs.)","New catalogue of Wolf-Rayet galaxies and high-excitation extra-galactic
  HII regions","Accepted for publication in A&AS. LaTeX, 19 pages including 3 tables.
  Database and paper available at
  http://www.obs-mip.fr/omp/astro/people/schaerer/ (minor corrections to
  references)",,"10.1051/aas:1999197",,"astro-ph",,"  We present a new compilation of Wolf-Rayet (WR) galaxies and extra-galactic
HII regions showing BROAD HeII emission drawn from the literature. Relevant
information on the presence of other broad emission lines (NIII 4640, CIV 5808
and others) from WR stars of WN and WC subtypes, and other existing broad
nebular lines is provided. In total we include 139 known WR galaxies. Among
these, 57 objects show both broad HeII and CIV features. In addition to the
broad (stellar) HeII emission, a NEBULAR HeII component is well established
(suspected) in 44 (54) objects. We find 19 extra-galatic HII regions without WR
detections showing nebular HeII emission. The present sample can be used for a
variety of studies on massive stars, interactions of massive stars with the
ISM, stellar populations, starburst galaxies etc. The data is accessible
electronically and will be updated periodicaly.
","[{""version"":""v1"",""created"":""Fri, 18 Dec 1998 11:19:13 GMT""},{""version"":""v2"",""created"":""Tue, 2 Feb 1999 16:06:45 GMT""}]","2009-10-31"
"astro-ph/9812348","Andrzej Udalski","A. Udalski, I. Soszynski, M. Szymanski, M. Kubiak, G. Pietrzynski, P.
  Wozniak, and K. Zebrun","The Optical Gravitational Lensing Experiment. Eclipsing Binary Stars in
  the Small Magellanic Cloud","13 pages, 13 tables, 6 figures, Latex+psfig. Acta Astronomica 48, in
  press. Only Appendix A is attached. The remaining appendices are available
  electronically from the OGLE archive http://www.astrouw.edu.pl/~ftp/ogle or
  its US mirror http://www.astro.princeton.edu/~ogle/",,,,"astro-ph",,"  We present the catalog of 1459 eclipsing binary stars detected in the central
2.4 square degree area of the Small Magellanic Cloud during the OGLE-II
microlensing search. The sample includes objects brighter than I=20 mag with
periods ranging from about 0.3 to 250 days. The average completeness of the
catalog is about 80%. Statistics of the entire sample and well detached
systems, suitable for distance determination, are also presented.
  The catalog, finding charts and BVI photometry data for all objects are
available from the OGLE Internet archive.
","[{""version"":""v1"",""created"":""Fri, 18 Dec 1998 11:28:22 GMT""}]","2007-05-23"
