"astro-ph/9812349","Lara Sidoli","L. Sidoli, S. Mereghetti, et al","Observations of the Galactic Center Region with Beppo-Sax","4 pages, 2 ps figures, epsfig.sty, to be published in Proc. of the
  Third INTEGRAL Workshop, ""The Extreme Universe"", Taormina 1998",,,,"astro-ph",,"  We are performing a survey of the Galactic Center region with the BeppoSAX
satellite. Several known point sources are visible (including one at the
position of SgrA*), as well as newly discovered sources and diffuse emission.
Here we report the preliminary results of the on-going analysis of both the
point sources and the diffuse X-ray emission.
","[{""version"":""v1"",""created"":""Fri, 18 Dec 1998 11:48:20 GMT""}]","2007-05-23"
"astro-ph/9812350","Krzysztof M. Gorski","K.M. Gorski, E. Hivon, B.D. Wandelt","Analysis Issues for Large CMB Data Sets","6 pages, 2 postscript figures, uses tp.sty, tp9.sty. To appear in
  Proceedings of the MPA/ESO Conferece on Evolution of Large-Scale Structure:
  from Recombination to Garching 2-7 August 1998; eds. A.J. Banday, R.K. Sheth
  and L. Da Costa",,,,"astro-ph",,"  Multi-frequency, high resolution, full sky measurements of the anisotropy in
both temperature and polarisation of the cosmic microwave background radiation
are the goals of the satellite missions MAP (NASA) and Planck (ESA). The
ultimate data products of these missions - multiple microwave sky maps, each of
which will have to comprise more than 10^6 pixels in order to render the
angular resolution of the instruments - will present serious challenges to
those involved in the analysis and scientific exploitation of the results of
both surveys. Some considerations of the relevant aspects of the mathematical
structure of future CMB data sets are presented in this contribution. >>> for
better on-screen rendition of the figures see <<< http://www.tac.dk/~healpix or
http://www.mpa-garching.mpg.de/~cosmo/contributions.html
","[{""version"":""v1"",""created"":""Fri, 18 Dec 1998 11:52:20 GMT""}]","2007-05-23"
"astro-ph/9812351","Mike Goad","M.R. Goad, A.P. Koratkar, D.J. Axon, K.T. Korista, and P.T. O'Brien","On the absence of broad MgII emission-line variability in NGC 3516
  during 1996","12 pages, 3 figures, accepted for publication in ApJ Letters",,"10.1086/311884",,"astro-ph",,"  During the 1996 HST/FOS monitoring campaign of the Seyfert 1 galaxy NGC 3516,
the UV continuum showed a factor of 5 variation; correspondingly the strongest
broad UV emission lines (e.g. Ly-alpha, CIV) displayed somewhat weaker, though
still significant variations (a factor of 2). In contrast, no variation was
detected in the strong broad MgII+UV FeII emission-line complex. While
historically the flux in the broad MgII emission line has varied (a factor of 2
within a few years), the profile shape has not been observed to change over the
past decade. In contrast, the high ionization lines (HILs) show both
emission-line flux and profile changes on relatively short timescales, which
appear to be correlated with changes in the continuum level. Significantly, on
1996, February 21, the profile shapes of the HILs (e.g. Ly-alpha, CIV) and low
ionization lines (LILs, e.g. MgII) were identical, at which time the continuum
level was at its highest. These results impose stringent constraints upon
viable kinematic models of the BLR in NGC 3516, some of which we discuss below.
","[{""version"":""v1"",""created"":""Fri, 18 Dec 1998 12:14:14 GMT""}]","2009-10-31"
"astro-ph/9812352","Jesper Sommer-Larsen","Jesper Sommer-Larsen","Kinematics and Dynamics of the Galactic Stellar Halo","10 pages incl. 3 figures (Kluwer Proceedings format). Invited review
  at ""Les Rencontres De L'Observatoire, Meudon"" 21-25 Sept. 1998 -- Galaxy
  evolution: Connecting the distant Universe with the local fossil record","Astrophys.Space Sci. 265 (1999) 123-131","10.1023/A:1002114216496",,"astro-ph",,"  The structure, kinematics and dynamics of the Galactic stellar halo are
reviewed including evidence of substructure in the spatial distribution and
kinematics of halo stars. Implications for galaxy formation theory are
subsequently discussed; in particular it is argued that the observed kinematics
of stars in the outer Galactic halo can be used as an important constraint on
viable galaxy formation scenarios.
","[{""version"":""v1"",""created"":""Fri, 18 Dec 1998 12:53:35 GMT""}]","2009-10-31"
"astro-ph/9812353","Renato Falomo","R. Falomo, C. Megan Urry, Riccardo Scarpa, Joseph E. Pesce, Aldo
  Treves","HST snapshot imaging of BL Lac objects","6 pages","BL Lac Phenomenon,Turku 1998, PASP conf. series",,,"astro-ph",,"  Snapshot images of about 100 BL Lac objects were obtained with WFPC2 on HST.
Sources from various samples, in the redshift range 0.05 to 1.2, were observed
and 61 resolved (51 with known z).
  The high resolution and homogeneity of the images allow us to address the
properties of the immediate environments of BL Lacs with unprecedented
capability. Host galaxies of BL Lacs are luminous ellipticals (on average 1 mag
brighter than L*) with no or little disturbed morphology.
  The nucleus, that is always well centered onto the galaxy, contributes in the
optical (R band) to about half of the total luminosity of the object (range of
the contribution from 0.1 to 10). The undisturbed morphology suggests that the
nuclear activity has marginal effect on the overall properties of the hosts.
Nonetheless several examples of close companions have been detected.
  The luminosity distribution of host galaxies is compared with that of a large
sample of FR-I radio galaxies.
","[{""version"":""v1"",""created"":""Fri, 18 Dec 1998 13:55:36 GMT""}]","2016-08-30"
"astro-ph/9812354","Kanaris Tsinganos","N. Vlahakis and K. Tsinganos","Systematic construction of exact MHD models for astrophysical winds and
  jets","13 pages, 11 figures","Mon. Not. R. Astron. Soc., 298, 777 - 789, 1998","10.1046/j.1365-8711.1998.01660.x",,"astro-ph",,"  By a systematic method we construct general classes of exact and
selfconsistent axisymmetric MHD solutions describing flows which originate at
the near environment of a central gravitating astrophysical object. The
unifying scheme contains two large groups of exact MHD outflow models, (I)
meridionally self-similar ones with spherical critical surfaces and (II)
radially self-similar models with conical critical surfaces. The classification
includes known polytropic models, such as the classical Park er model of a
stellar wind and the Blandford and Payne (1982) model of a disk-wind; it also
contains nonpolytropic models, such as those of winds/jets in Sauty and
Tsinganos (1994), Lima et al (1996) and Trussoni et al (1997). Besides the
unification of these known cases under a common scheme, several new classes
emerge and some are briefly analysed; they could be explored for a further
understanding of the physical properties of MHD outflows from various
magnetized and rotating astrophysical objects in stellar or galactic systems.
","[{""version"":""v1"",""created"":""Fri, 18 Dec 1998 15:30:24 GMT""}]","2009-10-31"
"astro-ph/9812355","Isabella Gioia","G. A. Luppino (Institute for Astronomy, Honolulu, HI, USA), I. M.
  Gioia (IfA, USA and IRA-CNR Bologna, Italy), F. Hammer (Observatoire de
  Meudon, France), O. Le Fevre (Laboratoire d'Astronomie Spatiale, Marseille,
  France) and J. A. Annis (Fermilab, Batavia, IL, USA)","A search for gravitational lensing in 38 X-ray selected clusters of
  galaxies","Latex file, 17 pages, 7 jpeg figures, to be published in Astronomy
  and Astrophysics Supplements","Astron.Astrophys.Suppl.Ser. 136 (1999) 117-137","10.1051/aas:1999203",,"astro-ph",,"  We present the results of a CCD imaging survey for gravitational lensing in a
sample of 38 X-ray-selected clusters of galaxies. Our sample consists of the
most X-ray luminous (Lx>= 2x10^{44} erg s^{-1}) clusters selected from the
Einstein Observatory Extended Medium Sensitivity Survey (EMSS) that are
observable from Mauna Kea (dec > -40deg). The sample spans a redshift range of
0.15 < z < 0.823 and includes 5 clusters with z > 0.5. CCD images of the
clusters were obtained in excellent seeing. There is evidence of strong
gravitational lensing in the form of giant arcs (length l > 8'', axis ratio l/w
> 10) in 8 of the 38 clusters. Two additional clusters contain shorter arclets,
and 6 more clusters contain candidate arcs that require follow-up observations
to confirm their lensing origin. Since the survey does not have a uniform
surface brightness limit we do not draw any conclusion based on the statistics
of the arcs found. We note, however, that 60% (3 of 5) of the clusters with Lx
> 10^{45} erg s^{-1}, and none of the 15 clusters with Lx < 4x10^{44} erg
s^{-1} contain giant arcs, thereby confirming that high X-ray luminosity does
identify the most massive systems, and thus X-ray selection is the preferred
method for finding true, rich clusters at intermediate and high redshifts. The
observed geometry of the arcs, most of which are thin, have large axis ratios
(l/w > 10), and are aligned orthogonal to the optical major axes of the
clusters, indicate the cluster core mass density profiles must be compact
(steeper than isothermal). In several cases, however, there is also some
evidence, in the form of possible radial arcs, for density profiles with finite
core radii.
","[{""version"":""v1"",""created"":""Fri, 18 Dec 1998 15:35:37 GMT""}]","2009-10-31"
"chao-dyn/9812022","Zoltan Kaufmann","Z. Kaufmann (1), P. Sz\'epfalusy (1,2) ((1) Eotvos University,
  Budapest, Hungary, (2) Research Institute for Solid State Physics and Optics,
  Budapest, Hungary)","Generalized multibaker maps for open dissipative systems","9 pages in REVTeX (twocolumn) including figures; changes: figures
  added, more elaborate discussion; to appear in J. Stat. Phys",,,,"chao-dyn nlin.CD",,"  Generalized multibaker maps are introduced to model dissipative systems which
are spatially extended only in certain directions and escape of particles is
allowed in other ones. Effects of nonlinearity are investigated by varying a
control parameter. Emphasis is put on the appearance of the critical state
representing the borderline of transient chaos, where anomalous behavior sets
in. The investigations extend to the conditionally invariant and the related
natural measures and to transient diffusion in normal and critical states as
well. Permanent chaos is also considered as a special case.
","[{""version"":""v1"",""created"":""Thu, 17 Dec 1998 19:18:56 GMT""},{""version"":""v2"",""created"":""Fri, 6 Aug 1999 20:53:27 GMT""},{""version"":""v3"",""created"":""Thu, 5 Oct 2000 16:38:59 GMT""}]","2007-05-23"
"cond-mat/9812303","Drazen Zanchi","D. Zanchi and H. J. Schulz","Weakly correlated electrons on a square lattice: a renormalization group
  theory","42 pages, 19 figures included (minor corrections)",,,"PAR/LPTHE/98-60","cond-mat.str-el cond-mat.supr-con",,"  We formulate the exact Wilsonian renormalization group for a system of
interacting fermions on a lattice. The flow equations for all vertices of the
Wilson effective action are expressed in form of the Polchinski equation. We
apply this method to the Hubbard model on a square lattice using both zero- and
finite- temperature methods. Truncating the effective action at the sixth term
in fermionic variables we obtain the one-loop functional renormalization
equations for the effective interaction. We find the temperature of the
instability Tc^{RG} as function of doping. We calculate furthermore the
renormalization of the angle-resolved correlation functions for the
superconductivity (SC) and for the antiferromagnetism (AF). The dominant
component of the SC correlations is of the type d while the AF fluctuations are
of the type s Following the strength of both SC and AF fluctuation along the
instability line we obtain the phase diagram. The temperature Tc^{RG} can be
identified with the crossover temperature T{co} found in the underdoped regime
of the high-temperature superconductors, while in the overdoped regime Tc^{RG}
corresponds to the superconducting critical temperature.
","[{""version"":""v1"",""created"":""Thu, 17 Dec 1998 19:04:39 GMT""},{""version"":""v2"",""created"":""Fri, 18 Dec 1998 13:34:33 GMT""}]","2007-05-23"
"cond-mat/9812305","Michail Paraskevopoulos","M. Paraskevopoulos, J. Hemberger, A. Loidl, A. A. Mukhin, V. Yu.
  Ivanov and A. M. Balbashov","Positive magnetoresistance and orbital ordering in La(1-x)Sr(x)MnO(3)","3 pages, 5 figures submitted to PRL December 1998",,,,"cond-mat.str-el",,"  We report on detailed transprort measurements of single crystalline
La(1-x)Sr(x)MnO(3) (x<=0.2). We have found a giantpositive magnetoresistance in
the compositions range between 0.1<=x<=0.125 and give an explaination in terms
of orbital ordering due to the interplay between superexchange interactions and
Jahn-Teller distortions.
","[{""version"":""v1"",""created"":""Thu, 17 Dec 1998 16:00:08 GMT""}]","2007-05-23"
"cond-mat/9812306","K. A. Muttalib","K. A. Muttalib and J. R. Klauder","Generalized Fokker-Planck Equation For Multichannel Disordered Quantum
  Conductors","8 pages, abstract, introduction and summary rewritten for broader
  readership. To be published in Phys. Rev. Lett",,"10.1103/PhysRevLett.82.4272",,"cond-mat.dis-nn cond-mat.mes-hall",,"  The Dorokhov-Mello-Pereyra-Kumar (DMPK) equation, which describes the
distribution of transmission eigenvalues of multichannel disordered conductors,
has been enormously successful in describing a variety of detailed transport
properties of mesoscopic wires. However, it is limited to the regime of quasi
one dimension only. We derive a one parameter generalization of the DMPK
equation, which should broaden the scope of the equation beyond the limit of
quasi one dimension.
","[{""version"":""v1"",""created"":""Thu, 17 Dec 1998 16:24:47 GMT""},{""version"":""v2"",""created"":""Thu, 15 Apr 1999 18:28:53 GMT""}]","2009-10-31"
"cond-mat/9812307","Joseph L. Birman","Nguyen Que Huong and Joseph L. Birman","Quantum Dot Lattice Embedded in An Organic Medium: Hybrid Exciton State
  and Optical Response","16 pages,2 Figs;Changes in Text and Figures",,,,"cond-mat.mes-hall cond-mat.mtrl-sci",,"  We propose a new model to implement organic exciton-semiconductor exciton
hybridization by embedding a semiconductor quantum dot array into an organic
medium. A Wannier-Mott transfer exciton is formed when the exciton in each
semiconductor dot interacts via the multipole-multipole coupling with other
excitons in the different dtos of the array. A new hybrid exciton appears in
the system owing to strong dipole-dipole interaction of the Frenkel exciton of
the organic molecules with the Wannier Mott transfer exciton of the quantum dot
array. This hybrid exciton has both a large oscillator strength (Frenkel like)
and a large Bohr radius (Wannier like). At resonance between these two types of
excitons, the optical non-linearity is very large and can be controlled by
changing parameters of the system such as dot radius and dot spacing.
","[{""version"":""v1"",""created"":""Thu, 17 Dec 1998 17:05:17 GMT""},{""version"":""v2"",""created"":""Mon, 21 Dec 1998 18:19:46 GMT""},{""version"":""v3"",""created"":""Thu, 15 Apr 1999 16:33:48 GMT""},{""version"":""v4"",""created"":""Tue, 14 Dec 1999 15:21:29 GMT""}]","2007-05-23"
"cond-mat/9812308","Stephen Dugdale","E.A. Livesay (1), R.N. West (1), S.B. Dugdale (2,3), G. Santi (3) and
  T. Jarlborg (3) ((1) University of Texas at Arlington, (2) University of
  Bristol, UK, (3) University of Geneva, Switzerland)","Fermi surface of the colossal magnetoresistance perovskite
  La_{0.7}Sr_{0.3}MnO_{3}","5 pages, 5 PS figures",,"10.1088/0953-8984/11/25/104",,"cond-mat.str-el",,"  Materials that exhibit colossal magnetoresistance (CMR) are currently the
focus of an intense research effort, driven by the technological applications
that their sensitivity lends them to. Using the angular correlation of photons
from electron-positron annihilation, we present a first glimpse of the Fermi
surface of a material that exhibits CMR, supported by ``virtual crystal''
electronic structure calculations. The Fermi surface is shown to be
sufficiently cubic in nature that it is likely to support nesting.
","[{""version"":""v1"",""created"":""Thu, 17 Dec 1998 17:14:41 GMT""}]","2009-10-31"
"cond-mat/9812309","Gian Salis","G. Salis, P. Wirth, T. Heinzel, T. Ihn, K. Ensslin, K. Maranwoski, A.
  C. Gossard","Variation of elastic scattering across a quantum well","4 pages, 4 figures","Phys. Rev. B 59, R5304 (1999)","10.1103/PhysRevB.59.R5304",,"cond-mat.mes-hall",,"  The Drude scattering times of electrons in two subbands of a parabolic
quantum well have been studied at constant electron sheet density and different
positions of the electron distribution along the growth direction. The
scattering times obtained by magnetotransport measurements decrease as the
electrons are displaced towards the well edges, although the lowest-subband
density increases. By comparing the measurements with calculations of the
scattering times of a two-subband system, new information on the location of
the relevant scatterers and the anisotropy of intersubband scattering is
obtained. It is found that the scattering time of electrons in the lower
subband depends sensitively on the position of the scatterers, which also
explains the measured dependence of the scattering on the carrier density. The
measurements indicate segregation of scatterers from the substrate side towards
the quantum well during growth.
","[{""version"":""v1"",""created"":""Thu, 17 Dec 1998 17:16:30 GMT""}]","2009-10-31"
"cond-mat/9812310","Vincenzo Fiorentino","F. Mancini (University of Salerno, Italy)","The Mott-Hubbard transition and the paramagnetic insulating state in the
  two-dimensional Hubbard model","7 pages, 5 EPS figures, EuroTeX, to be published in EuroPhysics
  Letters; content changed, references removed","Europhys. Lett. 50, 229 (2000)","10.1209/epl/i2000-00259-y",,"cond-mat.str-el",,"  The Mott-Hubbard transition is studied in the context of the two-dimensional
Hubbard model. Analytical calculations show the existence of a critical value
Uc of the potential strength which separates a paramagnetic metallic phase from
a paramagnetic insulating phase. Calculations of the density of states and
double occupancy show that the ground state in the insulating phase contains
always a small fraction of empty and doubly occupied sites. The structure of
the ground state is studied by considering the probability amplitude of
intersite hopping. The results indicate that the ground state of the Mott
insulator is characterized by a local antiferromagnetic order; the electrons
keep some mobility, but this mobility must be compatible with the local
ordering. The vanishing of some intersite probability amplitudes at U=Uc puts a
constrain on the electron mobility. It is suggested that such quantities might
be taken as the quantities which control the order in the insulating phase.
","[{""version"":""v1"",""created"":""Thu, 17 Dec 1998 18:19:31 GMT""},{""version"":""v2"",""created"":""Thu, 17 Feb 2000 20:14:12 GMT""}]","2007-05-23"
"cond-mat/9812311","Adolfo Emilio Trumper","Adolfo E. Trumper (The Abdus Salam International Centre for
  Theoretical Physics)","Spin wave analysis to the spatially-anisotropic Heisenberg
  antiferromagnet on triangular lattice","Revised version, 4 pages, Latex (twocolumn), 4 figures as eps files.
  To appear in PRB","Phys. Rev. B60, 2987 (1999)","10.1103/PhysRevB.60.2987",,"cond-mat.stat-mech",,"  We study the phase diagram at T=0 of the antiferromagnetic Heisenberg model
on the triangular lattice with spatially-anisotropic interactions. For values
of the anisotropy very close to J_alpha/J_beta=0.50, conventional spin wave
theory predicts that quantum fluctuations melt the classical structures, for
S=1/2. For the regime J_beta<J_alpha, it is shown that the incommensurate
spiral phases survive until J_beta/J_alpha=0.27, leaving a wide region where
the ground state is disordered. The existence of such nonmagnetic states
suggests the possibility of spin liquid behavior for intermediate values of the
anisotropy.
","[{""version"":""v1"",""created"":""Thu, 17 Dec 1998 18:31:44 GMT""},{""version"":""v2"",""created"":""Fri, 7 May 1999 18:18:23 GMT""}]","2009-10-31"
"cond-mat/9812312","Studart","O. G. Balev, P. Vasilopoulos, and Nelson Studart","Edge helicons and repulsion of fundamental edge magnetoplasmons in the
  quantum Hall regime","12 pages, 6 figures",,"10.1088/0953-8984/11/26/315",,"cond-mat.str-el",,"  A quasi-microscopic treatment of edge magnetoplasmons (EMP) is presented for
very low temperatures and confining potentials smooth on the scale of the
magnetic length $\ell_{0}$ but sufficiently steep at the edges such that Landau
level (LL) flattening can be discarded. The profile of the unperturbed electron
density is sharp and the dissipation taken into account comes only from
electron intra-edge and intra-LL transitions due to scattering by acoustic
phonons. For wide channels and filling factors $\nu =1$ and 2, there exist
independent EMP modes spatially symmetric and antisymmetric with respect to the
edge. Some of these modes, named edge helicons, can propagate nearly undamped
even when the dissipation is strong. Their density profile changes
qualitatively during propagation and is given by a rotation of a complex vector
function. For $\nu >2,$ the Coulomb coupling between the LLs leads to a
repulsion of the uncoupled fundamental LL modes: the new modes have very
different group velocities and are nearly undamped. The theory accounts well
for the experimentally observed plateau structure of the delay times as well as
for the EMP's period and decay rates.
","[{""version"":""v1"",""created"":""Thu, 17 Dec 1998 20:51:45 GMT""}]","2009-10-31"
"cond-mat/9812313","J. S. Frasier","J. S. Frasier, V. Celli and T. Blum","Resonant Processes in a Frozen Gas","30 pages, 6 figures","Physical Review A, Volume 59, Number 6, pp. 4358-4367","10.1103/PhysRevA.59.4358",,"cond-mat.dis-nn physics.atom-ph",,"  We present a theory of resonant processes in a frozen gas of atoms
interacting via dipole-dipole potentials that vary as $r^{-3}$, where $r$ is
the interatomic separation. We supply an exact result for a single atom in a
given state interacting resonantly with a random gas of atoms in a different
state. The time development of the transition process is calculated both on-
and off-resonance, and the linewidth with respect to detuning is obtained as a
function of time $t$. We introduce a random spin Hamiltonian to model a dense
system of resonators and show how it reduces to the previous model in the limit
of a sparse system. We derive approximate equations for the average effective
spin, and we use them to model the behavior seen in the experiments of Anderson
et al. and Lowell et al. The approach to equilibrium is found to be
proportional to $\exp (-\sqrt{\gamma_{eq}t}$), where the constant $\gamma
_{eq}$ is explicitly related to the system's parameters.
","[{""version"":""v1"",""created"":""Thu, 17 Dec 1998 22:36:07 GMT""},{""version"":""v2"",""created"":""Sun, 17 Jan 1999 21:31:35 GMT""}]","2009-10-31"
"cond-mat/9812314","Werner Fettes","Ingo Morgenstern, Werner Fettes, Thomas Husslein (University of
  Regensburg), Dennis M. Newns, and Pratap C. Pattnaik (IBM T.J. Watson
  Research Center)","Glass Model, Hubbard Model and High-Temperature Superconductivity","7 pages, 7 figures (included), LaTex using Revtex, accepted by Int.
  J. Mod. Phys. C",,"10.1142/S0129183199000218",,"cond-mat.supr-con cond-mat.str-el",,"  In this paper we revisit the glass model describing the macroscopic behavior
of the High-Temperature superconductors. We link the glass model at the
microscopic level to the striped phase phenomenon, recently discussed widely.
The size of the striped phase domains is consistent with earlier predictions of
the glass model when it was introduced for High-Temperature Superconductivity
in 1987. In an additional step we use the Hubbard model to describe the
microscopic mechanism for d-wave pairing within these finite size stripes. We
discuss the implications for superconducting correlations of Hubbard model,
which are much higher for stripes than for squares, for finite size scaling,
and for the new view of the glass model picture.
","[{""version"":""v1"",""created"":""Fri, 18 Dec 1998 10:05:52 GMT""}]","2015-06-25"
"cond-mat/9812315","Oded Agam","Oded Agam","Nonequilibrium effects in the tunneling conductance spectra of small
  metallic particles","19 pages, 7 figures included, plenum style, to appear in
  Supersymmetry and Trace Formulae: Chaos and Disorder (I.V. Lerner, J.P.
  Keating, and D.E. Khmelnitskii, eds.) Plenum Press (1999), pages 133-151",,,,"cond-mat chao-dyn nlin.CD",,"  The tunneling spectra of small metallic grains shows an unusual structure of
the differential conductance peaks. Namely, resonance peaks appear in clusters,
or develop substructure as the the gate voltage is changed. These features are
manifestations of a nonequilibrium behavior which appears when the applied
source-drain voltage is sufficiently large. Electron-electron Coulomb
interaction as well as an attractive pairing interaction play an important role
in determining the magnitude and energy scales of the phenomena. For normal
grains each cluster of resonances is identified with one excited
single-electron state of the metal particle, shifted as a result of the
different nonequilibrium occupancy configurations of the other single-electron
states. For superconducting grains in the odd charging state, the substructure
of the resonance is explained by nonequilibrium ``gapless'' excitations
associated with different energy levels occupied by the unpaired electron. The
excitations are generated by inelastic cotunneling.
","[{""version"":""v1"",""created"":""Fri, 18 Dec 1998 11:14:38 GMT""}]","2007-05-23"
