"hep-ph/9812481","R. Rueckl","T. Matsushita (U. of Oxford), E. Perez (CEA-Saclay), R. R\""uckl (U. of
  W\""urzburg)","High $Q^2$ Physics at HERA and Searches for New Particles","14 pages, 12 figures, uses iopart style files, contribution to the
  3rd UK Phenomenology Workshop on HERA Physics, Durham, Sep 1998","J.Phys.G25:1418-1427,1999","10.1088/0954-3899/25/7/319","WUE-ITP-98-056, DAPNIA/SPP 98-23","hep-ph",,"  Preliminary results from H1 and ZEUS on Deep Inelastic Scattering (DIS) at
high momentum transfer squared $Q^2$ are presented. Used are all available $e^+
p$ data accumulated by the H1 and ZEUS experiments between 1994 and 1997,
corresponding to integrated luminosities of $37 {pb}^{-1}$ and $47 {pb}^{-1}$,
respectively. The anomalies observed at high $Q^2$ in the 1994 to 1996 data
still remain, though with less significance. Since this high $Q^2$ domain
represents a new frontier in DIS, the same data are used to search for new
particles possessing direct couplings to lepton-quark pairs. Assuming that the
slight excess of events observed in Neutral Current DIS is due to a statistical
fluctuation, preliminary limits on the production of leptoquarks and of squarks
in R-parity violating MSSM are presented.
","[{""version"":""v1"",""created"":""Tue, 22 Dec 1998 20:19:13 GMT""}]","2008-11-26"
"hep-ph/9812482","Edward Shuryak","E.V.Shuryak (Department of Physics and Astronomy, State University of
  New York, Stony Brook NY)","The problem of Chiral Restoration and Dilepton Production in Heavy Ion
  Collisions","Lecture at the Ettore Majorana school ``From the Plank Length to
  Hubble Radius"", Erice, Sept. 98",,,,"hep-ph",,"  In the lecture we review several issues related to recent development in
non-perturbative QCD. The ``instanton liquid model'' reproduces not only the
basic vacuum parameters (the condensates), but even hadronic correlators. New
information obtained from lattice simulations also confirm it. Meanwhile the
model itself was developed into a self-consistent approach, allowing to include
't Hooft interaction to all orders. It was also generalized to non-zero
temperatures and high densities. We discuss one issue, displayed by behavior of
the pion and rho correlation functions: the former has strong non-perturbative
effects at small distances, the latter has none. What happens at $T\sim T_c$
can be answered by dilepton production experiments with heavy ion collisions.
The results definitely indicate large changes in spectral density and ""melting""
of the rho meson peak, possibly reaching the rate corresponding to complete
chiral restoration.
","[{""version"":""v1"",""created"":""Tue, 22 Dec 1998 19:18:11 GMT""}]","2007-05-23"
"hep-ph/9812483","Georgi Dvali","Gia Dvali and S.-H. Henry Tye","Brane Inflation","15 pages, Latex","Phys.Lett. B450 (1999) 72-82","10.1016/S0370-2693(99)00132-X","NYU-TH/12/98/01, CLNS 98/1600","hep-ph",,"  We present a novel inflationary scenario in theories with low scale (TeV)
quantum gravity, in which the standard model particles are localized on the
branes whereas gravity propagates in the bulk of large extra dimensions. This
inflationary scenario is natural in the brane world picture. In the lowest
energy state, a number of branes sit on top of each other (or at an orientifold
plane), so the vacuum energy cancels out. In the cosmological setting, some of
the branes ""start out"" relatively displaced in the extra dimensions and the
resulting vacuum energy triggers the exponential growth of the 3 non-compact
dimensions. The number of e-foldings can be very large due to the very weak
brane-brane interaction at large distances. In the effective four-dimensional
field theory, the brane motion is described by a slowly rolling scalar field
with an extremely flat plateau potential. When branes approach each other to a
critical distance, the potential becomes steep and inflation ends rapidly. Then
the branes ""collide"" and oscillate about the equilibrium point, releasing
energy mostly into radiation on the branes.
","[{""version"":""v1"",""created"":""Tue, 22 Dec 1998 21:04:15 GMT""}]","2009-10-31"
"hep-ph/9812484","Renard Fernand Michel","M. Beccaria, P. Ciafaloni, D. Comelli, F.M. Renard and C. Verzegnassi","Susy Virtual effects at LEP2 Boundary","8 pages and 8 figures; corrected numerical results","Eur.Phys.J.C10:331-336,1999","10.1007/s100529900115","PM/98-42","hep-ph",,"  We examine the possibility that SUSY particles are light, i.e. have a mass
just beyond the final kinematical reach of LEP2. In this case, even if light
particles are not directly detected, their virtual effects are enhanced by a
``close to threshold'' resonance in the s-channel. We find that this resonant
effect is absent in the case of light sfermions, while it is enhanced in the
case of light gauginos, since neutralinos and charginos add coherently in some
regions of the allowed parameter space. We discuss this ``virtual-alliance'' in
detail and try to examine the possibilities of its experimental verification.
","[{""version"":""v1"",""created"":""Wed, 23 Dec 1998 10:35:06 GMT""},{""version"":""v2"",""created"":""Tue, 23 Feb 1999 11:14:26 GMT""},{""version"":""v3"",""created"":""Thu, 18 Mar 1999 07:36:22 GMT""}]","2011-09-13"
"hep-ph/9812485",,"A. V. Gulov and V. V. Skalozub","Renormalization group relations and searching for abelian Z' Boson in
  the four-fermionic processes","18 pages, 4 figures. The title is changed to be more precise. The
  text of the paper is rewritten",,,,"hep-ph",,"  The method of searching for signals of heavy virtual particles is developed.
It is based on a renormalization group equation for the low energy effective
Lagrangian and the decoupling theorem. As an application, the model independent
search for Abelian Z' boson in four-fermion processes is analyzed. The basic
one-loop renormalization group relation for the parameters of the effective
Lagrangian is derived which gives possibility to reduce the problem to the
scattering of the Standard Model particles in the ``external field''
substituting heavy virtual Z' state. From the set of derived relations it is
determined that the absolute value of the Z' coupling to the axial currents has
to be the same for all fermions and is strongly correlated to the Z' coupling
to the scalar fields. The corresponding dependences between the parameters of
the effective Lagrangians are derived.
","[{""version"":""v1"",""created"":""Wed, 23 Dec 1998 12:05:51 GMT""},{""version"":""v2"",""created"":""Mon, 29 Mar 1999 09:43:08 GMT""},{""version"":""v3"",""created"":""Tue, 18 Jan 2000 08:43:48 GMT""}]","2007-05-23"
"hep-ph/9812486","K. Sridhar","Prakash Mathews, Sreerup Raychaudhuri and K. Sridhar (TIFR)","Large extra dimensions and deep-inelastic scattering at HERA","7 pages, latex, 1 ps figure, revised version to appear in Phys. Lett.
  B","Phys.Lett. B455 (1999) 115-119","10.1016/S0370-2693(99)00355-X","TIFR/TH/98-51","hep-ph hep-th",,"  In scenarios motivated by string theories, it is possible to have extra
Kaluza-Klein dimensions compactified to rather large magnitudes, leading to
large effects of gravity at scales down to a TeV. The effect of the spin-2
Kaluza-Klein modes on the deep-inelastic cross-section at HERA is investigated.
We find that the data can be used to obtain bounds on the effective low energy
scale, $M_S$.
","[{""version"":""v1"",""created"":""Wed, 23 Dec 1998 13:46:31 GMT""},{""version"":""v2"",""created"":""Thu, 24 Dec 1998 02:04:49 GMT""},{""version"":""v3"",""created"":""Wed, 10 Mar 1999 11:01:00 GMT""}]","2009-10-31"
"hep-ph/9812487","Yuri Dokshitzer","Yu.L. Dokshitzer, G. Marchesini, G.P. Salam","Revisiting non-perturbative effects in the jet broadenings","44 pages, 8 .eps figures; uses amsmath. This updated version includes
  the revised value for the Milan factor, which follows from the correction of
  a mistake in hep-ph/9707532","Eur.Phys.J.direct C1:3,1999",,"Bicocca-FT-98-01","hep-ph",,"  We show that taking into account the interplay between perturbative and
non-perturbative effects, the power-suppressed shift to the broadening
distributions becomes B dependent, and the non-perturbative contribution to the
mean values becomes proportional to 1/(Q\sqrt{\as(Q)}). The new theoretical
treatment greatly improves the consistency of the phenomenology with the notion
of the universality of confinement effects in jet shapes.
","[{""version"":""v1"",""created"":""Wed, 23 Dec 1998 15:30:31 GMT""},{""version"":""v2"",""created"":""Fri, 10 Sep 1999 18:05:17 GMT""},{""version"":""v3"",""created"":""Tue, 17 Oct 2000 17:57:56 GMT""}]","2014-11-17"
"hep-th/9812206","Danny Birmingham Staff","Danny Birmingham, Conall Kennedy, Siddhartha Sen, and Andy Wilkins","Geometrical Finiteness, Holography, and the BTZ Black Hole","6 pages, Latex, Version to appear in Physical Review Letters","Phys.Rev.Lett. 82 (1999) 4164-4167","10.1103/PhysRevLett.82.4164",,"hep-th",,"  We show how a theorem of Sullivan provides a precise mathematical statement
of a 3d holographic principle, that is, the hyperbolic structure of a certain
class of 3d manifolds is completely determined in terms of the corresponding
Teichmuller space of the boundary. We explore the consequences of this theorem
in the context of the Euclidean BTZ black hole in three dimensions.
","[{""version"":""v1"",""created"":""Tue, 22 Dec 1998 17:05:29 GMT""},{""version"":""v2"",""created"":""Fri, 23 Apr 1999 15:55:43 GMT""}]","2009-10-31"
"hep-th/9812207","Jeanne De Jaegher","J.De Jaegher, J. Raeymaekers, A. Sevrin and W. Troost","Dilaton transformation under abelian and non-abelian T-duality in the
  path integral approach","latex, 20 pages, no figures","Nucl.Phys. B548 (1999) 563-584","10.1016/S0550-3213(99)00157-1","KUL-TF-98/47, VUB/TENA/98/11","hep-th",,"  We present a convenient method for deriving the transformation of the dilaton
under T-duality in the path-integral approach. Subtleties arising in performing
the integral over the gauge fields are carefully analysed using Pauli-Villars
regularization, thereby clarifying existing ambiguities in the literature. The
formalism can not only be applied to the abelian case, but, and this for the
first time, to the non-abelian case as well. Furthermore, by choosing a
particular gauge, we directly obtain the target-space covariant expression for
the dual geometry in the abelian case. Finally it is shown that the conditions
for gauging non-abelian isometries are weaker than those generally found in the
literature.
","[{""version"":""v1"",""created"":""Tue, 22 Dec 1998 17:06:35 GMT""}]","2009-10-31"
"hep-th/9812208","Timur D. Bakeyev","T. D. Bakeyev","A simplified version of Higher Covariant Derivative regularization","8 pages, LATEX","Theor.Math.Phys. 122 (2000) 355-362; Teor.Mat.Fiz. 122 (2000)
  426-434",,"MSU-12-98","hep-th",,"  A simplified version of Higher Covariant Derivative regularization for
Yang-Mills theory is constructed. This may make Higher Covariant Derivative
method more attractive for practical calculations.
","[{""version"":""v1"",""created"":""Tue, 22 Dec 1998 17:08:09 GMT""}]","2007-05-23"
"hep-th/9812209","Tamas Hauer","Oliver DeWolfe, Tamas Hauer, Amer Iqbal and Barton Zwiebach","Uncovering Infinite Symmetries on [p,q] 7-branes: Kac-Moody Algebras and
  Beyond","44 pages, LaTeX, 9 eps figures, minor typos corrected","Adv.Theor.Math.Phys. 3 (1999) 1835-1891",,"MIT-CTP-2808","hep-th",,"  In a previous paper we explored how conjugacy classes of the modular group
classify the symmetry algebras that arise on type IIB [p,q] 7-branes. The
Kodaira list of finite Lie algebras completely fills the elliptic classes as
well as some parabolic classes. Loop algebras of E_N fill additional parabolic
classes, and exotic finite algebras, hyperbolic extensions of E_N and more
general indefinite Lie algebras fill the hyperbolic classes. Since they
correspond to brane configurations that cannot be made into strict
singularities, these non-Kodaira algebras are spectrum generating and organize
towers of massive BPS states into representations. The smallest brane
configuration with unit monodromy gives rise to the loop algebra \hat{E}_9
which plays a central role in the theory. We elucidate the patterns of
enhancement relating E_8, E_9, \hat{E}_9 and E_10. We examine configurations of
24 7-branes relevant to type IIB compactifications on a two-sphere, or F-theory
on K3. A particularly symmetric configuration separates the 7-branes into two
groups of twelve branes and the massive BPS spectrum is organized by E_10 +
E_10.
","[{""version"":""v1"",""created"":""Tue, 22 Dec 1998 18:00:14 GMT""},{""version"":""v2"",""created"":""Fri, 6 Aug 1999 23:54:00 GMT""}]","2007-05-23"
"hep-th/9812210","Chris Hull","C.M. Hull","The Non-Perturbative SO(32) Heterotic String","12 Pages, Tex, Phyzzx Macro","Phys.Lett. B462 (1999) 271-276","10.1016/S0370-2693(99)00802-3","QMW-PH-98-43","hep-th",,"  The SO(32) heterotic string can be obtained from the type IIB string by
gauging a discrete symmetry that acts as $(-1)^{F_L}$ on the perturbative
string states and reverses the parity of the D-string. Consistency requires the
presence of 32 NS 9-branes -- the S-duals of D9-branes -- which give SO(32)
Chan-Paton factors to open D-strings. At finite string coupling, there are
SO(32) charges tethered to the heterotic string world-sheet by open D-strings.
At zero-coupling, the D-string tension becomes infinite and the SO(32) charges
are pulled onto the world-sheet, and give the usual SO(32) world-sheet currents
of the heterotic string.
","[{""version"":""v1"",""created"":""Tue, 22 Dec 1998 18:23:58 GMT""}]","2009-10-31"
"hep-th/9812211","Patrick E. Dorey","Patrick Dorey and Roberto Tateo","Anharmonic oscillators, the thermodynamic Bethe ansatz, and nonlinear
  integral equations","11 pages, Latex 2e, uses amssymb, cite","J.Phys.A32:L419-L425,1999","10.1088/0305-4470/32/38/102","DTP-98/81, ITFA 98-41","hep-th",,"  The spectral determinant $D(E)$ of the quartic oscillator is known to satisfy
a functional equation. This is mapped onto the $A_3$-related $Y$-system
emerging in the treatment of a certain perturbed conformal field theory,
allowing us to give an alternative integral expression for $D(E)$. Generalising
this result, we conjecture a relationship between the $x^{2M}$ anharmonic
oscillators and the $A_{2M-1}$ TBA systems. Finally, spectral determinants for
general $|x|^{\alpha}$ potentials are mapped onto the solutions of nonlinear
integral equations associated with the (twisted) XXZ and sine-Gordon models.
","[{""version"":""v1"",""created"":""Tue, 22 Dec 1998 20:25:51 GMT""}]","2009-10-31"
"hep-th/9812212","Gordon Chalmers","G. Chalmers, M. Rocek, S. Wiles","Degeneration of ALF D_n Metrics","14 pages, 7 figures, LaTeX, minor corrections, to appear in JHEP","JHEP 9901:009,1999","10.1088/1126-6708/1999/01/009","ANL-HEP-PR-98-140, ITP-SB-98-72","hep-th",,"  Beginning with the Legendre transform construction of hyperk\""ahler metrics,
we analyze the ALF version of the D_n metrics. We determine the constraint
equation obtained from extremizing the $w$ coordinate of the generating
function F(z,\bar{z},u,\bar{u},w) and study its behavior as we send two of the
mass parameters of the $D_n$ metric to zero. We find that the constraint
equation enforces the limit that the metric becomes that of multi-Taub-NUT.
","[{""version"":""v1"",""created"":""Tue, 22 Dec 1998 22:18:41 GMT""},{""version"":""v2"",""created"":""Wed, 23 Dec 1998 04:42:39 GMT""},{""version"":""v3"",""created"":""Tue, 19 Jan 1999 19:10:23 GMT""}]","2014-11-18"
"hep-th/9812214","Myrzakulov Ratbay","R.Myrzakulov","On Some Sigma Models with Potentials and the Klein-Gordon Type Equations","9 pages, Latex, no figures",,,"CNLP-1995-06","hep-th",,"  The gauge equivalent counterparts of the some (1+1)-, or (2+0)-dimensional
sigma models with potentials are found. The gauge equivalence between the some
soliton equations of spin-phonon systems and the Yajima-Oikawa and Ma equations
are also established.
","[{""version"":""v1"",""created"":""Wed, 23 Dec 1998 07:56:45 GMT""}]","2007-05-23"
"hep-th/9812215","Hendry Izaac Elim","Freddy P. Zen and Hendry I. Elim","Soliton Solution of the Integrable Coupled Nonlinear Schrodinger
  Equation of Manakov Type","11 pages",,,,"hep-th math.DS nlin.PS nlin.SI patt-sol solv-int",,"  The soliton solution of the integrable coupled nonlinear Schrodinger equation
(NLS) of Manakov type is investigated by using Zakharov-Shabat (ZS) scheme. We
get the bright N-solitons solution by solving the integrable uncoupled NLS of
Manakov type. We also find that there is an elastic collision of the bright
N-solitons.
","[{""version"":""v1"",""created"":""Wed, 23 Dec 1998 09:00:19 GMT""},{""version"":""v2"",""created"":""Thu, 24 Dec 1998 01:08:00 GMT""}]","2007-05-23"
"hep-th/9812216","Ming Yu","Ming Yu and Bo Zhang","Light-Cone Gauge Quantization of String Theories on $AdS_3$ Space","Latex, 23 pages, 0 figures","Nucl.Phys. B551 (1999) 425-449",,"AS-ITP-98-16","hep-th",,"  Light-cone gauge quantization procedures are given, for superstring theory on
$AdS_3$ space charged with NS-NS background, both in NSR and GS formalism. The
spacetime (super)conformal algebras are constructed in terms of the transversal
physical degrees of freedom. The spacetime conformal anomaly agrees with that
of covariant formalism, provided that the worldsheet conformal anomaly $c$
equals 26 or 15 for bosonic string or superstring, respectively. The spacetime
(super)conformal field theory is found to correspond to orbifold construction
on symmetric product space $\it{Sym_p} {\cal{M}}/Z_p$.
","[{""version"":""v1"",""created"":""Wed, 23 Dec 1998 10:06:44 GMT""}]","2007-05-23"
"hep-th/9812217","Jerzy Przeszowski","Jerzy A. Przeszowski (IFTR PAC, Warsaw)","Canonical Quantization for the Light-Front Weyl Gauge","18 pages, no figures",,,,"hep-th",,"  The canonical quantization on a single light front is performed for the
Abelian gauge fields with the Weyl gauge coupled with fermion field currents.
The analysis is carried separately for 1+1 dimensions and for higher
dimensions. The Gauss law, implemented weakly as the condition on states,
selects physical subspace with the Poincare covariance recovered. The
perturbative gauge field propagators are found with the ML prescription for
their spurious poles. The LF Feynman rules are found and their equivalence with
the usual equal-time perturbation for the S-matrix elements is studied for all
orders.
","[{""version"":""v1"",""created"":""Wed, 23 Dec 1998 10:19:20 GMT""}]","2007-05-23"
"hep-th/9812218","Shinji Hirano","Hidetoshi Awata, Shinji Hirano","AdS_7/CFT_6 Correspondence and Matrix Models of M5-Branes","30 pages, 2 figures, LaTeX, some typos are corrected in particular in
  section 4","Adv.Theor.Math.Phys.3:147-176,1999",,"YITP-98-85","hep-th",,"  We study the large N limit of matrix models of M5-branes, or (2,0)
six-dimensional superconformal field theories, by making use of the
Bulk/Boundary correspondence. Our emphasis is on the relation between the
near-horizon limit of branes and the light-like limit of M-theory. In
particular we discuss a conformal symmetry in the D0 + D4 system, and interpret
it as a conformal symmetry in the discrete light-cone formulation of M5-branes.
We also compute two-point functions of scalars by applying the conjecture for
the AdS/CFT correspondence to the near-horizon geometry of boosted M5-branes.
We find an expected result up to a point subtle, but irrelevant to the IR
behavior of the theory. Our analysis matches with the Seiberg and Sen's
argument of a justification for the matrix model of M-theory.
","[{""version"":""v1"",""created"":""Wed, 23 Dec 1998 10:21:05 GMT""},{""version"":""v2"",""created"":""Tue, 19 Jan 1999 14:06:34 GMT""}]","2008-11-26"
"hep-th/9812219","Chong-Sun Chu","Chong-Sun Chu and Pei-Ming Ho","Noncommutative Open String and D-brane","LaTex, 19 pages. v2: two references added; more results added in sec.
  4 which extends the agreement with Matrix model for the D2 case (original
  version) to the general Dp case (v2) for any value of p. v3: further
  clarifying remarks added in sec. 3 in response to the referee suggestion for
  clearer presentation; final version to appear in NPB","Nucl.Phys. B550 (1999) 151-168","10.1016/S0550-3213(99)00199-6","NEIP-98-022","hep-th",,"  In this paper we consider the quantization of open strings ending on D-branes
with a background B field. We find that spacetime coordinates of the open
string end-points become noncommutative, and correspondingly the D-brane
worldvolume also becomes noncommutative. This provides a string theory
derivation and generalization of the noncommutativity obtained previously in
the Matrix model compactification. For Dp-branes with p>=2 our results are new
and agree with that of Matrix theory for the case of A=0 (where $A$ is the
worldvolume gauge field) if the T-duality radii are used.
","[{""version"":""v1"",""created"":""Wed, 23 Dec 1998 10:41:27 GMT""},{""version"":""v2"",""created"":""Tue, 12 Jan 1999 20:34:47 GMT""},{""version"":""v3"",""created"":""Tue, 30 Mar 1999 22:48:14 GMT""}]","2009-10-31"
"hep-th/9812220","Piet Claus","Piet Claus","Near-Horizon Supergravity Superspace","6 pages, contribution to the proceedings of the ""mid-term TMR meeting
  on Quantum Aspects Theories, Supersymmetry and Unification"", Corfu, September
  20-26, 1998",,"10.1007/BFb0104257","KUL-TF-98/60","hep-th",,"  We present a construction of the superspace of maximally supersymmetric
adS_{p+2} x S^{d-p-2} near-horizon geometry based entirely on the supergravity
constraints of which the bosonic space is a solution. Besides the geometric
superfields, i.e. the vielbeine and the spinconnection, we also derive the
isometries of the superspace together with the compensating tangent space
transformations to all orders in anticommuting superspace coordinates.
","[{""version"":""v1"",""created"":""Wed, 23 Dec 1998 11:06:05 GMT""}]","2009-10-31"
"hep-th/9812221","Zhukovsky Vladimir","V.Ch.Zhukovsky, N.A.Peskov","One-loop Energy Corrections in the Nonabelian Gauge Field Theory in 2+1
  Dimensions","7 pages, LATEX (corrected) Published in Vest. Mosk. Univ., Fiz.
  Astron., N2, 60, 1999 (corrections to be published)","Moscow Univ.Phys.Bull. 54N2 (1999) 79-82;
  Vestn.Mosk.Univ.Fiz.Astron. 54N2 (1999) 60-61",,,"hep-th",,"  Exact constant solutions of field equations in the classical nonabelian SU(2)
field theory with the Chern-Simons topological mass in 2+1-dimensional
space-time have been obtained. One-loop contributions of boson and fermion
fluctuations to the gauge field energy have been calculated.
","[{""version"":""v1"",""created"":""Wed, 23 Dec 1998 12:25:11 GMT""},{""version"":""v2"",""created"":""Wed, 19 Jan 2000 13:56:42 GMT""}]","2007-05-23"
"hep-th/9812222","Ademir eugenio de Santana","F.C. Khanna, A.E. Santana, A. Matos Neto, J.D.M. Vianna and T. Kopf","Spinorial density matrix equation and gauge covariance","LaTex, 17 pages",,,,"hep-th",,"  In this work we apply the Lie group representation method introduced in the
real time formalism for finite-temperature quantum-field theory, thermofield
dynamics, to derive a spinorial density matrix equation. Symmetry properties of
such equation are analysed, and as a basic result it is shown that one solution
is the generalised density matrix operator proposed by Heinz, to deal with
gauge covariant kinetic equations. In the same context, preliminary aspects of
a Lagrangian formalism to derive kinetic equations, as well as quantum density
matrix equations in curved space-time, are discussed.
","[{""version"":""v1"",""created"":""Wed, 23 Dec 1998 13:14:22 GMT""}]","2007-05-23"
"math-ph/9812021","Christof Kuelske","Christof Kuelske","Stability for a continuous SOS-interface model in a randomly perturbed
  periodic potential",,,,"98-466","math-ph math.MP math.PR",,"  We consider the Gibbs-measures of continuous-valued height configurations on
the $d$-dimensional integer lattice in the presence a weakly disordered
potential. The potential is composed of Gaussians having random location and
random depth; it becomes periodic under shift of the interface perpendicular to
the base-plane for zero disorder. We prove that there exist localized
interfaces with probability one in dimensions $d\geq 3+1$, in a
`low-temperature' regime. The proof extends the method of
continuous-to-discrete single- site coarse graining that was previously applied
by the author for a double-well potential to the case of a non-compact image
space. This allows to utilize parts of the renormalization group analysis
developed for the treatment of a contour representation of a related
integer-valued SOS-model in [BoK1]. We show that, for a.e. fixed realization of
the disorder, the infinite volume Gibbs measures then have a representation as
superpositions of massive Gaussian fields with centerings that are distributed
according to the infinite volume Gibbs measures of the disordered
integer-valued SOS-model with exponentially decaying interactions.
","[{""version"":""v1"",""created"":""Tue, 22 Dec 1998 18:16:58 GMT""}]","2007-05-23"
