"astro-ph/9812428","Jane Greaves","J.S. Greaves (1), W.S. Holland (1), P. Friberg (1), W.R.F. Dent (2)
  ((1) Joint Astronomy Centre, (2) Royal Observatory, Edinburgh)","Polarized CO emission from molecular clouds","15 pages, 1 figure, to be published in ApJ Letters",,"10.1086/311888",,"astro-ph",,"  Linearly polarized, non-masing, rotational lines have been detected for the
first time in the interstellar medium. This effect occurs in molecular clouds
with a magnetic field, and traces the field direction, offering an alternative
technique to dust emission polarimetry. The line polarization mechanism is
similar to that in masers, but with lower degrees of polarization (~1%). We
have detected the effect towards the Galactic Centre and its surrounding `2 pc
ring', and in the molecular clouds S140 and DR21 (tentatively), in the lines CO
J=2-1 and J=3-2, and 13CO J=2-1. The deduced magnetic field directions agree
well with previous dust polarimetry results, confirming that the line
polarization is a real effect. This new technique will be useful in sources
that are too faint for dust polarimetry, and can also be used to investigate
3-dimensional morphology of magnetic fields, where the velocity structure of
the clouds is known.
","[{""version"":""v1"",""created"":""Wed, 23 Dec 1998 02:53:09 GMT""}]","2009-10-31"
"astro-ph/9812429","Gerard Williger","S. R. Heap, G. M. Williger, A. Smette, I. Hubeny, M. Sahu (1), E. B.
  Jenkins, T. M. Tripp (2), J. N. Winkler (3) ((1) NASA/GSFC, Greenbelt MD,
  USA; (2) Princeton Univ. Observatory, Princeton NJ, USA; (3) Queen's College,
  Oxford, England)","STIS Observations of He II Gunn-Peterson Absorption Toward Q0302-003","56 pages, 17 figures, uses aaspp4.sty, revised text and figures,
  accepted by Astrophysical Journal",,,,"astro-ph",,"  The ultraviolet spectrum (1145--1720A) of the distant quasar Q 0302--003
(z=3.286) was observed at 1.8A resolution with the Space Telescope Imaging
Spectrograph aboard the Hubble Space Telescope. A total integration time of
23,280 s was obtained. The spectrum clearly delineates the Gunn-Peterson HeII
absorption trough, produced by HeII Lya, along the line of sight over the
redshift range z=2.78-3.28. Its interpretation was facilitated by modeling
based on Keck HIRES spectra of the HI Lya forest (provided by A. Songaila and
by M. Rauch and W. Sargent). We find that near the quasar HeII Lya absorption
is produced by discrete clouds, with no significant diffuse gas; this is
attributed to a HeII ""proximity effect"" in which the quasar fully ionizes He in
the diffuse intergalactic medium, but not the He in denser clouds. By two
different methods we calculate that the average HeII Lya opacity at z~3.15 is
tau >= 4.8. In the Dobrzycki-Bechtold void in the HI Lya forest near z=3.18,
the average HeII opacity tau=4.47^{+0.48}_{-0.33}. Such large opacities require
the presence of a diffuse gas component as well as a soft UV background
spectrum, whose softness parameter, defined as the ratio of the
photo-ionization rate in HI over the one in HeII,
S=Gamma^J_HI/Gamma^J_HeII~=800, indicating a significant stellar contribution.
At z=3.05, there is a distinct region of high HeII Lya transmission which most
likely arises in a region where helium is doubly ionized by a discrete local
source, quite possibly an AGN. At redshifts z<2.87, the HeII Lya opacity
detected by STIS, tau=1.88, is significantly lower than at z>3. Such a
reduction in opacity is consistent with Songaila's (1998) report that the
hardness of the UV background spectrum increases rapidly from z=3 to z=2.9.
","[{""version"":""v1"",""created"":""Wed, 23 Dec 1998 05:35:21 GMT""},{""version"":""v2"",""created"":""Thu, 11 Nov 1999 23:33:28 GMT""}]","2007-05-23"
"astro-ph/9812430","Nikolay A. Zabotin","N.A.Zabotin and E.S.Kovalenko","Simple numerical model of radio wave multiple scattering effects in the
  ionospheric plasma layer","html format",,"10.1088/0959-7174/9/3/307",,"astro-ph",,"  Computer simulations of radio energy transfer in the ionospheric layer with
random small-scale irregularities for the case of a point ground-based source
and total reflection have been carried out using specially designed algorithm
based on Monte Carlo method ideas. The model demonstrates redistribution of the
reflected radiation power on the Earth's surface caused by multiple scattering
process. The obtained data can serve as illustration of the effect of anomalous
attenuation of the signal power in the sounder vicinity. This result is in
agreement with more rigorous theory of the anomalous attenuation effect based
on the solving of the radiative transfer equation.
","[{""version"":""v1"",""created"":""Wed, 23 Dec 1998 06:33:28 GMT""}]","2009-10-31"
"astro-ph/9812431","Atsushi Kawai","Atsushi Kawai and Junichiro Makino","A Simple Formulation of the Fast Multipole Method: Pseudo-Particle
  Multipole Method","13 pages, 6 figures, uses aaspp4.sty, to appear in the proceedings of
  the ninth SIAM conference on parallel processing for scientific computing,
  Texas, March 1999",,,,"astro-ph",,"  We present the pseudo-particle multipole method (P2M2), a new method to
handle multipole expansion in fast multipole method and treecode. This method
uses a small number of pseudo-particles to express multipole expansion. With
this method, the implementation of FMM and treecode with high-order multipole
terms is greatly simplified. We applied P2M2 to treecode and combined it with
special-purpose computer GRAPE. Extensive tests on the accuracy and calculation
cost demonstrate that the new method is quite attractive.
","[{""version"":""v1"",""created"":""Wed, 23 Dec 1998 07:27:44 GMT""}]","2007-05-23"
"astro-ph/9812432","G. C. Anupama","G. C. Anupama (Indian Institute of Astrophysics) and J. Mikolajewska
  (Nicolaus Copernicus Astronomical Center)","Recurrent Novae at Quiescence: Systems with Giant Secondaries","11 pages, 7 postscript figures. Uses laa.sty, eps.sty. To appear in
  A&A (main journal)",,,,"astro-ph",,"  Spectroscopic and photometric behaviour of the class of recurrent novae with
giant secondaries (T Coronae Borealis, RS Ophiuchi, V3890 Sagittarii and V745
Scorpii) at quiescence are presented in this study. The hot component in these
systems is variable, with the variability manifesting as variability in the
ultraviolet luminosity, the ultraviolet and optical emission line fluxes and in
the UBV/visual magnitudes. The variations are uncorrelated with the binary
orbital motion. The observed ultraviolet+optical spectral characteristics of
the hot component in these systems can be explained by a white dwarf+accretion
disc embedded in an envelope of wind from the M giant secondary. We suggest the
observed variations are a result of (a) fluctuations in the mass accretion
rate; (b) changes in the column density of the absorbing, optically thick, wind
envelope.
","[{""version"":""v1"",""created"":""Wed, 23 Dec 1998 08:24:25 GMT""}]","2007-05-23"
"astro-ph/9812433","Michal Ostrowski","M. Ostrowski (Astronomical Observatory, Jagiellonian University)","Supernova remnants in molecular clouds: on cosmic ray electron spectra","LaTeX (4 pages, 2 postscript figures); A&A, accepted",,,,"astro-ph",,"  The particle acceleration process at a shock wave, in the presence of the
second-order Fermi acceleration in the turbulent medium near the shock, is
discussed as an alternative explanation for the observed flat synchrotron
spectra of supernova remnants (SNRs) in molecular clouds. We argue that medium
Alfv\'en Mach number shocks considered by Chevalier (1999, ApJ, in press) for
such SNRs can naturally lead to the observed spectral indices.
","[{""version"":""v1"",""created"":""Wed, 23 Dec 1998 11:17:12 GMT""}]","2007-05-23"
"astro-ph/9812434","Johan P. U. Fynbo","J.U. Fynbo, P. Moller, and S.J. Warren","Extended Ly-alpha emission from a damped Ly-alpha absorber at z = 1.93,
  and the relation between DLAs and Lyman-break galaxies","10 pages, 6 figures. MNRAS, in press","Mon.Not.Roy.Astron.Soc.305:849-858,1999","10.1046/j.1365-8711.1999.02520.x",,"astro-ph",,"  The number of damped Ly-alpha absorbers (DLAs) currently known is about 100,
but our knowledge of their sizes and morphologies is still very sparse as very
few have been detected in emission. Here we present narrow-band and broad-band
observations of a DLA in the field of the quasar pair Q0151+048A (qA) and
Q0151+048B (qB). These two quasars have very similar redshifts z_em = 1.922,
1.937, respectively, and an angular separation of 3.27 arcsec. The spectrum of
qA contains a DLA at z_abs = 1.9342 (close to the emission redshift) which
shows an emission line in the trough, detected at 4 sigma. Our narrow-band
image confirms this detection and we find Ly-alpha emission from an extended
area covering 6x3 arcsec^2, corresponding to 25x12h^-2 kpc^2 (q0=0.5, H0 = 100h
km s^-1). The total Ly-alpha luminosity from the DLA is 1.2 x 10^43 h^-2 erg
s^-1, which is a factor of several higher than the Ly-alpha luminosity found
from other DLAs. The narrow-band image also indicates that qB is not covered by
the DLA. This fact, together with the large equivalent width of the emission
line from the Ly-alpha cloud, the large luminosity, and the 300 km s^-1
blueshift relative to the DLA, can plausibly be explained if qB is the sourceof
a Lyman-limit system. We also consider the relation between DLAs and
Lyman-break galaxies (LBGs). If DLAs are gaseous disks surrounding LBGs, and if
the apparent brightnesses and impact parameters of the few identified DLAs are
representative of the brighter members of the population, then the luminosity
distribution of DLAs is nearly flat, and we would expect that some 70% of the
galaxy counterparts to DLAs at z=3 are fainter than m_R=28.
","[{""version"":""v1"",""created"":""Wed, 23 Dec 1998 11:59:46 GMT""}]","2016-08-30"
"astro-ph/9812435","Thomas Richard Marsh","T. R. Marsh","Kinematics of the helium accretor GP Com","9 pages Latex, 9 figures. Accepted for publication in Monthly Notices",,"10.1046/j.1365-8711.1999.02323.x",,"astro-ph",,"  We present time-resolved spectra of the double-degenerate binary star, GP
Com. The spectra confirm the presence and period (46.5 min) of the `S'-wave
feature found by Nather, Robinson and Stover. GP Com is erratically variable at
X-ray and UV wavelengths. We have found the equivalent variability in our data,
which, as also seen in UV data, is mostly confined to the emission lines. The
HeII 4686 changes by the largest amount, consistent with X-ray driven
photo-ionisation. The flaring part of the line profiles is broader than the
average, as expected if they are dominated by the inner disc. The HeII 4686
profile is especially remarkable in that its blue-shifted peak is 1400 km/s
from line centre compared to 700 km/s for the HeI lines (the red-shifted peak
is blended with HeI 4713). We deduce that HeII 4686 emission is confined to the
inner 1/4 of the disc. We suggest that the activity of the inner disc indicates
that accretion is significant (and unstable) there, in contrast to quiescent
dwarf novae, in support of models in which GP Com is in a (quasi-)steady-state
of low mass transfer rate. GP Com shows triple-peaked lines profiles which
consist of the usual double-peaked profiles from a disc plus a narrow component
at line centre. We find evidence for both radial velocity and flux variability
in this component, inconsistent with a nebula origin. The radial velocity
amplitude and its phase relative to the `S'-wave are consistent with an origin
on the accreting white dwarf, if the mass ratio, q = M2/M1, is of order 0.02,
as expected on evolutionary grounds. However this explanation is still not
satisfactory as the systemic velocity of the narrow component shows significant
variation from line to line, and we have no explanation for this.
","[{""version"":""v1"",""created"":""Wed, 23 Dec 1998 12:49:51 GMT""}]","2009-10-31"
"astro-ph/9812436","Ralph Neuhaeuser","Ralph Neuhaeuser (MPE Garching) Cesar Briceno (Yale) Fernando Comeron
  (ESO Garching) Thomas Hearty (MPE Garching) Eduardo L. Martin (UC Berkeley)
  Juergen H.M.M. Schmitt (Uni Hamburg) Beate Stelzer (MPE Garching) Rodrigo
  Supper (MPE Garching) Wolfgang Voges (MPE Garching) Hans Zinnecker (MPE
  Garching)","Search for X-ray emission from bona-fide and candidate brown dwarfs","text with 7 tables plus 3 figures. Astron. & Astrophys., in press",,,,"astro-ph",,"  Following the recent classification of the X-ray detected object V410 x-ray 3
with a young brown dwarf candidate (Briceno et al. 1998) and the identification
of an X-ray source in Chamaeleon as young bona-fide brown dwarf (Neuhaeuser &
Comeron 1998), we investigate all ROSAT All-Sky Survey and archived ROSAT PSPC
and HRI pointed observations with bona-fide or candidate brown dwarfs in the
field of view with exposure times ranging from 0.13 to 221 ks, including
dedicated 64 ks and 42 ks deep ROSAT HRI pointed observations on the low-mass
star BRI0021-0214 and the brown dwarf Calar 3, respectively. Out of 26
bona-fide brown dwarfs, one is newly detected in X-rays, namely rho Oph GY 202.
Also, four out of 57 brown dwarf candidates studied here are detected in
X-rays, namely the young Taurus brown dwarf candidates MHO-4, MHO-5, V410 Anon
13, and V410 x-ray 3. The M9.5-type star BRI0021-0214 is not detected. In the
appendix, we also present catalogued, but as yet unnoticed B- and R-band data
for some of the objects studied here.
","[{""version"":""v1"",""created"":""Wed, 23 Dec 1998 14:02:47 GMT""}]","2007-05-23"
"astro-ph/9812437","Holger Baumgardt","H. Baumgardt, C. Dettbarn, B. Fuchs, J. Rockmann, R. Wielen","A Comparison of ground-based Cepheid P-L Relations with HIPPARCOS
  Parallaxes","4 pages, 1 figure, LaTeX, paspconf.sty, to appear in Haguenau
  Colloquium ""Harmonizing Cosmic Distance Scales in a Post-Hipparcos Era"" ASP
  Conf. Series, D. Egret and A. Heck eds",,,,"astro-ph",,"  The statistical test described by Wielen et al.(1994) is used to derive new
zero-points of ground-based Cepheid period-luminosity (PL) and
period-luminosity-colour (PLC) relations. Eleven relations are compared with
the Hipparcos data. Our results argue for a typical increase of the adopted
distance scale by about 8% +- 8%. Our zero-point for the PL relation of
Caldwell & Laney (1991) is in agreement with that of Feast & Catchpole (1997).
","[{""version"":""v1"",""created"":""Wed, 23 Dec 1998 14:36:09 GMT""}]","2007-05-23"
"astro-ph/9812438","Combes","F. Combes","Dust and Molecules at High Redshift","9 pages, 4 figures, Proceedings of ESO conf. 'Chemical Evolution from
  Zero to high redshift', 14-16 october 1998, ed. J. walsh and M. Rosa,
  Springer",,,,"astro-ph",,"  In the last years, progress has been very rapid in the domain of molecules at
high redshift, and we know in better detail now the molecular and dust content
in several systems beyond z=1 and up to z = 5.
  The first discovery in 1992 by Brown and van den Bout of CO lines at z=2.28
in a gravitationally lensed starburst galaxy, strongly stimulated searches of
other systems, but these were harder than foreseen, and less than 10 other
systems have been discovered in CO emission. Redshifts range between 2 and 5,
the largest being BR1202-0725 at z=4.69. Most of these systems, if not all, are
gravitationally amplified objects. Some have been discovered first through
their dust emission, relatively easy to detect because of the negative
K-correction effect. The detection of all these systems could give an answer
about the debated question of the star-formation rate as a function of
redshift. The maximum of star-formation rate, found around z=2 from optical
studies, could shift to higher z if the most remote objects are hidden by dust.
  Absorption in front of quasars can also probe cold gas at high redshift,
taking advantage of very high spatial (milli arcsec) and spectral (30m/s)
resolutions. From the diffuse components, one can measure the cosmic black body
temperature as a function of redshift. All these preliminary studies will be
carried out at large scales with future millimeter instruments, and some
perspectives are given.
","[{""version"":""v1"",""created"":""Wed, 23 Dec 1998 14:48:00 GMT""}]","2016-08-30"
"astro-ph/9812439","O. Silchenko","O. K. Sil'chenko, A. N. Burenkov, V. V. Vlasyuk","Chemically Decoupled Nuclei in the Spiral Galaxies NGC 4216 and NGC 4501","28 pages, Latex uses aasms4.sty, 17 Postscript figures, accepted by
  AJ","Astron.Lett. 31 (2005) 227-238","10.1086/300733",,"astro-ph",,"  By using bidimensional spectral data obtained at the 6m telescope for the
Virgo spirals NGC 4216 and NGC 4501, we have found chemically distinct
metal-rich nuclei in these galaxies. Under the assumption of equal ages for the
nuclear and bulge stellar populations, the metallicity difference between the
nuclei and their environments in the galaxies is estimated as a factor of 2.
But we have also found an age difference between the nucleus and the bulge in
NGC 4216: age-metallicity disentangling on the diagrams (H-beta, Mgb), (H-beta,
[MgFe]), and (H-beta, $<Fe>$) results in an age estimate for the nucleus of 8 -
12 billion years, the bulge being older by a factor of 1.5 - 2; and the
self-consistent metallicity difference estimate is then a factor of 3. The
solar magnesium-to-iron ratios in the galactic nuclei show evidence for a long
duration of the secondary nuclear star formation bursts which produced the
chemically distinct stellar subsystems. Detailed morphological and kinematical
analyses made for the stellar and gaseous structures in the centers of NGC 4216
and 4501 have revealed the presence of circumnuclear stellar-gaseous disks with
radius of some hundreds parsecs which demonstrate fast axisymmetric rotation
and lie exactly in the planes of the main galactic disks.
","[{""version"":""v1"",""created"":""Wed, 23 Dec 1998 15:54:37 GMT""}]","2016-08-30"
"astro-ph/9812440","Tariq Shahbaz","T. Shahbaz (Oxford), E. Kuulkers (SRON), P.A.Charles (Oxford), F. van
  der Hooft (Amsterdam), J. Casares (IAC), J. van Paradijs (Amsterdam)","The rotation speed of the companion star in V395 Car (=2S0921--630)","4 pages, 1 figure, Accepted by A&A",,,,"astro-ph",,"  We have obtained high resolution optical spectroscopy of the accretion disc
corona source 2S0921--630 (=V395 Car) that constrains the spectral type of the
companion star to be most probably K0III. At 6500A the secondary star is found
to contribute ~25% to the observed flux. The absorption line spectrum of the
K0III companion star is broadened (compared to template stars) by a projected
rotational velocity of 65+/-9 km/s (1 sigma).
","[{""version"":""v1"",""created"":""Wed, 23 Dec 1998 15:59:22 GMT""}]","2007-05-23"
"chao-dyn/9812029","Luis da Mota","L. G. S. Duarte, L. A. C. P. da Mota, H. P. de Oliveira, R. O. Ramos
  and J. E. F. Skea, (UERJ, Rio de Janeiro, RJ, Brazil)","Numerical Analysis of Dynamical Systems and the Fractal Dimension of
  Boundaries","Latex, 19 pages, 7 figures. All the material (including the package,
  paper, figures) soon to be available on
  http://www.dft.if.uerj.br/symbcomp.htm","Computer Physics Communications, Holland, v. 119, n. 2-3, p.
  256-271, 1999.","10.1016/S0010-4655(99)00204-0",,"chao-dyn nlin.CD",,"  A set of MapleV R.4/5 software routines for calculating the numerical
evolution of dynamical systems and flexibly plotting the results is presented.
The package consists of an initial condition generator (on which the user can
impose quite general constraints), a numerical solving manager, plotting
commands that allow the user to locate and focus in on regions of possible
interest and, finally, a set of routines that calculate the fractal dimension
of the boundaries of those regions. A special feature of the software routines
presented here is an optional interface in C, permitting fast numerical
integration using standard Runge-Kutta methods, or variations, for high
precision numerical integration
","[{""version"":""v1"",""created"":""Tue, 22 Dec 1998 20:07:28 GMT""}]","2009-10-31"
"cond-mat/9812358","Hidekazu Nojiri","Hidekazu Nojiri(Nagoya University)","Self-Consistent Second Order Perturbation Theory for the Hubbard Model
  in Two Dimensions","8 pages, 12 embedded EPS figures, to appear in J. Phys. Soc. Jpn.
  Vol. 68-3 (1999)",,"10.1143/JPSJ.68.903",,"cond-mat.str-el",,"  We apply self-consistent second order perturbation theory (SCSOPT) with
respect to the on-site repulsive interaction U to study the Hubbard model in
two dimensions. We investigate single particle properties of the model over the
entire doping range at zero temperature. It is shown that as doping decreases
toward half-filling $\omega$-mass enhancement factor increases, while k-mass
enhancement factor decreases. The increase in $\omega$-mass enhancement factor
is larger than the decrease in k-mass enhancement factor, so that total-mass is
larger than that in the non-interacting case. When particle number density per
unit cell n is given by 0.64<n<1.0 interaction enhances anisotropy of the Fermi
surface, whereas at lower densities n<0.64 interaction suppresses anisotropy of
it. Due to the decrease in k-mass enhancement factor the density of states
(DOS) at the Fermi level is suppressed. It is possible to understand the
results within the framework of the weak coupling Fermi liquid theory.
","[{""version"":""v1"",""created"":""Tue, 22 Dec 1998 22:13:41 GMT""}]","2009-10-31"
"cond-mat/9812369","Francesco Di Tolla","J. A. Torres, E. Tosatti, A. Dal Corso, F. Ercolessi, J. J. Kohanoff,
  F. D. Di Tolla, and J. M. Soler","The Puzzling Stability of Monatomic Gold Wires","4 figures",,"10.1016/S0039-6028(99)00333-7",,"cond-mat.mtrl-sci",,"  We have examined theoretically the spontaneous thinning process of
tip-suspended nanowires, and subsequently studied the structure and stability
of the monatomic gold wires recently observed by Transmission Electron
Microscopy (TEM). The methods used include thermodynamics, classical many-body
force simulations, Local Density (LDA) and Generalized Gradient (GGA)
electronic structure calculations as well as ab-initio simulations including
the two tips. The wire thinning is well explained in terms of a thermodynamic
tip suction driving migration of surface atoms from the wire to the tips. For
the same reason the monatomic wire becomes progressively stretched.
Surprisingly, however, all calculations so far indicate that the stretched
monatomic gold wire should be unstable against breaking, contrary to the
apparent experimental stability. The possible reasons for the observed
stability are discussed.
","[{""version"":""v1"",""created"":""Tue, 22 Dec 1998 16:30:57 GMT""}]","2009-10-31"
"cond-mat/9812370","Claude Berthier","M. Horvatic, Y. Fagot Revurat, C. Berthier (GHMFL, CNRS/MPI,
  Grenoble), G. Dhalenne and A. Revcolevschi (LCS, CNRS, Orsay)","NMR imaging of the soliton lattice profile in the spin-Peierls compound
  CuGeO_3","3 pages, 4 eps figures, RevTeX, submitted to Physical Review Letter","Phys. Rev. Lett. 83, (1999), pp.420-3","10.1103/PhysRevLett.83.420",,"cond-mat.str-el",,"  In the spin-Peierls compound CuGeO$_{3}$, the commensurate-incommensurate
transition concerning the modulation of atomic position and the local
spin-polarization is fully monitored at T=0 by the application of an external
magnetic field ($H$) above a threshold value $H_{c}\simeq $ 13 Tesla. The
solitonic profile of the spin-polarization, as well as its absolute magnitude,
has been precisely imaged from $^{65}Cu$ NMR lineshapes obtained for
$h=(H-H_{c})/H_{c}$ varying from 0.0015 to 2. This offers a unique possibility
to test quantitatively the various numerical and analytical methods developed
to solve a generic Hamiltonian in 1-D physics, namely strongly interacting
fermions in presence of electron-phonon coupling at arbitrary band filling.
","[{""version"":""v1"",""created"":""Tue, 22 Dec 1998 16:21:05 GMT""}]","2009-10-31"
"cond-mat/9812371","Zoryana Usatenko","Z. E. Usatenko, M. P. Kozlovskii","Thermodynamic characteristics of the classical n-vector magnetic model
  in three dimensions","25 pages, 5 figures","Phys.Rev.B62:9599-9615,2000","10.1103/PhysRevB.62.9599",,"cond-mat.stat-mech",,"  The method of calculating the free energy and thermodynamic characteristics
of the classical n-vector three-dimensional (3D) magnetic model at the
microscopic level without any adjustable parameters is proposed. Mathematical
description is perfomed using the collective variables (CV) method in the
framework of the $\rho^4$ model approximation. The exponentially decreasing
function of the distance between the particles situated at the N sites of a
simple cubic lattice is used as the interaction potential. Explicit and
rigorous analytical expressions for entropy,internal energy, specific heat near
the phase transition point as functions of the temperature are obtained. The
dependence of the amplitudes of the thermodynamic characteristics of the system
for $T>T_c$ and $T<T_c$ on the microscopic parameters of the interaction
potential are studied for the cases $n=1,2,3$ and $n\to\infty$. The obtained
results provide the basis for accurate analysis of the critical behaviour in
three dimensions including the nonuniversal characteristics of the system.
","[{""version"":""v1"",""created"":""Tue, 22 Dec 1998 18:36:58 GMT""}]","2008-11-26"
