"cond-mat/9812372","Till D. Kuehner","Till D. Kuehner and Steven R. White","Dynamical Correlation Functions using the Density Matrix Renormalization
  Group","minor revision, 10 pages, 15 figures",,"10.1103/PhysRevB.60.335",,"cond-mat",,"  The density matrix renormalization group (DMRG) method allows for very
precise calculations of ground state properties in low-dimensional strongly
correlated systems. We investigate two methods to expand the DMRG to
calculations of dynamical properties. In the Lanczos vector method the DMRG
basis is optimized to represent Lanczos vectors, which are then used to
calculate the spectra. This method is fast and relatively easy to implement,
but the accuracy at higher frequencies is limited. Alternatively, one can
optimize the basis to represent a correction vector for a particular frequency.
The correction vectors can be used to calculate the dynamical correlation
functions at these frequencies with high accuracy. By separately calculating
correction vectors at different frequencies, the dynamical correlation
functions can be interpolated and pieced together from these results. For
systems with open boundaries we discuss how to construct operators for specific
wavevectors using filter functions.
","[{""version"":""v1"",""created"":""Tue, 22 Dec 1998 19:23:21 GMT""},{""version"":""v2"",""created"":""Tue, 5 Jan 1999 14:01:21 GMT""},{""version"":""v3"",""created"":""Fri, 12 Feb 1999 02:06:22 GMT""}]","2009-10-31"
"cond-mat/9812373","Juan P. Garrahan","Andrea Cavagna, Juan P. Garrahan and Irene Giardina","Energy distribution of maxima and minima in a one-dimensional random
  system","4 pages RevTeX, 1 eps figure. To appear in Phys. Rev. E","Phys. Rev. E, 59, 2808 (1999).","10.1103/PhysRevE.59.2808","OUTP-98-14S","cond-mat.dis-nn cond-mat.stat-mech",,"  We study the energy distribution of maxima and minima of a simple
one-dimensional disordered Hamiltonian. We find that in systems with short
range correlated disorder there is energy separation between maxima and minima,
such that at fixed energy only one kind of stationary points is dominant in
number over the other. On the other hand, in the case of systems with long
range correlated disorder maxima and minima are completely mixed.
","[{""version"":""v1"",""created"":""Tue, 22 Dec 1998 21:24:29 GMT""}]","2009-10-31"
"cond-mat/9812374","Li Sheng","L. Sheng and C.S. Ting","Modified Double Exchange Model with Novel Spin and Orbital Coupling:
  Phase Diagram of The Manganites","8 pages and 5 figures",,,,"cond-mat.str-el",,"  From a general model of the Mn oxides R_{1-x}A_{x}MnO_3, we derive an
effective Hamiltonian in the low-energy subspace using the projection operator
method, in which a novel coupling between the spin and orbital degrees of
freedom is included. A phase diagram for temperature T versus doping
concentration x is computed by means of Monte Carlo simulation. Our result is
consistent with experimental observations in the Mn oxides with relatively wide
conduction band, such as Pr_{1-x}Sr_{x} MnO_{3} and La_{1-x}Sr_{x}MnO_{3}.
According to the obtained orbital ordering, we also predict that the motion of
charge carriers transforms from three-dimensional to two-dimensional as x is
increased beyond a critical value.
","[{""version"":""v1"",""created"":""Tue, 22 Dec 1998 22:02:14 GMT""}]","2007-05-23"
"cond-mat/9812375","Herbert Kroemer","Herbert Kroemer","Quasiparticle dynamics in ballistic weak links under weak voltage bias:
  An elementary treatment","21 pages, 3 figures, PDF format. To be published in Superlattices and
  Microstructures (Special issue on mesoscopic superconductivity)",,"10.1006/spmi.1999.0704",,"cond-mat.supr-con cond-mat.mes-hall",,"  A simple one-dimensional model for SNS weak links in the ballistic limit is
presented. In the presence of a bias voltage, the quasiparticle state at any
given instant of time is described as a superposition of that particular set of
phase-dependent Andreev bound states that belongs to the specific phase
difference present at this instant between the superconducting banks. The
treatment -- basically a form of adiabatic perturbation theory -- has a strong
formal similarity to the treatment of the k-space dynamics of an electron in a
periodic potential under perturbation by an external electric field,
sufficiently strong to cause transitions across the energy gaps between bands
(Zener tunneling). It is shown that the quasiparticle wave function retains its
phase information during analogous transitions between Andreev bands. The
experimental observation of Shapiro steps at one-half the canonical voltage
follows naturally from the model, along with some of the experimental
properties of these steps, especially their much weaker temperature dependence,
compared to the canonical steps.
","[{""version"":""v1"",""created"":""Wed, 23 Dec 1998 01:49:59 GMT""}]","2009-10-31"
"cond-mat/9812377","Mike Norman","J. Mesot, M. R. Norman, H. Ding, M. Randeria, J. C. Campuzano, A.
  Paramekanti, H. M. Fretwell, A. Kaminski, T. Takeuchi, T. Yokoya, T. Sato, T.
  Takahashi, T. Mochiku, and K. Kadowaki","Superconducting Gap Anisotropy and Quasiparticle Interactions: a Doping
  Dependent ARPES Study","4 pages, 3 eps figs, manuscript and Fig. 3 significantly revised","Phys. Rev. Lett. 83, 840 (1999)","10.1103/PhysRevLett.83.840",,"cond-mat.supr-con",,"  Comparing ARPES measurements on Bi2212 with penetration depth data, we show
that a description of the nodal excitations of the d-wave superconducting state
in terms of non-interacting quasiparticles is inadequate, and we estimate the
magnitude and doping dependence of the Landau interaction parameter which
renormalizes the linear T contribution to the superfluid density. Furthermore,
although consistent with d-wave symmetry, the gap with underdoping cannot be
fit by the simple coskx-cosky form, which suggests an increasing importance of
long range interactions as the insulator is approached.
","[{""version"":""v1"",""created"":""Wed, 23 Dec 1998 03:06:10 GMT""},{""version"":""v2"",""created"":""Wed, 17 Mar 1999 20:24:32 GMT""}]","2009-10-31"
"cond-mat/9812378","Juan J. Ruiz-Lorenzo","J. J. Ruiz-Lorenzo (UCM, Spain), C. L. Ullod (UZ, Spain)","Study of a microcanonical algorithm on the $\pm J$ spin glass model in
  d=3","Revised version. Latex 14 pages, 6 figures. To be published in
  Comput. Phys. Commun","Comp. Phys. Comm. (125) 1-3 (2000) 210-220","10.1016/S0010-4655(99)00490-7",,"cond-mat.dis-nn cond-mat.stat-mech",,"  We consider a microcanonical local algorithm to be applied on the $\pm J$
spin glass model. We have compared the results coming from a microcanonical
Monte Carlo simulation with those from a canonical one: Thermalization times,
spin glass susceptibilities and Binder parameters. For a fixed lattice size we
found different results between the two thermodynamic ensembles, which tend to
vanish at bigger volumes. Moreover, microcanonical thermalization times are
longer than the canonical ones. Finally we have checked that one of the Guerra
relations is satisfied with good precision for the two largest lattices.
","[{""version"":""v1"",""created"":""Wed, 23 Dec 1998 10:01:27 GMT""},{""version"":""v2"",""created"":""Fri, 8 Oct 1999 07:29:58 GMT""}]","2009-10-31"
"cond-mat/9812379","Sven Brehmer","S. Brehmer, H.-J. Mikeska, M. Mueller, N. Nagaosa, S. Uchida","Effects of biquadratic exchange on the spectrum of elementary
  excitations in spin ladders","RevTeX, 17 pages, 6 embedded figures, uses epsfig",,"10.1103/PhysRevB.60.329",,"cond-mat.str-el",,"  We investigate the influence of biquadratic exchange interactions on the
low-lying excitations of a S=1/2-ladder using perturbation theory, numerical
diagonalization of finite systems and exact results for ladders with matrix
product ground states. We consider in particular the combination of biquadratic
exchange interactions corresponding to ring exchange on the basic ladder
plaquette. We find that a moderate amount of ring exchange reduces the spin gap
substantially and makes equal bilinear exchange on legs and rungs consistent
with experimentally observed spectra.
","[{""version"":""v1"",""created"":""Wed, 23 Dec 1998 10:45:28 GMT""}]","2009-10-31"
"cond-mat/9812380","Krzysztof Byczuk","K.Byczuk and T.Dietl","Realistic Electron-Electron Interaction in a Quantum Wire","10 pages, 6 figures","Phys. Rev. B 60, 1507-1510 (1999)","10.1103/PhysRevB.60.1507",,"cond-mat.str-el cond-mat.mes-hall",,"  The form of an effective electron-electron interaction in a quantum wire with
a large static dielectric constant is determined and the resulting properties
of the electron liquid in such a one-dimensional system are described. The
exchange and correlation energies are evaluated and a possibility of a
paramagnetic-ferromagnetic phase transition in the ground state of such a
system is discussed. Low-energy excitations are briefly described.
","[{""version"":""v1"",""created"":""Wed, 23 Dec 1998 13:49:13 GMT""}]","2009-10-31"
"cond-mat/9812381","Grigori Volovik","G.E. Volovik","Field theory in superfluid 3He: What are the lessons for particle
  physics, gravity and high-temperature superconductivity?","RevTex file, 8 pages, 5 figures, submitted to Proc. Nat. Ac. Sc. US,
  modified after referee reports, references are added","Proc.Nat.Acad.Sci. 96 (1999) 6042-6047","10.1073/pnas.96.11.6042",,"cond-mat hep-ph",,"  There are several classes of homogeneous Fermi-systems which are
characterized by the topology of the energy spectrum of fermionic
quasiparticles: (1) Gapless systems with a Fermi-surface; (2) Systems with a
gap in their spectrum; (3) Gapless systems with topologically stable point
nodes (Fermi points); and (4) Gapless systems with topologically unstable lines
of nodes (Fermi lines). Superfluid 3He-A and electroweak vacuum belong to the
universality Class (3). The fermionic quasiparticles (particles) in this class
are chiral: they are left-handed or right-handed. The collective bosonic modes
of systems of Class (3) are the effective gauge and gravitational fields. The
great advantage of superfluid 3He-A is that we can perform experiments using
this condensed matter and thereby simulate many phenomena in high energy
physics, including axial anomaly, baryoproduction, and magnetogenesis. 3He-A
textures induce a nontrivial effective metrics of the space, where the free
quasiparticles move along geodesics. With 3He-A one can simulate event
horizons, Hawking radiation, rotating vacuum, etc. High-temperature
superconductors are believed to belong to Class (4). They have gapless
fermionic quasiparticles with a ""relativistic"" spectrum close to gap nodes,
which allows application of ideas developed for superfluid 3He-A.
","[{""version"":""v1"",""created"":""Wed, 23 Dec 1998 15:50:42 GMT""},{""version"":""v2"",""created"":""Wed, 30 Dec 1998 14:15:52 GMT""},{""version"":""v3"",""created"":""Mon, 11 Jan 1999 12:32:34 GMT""},{""version"":""v4"",""created"":""Thu, 18 Mar 1999 08:00:52 GMT""}]","2009-10-31"
"cond-mat/9812382","Victor Tsebro","A. A. Gorbatsevich, V. V. Kapaev, Yu. V. Kopaev, I. V. Kucherenko,
  O.E. Omel'yanovskii and V.I. Tsebro","Field-asymmetric transverse magnetoresistance in a nonmagnetic
  quantum-size structure","10 pages, 5 figures. For correspondence, mail to
  tsebro@sci.lebedev.ru","JETP Letters, 68(5), 404-411 (1998)","10.1134/1.567881",,"cond-mat.mtrl-sci cond-mat.mes-hall",,"  A new phenomenon is observed experimentally in a heavily doped asymmetric
quantum-size structure in a magnetic field parallel to the quantum-well layers
- a transverse magnetoresistance which is asymmetric in the field (there can
even be a change in sign) and is observed in the case that the structure has a
built-in lateral electric field. A model of the effect is proposed. The
observed asymmetry of the magnetoresistance is attributed to an additional
current contribution that arises under nonequilibrium conditions and that is
linear in the gradient of the electrochemical potential and proportional to the
parameter characterizing the asymmetry of the spectrum with respect to the
quasimomentum.
","[{""version"":""v1"",""created"":""Wed, 23 Dec 1998 15:29:39 GMT""}]","2009-10-31"
"cond-mat/9812383","Serge Galam","Serge Galam and Alain Mauger","Topology invariance in Percolation Thresholds","11 pages, latex, 1 figure included","Eur. Phys. B 1 (1998) 255-258","10.1007/s100510050179",,"cond-mat.dis-nn cond-mat.stat-mech",,"  An universal invariant for site and bond percolation thresholds (p_{cs} and
p_{cb} respectively) is proposed. The invariant writes
{p_{cs}}^{1/a_s}{p_{cb}}^{-1/a_b}=\delta/d where a_s, a_b and \delta are
positive constants,and d the space dimension. It is independent of the
coordination number, thus exhibiting a topology invariance at any d.The formula
is checked against a large class of percolation problems, including percolation
in non-Bravais lattices and in aperiodic lattices as well as rigid percolation.
The invariant is satisfied within a relative error of \pm 5% for all the twenty
lattices of our sample at d=2, d=3, plus all hypercubes up to d=6.
","[{""version"":""v1"",""created"":""Wed, 23 Dec 1998 15:32:04 GMT""}]","2009-10-31"
"cs/9812021","Antal van den Bosch","Walter Daelemans, Antal van den Bosch, and Jakub Zavrel","Forgetting Exceptions is Harmful in Language Learning","31 pages, 7 figures, 10 tables. uses 11pt, fullname, a4wide tex
  styles. Pre-print version of article to appear in Machine Learning 11:1-3,
  Special Issue on Natural Language Learning. Figures on page 22 slightly
  compressed to avoid page overload",,,,"cs.CL cs.LG",,"  We show that in language learning, contrary to received wisdom, keeping
exceptional training instances in memory can be beneficial for generalization
accuracy. We investigate this phenomenon empirically on a selection of
benchmark natural language processing tasks: grapheme-to-phoneme conversion,
part-of-speech tagging, prepositional-phrase attachment, and base noun phrase
chunking. In a first series of experiments we combine memory-based learning
with training set editing techniques, in which instances are edited based on
their typicality and class prediction strength. Results show that editing
exceptional instances (with low typicality or low class prediction strength)
tends to harm generalization accuracy. In a second series of experiments we
compare memory-based learning and decision-tree learning methods on the same
selection of tasks, and find that decision-tree learning often performs worse
than memory-based learning. Moreover, the decrease in performance can be linked
to the degree of abstraction from exceptions (i.e., pruning or eagerness). We
provide explanations for both results in terms of the properties of the natural
language processing tasks and the learning algorithms.
","[{""version"":""v1"",""created"":""Tue, 22 Dec 1998 16:33:19 GMT""}]","2007-05-23"
"gr-qc/9812081","Amir H. Abbassi","Amir H. Abbassi","General Solutions of The Spherically Symmetric Vacuum Einstein Field
  Equations","8 pages,no figure, latex Adding a section",,,"Thp-Gr/001","gr-qc",,"  According to Birkhoff's theorem the only spherically symmetric solution of
the vacuum Einstein field equations is the Schwarzschild solution. Inspite of
imposing asymptotically flatness and staticness as initial conditions we obtain
that these equations have general solutions with the Schwarzschild metric as
merely a special and simplest form of them. It is possible to have perfect and
smooth metrics with the same Newtonian and post-Newtonian limits of
Schwarzschild by a convenient and correct selection.
","[{""version"":""v1"",""created"":""Wed, 23 Dec 1998 03:01:31 GMT""},{""version"":""v2"",""created"":""Wed, 17 Feb 1999 17:50:43 GMT""}]","2007-05-23"
"gr-qc/9812082","Saharyan Aram Azati","A. A. Saharian (Yerevan State University)","Qualitative evolution in higher-loop string cosmology","35 pages, 9 GIF figures","Class.Quant.Grav.16:2057-2096,1999","10.1088/0264-9381/16/6/331","YSU/98-51","gr-qc astro-ph hep-th",,"  We investigate the evolution of the homogeneous and isotropic universe within
the framework of the effective string gravity with string-loop modifications of
dilaton couplings. In the case of barotropic perfect fluid as a
nongravitational source the set of cosmological equations is presented in the
form of the third-order autonomous dynamical system. The cases are considered
when this system is integrable in terms of integrals depending on dilaton
coupling functions. Without specifying these functions we describe generic
evolution of the universe, using dynamical systems methods. The critical points
and their stability are found for all regions of the parameters. The
qualitatively different phase space diagrams are presented for the
spatially-flat, closed and open universes. The case of the tree-level models is
considered separately. The issue of dilaton stabilization is discussed within
the framework of Damour-Polyakov mechanism.
","[{""version"":""v1"",""created"":""Wed, 23 Dec 1998 12:46:37 GMT""}]","2008-11-26"
"hep-ex/9812029","Nick Brook PPE Glasgow","A. T. Doyle","Structure Functions","46 pages. 28 postscript figures + 1 postscript preprint logo + 1
  LaTeX file + 1 style file. Also available at
  http://ppewww.ph.gla.ac.uk/preprints/98/07/ Invited plenary talk given at
  ICHEP98",,,"GLAS-PPE-98-07","hep-ex",,"  The latest structure function results, as presented at the ICHEP98
conference, are reviewed. A brief introduction to the formalism and the status
of global analyses of parton distributions is given. The review focuses on
three experimental areas: fixed-target results and their constraints on the
parton densities at high $x$; spin structure and spin parton densities as well
as the status of the associated sum rules; HERA results on the dynamics of
$F_2$ at low $(x,Q^2)$, charm and $F_L$ as well as the measurement and
interpretation of the high-$Q^2$ neutral and charged current cross-sections.
","[{""version"":""v1"",""created"":""Wed, 23 Dec 1998 12:08:25 GMT""}]","2007-05-23"
"hep-lat/9812021","Howard D. Trottier","H. D. Trottier","String breaking by dynamical fermions in three-dimensional lattice QCD","Revised version to appear in Physical Review D, has additional
  discussion of the results, additional references, modified title, larger
  figures","Phys.Rev. D60 (1999) 034506","10.1103/PhysRevD.60.034506",,"hep-lat",,"  The first observation is made of hadronic string breaking due to dynamical
fermions in zero temperature lattice QCD. The simulations are done for SU(2)
color in three dimensions, with two flavors of staggered fermions. The results
have clear implications for the large scale simulations that are being done to
search (so far, without success) for string breaking in four-dimensional QCD.
In particular, string breaking is readily observed using only Wilson loops to
excite a static quark-antiquark pair. Improved actions on coarse lattices are
used, providing an extremely efficient means to access the quark separations
and propagation times at which string breaking occurs.
","[{""version"":""v1"",""created"":""Tue, 22 Dec 1998 18:39:52 GMT""},{""version"":""v2"",""created"":""Tue, 15 Jun 1999 05:16:37 GMT""}]","2009-10-31"
"hep-lat/9812022","Piotr Bialas","G. Thorleifsson, P. Bialas, B. Petersson","The Weak-Coupling Limit of Simplicial Quantum Gravity","32 pages, latex2e + 17 eps files","Nucl.Phys. B550 (1999) 465-491","10.1016/S0550-3213(99)00140-6","BI-TP 98/38","hep-lat",,"  In the weak-coupling limit, kappa_0 going to infinity, the partition function
of simplicial quantum gravity is dominated by an ensemble of triangulations
with the ratio N_0/N_D close to the upper kinematic limit. For a combinatorial
triangulation of the D--sphere this limit is 1/D. Defining an ensemble of
maximal triangulations, i.e. triangulations that have the maximal possible
number of vertices for a given volume, we investigate the properties of this
ensemble in three dimensions using both Monte Carlo simulations and a
strong-coupling expansion of the partition function, both for pure simplicial
gravity and a with a suitable modified measure. For the latter we observe a
continuous phase transition to a crinkled phase and we investigate the fractal
properties of this phase.
","[{""version"":""v1"",""created"":""Wed, 23 Dec 1998 10:04:18 GMT""}]","2009-10-31"
"hep-lat/9812023","Frithjof Karsch","Frithjof Karsch and Martin L\""utgemeier","Deconfinement and Chiral Symmetry Restoration in an SU(3) Gauge Theory
  with Adjoint Fermions","19 pages, LaTeX2e File, 9 Postscript figures","Nucl.Phys. B550 (1999) 449-464","10.1016/S0550-3213(99)00129-7","BI-TP 98/40","hep-lat",,"  We analyze the finite temperature phase diagram of$QC$ with fermions in the
adjoint representation. The simulations performed with four dynamical Majorana
fermions show that the deconfinement and chiral phase transitions occur at two
distinct temperatures. While the deconfinement transition is first order at T_d
we find evidence for a continuous chiral transition at a higher temperature
$T_c ~ 8 T_d. We observe a rapid change of bulk thermodynamic observables at
T_d which reflects the increase in the number of degrees of freedom. However,
these show little variation at T_c, where the fermion condensate vanishes. We
also analyze the potential between static fundamental and adjoint charges in
all three phases and extract the corresponding screening masses above T_d.
","[{""version"":""v1"",""created"":""Wed, 23 Dec 1998 10:08:50 GMT""}]","2009-10-31"
"hep-ph/9812476","Daniel Cormier","D. Cormier and R. Holman","Spinodal Inflation","4 pages, 1 epsf figure","Phys.Rev.D60:041301,1999","10.1103/PhysRevD.60.041301",,"hep-ph astro-ph",,"  Out-of-equilibrium, non-perturbative, quantum effects significantly modify
the standard picture of inflation in a wide class of models including new,
natural, and hybrid inflation. We find that the quantum evolution of a single
real inflaton field may be modeled by a classical theory of two homogeneous
scalar fields. We briefly discuss the important observational consequences that
are expected to result.
","[{""version"":""v1"",""created"":""Tue, 22 Dec 1998 16:29:48 GMT""}]","2010-01-06"
"hep-ph/9812477","Hugo Christiansen","H.R. Christiansen, J. Magnin (C.B.P.F - Rio de Janeiro)","Hadronic fluctuations and quark-antiquark asymmetry in the nucleon","4 pages, 2 fig.ps, uses sproc.sty. Presented in Quark Matter'97,
  Tsukuba (Japan) and in Hadron Physics'98, Florianopolis (Brazil). To appear
  in the Proceedings",,,,"hep-ph",,"  We derive the nucleon non-perturbative sea-quark distributions coming from a
composite model involving quarks and hadronic degrees of freedom. The model
predicts a definite structured quark-antiquark asymmetry in the nucleon sea.
","[{""version"":""v1"",""created"":""Tue, 22 Dec 1998 16:48:39 GMT""}]","2007-05-23"
"hep-ph/9812478","Johannes Bluemlein","J. Bl\""umlein and A. Tkabladze","Target Mass Corrections for Polarized Structure Functions and New Sum
  Rules","34 pages LATEX, 1 style file","Nucl.Phys.B553:427-464,1999","10.1016/S0550-3213(99)00289-8","DESY 98-181","hep-ph hep-ex",,"  The target mass corrections are calculated for all structure functions of
neutral and charged current deep inelastic scattering in lowest order in the
coupling constant. Representations of the correction to the twist--2 and
twist--3 contributions are derived both in Mellin-$n$ and $x$-space. The impact
of the target mass corrections on the general relations between the twist--2
and twist--3 parts of the structure functions is studied and three new
relations between the twist--3 contributions are derived.
","[{""version"":""v1"",""created"":""Tue, 22 Dec 1998 17:19:36 GMT""}]","2008-11-26"
"hep-ph/9812479","Stefano  Forte","Stefano Forte and Lorenzo Magnea","Truncated moments of parton distributions","11 pages, no figures, latex. Final version, to be published in Phys.
  Lett. B. A few typos corrected; derivation of eq.(9) improved","Phys.Lett. B448 (1999) 295-302","10.1016/S0370-2693(99)00065-9","DFTT 74/98; INFN-RM3 98/9","hep-ph",,"  We derive evolution equations satisfied by moments of parton distributions
when the integration over the Bjorken variable is restricted to a subset (x_0
<= x <= 1) of the allowed kinematical range 0<= x<= 1. The corresponding
anomalous dimensions turn out to be given by a triangular matrix which couples
the N--th truncated moment with all (N + K)--th truncated moments with integer
K >= 0. We show that the series of couplings to higher moments is convergent
and can be truncated to low orders while retaining excellent accuracy. We give
an example of application to the determination of alpha_s from scaling
violations.
","[{""version"":""v1"",""created"":""Tue, 22 Dec 1998 18:33:19 GMT""},{""version"":""v2"",""created"":""Thu, 14 Jan 1999 10:09:32 GMT""}]","2009-10-31"
"hep-ph/9812480","Edward Shuryak","Edward Shuryak (Stony Brook)","Summary of the Workshop ``the QCD Phase Transitions'' Brookhaven
  National Laboratory, November 4-7 1998",,,,,"hep-ph",,"  This is the full text of the summary talk: copies of transparancies of all
talks with Introduction and Summary would be mailed to participants from
RIKEN/BNL center
","[{""version"":""v1"",""created"":""Tue, 22 Dec 1998 19:03:24 GMT""}]","2007-05-23"
