"cond-mat/9802042","Victor Gurarie","V. Gurarie and A. Zee (ITP, UCSB)","Localization Length from Single-Particle Properties in Disordered
  Electronic Systems","12 pages, 5 figures",,,"NSF-ITP-98-018","cond-mat.mes-hall cond-mat.dis-nn",,"  This preprint has been withdrawn as crucial errors have been discovered in
the papers it has referred to. It is now superseded by cond-mat/9807391.
","[{""version"":""v1"",""created"":""Tue, 3 Feb 1998 22:07:42 GMT""},{""version"":""v2"",""created"":""Sat, 1 Aug 1998 20:33:47 GMT""}]","2007-05-23"
"cond-mat/9802043","John M. Tranquada","J.M. Tranquada (BNL)","Charge Stripes and Antiferromagnetism in Insulating Nickelates and
  Superconducting Cuprates","10pp., uses elsart.sty, 3 eps figures embedded with psfig; for
  proceedings of Spectroscopies in Novel Superconductors '97, J. Phys. Chem.
  Solids",,"10.1016/S0022-3697(98)00198-X",,"cond-mat.supr-con cond-mat.str-el",,"  Neutron and X-ray scattering studies have provided strong evidence for
coupled spatial modulations of charge and spin densities in layered nickelates
and cuprates. The accumulated results for La(2-x)Sr(x)NiO(4+d) are consistent
with the strongly-modulated topological-stripe concept. Clues from Nd-doped
La(2-x)Sr(x)CuO(4) suggest similar behavior for the cuprates. The experimental
results are summarized, and features that conflict with an interpretation based
on a Fermi-surface instability are emphasized. A rationalization for the
differences in transport properties between the cuprates and nickelates is
given.
","[{""version"":""v1"",""created"":""Tue, 3 Feb 1998 23:03:28 GMT""}]","2009-10-31"
"cond-mat/9802044","Erkki V. Thuneberg","E.V. Thuneberg","Ginzburg-Landau Theory for Impure Superfluid 3He","18 pages, 3 figures","in ""Quasiclassical methods in superconductivity and superfluidity,
  Verditz 96"", eds. D. Rainer and J.A. Sauls (1998) p. 53",,,"cond-mat",,"  Liquid 3He at low temperatures is an ideal substance to study because of its
natural purity. The superfluid state, which appears at temperatures below 3 mK,
has many unusual and exciting properties. These have extensively been studied
experimentally, and the results are in many cases well understood theoretically
using quasiclassical approximation. In this work we study the case that liquid
3He is inside of aerogel. Aerogel is a very porous substance, where 98% of the
volume can be empty. The purpose is to understand how the properties of the
superfluid are modified when the quasiparticles are scattered from an impurity,
such as aerogel. We study extensively the ""homogeneous scattering model"". From
it we derive the Ginzburg-Landau theory of impure superfluid 3He. We give
expressions for measurable quantities and compare them with experiments. We
consider random anisotropy and its effect on the NMR properties. More
sophisticated scattering models are briefly discussed.
","[{""version"":""v1"",""created"":""Wed, 4 Feb 1998 08:05:27 GMT""}]","2007-05-23"
"cond-mat/9802047","Avinash Singh","Avinash Singh","Quantum antiferromagnetism in the d=3 Hubbard model --- a
  spin-fluctuation approach","7 pages references, additional work added",,,"EKM-TP3/01-98","cond-mat.str-el",,"  A self-consistent spin-fluctuation theory is developed to obtain T_N vs. U
for the half-filled Hubbard antiferromagnet in the whole U/t range. Good
agreement is obtained in the strong coupling limit with the high-temperature
series-expansion result for the equivalent Heisenberg model. Quantum,
spin-fluctuation correction to the sublattice magnetization is also obtained
for all U at the one-loop level. A spin picture is used throughout, and quantum
effects are incorporated through transverse spin fluctuations, which are
evaluated in the RPA using a new method.
","[{""version"":""v1"",""created"":""Wed, 4 Feb 1998 14:41:34 GMT""},{""version"":""v2"",""created"":""Thu, 28 May 1998 13:38:22 GMT""}]","2007-05-23"
"cond-mat/9802048","Boaz Kol","Boaz Kol and Amnon Aharony (Tel-Aviv University, Israel)","Exact solution of diffusion limited aggregation in a narrow cylindrical
  geometry","18 pages RevTex, 6 eps figures",,"10.1103/PhysRevE.58.4716","tau-bka98a","cond-mat.stat-mech cond-mat.dis-nn nlin.SI solv-int",,"  The diffusion limited aggregation model (DLA) and the more general dielectric
breakdown model (DBM) are solved exactly in a two dimensional cylindrical
geometry with periodic boundary conditions of width 2. Our approach follows the
exact evolution of the growing interface, using the evolution matrix E, which
is a temporal transfer matrix. The eigenvector of this matrix with an
eigenvalue of one represents the system's steady state. This yields an estimate
of the fractal dimension for DLA, which is in good agreement with simulations.
The same technique is used to calculate the fractal dimension for various
values of eta in the more general DBM model. Our exact results are very close
to the approximate results found by the fixed scale transformation approach.
","[{""version"":""v1"",""created"":""Wed, 4 Feb 1998 14:47:50 GMT""}]","2009-10-31"
"cond-mat/9802049","Avinash Singh","Avinash Singh","On evaluation of transverse spin fluctuations in quantum magnets","7 pages, 6 figures","Eur. Phys. J. B vol. 11, 5-11, 1999","10.1007/s100510050911",,"cond-mat.str-el",,"  A numerical method is described for evaluating transverse spin correlations
in the random phase approximation. Quantum, spin-fluctuation corrections to
sublattice magnetization are evaluated for the half-filled Hubbard
antiferromagnet in two and three dimensions in the whole U/t range. Extension
to the case of defects in the Hubbard AF is discussed, and the vacancy-induced
enhancement in transverse spin fluctuation is obtained in the infinite-U limit
for the spin vacancy problem in two dimensions, for vacancy concentration up to
the percolation threshold. For low-U impurities, the overall spin fluctuation
correction is found to be strongly suppressed, although surprisingly spin
fluctuations are locally enhanced at the low-U sites.
","[{""version"":""v1"",""created"":""Wed, 4 Feb 1998 15:09:33 GMT""},{""version"":""v2"",""created"":""Fri, 28 Jan 2000 07:34:30 GMT""}]","2009-10-31"
"cond-mat/9802050","Eugene V. Sukhorukov","Eugene V. Sukhorukov and Daniel Loss","Universality of Shot-Noise in Multiterminal Diffusive Conductors","4 double-column pages, REVTeX, 1 eps figure embedded with epsf","Phys. Rev. Lett. v.80, 4959 (1998)","10.1103/PhysRevLett.80.4959",,"cond-mat.mes-hall",,"  We prove the universality of shot-noise in multiterminal diffusive conductors
of arbitrary shape and dimension for purely elastic scattering as well as for
hot electrons. Using a Boltzmann-Langevin approach we reduce the calculation of
shot-noise correlators to the solution of a diffusion equation. We show that
shot-noise in multiterminal conductors is a non-local quantity and that
exchange effects can occur without quantum phase coherence even at zero
electron temperature. Concrete numbers for shot-noise are given that can be
tested experimentally.
","[{""version"":""v1"",""created"":""Wed, 4 Feb 1998 15:35:21 GMT""},{""version"":""v2"",""created"":""Mon, 21 Sep 1998 14:55:03 GMT""}]","2009-10-31"
"gr-qc/9802009","Robert Paternoga","Robert Paternoga and Robert Graham (Univerit\""at Essen, Germany)","The Chern-Simons state for the non-diagonal Bianchi IX model","29 pages, Revtex, 1 figure included, submitted to Phys. Rev. D","Phys.Rev. D58 (1998) 083501","10.1103/PhysRevD.58.083501",,"gr-qc",,"  The Bianchi IX mixmaster model is quantized in its non-diagonal form,
imposing spatial diffeomorphism, time reparametrization and Lorentz invariance
as constraints on physical state vectors before gauge-fixing. The result turns
out to be different from quantizing the diagonal model obtained by gauge-fixing
already on the classical level. For the non-diagonal model a generalized
9-dimensional Fourier transformation over a suitably chosen manifold connects
the representations in metric variables and in Ashtekar variables. A space of
five states in the metric representation is generated from the single physical
Chern-Simons state in Ashtekar variables by choosing five different integration
manifolds, which cannot be deformed into each other. For the case of a positive
cosmological constant $\Lambda$ we extend our previous study of these five
states for the diagonal Bianchi IX model to the non-diagonal case. It is shown
that additional discrete (permutation) symmetries of physical states arise in
the quantization of the non-diagonal model, which are satisfied by two of the
five states connected to the Chern-Simons state. These have the characteristics
of a wormhole groundstate and a Hartle-Hawking `no-boundary' state,
respectively. We also exhibit a special gauge-fixing of the time
reparametrization invariance of the quantized system and define an associated
manifestly positive scalar product. Then the wormhole ground state is left as
the only normalizable physical state connected to the Chern-Simons state.
","[{""version"":""v1"",""created"":""Tue, 3 Feb 1998 17:30:50 GMT""}]","2016-08-15"
"gr-qc/9802010","Domenico Giulini","Domenico Giulini","Is There a General Area Theorem for Black Holes?","7 pages, TeX; the proof for existence of cusps is generalized, new
  material and references included","J.Math.Phys. 39 (1998) 6603-6606","10.1063/1.532668","ZU-TH 13/98","gr-qc",,"  The general validity of the area law for black holes is still an open
problem. We first show in detail how to complete the usually incompletely
stated text-book proofs under the assumption of piecewise $C^2$-smoothness for
the surface of the black hole. Then we prove that a black hole surface
necessarily contains points where it is not $C^1$ (called ``cusps'') at any
time before caustics of the horizon generators show up, like e.g. in merging
processes. This implies that caustics never disappear in the past and that
black holes without initial cusps will never develop such. Hence black holes
which will undergo any non-trivial processes anywhere in the future will always
show cusps. Although this does not yet imply a strict incompatibility with
piecewise $C^2$ structures, it indicates that the latter are likely to be
physically unnatural. We conclude by calling for a purely measure-theoretic
proof of the area theorem.
","[{""version"":""v1"",""created"":""Tue, 3 Feb 1998 17:50:20 GMT""},{""version"":""v2"",""created"":""Thu, 9 Jul 1998 12:12:49 GMT""}]","2015-06-25"
"gr-qc/9802011","Mark E. Rupright","M. E. Rupright, A. M. Abrahams, L. Rezzolla","Cauchy-perturbative matching and outer boundary conditions I: Methods
  and tests","13 pages, 6 figures, RevTeX","Phys.Rev. D58 (1998) 044005","10.1103/PhysRevD.58.044005","TAR-064-UNC","gr-qc",,"  We present a new method of extracting gravitational radiation from
three-dimensional numerical relativity codes and providing outer boundary
conditions. Our approach matches the solution of a Cauchy evolution of
Einstein's equations to a set of one-dimensional linear wave equations on a
curved background. We illustrate the mathematical properties of our approach
and discuss a numerical module we have constructed for this purpose. This
module implements the perturbative matching approach in connection with a
generic three-dimensional numerical relativity simulation. Tests of its
accuracy and second-order convergence are presented with analytic linear wave
data.
","[{""version"":""v1"",""created"":""Tue, 3 Feb 1998 19:23:54 GMT""}]","2009-10-31"
"gr-qc/9802012","Felix Finster","Felix Finster, Joel Smoller, and Shing-Tung Yau","Particle-Like Solutions of the Einstein-Dirac-Maxwell Equations","7 pages, LaTeX, 3 PostScript figures (published version)","Phys.Lett.A259:431-436,1999","10.1016/S0375-9601(99)00457-0",,"gr-qc hep-th",,"  We consider the coupled Einstein-Dirac-Maxwell equations for a static,
spherically symmetric system of two fermions in a singlet spinor state.
Soliton-like solutions are constructed numerically. The stability and the
properties of the ground state solutions are discussed for different values of
the electromagnetic coupling constant. We find solutions even when the
electromagnetic coupling is so strong that the total interaction is repulsive
in the Newtonian limit. Our solutions are regular and well-behaved; this shows
that the combined electromagnetic and gravitational self-interaction of the
Dirac particles is finite.
","[{""version"":""v1"",""created"":""Tue, 3 Feb 1998 21:38:22 GMT""},{""version"":""v2"",""created"":""Mon, 16 Feb 1998 14:51:36 GMT""},{""version"":""v3"",""created"":""Mon, 23 Aug 1999 21:46:24 GMT""}]","2010-11-19"
"gr-qc/9802013","Frank Antonsen","Frank Antonsen, Karsten Bormann","Casimir driven evolution of the universe","LaTeX, 11 figures (postscript). Revised edition. New references added",,,,"gr-qc astro-ph hep-th",,"  For a Friedman-Robertson-Walker space-time in which the only contribution to
the stress-energy tensor comes from the renormalised zero-point energy (i.e.
the Casimir energy) of the fundamental fields the evolution of the universe
(the scale factor) depends upon whether the universe is open, flat or closed
and upon which fundamental fields inhabit the space-time. We calculate this
""Casimir effect"" using the heat kernel method, and the calculation is thus
non-perturbative. We treat fields of spin $0,1/2,1$ coupled to the
gravitational background only. The heat kernels and/or zeta-functions for the
various spins are related to that of a non-minimally coupled one. A WKB
approximation is used in obtaining the radial part of that heat kernel. The
simulations of the resulting equations of motion seem to exclude the
possibility of a closed universe, $K=+1$, as these turn out to have an
overwhelming tendency towards a fast collapse - the details such as the rate of
this collapse depends on the structure of the underlying quantum degrees of
freedom: a non-minimal coupling to curvature accelerates the process. Only
$K=-1$ and K=0 will in general lead to macroscopic universes, and of these
$K=-1$ seems to be more favourable. The possibility of the scale factor being a
concave rather than a convex function potentially indicates that the problem of
the large Hubble constant is non-existent as the age of the universe need not
be less than or equal to the Hubble time. Note should be given to the fact,
however, that we are not able to pursue the numerical study to really large
times neither do simulations for a full standard model.
","[{""version"":""v1"",""created"":""Wed, 4 Feb 1998 14:22:45 GMT""},{""version"":""v2"",""created"":""Mon, 10 Aug 1998 11:31:44 GMT""}]","2007-05-23"
"hep-ex/9802006","Steve Mrenna","M. Carena (1), R.L. Culbertson (2), S. Eno (3), H.J. Frisch (2), and
  S. Mrenna (4) ((1) FNAL, (2) Univ. of Chicago, (3) Univ. of Maryland, (4)
  Argonne)","Perspectives on Supersymmetry: The Search for Supersymmetry at the
  Tevatron Collider","31 pages, 11 figures, uses psfig.tex and sprocl.sty",,,,"hep-ex",,"  A review of the status of searches for Supersymmetry at the Tevatron Collider
as of the Summer of 1997. This is a new version of the previous review,
substantially shortened to fit editorial guidelines, and significantly
different to warrant a separate posting. To appear in ""Perspectives on
Supersymmetry"", ed. G.L. Kane (World Scientific, Singapore).
","[{""version"":""v1"",""created"":""Tue, 3 Feb 1998 23:11:07 GMT""},{""version"":""v2"",""created"":""Wed, 4 Feb 1998 05:33:07 GMT""}]","2009-09-25"
"hep-lat/9802001","Yannick Meurice","J. J. Godina (1 and 2), Y. Meurice (2 and 3), M. B. Oktay (2 and 3)
  ((1) CINVESTAV, (2) University of Iowa, (3) CERN)","Accurate Checks of Universality for Dyson's Hierarchical Model","9 pages, Revtex, 1 figure","Phys.Rev.D57:6581-6584,1998","10.1103/PhysRevD.57.6581","CERN 97-378 ; U. of Iowa 97-2503","hep-lat cond-mat hep-th",,"  Using recently developed methods, we perform high-accuracy calculations of
the susceptibility near beta_c for the D=3 version of Dyson's hierarchical
model. Using linear fits, we estimate the leading gamma and subleading Delta
exponents. Independent estimates are obtained by calculating the first two
eigenvalues of the linearized renormalization group transformation. We found
gamma = 1.29914073 (with an estimated error of 10^{-8}) and, Delta=0.4259469
(with an estimated error of 10^{-7}) independently of the choice of local
integration measure (Ising or Landau-Ginzburg). After a suitable rescaling, the
approximate fixed points for a large class of local measure coincide accurately
with a fixed point constructed by Koch and Wittwer.
","[{""version"":""v1"",""created"":""Tue, 3 Feb 1998 17:54:59 GMT""}]","2010-01-06"
"hep-ph/9802232","Gustavo Burdman","Gustavo Burdman","Constraints on Strong Dynamics from Rare B and K Decays","12 pages, 3 figures. Talk presented at the Workshop on Physics at the
  First Muon Collider and the Front End of the Muon Collider; November 6-9
  1997, Fermilab, Batavia, Illinois",,"10.1063/1.56193","MADPH-98-1039","hep-ph",,"  We discuss the constraints from rare B and K decays on the Electroweak
Symmetry Breaking (EWSB) sector, as well as on theories of fermion masses. We
focus on models involving new strong dynamics and show that transitions
involving Flavor Changing Neutral Currents (FCNC) play an important role in
disentangling the physics in these scenarios. In a model-independent approach
to the EWSB sector, the information from rare decays is complementary to
precision electroweak observables in bounding the contributions to the
effective lagrangian. We compare the pattern of deviations from the standard
model that results from these sources, with the deviations associated with the
mechanism for generating fermion masses.
","[{""version"":""v1"",""created"":""Tue, 3 Feb 1998 16:36:58 GMT""}]","2009-10-31"
"hep-ph/9802233","Ruth Haeckl","Ruth Haeckl, Viktor Hund and Hartmut Pilkuhn","Eight-component two-fermion equations","Revtex, accepted for publication in Phys. Rev. A",,"10.1103/PhysRevA.57.3268","TTP97-07","hep-ph physics.atom-ph",,"  An eight-component formalism is proposed for the relativistic two-fermion
problem. In QED, it extends the applicability of the Dirac equation with
hyperfine interaction to the positronium case. The use of exact relativistic
two-body kinematics entails a CP-invariant spectrum which is symmetric in the
total cms energy. It allows the extension of recent \alpha^6 recoil corrections
to the positronium case, and implies new recoil corrections to the fine and
hyperfine structures and to the Bethe logarithm.
","[{""version"":""v1"",""created"":""Tue, 3 Feb 1998 18:11:01 GMT""}]","2009-10-31"
"hep-ph/9802234","Mikhail Voloshin","B.M. Chibisov, M.B. Voloshin","Top quark longitudinal polarization near the threshold in l+ l-
  annihilation","6 pages, LaTeX, no figures, added references, corrected typos","Mod.Phys.Lett. A13 (1998) 973-978","10.1142/S0217732398001042","TPI-MINN-98/02-T, UMN-TH-1623-98","hep-ph",,"  We show that the longitudinal polarization of the top quarks produced in the
annihilation of e+ e- or mu+ mu- into tbar t at energies near the threshold is
not affected by the large Coulomb-type corrections, which greatly modify the
total cross section. Thus the longitudinal polarization, although small, may
provide an independent information on the mass and the width of the top quark,
largely independent of the uncertainty in alpha_s.
","[{""version"":""v1"",""created"":""Tue, 3 Feb 1998 20:52:12 GMT""},{""version"":""v2"",""created"":""Thu, 5 Feb 1998 23:00:58 GMT""}]","2009-10-31"
"hep-ph/9802235","Aharon Davidson","Aharon Davidson, Tomer Schwartz, and Raymond R. Volkas","Linking Geometric Mass Hierarchy with Threefold Family Replication","Revtex, 11 twocolumn pages, No figures","J.Phys.G25:1571-1588,1999","10.1088/0954-3899/25/8/302","UMP-97/35, RCHEP-97/06, BGU-97/12","hep-ph",,"  A link is established between the observed (approximate) geometric mass
hierarchy of quarks and leptons and the triangular structure of their tenable
flavor representations. This singles out SU(3) as the horizontal flavor group,
thereby linking the Fermi mass hierarchy with the threefold family replication.
These linkages are exploited within a flavor-chiral SU(3) model, with fermions
and Higgs bosons in the 3+6* representation. The model is Left-Right symmetric
and utilizes the universal see-saw mechanism with a geometric mass suppression
pattern. Given certain assumptions, the model produces successful mass-ratio
(rather than square-mass-ratio) mixing angle relations and fixes the light
quark mass ratio.
","[{""version"":""v1"",""created"":""Tue, 3 Feb 1998 21:27:57 GMT""}]","2008-11-26"
"hep-ph/9802236","Wu Ning","Ning Wu","Gauge Field Model With Massive Gauge Bosons","5 Pages, no figures, LaTex file",,,,"hep-ph",,"  A gauge field model, which simultaneously has strict local gauge symmetry and
massive gauge bosons, is discussed in this paper. The model has SU(N) gauge
symmetry. In the limit $\alpha \longrightarrow 0$, the gauge field model
discussed in this paper will return to Yang-Mills gauge field model. The
important meaning of this model is that, without Higgs mechanism, gauge bosons
can also obtain masses. This theory can also explain some other unknown
phenomenum.
","[{""version"":""v1"",""created"":""Wed, 4 Feb 1998 01:32:32 GMT""}]","2007-05-23"
"hep-ph/9802237","Wu Ning","Ning Wu","A New Electroweak Model Without Higgs Boson","6 pages, no figures, LaTex file",,,,"hep-ph",,"  In this paper, we try to construct an electroweak model which avoids using
Higgs mechanism. We simultaneously introduce two sets of gauge bosons so as to
keep the masses of gauge bosons $W^{\pm}$ and $Z$ non-zero without using Higgs
mechanism. In order to introduce symmetry breaking, we need a vacuum potential.
In a proper limit, this model will return to the standard model, except that
there exists no Higgs particle and couplings between Higgs particle and
fermions or gauge fields. The fundamental dynamical characteristics of this
model are similar to those of the standard model.
","[{""version"":""v1"",""created"":""Wed, 4 Feb 1998 02:48:54 GMT""},{""version"":""v2"",""created"":""Fri, 6 Feb 1998 00:52:02 GMT""},{""version"":""v3"",""created"":""Sun, 15 Feb 1998 03:43:22 GMT""},{""version"":""v4"",""created"":""Thu, 2 Jul 1998 13:09:19 GMT""}]","2007-05-23"
"hep-ph/9802239","Jacques C. R. Bloch","D. Atkinson and J.C.R. Bloch","QCD in the Infrared with Exact Angular Integrations","7 pages, latex","Mod.Phys.Lett.A13:1055-1062,1998","10.1142/S0217732398001121","RUGTh-980204","hep-ph hep-th nucl-th",,"  In a previous paper we have shown that in quantum chromodynamics the gluon
propagator vanishes in the infrared limit, while the ghost propagator is more
singular than a simple pole. These results were obtained after angular
averaging, but in the current paper we go beyond this approximation and perform
an exact calculation of the angular integrals. The powers of the infrared
behaviour of the propagators are changed substantially. We find the very
intriguing result that the gluon propagator vanishes in the infrared exactly
like p^2, whilst the ghost propagator is exactly as singular as 1/p^4. We also
find that the value of the infrared fixed point of the QCD coupling is much
decreased from the y-max estimate: it is now equal to 4\pi/3.
","[{""version"":""v1"",""created"":""Wed, 4 Feb 1998 08:00:51 GMT""}]","2009-01-14"
"hep-ph/9802240",,"A. Riotto (CERN-TH)","Recent Developments in Electroweak baryogenesis","Talk given at the XXXIIIrd Recontres de Moriond Conference,
  Fundamental Parameters in Cosmology, Les Arcs, France, January 17-24, 1998; 8
  pages, uses spocrl.sty",,,"CERN-TH/98-41","hep-ph",,"  We discuss some recent developments made in the computation of the baryon
asymmetry generated at the electroweak scale. We emphasize that the local
number density asymmetries of the particles involved in supersymmetric
electroweak baryogenesis must be described by a set of Quantum Boltzmann
Equations. These diffusion equations automatically and self-consistently
incorporate the CP-violating sources which fuel baryogenesis and manifest
``memory'' effects which are typical of the quantum transport theory and are
not present in the classical approach.
","[{""version"":""v1"",""created"":""Wed, 4 Feb 1998 09:24:13 GMT""}]","2007-05-23"
"hep-ph/9802241","Matthias Steinhauser","J.H. K\""uhn and M. Steinhauser","A theory driven analysis of the effective QED coupling at $M_Z$","9 pages (Latex); minor error in result for charm threshold region
  fixed; final result unchanged","Phys.Lett. B437 (1998) 425-431","10.1016/S0370-2693(98)00908-3","TTP98-05, MPI/PhT/98-12","hep-ph",,"  An evaluation of the effective QED coupling at the scale M_Z is presented. It
employs the predictions of perturbative QCD for the cross section of electron
positron annihilation into hadrons up to order \alpha_s^2, including the full
quark mass dependence, and of order \alpha_s^3 in the high energy region. This
allows to predict the input for the dispersion relations over a large part of
the integration region. The perturbative piece is combined with data for the
lower energies and the heavy quark thresholds. The result for the hadronic
contribution to the running of the coupling \Delta\alpha^{(5)}_{\rm
had}(M_Z^2)= (277.5 \pm 1.7)\times 10^{-4} leads to
(\alpha(M_Z^2))^{-1}=128.927 \pm 0.023. Compared to previous analyses the
uncertainty is thus significantly reduced.
","[{""version"":""v1"",""created"":""Wed, 4 Feb 1998 10:51:40 GMT""},{""version"":""v2"",""created"":""Tue, 21 Jul 1998 09:13:36 GMT""}]","2009-10-31"
