"hep-ph/9802242","Nikolaos Tetradis","G. Lazarides, N. Tetradis","Two-Stage Inflation in Supergravity","25 pages, LaTeX file, 2 figures in eps format, minor corrections to
  the text","Phys.Rev.D58:123502,1998","10.1103/PhysRevD.58.123502","SNS-PH/1998-3","hep-ph astro-ph",,"  We investigate the viability of a two-stage inflationary scenario in the
context of supergravity, so as to resolve the problem of initial conditions for
hybrid inflation. We allow for non-renormalizable terms in the superpotential
and consider the most general form of the Kahler potential and the gauge
kinetic function. We construct a model with two stages of inflation, the first
driven by D-term and the second by F-term energy density. The viability of this
scenario depends on the non-minimal terms in the Kahler potential, for which we
derive the necessary constraints.
","[{""version"":""v1"",""created"":""Wed, 4 Feb 1998 13:52:08 GMT""},{""version"":""v2"",""created"":""Mon, 4 May 1998 13:40:06 GMT""},{""version"":""v3"",""created"":""Tue, 20 Oct 1998 08:31:52 GMT""}]","2008-11-26"
"hep-ph/9802243","Mihail Tentyukov","M. Tentyukov, J. Fleischer","Automation of Feynman Diagram Evaluation","LaTeX, 4 pages, 1 eps-figure; Contribution to Proceeding of XII
  International Workshop in Samara (Russia), 4 - 10 September 1997",,,,"hep-ph",,"  A C-program DIANA (DIagram ANAlyser) for the automation of Feynman diagram
evaluations is presented.
","[{""version"":""v1"",""created"":""Wed, 4 Feb 1998 14:42:36 GMT""}]","2007-05-23"
"hep-ph/9802244","Mihail Tentyukov","J. Fleischer, M. Tentyukov","Methods to calculate scalar two-loop vertex diagrams","LaTeX, 6 pages, 3 eps-figure, uses axodraw.sty; Contribution to
  Proceeding of XII International Workshop in Samara (Russia), 4 - 10 September
  1997",,,,"hep-ph",,"  We present a review of the Bielefeld-Dubna activities on multiloop
calculations.
","[{""version"":""v1"",""created"":""Wed, 4 Feb 1998 14:43:19 GMT""}]","2007-05-23"
"hep-th/9802010","Valeri P. Frolov","Valeri Frolov and Dmitri Fursaev","Thermal Fields, Entropy, and Black Holes","44 pages, LaTeX file","Class.Quant.Grav. 15 (1998) 2041-2074","10.1088/0264-9381/15/8/001","Alberta-Thy 03-98","hep-th",,"  In this review we describe statistical mechanics of quantum systems in the
presence of a Killing horizon and compare statistical-mechanical and one-loop
contributions to black hole entropy. Studying these questions was motivated by
attempts to explain the entropy of black holes as a statistical-mechanical
entropy of quantum fields propagating near the black hole horizon. We provide
an introduction to this field of research and review its results. In
particular, we discuss the relation between the statistical-mechanical entropy
of quantum fields and the Bekenstein-Hawking entropy in the standard scheme
with renormalization of gravitational coupling constants and in the theories of
induced gravity.
","[{""version"":""v1"",""created"":""Tue, 3 Feb 1998 23:02:47 GMT""}]","2009-10-31"
"hep-th/9802011",,"Y. S. Kim","Wigner's Photons","RevTex 6 pages,no figures,presented at the 5th International
  Conference on Squeezed States and Uncertainty Relations (Lake Balatonfured,
  Hungary, May 27-31, 1997), to be published in the Proceedings",,,,"hep-th hep-ph quant-ph",,"  If Einstein's photon is $E = cp = \hbar\omega$, Wigner's photon is its
helicity which is a Lorentz-invariant concept coming from the E(2)-like little
group for massless particles. In addition, the E(2)-like little group has two
translation-like degrees of freedom. What happens to them? They are associated
with the gauge degree of freedom. Since the physics of polarized light waves
can be formulated within the framework of the Lorentz group, it is now possible
to use polarization experiments to study the E(2)-like little group in terms of
quantities that can be measured in laboratories.
","[{""version"":""v1"",""created"":""Tue, 3 Feb 1998 16:32:52 GMT""}]","2007-05-23"
"hep-th/9802012","Kimyeong Lee","Kimyeong Lee (Columbia Univ.)","Instantons and Magnetic Monopoles on $R^3\times S^1$ with Arbitrary
  Simple Gauge Groups","11 pages, LaTex file, no figure","Phys.Lett. B426 (1998) 323-328","10.1016/S0370-2693(98)00283-4","CU-TP-877","hep-th hep-lat hep-ph nucl-th",,"  We investigate Yang-Mills theories with arbitrary gauge group on $R^3\times
S^1$, whose symmetry is spontaneously broken by the Wilson loop. We show that
instantons are made of fundamental magnetic monopoles, each of which has a
corresponding root in the extended Dynkin diagram. The number of constituent
magnetic monopoles for a single instanton is the dual Coxeter number of the
gauge group, which also accounts for the number of instanton zero modes. In
addition, we show that there exists a novel type of the $S^1$ coordinate
dependent magnetic monopole solutions in $G_2,F_4,E_8$.
","[{""version"":""v1"",""created"":""Tue, 3 Feb 1998 21:02:35 GMT""}]","2009-10-31"
"hep-th/9802013","Marco Cavagli\`a","Marco Cavaglia","A Solvable Model of Two-Dimensional Dilaton-Gravity Coupled to a
  Massless Scalar Field","6 pages, RevTeX, to be published in Phys. Rev. D","Phys.Rev. D57 (1998) 5295-5298","10.1103/PhysRevD.57.5295",,"hep-th gr-qc",,"  We present a solvable model of two-dimensional dilaton-gravity coupled to a
massless scalar field. We locally integrate the field equations and briefly
discuss the properties of the solutions. For a particular choice of the
coupling between the dilaton and the scalar field the model can be interpreted
as the two-dimensional effective theory of 2+1 cylindrical gravity minimally
coupled to a massless scalar field.
","[{""version"":""v1"",""created"":""Tue, 3 Feb 1998 18:18:35 GMT""}]","2009-10-31"
"hep-th/9802014","Daniel C. Cabra","D.C. Cabra, P. Pujol, C. von Reichenbach","Non-Abelian Bosonization and Haldane's Conjecture","9 pages REVTeX, no figures","Phys.Rev. B58 (1998) 65-68","10.1103/PhysRevB.58.65","La Plata-Th 98/03, SISSA 15/98/EP","hep-th cond-mat",,"  We study the long wavelength limit of a spin S Heisenberg antiferromagnetic
chain. The fermionic Lagrangian obtained corresponds to a perturbed level 2S
SU(2) Wess-Zumino-Witten model. This effective theory is then mapped into a
compact U(1) boson interacting with Z_{2S} parafermions. The analysis of this
effective theory allows us to show that when S is an integer there is a mass
gap to all excitations, whereas this gap vanishes in the half-odd-integer spin
case. This gives a field theory treatment of the so-called Haldane's conjecture
for arbitrary values of the spin S.
","[{""version"":""v1"",""created"":""Tue, 3 Feb 1998 19:11:19 GMT""}]","2009-10-31"
"hep-th/9802015","Peter E. Haagensen","Edward Farhi, Noah Graham, Peter E. Haagensen, Robert L. Jaffe","Finite Quantum Fluctuations About Static Field Configurations","16 pp. LaTeX, 3 figs., BoxedEPS","Phys.Lett. B427 (1998) 334-342","10.1016/S0370-2693(98)00354-2","MIT-CTP 2711","hep-th",,"  We develop an unambiguous and practical method to calculate one-loop quantum
corrections to the energies of classical time-independent field configurations
in renormalizable field theories. We show that the standard perturbative
renormalization procedure suffices here as well. We apply our method to a
simplified model where a charged scalar couples to a neutral ""Higgs"" field, and
compare our results to the derivative expansion.
","[{""version"":""v1"",""created"":""Tue, 3 Feb 1998 19:59:02 GMT""}]","2009-10-31"
"hep-th/9802016","Rajesh Gopakumar","Rajesh Gopakumar and Cumrun Vafa","Topological Gravity as Large N Topological Gauge Theory","Harvmac, 31 pages (big), references added","Adv.Theor.Math.Phys.2:413-442,1998",,"HUTP-97/A105, UCSB-97-25","hep-th",,"  We consider topological closed string theories on Calabi-Yau manifolds which
compute superpotential terms in the corresponding compactified type II
effective action. In particular, near certain singularities we compare the
partition function of this topological theory (the Kodaira-Spencer theory) to
$SU(\infty)$ Chern-Simons theory on the vanishing 3-cycle. We find agreement
between these theories, which we check explicitly for the case of shrinking
$S^3$ and Lens spaces, at the perturbative level. Moreover, the gauge theory
has non-perturbative contributions which have a natural interpretation in the
Type IIB picture. We provide a heuristic explanation for this agreement as well
as suggest further equivalences in other topological gravity/gauge systems.
","[{""version"":""v1"",""created"":""Tue, 3 Feb 1998 20:29:17 GMT""},{""version"":""v2"",""created"":""Wed, 18 Feb 1998 21:54:22 GMT""}]","2008-11-26"
"hep-th/9802017","Francesco Sannino","N. Kitazawa and F. Sannino (Yale Univ.)","Higgs Lagrangian from Gauge Theories","4 pages, two-column RevTeX",,,"YCTP-1-98","hep-th hep-ph",,"  We explore a novel way of deriving the effective Higgs Lagrangian from
strongly interacting vector-like gauge theories. We consider the N=1
supersymmetric extension of gauge theories and interpret the auxiliary field
associated with the low energy effective ""meson"" superfield as the Higgs field.
By introducing an explicit supersymmetry breaking term and computing the
one-loop effective action at the effective theory level we show that the
kinetic term for the Higgs field is generated, while the negative mass squared
term is already present at the tree level. We further propose a scenario by
which the complete Higgs potential can be generated and the fermion in the low
energy effective theory acquires a mass.
","[{""version"":""v1"",""created"":""Tue, 3 Feb 1998 23:06:02 GMT""}]","2007-05-23"
"hep-th/9802018","George Leontaris","E.G. Floratos, G.K. Leontaris","A Note on the Supersymmetries of the Self-Dual Supermembrane","Latex file, 12pages, no figures","Phys.Lett. B428 (1998) 75-81","10.1016/S0370-2693(98)00398-0",,"hep-th",,"  In this letter we discuss the supersymmetry issue of the self dual
supermembranes in (8+1) and (4+1)-dimensions. We find that all genuine
solutions of the (8+1)-dimensional supermembrane, based on the exceptional
group G_2, preserve one of the sixteen supersymmetries while all solutions in
(4+1)-dimensions preserve eight of them.
","[{""version"":""v1"",""created"":""Wed, 4 Feb 1998 08:28:44 GMT""}]","2009-10-31"
"hep-th/9802019","Brandon Carter","Brandon Carter","Regularisation of classical self interaction in strings","4 pages, Latex. Contribution to proceedings of 1997 Cargese A.S.I.
  ``Strings, branes, and dualities'', ed. L. Baulieu, P. Windey",,,,"hep-th",,"  A general method of regularisation of classical self interaction in strings
is extended from the electromagnetic case (for which it was originally
developed) to the gravitation case, for which the result can also be
represented as a renormalisation.
","[{""version"":""v1"",""created"":""Wed, 4 Feb 1998 11:02:43 GMT""}]","2007-05-23"
"hep-th/9802020","Ch. Floe Kristjansen","J. Ambjorn, K.N. Anagnostopoulos, J. Jurkiewicz and C. Kristjansen
  (The Niels Bohr Institute)","The Concept of Time in 2D Quantum Gravity","14 pages, LaTeX, 2 ps-figures","JHEP 9804 (1998) 016","10.1088/1126-6708/1998/04/016","NBI-HE-97-53","hep-th hep-lat",,"  We show that the ``time'' t_s defined via spin clusters in the Ising model
coupled to 2d gravity leads to a fractal dimension d_h(s) = 6 of space-time at
the critical point, as advocated by Ishibashi and Kawai. In the unmagnetized
phase, however, this definition of Hausdorff dimension breaks down. Numerical
measurements are consistent with these results. The same definition leads to
d_h(s)=16 at the critical point when applied to flat space. The fractal
dimension d_h(s) is in disagreement with both analytical prediction and
numerical determination of the fractal dimension d_h(g), which is based on the
use of the geodesic distance t_g as ``proper time''. There seems to be no
simple relation of the kind t_s = t_g^{d_h(g)/d_h(s)}, as expected by
dimensional reasons.
","[{""version"":""v1"",""created"":""Wed, 4 Feb 1998 15:08:56 GMT""}]","2009-10-31"
"hep-th/9802021",,"V. Grassi, R. A. Leo, G. Soliani and L. Solombrino","Continuous approximation of binomial lattices","30 pages, LaTeX, no figures. Submitted to Annals of Physics","Int.J.Mod.Phys. A14 (1999) 2357-2384","10.1142/S0217751X99001184",,"hep-th",,"  A systematic analysis of a continuous version of a binomial lattice,
containing a real parameter $\gamma$ and covering the Toda field equation as
$\gamma\to\infty$, is carried out in the framework of group theory. The
symmetry algebra of the equation is derived. Reductions by one-dimensional and
two-dimensional subalgebras of the symmetry algebra and their corresponding
subgroups, yield notable field equations in lower dimensions whose solutions
allow to find exact solutions to the original equation. Some reduced equations
turn out to be related to potentials of physical interest, such as the
Fermi-Pasta-Ulam and the Killingbeck potentials, and others. An instanton-like
approximate solution is also obtained which reproduces the Eguchi-Hanson
instanton configuration for $\gamma\to\infty$. Furthermore, the equation under
consideration is extended to $(n+1)$--dimensions. A spherically symmetric form
of this equation, studied by means of the symmetry approach, provides
conformally invariant classes of field equations comprising remarkable special
cases. One of these $(n=4)$ enables us to establish a connection with the
Euclidean Yang-Mills equations, another appears in the context of Differential
Geometry in relation to the socalled Yamabe problem. All the properties of the
reduced equations are shared by the spherically symmetric generalized field
equation.
","[{""version"":""v1"",""created"":""Wed, 4 Feb 1998 15:25:42 GMT""}]","2009-10-31"
"math/9802014","Jean-Luc A. Brylinski","Jean-Luc Brylinski, Gregg Zuckerman","The outer derivation of a complex Poisson manifold","plain tex, 9 pages",,,,"math.DG",,"  We introduce a canonical outer vector field on a Poisson manifold, also due
independently to A. Weinstein. We view it as a global section of the sheaf of
Poisson vector fields modulo the subsheaf of hamiltonian vector fields. We
study this outer derivation mostly in the case of holomorphic Poisson
manifolds.
","[{""version"":""v1"",""created"":""Tue, 3 Feb 1998 19:12:33 GMT""}]","2007-05-23"
"math/9802015","Daniele Guido","Daniele Guido (U. Basilicata), Tommaso Isola (U. Roma Tor Vergata)","Noncommutative Riemann integration and and Novikov-Shubin invariants for
  open manifolds","34 pages, LaTeX, a new section has been added, concerning an
  application to Novikov-Shubin invariants, the title changed accordingly","J. Funct. Anal. 176, (2000), 115-152","10.1006/jfan.2000.3609",,"math.OA math.FA",,"  Given a C*-algebra A with a semicontinuous semifinite trace tau acting on the
Hilbert space H, we define the family R of bounded Riemann measurable elements
w.r.t. tau as a suitable closure, a la Dedekind, of A, in analogy with one of
the classical characterizations of Riemann measurable functions, and show that
R is a C*-algebra, and tau extends to a semicontinuous semifinite trace on R.
  Then, unbounded Riemann measurable operators are defined as the closed
operators on H which are affiliated to A'' and can be approximated in measure
by operators in R, in analogy with unbounded Riemann integration. Unbounded
Riemann measurable operators form a tau-a.e. bimodule on R, denoted by R^, and
such bimodule contains the functional calculi of selfadjoint elements of R
under unbounded Riemann measurable functions. Besides, tau extends to a
bimodule trace on R^.
  Type II_1 singular traces for C*-algebras can be defined on the bimodule of
unbounded Riemann-measurable operators. Noncommutative Riemann integration, and
singular traces for C*-algebras, are then used to define Novikov-Shubin numbers
for amenable open manifolds, show their invariance under quasi-isometries, and
prove that they are (noncommutative) asymptotic dimensions.
","[{""version"":""v1"",""created"":""Tue, 3 Feb 1998 19:21:54 GMT""},{""version"":""v2"",""created"":""Sat, 20 Jun 1998 13:58:45 GMT""},{""version"":""v3"",""created"":""Wed, 28 Feb 2001 16:43:15 GMT""}]","2016-09-07"
"math/9802016","Jason Fulman","Jason Fulman","A Generalization of an Alternating Sum Formula for Finite Coxeter Groups","6 pages",,,,"math.GR math.CO",,"  For W a finite Coxeter group, a formula is found for the size of W
equivalence classes of subsets of a base. The proof is a case-by-case analysis
using results and tables of Carter and Orlik/Solomon. As a corollary we obtain
an alternating sum identity which generalizes a well-known identity from the
theory of Coxeter groups.
","[{""version"":""v1"",""created"":""Tue, 3 Feb 1998 22:19:17 GMT""}]","2007-05-23"
"math/9802017","Felshtyn","Alexander Fel'shtyn and Richard Hill","Trace Formulae, Zeta Functions, Congruences and Reidemeister Torsion in
  Nielsen Theory","21 pages, LATeX, 86 KB, no figures",,,"University Greifswald (January,1998)","math.DG math.AG",,"  In this paper we prove trace formulae for the Reidemeister number of a group
endomorphism. This result implies the rationality of the Reidemeister zeta
function in the following cases: the group is a direct product of a finite
group and a finitely generated Abelian group; the group is finitely generated,
nilpotent and torsion free. We continue to study analytical properties of the
Nielsen zeta function. We connect the Reidemeister zeta function of an
endomorphism of a direct product of a finite group and a finitely generated
free Abelian group with the Lefschetz zeta function of the induced map on the
unitary dual of the group. As a consequence we obtain a relation between a
special value of the Reidemeister zeta function and a certain Reidemeister
torsion. We also prove congruences for Reidemeister numbers of iterates of an
endomorphism of a direct product of a finite group and a finitely generated
free Abelian group which are the same as those found by Dold for Lefschetz
numbers.
","[{""version"":""v1"",""created"":""Wed, 4 Feb 1998 11:07:01 GMT""}]","2007-05-23"
"math/9802018","Mahmoud Nikbakht-Tehrani","M. Nikbakht-Tehrani","On the Cohomology of Twisting Sheaves on Toric Varieties","LaTex, 20 pages",,,"TUW-98-04","math.AG hep-th",,"  Using the homogeneous coordinate ring construction of a toric variety IP
defined by a complete simplicial fan and the methods of local cohomology theory
we develop a framework for the calculation of cohomology groups H^{*}(IP, O(p))
of twisting sheaves O(p) on IP.
","[{""version"":""v1"",""created"":""Wed, 4 Feb 1998 11:14:09 GMT""}]","2007-05-23"
"math/9802019","Peternel","Thomas Peternell","Towards a Mori theory on compact Kaehler threefolds,II","plainTex,40pages",,,,"math.AG math.CV",,"  We prove the existence of a Mori contraction on a compact Kaehler threefold
whose canonical bundle is (analytically) not nef if the threefold can be
approximated by projective threefolds or if the algebraic dimension is 2.
","[{""version"":""v1"",""created"":""Wed, 4 Feb 1998 12:28:36 GMT""}]","2007-05-23"
"math/9802020","Si-jong Kwak","Sijong Kwak(KIAS, Seoul, Korea)","Castelnuovo-Mumford Regularity of Smoth Threefolds in P^5","AMSTeX; 15 pages; to appear in Crelle Journal",,,,"math.AG",,"  Castelnuovo-Mumford regularity is an important invariant of projective
algebraic varieties. A well known conjecture due to Eisenbud and Goto gives a
bound for regularity in terms of the codimension and degree,i.e.,
Castelnuovo-Mumford regularity of a given variety $X$ is less than or equal to
$deg(X)-codim(X)+1$. This regularity conjecture (including classification of
examples on the boundary) was verified for integral curves (Castelnuovo,
Gruson, Lazarsfeld and Peskine), and for smooth surfaces (Pinkham, Lazarsfeld).
In this paper we prove that $reg(X) \le deg(X)-1$ for smooth threefolds $X$ in
P^5 and that the only varieties on the boundary are the Segre threefold and the
complete intersection of two quadrics. Furthermore, every smooth threefold $X$
in P^5 is $k$-normal for all $k \ge deg(X)-4$, which is the optimal bound as
the Palatini 3-fold of degree 7 shows.
","[{""version"":""v1"",""created"":""Wed, 4 Feb 1998 12:51:31 GMT""}]","2007-05-23"
"nucl-th/9802011","Daniel Gomez Dumm","J. Bernabeu, D. Gomez Dumm, G. Orlandini","Electric polarizability of nuclei from a longitudinal sum rule","9 pages, revtex. Minor changes, two references added. To appear in
  Nucl. Phys. A","Nucl.Phys. A634 (1998) 463-471","10.1016/S0375-9474(98)00166-3","FTUV/98-10, IFIC-98/10","nucl-th",,"  The nuclear electric polarizability is theoretically analyzed using a sum
rule derived from the longitudinal part of the forward Compton amplitude.
Beyond the leading dipole contribution, this approach leads to the presence of
potential-dependent terms that do not show up in previous analyses. The
significance of these new contributions is illustrated by performing an
explicit calculation for a proton-neutron system interacting via a separable
potential.
","[{""version"":""v1"",""created"":""Tue, 3 Feb 1998 17:32:54 GMT""},{""version"":""v2"",""created"":""Thu, 12 Mar 1998 14:44:16 GMT""}]","2009-10-31"
"nucl-th/9802012","Bogdan Mihaila","Bogdan Mihaila, Jochen H. Heisenberg","Computation of Two-Body Matrix Elements From the Argonne $v_{18}$
  Potential","19 pages, TeX",,,"UNH-NPG-98-01","nucl-th",,"  We discuss the computation of two-body matrix elements from the Argonne
$v_{18}$ interaction. The matrix elements calculation is presented both in
particle-particle and in particle-hole angular momentum coupling. The
procedures developed here can be applied to the case of other NN potentials,
provided that they have a similar operator format.
","[{""version"":""v1"",""created"":""Tue, 3 Feb 1998 21:11:09 GMT""}]","2007-05-23"
"nucl-th/9802014","Witold Nazarewicz","T. Vertse, A.T. Kruppa, R.J. Liotta, W. Nazarewicz, N. Sandulescu, and
  T.R. Werner","Shell corrections for finite depth potentials: Particle continuum
  effects","18 pages, 8 figures","Phys.Rev.C57:3089-3098,1998","10.1103/PhysRevC.57.3089",,"nucl-th",,"  Shell corrections of finite, spherical, one-body potentials are analyzed
using a smoothing procedure which properly accounts for the contribution from
the particle continuum, i.e., unbound states. Since the plateau condition for
the smoothed single-particle energy seldom holds, a new recipe is suggested for
the definition of the shell correction. The generalized Strutinsky smoothing
procedure is compared with the results of the semi-classical Wigner-Kirkwood
expansion. A good agreement has been found for weakly bound nuclei in the
vicinity of the proton drip line. However, some deviations remain for extremely
neutron-rich systems due to the pathological behavior of the semi-classical
level density around the particle threshold.
","[{""version"":""v1"",""created"":""Wed, 4 Feb 1998 15:49:38 GMT""}]","2008-11-26"
"physics/9802006","Yuri Arestov","Yu. Arestov (Institute for High Energy Physics, Protvino)","RAMPEX - a new spin experiment (presented for HELION97, 20-24 Jan 1997,
  Kobe, Japan)","8 pages, 1 figure","Nucl.Instrum.Meth. A402 (1998) 298-302","10.1016/S0168-9002(97)00853-X","IHEP-CONF-97-1","physics.ins-det hep-ex",,"  RAMPEX - Russian-AMerican Polarization EXperiment - is dedicated to studies
of one-spin asymmetries which have twist-3 and also twist-2 origin, in hard and
semi-hard inclusive processes on the polarized propane-diol target. A special
consideration has been given for the prospects of using polarized 3He target.
The studies will be performed at the Serpukhov accelerator at 70 GeV/c (proton
beam) and 40 GeV/c (pi- beam).
","[{""version"":""v1"",""created"":""Wed, 4 Feb 1998 00:20:27 GMT""}]","2009-10-31"
"physics/9802007","Dongsu Bak","Dongsu Bak, Sang Pyo Kim, Sung Ku Kim, Kwang-Sup Soh and Jae Hyung Yee","Fractal Diffraction Grating","7 pages",,,"SNUTP-97-172, UOSTP-98-101","physics.optics math-ph math.MP",,"  We consider an optical diffraction grating in which the spatial distribution
of open slits forms a fractal set. The Fraunhofer diffraction patterns through
the fractal grating are obtained analytically for the simplest triad Cantor
type and its generalized version. The resulting interference patterns exhibit
characteristics of the original fractals and their scaling properties.
","[{""version"":""v1"",""created"":""Wed, 4 Feb 1998 04:25:57 GMT""}]","2007-05-23"
"physics/9802008","Joseph Hope","J.J. Hope, G.M. Moy and C.M. Savage","The steady state of a pumped and damped atom laser","1 postscript figure, uses revtex.sty This paper has been withdrawn,
  as further work has shown that an atom laser as described by the model herein
  *does not have a steady state*, so it doesn't matter much what it would look
  like",,,"AN6353","physics.atom-ph",,"  This paper has been withdrawn, as further work has shown that an atom laser
as described by the model herein does not have a steady state, so it doesn't
matter much what it would look like.
","[{""version"":""v1"",""created"":""Wed, 4 Feb 1998 05:42:37 GMT""},{""version"":""v2"",""created"":""Thu, 14 May 1998 04:05:00 GMT""}]","2007-05-23"
