"physics/9802009","Rudolf A. Roemer","U. Elsner, V. Mehrmann, F. Milde, R. A. Roemer, and M. Schreiber","The Anderson model of localization: a challenge for modern eigenvalue
  methods","16 LaTeX pages with 3 figures included","SIAM Journal on Scientific Computing, 20(6), 2089-2102 (1999)","10.1137/S1064827598332217","Sfb393/97-31","physics.comp-ph",,"  We present a comparative study of the application of modern eigenvalue
algorithms to an eigenvalue problem arising in quantum physics, namely, the
computation of a few interior eigenvalues and their associated eigenvectors for
the large, sparse, real, symmetric, and indefinite matrices of the Anderson
model of localization. We compare the Lanczos algorithm in the 1987
implementation of Cullum and Willoughby with the implicitly restarted Arnoldi
method coupled with polynomial and several shift-and-invert convergence
accelerators as well as with a sparse hybrid tridiagonalization method. We
demonstrate that for our problem the Lanczos implementation is faster and more
memory efficient than the other approaches. This seemingly innocuous problem
presents a major challenge for all modern eigenvalue algorithms.
","[{""version"":""v1"",""created"":""Wed, 4 Feb 1998 10:20:37 GMT""}]","2020-05-04"
"physics/9802010","Julio Guerrero","J. Guerrero (U. of Naples) and V. Aldaya (CSIC - U. of Granada)","A Perturbative Approach to the Relativistic Harmonic Oscillator","9 pages, latex, no figures","Mod.Phys.Lett. A14 (1999) 1689-1699","10.1142/S0217732399001784",,"math-ph hep-th math.MP",,"  A quantum realization of the Relativistic Harmonic Oscillator is realized in
terms of the spatial variable $x$ and ${\d\over \d x}$ (the minimal canonical
representation). The eigenstates of the Hamiltonian operator are found (at
lower order) by using a perturbation expansion in the constant $c^{-1}$. Unlike
the Foldy-Wouthuysen transformed version of the relativistic hydrogen atom,
conventional perturbation theory cannot be applied and a perturbation of the
scalar product itself is required.
","[{""version"":""v1"",""created"":""Wed, 4 Feb 1998 10:47:27 GMT""}]","2009-10-31"
"quant-ph/9802013","Gennady Berman","Gennady P. Berman, Gary D. Doolen, Gustavo V. L\'opez, V.I.
  Tsifrinovich","Generalized Quantum Control-Not Gate in Two-Spin Ising System","8 pages, 4 figures",,,,"quant-ph",,"  The physical implementation of the quantum Control-Not gate for a two-spin
system is investigated numerically. The concept of a generalized quantum
Control-Not gate, with arbitrary phase shift, is introduced. It is shown that a
resonant $\pi$-pulse provides a simple example of a generalized quantum
Control-Not gate.
","[{""version"":""v1"",""created"":""Tue, 3 Feb 1998 22:10:51 GMT""}]","2009-09-25"
"quant-ph/9802014","S. E. Massen","S.E. Massen and C.P. Panos","Universal property of the information entropy in atoms, nuclei and
  atomic clusters","3 pages, REVTEX, one figure","Phys.Lett. A246 (1998) 530-533","10.1016/S0375-9601(98)00524-6","THES-TP 98/01","quant-ph",,"  The position- and momentum-space information entropies of the electron
distributions of atomic clusters are calculated using a Woods-Saxon single
particle potential. The same entropies are also calculated for nuclear
distributions according to the Skyrme parametrization of the nuclear mean
field. It turns out that a similar functional form S=a+b ln N for the entropy
as function of the number of particles N holds approximately for atoms, nuclei
and atomic clusters. It is conjectured that this is a universal property of a
many-fermion system in a mean field. It is also seen that there is an analogy
of our expression for S to Boltzmann's thermodynamic entropy S=k ln W.
","[{""version"":""v1"",""created"":""Wed, 4 Feb 1998 13:01:37 GMT""}]","2009-10-31"
