"hep-ph/9804252","Andrzej Czarnecki","Andrzej Czarnecki and William J. Marciano","Electroweak radiative corrections to b --> s gamma","updated version, to appear in Phys. Rev. Lett","Phys.Rev.Lett. 81 (1998) 277-280","10.1103/PhysRevLett.81.277","BNL-HET-98/11","hep-ph",,"  Two loop electroweak corrections to b --> s gamma decays are computed.
Fermion and photonic loop effects are found to reduce R = BR(b --> s
gamma)/BR(b --> c e nu) by 8+-2% and lead to the standard model prediction BR(B
--> X_s gamma)=(3.28 +- 0.30)x10^-4 for inclusive B meson decays. Comparison of
R^{theory} =(3.04 +- 0.25)x10^-3(1+0.10rho), where rho is a Wolfenstein CKM
parameter, with the current experimental average R^{exp}=(2.52+-0.52)x10^-3
gives rho=-1.7+-1.9 which is consistent with -0.21<rho<0.27 obtained from other
B and K physics constraints.
","[{""version"":""v1"",""created"":""Tue, 7 Apr 1998 22:57:22 GMT""},{""version"":""v2"",""created"":""Mon, 1 Jun 1998 21:52:19 GMT""}]","2009-10-31"
"hep-ph/9804253","Robert Fleischer","Amol Dighe (ICTP), Isard Dunietz (Fermilab), Robert Fleischer (CERN)","Extracting CKM Phases and $B_s - \bar{B}_s$ Mixing Parameters from
  Angular Distributions of Non-Leptonic B Decays","31 pages, LaTeX, no figures","Eur.Phys.J.C6:647-662,1999","10.1007/s100520050372","CERN-TH/98-85, FERMILAB-PUB-98/093-T, IC/98/25","hep-ph",,"  Suggestions for efficiently determining the lifetimes and mass difference of
the light and heavy $B_s$ mesons ($B_s^L, B_s^H$) from $B_s \to J/ \psi \phi,
D_s^{*+}D_s^{*-}$ decays are given. Using appropriate weighting functions for
the angular distributions of the decay products (moment analysis), one can
extract $(\Gamma_H, \Gamma_L, \Delta m)_{B_s}$. Such a moment analysis allows
the determination of the relative magnitudes and phases of the CP-odd and
CP-even decay amplitudes. Efficient determinations of CP-violating effects
occuring in $B_s \to J/\psi \phi, D_s^{*+} D_s^{*-}$ are discussed in the light
of a possible width difference $(\Delta \Gamma)_{B_s}$, and the utility of this
method for $B \to J/\psi K^*, D^{\ast +}_s \bar D^{\ast}$ decays is noted.
Since our approach is very general, it can in principle be applied to all kinds
of angular distributions and allows the determination of all relevant
observables, including fundamental CKM (Cabibbo-Kobayashi-Maskawa) parameters,
as well as tests of various aspects of the factorization hypothesis. Explicit
angular distributions and weighting functions are given, and the general method
that can be used for any angular distribution is indicated.
","[{""version"":""v1"",""created"":""Wed, 8 Apr 1998 07:46:09 GMT""}]","2014-11-17"
"hep-ph/9804254","Robert Fleischer","Amol Dighe (ICTP), Isard Dunietz (Fermilab), Robert Fleischer (CERN)","Resolving a Discrete Ambiguity in the CKM Angle $\beta$ through $B_{u,d}
  \to J/\psi K^\ast$ and $B_s \to J/\psi \phi$ Decays","5 pages, LaTeX, no figures","Phys.Lett. B433 (1998) 147-149","10.1016/S0370-2693(98)00680-7","CERN-TH/98-123, FERMILAB-PUB-98/101-T, IC/98/34","hep-ph",,"  It is well known that $\sin(2\beta)$, where $\beta$ is one of the angles of
the unitarity triangle of the CKM matrix, can be determined in a theoretically
clean way by measuring mixing-induced CP violation in the decay $B_d \to J/\psi
K_S$. Another clean extraction of this CKM angle is provided by the
time-dependent angular distribution for the decay products of $B_d \to
J/\psi(\to l^+l^-) K^{\ast0}(\to \pi^0 K_S)$, where we have more observables at
our disposal than in the case of $B_d \to J/\psi K_S$, so that in addition to
$\sin(2\beta)$ also $\cos(2\beta)$ can be probed in a direct way. Unfortunately
a sign ambiguity remains in $\cos(2\beta)$. If it could be resolved, a discrete
ambiguity in the extraction of the CKM angle $\beta$ could be resolved as well,
which would allow a more incisive test of the CKM model of CP violation. This
note shows that detailed time-dependent studies of $B_{u,d} \to J/\psi
K^{\ast}$ and $B_s \to J/\psi \phi$ decay processes can determine the sign of
$\cos(2\beta)$, thereby removing the corresponding ambiguity in the extraction
of the CKM angle $\beta$.
","[{""version"":""v1"",""created"":""Wed, 8 Apr 1998 07:49:15 GMT""}]","2009-10-31"
"hep-ph/9804255","Kari Rummukainen","M. Laine (1) and K. Rummukainen (2) ((1) CERN, (2) Nordita)","A Strong Electroweak Phase Transition up to m_H ~ 105 GeV","4 pages, 3 figures","Phys.Rev.Lett.80:5259-5262,1998","10.1103/PhysRevLett.80.5259","CERN-TH/98-121, NORDITA-98/28P","hep-ph hep-lat",,"  Non-perturbative lattice simulations have shown that there is no electroweak
phase transition in the Standard Model for the allowed Higgs masses, m_H \gsim
75 GeV. In the Minimal Supersymmetric Standard Model, in contrast, it has been
proposed that the transition should exist and even be strong enough for
baryogenesis up to m_H ~ 105 GeV, provided that the lightest stop mass is in
the range 100...160 GeV. However, this prediction is based on perturbation
theory, and suffers from a noticeable gauge parameter and renormalization scale
dependence. We have performed large-scale lattice Monte Carlo simulations of
the MSSM electroweak phase transition. Extrapolating the results to the
infinite volume and continuum limits, we find that the transition is in fact
stronger than indicated by 2-loop perturbation theory. This guarantees that the
perturbative Higgs mass bound m_H ~ 105 GeV is a conservative one, allows
slightly larger stop masses (up to ~ 165 GeV), and provides a strong motivation
for further studies of MSSM electroweak baryogenesis.
","[{""version"":""v1"",""created"":""Wed, 8 Apr 1998 09:29:36 GMT""}]","2011-05-05"
"hep-ph/9804256","Marek Pawlowski","Marek Pawlowski","Gauge theory of phase and scale","11 pages, latex, no figures; invited talk given at the international
  workshop ""Macroscopic Electrodynamics II"", Krakow, November 97; proceedings
  to be published in Turkish J. of Physics","Turk.J.Phys.23:895-902,1999",,,"hep-ph astro-ph gr-qc hep-th",,"  The old Weyl's idea of scale recalibration freedom and the Infeld and van der
Waerden (IW) ideas concerning geometrical interpretation of the natural spinor
phase gauge symmetry are discussed in the context of moderm models of
fundamental particle interactions. It is argued that IW gauge symmetry can be
naturaly identified with U(1) symmetry of Weinberg-Salam model. It is also
argued that there are no serious reasons to reject Weyl's gauge theory from the
considerations. Its inclusion enriches the original Weinberg-Salam theory and
leads to predictions of new phenomena that do not contradict experiments.
","[{""version"":""v1"",""created"":""Wed, 8 Apr 1998 10:14:22 GMT""}]","2011-04-20"
"hep-ph/9804257",,"Samim Erhan and Peter E. Schlein","Evidence for xi- and t-dependent damping of the Pomeron Flux in the
  proton","19 pages, 7 Encapsulated Postscript figures, LaTex, Phys. Lett. B (in
  press - 1998)","Phys.Lett. B427 (1998) 389-397","10.1016/S0370-2693(98)00405-5",,"hep-ph",,"  We show that a triple-Regge parametrization of inclusive single diffraction
agrees with the data in the following two domains: (a) xi > 0.03 at all t, (b)
|t| > 1 GeV^2 at all xi. Since the triple-Regge parametrization fails when
applied to the full xi-t range of the total single-diffractive cross section,
we conclude that damping occurs only at low-xi and low-|t|. We give a (``toy'')
parametrization of the damping factor, D(xi), valid at low-|t|, which describes
the diffractive differential cross-section (dsig/dt) data at the ISR and
roughly accounts for the observed s-dependence of diffractive total
cross-section up to Tevatron energies. However, an effective damping factor
calculated for the CDF fitted function for dsig/dxidt at sqrt(s} = 1800 GeV and
|t| = 0.05 GeV^2, suggests that, at fixed-xi, damping increases as s increases.
  We conjecture that, in the regions where the triple-Regge formalism describes
the data and there is no evidence of damping, factorization is valid and the
Pomeron-flux-factor may be universal. With the assumption that the observed
damping is due to multi-Pomeron exchange, our results imply that the recent UA8
demonstration that the effective Pomeron trajectory flattens for |t| > 1 GeV$^2
is evidence for the onset of the perturbative 2-gluon pomeron. Our damping
results may also shed some light on the self-consistency of recent measurements
of hard-diffractive jet production cross sections in the UA8, CDF and ZEUS
experiments.
","[{""version"":""v1"",""created"":""Wed, 8 Apr 1998 13:02:26 GMT""}]","2009-10-31"
"hep-ph/9804258","Pavel Nadolsky","Chong Sheng Li, P. Nadolsky, C.-P. Yuan, Hong-Yi Zhou","Signatures of the light gluino in the top quark production","23 pages, 5 Postscript figures","Phys.Rev.D58:095004,1998","10.1103/PhysRevD.58.095004","MSUHEP-80226","hep-ph",,"  If a light gluino, with a mass of the order of GeV, exists in the minimal
supersymmetric extension of the Standard Model, then it can contribute to the
production rate of the top quark pairs at hadron colliders via the process
gluino + gluino --> t + tbar. Because the top quark is heavy, the masses of the
superpartners of the left-handed and right-handed top quarks can be very
different such that a parity-violating observable can be induced at the tree
level. We discuss the phenomenology of this parity violating asymmetry at the
CERN Large Hadron Collider.
","[{""version"":""v1"",""created"":""Wed, 8 Apr 1998 14:44:18 GMT""}]","2008-11-26"
"hep-ph/9804259","Subhendra Mohanty","Subhendra Mohanty and Utpal Sarkar","Constraints on background torsion field from K physics","12 pages latex file","Phys.Lett. B433 (1998) 424-428","10.1016/S0370-2693(98)00735-7","IC/98/34","hep-ph",,"  We point out that a background torsion field will produce an effective
potential to the $K$ and $\bar{K}$ with opposite signs. This allows us to
constrain the background torsion field from the $K_L$ and $K_S$ mass
difference, CPT violating $K^\circ$ and $\bar{K^\circ}$ mass difference and the
CP violating quantities $\epsilon$ and $\eta_{+-}$. The most stringent bound on
the cosmological background torsion $< T^0 > < 10^{-25}$ GeV comes from the
direct measurement of the CPT violation.
","[{""version"":""v1"",""created"":""Wed, 8 Apr 1998 14:10:33 GMT""}]","2016-09-06"
"hep-th/9804055","Alexey Deriglazov","A.A. Deriglazov and D.M. Gitman","Green-Schwarz type formulation of D=11 S - invariant superstring and
  superparticle actions","Revised version, in particular, discussion of SO(2,9) case is
  included. To be published in Int. J. Mod. Phys. A",,"10.1142/S0217751X9900138X",,"hep-th",,"  A manifestly Poincare invariant formulations for $SO(1,10)$ and SO(2,9)
superstring actions are proposed. The actions are invariant under a local
fermionic $\kappa$-symmetry as well as under a number of global symmetries,
which turn out to be on-shell realization of the known ``new supersymmetry``
S-algebra. Canonical quantization of the theory is performed and relation of
the quantum state spectrum with that of type IIA Green-Schwarz superstring is
discussed. Besides, a mechanical model is constructed, which is a zero tension
limit of the D=11 superstring and which incorporates all essential features of
the latter. A corresponding action invariant under off-shell closed realization
of the S-algebra is obtained.
","[{""version"":""v1"",""created"":""Tue, 7 Apr 1998 17:40:20 GMT""},{""version"":""v2"",""created"":""Sat, 31 Jul 1999 15:21:05 GMT""}]","2009-10-31"
"hep-th/9804056","Dr Mario Trigiante","F. Cordaro, P. Fre', L. Gualtieri, P. Termonia, M.Trigiante","N=8 gaugings revisited: an exhaustive classification","1 LaTeX file, 41 pages, 3 eps-figures","Nucl.Phys. B532 (1998) 245-279","10.1016/S0550-3213(98)00449-0",,"hep-th",,"  In this paper we reconsider, for N=8 supergravity, the problem of gauging the
most general electric subgroup.
  We show that admissible theories are fully characterized by a single
algebraic equation to be satisfied by the embedding of the gauge group G within
the electric subalgebra SL(8,\IR) of E_{7(7)}. The complete set of solutions to
this equation contains 36 parameters. Modding by the action of SL(8,\IR)
conjugations that yield equivalent theories all continuous parameters are
eliminated except for an overall coupling constant and we obtain a discrete set
of orbits. This set is in one--to--one correspondence with 36 Lie subalgebras
of SL(8,\IR), corresponding to all possible real forms of the SO(8) Lie algebra
plus a set of contractions thereof. By means of our analysis we establish the
theorem that the N=8 gaugings constructed by Hull in the middle eighties
constitute the exhaustive set of models. As a corollary we show that there
exists a unique 7--dimensional abelian gauging. The corresponding abelian
algebra is not contained in the maximal abelian ideal of the solvable Lie
algebra generating the scalar manifold E_{7(7)}/SU(8).
","[{""version"":""v1"",""created"":""Tue, 7 Apr 1998 17:55:32 GMT""}]","2009-10-31"
"hep-th/9804057","Zachary Guralnik","Z. Guralnik","Duality of large N Yang-Mills Theory on $T^2 \times R^n$","17 pages, harvmac, reference added",,,"PUPT-1763","hep-th",,"  We find aspects of electrically confining large $N$ Yang-Mills theories on
$T^2 \times R^{d-2}$ which are consistent with a $GL(2,Z)$ duality. The modular
parameter associated with this $GL(2,Z)$ is given by ${m\over N} + i\Lambda^2
A$, where $A$ is the area of the torus, $m$ is the t'Hooft twist on the torus,
and $\Lambda^2$ is the string tension. $N$ is taken to infinity keeping $m\over
N$ and $g^2N$ fixed. This duality may be interpreted as T-duality of the QCD
string if one identifies the magnetic flux with a two-form background in the
string theory. Our arguments make no use of supersymmetry. While we are not
able to show that this is an exact self duality of conventional QCD, we
conjecture that it may be applicable within the universality class of QCD. We
discuss the status of the conjecture for the soluble case of pure two
dimensional Euclidean QCD on $T^2$, which is almost but not exactly self dual.
For higher dimensional theories, we discuss qualitative features consistent
with duality. For $m=0$, such a duality would lead to an equivalence between
pure QCD on $R^4$ and QCD on $R^2$ with two adjoint scalars. When $\Lambda^2 A
<< m^2/N^2$, the proposed duality includes exchanges of rank with twist. This
exchange bears some resemblance, but is not equivalent, to Nahm duality. A
proposal for an explicit perturbative map which implements duality in this
limit is discussed.
","[{""version"":""v1"",""created"":""Tue, 7 Apr 1998 21:30:04 GMT""},{""version"":""v2"",""created"":""Mon, 13 Apr 1998 16:58:44 GMT""}]","2007-05-23"
"hep-th/9804058","Alec Matusis","Daniel Z. Freedman, Samir D. Mathur, Alec Matusis, Leonardo Rastelli","Correlation functions in the CFT(d)/AdS(d+1) correpondence","27 pages, LaTex, 1 eps figure, few misprints corrected, references
  added","Nucl.Phys.B546:96-118,1999","10.1016/S0550-3213(99)00053-X","MIT-CTP-2727","hep-th",,"  Conformal techniques are applied to the calculation of integrals on AdS(d+1)
space which define correlators of composite operators in the superconformal
field theory on the d-dimensional boundary. The 3-point amplitudes for scalar
fields of arbitrary mass and gauge fields in the AdS supergravity are
calculated explicitly. For 3 gauge fields we compare in detail with the known
conformal structure of the SU(4) flavor current correlator <J_i^a J_j^b J_k^c>
of the N=4, d=4 SU(N) SYM theory. Results agree with the free field
approximation as would be expected from superconformal non-renormalization
theorems. In studying the Ward identity relating <J_i^a O^I O^J> to <O^I O^J>
for (non-marginal) scalar composite operators O^I, we find that there is a
subtlety in obtaining the normalization of <O^I O^J> from the supergravity
action integral.
","[{""version"":""v1"",""created"":""Tue, 7 Apr 1998 22:24:43 GMT""},{""version"":""v2"",""created"":""Fri, 25 Sep 1998 02:34:23 GMT""}]","2009-10-08"
"hep-th/9804059","Duiliu Diaconescu","Duiliu-Emanuel Diaconescu, Sergei Gukov","Three Dimensional N=2 Gauge Theories and Degenerations of Calabi-Yau
  Four-Folds","subsections on Sp(N) and Spin(2N+1) theories removed, 32 pages,
  harvmac, 6 postscript figures","Nucl.Phys. B535 (1998) 171-196","10.1016/S0550-3213(98)00597-5","Ru-98-11, PUPT-1780, ITEP-TH-52/97, Landau-97-TMP-4","hep-th",,"  Three dimensional N=2 gauge theories with arbitrary gauge group and
fundamental flavors are engineered from degenerations of Calabi-Yau four-folds.
We show how Coulomb and Higgs branches emerge in the geometric picture. The
analysis of instanton generated superpotentials unravels interesting aspects of
the five-brane effective action in M theory.
","[{""version"":""v1"",""created"":""Tue, 7 Apr 1998 21:55:33 GMT""},{""version"":""v2"",""created"":""Wed, 15 Apr 1998 16:51:54 GMT""},{""version"":""v3"",""created"":""Tue, 21 Jul 1998 14:04:02 GMT""}]","2009-10-31"
"hep-th/9804060","Jaime Gomis","Rami Entin and Jaume Gomis (Rutgers University)","Spectrum of Chiral Operators in Strongly Coupled Gauge Theories","harvmac, 16 pages, one acknowledgement added","Phys.Rev.D58:105008,1998","10.1103/PhysRevD.58.105008","RU-98-12","hep-th",,"  We analyze the large $N$ spectrum of chiral primary operators of three
dimensional fixed points of the renormalization group. Using the space-time
picture of the fixed points and the correspondence between anti-de Sitter
compactifications and conformal field theories we are able to extract the
dimensions of operators in short superconformal multiplets. We write down some
of these operators in terms of short distance theories flowing to these
non-trivial fixed points in the infrared.
","[{""version"":""v1"",""created"":""Tue, 7 Apr 1998 23:51:04 GMT""},{""version"":""v2"",""created"":""Wed, 15 Apr 1998 22:14:15 GMT""}]","2014-11-18"
"hep-th/9804063","Robert Andrew Weston","Jin Hong, Seok-Jin Kang, Tetsuji Miwa and Robert Weston","Mixing of Ground States in Vertex Models","12 pages, LaTeX, typos corrected","J.Phys. A31 (1998) L515-L525","10.1088/0305-4470/31/28/001",,"hep-th math.QA",,"  We consider the analogue of the 6-vertex model constructed from alternating
spin n/2 and spin m/2 lines, where $1\leq n<m$. We identify the transfer matrix
and the space on which it acts in terms of the representation theory of
$U_q(sl_2)$. We diagonalise the transfer matrix and compute the S-matrix. We
give a trace formula for local correlation functions. When n=1, the 1-point
function of a spin m/2 local variable for the alternating lattice with a
particular ground state is given as a linear combination of the 1-point
functions of the pure spin m/2 model with different ground states. The mixing
ratios are calculated exactly and are expressed in terms of irreducible
characters of $U_q(sl_2)$ and the deformed Virasoro algebra.
","[{""version"":""v1"",""created"":""Wed, 8 Apr 1998 10:09:21 GMT""},{""version"":""v2"",""created"":""Fri, 10 Apr 1998 09:53:19 GMT""},{""version"":""v3"",""created"":""Tue, 16 Jun 1998 13:54:53 GMT""}]","2009-10-31"
"hep-th/9804064","G. Lopes Cardoso","Gabriel Lopes Cardoso","Charged Heterotic Black-Holes in Four and Two Dimensions","5 pages, Latex; minor changes","Phys.Lett. B432 (1998) 65-68","10.1016/S0370-2693(98)00612-1","THU-98/16","hep-th",,"  We consider four-dimensional charged black-holes occuring in toroidally
compactified heterotic string theory, whose ten-dimensional interpretation
involves a Kaluza-Klein monopole and a five-brane. We show that these
four-dimensional black-holes can be connected to two-dimensional charged
heterotic black-holes upon removal of the constants appearing in the harmonic
functions associated with the Kaluza-Klein monopole and the five-brane.
","[{""version"":""v1"",""created"":""Wed, 8 Apr 1998 12:03:08 GMT""},{""version"":""v2"",""created"":""Mon, 27 Apr 1998 18:09:11 GMT""}]","2009-10-31"
"hep-th/9804065","Harald Dorn","H. Dorn","The mass term in non-Abelian gauge field dynamics on matrix D-branes and
  T-duality in the $\sigma$-model approach","13 pages, Latex, some typos corrected","JHEP 9804:013,1998","10.1088/1126-6708/1998/04/013","HU Berlin-EP-98/21","hep-th",,"  The formal extension of the T-duality rules for open strings from Abelian to
non-Abelian gauge field background leads in a well known manner to the notion
of matrix valued D-brane position. The application of this concept to the
non-Abelian gauge field RG $\beta $-function of the corresponding $\sigma
$-model yields a mass term in the gauge field dynamics on the matrix D-brane.
The direct calculation in a corresponding D-brane model does $not$ yield such a
mass term, if the Dirichlet boundary condition is implemented as a constraint
on the integrand in the defining functional integral. However, the mass term
arises in the direct calculation for a D-brane model with dynamically realized
boundary condition.
","[{""version"":""v1"",""created"":""Wed, 8 Apr 1998 12:17:13 GMT""},{""version"":""v2"",""created"":""Thu, 16 Apr 1998 09:33:13 GMT""}]","2010-02-03"
"hep-th/9804066","Eric R. Sharpe","E. Sharpe","Conjectures on (0,2) Mirror Symmetry","21 pages, LaTex, 2 figures, title altered to avoid confusion with an
  older paper -- no other changes",,,"PUPT-1785","hep-th",,"  In this paper we conjecture a reformulation of the monomial-divisor mirror
map for (2,2) mirror symmetry, valid at a boundary of the moduli space, that is
easily extended to also include tangent bundle deformations -- an important
step towards understanding (0,2) mirror symmetry. We check our conjecture in a
few simple cases, and thereby illustrate how to perform calculations using a
description of sheaves recently published by Knutson, Sharpe.
","[{""version"":""v1"",""created"":""Wed, 8 Apr 1998 15:00:38 GMT""},{""version"":""v2"",""created"":""Tue, 14 Apr 1998 18:34:39 GMT""}]","2007-05-23"
"math/9804034","Andrew J. Sommese","Thomas Peternell, Michael Schneider, Andrew J. Sommese","Kodaira Dimension of Subvarieties",,,,,"math.AG math.CV",,"  In this article we study how the birational geometry of a normal projective
variety $X$ is influenced by a normal subvariety $A \subset X.$ One of the most
basic examples in this context is provided by the following situation. Let
$f:X\to Y$ be a surjective holomorphic map with connected fibers between
compact connected complex manifolds. It is well known that given a general
fiber $A$ of $f$ we have $$ \kappa(X)\le \kappa(A)+\dim Y. $$ This article grew
out of the realization that this result should be true with $\dim Y$ replaced
by the codimension $\cod_X A$ for a pair $(X,A)$ consisting of a normal
subvariety $A$ of a compact normal variety $X$ under weak semipositivity
conditions on the normal sheaf of $A$ and the weak singularity condition
$\cod_A (A\cap\sing X)\ge 2$. We shall now state our main results in the
special case of a submanifold $A$ in a projective manifold $X$ and we also
simplify the semipositivity notion.
","[{""version"":""v1"",""created"":""Tue, 7 Apr 1998 16:17:11 GMT""}]","2007-05-23"
"math/9804035","Gia Giorgadze","Gia Giorgadze","On the Riemann-Hilbert Problems","40 pages",,,,"math.CV math.FA",,"  We discuss some topological aspects of the Riemann-Hilbert transmission
problem and Riemann-Hilbert monodromy problem on Riemann surfaces. In
particular, we describe the construction of a holomorphic vector bundle
starting from the given representation of the fundamental group and investigate
the local behaviour of connexions on this bundle. We give formulae for the
partial indices of the Riemann-Hilbert transmission problem in the
three-dimensional case in terms of the correspoding vector bundle on the
Riemann sphere.
","[{""version"":""v1"",""created"":""Tue, 7 Apr 1998 19:51:56 GMT""}]","2007-05-23"
"math/9804036","Mark Shimozono","Mark Shimozono, Jerzy Weyman","Graded characters of modules supported in the closure of a nilpotent
  conjugacy class","31 pages, AMS-LaTeX",,,"VPI-M-98-401","math.QA math.CO",,"  We study the Poincare polynomials of isotypic components of a natural family
of graded GL(n)-modules supported in the closure of a nilpotent conjugacy
class. These polynomials generalize the Kostka-Foulkes and are q-analogues of
Littlewood-Richardson coefficients corresponding to arbitrary tensor products
of irreducibles. Many properties and formulas for these polynomials are
derived, such as a generalized Morris recurrence, q-Kostant formula, and a
conjectural formula in terms of catabolizable tableaux and charge.
","[{""version"":""v1"",""created"":""Tue, 7 Apr 1998 19:56:51 GMT""}]","2007-05-23"
"math/9804037","Mark Shimozono","Mark Shimozono","A cyclage poset structure for Littlewood-Richardson tableaux","32 pages, AMS-LaTeX",,,"VPI-M-98-402","math.QA",,"  A graded poset structure is defined for the sets of Littlewood-Richardson
(LR) tableaux that count the multiplicity of an irreducible GL(n)-module in the
tensor product of irreducibles indexed by a sequence of rectangular partitions.
This poset generalizes the cyclage poset on column-strict tableaux defined by
Lascoux and Schutzenberger, and its grading function generalizes the charge
statistic. It is shown that the polynomials obtained by enumerating LR tableaux
by shape and the generalized charge, are the Poincare polynomials of isotypic
components of the certain modules supported in the closure of a nilpotent
conjugacy class.
","[{""version"":""v1"",""created"":""Tue, 7 Apr 1998 21:09:54 GMT""}]","2007-05-23"
