"cond-mat/9804087","John Tatini Titantah","J. T. Titantah and M. N. Hounkonnou","A quantum statistical mechanics model of a three dimensional linear
  rigid rotator in a bath of oscillators: IV - steady state dielectric
  properties induced by a. c. and d. c. field coupling","30 pages, 14 figures. Submitted to J. Phys. A: Math. and Gen",,"10.1088/0305-4470/32/6/005",,"cond-mat.stat-mech cond-mat.soft",,"  The long time effect of a radio frequency (rf) a.c. field superimposed on a
d.c. field on the electrical susceptibility and the Kerr optical functions of
polarisable fluids in inert solvent is analysed. The results obtained for the
classical Brownian limit, valid for dense solvent media, well reproduce
classical results published in the literature with excellent precisions in
inertia, density and temperature dependences. The low density limit yields
absorption-dispersion lines whose widths and shifts are density, inertia and
temperature dependent. While the low density and/or large inertia
susceptibility is explicitly written out as a continued fraction got by solving
an infinite hierarchy of differential coupled equations, that of the Kerr
effect is given in the form of successive convergents of the solutions of an
infinite hierarchy of differential difference triplets. The polarisation/a.c.
field phase difference is analysed. The effects of the constant field strength
and the a.c. field frequency on the Kerr function are explored. In this paper,
which will be named paper IV, the derivation of some quoted equations will
intensionally be left out as they exist in paper III (J. Phys. A, 30:6347,
1997) of which this work is its logical continuation.
","[{""version"":""v1"",""created"":""Tue, 7 Apr 1998 16:18:56 GMT""}]","2009-10-31"
"cond-mat/9804088","Tamara Nunner","T. S. Nunner, J. Schmalian, and K. H. Bennemann","Influence of Electron-Phonon Interaction on Spin Fluctuation Induced
  Superconductivity","11 pages, 12 figures",,"10.1103/PhysRevB.59.8859",,"cond-mat.supr-con",,"  We investigate the interplay of the electron-phonon and the spin fluctuation
interaction for the superconducting state of YBa$_2$Cu$_3$O$_{7}$. The spin
fluctuations are described within the nearly antiferromagnetic Fermi liquid
theory, whereas the phonons are treated using a shell model calculation of all
phonon branches. The electron-phonon coupling is calculated using rigidly
displaced ionic potentials screened by a background dielectric constant
$\epsilon_\infty$ and by holes within the CuO$_2$ planes. Taking into account
both interactions we get a superconducting state with $d_{x^2-y^2}$-symmetry,
whose origin are antiferromagnetic spin fluctuations. The investigation of all
phonon modes of the system shows that the phononic contribution to the d-wave
pairing interaction is attractive. This is a necessary prerequisite for a
positive isotope effect. The size of the isotope exponent depends strongly on
the relative strength of the electron-phonon and spin fluctuation coupling. Due
to the strong electronic correlations no phononic induced superconducting
state, which is always of s-wave character, is possible.
","[{""version"":""v1"",""created"":""Tue, 7 Apr 1998 20:20:25 GMT""},{""version"":""v2"",""created"":""Thu, 9 Apr 1998 09:27:53 GMT""},{""version"":""v3"",""created"":""Thu, 29 Oct 1998 14:48:52 GMT""}]","2009-10-31"
"cond-mat/9804089","Oliver Zobay","E. V. Goldstein, O. Zobay, P. Meystre","Field and density coherence of matter-wave fields","12 pages, 4 figures, Revtex",,,,"cond-mat quant-ph",,"  In analogy to Glauber's analysis of optical coherence, we adopt an
operational approach to introduce different classes of atomic coherence
associated with different types of measurements. For the sake of concreteness
we consider specifically fluorescence, nonresonant imaging, and ionization. We
introduce definitions of coherence appropriate to them, which we call
electronic, density, and field coherence, respectively. We illustrate these
concepts in various descriptions of Bose-Einstein condensation, showing that
each of these descriptions makes different implicit assumptions on the
coherence of the system. We also study the impact of elastic collision on the
field and density coherence properties of atom lasers.
","[{""version"":""v1"",""created"":""Tue, 7 Apr 1998 23:05:17 GMT""}]","2007-05-23"
"cond-mat/9804090","Edward H. rezayi","E. H. Rezayi and S. L. Sondhi","Coulomb and Hard Core Skyrmion Tails","Revtex 9 pages, figs.ps files at
  ftp://landau.calstatela.edu/pub/tailfigs",,"10.1142/S0217979299002368","CSULA-02-98","cond-mat.mes-hall",,"  Quantum Hall skyrmions are quantized solitons of a ferromagnetic O(3)
sigma-model. The reference, classical, solutions depend upon the interaction
between the electrons and exhibit completely different asymptotic profiles for
the physical Coulomb interaction than for the model hard core interaction
frequently used to generate variational wavefunctions. In this note we show, by
means of numerical calculations on (large) finite size systems at nu=1, that
this physically important difference, crucial for a sharp definition of their
statistics, persists for the quantized skyrmions at n=1.
","[{""version"":""v1"",""created"":""Tue, 7 Apr 1998 23:35:26 GMT""}]","2009-10-31"
"cond-mat/9804091","Dimitrios Vavylonis","Ben O'Shaughnessy (1) and Dimitrios Vavylonis (2) ((1) Dept. Chemical
  Engineering, Columbia Univ, (2) Dept. Physics, Columbia Univ)","Interfacial Reactions: Mixed Order Kinetics and Segregation Effects","11 pages, 2 figures (uses fund.sty). Numerical simulation results
  added, minor changes. Submitted to Phys. Rev. Lett","Phys. Rev. Lett., v.84, p.3193 (2000)","10.1103/PhysRevLett.84.3193",,"cond-mat.soft cond-mat.stat-mech",,"  We study A-B reaction kinetics at a fixed interface separating A and B bulks.
Initially, the number of reactions ${\cal R}_t \sim t n_A^\infty n_B^\infty$ is
2nd order in the far-field densities $n_A^\infty,n_B^\infty$. First order
kinetics, governed by diffusion from the dilute bulk, onset at long times:
${\cal R}_t\approx x_t n_A^\infty$ where $x_t\sim t^{1/z}$ is the rms molecular
displacement. Below a critical dimension, $d<d_c=z-1$, mean field theory is
invalid: a new regime appears, ${\cal R}_t\sim x_t^{d+1} n_A^\infty
n_B^\infty$, and long time A-B segregation (similar to bulk $A+B\gt\emptyset$)
leads to anomalous decay of interfacial densities. Numerical simulations for
$z=2$ support the theory.
","[{""version"":""v1"",""created"":""Wed, 8 Apr 1998 02:54:04 GMT""},{""version"":""v2"",""created"":""Tue, 2 Nov 1999 05:45:35 GMT""}]","2009-10-31"
"cond-mat/9804092",,"Claudius Gros and Ralph Werner (Dortmund)","Dynamics of the Peierls-active phonon modes in CuGeO_3","4 pages, 4 figures","Phys. Rev. B, Vol. 58, R14 677 (1998)","10.1103/PhysRevB.58.R14677",,"cond-mat",,"  We reconsider the Cross and Fischer approach to spin-Peierls transitions. We
show that a soft phonon occurs only if Omega_0<2.2 T_SP. For CuGeO_3 this
condition is not fulfilled and the calculated temperature dependence of the
Peierls-active phonon modes is in excellent agreement with experiment. A
central peak of a width ~0.2 meV is predicted at T_SP. Good agreement is found
between theory and experiment for the pretransitional Peierls-fluctuations.
Finally, we consider the problem of quantum criticality in CuGeO_3.
","[{""version"":""v1"",""created"":""Wed, 8 Apr 1998 07:28:19 GMT""}]","2009-10-31"
"cond-mat/9804093","Petr G. Silvestrov","P. G. Silvestrov (Budker Institute of Nuclear Physics, Novosibirsk)","Vortices in a cylinder: Localization after depinning","4 pages, REVTEX, 2 eps figures","Phys.Rev.Lett. 82 (1999) 3140-3143","10.1103/PhysRevLett.82.3140","BINP preprint 98-21","cond-mat.stat-mech chao-dyn cond-mat.supr-con hep-th nlin.CD",,"  Edge effects in the depinned phase of flux lines in hollow superconducting
cylinder with columnar defects and electric current along the cylinder are
investigated. Far from the ends of the cylinder vortices are distributed almost
uniformly (delocalized). Nevertheless, near the edges these free vortices come
closer together and form well resolved dense bunches. A semiclassical picture
of this localization after depinning is described. For a large number of
vortices their density $\rho(x)$ has square root singularity at the border of
the bunch ($\rho(x)$ is semicircle in the simplest case). However, by tuning
the strength of current, the various singular regimes for $\rho(x)$ may be
reached. Remarkably, this singular behaviour reproduces the phase transitions
discussed during the past decade within the random matrix regularization of
2d-Gravity.
","[{""version"":""v1"",""created"":""Wed, 8 Apr 1998 10:23:50 GMT""}]","2007-05-23"
"cond-mat/9804094","Luis Carlos Malacarne","L. R. Evangelista, L. C. Malacarne and R. S. Mendes","Quantum Corrections for Generalized Partition Functions","latex, 12 pages, to appears in Phys. A","Phys. A 253 (1998) 507","10.1016/S0378-4371(97)00617-1",,"cond-mat",,"  The classical limit for generalized partition functions is obtained using
coherent states. In this framework it is presented a general procedure to
obtain all the corrections to the classical limit. In particular, the first and
second order quantum corrections are worked out explicitly, and the classical
limit for the Tsallis thermostatistics is determined. The results of this work
generalize the ones obtained by E. Wigner (Phys. Rev. 40 (1932) 749) for usual
statistical mechanics.
","[{""version"":""v1"",""created"":""Wed, 8 Apr 1998 12:36:04 GMT""}]","2015-06-25"
"cond-mat/9804095","Luis Carlos Malacarne","E. K. Lenzi, L. C. Malacarne and R. S. Mendes","Perturbation and Variational Methods in Nonextensive Tsallis Statistics","revtex","Phys. Rev. Lett. 80, 218 (1998)","10.1103/PhysRevLett.80.218",,"cond-mat.stat-mech",,"  A unified presentation of the perturbation and variational methods for the
generalized statistical mechanics based on Tsallis entropy is given here. In
the case of the variational method, the Bogoliubov inequality is generalized in
a very natural way following the Feynman proof for the usual statistical
mechanics. The inequality turns out to be form-invariant with respect to the
entropic index $q$. The method is illustrated with a simple example in
classical mechanics. The formalisms developed here are expected to be useful in
the discussion of nonextensive systems.
","[{""version"":""v1"",""created"":""Wed, 8 Apr 1998 12:42:20 GMT""}]","2009-10-31"
"cond-mat/9804096","Tsutomu Momoi","Tsutomu Momoi and Kenn Kubo (University of Tsukuba)","Ferromagnetism in the Hubbard model with orbital degeneracy in infinite
  dimensions","4 pages, Revtex, 3 figures, corrected some typos and references, to
  be published in Phys. Rev. B (Rapid Communication)","Phys. Rev. B 58, R567 (1998)","10.1103/PhysRevB.58.R567",,"cond-mat.str-el",,"  We study the ferromagnetism due to orbital degeneracy in the Hubbard model in
infinite dimensions. The model contains the intraorbital repulsion $U$, the
interorbital repulsion $U^\prime$, the exchange $J$ (Hund coupling) and the
pair hopping $J^\prime$, where all of them originate from the on-site Coulomb
interaction. The ground state of the effective one-site problem was obtained by
exact diagonalizations. At the 1/4-filling, we found two insulating phases; one
is a ferromagnetic phase with alternating orbital order and the other is
antiferromagnetic one with uniform orbital order. If electrons are doped into
the 1/4-filling, the ferromagnetic phase still survives and becomes metallic,
while the antiferromagnetic phase disappears. This result indicates that the
double-exchange mechanism is relevant to stabilize metallic ferromagnetism in
infinite dimensions.
","[{""version"":""v1"",""created"":""Wed, 8 Apr 1998 13:28:14 GMT""},{""version"":""v2"",""created"":""Mon, 15 Jun 1998 13:53:31 GMT""}]","2009-10-31"
"cond-mat/9804097","User Prokofev Nikolai V. Prokof'ev","Nikolai V. Prokof'ev and Boris V. Svistunov","Polaron Problem by Diagrammatic Quantum Monte Carlo","Latex, 4 pages, 5 figures","Phys. Rev. Lett. 81, p. 2514 (1998).","10.1103/PhysRevLett.81.2514","TOISFFT-980405","cond-mat",,"  We present a precise solution of the polaron problem by a novel Monte Carlo
method. Basing on conventional diagrammatic expansion for the Green function of
the polaron, $G({\bf k}, \tau)$, we construct a process of generating
continuous random variables ${\bf k}$ and $\tau$, with the distribution
function exactly coinciding with $G({\bf k}, \tau)$. The polaron spectrum is
extracted from the asymptotic behavior of the Green function. We compare our
results for the polaron energy with the variational treatment of Feynman, and
for the first time present precise dispersion curve which features an ending
point at finite momentum.
","[{""version"":""v1"",""created"":""Wed, 8 Apr 1998 13:00:57 GMT""}]","2009-10-31"
"cond-mat/9804098","Antonio Trovato","A. Trovato, J. van Mourik and A. Maritan (SISSA/ISAS - International
  School of Advanced Studies and INFM, Trieste, Italy)","Swollen-Collapsed Transition in Random Hetero-Polymers","13 pages, 8 figures; revised version with minor changes, accepted for
  publication in European Physical Journal B",,"10.1007/s100510050527",,"cond-mat.stat-mech",,"  A lattice model of a hetero-polymer with random hydrophilic-hydrophobic
charges interacting with the solvent is introduced, whose continnuum
counterpart has been proposed by T. Garel, L. Leibler and H. Orland {J. Phys.
II France 4, 2139 (1994)]. The transfer matrix technique is used to study
various constrained annealed systems which approximate at various degrees of
accuracy the original quenched model. For highly hydrophobic chains an ordinary
$\theta$-point transition is found from a high temperature swollen phase to a
low temperature compact phase. Depending on the type of constrained averages,
at very low temperatures a swollen phase or a coexistence between compact and
swollen phases are found. The results are carefully compared with the
corresponding ones obtained in the continuum limit, and various improvements in
the original calculations are discussed.
","[{""version"":""v1"",""created"":""Wed, 8 Apr 1998 14:40:35 GMT""},{""version"":""v2"",""created"":""Tue, 14 Apr 1998 17:39:20 GMT""},{""version"":""v3"",""created"":""Mon, 27 Jul 1998 16:35:15 GMT""}]","2009-10-31"
"cond-mat/9804099","Remi Monasson","G.Biroli and R.Monasson","Relationship between long time scales and the static free-energy in the
  Hopfield model","5 pages RevTex file, accepted for publication in J.Phys.A","J. Phys. A: Math. Gen. 31 No 21 (29 May 1998)L391-L396","10.1088/0305-4470/31/21/001",,"cond-mat.dis-nn",,"  The Glauber dynamics of the Hopfield model at low storage level is
considered. We analytically derive the spectrum of relaxation times for large
system sizes. The longest time scales are gathered in families, each family
being in one to one correspondence with a stationary (not necessarily stable)
point of the static mean-field free-energy. Inside a family, the time scales
are given by the reciprocals (of the absolute values) of the eigenvalues of the
free-energy Hessian matrix.
","[{""version"":""v1"",""created"":""Wed, 8 Apr 1998 15:09:45 GMT""}]","2009-10-31"
"cond-mat/9804100","Luis Amaral","Youngki Lee (BU), Luis A. N. Amaral (MIT), David Canning (HIID),
  Martin Meyer (BU), and H. Eugene Stanley (BU)","Universal features in the growth dynamics of complex organizations","4 pages, 7 ps figures, using Latex2e with epsf rotate and multicol
  style files. Submitted to PRL",,"10.1103/PhysRevLett.81.3275",,"cond-mat.stat-mech q-fin.GN",,"  We analyze the fluctuations in the gross domestic product (GDP) of 152
countries for the period 1950--1992. We find that (i) the distribution of
annual growth rates for countries of a given GDP decays with ``fatter'' tails
than for a Gaussian, and (ii) the width of the distribution scales as a power
law of GDP with a scaling exponent $\beta \approx 0.15$. Both findings are in
surprising agreement with results on firm growth. These results are consistent
with the hypothesis that the evolution of organizations with complex structure
is governed by similar growth mechanisms.
","[{""version"":""v1"",""created"":""Wed, 8 Apr 1998 15:14:52 GMT""}]","2009-10-31"
"gr-qc/9804024","Eanna E. Flanagan","Eanna E Flanagan","Sources of gravitational radiation and prospects for their detection","21 pages, Latex, crckapb.sty, 5 figures included using psfig.tex,
  talk given at GR15, Pune, India, to appear in the proceedings. Some
  references added 16 Apr 98",,,,"gr-qc astro-ph",,"  In the coming decade, the LIGO/VIRGO/GEO network of ground-based
kilometer-scale laser interferometer gravitational wave detectors will open up
a new astronomical window on the Universe: gravitational waves in the frequency
band 10 to 10^4 Hz. In addition, if the proposed, 5 million kilometer long,
space based interferometer LISA flies, another window will be opened in the
frequency band 10^(-4) to 1 Hz. I review the various possible sources that
might be detected in these frequency bands, and the information that might be
obtainable from observed sources. This article closely parallels my talk at the
GR15 conference, but is updated to include discussions of some recent
developments.
","[{""version"":""v1"",""created"":""Tue, 7 Apr 1998 21:24:00 GMT""},{""version"":""v2"",""created"":""Thu, 16 Apr 1998 14:04:25 GMT""}]","2007-05-23"
"gr-qc/9804025","Roy Maartens","Neil Humphreys, David Matravers, Roy Maartens","Exact isotropic cosmologies with local fractal number counts","revised version, to appear Class. Q. Grav.; minor corrections
  following eqn 16, additional comments on relation to other work, some new
  references","Class.Quant.Grav. 15 (1998) 3041-3049","10.1088/0264-9381/15/10/010",,"gr-qc",,"  We construct an exact relativistic cosmology in which an inhomogeneous but
isotropic local region has fractal number counts and matches to a homogeneous
background at a scale of the order of $10^2$ Mpc. We show that Einstein's
equations and the matching conditions imply either a nonlinear Hubble law or a
very low large-scale density.
","[{""version"":""v1"",""created"":""Wed, 8 Apr 1998 08:28:55 GMT""},{""version"":""v2"",""created"":""Thu, 30 Jul 1998 10:51:09 GMT""}]","2009-10-31"
"hep-lat/9804008","Mike Teper","M. Teper (Oxford)","SU(N) gauge theories in 2+1 dimensions","86 pages; LaTeX; typos corrected, references added and minor changes
  for publication","Phys.Rev. D59 (1999) 014512","10.1103/PhysRevD.59.014512","OUTP-98-29P","hep-lat hep-th",,"  We calculate the mass spectra and string tensions of SU(2), SU(3), SU(4) and
SU(5) gauge theories in 2+1 dimensions. We do so by simulating the
corresponding lattice theories and then extrapolating dimensionless mass ratios
to the continuum limit. We find that such mass ratios are, to a first
approximation, independent of the number of colours and that the remaining
dependence can be accurately reproduced by a simple O(1/N.N) correction. This
provides us with a prediction of these mass ratios for all SU(N) theories in
2+1 dimensions and demonstrates that these theories are already `close' to
N=infinity for N=2. We find that the theory retains a non-zero confining string
tension as N goes to infinity and that the dimensionful coupling g.g is
proportional to 1/N at large N, when expressed in units of the dynamical length
scale of the theory. During the course of these calculations we study in detail
the effects of including over-relaxation in the Monte Carlo, of using a
mean-field improved coupling to extrapolate to the continuum limit, and the use
of space-time asymmetric lattice actions to resolve heavy glueball correlators.
","[{""version"":""v1"",""created"":""Tue, 7 Apr 1998 17:03:36 GMT""},{""version"":""v2"",""created"":""Mon, 23 Nov 1998 10:08:57 GMT""}]","2009-10-31"
"hep-lat/9804009","Oleg Borisenko","O. Borisenko, M. Faber and G. Zinovjev","On the Deconfinement Phase Transition in Hot Gauge Theories with
  Dynamical Matter Fields","24 pages, latex, 2 eps.figs., revised version",,,,"hep-lat",,"  The phase structure of hot gauge theories with dynamical matter fields is
reexamined in the canonical ensemble with respect to triality. Since this
ensemble implies a projection to the zero triality sector of the theory we
introduce a proper quantity which is able to reveal a critical behaviour of the
theory with fundamental quarks. We discuss the properties of both the
chromoelectric and chromomagnetic sectors of the theory and show while electric
charges carrying a unit of Z(N) charge are screened at high temperatures by
dynamical matter loops, this is not the case for the Z(N) magnetic flux. An
order parameter is constructed to probe the realization of local discrete Z(N)
symmetry in the magnetic sector. We argue it can be used to detect a
deconfinement phase being defined in terms of the screening mechanism as a
phase of unscreened Z(N) flux. It may be detectable at long range via the
Aharonov-Bohm effect. We discuss the possible phase structure of QCD in this
approach.
","[{""version"":""v1"",""created"":""Wed, 8 Apr 1998 09:34:29 GMT""},{""version"":""v2"",""created"":""Tue, 2 Mar 1999 13:46:07 GMT""}]","2007-05-23"
"hep-lat/9804010","Matteo Beccaria","Matteo Beccaria, Giuseppe Curci, Erika D'Ambrosio","Simulation of Supersymmetric Models with a Local Nicolai Map","18 pages, REVTeX + 2 PostScript figures","Phys.Rev. D58 (1998) 065009","10.1103/PhysRevD.58.065009","ULDF-TH-1/4/98","hep-lat hep-th",,"  We study the numerical simulation of supersymmetric models having a local
Nicolai map. The mapping can be regarded as a stochastic equation and its
numerical integration provides an algorithm for the simulation of the original
model. In this paper, the method is discussed in details and applied to
examples in 0+1 and 1+1 dimensions.
","[{""version"":""v1"",""created"":""Wed, 8 Apr 1998 13:01:52 GMT""}]","2009-10-31"
"hep-ph/9804248","Adam Falk","George Chiladze, Adam F. Falk and Alexey A. Petrov","Hybrid Charmonium Production in B Decays","15 pages, uses REVTeX","Phys. Rev. D 58, 034013 (1998)","10.1103/PhysRevD.58.034013","JHU-TIPAC-98006","hep-ph hep-lat",,"  We study the production of charmonium hybrids in B decays. We use the
operator product expansion and nonrelativistic QCD to organize the various
contributions to this process. We express the decay rate in terms of a few
matrix elements which eventually will be fixed by experimental measurements or
calculated on the lattice. While the Fock state expansion is problematic for
hybrids, in that there is no perturbative large mass limit, the operator
product expansion still provides a model independent framework for
phenomenological calculations of hybrid production and decay. We then use a
simple flux tube model to estimate the branching ratio B -> psi_g + X, where
psi_g is a J^{PC}=0^{+-} hybrid, the large production of which could help
resolve the low charm multiplicity and semileptonic branching ratio observed in
B decays. We also investigate the possible contributions of tensor charmonium
production. We observe that it is unlikely for either effect to be large enough
to play a significant role in resolving these problems.
","[{""version"":""v1"",""created"":""Tue, 7 Apr 1998 20:49:03 GMT""}]","2016-08-25"
"hep-ph/9804250","Gerardo Aldazabal","G. Aldazabal","Non-Perturbative effects from orbifold constructions","12 pages, Latex. To appear in the proceedings of the workshop on
  ""Phenomenological Aspects of String Theory""(PAST97), ICTP, October 1997,
  Trieste, Italy",,,,"hep-ph hep-th",,"  We indicate how consistent heterotic orbifold compactifications, including
non perturbative information, can be constructed. We first analyse the
situation in six dimensions, N=1, where strong coupling effects, implying the
presence of five branes, are better known. We show that anomaly free models can
be obtained even when usual modular invariance constraints are not satisfied.
The perturbative massless sector can be computed explicitly from the
perturbative mass formula subject to an extra shift in the vacuum energy.
Explicit examples in D=4, N=1 are presented. Generically, examples exhibit non
perturbative transitions leading to gauge enhancement and/or changing the
number of chiral generations.
","[{""version"":""v1"",""created"":""Tue, 7 Apr 1998 18:06:11 GMT""}]","2007-05-23"
"hep-ph/9804251","Harald W. Griesshammer","H. W. Griesshammer (U of Washington)","The Soft R'egime in NRQCD","14 pages LaTeX2e, uses feynmf to generate 11 in-text graphs, 2 tables
  and 4 figures; Talk presented at the workshop ``Nuclear Physics with
  Effective Field Theories'' at Caltech, 26th -- 27th February 1998",,,"NT@UW-98-12","hep-ph nucl-th",,"  A Lagrangean and a set of Feynman rules are presented for Non-Relativistic
QCD with manifest power counting in the heavy quark velocity $v$. A r\'egime is
identified in which energies and momenta are of order $Mv$. It is neither
identical to the ultrasoft r\'egime corresponding to radiative processes with
energies and momenta of order $Mv^2$, nor to the potential r\'egime with on
shell quarks and gluons providing the Coulomb binding. In this soft r\'egime,
gluons are on shell, and the quark propagator becomes static. Examples show
that it contributes to one- and two-loop corrections of scattering and
production amplitudes near threshold. The results are readily generalised to
any effective field theory with more than one low energy scale.
","[{""version"":""v1"",""created"":""Tue, 7 Apr 1998 23:44:53 GMT""}]","2007-05-23"
