"astro-ph/9811148","Eric Gawiser","Eric Gawiser, Andrew Jaffe, & Joseph Silk (U.C.Berkeley)","Observational Constraints on Microwave Anisotropy from Point Sources","submitted to Astrophysical Journal, 15 pages in ApJ preprint style,
  including 3 figures",,,,"astro-ph",,"  Applying basic physical principles to recent observational results, we derive
upper and lower limits on microwave anisotropy from point sources over the
range of frequencies 10-1000 GHz. We examine the level of noise in the
observations as a possible indication of source confusion at subarcminute
scales. We also derive an upper limit on microwave anisotropy caused by the
sources responsible for the Far-Infrared Background radiation detected in FIRAS
data. Our upper limit on point source confusion of DeltaT/T=10^{-5} for a 10'
beam at 100 GHz would cause severe foreground contamination for CMB anisotropy
observations, although the actual contamination level is probably much lower.
This upper limit constrains the long-feared possibility of an undetected
population of sources with emission peaking near 100 GHz. Source detections
closer to 100 GHz are needed to improve our knowledge of galaxy evolution at
high redshift and to predict the level of point source confusion.
","[{""version"":""v1"",""created"":""Tue, 10 Nov 1998 22:10:22 GMT""}]","2007-05-23"
"astro-ph/9811154","Sarbani Basu","H. M. Antia (TIFR, Mumbai) and Sarbani Basu (IAS, Princeton)","High frequency and high wavenumber solar oscillations","Revised version. 1.2 mHz features identified as artifacts of data
  analysis. Accepted for publication in ApJ","Astrophys. J. (1999), 519, 400","10.1086/307364",,"astro-ph",,"  We determine the frequencies of solar oscillations covering a wide range of
degree (100< l <4000) and frequency (1.5 <\nu<10 mHz) using the ring diagram
technique applied to power spectra obtained from MDI (Michelson Doppler Imager)
data. The f-mode ridge extends up to degree of approximately 3000, where the
line width becomes very large, implying a damping time which is comparable to
the time period. The frequencies of high degree f-modes are significantly
different from those given by the simple dispersion relation \omega^2=gk. The
f-mode peaks in power spectra are distinctly asymmetric and use of asymmetric
profile increases the fitted frequency bringing them closer to the frequencies
computed for a solar model.
","[{""version"":""v1"",""created"":""Tue, 10 Nov 1998 20:39:54 GMT""},{""version"":""v2"",""created"":""Wed, 10 Feb 1999 12:16:12 GMT""}]","2009-10-31"
"astro-ph/9811158","Jan Peter Muecket","F. Atrio Barandela (Universidad de Salamanca), J. P. Muecket
  (Astrophysikalisches Institut Potsdam)","Temperature Anisotropies and Distortions Induced by Hot Intracluster Gas
  on the Cosmic Microwave Background","10 pages, Latex, 3 figures; to be published in ApJ",,"10.1086/307032",,"astro-ph",,"  The power spectrum of temperature anisotropies induced by hot intracluster
gas on the cosmic background radiation is calculated. For low multipoles it
remains constant while at multipoles above $l>2000$ it is exponentially damped.
The shape of the radiation power spectrum is almost independent of the average
intracluster gas density profile, gas evolution history or clusters virial
radii; but the amplitude depends strongly on those parameters and could be as
large as 20% that of intrinsic contribution. The exact value depends on the
global properties of the cluster population and the evolution of the
intracluster gas. The distortion on the Cosmic Microwave Background black body
spectra varies in a similar manner. The ratio of the temperature anisotropy to
the mean Comptonization parameters is shown to be almost independent of the
cluster model and, in first approximation, depends only on the number density
of clusters.
","[{""version"":""v1"",""created"":""Tue, 10 Nov 1998 17:48:52 GMT""}]","2009-10-31"
"astro-ph/9811163","Arthur Kosowsky","Arthur Kosowsky (Rutgers University)","Seeing Sound Waves in the Early Universe","5 pages, 1 figure. Submitted to Physical Review Letters",,,"RAP-238","astro-ph",,"  Temperature and polarization power spectra of the cosmic microwave background
can provide essentially incontrovertible evidence for coherent acoustic
oscillations in the early universe. A simple model calculation demonstrates
explicitly how polarization couples to velocities at the surface of last
scatter and is nearly independent of gravitational or density perturbations.
For coherent acoustic oscillations, peaks in the temperature and polarization
power spectra are precisely interleaved. If observed, such a signal would
provide strong support for initial density perturbations on scales larger than
the horizon, and thus for inflation.
","[{""version"":""v1"",""created"":""Tue, 10 Nov 1998 17:00:56 GMT""}]","2007-05-23"
"astro-ph/9811164","Philip R. Maloney","Philip R. Maloney, J. Bland-Hawthorn","Warm Gas and Ionizing Photons in the Local Group","5 pages, 1 figure. To appear in the Third Stromlo Symposium: The
  Galactic Halo (ASP Conference Series), in press",,,,"astro-ph",,"  We investigate how much warm (T \sim 10^6 K) gas may exist in a Local Group
corona, and, in particular, whether such a corona could be detected indirectly
through its ionizing radiation. We calculate the non-LTE cooling of warm,
low-density gas and the resulting ionizing photon emissivities for a range of
metallicities. In principle a corona can produce a photon flux which
significantly exceeds the cosmic ionizing background. However, the additional
constraints which can be imposed on intragroup gas rule out models which
produce detectable ionizing photon fluxes at the Milky Way's distance from the
Local Group barycenter.
","[{""version"":""v1"",""created"":""Wed, 11 Nov 1998 00:25:27 GMT""}]","2007-05-23"
"astro-ph/9811165","Anatoli Vankov","A. Vankov","On an Alternative Cosmology","7 pages",,,,"astro-ph",,"  The suggested alternative cosmology is based on the idea of barion symmetric
universe, in which our home universe is a representative of multitude of
typical matter and antimatter universes. This alternative concept gives a
physically reasonable explanation of all major problems of the Standard
Cosmological Model.
  Classification Code MSC: Cosmology 524.8
  Key words: standard cosmological model, alternative cosmology, barionic
symmetry, typical universe, quasars, cosmic rays.
","[{""version"":""v1"",""created"":""Tue, 10 Nov 1998 18:05:49 GMT""}]","2016-08-30"
"astro-ph/9811166","Brad K. Gibson","Brad K. Gibson (Univ. of Colorado), Bart P. Wakker (Univ of Wisconsin)","Stromlo Workshop on High-Velocity Clouds - Conference Highlights","5 pages; LaTeX; To appear in Publications of the Astronomical Society
  of the Pacific, Vol. 111 (Feb. 1999)",,,,"astro-ph",,"  A highly colloquialized summary of the Stromlo Workshop on High-Velocity
Clouds, held Aug 14-15, 1998, at Mount Stromlo Observatory. The proceedings
will be edited by Brad Gibson and Mary Putman, and published as part of the ASP
Conference Series.
","[{""version"":""v1"",""created"":""Tue, 10 Nov 1998 19:08:13 GMT""}]","2007-05-23"
"astro-ph/9811167","Chris Fassnacht","C. D. Fassnacht, R. D. Blandford, J. G. Cohen, K. Matthews, T. J.
  Pearson, A. C. S. Readhead, D. S. Womble (Caltech), S. T. Myers (Penn), I. W.
  A. Browne, N. J. Jackson, D. R. Marlow, P. N. Wilkinson (NRAL, Jodrell Bank),
  L. V. E. Koopmans (Kapteyn), A. G. de Bruyn, R. T. Schilizzi (NFRA), M.
  Bremer, G. Miley (Leiden)","B2045+265: A New Four-Image Gravitational Lens from CLASS","18 pages, 15 figures. Accepted for publication in the Astronomical
  Journal (Feb 1999)",,"10.1086/300724",,"astro-ph",,"  We have discovered a new gravitational lens in the Cosmic Lens All-Sky Survey
(CLASS). B2045+265 is a four-image system with a maximum separation of 1.9
arcsec. A fifth radio component is detected, but its radio spectrum and its
positional coincidence with infrared emission from the lensing galaxy strongly
suggests that it is the radio core of the lensing galaxy. This implies that the
B2045+265 system consists of a flat-spectrum radio source being lensed by
another flat-spectrum radio source. Infrared images detect the lensed images of
the background source and the lensing galaxy. The lensed images have relative
positions and flux densities that are consistent with those seen at radio
wavelengths. Spectra of the system reveal a lens redshift of z_l=0.8673 and a
source redshift of z_s=1.28. The image splitting and system redshifts imply
that the projected mass inside the Einstein radius of the lensing galaxy is
M_E=4.7x10^{11} h^{-1} M_sun. An estimate of the light emitted inside the
Einstein radius gives a mass-to-light ratio in the rest frame B band of
(M/L_B)_E = 20 h (M/L_B)_sun. Both the mass and mass-to-light ratio are higher
than what is seen in nearby Sa galaxies. In fact, the implied rotation velocity
for the lensing galaxy is two to three times higher than what is seen in nearby
spirals. The large projected mass inside the Einstein ring radius may be the
result of a significant amount of dark matter in the system, perhaps from a
compact group of galaxies; however, it may also arise from a misidentification
of the source redshift. A simple model of the gravitational potential of the
lens reproduces the image positions well, but further modeling is required to
satisfy the constraints from the image flux density ratios. With further
observations and modeling, this lens may yield an estimate of H_0.
","[{""version"":""v1"",""created"":""Tue, 10 Nov 1998 23:10:32 GMT""}]","2009-10-31"
"astro-ph/9811168","Wayne Hu","Wayne Hu and Max Tegmark (IAS, Princeton)","Weak Lensing: Prospects for Measuring Cosmological Parameters","4 pages, 2 figures submitted to ApJ letters","Astrophys.J.514:L65-L68,1999","10.1086/311947",,"astro-ph",,"  Weak lensing of galaxies by large scale structure can potentially measure
cosmological quantities as accurately as the cosmic microwave background (CMB).
However, the relation between observables and fundamental parameters is more
complex and degenerate, especially in the full space of adiabatic cold dark
matter models considered here. We introduce a Fisher matrix analysis of the
information contained in weak lensing surveys to address these issues and
provide a simple means of estimating how survey properties and source redshift
uncertainties affect parameter measurement. We find that surveys on degree
scales and above can improve the accuracy on parameters that affect the growth
rate of structure by up to an order of magnitude compared to using the CMB
alone even if the characteristic redshift of the sources must be determined
from the data itself. Surprisingly, both sparse sampling and increasing the
source redshift can weaken the cosmological constraints.
","[{""version"":""v1"",""created"":""Wed, 11 Nov 1998 01:03:11 GMT""}]","2009-10-31"
"astro-ph/9811169","K. C. Chambers","K. C. Chambers","Morphology and dynamics of high z radio galaxies and quasars","To appear in ``After the Dark Ages: When Galaxies Were Young'', Ninth
  Annual October Astrophysics Conference in Maryland, ed. S. S. Holt and E. P.
  Smith, (New York: American Institute of Physics Press), 1998",,"10.1063/1.58609","IfA-98-57","astro-ph",,"  The continuum morphologies of high redshift radio galaxies and quasars can be
modeled as enormous bipolar reflection nebulae from shells of dust swept up by
bipolar outflows. If the observed shape of a particular object is fit with an
analytic function, then the velocity of the shell is specified by the equations
of motion. The predicted kinematics can be compared with the observed emission
line velocity field, and the resulting fit is excellent. The implications for
massive galaxies at high redshift include the requirement of an initial epoch
of star formation that creates dust distributed throughout a very large,
diffuse, nearly virialized halo.
","[{""version"":""v1"",""created"":""Wed, 11 Nov 1998 02:44:24 GMT""}]","2009-10-31"
"astro-ph/9811170","Hiroyuki Hirashita","H. Hirashita (Department of Astronomy, Kyoto University)","Global Law for Dust-to-gas Ratio of Spiral Galaxies","9 pages LaTeX, 3 figures, to appear in ApJ Letters",,"10.1086/311806",,"astro-ph",,"  Using a one-zone model for the evolution of dust in spiral galaxies and
applying the instantaneous recycling approximation to the model equations, we
investigate dust-to-gas ratio of spiral galaxies. Four processes are
considered; dust formation from heavy elements ejected by stellar mass loss,
dust destruction in supernova remnants, dust destruction in star-forming
regions, and accretion of heavy elements onto preexisting dust grains. The
equations describe a simplified relation between dust-to-gas ratio and
metallicity. The relation is independent of star formation rate. By comparing
the theoretical relation with the observational data of nearby spiral galaxies,
we show (i) that the accretion process onto the preexisting dust particles must
be taken into account for the spiral galaxies; (ii) that the efficiency of dust
production from heavy elements ejected by stars can be constrained by the
spiral galaxies with low metallicity; (iii) that the Salpeter and Scalo initial
mass functions are both consistent with the data of the spiral galaxies.
","[{""version"":""v1"",""created"":""Wed, 11 Nov 1998 06:12:36 GMT""}]","2009-10-31"
"astro-ph/9811171","Shude Mao","X.-Y. Xia, Shude Mao, H. Wu, Z. Zheng, Th. Boller, Z.-G. Deng, Z.-L.
  Zou","Ultraluminous IRAS galaxy 10026+4347","A&A Letters, in press",,,,"astro-ph",,"  We study optical and X-ray properties of the ultraluminous IRAS galaxy
10026+4347. This galaxy is a narrow-line QSO with very strong FeII emission.
Three optical spectra were taken over two years. The full widths at half
maximum (FWHMs) of the emission lines are constant whereas the third spectrum
seems to show a continuum change. Intermediate-band photometry also shows a
small (0.1 mag) but significant decrease in flux. HST WFPC2 images suggest that
this object is a post-merger galaxy. The source is X-ray luminous (L_x ~ 10^45
erg/s) with a very soft X-ray spectrum (photon index ~ 3.2) The X-ray
luminosity exhibits variabilities of a factor of ~8 over four years and a
factor of two within two days. During these X-ray flux changes, the X-ray
spectral shapes are consistent with no variation. All the optical and X-ray
properties resemble those of narrow-line Seyfert 1 galaxies, except that the
FWHM of Hbeta is about 2500 km/s, larger than that for most NLS1s. We discuss
the implications of our results on models of NLS1s.
","[{""version"":""v1"",""created"":""Wed, 11 Nov 1998 08:45:04 GMT""}]","2007-05-23"
"astro-ph/9811172","D. W. Sciama","D.W. Sciama","Are Neutrino Oscillations Compatible with the Decaying Neutrino Theory
  for the Ionisation of Hydrogen in the Interstellar Medium?","6 pages",,,,"astro-ph hep-ph",,"  Recent Super-Kamiokande data have greatly strengthened the hypothesis that
the atmospheric neutrino anomaly is mainly due to nearly maximal oscillations
between $\nu_{\mu}$ and either $\nu_{\tau}$ or a sterile neutrino
$\nu^s_{\mu}$.In this letter we point out that the decaying neutrino theory for
the ionisation of hydrogen in the interstellar medium, in conjunction with the
assumption that the cosmological constant $\lambda$ is zero, requires these
oscillations to be between $\nu_{\mu}$ and $\nu^s_{\mu}$. This requirement can
be tested by forthcoming Super-Kamiokande measurements. A further requirement
can be derived if the solar neutrino deficit is energy dependent and if both it
and the LSND data are also due to neutrino oscillations. In that case the
decaying neutrino theory alone (without any assumption about the value of
$\lambda$) requires both that the atmospheric anomaly is due to
$\nu_{\mu}-\nu^s_{\mu}$ oscillations and that the solar neutrino oscillations
are between $\nu_e$ and a second sterile neutrino $\nu^s_e$. This latter
requirement can be tested by forthcoming SNO and BOREXINO measurements. If
these are also $\nu_{\tau}-\nu^s_{\tau}$ oscillations the decay line would be
split into two lines of nearly equal intensity and spacing less than $\sim$ 0.2
eV.
","[{""version"":""v1"",""created"":""Wed, 11 Nov 1998 09:00:55 GMT""}]","2007-05-23"
"astro-ph/9811173","Guido De Marchi","Guido De Marchi, Bruno Leibundgut, Francesco Paresce, Luigi Pulone
  (ESO)","A Deep Optical Luminosity Function of NGC 6712 with the VLT: Evidence
  for Severe Tidal Disruption","6 pages, 3 figures, to appear as a Letter in the special VLT issue of
  Astronomy & Astrophysics (March 1999)",,,,"astro-ph",,"  The VLT on Cerro Paranal was used to observe four fields located at 2.3' from
the center of the Galactic globular cluster NGC 6712 in the V and R bands. The
resulting color-magnitude diagram shows a well defined main sequence reaching
down to the 5 sigma detection limit at V~25, R~23.5 or approximately 4 mag
below the main sequence turn-off, the deepest obtained so far on this cluster.
This yields a main sequence luminosity function that peaks at M_R~4.5 and drops
down to the 50% completeness limit at M_R~8.5. Transformation to a mass
function via the latest mass-luminosity relation appropriate to this object
indicates that the peak of the luminosity function corresponds to ~0.75 Msolar,
a value significantly higher than the ~0.25 Msolar measured for most other
clusters observed so far. Since this object, in its Galactic orbit, penetrates
very deeply into the Galactic bulge with perigalactic distance of ~0.3 kpc,
this result is the first strong evidence that tidal forces have stripped this
cluster of a substantial portion of its lower mass star population all the way
down to its half-light radius and possibly beyond.
","[{""version"":""v1"",""created"":""Wed, 11 Nov 1998 10:22:52 GMT""}]","2007-05-23"
"astro-ph/9811174","Martin Kunz","Ruth Durrer, Martin Kunz, Alessandro Melchiorri","Cosmic Microwave Background Anisotropies from Scaling Seeds: Global
  Defect Models","LaTeX file with RevTex, 27 pages, 23 eps figs., submitted to Phys.
  Rev. D. A version with higher quality images can be found at
  http://mykonos.unige.ch/~kunz/download/lam.tar.gz for the LaTeX archive and
  at http://mykonos.unige.ch/~kunz/download/lam.ps.gz for the compiled
  PostScript file","Phys.Rev. D59 (1999) 123005","10.1103/PhysRevD.59.123005","UGVA-DPT/98-11-1021","astro-ph",,"  We investigate the global texture model of structure formation in cosmogonies
with non-zero cosmological constant for different values of the Hubble
parameter. We find that the absence of significant acoustic peaks and little
power on large scales are robust predictions of these models. However, from a
careful comparison with data we conclude that at present we cannot safely
reject the model on the grounds of present CMB data. Exclusion by means of
galaxy correlation data requires assumptions on biasing and statistics. New,
very stringent constraints come from peculiar velocities.
  Investigating the large-N limit, we argue that our main conclusions apply to
all global O(N) models of structure formation.
","[{""version"":""v1"",""created"":""Wed, 11 Nov 1998 11:08:57 GMT""}]","2009-10-31"
"astro-ph/9811175",,"G. Bono (Osservatorio Astronomico di Roma, Italy) and S. Cassisi
  (Osservatorio Astronomico di Teramo, Italy)","On the Blue Tail of Horizontal Branch Stars","5 pages including 2 encapsulated postscript figures, To be published
  on the Proceedings of ""The Third Stromlo Symposium: The Galactic Halo"", ASP
  Conference Series, 1999",,,,"astro-ph",,"  We discuss theoretical predictions for ZAHB models constructed either by
including or neglecting the He extra-mixing effect recently suggested by
Sweigart (1997). The comparison in the $log T_e -log g$ plane suggests that
within current observational uncertainties canonical hot HB models based on new
input physics agree with empirical data in Galactic globular clusters and in
the field. We also briefly discuss the impact of the new class of variable
stars EC14026 on constraining the parameters of blue HB stars and their
distribution along the tail.
","[{""version"":""v1"",""created"":""Wed, 11 Nov 1998 11:22:24 GMT""}]","2007-05-23"
"astro-ph/9811176","Carlo Baccigalupi","Carlo Baccigalupi","Cosmic microwave background: polarization and temperature anisotropies
  from symmetric structures","21 pages, seven postscript figures, final version accepted for
  publication in Phys.Rev.D","Phys.Rev. D59 (1999) 123004","10.1103/PhysRevD.59.123004",,"astro-ph gr-qc",,"  I consider the case of anisotropies in the Cosmic Microwave Background (CMB)
from one single ordered perturbation source, or seed, existing well before
decoupling between matter and radiation. Such structures could have been left
by high energy symmetries breaking in the early universe.
  I focus on the cases of spherical and cylindrical symmetry of the seed. I
give general analytic expressions for the polarization and temperature linear
perturbations, factoring out of the Fourier integral the dependence on the
photon propagation direction and on the geometric coordinates describing the
seed. I show how the CMB perturbations manifestly reflect the symmetries of
their seeds. CMB anisotropies are obtained with a line of sight integration.
  This treatment highlights the undulatory properties of the CMB. I show with
numerical examples how the polarization and temperature perturbations propagate
beyond the size of their seeds, reaching the CMB sound horizon at the time
considered. Just like the waves from a pebble thrown in a pond, CMB anisotropy
from a seed intersecting the last scattering surface appears as a series of
temperature and polarization waves surrounding the seed, extending on the scale
of the CMB sound horizon at decoupling, roughly $1^{o}$ in the sky. Each wave
is characterized by its own value of the CMB perturbation, with the same mean
amplitude of the signal coming from the seed interior.
  These waves could allow to distinguish relics from high energy processes of
the early universe from point-like astrophysical sources, because of their
angular extension and amplitude. Also, the marked analogy between polarization
and temperature signals offers cross correlation possibilities for the future
Planck Surveyor observations.
","[{""version"":""v1"",""created"":""Wed, 11 Nov 1998 13:19:24 GMT""},{""version"":""v2"",""created"":""Mon, 8 Mar 1999 18:09:53 GMT""},{""version"":""v3"",""created"":""Tue, 9 Mar 1999 09:43:01 GMT""}]","2009-10-31"
"astro-ph/9811177","Alessandro Marconi","E. Oliva, A. Marconi (Arcetri Observatory), A.F.M. Moorwood (ESO)","Metal abundances and excitation of extranuclear clouds in the Circinus
  galaxy -- A new method for deriving abundances of AGN narrow line clouds","14 pages, 11 figures, Astronomy and Astrophysics in press",,,,"astro-ph",,"  Spectra of extranuclear clouds within the ionization cone of Circinus galaxy
are presented and modelled assuming photoionization by the Seyfert 2 nucleus
but no preconceived assumption concerning the spectral shape of the ionizing
AGN radiation or the gas density distribution.
  The most important result is that, regardless of the assumed AGN spectral
shape or density distribution, the metal abundances are remarkably well (+/-0.2
dex) constrained by the data. Oxygen and neon are found to be a factor of 5
below solar, while nitrogen is solar. The large N/O overabundance is in
agreement with the chemical enrichment expected from the old (circum)nuclear
starburst. Similar studies of extranuclear clouds in other objects could
therefore provide a powerful tool to determine metallicities and trace past
starburst activity in AGNs.
  Other implications such as the role of shock excitation, which is effectively
excluded, and the intrinsic shape of the AGN ionizing continuum, which is
poorly constrained by the data, are also discussed.
","[{""version"":""v1"",""created"":""Wed, 11 Nov 1998 13:20:34 GMT""}]","2007-05-23"
"astro-ph/9811178","Roberto Silvotti","R. Silvotti, S. Dreizler, G. Handler, X.J. Jiang","The photometric behaviour of the peculiar PG1159 star HS2324+3944 at
  high frequency resolution","13 pages, 8 figures, A&A in press, ps version available at
  http://www.na.astro.it/~silvotti/pubs.html",,,"OAC-84 (1998)","astro-ph",,"  We present the results from 135 hours of nearly continuous time series
photometry on the ``hybrid'' (H-rich) PG1159 variable star HS2324+3944,
obtained in August-September 1997. The power spectrum of the data shows several
frequencies (about 20 or more), concentrated in three narrow and very crowded
regions near 475, 390 and 950 microHz in decreasing amplitude order. Most (if
not all) of the peaks in the latter region are linear combinations of the
high-amplitude frequencies between 455 and 500 microHz. If we divide the data
set into two equal parts, the power spectra are different. This is probably due
to a not sufficiently long (and therefore not completely resolved) light curve;
nevertheless an alternative hypothesis of a single damped oscillator may not be
completely ruled out. If we adopt the first hypothesis, the high concentration
of peaks between 455 and 500 microHz suggests the presence of both l=1 and l=2
high-overtone nonradial g-modes. The insufficient frequency resolution of our
data does not allow to obtain definite precision asteroseismology results.
Nevertheless a spacing of the signals is observed, probably due to stellar
rotation with a period of 2.3 days. If the signal spacing was due to the
successive overtones, the period spacings would be equal to 18.8 (l=1) and 10.4
(l=2) s.
","[{""version"":""v1"",""created"":""Wed, 11 Nov 1998 13:42:35 GMT""}]","2007-05-23"
