"astro-ph/9811179","Hans-Guenter Ludwig","H.-G. Ludwig, B. Freytag, M. Steffen","A calibration of the mixing-length for solar-type stars based on
  hydrodynamical simulations - I. Methodical aspects and results for solar
  metallicity","14 pages, 6 figures, 4 tables",,,,"astro-ph",,"  Based on detailed 2D numerical radiation hydrodynamics (RHD) calculations of
time-dependent compressible convection, we have studied the dynamics and
thermal structure of the convective surface layers of solar-type stars. The RHD
models provide information about the convective efficiency in the
superadiabatic region at the top of convective envelopes and predict the
asymptotic value of the entropy of the deep, adiabatically stratified layers.
This information is translated into an effective mixing-length parameter alpha
suitable to construct standard stellar structure models. We validate the
approach by a detailed comparison to helioseismic data.
  The grid of RHD models for solar metallicity comprises 58 simulation runs
with a helium abundance of Y=0.28 in the range of effective temperatures 4300K
< Teff < 7100K and gravities 2.54 < logg < 4.74. We find a moderate,
nevertheless significant variation of alpha between about 1.3 for F-dwarfs and
1.75 for K-subgiants with a dominant dependence on Teff. In the close
neighbourhood of the Sun we find a plateau where alpha remains almost constant.
The internal accuracy of the calibration of alpha is estimated to be +/- 0.05
with a possible systematic bias towards lower values. An analogous calibration
of the convection theory of Canuto & Mazzitelli gives a different temperature
dependence but a similar variation of the free parameter.
  For the first time, values for the gravity-darkening exponent beta are
derived independently of mixing-length theory: beta=0.07...0.10.
  We show that our findings are consistent with constraints from stellar
stability considerations and provide compact fitting formulae for the
calibrations.
","[{""version"":""v1"",""created"":""Wed, 11 Nov 1998 13:46:40 GMT""},{""version"":""v2"",""created"":""Thu, 25 Mar 1999 14:47:16 GMT""}]","2007-05-23"
"astro-ph/9811180","Nicolas Cretton","Nicolas Cretton (Sterrewacht Leiden) and Frank C. van den Bosch
  (University of Washington, Seattle)","Evidence for a Massive Black Hole in the S0 Galaxy NGC 4342","4 pages, 3 figures (2 color). Contributed Talk at ""Galaxy Dynamics"",
  Rutgers University, New Jersey, August 8-12, 1998",,"10.1086/306971",,"astro-ph",,"  We have constructed axisymmetric dynamical models of the edge-on S0 galaxy
NGC 4342: simple two-integral Jeans models as well as fully general,
three-integral models using a modified version of Schwarzschild's orbit
superposition technique. The two-integral models suggest a black hole (BH) of 3
or $6\times 10^8 M_\odot$, depending on the data set. The three-integral models
can fit all ground-based and HST data simultaneously, but only when a central
BH is included. Models without BH are ruled out at better than 99.73%
confidence level. We determine a BH mass of $3.0^{+1.7}_{-1.0} \times 10^8
M_\odot$. This corresponds to 2.6% of the bulge mass, making NGC 4342 one of
the galaxies with the highest BH mass to bulge mass ratio currently known.
","[{""version"":""v1"",""created"":""Wed, 11 Nov 1998 15:40:11 GMT""}]","2009-10-31"
"chao-dyn/9811014","Diego A. Wisniacki","D.A. Wisniacki (1) and E. Vergini (2) ((1) Dpto. de Fisica ``J.J.
  Giambiagi'', Universidad de Buenos Aires. (2) Dpto. de Fisica, Tandar,
  Comision Nacional de Energia Atomica. Argentina.)","Influence of phase space localization on the energy diffusion in a
  quantum chaotic billiard","5 pages, 5 figures",,"10.1103/PhysRevE.59.6579",,"chao-dyn cond-mat.mes-hall nlin.CD quant-ph",,"  The quantum dynamics of a chaotic billiard with moving boundary is considered
in this work. We found a shape parameter Hamiltonian expansion which enables us
to obtain the spectrum of the deformed billiard for deformations so large as
the characteristic wave length. Then, for a specified time dependent shape
variation, the quantum dynamics of a particle inside the billiard is integrated
directly. In particular, the dispersion of the energy is studied in the
Bunimovich stadium billiard with oscillating boundary. The results showed that
the distribution of energy spreads diffusively for the first oscillations of
the boundary (${< \Delta^2 E}> =2 D t$). We studied the diffusion contant $D$
as a function of the boundary velocity and found differences with theoretical
predictions based on random matrix theory. By extracting highly phase space
localized structures from the spectrum, previous differences were reduced
significantly. This fact provides the first numerical evidence of the influence
of phase space localization on the quantum diffusion of a chaotic system.
","[{""version"":""v1"",""created"":""Tue, 10 Nov 1998 19:19:33 GMT""}]","2009-10-31"
"cond-mat/9811131","Arkadi Odintsov","Arkadi A. Odintsov, and Hideo Yoshioka","Universality of electron correlations in conducting carbon nanotubes","4 pages, 2 figures",,"10.1103/PhysRevB.59.R10457",,"cond-mat.mes-hall",,"  Effective low-energy Hamiltonian of interacting electrons in conducting
single-wall carbon nanotubes with arbitrary chirality is derived from the
microscopic lattice model. The parameters of the Hamiltonian show very weak
dependence on the chiral angle, which makes the low energy properties of
conducting chiral nanotubes universal. The strongest Mott-like electron
instability at half filling is investigated within the self-consistent harmonic
approximation. The energy gaps occur in all modes of elementary excitations and
estimate at $0.01-0.1$ eV.
","[{""version"":""v1"",""created"":""Tue, 10 Nov 1998 17:14:53 GMT""}]","2009-10-31"
"cond-mat/9811132","Patrick Bruno","Vaclav Drchal, Josef Kudrnovsky, Patrick Bruno, Peter Dederichs, Peter
  Weinberger","The combined effect of temperature and disorder on interlayer exchange
  coupling in magnetic multilayers","5 pages, LaTeX, 1 figure. Submitted to Phil. Mag. B","Phil. Mag. B 78, pp. 571-575 (1998)","10.1080/13642819808206761",,"cond-mat.mes-hall cond-mat.mtrl-sci",,"  We study the combined effect of temperature and disorder in the spacer on the
interlayer exchange coupling. The temperature dependence is treated on ab
initio level. We employ the spin-polarized surface Green function technique
within the tight-binding linear muffin-tin orbital method and the Lloyd
formulation of the IEC. The integrals involving the Fermi-Dirac distribution
are calculated using an efficient method based on representation of integrands
by a sum of complex exponentials. Application is made to
Co/Cu_{100-x}M_x/Co(001) trilayers (M=Zn, Au, and Ni) with varying thicknesses
of the spacer.
","[{""version"":""v1"",""created"":""Tue, 10 Nov 1998 17:27:04 GMT""}]","2017-02-08"
"cond-mat/9811133","B. C. den Hertog","B.C. den Hertog, A.J. Berlinsky and C. Kallin","Properties of SAS Josephson junctions in SO(5) theory","4 pages, 5 figures, RevTex",,,,"cond-mat.supr-con",,"  We derive the qualitative behavior of superconductor-antiferromagnet-
superconductor (SAS) Josephson junctions described by Zhang's SO(5) theory. The
main differences between these junctions and conventional SIS junctions arise
from the non-sinusoidal current-phase relation derived by Demler et al. for
thin SAS junctions. Using a simple approximation to this non-sinusoidal
function, the current voltage relation, Shapiro steps, thermal fluctuation
effects and the diffraction pattern in a magnetic field are obtained.
","[{""version"":""v1"",""created"":""Tue, 10 Nov 1998 18:17:34 GMT""}]","2007-05-23"
"cond-mat/9811134","Ben Simons","Alexander Altland and B D Simons","Field Theory of the Random Flux Model","4 pages, 1 eps figure","J.Phys. A32 (1999) L353-L359","10.1088/0305-4470/32/31/101",,"cond-mat hep-th",,"  The long-range properties of the random flux model (lattice fermions hopping
under the influence of maximally random link disorder) are shown to be
described by a supersymmetric field theory of non-linear sigma model type,
where the group GL(n|n) is the global invariant manifold. An extension to
non-abelian generalizations of this model identifies connections to lattice
QCD, Dirac fermions in a random gauge potential, and stochastic non-Hermitian
operators.
","[{""version"":""v1"",""created"":""Tue, 10 Nov 1998 17:57:03 GMT""}]","2009-10-31"
"cond-mat/9811135","Michael Potthoff","M. Potthoff and W. Nolting","Surface metal-insulator transition in the Hubbard model","LaTeX, 9 pages, 5 eps figures included, Phys. Rev. B (in press)","Phys. Rev. B 59, 2549 (1999)","10.1103/PhysRevB.59.2549",,"cond-mat.str-el cond-mat.supr-con",,"  The correlation-driven metal-insulator (Mott) transition at a solid surface
is studied within the Hubbard model for a semi-infinite lattice by means of the
dynamical mean-field theory. The transition takes place at a unique critical
strength of the interaction. Depending on the surface geometry, the interaction
strength and the wave vector, we find one-electron excitations in the coherent
part of the surface-projected metallic spectrum which are confined to two
dimensions.
","[{""version"":""v1"",""created"":""Tue, 10 Nov 1998 18:35:20 GMT""}]","2009-10-31"
"cond-mat/9811136","Michael Potthoff","M. Potthoff and W. Nolting","Effective mass at the surface of a Fermi liquid","LaTeX, 2 pages, 1 eps figure included, Physica B (in press), SCES 98","Physica B 259-261, 760 (1999)","10.1016/S0921-4526(98)01126-0",,"cond-mat.str-el cond-mat.supr-con",,"  Using the dynamical mean-field theory, we calculate the effective electron
mass in the Hubbard model on a semi-infinite lattice. At the surface the
effective mass is strongly enhanced. Near half-filling this gives rise to a
correlation-driven one-electron surface mode.
","[{""version"":""v1"",""created"":""Tue, 10 Nov 1998 18:47:15 GMT""}]","2009-10-31"
"cond-mat/9811137","Michael Potthoff","M. Potthoff and W. Nolting","Dynamical mean-field study of the Mott transition in thin films","LaTeX, 17 pages, 15 eps figures included, Eur. Phys. J. B (in press)","Eur. Phys. J. B 8, 555 (1999)","10.1007/s100510050722",,"cond-mat.str-el cond-mat.supr-con",,"  The correlation-driven transition from a paramagnetic metal to a paramagnetic
Mott-Hubbard insulator is studied within the half-filled Hubbard model for a
thin-film geometry. We consider simple-cubic films with different low-index
surfaces and film thickness d ranging from d=1 (two-dimensional) up to d=8.
Using the dynamical mean-field theory, the lattice (film) problem is
self-consistently mapped onto a set of d single-impurity Anderson models which
are indirectly coupled via the respective baths of conduction electrons. The
impurity models are solved at zero temperature using the exact-diagonalization
algorithm. We investigate the layer and thickness dependence of the electronic
structure in the low-energy regime. Effects due to the finite film thickness
are found to be the more pronounced the lower is the film-surface coordination
number. For the comparatively open sc(111) geometry we find a strong layer
dependence of the quasi-particle weight while it is much less pronounced for
the sc(110) and the sc(100) film geometries. For a given geometry and thickness
d there is a unique critical interaction strength Uc2(d) at which all effective
masses diverge and there is a unique strength Uc1(d) where the insulating
solution disappears. Uc2(d) and Uc1(d) gradually increase with increasing
thickness eventually approaching their bulk values. A simple analytical
argument explains the complete geometry and thickness dependence of Uc2. Uc1 is
found to scale linearly with Uc2.
","[{""version"":""v1"",""created"":""Tue, 10 Nov 1998 18:57:37 GMT""}]","2009-10-31"
"cond-mat/9811138","Jon Machta","K. Moriarty, J. Machta (UMASS) and L. Y. Chayes (UCLA)","Dynamic and static properties of the invaded cluster algorithm","21 pages with 12 figures","Phys. Rev. E59 (1999) 1425-1434","10.1103/PhysRevE.59.1425",,"cond-mat.stat-mech",,"  Simulations of the two-dimensional Ising and 3-state Potts models at their
critical points are performed using the invaded cluster (IC) algorithm. It is
argued that observables measured on a sub-lattice of size l should exhibit a
crossover to Swendsen-Wang (SW) behavior for l sufficiently less than the
lattice size L, and a scaling form is proposed to describe the crossover
phenomenon. It is found that the energy autocorrelation time tau(l,L) for an
l*l sub-lattice attains a maximum in the crossover region, and a dynamic
exponent z for the IC algorithm is defined according to tau_max ~ L^z.
Simulation results for the 3-state model yield z=.346(.002) which is smaller
than values of the dynamic exponent found for the SW and Wolff algorithms and
also less than the Li-Sokal bound. The results are less conclusive for the
Ising model, but it appears that z<.21 and possibly that tau_max ~ log L so
that z=0 -- similar to previous results for the SW and Wolff algorithms.
","[{""version"":""v1"",""created"":""Tue, 10 Nov 1998 19:30:48 GMT""}]","2009-10-31"
"cond-mat/9811139","Christof Gattringer","Christof Gattringer (MIT)","A formula for the hopping expansion of 8-vertex models coupled to an
  external field","Revised version, to appear in Int. J. Mod. Phys. A. Remarks and
  references added, typos corrected","Int.J.Mod.Phys. A14 (1999) 4853","10.1142/S0217751X99002293","MIT-CTP-2801","cond-mat.stat-mech hep-lat hep-th",,"  We study a generalized 8-vertex model where the vertices are coupled to a
locally varying field. We rewrite the partition function as an integral over
Grassmann variables. In this form it is possible to explicitly evaluate all
terms of the hopping expansion. Applications of the resulting formula, in
particular its relation to 2-D lattice field theories with fermions are
discussed.
","[{""version"":""v1"",""created"":""Tue, 10 Nov 1998 22:03:59 GMT""},{""version"":""v2"",""created"":""Tue, 31 Aug 1999 14:29:04 GMT""}]","2009-10-31"
"cond-mat/9811140","Johan Feenstra","S. K. Dutta, C. P. Vlahacos, D. E. Steinhauer, Ashfaq S. Thanawalla,
  B. J. Feenstra, F. C. Wellstood, and Steven M. Anlage","Imaging Microwave Electric Fields Using a Near-Field Scanning Microwave
  Microscope","10 pages, 3 eps-figures, accepted by Appl. Phys. Lett","Appl. Phys. Lett. 74, 156 (1999)","10.1063/1.123137",,"cond-mat",,"  By scanning a fine open-ended coaxial probe above an operating microwave
device, we image local electric fields generated by the device at microwave
frequencies. The probe is sensitive to the electric flux normal to the face of
its center conductor, allowing different components of the field to be imaged
by orienting the probe appropriately. Using a simple model of the microscope,
we are able to interpret the system's output and determine the magnitude of the
electric field at the probe tip. We show images of electric field components
above a copper microstrip transmission line driven at 8 GHz, with a spatial
resolution of approximately 200 $\mu$m.
","[{""version"":""v1"",""created"":""Tue, 10 Nov 1998 22:44:27 GMT""}]","2009-10-31"
"cond-mat/9811141","Johan Feenstra","Ashfaq S. Thanawalla, B. J. Feenstra, Wensheng Hu, D. E. Steinhauer,
  S. K. Dutta, Steven M. Anlage, F. C. Wellstood (University of Maryland) and
  Robert B. Hammond (STI Inc.)","Frequency Following Imaging of Electric Fields from Resonant
  Superconducting Devices using a Scanning Near-Field Microwave Microscope","4 pages, postscript file with 6 figures conference proceeding for the
  Applied Superconductivity Conference 1998","IEEE Trans. Appl. Supercond. 9, 3042 (1999)","10.1109/77.783670",,"cond-mat.supr-con",,"  We have developed a scanning near-field microwave microscope that operates at
cryogenic temperatures. Our system uses an open-ended coaxial probe with a 200
mm inner conductor diameter and operates from 77 to 300 K in the 0.01-20 GHz
frequency range. In this paper, we present microwave images of the electric
field distribution above a Tl2Ba2CaCu2O8 microstrip resonator at 77 K, measured
at several heights. In addition, we describe the use of a frequency-following
circuit to study the influence of the probe on the resonant frequency of the
device.
","[{""version"":""v1"",""created"":""Tue, 10 Nov 1998 22:54:26 GMT""}]","2016-11-18"
"cond-mat/9811142","Peter Forrester","P.J. Forrester (U. of Melbourne), T. Nagao (Osaka University) and G.
  Honner (U. of Melbourne)","Correlations for the orthogonal-unitary and symplectic-unitary
  transitions at the hard and soft edges","37 pgs., 1fig",,"10.1016/S0550-3213(99)00272-2",,"cond-mat.mes-hall cond-mat.stat-mech",,"  For the orthogonal-unitary and symplectic-unitary transitions in random
matrix theory, the general parameter dependent distribution between two sets of
eigenvalues with two different parameter values can be expressed as a
quaternion determinant. For the parameter dependent Gaussian and Laguerre
ensembles the matrix elements of the determinant are expressed in terms of
corresponding skew-orthogonal polynomials, and their limiting value for
infinite matrix dimension are computed in the vicinity of the soft and hard
edges respectively. A connection formula relating the distributions at the hard
and soft edge is obtained, and a universal asymptotic behaviour of the two
point correlation is identified.
","[{""version"":""v1"",""created"":""Tue, 10 Nov 1998 22:56:05 GMT""}]","2009-10-31"
"cond-mat/9811143","Michael T. Woodside","Kent L. McCormick, Michael T. Woodside, Mike Huang, Mingshaw Wu, Paul
  McEuen, Cem Duruoz, J.S. Harris Jr","Scanned Potential Microscopy of Edge and Bulk Currents in the Quantum
  Hall Regime","4 pages, 5 figures",,"10.1103/PhysRevB.59.4654",,"cond-mat.mes-hall",,"  Using an atomic force microscope as a local voltmeter, we measure the Hall
voltage profile in a 2D electron gas in the quantum Hall (QH) regime. We
observe a linear profile in the bulk of the sample in the transition regions
between QH plateaus and a distinctly nonlinear profile on the plateaus. In
addition, localized voltage drops are observed at the sample edges in the
transition regions. We interpret these results in terms of theories of edge and
bulk currents in the QH regime.
","[{""version"":""v1"",""created"":""Wed, 11 Nov 1998 00:09:20 GMT""}]","2009-10-31"
"cond-mat/9811144","R. Chitra","R. Chitra and G. Kotliar","Dynamical Mean Field Theory of the Antiferromagnetic Metal to
  Antiferromagnetic Insulator Transition","4 pages, uses epsfig,4 figures,notational errors rectified",,"10.1103/PhysRevLett.83.2386",,"cond-mat.str-el",,"  We study the antiferromagnetic metal to antiferromagnetic insulator using
dynamical mean field theory and exact diagonalization methods. We find two
qualitatively different behaviors depending on the degree of magnetic
correlations. For strong correlations combined with magnetic frustration, the
transition can be described in terms of a renormalized slater theory, with a
continuous gap closure driven by the magnetism but strongly renormalized by
correlations. For weak magnetic correlations, the transition is weakly first
order.
","[{""version"":""v1"",""created"":""Wed, 11 Nov 1998 00:41:20 GMT""},{""version"":""v2"",""created"":""Thu, 3 Dec 1998 21:27:42 GMT""}]","2009-10-31"
"cond-mat/9811146","Ching-Long Wu","Ching-Long Wu, Chung-Yu Mou, Xiao-Gang Wen and Darwin Chang","Preformed Pairs, SU(2) Slave-boson Theory, and High T_c Superconductors","12 pages, RevTEX",,,,"cond-mat.supr-con",,"  A preformed-pair model was considered. The quantum disordered phase of the
d-wave superconducting state was obtained by turning on an on-site repulsion.
The low energy effective theory of the quantum disordered phase was derived,
which was found to be qualitatively equivalent to the low energy effective
theory of the SU(2) slave-boson theory in the staggered-flux phase. Many
physical properties of the disordered phase at low energies were obtained, such
as the Mott insulator property at zero doping, spin gap and low superfluid
density at low doping.
","[{""version"":""v1"",""created"":""Wed, 11 Nov 1998 03:40:56 GMT""}]","2007-05-23"
"cond-mat/9811147","James Anglin","Th. Busch and J.R. Anglin","Instabilities of wave function monopoles in Bose-Einstein condensates","4 pages, 9 figures (compressed figures become legible when zoomed or
  when paper is actually printed)",,"10.1103/PhysRevA.60.R2669",,"cond-mat",,"  We present analytic and numerical results for a class of monopole solutions
to the two-component Gross-Pitaevski equation for a two-species Bose condensate
in an effectively two-dimensional trap. We exhibit dynamical instabilities
involving vortex production as one species pours through another, from which we
conclude that the sub-optical sharpness of potentials exerted by matter waves
makes condensates ideal tools for manipulating condensates. We also show that
there are two equally valid but drastically different hydrodynamic descriptions
of a two-component condensate, and illustrate how different phenomena may
appear simpler in each.
","[{""version"":""v1"",""created"":""Wed, 11 Nov 1998 05:06:52 GMT""}]","2009-10-31"
"cond-mat/9811148","Nikulov Alexey","A.V.Nikulov and I.N.Zhilyaev","The Little-Parks effect in an inhomogeneous superconducting ring","9 pages, LaTex, 0 figures","Journal of Low Temperature Physics vol.112, Nos.3/4, August 1998,
  pp.227-295",,,"cond-mat.supr-con cond-mat.stat-mech",,"  An inhomogeneous superconducting ring placed in a magnetic field is
considered. It is shown that the superconducting transition of the section with
lowest critical temperature may be a first order phase transition if the
magnetic flux contained within the ring is not divisible by the flux quantum.
In the visinity of this transition, thermal fluctuations can induce the direct
voltage in the ring with rather small sizes. The voltage value depends in a
periodic manner on the magnetic flux contained within the ring. According to
this result, the entropy value can be decreased in the considered quantum
system. The chaotic heat energy can be transformed in the electric energy of
the direct current.
","[{""version"":""v1"",""created"":""Wed, 11 Nov 1998 08:22:50 GMT""}]","2007-05-23"
"cond-mat/9811149","Kiet Anh Nguyen","A. K. Nguyen and A. Sudb{\o}","A new broken U(1)-symmetry in extreme type-II superconductors","5 pages, 3 figures","EuroPhys. Lett. 46, 780 (1999)","10.1209/epl/i1999-00332-7",,"cond-mat.supr-con",,"  A phase transition within the molten phase of the Abrikosov vortex system
without disorder in extreme type-II superconductors is found via large-scale
Monte-Carlo simulations. It involves breaking a U(1)-symmetry, and has a
zero-field counterpart, unlike vortex lattice melting. Its hallmark is the loss
of number-conservation of connected vortex paths threading the entire system
{\it in any direction}, driving the vortex line tension to zero. This tension
plays the role of a generalized ``stiffness'' of the vortex liquid, and serves
as a probe of the loss of order at the transition, where a weak specific heat
anomaly is found.
","[{""version"":""v1"",""created"":""Wed, 11 Nov 1998 11:58:11 GMT""},{""version"":""v2"",""created"":""Mon, 31 May 1999 17:29:45 GMT""}]","2009-10-31"
"cond-mat/9811150","Richard P. Sear","Richard P. Sear","Depletion induced demixing in polydisperse mixtures of hard spheres","5 pages, 1 Postscript figure","Physical Review Letters v82 p4244-4247 (1999)","10.1103/PhysRevLett.82.4244",,"cond-mat.soft cond-mat.stat-mech",,"  Polydisperse mixtures are those in which components with a whole range of
sizes are present. It is shown that the fluid phase of polydisperse hard
spheres is thermodynamically unstable unless the density of large spheres
decreases at least exponentially as their size increases. The instability is
with respect to the large spheres crystallising out into multiple solid phases.
","[{""version"":""v1"",""created"":""Wed, 11 Nov 1998 12:41:09 GMT""}]","2009-10-31"
"cond-mat/9811152","Patrick Bruno","Josef Kudrnovsky, Vaclav Drchal, Ilja Turek, Patrick Bruno, Peter
  Dederichs, Peter Weinberger","Ab initio theory of the interlayer exchange coupling","34 pages, LaTeX2e, Springer-Verlag style (style files included), 7
  figures. Talk given at the ""Workshop on the TB-LMTO Method"",
  Mont-Sainte-Odile, France, October 1998. v2: ref. added. Further (p)reprints
  available from http://www.mpi-halle.de/~theory/","""Electronic Structure and Physical Properties of Solids. The Uses
  of the LMTO Method"", edited by Hugues Dreysse (Springer Verlag, Berlin,
  2000), pp. 313-346",,,"cond-mat.mes-hall cond-mat.mtrl-sci",,"  Ab initio formulations of the interlayer exchange coupling (IEC) between two,
in general non-collinearly aligned magnetic slabs embedded in a non-magnetic
spacer are reviewed whereby both the spacer and the magnetic slabs as well as
their interfaces may be either ideal or random. These formulations are based on
the spin-polarized surface Green function technique within the tight-binding
linear muffin-tin orbital method, the Lloyd formulation of the IEC, and the
coherent potential approximation using the vertex-cancellation theorem. We also
present an effective method for the study of the temperature dependence of the
IEC. The periods, amplitudes, and phases are studied in terms of discrete
Fourier transformations, the asymptotic behavior of the IEC is briefly
discussed within the stationary-phase method. Numerical results illustrating
the theory are presented.
","[{""version"":""v1"",""created"":""Wed, 11 Nov 1998 13:32:48 GMT""},{""version"":""v2"",""created"":""Thu, 27 Jul 2000 15:12:10 GMT""}]","2007-05-23"
