"cond-mat/9811153","Yamir Moreno Vega","J. B. Gomez, M. Vazquez-Prada, Y. Moreno, and A. F. Pacheco
  (Departamento de Fisica Teorica, Universidad de Zaragoza, Zaragoza, Spain)","Bounds for the time to failure of hierarchical systems of fracture","Final version. To appear in Phys. Rev. E, Feb 1999","Phys. Rev. E., 59, R1287 (1999)","10.1103/PhysRevE.59.R1287",,"cond-mat.stat-mech cond-mat.dis-nn",,"  For years limited Monte Carlo simulations have led to the suspicion that the
time to failure of hierarchically organized load-transfer models of fracture is
non-zero for sets of infinite size. This fact could have a profound
significance in engineering practice and also in geophysics. Here, we develop
an exact algebraic iterative method to compute the successive time intervals
for individual breaking in systems of height $n$ in terms of the information
calculated in the previous height $n-1$. As a byproduct of this method,
rigorous lower and higher bounds for the time to failure of very large systems
are easily obtained. The asymptotic behavior of the resulting lower bound leads
to the evidence that the above mentioned suspicion is actually true.
","[{""version"":""v1"",""created"":""Wed, 11 Nov 1998 15:24:45 GMT""},{""version"":""v2"",""created"":""Tue, 29 Dec 1998 09:40:13 GMT""},{""version"":""v3"",""created"":""Wed, 30 Dec 1998 10:37:27 GMT""}]","2009-10-31"
"cond-mat/9811154","Staffan Grundberg","Staffan Grundberg and J{\o}rgen Rammer","Self-consistent theory of dynamic melting of a vortex lattice","9 pages, 1 figure, revtex, revised version",,,,"cond-mat.supr-con",,"  The dynamic melting of vortex lattices in type II superconductors is
considered. A field-theoretic formulation of the pinning problem allows the
average over the quenched disorder to be performed exactly. A self-consistent
theory is constructed using a functional method for the effective action,
allowing a determination of the pinning force and the vortex fluctuations. The
phase diagram for the dynamic melting transition is determined numerically. In
contrast to perturbation theory, the self-consistent theory is in quantitative
agreement with the prediction of a recent phenomenological theory and
simulations and experimental data.
","[{""version"":""v1"",""created"":""Wed, 11 Nov 1998 14:46:28 GMT""},{""version"":""v2"",""created"":""Tue, 23 Mar 1999 08:14:10 GMT""}]","2007-05-23"
"cond-mat/9811155","Yuli V. Nazarov","Yuli V. Nazarov","Novel Circuit Theory of Andreev Reflection","10 pages RevTex, 1 figure, subm. to Superlattices and Microstructures",,"10.1006/spmi.1999.0738",,"cond-mat.mes-hall",,"  We review here a novel circuit theory of superconductivity. The existed
circuit theory of Andreev reflection has been revised to account for
decoherence between electrons and holes and twofold nature of the distribution
function. The description of arbitrary connectors has been elaborated. In this
way one can cope with the most of the factors that limited applicability of the
old circuit theory. We give a simple example and discuss numerical
implementation of the theory.
","[{""version"":""v1"",""created"":""Wed, 11 Nov 1998 15:19:07 GMT""}]","2009-10-31"
"cond-mat/9811156","Christa Oligschleger","C. Oligschleger, J.C. Sch""on","Simulation of thermal conductivity and heat transport in solids","Revtex, 8 pages, 11 postscript figures, accepted for publication in
  PRB",,"10.1103/PhysRevB.59.4125",,"cond-mat.mtrl-sci cond-mat.dis-nn",,"  Using molecular dynamics (MD) with classical interaction potentials we
present calculations of thermal conductivity and heat transport in crystals and
glasses. Inducing shock waves and heat pulses into the systems we study the
spreading of energy and temperature over the configurations. Phonon decay is
investigated by exciting single modes in the structures and monitoring the time
evolution of the amplitude using MD in a microcanonical ensemble. As examples,
crystalline and amorphous modifications of Selenium and $\rm{SiO_2}$ are
considered.
","[{""version"":""v1"",""created"":""Wed, 11 Nov 1998 15:28:24 GMT""}]","2009-10-31"
"cond-mat/9811157","Ch. Binek","Ch. Binek","Density of Zeros on the Lee-Yang circle obtained from magnetization data
  of a two-dimensional Ising ferromagnet","4 figures. Phys. Rev. Lett. (in press)",,"10.1103/PhysRevLett.81.5644",,"cond-mat.stat-mech",,"  In order to provide an experimental access to the statistical theory of Lee
and Yang (1952) the density function g(theta) of zeros on the Lee-Yang circle
has been determined for the first time by analyzing isothermal magnetization
data, m(H), of the Ising ferromagnet FeCl2 in axial magnetic fields, H, at
temperatures 34 < T < 99K. The validity of our approach is demonstrated by the
perfect agreement of magnetic specific heat data as calculated from g(theta)
and m(H) via Maxwells relation, respectively. Moreover, the correct in-plane
exchange constant of FeCl2 emerges from the series expansion of m(H) involved
in the analysis.
","[{""version"":""v1"",""created"":""Wed, 11 Nov 1998 15:33:34 GMT""}]","2009-10-31"
"cond-mat/9811158","Johan Feenstra","Steven M. Anlage, D. E. Steinhauer, C. P. Vlahacos, B. J. Feenstra, A.
  S. Thanawalla, Wensheng Hu, Sudeep K. Dutta, and F. C. Wellstood (University
  of Maryland)","Superconducting Material Diagnostics using a Scanning Near-Field
  Microwave Microscope","6 pages with 9 figures, Proceedings of the Applied Superconductivity
  Conference 1998","IEEE Trans. Appl. Supercond. 9, 4127 (1999)","10.1109/77.783934",,"cond-mat.mtrl-sci cond-mat.supr-con",,"  We have developed scanning near-field microwave microscopes which can image
electrodynamic properties of superconducting materials on length scales down to
about 2 $\mu$m. The microscopes are capable of quantitative imaging of sheet
resistance of thin films, and surface topography. We demonstrate the utility of
the microscopes through images of the sheet resistance of a YBa2Cu3O7-d thin
film wafer, images of bulk Nb surfaces, and spatially resolved measurements of
Tc of a YBa2Cu3O7-d thin film. We also discuss some of the limitations of the
microscope and conclude with a summary of its present capabilities.
","[{""version"":""v1"",""created"":""Wed, 11 Nov 1998 15:59:53 GMT""}]","2016-11-18"
"cs/9811015","Lunjin Lu","Lunjin Lu and John G. Cleary (University of Waikato)","An Emptiness Algorithm for Regular Types with Set Operators","22 pages",,,,"cs.LO cs.PL",,"  An algorithm to decide the emptiness of a regular type expression with set
operators given a set of parameterised type definitions is presented. The
algorithm can also be used to decide the equivalence of two regular type
expressions and the inclusion of one regular type expression in another. The
algorithm strictly generalises previous work in that tuple distributivity is
not assumed and set operators are permitted in type expressions.
","[{""version"":""v1"",""created"":""Wed, 11 Nov 1998 04:50:28 GMT""}]","2007-05-23"
"cs/9811016","Martin Volk","Martin Volk and Gerold Schneider (University of Zurich)","Comparing a statistical and a rule-based tagger for German","8 pages",,,,"cs.CL",,"  In this paper we present the results of comparing a statistical tagger for
German based on decision trees and a rule-based Brill-Tagger for German. We
used the same training corpus (and therefore the same tag-set) to train both
taggers. We then applied the taggers to the same test corpus and compared their
respective behavior and in particular their error rates. Both taggers perform
similarly with an error rate of around 5%. From the detailed error analysis it
can be seen that the rule-based tagger has more problems with unknown words
than the statistical tagger. But the results are opposite for tokens that are
many-ways ambiguous. If the unknown words are fed into the taggers with the
help of an external lexicon (such as the Gertwol system) the error rate of the
rule-based tagger drops to 4.7%, and the respective rate of the statistical
taggers drops to around 3.7%. Combining the taggers by using the output of one
tagger to help the other did not lead to any further improvement.
","[{""version"":""v1"",""created"":""Wed, 11 Nov 1998 11:06:34 GMT""}]","2007-05-23"
"cs/9811017","Marc Bezem","Krzysztof R. Apt and Marc Bezem","Formulas as Programs","34 pages, appears in: The Logic Programming Paradigm: a 25 Years
  Perspective, K.R. Apt, V. Marek, M. Truszczynski and D.S. Warren (eds),
  Springer-Verlag, Artificial Intelligence Series",,,,"cs.LO cs.SC",,"  We provide here a computational interpretation of first-order logic based on
a constructive interpretation of satisfiability w.r.t. a fixed but arbitrary
interpretation. In this approach the formulas themselves are programs. This
contrasts with the so-called formulas as types approach in which the proofs of
the formulas are typed terms that can be taken as programs. This view of
computing is inspired by logic programming and constraint logic programming but
differs from them in a number of crucial aspects.
  Formulas as programs is argued to yield a realistic approach to programming
that has been realized in the implemented programming language ALMA-0 (Apt et
al.) that combines the advantages of imperative and logic programming. The work
here reported can also be used to reason about the correctness of non-recursive
ALMA-0 programs that do not include destructive assignment.
","[{""version"":""v1"",""created"":""Wed, 11 Nov 1998 14:05:13 GMT""}]","2007-05-23"
"cs/9811018","Mark D. Roberts","Mark D. Roberts","P-model Alternative to the T-model","28 pages, 73262 bytes, six eps diagrams, 53 references, background to
  this work is described:
  http://cosmology.mth.uct.ac.za/~roberts/pastresearch/pmodel.html",,,,"cs.CL q-bio.NC",,"  Standard linguistic analysis of syntax uses the T-model. This model requires
the ordering: D-structure $>$ S-structure $>$ LF. Between each of these
representations there is movement which alters the order of the constituent
words; movement is achieved using the principles and parameters of syntactic
theory. Psychological serial models do not accommodate the T-model immediately
so that here a new model called the P-model is introduced. Here it is argued
that the LF representation should be replaced by a variant of Frege's three
qualities. In the F-representation the order of elements is not necessarily the
same as that in LF and it is suggested that the correct ordering is:
F-representation $>$ D-structure $>$ S-structure. Within this framework
movement originates as the outcome of emphasis applied to the sentence.
","[{""version"":""v1"",""created"":""Wed, 11 Nov 1998 14:17:09 GMT""},{""version"":""v2"",""created"":""Sun, 13 Aug 2000 12:52:13 GMT""},{""version"":""v3"",""created"":""Sun, 8 Jul 2001 18:51:35 GMT""}]","2007-05-23"
"gr-qc/9811029","Andrew DeBenedictis","A. DeBenedictis","Gravitational Effects of Quantum Fields in the Interior of a Cylindrical
  Black Hole","13 pages, 1 figure, uses AMS package. D.E. solution corrected. Some
  qualitative results are changed","Class.Quant.Grav. 16 (1999) 1955-1962","10.1088/0264-9381/16/6/324",,"gr-qc",,"  The gravitational back-reaction is calculated for the conformally invariant
scalar field within a black cosmic string interior with cosmological constant.
Using the perturbed metric, the gravitational effects of the quantum field are
calculated. It is found that the perturbations initially strengthen the
singularity. This effect is similar to the case of spherical symmetry (without
cosmological constant). This indicates that the behaviour of quantum effects
may be universal and not dependent on the geometry of the spacetime nor the
presence of a non-zero cosmological constant.
","[{""version"":""v1"",""created"":""Tue, 10 Nov 1998 18:59:09 GMT""},{""version"":""v2"",""created"":""Fri, 13 Nov 1998 00:33:17 GMT""},{""version"":""v3"",""created"":""Wed, 18 Nov 1998 21:24:35 GMT""}]","2009-10-31"
"gr-qc/9811030","Rafael D. Sorkin","Rafael D. Sorkin (Syracuse University and Perimeter Institute)","An energy bound deduced from the vanishing of the radiation reaction
  force during uniform acceleration","4 pages, plainTeX. New title, appendix added, small corrections and
  additions. Source for most up to date version:
  http://www.physics.syr.edu/~sorkin",,,"SU-GP-98/11-1","gr-qc hep-th physics.class-ph",,"  We deduce from energy conservation a lower bound on the mass of any system
capable of imparting a constant acceleration to a charged body. We also point
out a connection between this bound and the so called dominant energy condition
of general relativity.
","[{""version"":""v1"",""created"":""Tue, 10 Nov 1998 22:21:22 GMT""},{""version"":""v2"",""created"":""Tue, 7 Oct 2003 06:35:58 GMT""},{""version"":""v3"",""created"":""Wed, 4 Feb 2004 01:02:54 GMT""}]","2007-05-23"
"gr-qc/9811031","Istvan Racz","Istvan Racz","On the existence of Killing vector fields","9 pages, no figure, to appear in Class. Quant. Grav","Class.Quant.Grav. 16 (1999) 1695-1703","10.1088/0264-9381/16/6/304",,"gr-qc hep-th",,"  In covariant metric theories of coupled gravity-matter systems the necessary
and sufficient conditions ensuring the existence of a Killing vector field are
investigated. It is shown that the symmetries of initial data sets are
preserved by the evolution of hyperbolic systems.
","[{""version"":""v1"",""created"":""Wed, 11 Nov 1998 08:23:06 GMT""},{""version"":""v2"",""created"":""Mon, 22 Mar 1999 15:40:19 GMT""}]","2009-10-31"
"gr-qc/9811032","Shahar Hod","Shahar Hod","Late-Time Evolution of Realistic Rotating Collapse and The No-Hair
  Theorem","16 pages","Phys.Rev. D58 (1998) 104022","10.1103/PhysRevD.58.104022",,"gr-qc",,"  We study analytically the asymptotic late-time evolution of realistic
rotating collapse. This is done by considering the asymptotic late-time
solutions of Teukolsky's master equation, which governs the evolution of
gravitational, electromagnetic, neutrino and scalar perturbations fields on
Kerr spacetimes. In accordance with the no-hair conjecture for rotating
black-holes we show that the asymptotic solutions develop inverse power-law
tails at the asymptotic regions of timelike infinity, null infinity and along
the black-hole outer horizon (where the power-law behaviour is multiplied by an
oscillatory term caused by the dragging of reference frames). The damping
exponents characterizing the asymptotic solutions at timelike infinity and
along the black-hole outer horizon are independent of the spin parameter of the
fields. However, the damping exponents at future null infinity are spin
dependent. The late-time tails at all the three asymptotic regions are
spatially dependent on the spin parameter of the field. The rotational dragging
of reference frames, caused by the rotation of the black-hole (or star) leads
to an active coupling of different multipoles.
","[{""version"":""v1"",""created"":""Wed, 11 Nov 1998 12:19:34 GMT""},{""version"":""v2"",""created"":""Thu, 12 Nov 1998 08:46:22 GMT""}]","2009-10-31"
"gr-qc/9811033","Ilja Schmelzer","Ilja Schmelzer","A Metric Theory of Gravity with Condensed Matter Interpretation","11 pages Latex, no figures",,,"WIAS preprint No. 447 (ISSN 0946-8633)","gr-qc",,"  We define a metric theory of gravity with preferred Newtonian frame
(X^i(x),T(x)) by
  L = L_{GR}
  + \Xi g^{mn}\delta_{ij}X^i_{,m}X^j_{,n}
  - \Upsilon g^{mn}T_{,m}T_{,n}
  It allows a condensed matter interpretation which generalizes LET to gravity.
  The \Xi-term influences the age of the universe. \Upsilon>0 allows to avoid
big bang singularity and black hole horizon formation. This solves the horizon
problem without inflation. An atomic hypothesis solves the ultraviolet problem
by explicit regularization. We give a prediction about cutoff length.
","[{""version"":""v1"",""created"":""Wed, 11 Nov 1998 13:18:04 GMT""},{""version"":""v2"",""created"":""Thu, 12 Nov 1998 11:51:03 GMT""},{""version"":""v3"",""created"":""Mon, 16 Nov 1998 12:32:27 GMT""}]","2007-05-23"
"gr-qc/9811034","Juan A. Valiente","Juan Antonio Valiente Kroon","A comment on the Outgoing Radiation Condition and the Peeling Theorem","5 pages. Submitted to Classical & Quantum Gravity","Gen.Rel.Grav. 31 (1999) 1219-1224",,,"gr-qc",,"  The connection between the Bondi-Sachs (BS) and the Newman-Penrose (NP)
framework for the study of the asymptotics of the gravitational field is done.
In particular the coordinate transformation relationg the BS luminosity
parameter and the NP affine parameter is obtained. Using this coordinate
transformation it is possible to express BS quantities in terms of NP
quantities, and to show that if the Outgoing Radiation Condition is not
satisfied then the spacetime will not decay in the way prescribed by the
Peeling theorem.
","[{""version"":""v1"",""created"":""Wed, 11 Nov 1998 14:09:34 GMT""}]","2007-05-23"
"hep-ex/9811016","Nader Copty","Fermilab E791 Collaboration: E. M. Aitala, et al","Measurement of the Ds Lifetime","12 pages, 3 figures, 2 table. LaTeX","Phys.Lett.B445:449-454,1999","10.1016/S0370-2693(98)01476-2","USCHEP-9801","hep-ex",,"  We report the results of a precise measurement of the Ds meson lifetime based
on 1662 +/- 56 fully reconstructed Ds -> phi pi decays, from the charm
hadroproduction experiment E791 at Fermilab. Using an unbinned maximum
likelihood fit, we measure the Ds lifetime to be 0.518 +/- 0.014 +/- 0.007 ps.
The ratio of the measured Ds lifetime to the world average D0 lifetime is 1.25
+/- 0.04. This result differs from unity by six standard deviations, indicating
significantly different lifetimes for the Ds and the D0.
","[{""version"":""v1"",""created"":""Tue, 10 Nov 1998 16:10:13 GMT""}]","2008-11-26"
"hep-ex/9811017","Saverio Braccini","Saverio Braccini","The K0sK0s Final State in Two-Photon Collisions and Some Implications
  for Glueball Searches","7 pages, 5 figures, Invited contribution to LEAP98, Villasimius,
  Italy, September 1998","Nucl.Phys. A655 (1999) 143-148","10.1016/S0375-9474(99)00194-3",,"hep-ex",,"  The K0sK0s final state in two-photon collisions is studied with the L3
detector at LEP using data at centre of mass energies from 91 GeV to 183 GeV.
The K0sK0s mass spectrum is dominated by the formation of the f_2'(1525) tensor
meson whose two-photon partial width is measured. Clear evidence for
destructive f_2-a_2 interference is observed. No signal is present in the
region around 2.2 GeV. An upper limit for the two-photon partial width times
the K0sK0s branching ratio of the \xi(2230) glueball candidate is then derived.
An enhancement is observed around 1750 MeV. It may be due to the formation of a
radial recurrence of the f_2'(1525) or to the s\bar{s} member of the 0++ meson
nonet.
","[{""version"":""v1"",""created"":""Tue, 10 Nov 1998 18:37:21 GMT""}]","2009-10-31"
"hep-ex/9811018","Brunner","ALEPH collaboration","Search for B0s oscillations using inclusive lepton events","23 pages, 10 figures","Eur.Phys.J.C7:553-569,1999","10.1007/s100529901108","CERN-EP/98-117","hep-ex",,"  A search for B0s oscillations is performed using a sample of semileptonic
b-hadron decays collected by the ALEPH experiment during 1991-1995. Compared to
previous inclusive lepton analyses, the proper time resolution and b-flavour
mistag rate are significantly improved. Additional sensitivity to B0s mixing is
obtained by identifying subsamples of events having a B0s purity which is
higher than the average for the whole data sample. Unbinned maximum likelihood
amplitude fits are performed to derive a lower limit of Deltam_s>9.5ps^-1 at
95% CL. Combining with the ALEPH D-s based analyses yields Deltam_s>9.6ps^-1 at
95% CL.
","[{""version"":""v1"",""created"":""Wed, 11 Nov 1998 08:20:47 GMT""}]","2012-08-27"
"hep-ex/9811019","Tamar Djobava","M.Anikina, L.Chkhaidze, T.Djobava, V.Garsevanishvili, L.Kharkhelauri","The Light Front Analysis of pi^{-} Mesons Produced in the Relativistic
  Nucleus-Nucleus Collisions","15 pages with 13 postscript figures",,,"HEPI-98-07","hep-ex",,"  The light front analysis of pi^{-} mesons in A_{P} (He, C, Mg, O) + A_{T}
(Li,C, Ne, Mg,Cu,Pb) collisions is carried out. The phase space of secondary
pions is naturally divided into two parts in one of which the thermal
equilibration assumption seems to be in a good agreement with data.
Corresponding temperatures are extracted and compared to the results of other
experiments. The dependence of the average temperature T on (A_{P}*A_{T})^{1/2}
is studied.
","[{""version"":""v1"",""created"":""Wed, 11 Nov 1998 10:25:24 GMT""}]","2007-05-23"
"hep-ex/9811020","Sergei Khaltourtsev","Yu.V.Kozlov, S.V.Khalturtsev, I.N.Machulin, A.V.Martemyanov,
  V.P.Martemyanov, A.A.Sabelnikov, S.V.Sukhotin, V.G.Tarasenkov, E.V.Turbin,
  V.N.Vyrodov","Modern Status of Neutrino Experiments at the Underground Neutrino
  Laboratory of Kurchatov Institute Near Krasnoyarsk Nuclear Reactor","10 pages, 3 figures",,,,"hep-ex",,"  The investigation of antineutrino-deuteron interaction at Krasnoyarsk reactor
are discussed. The characteristics of the installation ''Deuteron'', present
results and perspectives of Krasnoyarsk neutrino laboratory are presented.
","[{""version"":""v1"",""created"":""Wed, 11 Nov 1998 11:35:49 GMT""}]","2007-05-23"
"hep-ex/9811021","Brunner","ALEPH collaboration","Study of D0-Dbar0 mixing and D0 doubly cabibbo-suppressed decays","14 pages, 5 figures","Phys.Lett.B436:211-221,1998","10.1016/S0370-2693(98)00946-0","CERN-EP/98-118","hep-ex",,"  Using a sample of four million hadronic Z events collected in ALEPH from 1991
to 1995, the decays D*+ -> D0pi^+_s, with D0 decaying to K-pi+ or to K+pi-, are
studied. The relative branching ratio B(D0 -> K+pi-)/B(D0 -> K-pi+) is measured
to be (1.84+-0.59(stat.)+-0.34(syst.))%. The two possible contributions to the
D0 -> K+pi- decay, doubly cabibbo-suppressed decays and D0-Dbar0 mixing, are
disentangled by measuring the proper-time ditribution of the reconstructed
D0's. Assuming no interference between the two processes, the upper limit
obtained on the mixing rate is 0.92% at 95% CL. The possible effect of
interference between the two amplitudes is also assessed.
","[{""version"":""v1"",""created"":""Wed, 11 Nov 1998 13:14:37 GMT""}]","2012-08-27"
"hep-ex/9811022","Bela Majorovits","L. Baudis, G. Heusser, B. Majorovits, Y. Ramachers, H. Strecker, H.V.
  Klapdor-Kleingrothaus","The GENIUS Project - Background and technical studies","8 pages, LaTeX, 4 figures, requires ws-p8-50x6-00.cls, To appear in
  Proceedings of IDM98, Buxton, England, Talk presented by B. Majorovits",,,,"hep-ex",,"  The potential of GENIUS as a dark matter detector is discussed. A study was
performed to demonstrate the good behaviour of the proposed detector design of
naked HPGe-crystals in liquid nitrogen. The expected background components were
simulated and are discussed in some detail.With the obtained background GENIUS
could cover a large part of the favoured MSSM parameter-space.
","[{""version"":""v1"",""created"":""Wed, 11 Nov 1998 14:08:31 GMT""}]","2007-05-23"
"hep-ex/9811023","Bernd Surrow","Bernd Surrow","The structure of the photon and its interactions","18 pages with 20 eps files. Invited talk given at the Workshop on
  Photon Interactions and the Photon Structure, Lund, Sweden, September 10-13,
  1998 to be published in the proceedings",,,,"hep-ex",,"  The OPAL experiment at LEP has performed a variety of measurements of
photon-photon and electron-photon scattering at the electron-positron collider
LEP to gain a deeper insight into the structure of the photon and its
interactions. This review presents a summary of these results.
","[{""version"":""v1"",""created"":""Wed, 11 Nov 1998 15:10:32 GMT""}]","2007-05-23"
"hep-lat/9811014","Christof Gattringer","Christof Gattringer (MIT)","Loop representation for 2-D Wilson lattice fermions in a scalar
  background field",,"Nucl.Phys. B543 (1999) 533-542","10.1016/S0550-3213(99)00021-8","MIT-CTP-2800","hep-lat cond-mat.stat-mech hep-th",,"  We show that the fermion determinant for 2-D Wilson lattice fermions coupled
to an external scalar field is equivalent to self avoiding loops interacting
with the external field. In an application of the resulting formula we
integrate the scalar field with a Gaussian action to generate the N-component
Gross-Neveu model. The loop representation for this model is discussed.
","[{""version"":""v1"",""created"":""Tue, 10 Nov 1998 21:50:12 GMT""}]","2009-10-31"
"hep-lat/9811015","A. Kovner","Alex Kovner (Oxford University), Benjamin Svetitsky (Tel Aviv
  University)","Interaction potential in compact three-dimensional QED with mixed action","22 pages, Latex -- final version, minor changes from first version","Phys.Rev. D60 (1999) 105032","10.1103/PhysRevD.60.105032","OUTP-98-75 P","hep-lat hep-th",,"  We use a variational wave function to calculate the energy of the interaction
between external charges in the compact Abelian gauge theory in 2+1 dimensions
with mixed action. Our variational wave functions preserve the compact gauge
invariance of the theory both in the vacuum and in the charged sectors. We find
that a good estimate of the interaction energy is obtained only when we allow
more variational parameters in the charged sector than in the vacuum sector.
These extra parameters are the profile of an induced electric field. We find
that the theory has a two-phase structure: When the charge-2 coupling is large
and negative there is no mass gap in the theory and no confinement, while
otherwise a mass gap is generated dynamically and the theory confines charges.
The pure Wilson theory is in the confining phase.
","[{""version"":""v1"",""created"":""Wed, 11 Nov 1998 12:46:22 GMT""},{""version"":""v2"",""created"":""Sun, 1 Aug 1999 09:16:32 GMT""}]","2009-10-31"
