"hep-ph/9809378","B. J. Nauta","Bert-Jan Nauta and Chris van Weert","Real-Time Dimensional Reduction in Thermal Field Theory","6 pages, Talk given at TFT98, Regensburg, Germany, August 10-14, 1998
  some typos corrected and a discussion on an intermediate cut-off added",,,"ITFA-98-20","hep-ph",,"  We consider the extension of static dimensional reduction to real-time. For a
scalar field theory it is shown that in the high-temperature limit this leads
to an effective classical theory. Quantum corrections to the leading classical
behavior are determined by an effective action which can be calculated
perturbatively in the background of the classical fields. Feynman rules for
(\lambda\phi^4)-theory are given and the extension to SU($N$) gauge theories is
outlined.
","[{""version"":""v1"",""created"":""Mon, 14 Sep 1998 16:14:08 GMT""},{""version"":""v2"",""created"":""Wed, 18 Nov 1998 15:00:55 GMT""}]","2007-05-23"
"hep-ph/9809379","Andre Peshier","Andr\'e Peshier","Quasiparticle description of strongly coupled plasmas","4 pages twocolumn REVTeX, 2 eps figures, minor corrections",,,,"hep-ph",,"  The extrapolation of truncated perturbative series to the large coupling
regime is not reliable since the accuracy of the calculations cannot be
improved systematically by a finite set of higher order terms. Instead, a
nonperturbative approach is proposed here to describe the thermodynamics of
strongly coupled plasmas. Within the $\phi^4$ theory, it is derived from the
Luttinger-Ward theorem and amounts to a quasiparticle description. The approach
is extended to the quark-gluon plasma. Even close to the confinement
temperature it is found to be in a good agreement with lattice data of several
gauge systems. The model is applied to predict the equation of state of the
quark-gluon plasma with realistic quark masses.
","[{""version"":""v1"",""created"":""Mon, 14 Sep 1998 16:07:11 GMT""},{""version"":""v2"",""created"":""Thu, 5 Nov 1998 15:15:51 GMT""}]","2007-05-23"
"hep-ph/9809380","Francois Gelis","Francois Gelis","Quasi-real photon production in thermal QCD","Revtex, postscript figures included with epsf, 9 pages",,,"LAPTH-98/699","hep-ph",,"  In this proceedings, I consider two-loop contributions to real photon
production in thermal QCD. If the photon is strictly massless, strong collinear
divergences appear in this calculation. These singularities are regularized by
the quark thermal mass of order $gT$, which generates powers of $1/g$, so that
the corresponding terms are strongly enhanced with respect to naive
expectations of their order of magnitude.
","[{""version"":""v1"",""created"":""Mon, 14 Sep 1998 16:47:09 GMT""},{""version"":""v2"",""created"":""Mon, 12 Oct 1998 08:04:39 GMT""}]","2007-05-23"
"hep-ph/9809381","Wilfried Buchmuller","M.Bolz, W. Buchm\""uller, M. Pl\""umacher","Baryon Asymmetry and Dark Matter","10 pages, 2 figures included, eq. (13) replaced by leading order
  approximation","Phys.Lett. B443 (1998) 209-213","10.1016/S0370-2693(98)01342-2","DESY-98-066","hep-ph astro-ph",,"  We study the implications of a large baryogenesis temperature, $T_B =
O(10^{10}$ GeV), on the mass spectrum of superparticles in supersymmetric
extensions of the standard model. Models with a neutralino as lightest
superparticle (LSP) are excluded. A consistent picture is obtained with the
gravitino as LSP, followed by a higgsino-like neutralino (NSP). Gravitinos with
masses from 10 to 100 GeV may be the dominant component of dark matter.
","[{""version"":""v1"",""created"":""Mon, 14 Sep 1998 17:36:51 GMT""},{""version"":""v2"",""created"":""Mon, 21 Sep 1998 17:20:32 GMT""}]","2009-10-31"
"hep-ph/9809382","Sourendu Gupta","Saumen Datta and Sourendu Gupta","Dimensional Reduction in High Temperature Gauge Theories","Talk given at the 5th International Workshop on Thermal Field
  Theories and their Applications, Regensburg, Germany, August 1998",,,,"hep-ph",,"  Screening masses in the equilibrium thermodynamics of gauge theories were
measured. The spectroscopy of these screening masses gives strong evidence for
dimensional reduction at $T\ge2T_c$. A perturbative explanation of these masses
is ruled out. The mass ratios in the high temperature phase are consistent with
those in the pure gauge theory in three dimensions.
","[{""version"":""v1"",""created"":""Mon, 14 Sep 1998 17:56:08 GMT""}]","2007-05-23"
"hep-ph/9809383","Nicholas Petropoulos","Nicholas Petropoulos","Thermal effective potential of the linear sigma model","4 pages revtex, 5 eps figures, axodraw.sty, poster presented in the
  5th International Workshop on Thermal Field Theories, Regensburg, Germany",,,,"hep-ph",,"  We have attempted an approach to the chiral phase transition of QCD using the
linear sigma model as an effective theory. In order to get some insight into
how the phase transition could proceed, we have calculated the finite
temperature effective potential of this model in the Hartree and large N
approximations using the Cornwall-Jackiw-Tomboulis formalism of composite
operators.
","[{""version"":""v1"",""created"":""Mon, 14 Sep 1998 21:16:25 GMT""}]","2007-05-23"
"hep-ph/9809384",,"Michael Gronau and Jonathan L. Rosner","Combining CP Asymmetries in $B \to K \pi$ Decays","9 pages, latex, no figures, submitted to Phys. Rev. Letters, revised","Phys.Rev.D59:113002,1999","10.1103/PhysRevD.59.113002","SLAC-PUB-7945, EFI-98-46","hep-ph",,"  We prove an approximate relation, to leading order in dominant terms, between
CP-violating rate differences in $B^0/\bar{B}^0 \to K^{\pm}\pi^{\mp}$ and
$B^{\pm} \to K^{\pm}\pi^0$. We show how data from these two processes may be
combined in order to enhance the significance of a nonzero result.
","[{""version"":""v1"",""created"":""Mon, 14 Sep 1998 22:55:33 GMT""},{""version"":""v2"",""created"":""Wed, 16 Sep 1998 20:18:00 GMT""},{""version"":""v3"",""created"":""Thu, 19 Nov 1998 22:36:08 GMT""}]","2009-12-30"
"hep-ph/9809385","Levai Peter","T.S. Biro, P. Levai, J. Zimanyi (KFKI Rmki)","Hadronization of massive quark matter","12 pages, Latex, 2 EPS figures, contribution to the Proceedings of
  the 4th International Conference on Strangeness in Quark Matter (SQM'98),
  Padova, Italy, 20-24 July 1998","J.Phys.G25:311-320,1999","10.1088/0954-3899/25/2/019",,"hep-ph",,"  We present a fast hadronization model for the constituent quark plasma (CQP)
produced in relativistic heavy ion collisions at SPS. The model is based on
rate equations and on an equation of state inspired by the string
phenomenology. This equation of state has a confining character. We display the
time evolution of the relevant physical quantities during the hadronization
process and the final hadron multiplicities. The results indicate that the
hadronization of CQP is fast.
","[{""version"":""v1"",""created"":""Tue, 15 Sep 1998 03:02:45 GMT""}]","2008-11-26"
"hep-ph/9809386","Du Dong-Sheng","Youshan Dai, Dongsheng Du","CP Violation in Two-Body Hadronic Decays of $B_c$ Meson","19 pages, 3 figures, corrected some typos and sentences","Eur.Phys.J.C9:557-564,1999","10.1007/s100529900073",,"hep-ph",,"  Using the next-to-leading order low energy effective Hamiltonian, the CP
asymmetries for the $B_{c}$ meson decays into meson pair are calculated in the
spectator approximation. We do not compute the hadronic matrix elements
directly, instead, we use the amplitude ratios to estimate the CP asymmetries.
This is quite,different from the previous works in the literature. The values
of the momentum squared carried by the virtual particles in timelike penguin
dirgrams are also carefully discussed. From our calculated results, the best
decay modes to observe CP violation in $B_{c}$ decays would be $B_{c}^-\to{\bar
D}^{*0}K^{*-}$, ${\bar D}^{0}K^{*-}$, ${\bar D}^{*0} K^{-}$, ${\bar
D}^{0}K^{-}$ and $B_{c}^-\to{\eta}_{c}D^{-}$, which need about $10^8$ of
$B_{c}^{\pm}$ events in experiment.
","[{""version"":""v1"",""created"":""Tue, 15 Sep 1998 03:34:47 GMT""},{""version"":""v2"",""created"":""Wed, 16 Dec 1998 06:56:06 GMT""}]","2011-09-13"
"hep-ph/9809387","David Atwood","D. Atwood, A. Soni","Closing in on B-CP","19 pages, 4 figures",,,"AMES-HET-98-12, BNL-HET-98-31","hep-ph",,"  Major new experimental efforts on detecting CP violation in $B$ decays will
very soon go on the air. Recent developments suggest that final state
interaction phases in exclusive decays of $B$ are unlikely to be small
indicating the possibility of observable direct CP asymmetries in these
channels. CLEO results on charmless hadronic modes suggest penguin amplitudes
are rather big implying that the extraction of $\alpha$ from $B^0$-$\bar B^0$
alone will be difficult, thus necessitating also information from direct
CP\null. Importance of $B(B_s)$ decays to two vectors for model independent
tests of electroweak penguins and for extraction of $\alpha(\gamma)$ is
emphasized. Inclusive $b\to sg^\ast$ and related modes, e.g. $B\to \eta^\prime
X_s$, are very good probes of CP-odd phase(s) due to beyond the standard model
physics. On the other hand, $b\to dg^\ast$ and related modes, e.g. $B\to
\eta^\prime X_d$ are more suitable for CP violation due to the CKM phase. Two
body $b$-quark decays: $b\to Mq_f$ leading to semi-inclusive, $B$ decays, $B\to
MX$ (with $2\lsim E_M\lsim2.8$ GeV), are very interesting and important. Their
theory is relatively clean; partial rate asymmetries may be large in several
cases (e.g. $M=K^\ast, K, \rho, \pi...$) and a few cases provide very good
probe of electroweak penguins.
","[{""version"":""v1"",""created"":""Tue, 15 Sep 1998 05:31:16 GMT""}]","2007-05-23"
"hep-ph/9809388",,"K. Takayama and M. Oka","Hyperon Non-leptonic Weak Decays in the Chiral Perturbation Theory I","LaTeX 30 pages, 8 figures, with epsf.sty",,,"TIT/HEP-384/NP","hep-ph nucl-th",,"  Hyperon non-leptonic weak decay amplitudes are studied in the chiral
perturbation theory. We employ the low energy effective weak Hamiltonian which
contains the perturbative QCD correction. To include the non-perturbative QCD
effect, quark currents of the effective Hamiltonian are substituted with
hadronic currents which are color singlet and are derived by the chiral
perturbation theory. We find that the amplitudes caused by the product of
hadronic currents are small. It reproduce the small amplitudes of $\Delta
I=3/2$, which are derived by the strong interaction correction.
","[{""version"":""v1"",""created"":""Tue, 15 Sep 1998 09:13:09 GMT""}]","2007-05-23"
"hep-ph/9809389","Floarea Stancu","P. Stassart (U. of Liege), Fl. Stancu (U. of Liege) and J.-M. Richard
  (U. Joseph Fourier, Grenoble)","Scalar meson exchange and the baryon spectra","6 pages, RevTex, to appear in the Proceedings of the Third
  International Conference on ""Quark Confinement and the Hadron Spectrum III,
  Jefferson Lab. (Newport News, USA), June 7-12, 1998, World Scientific
  (Singapore)",,,"ULG-PNT-98-2-FS","hep-ph",,"  We explore the role of a scalar meson exchange interaction between quarks in
a semirelativistic constituent quark model where the quarks are subject to a
linear confinement. We search for a variational solution and show that the gap
between the N=1 band and the ground state N=0 band increases with the strength
of the scalar meson exchange interaction potential. This result has good
implications on the description of the low-lying baryon resonances, especially
on the Roper vs. negative parity resonances ordering.
","[{""version"":""v1"",""created"":""Tue, 15 Sep 1998 10:06:45 GMT""}]","2007-05-23"
"hep-ph/9809390","Massimo Pietroni","Massimo Pietroni","Critical Slowing Down from $T\neq 0$ Wilson RG","7 pages twocolumn REVTeX, 4 figures, Talk given at the 5th
  International Workshop `Thermal Field Theories and their Applications',
  August 10 - 14, 1998, Regensburg, Germany. Explicit expression for the
  evolution equations added. Typo corrected",,,"DFPD 98/TH/40","hep-ph",,"  The Thermal Renormalization Group can be employed to study the dynamics of
$T\neq 0$ Quantum Field Theories close to second order phase transitions, where
neither resummed perturbation theory nor first principle lattice simulations
can be employed. As an example, I discuss the computation of the plasmon
damping rate in the scalar field theory from $T\gg T_C$ down to $T_C$. As the
critical point is approached, the lifetime of long wavelength thermal
fluctuations diverges. Taking this effect into account, the notion of
quasiparticle, and kinetic approaches, can be extended close to the critical
regime. The consequences on the scenarios for topological defect formation in
the early universe are also discussed.
","[{""version"":""v1"",""created"":""Tue, 15 Sep 1998 10:18:16 GMT""},{""version"":""v2"",""created"":""Wed, 14 Oct 1998 21:34:45 GMT""},{""version"":""v3"",""created"":""Thu, 15 Oct 1998 15:13:44 GMT""}]","2009-09-25"
"hep-ph/9809391",,"Wei Zhu (East China Normal University)","A new approach to parton recombination in a QCD evolution equation","25 pages, LaTex, 10 PS figures, submmitted to Nucl. Phys. B","Nucl.Phys.B551:245-274,1999","10.1016/S0550-3213(99)00237-0","ECNU-PPE-98-02","hep-ph",,"  Parton recombination is reconsidered in perturbation theory without using the
AGK cutting rules in the leading order of the recombination. We use
time-ordered perturbation theory to sum the cut diagrams, which are neglected
in the GLR evolution equation. We present a set of new evolution equations
including parton recombination.
","[{""version"":""v1"",""created"":""Tue, 15 Sep 1998 10:23:54 GMT""}]","2014-11-17"
"hep-ph/9809392","Ugo Aglietti UA","U. Aglietti (Rome I University)","Effective Theories for Exclusive and Seminclusive Processes and
  Factorization","LaTex file, 4 pages, no figures; talk given at the QCD 98
  Euroconference 2-8th July 1998 Montpellier (France) to be published in Nucl.
  Phys. B (Proc. Suppl.)","Nucl.Phys.Proc.Suppl. 74 (1999) 268-271","10.1016/S0920-5632(99)00176-0","Rome I preprint, ROME1/1221(98)","hep-ph",,"  The effective theories for massless quarks describing exclusive and
seminclusive processes are discussed, considering in particular the
factorization problem.
","[{""version"":""v1"",""created"":""Tue, 15 Sep 1998 10:32:19 GMT""}]","2009-10-31"
"hep-ph/9809393","Aldo Deandrea","A. Deandrea","A Constituent Quark-Meson Model for Heavy Meson Decays","5 pages, 1 figure, uses ltwol2e.sty, to appear in the Proceedings of
  the 29th International Conference on High Energy Physics (Vancouver)",,,"CPT-98/P.3695","hep-ph",,"  I describe a model for heavy meson decays based on an effective quark-meson
lagrangian. I consider the heavy mesons S with spin and parity J^P=(1+,0+), H
with J^P=(1-,0-) and T^mu with J^P=(2+,1+), i.e. S and P wave heavy-light
mesons. The model is constrained by the known symmetries of QCD in the mQ ->
infinity limit for the heavy quarks, and chiral symmetry in the light quark
sector. Using a very limited number of free parameters it is possible to
compute several phenomenological quantities, e.g. the leptonic B and B** decay
constants; the three universal Isgur-Wise form factors: xi, tau(3/2), tau(1/2),
describing the semi-leptonic decays B -> D(*) l nu, B -> D** l nu; the strong
and radiative D* decays; the weak semi-leptonic decays of B and D into light
mesons: pi, rho, a1. An overall agreement with data, when available, is
achieved.
","[{""version"":""v1"",""created"":""Tue, 15 Sep 1998 13:36:21 GMT""}]","2007-05-23"
"hep-ph/9809394","Vladimir B. Kopeliovich","V.B. Kopeliovich and M.S. Sriram (Institute for Nuclear Research of
  Russian Academy of Sciences, Moscow and Department of Theoretical Physics,
  University of Madras, Guindy Campus, Madras, India)","Strangeness, charm and bottom in a chiral quark-meson model","12 pages, no figures. Journal ref: submitted to Nucl.Phys. B","Phys.Atom.Nucl. 63 (2000) 480-488; Yad.Fiz. 63 (2000) 552-560","10.1134/1.855656",,"hep-ph",,"  In this paper we investigate an SU(3) extension of the chiral quark-meson
model. The spectra of baryons with strangeness, charm and bottom are considered
within a ""rigid oscillator"" version of this model. The similarity between the
quark part of the Lagrangian in the model and the Wess-Zumino term in the
Skyrme model is noted. The binding energies of baryonic systems with baryon
number B=2 and 3 possessing strangeness or heavy flavor are estimated. The
results obtained are in good qualitative agreement with those obtained
previously in the topological soliton (Skyrme) model.
","[{""version"":""v1"",""created"":""Tue, 15 Sep 1998 13:41:05 GMT""}]","2009-10-31"
"hep-ph/9809395","Ivan Dadic","I. Dadic (Ruder Boskovic Institute)","Cancellation of pinching singularities in out-of-equilibrium thermal
  field theory","10 pages, Revtex, no figures, corrected abstract and misprints, minor
  changes, Talk given at the 5th International Workshop ""Thermal Field Theories
  and Applications"", August 10-14, 1998, Regensburg, Germany",,,,"hep-ph",,"  Long standing problem in out-of-equilibrium thermal field theories are
pinching singularities. We find that the expressions suspect of pinching
require loop particles to be on the mass shell. This fact, with the help of
threshold effect and similar effect due to spin, leads to the elimination of
pinching in single self-energy insertion approximation to propagator in all
propagators appearing in QED and QCD under very mild restrictions on particle
densities.
  This, together with the cancellation of collinear singularities, allows the
extraction of useful physical information contained in the imaginary parts of
the two loop diagrams.
  In some cases of interest ($\pi-\rho $ interaction, electro-weak interaction,
decay of Higgs particle, ...) none of the mentioned mechanisms works and one
has to resort to the resummed Schwinger-Dyson series. These cases are more
sensitive to the limitations related to the finite time range.
","[{""version"":""v1"",""created"":""Tue, 15 Sep 1998 14:20:58 GMT""},{""version"":""v2"",""created"":""Fri, 18 Sep 1998 09:36:52 GMT""},{""version"":""v3"",""created"":""Fri, 9 Oct 1998 09:35:18 GMT""}]","2007-05-23"
"hep-ph/9809396","Heinrich Paes","H.V. Klapdor--Kleingrothaus, H. P\""as, U. Sarkar","Test of Special Relativity and Equivalence Principle from Neutrinoless
  Double Beta Decay","4 pages, Latex, 1 figure, requires sprocl.sty","Eur.Phys.J. A5 (1999) 3-6","10.1007/s100500050249",,"hep-ph",,"  We generalize the formalism for testing Lorentz invariance and the
equivalence principle in the neutrino sector. While neutrino oscillation bounds
constrain the region of large mixing of the the weak and gravitational
eigenstates, we obtain new constraints on violations of Lorentz invariance and
the equivalence principle from neutrinoless double beta decay. These bounds
apply even in the case of no mixing and thus probe a totally unconstrained
region in the parameter space.
","[{""version"":""v1"",""created"":""Tue, 15 Sep 1998 15:21:20 GMT""}]","2009-10-31"
"hep-ph/9809397","Stefano Frixione","S. Frixione (ETH Zurich)","Isolated photons without fragmentation contribution","5 pages Latex, 2 figures; ltwol.sty included. Talk given at ICHEP98,
  23 - 29 July 1998, Vancouver, CA",,,"ETH-TH/98-26","hep-ph",,"  I illustrate how to define an isolated-photon cross section which is
independent of the parton-to-photon fragmentation contribution, it is infrared
safe to all orders in perturbative QCD, and it is exclusive in the kinematical
variables of the photon and of the accompanying jets. This isolation
prescription is applicable to any kind of polarized or unpolarized hard
collisions. It can also be used without any modifications in the case of two or
more isolated photons in the final state. I present results for one-photon
production in hadronic collisions, and I compare them with existing results
obtained in the framework of the conventional cone approach.
","[{""version"":""v1"",""created"":""Tue, 15 Sep 1998 15:33:46 GMT""}]","2007-05-23"
"hep-ph/9809398","K. G. Boreskov","K.G. Boreskov, A.B. Kaidalov","On the polarization of the nucleon sea in the meson cloud model","20 pages, 8 figures; some misprints are corrected","Eur.Phys.J.C10:143-151,1999","10.1007/s100529900072",,"hep-ph",,"  It is pointed out that the meson cloud model predicts a substantial
polarization of the sea quarks of the nucleon due to interference of $\pi$ and
$\rho$ exchanges. This polarization is strongly flavour dependent. The model
gives an explanation of a strong increase in the structure function $g_1$ with
isospin I=1 at small $x$.
","[{""version"":""v1"",""created"":""Tue, 15 Sep 1998 15:39:09 GMT""},{""version"":""v2"",""created"":""Wed, 3 Feb 1999 15:30:21 GMT""},{""version"":""v3"",""created"":""Fri, 19 Mar 1999 16:22:20 GMT""}]","2011-09-13"
"hep-th/9809097","Jean-Bernard Zuber","R. Behrend, P. Pearce, V. Petkova and J.-B. Zuber","On the Classification of Bulk and Boundary Conformal Field Theories","7 pages, LaTeX; minor corrections","Phys.Lett. B444 (1998) 163-166","10.1016/S0370-2693(98)01374-4",,"hep-th",,"  The classification of rational conformal field theories is reconsidered from
the standpoint of boundary conditions. Solving Cardy's equation expressing the
consistency condition on a cylinder is equivalent to finding integer valued
representations of the fusion algebra. A complete solution not only yields the
admissible boundary conditions but also gives valuable information on the bulk
properties.
","[{""version"":""v1"",""created"":""Mon, 14 Sep 1998 16:46:44 GMT""},{""version"":""v2"",""created"":""Mon, 2 Nov 1998 21:55:39 GMT""}]","2009-10-31"
"hep-th/9809098","Antonio Filippi","Antonio Filippi","Chemical potential and multiplicative anomaly","4 pages, LaTeX, to appear in Proceedings of the 5th International
  Workshop on Thermal Field Theories and Their Applications, August 1998,
  Regensburg, Germany",,,,"hep-th hep-ph",,"  The relativistic complex scalar field at finite temperature and in presence
of a net conserved charge is studied in reference to recent developments on the
multiplicative anomaly. This quantity, overlooked until now, is computed and it
is shown how it could play a role for this system. Other possible applications
are also mentioned.
","[{""version"":""v1"",""created"":""Mon, 14 Sep 1998 19:11:08 GMT""}]","2007-05-23"
"hep-th/9809099","Maria Asprouli","Maria Asprouli, Victor Galan-Gonzalez (Imperial College)","A way to get a well-defined derivative expansion of real-time thermal
  effective actions","4 pages, 1 figure, REVTeX, to appear in Proceedings of the 5th
  International Workshop on Thermal Field Theories and Their Applications,
  Regensburg, Germany, August 10-14, 1998",,,,"hep-th hep-ph",,"  We compute the quadratic part of the thermal effective action for real scalar
fields which are initially in thermal equilibrium and vary slowly in time using
a generalised real-time formalism proposed by Le Bellac and Mabilat
\cite{belmab}. We derive both Real Time and Imaginary Time Formalisms and find
that the result is analytic at the limits of zero external four-momenta when
using our full time contour. We expand the fields in time up to the second
derivative and discuss the initial time dependence of our result before and
after the expansion in terms of equilibrium.
","[{""version"":""v1"",""created"":""Mon, 14 Sep 1998 19:10:33 GMT""}]","2007-05-23"
"hep-th/9809100","Robert C. Myers","M.R. Garousi and R.C. Myers","World-Volume Interactions on D-Branes","14 pages","Nucl.Phys. B542 (1999) 73-88","10.1016/S0550-3213(98)00792-5","McGill/98-21","hep-th",,"  We examine in detail various string scattering amplitudes in order to extract
the world-volume interactions of massless fields on a Dirichlet brane. We find
that the leading low-energy interactions are consistent with the Born-Infeld
and Chern-Simons actions. In particular, our results confirm that the
background closed string fields appearing in these actions must be treated as
functionals of the non-abelian scalar fields describing transverse fluctuations
of the D-brane.
","[{""version"":""v1"",""created"":""Mon, 14 Sep 1998 21:21:48 GMT""}]","2009-10-31"
"hep-th/9809101","A. W. Schreiber","C. Alexandrou, R. Rosenfelder and A. W. Schreiber","Worldline path integral for the massive Dirac propagator : A
  four-dimensional approach","27 pages, LaTeX, no figures, uses revtex.sty; note with omitted
  references added in proof","Phys.Rev. A59 (1999) 1762-1776","10.1103/PhysRevA.59.1762","PSI-PR-98-20, ADP-98-55/T323, UCY-PHY-98/10","hep-th quant-ph",,"  We simplify and generalize an approach proposed by Di Vecchia and Ravndal to
describe a massive Dirac particle in external vector and scalar fields. Two
different path integral representations for the propagator are derived
systematically without the usual five-dimensional extension and shown to be
equivalent due to the supersymmetry of the action. They correspond to a
projection on the mass of the particle either continuously or at the end of the
time evolution. It is shown that the supersymmetry transformations are
generated by shifting and scaling the supertimes and the invariant difference
of two supertimes is given for the general case. A nonrelativistic reduction of
the relativistic propagator leads to a three-dimensional path integral with the
usual Pauli Hamiltonian. By integrating out the photons we obtain the effective
action for quenched QED and use it to derive the gauge-transformation
properties of the general Green function of the theory.
","[{""version"":""v1"",""created"":""Tue, 15 Sep 1998 01:36:30 GMT""},{""version"":""v2"",""created"":""Tue, 9 Mar 1999 03:06:10 GMT""}]","2009-10-31"
