"cond-mat/9809213","Didier Sornette","C. Maveyraud, W. Benz, G. Ouillon, A. Sornette and D. Sornette","Solid friction at high sliding velocities: an explicit 3D dynamical SPH
  approach","25 pages, 18 figures, submitted to J. Geophys. Res","J. Geophys. Res. 104 NB12:28769-28788 (1999)","10.1029/1999JB900217",,"cond-mat.stat-mech",,"  We present realistic 3D numerical simulations of elastic bodies sliding on
top of each other in a regime of velocities ranging from meters to tens of
meters per second using the so-called Smoothed Particle Hydrodynamics (SPH)
method. Our investigations are restricted to regimes of pressure and roughness
where only elastic deformations occur between asperities at the contact surface
between the slider block and the substrate. In this regime, solid friction is
due to the generation of vibrational radiations which are subsequently damped
out. We study periodic commensurate and incommensurate asperities and various
types of disordered surfaces. We report the evidence of a transition from zero
(or non-measurable $\mu < 0.001$) friction to a finite friction as the normal
pressure increases above about $10^6~Pa$. For larger normal pressures (up to
$10^9~Pa$), we find a remarkably universal value for the friction coefficient
$\mu \approx 0.06$, which is independent of the internal dissipation strength
over three order of magnitudes, and independent of the detailled nature of the
slider block-substrate interactions. We find that disorder may either decrease
or increase $\mu$ due to the competition between two effects: disorder detunes
the coherent vibrations of the asperties that occur in the periodic case,
leading to weaker acoustic radiation and thus weaker damping. On the other
hand, large disorder leads to stronger vibration amplitudes at local asperities
and thus stronger damping. Our simulations have confirmed the existence of
jumps over steps or asperities of the slider blocks occurring at the largest
velocities studied ($10~m/s$). These jumps lead to chaotic motions similar to
the bouncing-ball problem. We find a velocity strengthening with a doubling of
the friction coefficient as the velocity increases from $1~m/s$ to $10~m/s$.
","[{""version"":""v1"",""created"":""Tue, 15 Sep 1998 14:53:10 GMT""}]","2015-06-25"
"cond-mat/9809214","Hernan Makse","U. M. S. Costa, J. S. Andrade Jr., H. A. Makse, and H. E. Stanley","Inertial Effects on Fluid Flow through Disordered Porous Media","to appear in Proc. Int. Conf. on Percolation and Disordered Systems,
  July 14-17, 1998, Giessen. Physica A",,"10.1016/S0378-4371(98)00624-4",,"cond-mat.dis-nn",,"  We study the fluid flow through disordered porous media by numerically
solving the complete set of the Navier-Stokes equations in a two dimensional
lattice with a spatially random distribution of solid obstacles (plaquettes).
We simulate viscous and non-viscous flow through these idealized pore spaces to
determine the origin of the deviations from the classical Darcy's law behavior.
Due to the non-linear contribution of inertia to the transport of momentum at
the pore scale, we observe a typical departure from Darcy's law at sufficiently
high Reynolds numbers. Moreover, we show that the classical Forchheimer
equation provides a valid phenomenological model to correlate the variations of
the friction factor of the porous media over a wide range of Reynolds
conditions.
","[{""version"":""v1"",""created"":""Tue, 15 Sep 1998 14:55:58 GMT""}]","2015-06-25"
"gr-qc/9809044","Robert C. Myers","R.C. Myers","Wavy Horizons?","12 pages, Based on a talk at the 7th CCGRRA meeting (May 31 - June 7,
  1997)",,,"McGill/97-27","gr-qc",,"  We describe the application of a gravity wave-generating technique to certain
higher dimensional black holes. We find that the induced waves generically
destroy the event horizon producing parallelly propagated curvature
singularities.
","[{""version"":""v1"",""created"":""Mon, 14 Sep 1998 22:17:28 GMT""}]","2007-05-23"
"gr-qc/9809045","Fredrik Andersson","F. Andersson and S. B. Edgar","Spinors, Spin Coefficients and Lanczos Potentials","10 pages, LaTeX-file",,,,"gr-qc",,"  It has been demonstrated, in a number of special situations, that the spin
coefficients of a canonical spinor dyad can be used to define a Lanczos
potential of the Weyl curvature spinor. In this paper we explore some of these
potentials and show that they can be defined directly from the spinor dyad in a
very simple way, but that the results do not generalize significantly, in any
direct manner. A link to metric, asymmetric, curvature-free connections, which
suggests a more natural relationship between the Lanczos potential and spin
coefficients, is also considered.
","[{""version"":""v1"",""created"":""Tue, 15 Sep 1998 14:18:34 GMT""}]","2007-05-23"
"gr-qc/9809046","Piotr Jaranowski","Piotr Jaranowski and Andrzej Kr\'olak","Data analysis of gravitational-wave signals from spinning neutron stars.
  II. Accuracy of estimation of parameters","LaTeX, 34 pages, 15 figures, submitted to Phys. Rev. D","Phys.Rev. D59 (1999) 063003","10.1103/PhysRevD.59.063003",,"gr-qc",,"  We examine the accuracy of estimation of parameters of the gravitational-wave
signals from spinning neutron stars that can be achieved from observations by
Earth-based laser interferometers. We consider a model of the signal consisting
of two narrowband components and including both phase and amplitude modulation.
We calculate approximate values of the rms errors of the parameter estimators
using the Fisher information matrix. We carry out extensive Monte Carlo
simulations and obtain cumulative distribution functions of rms errors of
astrophysically interesting parameters: amplitude of the signal, wobble angle,
position of the source in the sky, frequency, and spindown coefficients. We
consider both all-sky searches and directed searches. We also examine the
possibility of determination of neutron star proper motion. We perform
simulations for all laser-interferometric detectors that are currently under
construction and for several possible lengths of the observation time and sizes
of the parameter space. We find that observations of continuous
gravitational-wave signals from neutron stars by laser-interferometric
detectors will provide a very accurate information about their astrophysical
properties. We derive several simplified models of the signal that can be used
in the theoretical investigations of the data analysis schemes independently of
the physical mechanisms generating the gravitational-wave signal.
","[{""version"":""v1"",""created"":""Tue, 15 Sep 1998 15:55:23 GMT""}]","2009-10-31"
"hep-ex/9809012","Preprints Libr/pam","M. Bishai, et al. (CLEO Collaboration)","First Observation of the Decay $\tau^{-}\to K^{*-}\eta\nu_{\tau}$","10 pages, postscript file also available through
  http://w4.lns.cornell.edu/public/CLNS","Phys.Rev.Lett.82:281-285,1999","10.1103/PhysRevLett.82.281","CLNS 98/1574, CLEO 98-11","hep-ex",,"  Using data recorded by the CLEO-II detector at CESR, we report the first
measurement of the branching fraction for the decay of $\tau^-$ into
$K^{*-}\eta \nu_{\tau}$. The measured branching fraction is (2.9 +- 0.8 +- 0.4)
$10^{-4}$. We also measure the inclusive branching fractions without requiring
the $K^*$ resonance: $\tau^-$ into $K_S \pi^- \eta \nu_{\tau}$, $\tau^-$ into
$K^- \pi^0 \eta \nu_{\tau}$. The measured branching fractions are (1.10 +- 0.35
+- 0.11) $10^{-4}$, (1.77 +- 0.56 +- 0.71) $10^{-4}$ respectively.
","[{""version"":""v1"",""created"":""Tue, 15 Sep 1998 12:43:33 GMT""}]","2010-04-08"
"hep-lat/9809087","Craig McNeile","C. Bernard, T. DeGrand, C. DeTar, Steven Gottlieb, U. M. Heller, J.
  Hetrick, C. McNeile, R. Sugar, and D. Toussaint","Exotic meson spectroscopy from the clover action at beta = 5.85 and 6.15","LATTICE98(spectrum) 3 latex pages and two postscript figures.
  Contribution to lattice 98","Nucl.Phys.Proc.Suppl.73:264-266,1999","10.1016/S0920-5632(99)85043-9",,"hep-lat",,"  We repeat our original simulations of the hybrid meson spectrum using the
clover action, as a check on lattice artifacts. Our results for the 1-+ masses
do not substantially change. We present preliminary results for the wave
function of the 1-+ state in Coulomb gauge.
","[{""version"":""v1"",""created"":""Mon, 14 Sep 1998 16:16:33 GMT""}]","2008-11-26"
"hep-lat/9809091","Dong Chen","R. C. Brower, D. Chen, J. W. Negele and E. Shuryak","Heavy quark potential in the instanton liquid model","LATTICE98(confine)","Nucl.Phys.Proc.Suppl.73:512-514,1999","10.1016/S0920-5632(99)85121-4","MIT-CTP/2778","hep-lat",,"  We study the heavy quark potential in the instanton liquid model by carefully
measuring Wilson loops out to a distance of order 3$fm$. A random instanton
ensemble with a fixed radius $\rho$ = 1/3$fm$ generates a potential $V(R)$
growing very slowly at large $R$. In contrast, a more realistic size
distribution growing as $\rho^6$ at small $\rho$ and decaying as $\rho^{-5}$ at
large $\rho$, leads to a potential which grows linearly with $R$. The string
tension, however, is only about 1/10 of the phenomenological value.
","[{""version"":""v1"",""created"":""Mon, 14 Sep 1998 17:25:32 GMT""}]","2008-11-26"
"hep-lat/9809092","Anthony D. Kennedy","Ivan Horvath, A. D. Kennedy and Stefan Sint","A New Exact Method for Dynamical Fermion Computations with Non-Local
  Actions","LATTICE98(algorithms)","Nucl.Phys.Proc.Suppl. 73 (1999) 834-836","10.1016/S0920-5632(99)85217-7",,"hep-lat",,"  We introduce a new algorithm which we call the {Rational Hybrid Monte Carlo}
Algorithm (RHMC). This method uses a rational approximation to the fermionic
kernel together with a noisy Kennedy-Kuti acceptance step to give an efficient
algorithm with no molecular dynamics integration step-size errors.
","[{""version"":""v1"",""created"":""Mon, 14 Sep 1998 18:11:49 GMT""}]","2009-10-31"
"hep-lat/9809093","Owe Philipsen","O. Philipsen and H. Wittig","The static potential beyond screening in the 3d SU(2) Higgs model","LATTICE98(higgs), 3 pages Latex, 3 figs. Presented at the
  International Symposium on Lattice Field Theory, 13.7.-18.7.1998, Boulder,
  Colorado","Nucl.Phys.Proc.Suppl. 73 (1999) 706-708","10.1016/S0920-5632(99)85179-2","HD THEP-98-45","hep-lat",,"  The static potential in the 3d SU(2) Higgs model is computed by a variational
calculation employing Wilson loops and two-meson operators. String breaking is
demonstrated numerically, the breaking scale is determined and the results are
compared with a quenched calculation.
","[{""version"":""v1"",""created"":""Mon, 14 Sep 1998 19:47:56 GMT""}]","2009-10-31"
"hep-lat/9809094","Richard Haymaker","Richard W. Haymaker","Confinement studies in lattice QCD","Talk given at the Symposium in Honor of Dick Slansky, Los Alamos, May
  20-21 1998, to be published in Phys. Rep., Latex 2e uses class file
  elsart.cls","Phys.Rept. 315 (1999) 153-173","10.1016/S0370-1573(99)00019-8","LSUHE No. 270-1998","hep-lat",,"  We describe the current search for confinement mechanisms in lattice QCD. We
report on a recent derivation of a lattice Ehrenfest-Maxwell relation for the
Abelian projection of SU(2) lattice gauge theory. This gives a precise lattice
definition of field strength and electric current due to static sources,
charged dynamical fields, gauge fixing and ghosts. In the maximal Abelian gauge
the electric charge is anti-screened analogously to the non-Abelian charge.
","[{""version"":""v1"",""created"":""Mon, 14 Sep 1998 19:58:01 GMT""}]","2015-06-25"
"hep-lat/9809095","Frank X. lee","Frank X. Lee, Derek B. Leinweber","Negative-Parity Baryon Spectroscopy","LATTICE98(spectrum), 3 pages, 1 figure; minor typos corrected","Nucl.Phys.Proc.Suppl.73:258-260,1999","10.1016/S0920-5632(99)85041-5",,"hep-lat hep-ph nucl-th",,"  Results are reported for the first calculation of the low-lying spin-1/2
odd-parity octet baryon masses using ${\cal O}(a^2)$ improved gluon and fermion
actions. Methods for removing even-parity ground-state contaminations from the
two-point correlation functions at zero and finite momenta are outlined. We
investigate the properties of two odd-parity interpolating fields based on the
established interpolating fields for the nucleon ground state. Isolation of the
lowest-lying odd-parity state appears to be sufficient to begin exploring
odd-parity $N \to N^*$ electromagnetic transition form factors.
","[{""version"":""v1"",""created"":""Mon, 14 Sep 1998 20:03:02 GMT""},{""version"":""v2"",""created"":""Wed, 23 Sep 1998 20:24:43 GMT""}]","2008-11-26"
"hep-lat/9809096","L. Averchenkova","L.A.Averchenkova, V.K.Petrov, G.M.Zinovjev","Gauge model at finite temperature with massive quarks and at finite
  density on anisotropic lattice","talk given by L.A.Averchenkova at LATTICE'98, Boulder, CO, USA, 13-18
  July 1998, 3 pages, LaTex, no figures","Nucl.Phys.Proc.Suppl. 73 (1999) 492-494","10.1016/S0920-5632(99)85115-9",,"hep-lat",,"  Critical properties of QCD and the chiral condensate at finite density are
analytically studied on an anisotropic lattice in the approximation SU(N)
\simeq Z(N). Asymptotic behavior of the partition function and its continuum
limit are discussed.
","[{""version"":""v1"",""created"":""Mon, 14 Sep 1998 22:34:44 GMT""}]","2009-10-31"
"hep-lat/9809097","Tom Degrand","Thomas DeGrand, Anna Hasenfratz, Tamas G. Kovacs","Optimizing the Chiral Properties of Lattice Fermions","LATTICE98(improvement)","Nucl.Phys.Proc.Suppl. 73 (1999) 903-905","10.1016/S0920-5632(99)85239-6",,"hep-lat",,"  We describe a way to optimize the chiral behavior of Wilson-type lattice
fermion actions by studying the low energy real eigenmodes of the Dirac
operator. We find a candidate action, the clover action with fat links with a
tuned clover term. The action shows good scaling behavior at Wilson gauge
coupling beta=5.7.
","[{""version"":""v1"",""created"":""Mon, 14 Sep 1998 22:37:09 GMT""}]","2009-10-31"
"hep-lat/9809098","Colin Morningstar","K.J. Juge, J. Kuti, and C.J. Morningstar","Where is the string limit in QCD?","LATTICE98(confine), 6 pages, LaTeX (3 figures), uses espcrc2.sty.
  Talk and poster given at the XVI International Symposium on Lattice Field
  Theory, Boulder, CO, USA, 13-18 July 1998","Nucl.Phys.Proc.Suppl. 73 (1999) 590-595","10.1016/S0920-5632(99)85147-0","UCSD/PTH 98-30","hep-lat",,"  The energies of glue in the presence of a static quark-antiquark pair are
calculated for separations r ranging from 0.1 fm to 4 fm and for various
quark-antiquark orientations on the lattice. Our simulations use an improved
gauge-field action on anisotropic space-time lattices. Discretization errors
and finite volume effects are studied. We find that the spectrum does not
exhibit the expected onset of the universal pi/r Goldstone excitations of the
effective QCD string, even for r as large as 4 fm. Our results cast serious
doubts on the validity of treating glue in terms of a fluctuating string for r
below 2 fm. Retardation effects in the Upsilon system are also studied by
comparing level splittings from the Born-Oppenheimer approximation with those
directly obtained in simulations.
","[{""version"":""v1"",""created"":""Mon, 14 Sep 1998 22:54:56 GMT""}]","2009-10-31"
"hep-lat/9809099","Tom Degrand","Thomas DeGrand, Anna Hasenfratz, Tamas G. Kovacs","Exceptional Configurations with the Clover Action","LATTICE98(improvement)","Nucl.Phys.Proc.Suppl. 73 (1999) 506-508","10.1016/S0920-5632(99)85119-6",,"hep-lat",,"  We study exceptional modes of both the Wilson and the clover action in order
to understand why quenched clover spectroscopy suffers so severely from
exceptional configurations. We show that a large clover coefficient can make
the exceptional modes extremely localized and thus very sensitive to short
distance fluctuations. We contrast this with the case of the Wilson action
where exceptional modes correspond to large instantons. These modes are broadly
extended and suffer much less from discretization errors.
","[{""version"":""v1"",""created"":""Mon, 14 Sep 1998 23:15:47 GMT""}]","2009-10-31"
"hep-lat/9809100","Sergio Caracciolo","Sergio Caracciolo, Andrea Montanari and Andrea Pelissetto","Operator product expansion and non-perturbative renormalization","LATTICE98(matrixelement), uses espcrc2 and epsfig, 3 pages, 2 eps
  figures","Nucl.Phys.Proc.Suppl. 73 (1999) 273-275","10.1016/S0920-5632(99)85045-2",,"hep-lat",,"  It has been recently proposed to use the operator product expansion to
evaluate the expectation values of renormalized operators without the need of a
direct computation of the relevant renormalization constants. We test the
viability of this idea in the two-dimensional non-linear sigma-model discussing
the non-perturbative renormalization of the energy-momentum tensor.
","[{""version"":""v1"",""created"":""Tue, 15 Sep 1998 07:05:30 GMT""}]","2009-10-31"
"hep-lat/9809101","Sergio Caracciolo","Sergio Caracciolo, Maria Serena Causo, Andrea Pelissetto, Paolo Rossi
  and Ettore Vicari","Crossover scaling from classical to non-classical critical behaviour","LATTICE98(spin), uses epsfig, 5 ps figures","Nucl.Phys.Proc.Suppl. 73 (1999) 757-762","10.1016/S0920-5632(99)85195-0",,"hep-lat cond-mat.stat-mech",,"  Interacting physical systems in the neighborhood of criticality (and massive
continuum field theories) can often be characterized by just two physical
scales: a (macroscopic) correlation length and a (microscopic) interaction
range, related to the coupling and measured by the Ginzburg number $G$. A
critical crossover limit can be defined when both scales become large while
their ratio stays finite. The corresponding scaling functions are universal,
and they are related to the standard field-theory renormalization-group
functions. The critical crossover describes the unique flow from the Gaussian
to the nonclassical fixed point.
","[{""version"":""v1"",""created"":""Tue, 15 Sep 1998 07:31:32 GMT""}]","2009-10-31"
"hep-lat/9809102","Kaya Shogo","JLQCD Collaboration: S. Aoki, M. Fukugita, S. Hashimoto, K-I.
  Ishikawa, N. Ishizuka, Y. Iwasaki, K. Kanaya, T. Kaneda, S. Kaya, Y.
  Kuramashi, M. Okawa, T. Onogi, S. Tominaga, N. Tsutsui, A. Ukawa, N. Yamada,
  T. Yoshi\'e","Phase structure of lattice QCD at finite temperature for 2+1 flavors of
  Kogut-Susskind quarks","LATTICE98(hightemp), 3 pages, 4 figures","Nucl.Phys.Proc.Suppl. 73 (1999) 459-461","10.1016/S0920-5632(99)85104-4","KEK-CP-073, KEK Preprint 98-147","hep-lat",,"  We report on a study of the finite-temperature chiral transition on an
$N_t=4$ lattice for 2+1 flavors of Kogut-Susskind quarks. We find the point of
physical quark masses to lie in the region of crossover, in agreement with
results of previous studies. Results of a detailed examination of the
$m_{u,d}=m_s$ case indicate vanishing of the screening mass of $\sigma$ meson
at the end point of the first-order transition.
","[{""version"":""v1"",""created"":""Tue, 15 Sep 1998 07:43:12 GMT""},{""version"":""v2"",""created"":""Wed, 16 Sep 1998 13:22:32 GMT""}]","2009-10-31"
"hep-lat/9809103","Luigi Scorzato","G. Burgio, F. Di Renzo, G. Marchesini, E. Onofri, M. Pepe, L. Scorzato","New issues for Numerical Stochastic Perturbation Theory","3 pages, Latex, LATTICE98(algorithms)","Nucl.Phys.Proc.Suppl. 73 (1999) 853-855","10.1016/S0920-5632(99)85223-2","UPRF-98-11, LTH-437","hep-lat",,"  First attempts in the application of Numerical Stochastic Perturbation Theory
(NSPT) to the problem of pushing one loop further the computation of SU(3)
(SU(2)) pertubative beta function (in different schemes) are reviewed and the
relevance of such a computation is discussed. Other issues include the proposal
of a different strategy for gauge-fixed NSPT computations in lattice QCD.
","[{""version"":""v1"",""created"":""Tue, 15 Sep 1998 08:19:24 GMT""},{""version"":""v2"",""created"":""Thu, 17 Sep 1998 14:25:03 GMT""}]","2009-10-31"
"hep-lat/9809104","Ka Chun Leung","Maarten Golterman and Ka Chun Leung","Applications of Partially Quenched Chiral Perturbation Theory","LATTICE98(matrixelement)","Nucl.Phys.Proc.Suppl. 73 (1999) 246-248","10.1016/S0920-5632(99)85037-3","US-01","hep-lat",,"  Partially quenched theories are theories in which the valence- and sea-quark
masses are different. Here, we will discuss the nonanalytic one-loop
corrections to some physical quantities, using partially quenched chiral
perturbation theory. In particular, we will focus on the results for Goldstone
boson masses to illustrate the general features of our calculation.
","[{""version"":""v1"",""created"":""Tue, 15 Sep 1998 08:55:35 GMT""}]","2009-10-31"
"hep-lat/9809105","Edwin Laermann","E. Laermann, C. DeTar, O. Kaczmarek and F. Karsch","String breaking in Lattice QCD","LATTICE98(hightemp), 3 pages, 4 figures, LaTeX","Nucl.Phys.Proc.Suppl.73:447-449,1999","10.1016/S0920-5632(99)85100-7",,"hep-lat",,"  The separation of a heavy quark and antiquark pair leads to the formation of
a tube of flux, or string, which should break in the presence of light
quark-antiquark pairs. This expected zero temperature phenomenon has proven
elusive in simulations of lattice QCD. We present simulation results that show
that the string does break in the confining phase at nonzero temperature.
","[{""version"":""v1"",""created"":""Tue, 15 Sep 1998 09:53:38 GMT""},{""version"":""v2"",""created"":""Wed, 16 Sep 1998 10:10:26 GMT""}]","2008-11-26"
"hep-lat/9809106","Gudmar Thorleifsson","S. Bilke and G. Thorleifsson","Simulating 4D Simplicial Gravity including Degenerate Triangulations","LATTICE98(surfaces), 3 pages, 2 eps-figures","Nucl.Phys.Proc.Suppl. 73 (1999) 801-803","10.1016/S0920-5632(99)85208-6","BI-TP 98/30","hep-lat",,"  We extend simulations of simplicial gravity in four dimensions to include
{\it degenerate} triangulations and demonstrate that using this ensemble the
geometric finite-size effects are much reduced. We provide strong numerical
evidence for the existence of an exponential bound on the entropy of the model
and establish that the phase structure is identical to that of a corresponding
model restricted to an ensemble of combinatorial triangulations.
","[{""version"":""v1"",""created"":""Tue, 15 Sep 1998 12:17:51 GMT""}]","2009-10-31"
"hep-lat/9809107","Hildegard Meyer-Ortmanns","H.Meyer-Ortmanns, T.Reisz","Dynamical linke cluster expansions: Algorithmic aspects and applications","LATTICE98(algorithms)","Nucl.Phys.Proc.Suppl. 73 (1999) 892-894","10.1016/S0920-5632(99)85236-0","HD-THEP-98-46","hep-lat",,"  Dynamical linked cluster expansions are linked cluster expansions with
hopping parameter terms endowed with their own dynamics. They amount to a
generalization of series expansions from 2-point to point-link-point
interactions. We outline an associated multiple-line graph theory involving
extended notions of connectivity and indicate an algorithmic implementation of
graphs. Fields of applications are SU(N) gauge Higgs systems within variational
estimates, spin glasses and partially annealed neural networks. We present
results for the critical line in an SU(2) gauge Higgs model for the electroweak
phase transition. The results agree well with corresponding high precision
Monte Carlo results.
","[{""version"":""v1"",""created"":""Tue, 15 Sep 1998 12:47:09 GMT""}]","2009-10-31"
"hep-lat/9809108","Ivan Horvath","Ivan Horvath and Harry B. Thacker","Ginsparg-Wilson Relation and Spin Chains","LATTICE98(chiral)","Nucl.Phys.Proc.Suppl. 73 (1999) 682-684","10.1016/S0920-5632(99)85172-X",,"hep-lat",,"  The Baxter 8-vertex model is equivalent to a particular lattice formulation
of a self-interacting, massive Dirac fermion theory. In the time-continuum
limit, the lattice Hamiltonian (XYZ spin chain) can be explicitly transformed
to a lattice Dirac Hamiltonian. We show that the kernel describing the
quadratic part of this Hamiltonian satisfies a one-dimensional version of the
Ginsparg-Wilson relation. The corresponding conserved charge is derived and
compared with the conserved arrow number of the 8-vertex model.
","[{""version"":""v1"",""created"":""Tue, 15 Sep 1998 13:03:29 GMT""}]","2009-10-31"
"hep-lat/9809109","Claude Bernard","MILC Collaboration: C. Bernard, T. DeGrand, C. DeTar, Steven Gottlieb,
  Urs M. Heller, J. Hetrick, N. Ishizuka, C. McNeile, R. Sugar, D. Toussaint,
  M. Wingate","Heavy-Light Decay Constants: Conclusions from the Wilson Action","LATTICE98(heavyqk) 3 latex pages and 3 postscript figures. The
  perturbative correction calculated by Kuramashi has been adjusted to take
  into account the fact that we match to the continuum at the kinetic mass of
  the heavy meson, not the pole mass. This produces a 2 to 4 MeV change in
  final results for decay constants, and has negligible effect on decay
  constant ratios","Nucl.Phys.Proc.Suppl.73:372-374,1999","10.1016/S0920-5632(99)85077-4",,"hep-lat",,"  We report on the results of a MILC collaboration calculation of $f_B$,
$f_{B_s}$, $f_D$, $f_{D_s}$ and their ratios. We discuss the most important
errors in more detail than we have elsewhere.
","[{""version"":""v1"",""created"":""Tue, 15 Sep 1998 14:24:36 GMT""},{""version"":""v2"",""created"":""Mon, 19 Oct 1998 17:42:43 GMT""}]","2008-11-26"
