"astro-ph/9809191","Marco Scodeggio","M. Scodeggio (1), G. Gavazzi (2), E. Belsole (2), D. Pierini (3), A.
  Boselli (4) ((1) European Southern Observatory, (2) Universita` degli Studi,
  Milano, (3) Max-Planck-Institut fur Kernphysik, Heidelberg, (4) Laboratoire
  d' Astronomie Spatiale, Marseille)","The tilt of the Fundamental Plane of Early-type galaxies: wavelength
  dependence","8 pages, 7 figures, 6 tables; table 3 should be printed in landscape
  mode, and inserted into the text. Accepted for publication in MNRAS",,"10.1046/j.1365-8711.1998.02106.x",,"astro-ph",,"  The photometric parameters R_e and mu_e of 74 early-type (E+S0+S0a) galaxies
in the Coma cluster are derived for the first time in the near IR H band. These
are used, coupled with measurements of the central velocity dispersion found in
the literature, to determine the H band Fundamental Plane (FP) relation of this
cluster. The same procedure is applied to previously available photometric data
in the B, V, r, I, and K bands, to perform a multi-wavelength study of the FP.
Because systematic uncertainties in the value of the FP parameters are
introduced both by the choice of the fitting algorithm, and by the presence of
statistical biases connected with the sample selection procedure, we emphasize
the importance of deriving the FP parameters in the six photometric bands using
an identical fitting algorithm, and appropriate corrections to eliminate the
effects of sample incompleteness. We find that the FP mu_e coefficient is
stable with wavelength, while the sigma coefficient increases significantly
with increasing wavelength, in agreement with an earlier result presented by
Pahre & Djorgovski. The slope of the FP relation, although changing with
wavelength, never approaches the virial theorem expectation. We also find that
the magnitude of the slope change can be entirely explained by the presence of
the well known relation between color and magnitude among early-type galaxies.
We conclude that the tilt of the Fundamental Plane is significant, and must be
due to some form of broken homology among early-type galaxies, while its
wavelength dependence derives from whatever mechanism (currently the preferred
one is the existence of a mass-metal content sequence) produces the
color-magnitude relation in those galaxies.
","[{""version"":""v1"",""created"":""Tue, 15 Sep 1998 12:08:27 GMT""}]","2009-10-30"
"astro-ph/9809192","Jochen Greiner","Jochen Greiner (AI Potsdam, Germany), Andre van Teeseling (Univ.
  G""ottingen, Germany)","On the X-ray properties of V Sge and its relation to the supersoft X-ray
  binaries","4 pages (aa style) incl. 3 figures; to be publ. in Astronomy &
  Astrophysics; also available from http://www.obs.aip.de/~jcg/publis.html",,,,"astro-ph",,"  We investigate the ROSAT X-ray properties of V Sge, which has been proposed
to be related to supersoft X-ray binaries. During optical bright states, V Sge
is a faint hard X-ray source, while during optical faint states (V >=12 mag), V
Sge is a `supersoft' X-ray source. Spectral fitting confirms that V~Sge's X-ray
properties during its soft X-ray state may be similar to those of supersoft
X-ray binaries, although a much lower luminosity cannot be excluded. It is
possible to explain the different optical/X-ray states by a variable amount of
extended uneclipsed matter, which during the optical bright states contributes
significantly to the optical flux and completely absorbes the soft X-ray
component. An additional, perhaps permanent, hard X-ray component, such as a
bremsstrahlung component with a 0.1-2.4 keV luminosity of ~10^30 erg/s, must be
present to explain the X-ray properties during the optical bright/hard X-ray
state.
","[{""version"":""v1"",""created"":""Tue, 15 Sep 1998 12:46:12 GMT""}]","2007-05-23"
"astro-ph/9809193","Michele Bellazzini","M. Bellazzini, F.R. Ferraro and R. Buonanno","The Sagittarius Dwarf Galaxy Survey (SDGS): constraints on the Star
  Formation History of the Sgr dSph","6 pages, ASPCS Latex, 2 .ps figures, contributed talk presented at
  the IAU Symp. 192, The Stellar Content of the Local Group, 1998 sept 7 - 11,
  Cape Town, South Africa",,,,"astro-ph",,"  The main characteristics of a wide photometric survey of the Sgr dwarf
spheroidal galaxy are shortly presented. V and I photometry has been obtained
for ~ 90000 stars toward Sgr and for ~ 9000 stars in a region devoid of Sgr
stars (for decontamination purposes). The full potential of this large database
is far from being completely explored. Here we present only preliminary results
from the analysis of statistically decontaminated Color Magnitude Diagrams,
trying to set a scheme of the Star Formation History of the Sgr Galaxy. A
scenario is proposed in which star formation in Sgr began very early and lasted
for several Gyr with progressive chemical enrichment of the Inter Stellar
Medium (ISM). Nearly 8 Gyr ago the star formation rate abruptly decreased,
perhaps in coincidence with the event that led to the gas depletion of the
galaxy. A very small rate of star formation continued until relatively recent
times (~ 1 Gyr ago).
","[{""version"":""v1"",""created"":""Tue, 15 Sep 1998 13:10:39 GMT""}]","2007-05-23"
"astro-ph/9809194","Enrique Garcia-Berro","E. Garcia-Berro (1), S. Torres (1), J. Isern (2) and A. Burkert (3) (
  (1) Universitat Politecnica de Catalunya, (2) Institut d'Estudis Espacials de
  Catalunya, (3) Max Planck Institut fur Astronomie)","Monte Carlo simulations of the disk white dwarf population","18 pages, 14 postscript figures. Accepted for publication in Monthly
  Notices of the RAS, uses mn.sty",,,"UPC/DFA/98-MY251","astro-ph",,"  In order to understand the dynamical and chemical evolution of our Galaxy it
is of fundamental importance to study the local neighborhood. White dwarf stars
are ideal candidates to probe the history of the solar neighborhood, since
these ``fossil'' stars have very long evolutionary time-scales and, at the same
time, their evolution is relatively well understood. In fact, the white dwarf
luminosity function has been used for this purpose by several authors. However,
a long standing problem arises from the relatively poor statistics of the
samples, especially at low luminosities. In this paper we assess the
statistical reliability of the white dwarf luminosity function by using a Monte
Carlo approach.
","[{""version"":""v1"",""created"":""Tue, 15 Sep 1998 15:14:43 GMT""}]","2007-05-23"
"astro-ph/9809195","Gregory J. Sobczak","Gregory J. Sobczak, Jeffrey E. McClintock, Ronald A. Remillard,
  Charles D. Bailyn, Jerome A. Orosz","RXTE Spectral Observations of the 1996-97 Outburst of the Microquasar
  GRO J1655-40","34 pages including 9 figures and 3 tables. Accepted for publication
  in the Astrophysical Journal. Our interpretation of the data and the main
  conclusions have been significantly revised",,"10.1086/307474",,"astro-ph",,"  Excellent coverage of the entire 16-month 1996-97 outburst cycle of GRO
J1655-40 was provided by RXTE. We present a full spectral analysis of these
data, which includes 52 PCA spectra from 2.5-20 keV and HEXTE spectra above 20
keV. We also include a nearly continuous ASM light curve with several intensity
measurements per day. The data are interpreted in the context of the multicolor
blackbody disk/power-law model. The source is observed in the very high,
high/soft, and low/hard outburst states. During the very high state, the source
exhibits intense hard flares on time scales of hours to days which are
correlated with changes in both the fitted temperature and radius of the inner
accretion disk. During the high/soft state, the spectrum is dominated by the
soft thermal emission from the accretion disk with spectral parameters that
suggest approximately constant inner disk radius and temperature. We find that
a tight relationship exists between the observed inner radius of the disk and
the flux in the power-law component. During intense hard flares, the inner disk
radius is observed to decrease by as much as a factor of three on a time scale
of days. The apparent decrease of the inner disk radius observed during the
flares may be due to the failure of the multicolor disk model caused by a
steepening of the radial temperature profile in the disk coupled with increased
spectral hardening and not physical changes of the inner disk radius. Assuming
that our spectral model is valid during periods of weak power-law emission, our
most likely value for the inner disk radius implies a* < 0.7. Such a low value
for the black hole angular momentum is inconsistent with the relativistic frame
dragging and the `diskoseismic' models as interpretations for the 300 Hz X-ray
QPO seen during some of these RXTE observations.
","[{""version"":""v1"",""created"":""Tue, 15 Sep 1998 15:47:18 GMT""},{""version"":""v2"",""created"":""Sat, 27 Feb 1999 15:56:40 GMT""}]","2009-10-30"
"cond-mat/9809199","Belal Baaquie","Belal E. Baaquie","Quantum Field Theory of Treasury Bonds","29 pages, 4 figures",,,"HUTP-98/A068","cond-mat.soft q-fin.PR",,"  The Heath-Jarrow-Morton (HJM) formulation of treasury bonds in terms of
forward rates is recast as a problem in path integration. The HJM-model is
generalized to the case where all the forward rates are allowed to fluctuate
independently. The resulting theory is shown to be a two-dimensional Gaussian
quantum field theory. The no arbitrage condition is obtained and a functional
integral derivation is given for the price of a futures and an options
contract.
","[{""version"":""v1"",""created"":""Mon, 14 Sep 1998 16:17:55 GMT""}]","2008-12-02"
"cond-mat/9809200","Ray Rivers","R.J. Rivers","Phase Transitions in Condensed Matter and Relativistic QFT","Talk presented at 5th International Workshop on Thermal Field
  Theories and Their Applications, Regensberg, August 1998. 10 pages, no
  figures",,,,"cond-mat hep-th",,"  Kibble and Zurek have provided a unifying picture for the onset of phase
transitions in relativistic QFT and condensed matter systems respectively,
strongly supported by agreement with condensed matter experiments in He3. The
failure of a recent experiment on He4 to agree with the predictions has
prompted a reappraisal of this picture. We provide an alternative picture that
explains the experimental evidence.
","[{""version"":""v1"",""created"":""Mon, 14 Sep 1998 16:27:23 GMT""}]","2007-05-23"
"cond-mat/9809201","K. J. Thomas","N. J. Appleyard, J. T. Nicholls, M. Y. Simmons, W. R. Tribe and M.
  Pepper","A Thermometer for the 2D Electron Gas using 1D Thermopower","4 pages and 5 figures, To appear in Phys. Rev. Lett. Vol. 81 (Oct 12
  issue)",,"10.1103/PhysRevLett.81.3491",,"cond-mat.mes-hall",,"  We measure the temperature of a 2D electron gas in GaAs from the thermopower
of a one-dimensional ballistic constriction, using the Mott relation to confirm
the calibration from the electrical conductance. Under hot electron conditions,
this technique shows that the power loss by the electrons follows a $T^5$
dependence in the Gruneisen-Bloch regime, as predicted for acoustic phonon
emission with a screened piezoelectric interaction. An independent measurement
using conventional thermometry based on Shubnikov-de Haas oscillations gives a
$T^3$ loss rate; we discuss reasons for this discrepancy.
","[{""version"":""v1"",""created"":""Mon, 14 Sep 1998 16:44:55 GMT""}]","2009-10-31"
"cond-mat/9809202","Seth Fraden","Mark Ospeck and Seth Fraden (Complex Fluids Group, Brandeis
  University)","Solving the Poisson-Boltzmann Equation to Obtain Interaction Energies
  Between Confined, Like-charged Cylinders","8 pages, 11 figures. To be published in the Journal of Chemical
  Physics, Nov. 22, 1998. http://www.elsie.brandeis.edu is the Complex Fluids
  Group Website",,"10.1063/1.477469",,"cond-mat.soft",,"  We numerically solve the non-linear Poisson-Boltzmann equation for two
cylinders confined by two parallel charged plates. The repulsive electrical
double layer component of the cylinder pair potential is substantially reduced
by confinement between like-charged plates. While the effective cylinder
surface charge is increased by the confinement, the effective interaction
screening length is reduced, this effect being dominant so that the repulsive
confined cylinder-cylinder interaction potential is reduced.
","[{""version"":""v1"",""created"":""Mon, 14 Sep 1998 19:02:06 GMT""}]","2009-10-31"
"cond-mat/9809203","Carlo Presilla","Roberto D'Agosta, Boris A. Malomed and Carlo Presilla","Stationary states of the Gross-Pitaevskii equation with linear
  counterpart","15 pages, 6 figures, LaTeX","Phys. Lett. A 275, 424-434 (2000)","10.1016/S0375-9601(00)00619-8",,"cond-mat math-ph math.MP nlin.PS patt-sol quant-ph",,"  We study the stationary solutions of the Gross-Pitaevskii equation that
reduce, in the limit of vanishing non-linearity, to the eigenfunctions of the
associated Schr\""odinger equation. By providing analytical and numerical
support, we conjecture an existence condition for these solutions in terms of
the ratio between their proper frequency (chemical potential) and the
corresponding linear eigenvalue. We also give approximate expressions for the
stationary solutions which become exact in the opposite limit of strong
non-linearity. For one-dimensional systems these solutions have the form of a
chain of dark or bright solitons depending on the sign of the non-linearity. We
demonstrate that in the case of negative non-linearity (attractive interaction)
the norm of the solutions is always bounded for dimensions greater than one.
","[{""version"":""v1"",""created"":""Mon, 14 Sep 1998 18:21:11 GMT""},{""version"":""v2"",""created"":""Tue, 30 Mar 1999 16:05:06 GMT""},{""version"":""v3"",""created"":""Thu, 6 Jul 2000 12:34:03 GMT""}]","2009-10-31"
"cond-mat/9809204","Jorge Jose","Jorge V. Jos\'e","Duality in two capacitively coupled layered arrays of ultrasmall
  Josephson junctions","25 pages in Revtex, To appear in J. Stat. Physics In the November
  1998 issue",,"10.1023/B:JOSS.0000033171.04828.d6",,"cond-mat.mes-hall cond-mat.stat-mech",,"  We consider the problem of two capacitively coupled Josephson junction arrays
made of ultrasmall junctions. Each one of the arrays can be in the
semiclassical or quantum regimes, depending on their physical parameter values.
The former case is dominated by a Cooper-pair superfluid while the quantum one
is dominated by dynamic vortices leading to an insulating behavior. We first
consider the limit when both arrays are in the semiclassical limit, and next
the case when one array is quantum and the other semiclassical. We present WKB
and Mean Field theory results for the critical temperature of each array when
both are in the semiclassical limit. When one array is in the semiclassical
regime and the other one in the quantum fluctuations dominated regimes, we
derive a duality transformation between the charged and vortex dominated arrays
that involve a gauge vector field, which is proportional to the site coupling
capacitance between the arrays. The system considered here has been fabricated
and we make some predictions as to possible experimentally measurable
quantities that could be compared with theory.
","[{""version"":""v1"",""created"":""Mon, 14 Sep 1998 22:51:01 GMT""}]","2009-10-31"
"cond-mat/9809205","David Pettey","David Pettey and T.C. Lubensky","Stability of Texture and Shape of Circular Domains of Langmuir
  Monolayers","14 double column RevTex pages, 8 eps figures",,"10.1103/PhysRevE.59.1834",,"cond-mat.soft",,"  Finite domains of a Langmuir monolayer in a phase with tilted molecules can
be modeled by a simple elastic free energy of an XY order parameter with
isotropic and anisotropic line tension terms. The domains can and often do
contain nontrivial textures, which in turn influence the shape of the domains.
Herein we investigate the properties of a simplified isotropic model with a
single elastic constant. For circular domains a first-order phase transition is
found between two distinct textures: an exterior defect (or ``virtual boojum'')
texture, and an interior defect texture. Starting with a circular domain and
either of these two textures as a ground state, we find shape instabilities
develop that depend on the elastic constants and line tensions in the
simplified model. In both cases a necessary but not sufficient condition for
the onset of shape instabilities is the possibility for a local negative
effective line tension to develop from the anisotropic line tension term.
","[{""version"":""v1"",""created"":""Mon, 14 Sep 1998 19:05:25 GMT""}]","2016-08-31"
"cond-mat/9809206","Mike Norman","M. R. Norman, M. Randeria, H. Ding, and J. C. Campuzano","Photoelectron Escape Depth and Inelastic Secondaries in High Temperature
  Superconductors","2 pages, revtex, 3 encapsulated postscript figures","Phys. Rev. B 59, 11191 (1999)","10.1103/PhysRevB.59.11191",,"cond-mat.supr-con",,"  We calculate the photoelectron escape depth in the high temperature
superconductor Bi2212 by use of electron energy-loss spectroscopy data. We find
that the escape depth is only 3 Ang. for photon energies typically used in
angle resolved photoemission measurements. We then use this to estimate the
number of inelastic secondaries, and find this to be quite small near the Fermi
energy. This implies that the large background seen near the Fermi energy in
photoemission measurements is of some other origin.
","[{""version"":""v1"",""created"":""Mon, 14 Sep 1998 20:09:07 GMT""}]","2009-10-31"
"cond-mat/9809207","Guanghong Chen","Guang-Hong Chen and M. E. Raikh (University of Utah)","Small-$q$ Anomaly in the Dielectric Function and High-Temperature
  Oscillations of Screening Potential in 2D Electron Gas with Spin-Orbit
  Coupling","15 pages, REVTeX, 5 figures",,"10.1103/PhysRevB.59.5090",,"cond-mat.mes-hall",,"  We study the static dielectric function $\epsilon(q)$ of 2D electron system
with spin-orbit coupling in the frame of the random phase approximation. We
demonstrate that, in addition to the well-known $2k_F$-Kohn anomaly, spin-orbit
coupling gives rise to the novel anomaly in the dielectric function at small
$q=q_0\ll k_F$, where $q_0$ is the distance between two Fermi surfaces. As a
result of this anomaly a large-distance behavior of the potential from a point
charge exhibits (in addition to the conventional Friedel oscillations) novel
oscillations with a period $2\pi/q_0$. The remarkable feature of these
oscillations is that they are not smeared out by the temperature. We show that
the small-$q$ anomaly also modifies the indirect exchange interaction of
localized magnetic moments (RKKY interaction). In the presense of spin-orbit
coupling this interaction acquires a high-temperature component.
","[{""version"":""v1"",""created"":""Mon, 14 Sep 1998 21:27:30 GMT""}]","2009-10-31"
"cond-mat/9809208","Yoshiya Yamanaka","Hiroshi Ezawa (Gakushuin University), Koichi Nakamura (Meiji
  University) and Keiji Watanabe (Meisei University)","Irreversibility from a Reversible Equation","8 pages, LaTeX",,,,"cond-mat",,"  After a discussion on the state of local equilibrium with temperature
inhomogeneity, comparing mixture state reprsentation in statistical mechanics
and pure state representation in thermo field dynamics, a simple model is
solved to show that a reversible equation of motion with the initial condition
having inhomogeneous temperature can lead to irreversible, viz. diffusive,
behaviour. Yet, the solution is time symmetric exhibiting diffusion both
towards future and past.
","[{""version"":""v1"",""created"":""Tue, 15 Sep 1998 02:32:34 GMT""},{""version"":""v2"",""created"":""Thu, 17 Sep 1998 23:54:02 GMT""},{""version"":""v3"",""created"":""Wed, 28 Oct 1998 08:39:32 GMT""}]","2007-05-23"
"cond-mat/9809209","Paulo Roberto","P. R. A. Campos and J. F. Fontanari","Finite-size scaling of the error threshold transition in finite
  population","8 pages, 3 ps figures. submitted to J. Phys. A",,"10.1088/0305-4470/32/1/001",,"cond-mat.stat-mech q-bio",,"  The error threshold transition in a stochastic (i.e. finite population)
version of the quasispecies model of molecular evolution is studied using
finite-size scaling. For the single-sharp-peak replication landscape, the
deterministic model exhibits a first-order transition at $Q=Q_c=1/a$, where $%
Q$ is the probability of exact replication of a molecule of length $L \to
\infty$, and $a$ is the selective advantage of the master string. For
sufficiently large population size, $N$, we show that in the critical region
the characteristic time for the vanishing of the master strings from the
population is described very well by the scaling assumption $\tau = N^{1/2} f_a
\left [ \left (Q - Q_c) N^{1/2} \right ] $, where $f_a$ is an $a$-dependent
scaling function.
","[{""version"":""v1"",""created"":""Tue, 15 Sep 1998 13:19:45 GMT""}]","2009-10-31"
"cond-mat/9809210","Stefano Lise","Stefano Lise, Amos Maritan and Alessandro Pelizzola","Bethe Approximation for a Semi-flexible Polymer Chain","8 pages, 3 eps figures",,"10.1103/PhysRevE.58.R5241",,"cond-mat.stat-mech cond-mat.soft",,"  We present a Bethe approximation to study lattice models of linear polymers.
The approach is variational in nature and based on the cluster variation method
(CVM). We focus on a model with $(i)$ a nearest neighbor attractive energy
$\epsilon_v$ between pair of non--bonded monomers, $(ii)$ a bending energy
$\epsilon_h$ for each pair of successive chain segments which are not
collinear. We determine the phase diagram of the system as a function of the
reduced temperature $t=\frac{T}{\epsilon_v}$ and of the parameter
$x=\frac{\epsilon_h}{\epsilon_v}$. We find two different qualitative behaviors,
on varying $t$. For small values of $x$ the system undergoes a $\theta$
collapse from an extended coil to a compact globule; subsequently, on
decreasing further $t$, there is a first order transition to an anisotropic
phase, characterized by global orientational order. For sufficiently large
values of $x$, instead, there is directly a first order transition from the
coil to the orientational ordered phase. Our results are in good agreement with
previous Monte Carlo simulations and contradict in some aspects mean--field
theory. In the limit of Hamiltonian walks, our approximation recovers results
of the Flory-Huggins theory for polymer melting.
","[{""version"":""v1"",""created"":""Tue, 15 Sep 1998 14:19:06 GMT""}]","2009-10-31"
"cond-mat/9809211","Tomaz Prosen","Tomaz Prosen (Faculty of Math.&Phys., Univ.of Ljubljana, Slovenia)","A map from 1d Quantum Field Theory to Quantum Chaos on a 2d Torus","4 pages in REVTeX, 1 eps-figure included","Phys.Rev. E60 (1999) 1658-1663","10.1103/PhysRevE.60.1658",,"cond-mat.stat-mech chao-dyn nlin.CD",,"  Dynamics of a class of quantum field models on 1d lattice in Heisenberg
picture is mapped into a class of `quantum chaotic' one-body systems on
configurational 2d torus (or 2d lattice) in Schr\"" odinger picture. Continuum
field limit of the former corresponds to quasi-classical limit of the latter.
","[{""version"":""v1"",""created"":""Tue, 15 Sep 1998 14:49:10 GMT""}]","2009-10-31"
"cond-mat/9809212","Michael Potthoff","M. Potthoff, T. Herrmann, T. Wegner and W. Nolting","The moment sum rule and its consequences for ferromagnetism in the
  Hubbard model","LaTeX, 22 pages, 9 eps figures included, to be published in phys.
  stat. sol. (b)","phys. stat. sol. (b) 210, 199 (1998)","10.1002/(SICI)1521-3951(199811)210:1<199::AID-PSSB199>3.0.CO;2-3",,"cond-mat.str-el",,"  The sum rule for the moments of the spectral density is discussed for the
single-band Hubbard model. It is shown that respecting the sum rule up to the
order m=3 is conceptually important for a qualitatively correct description of
the quasi-particle band structure in the strong-correlation regime. Different
analytical approximations for the self-energy are analyzed with respect to
their compatibility with the moment sum rule. To estimate the practical
usefulness of the sum rule, correlation functions and dynamical quantities are
determined. The results obtained within the various approximation schemes of
different complexity are compared with each other and also with essentially
exact results available for infinite-dimensional lattices. It turns out that
the m=3 moment is rather unimportant for the paramagnetic phase on the
hyper-cubic lattice. Contrary, it decisively influences the magnetic phase
boundary as well as the critical temperature for the ferromagnetic phase on an
fcc-type lattice.
","[{""version"":""v1"",""created"":""Tue, 15 Sep 1998 14:50:37 GMT""}]","2015-06-25"
