"cond-mat/9805233","Marin Stoytchev","M. Stoytchev and A. Z. Genack","Measurements of Intensity Distributions in the Approach to Localization","5 pages, 5 post script figures, RevTex",,,"ms-041498","cond-mat.mes-hall cond-mat.dis-nn",,"  We report measurements of intensity distributions of transmitted microwave
radiation in quasi-1D samples with lengths L as large as the localization
length $\xi$. In contrast to negative exponential statistics found in the
diffusive limit, the distribution falls as a stretched exponential of power 1/2
and becomes nearly log-normal as L approaches $\xi$. We confirm the relation
between the moments and full distributions of the intensity and total
transmission obtained by Kogan and Kaveh using random matrix theory. Good
agreement is found when this relationship is used to compare measurements of
intensity distribution in strongly absorbing samples with lengths as large as
$\xi$ with calculations by Brouwer of the transmission distribution. The
variances of the measured distributions increase superlinearly near the
localization threshold confirming the coexistence of localization and
absorption and the suitability of these variances as measures of the closeness
to the localization threshold.
","[{""version"":""v1"",""created"":""Tue, 19 May 1998 15:35:14 GMT""}]","2007-05-23"
"gr-qc/9805069","Jerome Martin","Jerome Martin and Dominik J. Schwarz","Reply to `Comment on ``The influence of cosmological transitions on the
  evolution of density perturbations'' '","2 pages, Revtex",,,,"gr-qc astro-ph",,"  We reply to L.P. Grishchuk's comment (gr-qc/9801011) on our paper ``The
Influence of Cosmological Transitions on the Evolution of Density
Perturbations'' (Phys. Rev. D 57, 3302, 1998). We show that his points of
criticism are not correct.
","[{""version"":""v1"",""created"":""Mon, 18 May 1998 16:01:25 GMT""}]","2007-05-23"
"gr-qc/9805070","Miguel Navarro","M. Navarro","2D dilaton gravity made compact","Latex file, no macros, 8 pages",,,,"gr-qc",,"  We show that the equations of motion of two-dimensional dilaton gravity
conformally coupled to a scalar field can be reduced to a single non-linear
second-order partial differential equation when the coordinates are chosen to
coincide with the two scalar fields, the matter field $f$ and the dilaton
$\phi$, which are present in the theory. This result may help solve and
understand two- and higher-dimensional classical and quantum gravity.
","[{""version"":""v1"",""created"":""Mon, 18 May 1998 20:28:39 GMT""}]","2007-05-23"
"gr-qc/9805071","Tomohiro Harada","Tomohiro Harada, Hideo Iguchi, and Ken-ichi Nakao","Naked singularity formation in the collapse of a spherical cloud of
  counterrotating particles","6 pages, Accepted for Publication as a Rapid Communication in
  Physical Review D, Some Minor Corrections","Phys.Rev.D58:041502,1998","10.1103/PhysRevD.58.041502","KUNS-1500","gr-qc astro-ph",,"  We investigate collapse of a spherical cloud of counter-rotating particles.
An explicit solution is given using an elliptic integral. If the specific
angular momentum $L(r)=O(r^2)$ at $r\to 0$, no central singularity occurs. With
$L(r)$ like that, there is a finite region around the center that bounces. On
the other hand, if the order of $L(r)$ is higher than that, a central
singularity occurs. In marginally bound collapse with $L(r)=4F(r)$, a naked
singularity occurs, where $F(r)$ is the Misner-Sharp mass. The solution for
this case is expressed by elementary functions. For $ 4 <L/F<\infty$ at
$r\to0$, there is a finite region around the center that bounces and a naked
singularity occurs. For $ 0 \le L/F< 4$ at $r\to0$, there is no such region.
The results suggests that rotation may play a crucial role on the final fate of
collapse.
","[{""version"":""v1"",""created"":""Tue, 19 May 1998 04:26:24 GMT""},{""version"":""v2"",""created"":""Thu, 28 May 1998 13:08:23 GMT""},{""version"":""v3"",""created"":""Thu, 9 Jul 1998 08:20:42 GMT""}]","2009-12-30"
"gr-qc/9805072","Jerome Martin","Jerome Martin and Dominik J. Schwarz","Amplitude of superhorizon cosmological perturbations","Contributions to the XXXIIIrd Rencontres de Moriond, Fundamental
  Parameters in Cosmology, 5 pages, Latex",,,,"gr-qc astro-ph",,"  We study the influence of reheating on super-horizon density perturbations
and gravitational waves. We correct wrong claims [L. P. Grishchuk Phys. Rev. D
50, 7154 (1994) and gr-qc/9801011] about the joining of perturbations at
cosmological transitions and about the quantization of cosmological
perturbations.
","[{""version"":""v1"",""created"":""Tue, 19 May 1998 09:15:09 GMT""}]","2007-05-23"
"gr-qc/9805073","David Wands","Edmund J. Copeland, Andrew R. Liddle, James E. Lidsey and David Wands","Black holes and gravitational waves in concert - a probe of superstring
  cosmology","5 pages, Latex, no figures. Awarded fifth prize in 1998 Gravity
  Research Foundation Essay Competition. To appear in Gen. Rel. Grav","Gen.Rel.Grav. 30 (1998) 1711-1715","10.1023/A:1026658909927",,"gr-qc",,"  Two strands of observational gravitation, one the search for astrophysical
evidence of primordial black holes and the other the search for gravitational
waves, may combine to provide strong evidence in favour of cosmological models
based on superstring theory, the leading candidate for unifying gravity with
the other fundamental forces.
","[{""version"":""v1"",""created"":""Tue, 19 May 1998 14:14:45 GMT""}]","2015-06-25"
"hep-ex/9805019","J. H. Vossebeld","J.H. Vossebeld","Photon Structure in Photon Proton Interactions","5 pages, 8 eps figures; to appear in the proceedings of the 6th
  International Workshop on Deep Inelastic Scattering and QCD",,,,"hep-ex",,"  Photoproduction of jets at HERA provides information on the partonic
structure of the photon. We report on the latest dijet photoproduction results,
for real photons and for photons at low virtualities, measured with the ZEUS
detector.
","[{""version"":""v1"",""created"":""Tue, 19 May 1998 09:35:21 GMT""}]","2007-05-23"
"hep-lat/9805016",,"M. N. Chernodub, F. V. Gubarev, E.-M. Ilgenfritz and A. Schiller","Embedded Topological Defects in Hot Electroweak Theory: a Lattice Study","13 pages, LaTeX, 8 figures, epsf.sty needed; revision: minor changes
  and reference added","Phys.Lett.B434:83-91,1998","10.1016/S0370-2693(98)00754-0","ITEP-TH-12/98, KANAZAWA-98-03, ZIF-MS-30/98","hep-lat hep-ph",,"  We study the properties of Nambu monopoles and Z-vortices in the 3D lattice
SU(2) Higgs theory which represents the Standard Model at high temperature. We
show that the densities of the Nambu monopoles and the Z-vortices are O(1) in
the symmetric phase and generically small in the Higgs phase. Near to the
critical Higgs mass and in the vicinity of the phase transition the densities
are no more negligible in the broken phase. The percolation probability of the
Z-vortex lines is found as a new disorder parameter for this phase transition.
We conclude that the transition to the symmetric phase is accompanied by
Z-vortex condensation. Simulations comparing elementary and extended vortices
and monopoles at different \beta_G values, aiming to show that the density of
vortices and monopoles of fixed physical size might have a well-defined
continuum limit, gives encouraging but so far inconclusive results.
","[{""version"":""v1"",""created"":""Mon, 18 May 1998 17:02:24 GMT""},{""version"":""v2"",""created"":""Tue, 9 Jun 1998 14:02:14 GMT""}]","2010-05-27"
"hep-lat/9805017","Shchur Lev N.","Lev N. Shchur and Paolo Butera","The RANLUX generator: resonances in a random walk test","18 pages with 14 figures, Essential addings in the Abstract only","Int.J.Mod.Phys. C9 (1998) 607-624","10.1142/S0129183198000509","IFUM 620/FT","hep-lat cond-mat",,"  Using a recently proposed directed random walk test, we systematically
investigate the popular random number generator RANLUX developed by Luescher
and implemented by James. We confirm the good quality of this generator with
the recommended luxury level. At a smaller luxury level (for instance equal to
1) resonances are observed in the random walk test. We also find that the
lagged Fibonacci and Subtract-with-Carry recipes exhibit similar failures in
the random walk test. A revised analysis of the corresponding dynamical systems
leads to the observation of resonances in the eigenvalues of Jacobi matrix.
","[{""version"":""v1"",""created"":""Mon, 18 May 1998 19:52:18 GMT""},{""version"":""v2"",""created"":""Fri, 22 May 1998 07:53:25 GMT""},{""version"":""v3"",""created"":""Fri, 28 Aug 1998 13:59:45 GMT""}]","2015-06-25"
"hep-lat/9805018","Kim Splittorff","K. Splittorff and A.D. Jackson (The Niels Bohr Institute, Copenhagen)","The Ginsparg-Wilson relation and local chiral random matrix theory","10 pages LaTeX one figure",,,,"hep-lat",,"  A chiral random matrix model with locality is constructed and examined. The
Nielsen-Ninomiya no-go theorem is circumvented by the use of a generally
applicable modified Dirac operator which respects the Ginsparg-Wilson relation.
We observe the expected universal behaviour of the eigenvalue density in the
microscopic limit.
","[{""version"":""v1"",""created"":""Tue, 19 May 1998 15:16:49 GMT""},{""version"":""v2"",""created"":""Wed, 20 May 1998 14:51:10 GMT""}]","2007-05-23"
"hep-ph/9805352","Borut Bajc","Borut Bajc","Do internal symmetries get restored in hot and dense SUSY?","3 pages, uses sprocl.sty, talk given at the International Workshop
  COSMO97 on Particle Physics and the Early Universe, 15-19 September 1997,
  Ambleside, Lake District, England, to be published in the Proceedings",,"10.1142/9789814447263_0067","IJS-TP-98/09","hep-ph",,"  I offer some computational details and useful and concise formulae to
calculate the effective potential for a general abelian supersymmetric model at
high temperature and density. It will be shown that such cases are very good
candidates for symmetry nonrestoration at high temperature, providing large
densities are present.
","[{""version"":""v1"",""created"":""Mon, 18 May 1998 18:04:20 GMT""}]","2016-10-26"
"hep-ph/9805360","Luis M. Bettencourt","Luis M.A. Bettencourt (Los Alamos) and C. Wetterich (U. of Heidelberg)","Time evolution of correlation functions for classical and quantum
  anharmonic oscillators","4 pages, 4 figures, RevTex, revised version",,,"LAUR-98-1914, HD-THEP-98-19","hep-ph astro-ph cond-mat hep-th quant-ph",,"  The time evolution of the correlation functions of an ensemble of anharmonic
N-component oscillators with O(N) symmetry is described by a flow equation,
exact up to corrections of order $1/N^2$. We find effective irreversibility.
Nevertheless, analytical and numerical investigation reveals that the system
does not reach thermal equilibrium for large times, even when $N\to \infty$.
Depending on the initial distribution, the dynamics is asymptotically stable or
it exhibits growing modes which break the conditions for the validity of the
1/N expansion for large time. We investigate both classical and quantum
systems, the latter being the limit of an O(N) symmetric scalar quantum field
theory in zero spatial dimensions.
","[{""version"":""v1"",""created"":""Mon, 18 May 1998 17:15:19 GMT""},{""version"":""v2"",""created"":""Fri, 29 May 1998 20:45:40 GMT""}]","2007-05-23"
"hep-ph/9805361","Goran Senjanovic","Goran Senjanovic","Rochelle salt: a prototype of particle physics","9 pages, uses sprocl.sty, plenary talk given at the International
  Workshop COSMO97 on Particle Physics and the Early Universe, 15-19 September
  1997, Ambleside, Lake District, England, to be published in the Proceedings.
  References added",,"10.1142/9789814447263_0062","IC/98/48","hep-ph",,"  Rochelle salt has a remarkable characteristic of becoming more ordered for a
range of high temperatures before melting. In the particle physics language
this means more symmetry breaking for high T. In many realistic field theories
this is a perfectly consistent scenario which has profound consequences in the
early universe. In particular it implies that there may be no domain wall and
monopole problems, and it may also play an important role in baryogenesis if CP
and P are broken spontaneously. In the case of the monopole problem this may
require a large background charge of the universe. The natural candidates for
this background charge are a possible lepton number in the neutrino sea or
global continous R-charges in supersymmetric theories.
","[{""version"":""v1"",""created"":""Mon, 18 May 1998 18:31:44 GMT""},{""version"":""v2"",""created"":""Tue, 19 May 1998 13:18:34 GMT""}]","2016-10-26"
"hep-ph/9805362","Mikhail Galynskii","Mikhail Galynskii and Sergei Sikach","On production $e^+ e^-$-pairs by a high energy photon in collision with
  photons of a laser wave","4 pages, 2 figures","Adv. Synerg.8:60-63,1997",,"Proceeding of the V Annual Seminar ""Nonlinear phenomena in complex
  system"". February 1996, Minsk, Belarus. Advances in Synergetics 1997, vol. 8,
  pp. 60-63, Minsk, Edited by V.Kuvshinov & G.Krylov","hep-ph",,"  We calculate the number of $e^+ e^-$-pairs produced by a Compton high energy
photon in turn formed in the process $e + n \gamma_0 -> e + \gamma$ at
simultaneous collision with several photons $\gamma_0$ of the same laser beam
$\gamma + s \gamma_0 -> e^+ + e^-$. The case when polarization states of
initial electron beam and laser photons are helicity is considered. It is shown
that taking into account nonlinear effects in the Compton backscattering leads
to decreasing the threshold of production of $e^+ e^-$-pairs and increasing
their number. The consideration is based on the direct calculation of matrix
elements in the formalism of diagonal spin basis.
","[{""version"":""v1"",""created"":""Mon, 18 May 1998 18:34:13 GMT""}]","2011-04-15"
"hep-ph/9805363","Bing An Li","Bing An Li (Univ. of Kentucky)","$\tau\to\rho\pi\pi\nu$ decays","12 pages and one figure","Phys.Rev.D58:097302,1998","10.1103/PhysRevD.58.097302",,"hep-ph",,"  Effective chiral theory of mesons is applied to study the four decay modes of
$\tau\to\rho\pi\pi\nu$. Theoretical values of the branching ratios are in
agreement with the data. The theory predicts that the $a_{1}$ resonance plays a
dominant role in these decays. There is no new parameter in this study.
","[{""version"":""v1"",""created"":""Mon, 18 May 1998 18:42:26 GMT""}]","2014-11-17"
"hep-ph/9805364","Robin Stuart","Paresh Malde and Robin G. Stuart (Randall Laboratory of Physics)","O(N_f alpha^2) Electromagnetic Charge Renormalization in the Standard
  Model","29 pages LaTeX. 6 figures. Uses amsmath.sty, cite.sty and epsfig.sty",,,,"hep-ph",,"  The O(N_f alpha^2) electroweak radiative corrections to the Thomson
scattering matrix element are calculated for a general renormalization scheme
with massless fermions. All integrals can be evaluated exactly in dimensional
regularization which in several cases yields new results that are remarkably
simple in form. A number of stringent internal consistency checks are
performed. The Z-gamma mixing complicates the calculation of 1-particle
reducible diagrams considerably at this order and a general treatment of this
problem is given. Conditions satisfied by O(N_f alpha^2) counterterms are
derived and may be applied to other calculations at this order.
","[{""version"":""v1"",""created"":""Mon, 18 May 1998 19:11:33 GMT""}]","2007-05-23"
"hep-ph/9805365","Kimball A. Milton","Leonard Gamberg, George R. Kalbfleisch, and Kimball A. Milton","Difficulties with Photonic Searches for Magnetic Monopoles","13 pages, 1 ps figure, REVTeX",,,"OKHEP-98-02","hep-ph",,"  Recently, there have been proposals that the classic Euler-Heisenberg
Lagrangian together with duality could be employed to set limits on magnetic
monopoles having masses less than 1 TeV. The D0 collaboration at Fermilab has
used such a proposal to set mass limits based on the nonobservation of pairs of
photons each with high transverse momentum. In this note, we critique the
underlying theory, by showing that at the quoted limits the cross section
violates unitarity and is unstable with respect to radiative corrections. It is
proposed that the correct coupling of magnetic monopoles to photons leads to an
effective softening of the interaction, leading to a much smaller cross
section, from which no significant limit can be obtained from the current
experiments. Previous limits based on virtual monopole loops are similarly
criticized.
","[{""version"":""v1"",""created"":""Mon, 18 May 1998 19:13:50 GMT""}]","2007-05-23"
"hep-ph/9805366","Jose Wudka","G. Sanchez-Colon and J.Wudka","Effective operator contributions to the oblique parameters","13 pages, RevTeX","Phys.Lett.B432:383-389,1998","10.1016/S0370-2693(98)00682-0","UCRHEP-T229","hep-ph",,"  We present a model and process independent study of the contributions from
non-Standard Model physics to the oblique parameters S, T and U. We show that
within an effective lagrangian parameterization the expressions for the oblique
parameters in terms of observables are consistent, while those in terms of the
vector-boson vacuum polarization tensors are ambiguous. We obtain the
constraints on the scale of new physics derived from current data on S, T and U
and note that deviations in U from its Standard Model value would favor a
scenario where the underlying physics does not decouple.
","[{""version"":""v1"",""created"":""Mon, 18 May 1998 20:39:43 GMT""}]","2011-07-19"
"hep-ph/9805367","Daisuke Nomura","J. Hisano, Daisuke Nomura, Yasuhiro Okada, Yasuhiro Shimizu, Minoru
  Tanaka","Enhancement of \mu \to e \gamma in the supersymmetric SU(5) GUT at large
  \tan\beta","11 pages, 3 figures","Phys.Rev. D58 (1998) 116010","10.1103/PhysRevD.58.116010","KEK-TH-575, UT-815, OU-HET-294","hep-ph",,"  Branching ratio of $\mu \to \e \gamma$ is evaluated in the supersymmetric
SU(5) grand unified theory taking account of higher dimensional operators,
which reproduce the realistic quark and lepton masses and the mixing
parameters. It is shown by numerical calculation that at large $\tan\beta$ the
branching ratio is enhanced by a few orders of magnitude since the flavor
mixings for both the left- and the right-handed sleptons are induced by the
effect of the higher dimensional operators.
","[{""version"":""v1"",""created"":""Tue, 19 May 1998 03:13:10 GMT""}]","2009-10-31"
"hep-ph/9805368","Walter Grimus","S.M. Bilenky (JINR, Dubna & INFN, Torino), C. Giunti (INFN, Torino &
  Torino U.), W. Grimus (Vienna U.)","Neutrino Masses and Mixings in the Light of Experimental Data","LaTeX2e, 12 pages with 4 figures","Pramana 51:51-64,1998","10.1007/BF02827480","UWThPh-1998-21, DFTT 19/98","hep-ph",,"  All the possible schemes of neutrino mixing with four massive neutrinos
inspired by the existing experimental indications in favour of neutrino mixing
are considered. It is shown that the scheme with a neutrino mass hierarchy is
not compatible with the experimental results, likewise all other schemes with
the masses of three neutrinos close together and the fourth mass separated by a
gap needed to incorporate the LSND neutrino oscillations. Only two schemes with
two pairs of neutrinos with close masses separated by this gap of the order of
1 eV are in agreement with the results of all experiments. We carefully examine
the arguments leading to this conclusion and also discuss experimental
consequences of the two favoured neutrino schemes.
","[{""version"":""v1"",""created"":""Tue, 19 May 1998 07:29:01 GMT""}]","2011-08-17"
"hep-ph/9805369","Rahul Basu","Rahul Basu (Institute of Mathematical Sciences, Madras, India)","Low $x$ physics and Structure Functions","This is an expanded version of a talk presented at the Fifth Workshop
  in High Energy Physics Phenomenology held at IUCAA, Pune, India, Jan 12-25,
  1998 - 16 pages, 10 figures, uses general.sty (included)","Pramana 51:205-216,1998","10.1007/BF02827492",,"hep-ph",,"  In this talk I review the behaviour of structure functions at low values of
Bjorken $x$ and discuss the theoretical underpinnings with particular attention
to resummation schemes. I present the need for 'less inclusive' events to
distinguish between various resummation schemes and discuss the various
difficulties in differentiating experimentally between different schemes.
","[{""version"":""v1"",""created"":""Tue, 19 May 1998 07:36:18 GMT""}]","2014-11-17"
"hep-ph/9805370","Sven-Olaf Moch","Sven Moch (NIKHEF, Amsterdam)","Sudakov Resummation for Electroproduction of Heavy Quarks","5 pages latex + 2 eps figures. Talk given at the DIS98 Workshop,
  Brussels, Belgium, April 4-8, 1998. To appear in the proceedings",,,"NIKHEF 98-011","hep-ph",,"  The leading and next-to-leading threshold logarithms of the QCD corrections
to electroproduction of heavy quarks in single-particle inclusive kinematics
are resummed to all orders in perturbation theory. The resummed cross-section
is used to derive the NLO and NNLO results near threshold and their numerical
impact on the charm structure function is studied.
","[{""version"":""v1"",""created"":""Tue, 19 May 1998 15:33:24 GMT""}]","2007-05-23"
"hep-ph/9805371","Georg G. Bunatian","G. G. Bunatian (JINR)","Inquiry for the \pi^+ \pi^- bound state conversion in two \pi^0 as being
  due to the Weinberg pion-pion-interaction lagrangian","13 pages, LaTeX, submitted to Nucl. Phys. A","Nucl.Phys. A645 (1999) 314-328","10.1016/S0375-9474(98)00594-6",,"hep-ph",,"  In the work presented, the decay of the pionium, that is the \pi^+ \pi^-
bound state, into two \pi^0 is studied, the \pi\pi-interaction causing this
transition being described by the underlying Weinberg lagrangian. The
calculation with such a \pi\pi-lagrangian being carried out, the \pi-meson size
r_{0}-emerges to be allowed for and occurs in the final result. The bound
\pi^+\pi^- system itself is presumed to be due to the instantaneous Coulomb
interaction and is treated consistently nonrelativistic, the Bethe-Solpeter
equation being utilized. Along calculating, the terms of the lowest order in
fine structure constant \alpha and the terms \sim \ln(r_{0}) are retained. The
obtained pionium lifetime \tau is thought to be compatible with the conceivable
future experimental data. The dependence of the results on the effective
lagrangian parameters is visualized. The investigation carried out persuades us
that just the whole form of the genuine \pi-interaction determines the pionium
lifetime, but not simply the \pi\pi scattering lengths. The inquiry into
pionium decaying promotes to specify the validity of various \pi\pi-interaction
descriptions.
","[{""version"":""v1"",""created"":""Tue, 19 May 1998 08:54:36 GMT""}]","2009-10-31"
"hep-ph/9805372","Hong-Yi Zhou","Hong-Yi Zhou(Tsinghua U.),Chong-Sheng Li(Beijing U.)","Supersymmetric Electroweak Corrections to Top Quark Production at LHC","11pages,4 postscript figures","Commun.Theor.Phys. 30 (1998) 465-470","10.1088/0253-6102/30/3/465","TUIMP-TH-96/82","hep-ph",,"  The $\alpha m_t^2/m_W^2$ order supersymmetric electroweak corrections arising
from loops of chargino, neutralino, and squark to top quark pair production by
$gg$ fusion at LHC are calculated in the minimal supersymmetric model. We found
that the corrections amount about a few percent.
","[{""version"":""v1"",""created"":""Tue, 19 May 1998 09:54:18 GMT""},{""version"":""v2"",""created"":""Fri, 22 May 1998 09:31:51 GMT""}]","2018-01-17"
"hep-ph/9805373","Apostolos Pilaftsis","Apostolos Pilaftsis (MPI, Munich)","Higgs Scalar-Pseudoscalar Mixing in the Minimal Supersymmetric Standard
  Model","17 pages, LaTeX, 3 encapsulated figures included","Phys.Lett.B435:88-100,1998","10.1016/S0370-2693(98)00771-0","MPI-PhT/98-38","hep-ph",,"  In the minimal supersymmetric Standard Model, the heaviest CP-even Higgs
boson H and the CP-odd Higgs scalar A are predicted to be almost degenerate in
mass at the tree level, for the wide kinematic range M_A > 2M_Z and \tan\beta
\ge 2. However, if large soft-CP-violating Yukawa interactions involving scalar
quarks of the third generation are present in the theory, then the CP
invariance of the Higgs potential can be maximally broken beyond the Born
approximation, and the high degree of mass degeneracy between H and A may be
lifted through a sizeable HA mixing. After taking the CP-odd tadpole
renormalization of the A boson into account, we find that the small mass
difference M_H - M_A, which is about 1% of the A-boson mass at the tree level,
can be substantially enhanced to the 25% level at the one-loop order. We also
find that the loop-induced mixing between the lightest CP-even Higgs boson h
and the A boson may be of comparable size to M_h. We briefly discuss the main
phenomenological implications of the predicted hA and HA mixings for the
general Higgs-boson mass spectrum and for CP-violating observables at collider
and lower energies.
","[{""version"":""v1"",""created"":""Tue, 19 May 1998 10:04:41 GMT""}]","2011-01-27"
"hep-ph/9805374","Kotikov A. V.","A. V. Kotikov, D. V. Peshekhonov (JINR, Dubna)","About Q2 Dependence of the Measured Asymmetry A_1(x)","5 pages, latex + 2 eps figures. Talk presented at the DIS98 workshop,
  Brussels, April 1998",,,,"hep-ph",,"  We propose the new approach for taking into account the Q2 dependence of
measured asymmetry A_1. This approach is based on the similarity of the Q2
behaviour and the shape of the spin-dependent structure function g_1(x,Q^2) and
spin averaged structure function F_3(x,Q^2). The analysis is applied on the SMC
and E154 experimental data.
","[{""version"":""v1"",""created"":""Tue, 19 May 1998 10:05:49 GMT""},{""version"":""v2"",""created"":""Mon, 8 Jun 1998 16:21:45 GMT""}]","2007-05-23"
