"chao-dyn/9805016","Sascha Hilgenfeldt","Sascha Hilgenfeldt, Michael P. Brenner, Siegfried Grossmann and Detlef
  Lohse","Analysis of Rayleigh-Plesset dynamics for sonoluminescing bubbles","41 pages, 21 eps and ps figures; LaTeX stylefiles replaced because
  the PostScript file produced at the archive had misplaced and misscaled
  figures","J. Fluid Mech. 365, 171-204 (1998)","10.1017/S0022112098001207",,"chao-dyn nlin.CD physics.flu-dyn",,"  Recent work on single bubble sonoluminescence (SBSL) has shown that many
features of this phenomenon, especially the dependence of SBSL intensity and
stability on experimental parameters, can be explained within a hydrodynamic
approach. More specifically, many important properties can already be derived
from an analysis of bubble wall dynamics. This dynamics is conveniently
described by the Rayleigh-Plesset (RP) equation. In this work we derive
analytical approximations for RP dynamics and subsequent analytical laws for
parameter dependences. These results include (i) an expression for the onset
threshold of SL, (ii) an analytical explanation of the transition from
diffusively unstable to stable equilibria for the bubble ambient radius
(unstable and stable sonoluminescence), and (iii) a detailed understanding of
the resonance structure of the RP equation. It is found that the threshold for
SL emission is shifted to larger bubble radii and larger driving pressures if
surface tension is enlarged, whereas even a considerable change in liquid
viscosity leaves this threshold virtually unaltered. As an enhanced viscosity
stabilizes the bubbles against surface oscillations, we conclude that the ideal
liquid for violently collapsing, surface stable SL bubbles should have small
surface tension and large viscosity, although too large viscosity (>40 times
the viscosity of water) will again preclude collapses.
","[{""version"":""v1"",""created"":""Mon, 18 May 1998 21:28:22 GMT""},{""version"":""v2"",""created"":""Sat, 30 May 1998 22:25:49 GMT""}]","2017-05-17"
"cond-mat/9805213","Dirk Helbing","Dirk Helbing","A Fluid Dynamic Model for the Movement of Pedestrians","For related work see
  http://www.theo2.physik.uni-stuttgart.de/helbing.html","Complex Systems 6, 391-415 (1992)",,,"cond-mat.stat-mech",,"  A kind of fluid dynamic description for the collective movement of
pedestrians is developed on the basis of a Boltzmann-like gaskinetic model. The
differences between these pedestrian specific equations and those for ordinary
fluids are worked out, for example concerning the mechanism of relaxation to
equilibrium, the role of ``pressure'', the special influence of internal
friction and the origin of ``temperature''. Some interesting results are
derived that can be compared to real situations, for example the development of
walking lanes and of pedestrian jams, the propagation of waves, and the
behavior on a dance floor. Possible applications of the model to town- and
traffic-planning are outlined.
","[{""version"":""v1"",""created"":""Mon, 18 May 1998 16:55:47 GMT""}]","2007-05-23"
"cond-mat/9805214","Michael Krech","M. Krech, Alex Bunker, and D.P. Landau (Center for Simulational
  Physics)","Fast spin dynamics algorithms for classical spin systems","9 pages RevTeX with 8 figures","Computer Physics Communications 111 (1998) 1-13","10.1016/S0010-4655(98)00009-5",,"cond-mat.stat-mech cond-mat.mtrl-sci",,"  We have proposed new algorithms for the numerical integration of the
equations of motion for classical spin systems. In close analogy to symplectic
integrators for Hamiltonian equations of motion used in Molecular Dynamics
these algorithms are based on the Suzuki-Trotter decomposition of exponential
operators and unlike more commonly used algorithms exactly conserve spin length
and, in special cases, energy. Using higher order decompositions we investigate
integration schemes of up to fourth order and compare them to a well
established fourth order predictor-corrector method. We demonstrate that these
methods can be used with much larger time steps than the predictor-corrector
method and thus may lead to a substantial speedup of computer simulations of
the dynamical behavior of magnetic materials.
","[{""version"":""v1"",""created"":""Mon, 18 May 1998 17:03:18 GMT""}]","2009-10-31"
"cond-mat/9805215","Jacek Dziarmaga","Jacek Dziarmaga","Density of Bloch Waves after a Quench","4 pages in RevTex + 3 .ps files; improved presentation; version to
  appear in PRL",,"10.1103/PhysRevLett.81.5485",,"cond-mat hep-ph hep-th",,"  Production of Bloch waves during a rapid quench is studied by analytical and
numerical methods. The density of Bloch waves decays exponentially with the
quench time. It also strongly depends on temperature. Very few textures are
produced for temperatures lower than a characteristic temperature proportional
to the square of the magnetic field.
","[{""version"":""v1"",""created"":""Mon, 18 May 1998 18:09:10 GMT""},{""version"":""v2"",""created"":""Fri, 20 Nov 1998 19:13:19 GMT""}]","2009-10-31"
"cond-mat/9805216","Giuliano Benenti","Giuliano Benenti, Giulio Casati, Dima L. Shepelyansky","Chaotic enhancement in microwave ionization of Rydberg atoms","revtex, 19 pages, 23 figures","Eur. Phys. J. D 5, 311 (1999)","10.1007/s100530050261",,"cond-mat chao-dyn nlin.CD physics.atom-ph",,"  The microwave ionization of internally chaotic Rydberg atoms is studied
analytically and numerically. The internal chaos is induced by magnetic or
static electric fields. This leads to a chaotic enhancement of microwave
excitation. The dynamical localization theory gives a detailed description of
the excitation process even in a regime where up to few thousands photons are
required to ionize one atom. Possible laboratory experiments are also
discussed.
","[{""version"":""v1"",""created"":""Mon, 18 May 1998 19:56:00 GMT""}]","2009-10-31"
"cond-mat/9805217","Sascha Hilgenfeldt","Sascha Hilgenfeldt, Detlef Lohse, and Michael Zomack","Response of bubbles to diagnostic ultrasound: a unifying theoretical
  approach","21 pages, 8 ps figures, accepted for publication in European Physical
  Journal B",,"10.1007/s100510050375",,"cond-mat.soft chao-dyn nlin.CD",,"  The scattering of ultrasound from bubbles of micrometer-sized radius, such as
used in contrast enhancers for ultrasound diagnostics, is studied. We show that
sound scattering and ``active'' emission of sound from oscillating bubbles are
not contradictory, but are just two different aspects derived from the same
physics. Treating the bubble as a nonlinear oscillator, we arrive at general
formulas for scattering and absorption cross sections. We show that several
well-known formulas are recovered in the linear limit of this ansatz. In the
case of strongly nonlinear oscillations, however, the cross sections can be
larger than those for linear response by several orders of magnitude. The major
part of the incident sound energy is then converted into emitted sound, unlike
what happens in the linear case, where the absorption cross sections exceed the
scattering cross sections.
","[{""version"":""v1"",""created"":""Mon, 18 May 1998 23:42:01 GMT""},{""version"":""v2"",""created"":""Sat, 30 May 1998 22:48:46 GMT""}]","2009-10-31"
"cond-mat/9805218","Dimitre Andonov Dimitrov","D. A. Dimitrov and G. M. Wysin","Free vortex and vortex-pair lifetimes in classical two-dimensional
  easy-plane magnets","8 two-column pages, 3 figures. The file dad.tar.gz contains the Retex
  source, its PostScript version which also contains the figures, and the
  separate Postscript files for each figure",,"10.1088/0953-8984/10/33/014",,"cond-mat.stat-mech",,"  We report numerical simulation results for free-vortex lifetimes in the
critical region of classical two-dimensional easy-plane ferro- and
antiferromagnets having three-component order parameters. The fluctuations in
the vortex number density in a spin dynamics simulation were used to estimate
the lifetimes. The observed lifetimes are of the same order of magnitude but
smaller than the characteristic time-scale above which a phenomenological ideal
vortex-gas theory that has been used to account for the central peak in the
dynamic structure factor $S^{\alpha\alpha}({\bf q},\omega)$ is expected to be
valid. % For strong anisotropy, where the vortices are in-plane, the free
vortex lifetimes for ferromagnets and antiferromagnets are the same, while for
weak anisotropy, where the vortices have nonzero out-of-easy-plane components,
the lifetimes in antiferromagnets are smaller than in ferromagnets. The
dependence of the free-vortex and total vortex densities on the size dependent
correlation length in the critical region is examined. We also determined the
lifetimes of vortex-antivortex pairs for $T = T_{{\scriptsize KT}}$ and well
below $T_{{\scriptsize KT}}$. The observed time-scales are very short, and the
observed pair densities are extremely small. These results suggest that pair
creation and annihilation are unlikely to play any role in the central peak in
$S^{xx}({\bf q},\omega)$ observed in computer simulations for the ferromagnetic
model for $T \leq T_{{\scriptsize KT}}$.
","[{""version"":""v1"",""created"":""Tue, 19 May 1998 03:53:49 GMT""}]","2009-10-31"
"cond-mat/9805219","Andrei B. Sushkov","A. B. Sushkov and E. A. Tishchenko","Low-temperature far-infrared ellipsometry of convergent beam","14 pages, 6 figures","Int.J.Infrared and MM Waves 14 (1993) 2555","10.1007/BF02086222",,"cond-mat.mtrl-sci",,"  Development of an ellipsometry to the case of a coherent far infrared
irradiation, low temperatures and small samples is described, including a
decision of the direct and inverse problems of the convergent beam ellipsometry
for an arbitrary wavelength, measurement technique and a compensating
orientation of cryostat windows. Experimental results are presented: for a gold
film and UBe13 single crystal at room temperature (lambda=119 um), temperature
dependencies of the complex dielectric function of SrTiO3 (lambda=119, 84 and
28 um) and of YBa2Cu3O7-delta ceramic (lambda=119 um).
","[{""version"":""v1"",""created"":""Tue, 19 May 1998 08:06:03 GMT""}]","2015-06-25"
"cond-mat/9805220","Vincenzo Fiorentini","Alessio Filippetti (Davis), Vincenzo Fiorentini (Cagliari/Munich),
  Giancarlo Cappellini, and Andrea Bosin (Cagliari)","Anomalous relaxations and chemical trends at III-V nitride non-polar
  surfaces","RevTeX 7 pages, 8 figures included; also available at
  http://kalix.dsf.unica.it/preprints/; improved after review",,"10.1103/PhysRevB.59.8026",,"cond-mat.mtrl-sci",,"  Relaxations at nonpolar surfaces of III-V compounds result from a competition
between dehybridization and charge transfer. First principles calculations for
the (110) and (10$\bar{1}$0) faces of zincblende and wurtzite AlN, GaN and InN
reveal an anomalous behavior as compared with ordinary III-V semiconductors.
Additional calculations for GaAs and ZnO suggest close analogies with the
latter. We interpret our results in terms of the larger ionicity (charge
asymmetry) and bonding strength (cohesive energy) in the nitrides with respect
to other III-V compounds, both essentially due to the strong valence potential
and absence of $p$ core states in the lighter anion. The same interpretation
applies to Zn II-VI compounds.
","[{""version"":""v1"",""created"":""Tue, 19 May 1998 09:32:13 GMT""},{""version"":""v2"",""created"":""Tue, 11 Aug 1998 22:39:43 GMT""}]","2009-10-31"
"cond-mat/9805221","Adnan Rebei","A. Rebei and W.N.G. Hitchon","The Specific Heat of a Fermi Gas at Low Temperature: A closer look at
  the TlnT behavior","1 figure, 14 pages",,,"WISC-TH-98-348","cond-mat.str-el",,"  At finite temperature, a Fermi gas can have sates that hold simultaneously a
particle and a hole with a finite probability. This gives rise to a new set of
diagrams that are absent at zero temperature. The so called ""anomalous"" diagram
is just one of the new diagrams. We have already studied the contribution of
these new diagrams to the thermodynamic potential (Phys. Lett. A224, 127 (1996)
). Here we continue that work and calculate their effect on the specific heat.
We will also calculate the finite temperature contribution of the ring
diagrams. We conclude that the TlnT behavior due to exchange gets canceled by
the new contribution of the new diagrams and screening is not essential to
solve this anomaly.
","[{""version"":""v1"",""created"":""Tue, 19 May 1998 10:11:20 GMT""}]","2007-05-23"
"cond-mat/9805222","Alfred A. Manuel","Andreas Erb, Alfred A. Manuel, Marc Dhalle, Frank Marti, Jean-Yves
  Genoud, Bernard Revaz, Alain Junod, Dharmavaram Vasumathi, Shoji Ishibashi,
  Abhay Shukla, Eric Walker, Oystein Fischer, Rene Fluekiger, Riccardo Pozzi,
  Mihael Mali and Detlef Brinkmann","Experimental evidence for fast cluster formation of chain oxygen
  vacancies in YBa2Cu3O7-d being at the origin of the fishtail anomaly","10 pages, 4 figures, submitted to PRL",,"10.1016/S0038-1098(99)00347-6",,"cond-mat.supr-con",,"  We report on three different and complementary measurements, namely
magnetisation measurements, positron annihilation spectroscopy and NMR
measurements, which give evidence that the formation of oxygen vacancy clusters
is on the origin of the fishtail anomaly in YBa2Cu3O7-d. While in the case of
YBa2Cu3O7.0 the anomaly is intrinsically absent, it can be suppressed in the
optimally doped state where vacancies are present. We therefore conclude that
the single vacancies or point defects can not be responsible for this anomaly
but that clusters of oxygen vacancies are on its origin.
","[{""version"":""v1"",""created"":""Tue, 19 May 1998 11:33:02 GMT""}]","2009-10-31"
"cond-mat/9805223","Hans-Karl Janssen","H.K. Janssen (Heinrich-Heine-Universitaet, Duesseldorf, Germany)","Influence of Long-range Interactions on the Critical Behavior of Systems
  with negative Fisher-Exponent","3pages, 2 figures","Phys.Rev.E58:2673-2676,1998","10.1103/PhysRevE.58.2673",,"cond-mat.stat-mech",,"  The influence of long-range interactions decaying in d dimensions as
1/R^{d+\sigma} on the critical behavior of systems with Fisher's
correlation-function exponent for short-range interactions \eta_{SR}<0, is
re-examined. Such systems, typically described by \Phi ^{3}-field theories, are
e.g. the Potts-model in the percolation-limit, the Edwards-Anderson spin-glass,
and the Yang-Lee edge singularity. In contrast to preceding studies, it is
shown by means of Wilson's momentum-shell renormalization-group recursion
relations that the long-range interactions dominate as long as \sigma <2-\eta
_{SR}. Exponents change continuously to their short-range values at the
boundary of this region.
","[{""version"":""v1"",""created"":""Tue, 19 May 1998 11:58:27 GMT""}]","2011-08-17"
"cond-mat/9805224","Kenichiro Imura","Ken-ichiro Imura and Kazusumi Ino","Tunneling in Paired Fractional Quantum Hall States: Conductance and
  Andreev Reflection of Non-Abelions","4 pages, LATEX, to appear in Solid State Communications","Solid State Commun. 107, 497 (1998)","10.1016/S0038-1098(98)00241-5",,"cond-mat",,"  We study the edge transport properties of paired fractional quantum Hall
(FQH) states--- the Haldane-Rezayi (HR), Moore-Read (Pfaffian) and Halperin
(331) states. A table of exponents is given for the tunneling between the edges
of paired FQH states in gated 2D structures and the tunneling into the edge of
FQH states from a normal Fermi liquid (N). It is found that HR, Pfaffian and
331 states have different exponents for quasiparticle tunneling. For the
tunneling through a FQH-N junction, we propose unusual Andreev reflection
processes that may also probe the non-abelian FQH states.
","[{""version"":""v1"",""created"":""Tue, 19 May 1998 11:38:11 GMT""},{""version"":""v2"",""created"":""Thu, 21 May 1998 05:10:55 GMT""}]","2009-10-31"
"cond-mat/9805225","Alfred A. Manuel","Abhay Shukla, Bernardo Barbiellini, Andreas Erb, Alfred A. Manuel,
  Thomas Buslaps, Veijo Honkimaki and Pekka Suortti","Hole depletion and localization due to disorder in insulating
  PrBa2Cu3O7-d: a Compton scattering study","4 pages, 3 figures, revised version submitted to PRL",,"10.1103/PhysRevB.59.12127",,"cond-mat.supr-con",,"  The (mostly) insulating behaviour of PrBa2Cu3O7-d is still unexplained and
even more interesting since the occasional appearance of superconductivity in
this material. Since YBa2Cu3O7-d is nominally iso-structural and always
superconducting, we have measured the electron momentum density in these
materials. We find that they differ in a striking way, the wavefunction
coherence length in PrBa2Cu3O7-d being strongly suppressed. We conclude that Pr
on Ba-site substitution disorder is responsible for the metal-insulator
transition. Preliminary efforts at growth with a method to prevent disorder
yield 90K superconducting PrBa2Cu3O7-d crystallites.
","[{""version"":""v1"",""created"":""Tue, 19 May 1998 12:05:43 GMT""},{""version"":""v2"",""created"":""Tue, 6 Oct 1998 10:30:02 GMT""}]","2009-10-31"
"cond-mat/9805226","Patrick Bruno","Peter M. Levy (1), Sadamichi Maekawa (2), and Patrick Bruno (3) ((1)
  Department of Physics, New York University, (2) Institute for Materials
  Research, Sendai, Japan, (3) MPI fuer Mikrostrukturphysik, Halle, Germany)","Range dependence of interlayer exchange coupling","RevTeX, 6 pages, no figures","Phys. Rev. B 58, 5588-5593 (1998)","10.1103/PhysRevB.58.5588",,"cond-mat.mes-hall cond-mat.mtrl-sci",,"  We have considered the effects of non magnetic impurities and interface
roughness on the interlayer coupling between magnetic layers in metallic
multilayers. The two types of defects alter the interlayer coupling in quite
different ways. Elastic electron scattering by impurities in the non magnetic
spacer layers between magnetic layers produces an exponential decay of the
coupling with a characteristic decay length that is considerably longer than
the ``global'' transport mean free path for the spacer layer with its
surrounding interfaces. Interfacial roughness leads to an attenuation of the
coupling that is related to the width of the roughness in relation to the Fermi
wavelength; roughness does not alter the range dependence of the coupling. For
certain types of electrical transport, e.g., for current perpendicular to the
plane of the layers, the scattering from interface roughness and impurities in
the spacer layers contribute on an equal footing to the exponential decay of
the electron propagators, i.e., global mean free path. We show that interface
roughness and impurities in the spacer layer affect the interlayer coupling
differently.
","[{""version"":""v1"",""created"":""Tue, 19 May 1998 12:26:33 GMT""},{""version"":""v2"",""created"":""Tue, 1 Sep 1998 09:06:31 GMT""}]","2009-10-31"
"cond-mat/9805227","Marin Stoytchev","M. Stoytchev and A. Z. Genack","Measurement of the Probability Distribution of Total Transmission in
  Random Waveguides","5 pages, 5 post script figures, RevTex","Phys. Rev. Lett. 79, 309 (1997)","10.1103/PhysRevLett.79.309","ms-030597","cond-mat.dis-nn",,"  Measurements have been made of the probability distribution of total
transmission of microwave radiation in waveguides filled with randomly
positioned scatterers which would have values of the dimensionless conductance
g near unity. The distributions are markedly non-Gaussian and have exponential
tails. The measured distributions are accurately described by diagrammatic and
random matrix calculations carried out for nonabsorbing samples in the limit g
>> 1 when g is expressed in terms of the variance of the distribution, which
equals the degree of long-range intensity correlation across the output face of
the sample.
","[{""version"":""v1"",""created"":""Tue, 19 May 1998 13:36:37 GMT""}]","2009-10-31"
"cond-mat/9805229","Mona Berciu","Mona Berciu and Sajeev John","A numerical study of multi-soliton configurations in a doped
  antiferromagnetic Mott insulator","12 pages, 25 figures; added references, modified/eliminated some
  figures","Phys. Rev. B 59, 15143 (1999)","10.1103/PhysRevB.59.15143",,"cond-mat.supr-con cond-mat.str-el",,"  We evaluate from first principles the self-consistent Hartree-Fock energies
for multi-soliton configurations in a doped, spin-1/2, antiferromagnetic Mott
insulator on a two-dimensional square lattice. We find that nearest-neighbor
Coulomb repulsion stabilizes a regime of charged meron-antimeron vortex soliton
pairs over a region of doping from 0.05 to 0.4 holes per site for intermediate
coupling 3 < U/t <8. This stabilization is mediated through the generation of
``spin-flux'' in the mean-field antiferromagnetic (AFM) background. Holes
cloaked by a meron-vortex in the spin-flux AFM background are charged bosons.
Our static Hartree-Fock calculations provide an upper bound on the energy of a
finite density of charged vortices. This upper bound is lower than the energy
of the corresponding charged stripe configurations. A finite density of charge
carrying vortices is shown to produce a large number of unoccupied electronic
levels in the Mott-Hubbard charge transfer gap. These levels lead to
significant band tailing and a broad mid-infrared band in the optical
absorption spectrum as observed experimentally. At very low doping (below 0.05)
the doping charges create extremely tightly bound meron-antimeron pairs or even
isolated conventional spin-polarons, whereas for very high doping (above 0.4)
the spin background itself becomes unstable to formation of a conventional
Fermi liquid and the spin-flux mean-field is energetically unfavorable. Our
results point to the predominance of a quantum liquid of charged, bosonic,
vortex solitons at intermediate coupling and intermediate doping
concentrations.
","[{""version"":""v1"",""created"":""Tue, 19 May 1998 14:35:47 GMT""},{""version"":""v2"",""created"":""Wed, 17 Mar 1999 20:35:48 GMT""}]","2009-10-31"
"cond-mat/9805230","Peter Thalmeier","P.Thalmeier (Max-Planck-Institut fuer Chemische Physik fester Stoffe,
  Dresden), P.Fulde (Max-Planck-Institut fuer Physik komplexer Systeme,
  Dresden)","Charge ordering and spin- Peierls transition in alpha'-NaV2O5","10 pages, 2 figures, accepted for publication in Europhysics Letters",,"10.1209/epl/i1998-00463-3","mpi-pks/9805001","cond-mat.str-el",,"  Recent X-ray analysis and NMR- experiments have shown that alpha'- NaV2O5 is
not a conventional spin-Peierls (SP) compound because above the transition at
33K it is in a homogeneous mixed valent (MV) state and atomic spin chains do
not exist. Furthermore, thermal expansion experiments have identified the
existence of a double phase transition. We present a theoretical model which
qualitatively explains these observations. We derive an effective Hamiltonian
for the insulating state which describes the transitions as primary charge
order leading to linear spin chains in b- direction and a secondary SP-
transition. We show that this scenario explains in a natural way the anomalous
BCS-ratio observed in alpha'- NaV2O5.
","[{""version"":""v1"",""created"":""Tue, 19 May 1998 14:42:52 GMT""},{""version"":""v2"",""created"":""Wed, 19 Aug 1998 07:34:32 GMT""}]","2009-10-31"
"cond-mat/9805231","Pratap Raychaudhuri","P. Raychaudhuri, P. Taneja, S. Sarkar, A. K. Nigam, P. Ayyub, R. Pinto","Magnetic field dependent variable range hopping behaviour in resistivity
  at low temperatures in polycrystalline colossal magnetoresistive manganites:
  evidence of spin polarised tunnelling","8 pages, postscipt(figures embedded)",,,"TFR-98-11119","cond-mat.str-el",,"  It has been observed that the low temperature magnetoresistance behaviour in
polycrystalline colossal magnetoresistive (CMR) manganites differ significantly
from the single crystals. The polycrystalline samples show large
magnetoresistance at temperatures much below the ferromagnetic transition
temperature where the magnetoresistance of single crystals is very small. This
has conventionally been attributed to spin polarised tunnelling at the grain
boundaries in polycrystalline samples. In this paper we show the existence of a
variable range hopping behaviour in resistivity at low temperatures in
polycrystalline CMR samples. This behaviour gets gradually suppressed under the
application of magnetic field. We discuss the significance of these results
with respect to spin polarised tunnelling.
","[{""version"":""v1"",""created"":""Tue, 19 May 1998 14:43:38 GMT""}]","2007-05-23"
"cond-mat/9805232","dr. C. J. M. Schoutens","P. Bouwknegt (Adelaide) and K. Schoutens (Amsterdam)","Non-abelian Electrons","4 pages, 2 figures, LaTeX (uses revtex)",,,"ADL-98-12/M64, ITFA-98-10","cond-mat.str-el",,"  We analyze critical and massive SO(5) superspin regimes for correlated
electrons on a two-chain ladder. We identify fundamental low energy
excitations, which carry the quantum numbers of a free electron, and can be
probed in (inverse) photo-emission experiments. These excitations do not obey
the usual Pauli Principle, but are governed by specific forms of so-called
non-abelian exclusion statistics.
","[{""version"":""v1"",""created"":""Tue, 19 May 1998 15:30:41 GMT""}]","2007-05-23"
