"hep-ph/9805375","F. . Krauss","I. F. Ginzburg, U. D. Jentschura, S. G. Karshenboim, F. Krauss, V. G.
  Serbo, G. Soff","Production of bound {$\mu^{+}\mu^{-}$}-systems in relativistic heavy ion
  collisions","20 pages, RevTex, 7 figures","Phys.Rev.C58:3565-3573,1998","10.1103/PhysRevC.58.3565",,"hep-ph",,"  Dimuonium (the bound system of two muons, $\mu^+\mu^-$-atom) has not been
observed yet. In this paper we discuss the electromagnetic production of
dimuonium at RHIC and LHC in relativistic heavy ion collisions. The production
of parastates is analyzed in the equivalent photon approximation. For the
treatment of orthostates, we develop a three photon formalism. We determine the
production rates at RHIC and LHC with an accuracy of a few percent and discuss
problems related to the observation of dimuonium.
","[{""version"":""v1"",""created"":""Tue, 19 May 1998 13:51:58 GMT""}]","2008-11-26"
"hep-ph/9805376",,"Shuquan Nie and Marc Sher","The Anomalous Magnetic Moment of the Muon and Higgs-Mediated Flavor
  Changing Neutral Currents","7 pages Latex, 2 figures","Phys.Rev. D58 (1998) 097701","10.1103/PhysRevD.58.097701","WM-98-107","hep-ph",,"  In the two-Higgs doublet extension of the standard model, flavor-changing
neutral couplings arise naturally. In the lepton sector, the largest such
coupling is expected to be $\mu-\tau-\phi#. We consider the effects of this
coupling on the anomalous magnetic moment of the muon. The resulting bound on
the coupling, unlike previous bounds, is independent of the value of other
unknown couplings. It will be significantly improved by the upcoming E821
experiment at Brookhaven National Lab.
","[{""version"":""v1"",""created"":""Tue, 19 May 1998 15:31:45 GMT""}]","2009-10-31"
"hep-ph/9805377","Zygmunt Lalak","John Ellis, Zygmunt Lalak, Stefan Pokorski, Witold Pokorski","Five-Dimensional Aspects of M-Theory Dynamics and Supersymmetry Breaking","35 pages, Latex, 9 figures, discussion of the extension of the
  results to the gauged supergravity model has been added at the end of section
  5","Nucl.Phys.B540:149-186,1999","10.1016/S0550-3213(98)00749-4","CERN-TH/98-118, OUTP-98-37-P","hep-ph hep-th",,"  We discuss the reduction of the eleven-dimensional M-theory effective
Lagrangian, considering first compactification from eleven to five dimensions
on a Calabi-Yau manifold, followed by reduction to four dimensions on an
S_1/Z_2 line segment at a larger distance scale. The Calabi-Yau geometry leads
to a structure of the five-dimensional Lagrangian that has more freedom than
the eleven-dimensional theory. In five dimensions one obtains a non-linear
sigma-model coupled to gravity, which implies non-trivial dynamics for the
scalar moduli fields in the bulk of the Z_2 orbifold. We discuss solutions to
the five-dimensional equations of motion in the presence of sources localized
on the boundaries of the Z_2 orbifold that may trigger supersymmetry breaking,
e.g., gaugino condensates. The transmission of supersymmetry breaking from the
hidden wall to the visible wall is demonstrated in specific models. The role of
the messenger of supersymmetry breaking may be played by the gravity
supermultiplet and/or by scalar hypermultiplets. The latter include the
universal hypermultiplet associated with the Calabi-Yau volume, and also the
hypermultiplets associated with deformations of its complex structure, which
mix in general.
","[{""version"":""v1"",""created"":""Tue, 19 May 1998 15:06:19 GMT""},{""version"":""v2"",""created"":""Mon, 8 Jun 1998 13:54:59 GMT""},{""version"":""v3"",""created"":""Fri, 30 Oct 1998 22:13:50 GMT""}]","2009-09-11"
"hep-th/9805097","Finn Larsen","Mirjam Cvetic and Finn Larsen","Near Horizon Geometry of Rotating Black Holes in Five Dimensions","18 pages, latex","Nucl.Phys.B531:239-255,1998","10.1016/S0550-3213(98)00604-X","UPR/803-T","hep-th",,"  We interpret the general rotating black holes in five dimensions as rotating
black strings in six dimensions. In the near horizon limit the geometry is
locally AdS_3 x S_3, as in the nonrotating case. However, the global structure
couples the AdS_3 and the S_3, giving angular velocity to the S_3. The
asymptotic geometry is exploited to count the microstates and recover the
precise value of the Bekenstein- Hawking entropy, with rotation taken properly
into account. We discuss the perturbation spectrum of the rotating black hole,
and its relation to the underlying conformal field theory.
","[{""version"":""v1"",""created"":""Mon, 18 May 1998 23:35:50 GMT""}]","2009-09-17"
"hep-th/9805099","Karim Benakli","Karim Benakli","Heterotic String Theory on Anti-de-Sitter Spaces","6 pages, latex",,,,"hep-th",,"  We suggest that compactifications on Anti-de-Sitter (AdS) spaces of type IIA,
IIB, heterotic strings and eleven dimensional vacuua of M-theory are related by
a combination of $T$ and strong/weak dualities. Maldacena conjecture relates
then all these vacuua to a conformal theory on the boundaries. Furthermore
acting with discrete groups on part of the internal spaces of these theories
will lead to further dual theories with less or no supersymmetry.
","[{""version"":""v1"",""created"":""Mon, 18 May 1998 23:54:24 GMT""}]","2007-05-23"
"hep-th/9805102","Pushan Majumdar","Pushan Majumdar, H.S.Sharatchandra","Duality transformation for 3+1 dimensional Yang-Mills theory","13 pages, revtex. Change in several sections in the wake of some new
  results. Major conclusions unchanged","Int.J.Mod.Phys. A17 (2002) 175-186","10.1142/S0217751X02005785","imsc/98/05/22","hep-th",,"  Dual form of 3+1 dimensional Yang-Mills theory is obtained as another SO(3)
gauge theory. Duality transformation is realized as a canonical transformation.
The The non-abelian Gauss law implies the corresponding Gauss law for the dual
theory. The dual theory is non-local. There is a non-local version of
Yang-Mills theory which is self dual.
","[{""version"":""v1"",""created"":""Mon, 18 May 1998 19:07:33 GMT""},{""version"":""v2"",""created"":""Sun, 23 Jul 2000 19:23:42 GMT""}]","2009-10-31"
"hep-th/9805104","Joseph A. Minahan","J. A. Minahan and N. P. Warner","Quark Potentials in the Higgs Phase of Large N Supersymmetric Yang-Mills
  Theories","23 pages, 7 figures, harvmac (b)","JHEP 9806:005,1998","10.1088/1126-6708/1998/06/005","USC-98/006","hep-th",,"  We compute, in the large N limit, the quark potential for ${\cal N}=4$
supersymmetric SU(N) Yang-Mills theory broken to $SU(N_1) \times SU(N_2)$. At
short distances the quarks see only the unbroken gauge symmetry and have an
attractive potential that falls off as 1/L. At longer distances the interquark
interaction is sensitive to the symmetry breaking, and other QCD states appear.
These states correspond to combinations of the quark-antiquark pair with some
number of W-particles. If there is one or more W-particles then this state is
unstable because of the coulomb interaction between the W-particles and between
the W's and the quarks. As L is decreased the W-particles delocalize and these
coulomb branches merge onto a branch with a linear potential. The quarks on
this branch see the unbroken gauge group, but the flux tube is unstable to the
production of W-particles.
","[{""version"":""v1"",""created"":""Mon, 18 May 1998 21:36:32 GMT""}]","2010-02-03"
"hep-th/9805111","George Kraniotis","D. Bailin, G.V. Kraniotis and A. Love","CP-violating phases in the CKM matrix in orbifold compactifications","LaTeX file 17 pages","Phys.Lett.B435:323-330,1998","10.1016/S0370-2693(98)00804-1","SUSX-TH-98-006","hep-th hep-ph",,"  The picture of CP-violation in orbifold compactifications in which the
$T$-modulus is at a complex fixed point of the modular group is studied.
CP-violation in the neutral kaon system and in the neutron electric dipole
moment are both discussed. The situation where the $T$-modulus takes complex
values on the unit circle which are not at a fixed point is also discussed.
","[{""version"":""v1"",""created"":""Mon, 18 May 1998 16:45:54 GMT""}]","2010-11-19"
"hep-th/9805112","Edward Witten","Edward Witten","Baryons And Branes In Anti de Sitter Space","44 pp, 9 figures","JHEP 9807:006,1998","10.1088/1126-6708/1998/07/006",,"hep-th",,"  In the mapping from four-dimensional gauge theories to string theory in $AdS$
space, many features of gauge theory can be described by branes wrapped in
different ways on $\S^5$, $\RP^5$, or subspaces thereof. These include a baryon
vertex coupling N external charges in the fundamental representation of SU(N),
a bound state of $k$ gluons in SO(2k) gauge theory, strings coupled to external
charges in the spinor representation of the gauge group, and domain walls
across which the low energy gauge group changes.
","[{""version"":""v1"",""created"":""Mon, 18 May 1998 17:57:24 GMT""}]","2010-04-07"
"hep-th/9805113","Michael Grebeniuk","M. A. Grebeniuk and V. D. Ivashchuk","Sigma-model Solutions and Intersecting p-Branes Related to Lie Algebras","13 pages, LaTeX, submitted to Phys. Lett. B","Phys.Lett. B442 (1998) 125-135","10.1016/S0370-2693(98)01215-5",,"hep-th",,"  A family of Majumdar-Papapetrou type solutions in sigma-model of p-brane
origin is obtained for all direct sums of finite-dimensional simple Lie
algebras. Several examples of p-brane dyonic configurations in D=10 (IIA) and
D=11 supergravities corresponding to the Lie algebra sl(3,C) are considered.
","[{""version"":""v1"",""created"":""Mon, 18 May 1998 20:07:42 GMT""},{""version"":""v2"",""created"":""Tue, 8 Sep 1998 20:59:32 GMT""}]","2009-10-31"
"hep-th/9805114","Leonard Susskind","L. Susskind and Edward Witten","The Holographic Bound in Anti-de Sitter Space","10 pages, phyzzx",,,,"hep-th",,"  The correspondence between string theory in Anti-de Sitter space and super
Yang Mills theory is an example of the Holographic principle according to which
a quantum theory with gravity must be describable by a boundary theory.
However, arguments given so far are incomplete because, while the bulk theory
has been related to a boundary theory, the holographic bound saying that the
boundary theory has only one bit of information per Planck area has not been
justified. We show here that this bound is the physical interpretation of one
of the unusual aspects of the correspondence between Anti-de Sitter space and
the boundary conformal field theory, which is that infrared effects in the bulk
theory are reflected as ultraviolet effects in the boundary theory.
","[{""version"":""v1"",""created"":""Tue, 19 May 1998 03:02:45 GMT""}]","2007-05-23"
"hep-th/9805115","Leonard Susskind","L. Susskind","Matrix Theory Black Holes and the Gross Witten Transition","8 pages, phyzzx",,,,"hep-th",,"  Large N gauge theories have so called Gross-Witten phase transitions which
typically can occur in finite volume systems. In this paper we relate these
transitions in supersymmetric gauge theories to transitions that take place
between black hole solutions in general relativity. The correspondence between
gauge theory and gravitation is through matrix theory which represents the
gravitational system in terms of super Yang Mills theories on finite tori. We
also discuss a related transition that was found by Banks, Fischler, Klebanov
and Susskind.
","[{""version"":""v1"",""created"":""Tue, 19 May 1998 03:22:36 GMT""}]","2007-05-23"
"hep-th/9805116","Mihai Visinescu","Diana Vaman and Mihai Visinescu","Supersymmetries and constants of motion in Taub-NUT spinning space","33 pages, LaTeX2e, to appear in Fortschritte der Physik","Fortsch.Phys. 47 (1999) 493-514","10.1002/(SICI)1521-3978(199906)47:5<493::AID-PROP493>3.0.CO;2-M","IFA-FT-434-1998","hep-th gr-qc",,"  We review the geodesic motion of pseudo-classical spinning particles in
curved spaces. Investigating the generalized Killing equations for spinning
spaces, we express the constants of motion in terms of Killing-Yano tensors.
The general results are applied to the case of the four-dimensional Euclidean
Taub-NUT spinning space. A simple exact solution, corresponding to trajectories
lying on a cone, is given.
","[{""version"":""v1"",""created"":""Tue, 19 May 1998 06:50:22 GMT""}]","2015-06-26"
"hep-th/9805117","Gabor Takacs","G. Feverati, F. Ravanini and G. Takacs","Nonlinear Integral Equation and Finite Volume Spectrum of Sine-Gordon
  Theory","LaTeX2e, 49 pages, 14 eps figures. Presentation shortened and
  improved, some typos corrected","Nucl.Phys. B540 (1999) 543-586","10.1016/S0550-3213(98)00747-0","DFUB-98-10","hep-th",,"  We examine the connection between the nonlinear integral equation (NLIE)
derived from light-cone lattice and sine-Gordon quantum field theory,
considered as a perturbed c=1 conformal field theory. After clarifying some
delicate points of the NLIE deduction from the lattice, we compare both
analytic and numerical predictions of the NLIE to previously known results in
sine-Gordon theory. To provide the basis for the numerical comparison we use
data from Truncated Conformal Space method. Together with results from analysis
of infrared and ultraviolet asymptotics, we find evidence that it is necessary
to change the rule of quantization proposed by Destri and de Vega to a new one
which includes as a special case that of Fioravanti et al. This way we find
strong evidence for the validity of the NLIE as a description of the finite
size effects of sine-Gordon theory.
","[{""version"":""v1"",""created"":""Tue, 19 May 1998 12:03:48 GMT""},{""version"":""v2"",""created"":""Fri, 22 May 1998 12:27:30 GMT""},{""version"":""v3"",""created"":""Mon, 22 Jun 1998 13:53:52 GMT""},{""version"":""v4"",""created"":""Fri, 14 Aug 1998 11:32:33 GMT""}]","2009-10-31"
"hep-th/9805119","Tomohiko Takahashi","Tsuguhiko Asakawa, Taichiro Kugo and Tomohiko Takahashi","On the Generalized Gluing and Resmoothing Theorem","19 pages, LaTeX with PTPTeX.sty, 3 eps figures","Prog.Theor.Phys. 100 (1998) 437-454","10.1143/PTP.100.437","KUNS-1509 HE(TH) 98/7, UT-813","hep-th",,"  The generalized gluing and resmoothing theorem originally proved by LeClair,
Peskin and Preitschopf, gives a powerful formula for the fused vertex obtained
by contracting any two vertices in string field theories. Although the theorem
is naturally expected to hold for the vertices at any loop level, the original
proof was restricted to the vertices at tree level. Here we present a
simplified proof for the tree level theorem and then prove explicitly the
extended version at one-loop level. We also find that a non-trivial sign
factor, which depends on the string states to be contracted, appears in the
theorem. This sign factor turns out to be essential for reproducing correctly
the conformal field theory correlation function on the torus.
","[{""version"":""v1"",""created"":""Tue, 19 May 1998 11:25:54 GMT""}]","2009-10-31"
"hep-th/9805120","Dr N. Mavromatos","John Ellis, N.E. Mavromatos and D.V. Nanopoulos","A Microscopic Liouville Arrow of Time","24 pages LATEX, two figures incorporated. Invited Review for the
  ``Journal of Chaos, Solitons and Fractals'', Special Issue on:
  ``Superstrings, M, F, S, ... theory'', eds. C. Castro and M. S. El Naschie","Chaos Solitons Fractals 10:345-363,1999","10.1016/S0960-0779(98)00152-0","ACT-6/98, CTP-TAMU-21/98, OUTP-98-38P","hep-th gr-qc",,"  We discuss the treatment of quantum-gravitational fluctuations in the
space-time background as an `environment', using the formalism for open
quantum-mechanical systems, which leads to a microscopic arrow of time. After
reviewing briefly the open-system formalism, and the motivations for treating
quantum gravity as an `environment', we present an example from general
relativity and a general framework based on non-critical strings, with a
Liouville field that we identify with time. We illustrate this approach with
calculations in the contexts of two-dimensional models and $D$ branes. Finally,
some prospects for observational tests of these ideas are mentioned.
","[{""version"":""v1"",""created"":""Tue, 19 May 1998 14:14:07 GMT""}]","2009-09-11"
"math-ph/9805016","Miguel A. Martin","Oscar Arratia, Miguel A. Martin, Mariano A. Olmo","Deformation in Phase Space","29 pages, LaTex 2.09",,,,"math-ph math.MP",,"  We review several procedures of quantization formulated in the framework of
(classical) phase space M. These quantization methods consider Quantum
Mechanics as a ""deformation"" of Classical Mechanics by means of the
""transformation"" of the commutative algebra of smooth functions on M in a new
non-commutative algebra. These ideas lead in a natural way to Quantum Groups as
deformation (or quantization, in a broad sense) of Poisson-Lie groups, which is
also analysed here.
","[{""version"":""v1"",""created"":""Mon, 18 May 1998 19:28:28 GMT""}]","2007-05-23"
"math-ph/9805017","Valeri Dvoeglazov","Valeri V. Dvoeglazov (EFUAZ)","The Bargmann-Wigner Formalism for Spin 2","ReVTeX file, 6pp","Adv. Appl. Clifford Algebras v. 10 , No. 1 (2000) pp. 7-14",,"EFUAZ FT-98-55-REV","math-ph gr-qc hep-ph hep-th math.MP quant-ph",,"  We proceed to derive equations for the symmetric tensor of the second rank on
the basis of the Bargmann-Wigner formalism in a straightforward way. The
symmetric multispinor of the fourth rank is used. It is constructed out of the
Dirac 4-spinors. Due to serious problems with the interpretation of the results
obtained on using the standard procedure we generalize it and obtain the spin-2
relativistic equations, which are consistent with the previous one. The
importance of the 4-vector field (and its gauge part) is pointed out.
","[{""version"":""v1"",""created"":""Mon, 18 May 1998 23:36:16 GMT""}]","2007-05-23"
"math/9805079","Sergey Fomin","Francesco Brenti, Sergey Fomin, and Alexander Postnikov","Mixed Bruhat operators and Yang-Baxter equations for Weyl groups","19 pages",,,,"math.QA math.AG math.CO math.RT",,"  We introduce and study a family of operators which act in the span of a Weyl
group $W$ and provide a multi-parameter solution to the quantum Yang-Baxter
equations of the corresponding type. Our operators generalize the ""quantum
Bruhat operators"" that appear in the explicit description of the multiplicative
structure of the (small) quantum cohomology ring of $G/B$.
  The main combinatorial applications concern the ""tilted Bruhat order,"" a
graded poset whose unique minimal element is an arbitrarily chosen element
$w\in W$. (The ordinary Bruhat order corresponds to the case $w=1$.) Using the
mixed Bruhat operators, we prove that these posets are lexicographically
shellable, and every interval in a tilted Bruhat order is Eulerian. This
generalizes well known results of Verma, Bjorner, Wachs, and Dyer.
","[{""version"":""v1"",""created"":""Mon, 18 May 1998 20:13:59 GMT""}]","2007-05-23"
"math/9805080","Stony Brook IMS Preprint Series","Eric Bedford and Mattias Jonsson","Regular Polynomial Endomorphisms of C^k","54 pages. PostScript figures",,,"Stony Brook IMS 1998/3","math.DS math.CV",,"  We study the dynamics of polynomial mappings f:C^k to C^k of degree at least
2 that extend continuously to projective space P^k. Our approach is to study
the dynamics near the hyperplane at infinity and then making a descent to K ---
the set of points with bounded orbits --- via external rays.
","[{""version"":""v1"",""created"":""Mon, 18 May 1998 20:30:04 GMT""}]","2007-05-23"
"math/9805081","Dale E. Alspach","Dale Alspach","The dual of the Bourgain-Delbaen space","20 pages, LaTeX2e, Missing omegas in the statement and proof of
  Corollary 3.11 inserted","Israel J. Math 117 (2000), 239-259",,,"math.FA math.LO",,"  It is shown that a script L_infty-space with separable dual constructed by
Bourgain and Delbaen has small Szlenk index and thus does not have a quotient
isomorphic to C(omega^omega). It follows that this is a script L_infty-space
which is the same size as c_0 in the sense of the Szlenk index but does not
contain c_0. This has some consequences in the theory of uniform homeomorphism
of Banach spaces.
","[{""version"":""v1"",""created"":""Mon, 18 May 1998 20:35:16 GMT""},{""version"":""v2"",""created"":""Mon, 25 Jan 1999 14:56:12 GMT""},{""version"":""v3"",""created"":""Fri, 26 Sep 2003 20:33:56 GMT""}]","2007-05-23"
"math/9805082","Wolf Barth","W. Barth","On the Classification of K3-Surfaces with Nine Cusps",,,,,"math.AG",,"  By a K3-surface with nine cusps I mean a compact complex surface with nine
isolated double points $A_2$, but otherwise smooth, such that its minimal
desingularisation is a K3-surface. In an earlier paper I showd that each such
surface is a quotient of a complex torus by a cyclic group of order three. Here
I try to classify these $K3$-surfaces, using the period map for complex tori.
In particular I show:
  A $K3$-surface with nine cusps carries polarizations only of degrees 0 or 2
modulo 6. This implies in particular that there is no quartic surface in
projective three-space with nine cusps. (T. Urabe pointed out to me how to
deduce this from a theorem of Nikulin.)
  In an appendix I give explicit equations of quartic surfaces in three-space
with eight cusps.
","[{""version"":""v1"",""created"":""Tue, 19 May 1998 14:16:42 GMT""}]","2007-05-23"
"math/9805083","Allan P. Donsig","Allan P. Donsig, Tim D. Hudson, and Elias G. Katsoulis","Algebraic Isomorphism of Limit Algebras","13 pages",,,,"math.OA math.FA",,"  We prove that algebraic isomorphisms between limit algebras are automatically
continuous, and consider consequences of this result. In particular, we give
partial solutions to a conjecture of Power [Limit Algebras, Longman, 1992,
Notes to Chapter 8] and to an open problem [op. cit., Problem 7.8]. As a
further consequence, we describe epimorphisms between various classes of limit
algebras.
","[{""version"":""v1"",""created"":""Tue, 19 May 1998 15:44:27 GMT""},{""version"":""v2"",""created"":""Mon, 19 Oct 1998 22:26:27 GMT""}]","2007-05-23"
"nucl-th/9805030","Sergey","S. B. Dubovichenko","Deep Potentials of the NN Interactions with Forbidden States","18 pages, 18 references, 1 table, 8 figures",,,"KSNU-16-98","nucl-th",,"  The three variant of the potentials with tensor part and ioao containing
unobservable forbidden states and having one fitted parameter are considered.
Parameter of such potentials is fixed only on the base low energy NN
characteristics and deuteron binding energies. The NN characteristics at high
energies, deuteron properties and formfactors up to 6 Fm-1 is appear in the
good consent with experimental data.
","[{""version"":""v1"",""created"":""Tue, 19 May 1998 06:01:30 GMT""}]","2009-09-25"
"nucl-th/9805031",,"A. Misra (1), D.S.Koltun (2) ((1) Indian Institute of Technology,
  Kanpur, India, (2) University of Rochester, Rochester, USA)","Derivation of the Effective Pion-Nucleon Lagrangian within Heavy Baryon
  Chiral Perturbation Theory","31 pages, LaTex; original version shortened; 2 new tables and new
  material on extending on-shell reduction method within HBChPT to arbitrary
  chiral orders, included","Nucl.Phys. A646 (1999) 343-363","10.1016/S0375-9474(98)00625-3",,"nucl-th hep-ph",,"  We develop a method for constructing the Heavy Baryon Chiral Perturbation
Theory Lagrangian (L_{HBChPT}), to a given chiral order, within HBChPT. We work
within SU(2) theory, with only the pion field interacting with the nucleon. The
main difficulties, which are solved, are to develop techniques for implementing
charge conjugation invariance, and for taking the nucleon on shell, both within
the nonrelativistic formalism. We obtain complete lists of independent terms in
L_{HBChPT} through O(q^3) for off- shell nucleons. Then, eliminating
equation-of-motion (eom) terms at the relativistic and nonrelativistic level
(both within HBChPT), we obtain L_{HBCHPT} for on-shell nucleons, through
O(q^3). The extension of the method (to obtain on-shell L_{HBChPT} within
HBChPT) to higher orders is also discussed.
","[{""version"":""v1"",""created"":""Tue, 19 May 1998 06:34:13 GMT""},{""version"":""v2"",""created"":""Tue, 24 Nov 1998 10:57:40 GMT""}]","2009-10-31"
"nucl-th/9805032","Isaac Vidanya","I. Vida\~na, A. Polls, A. Ramos and M. Hjorth-Jensen","Hyperon properties in finite nuclei using realistic $YN$ interactions","31 pages, LateX, includes 4 PostScript figures, (submitted to Nucl.
  Phys. A)","Nucl.Phys. A644 (1998) 201-220","10.1016/S0375-9474(98)00599-5",,"nucl-th",,"  Single-particle energies of the $\Lambda$ and $\Sigma$ hyperons are obtained
from the relevant self-energies. The latter are constructed within the
framework of a perturbative many-body approach employing present realistic
hyperon-nucleon interactions such as the models of the Juelich and Nijmegen
groups. The effects of the non-locality and energy dependence of the
self-energy on the bound states are investi- gated. It is also shown that,
although the single-particle hyperon energies are well reproduced by local
Woods-Saxon hyperon-nucleus potentials, the wave functions from the non-local
self-energy are far more extended. Implications of this behavior on the mesonic
weak decay of $\Lambda$ hypernuclei are discused.
","[{""version"":""v1"",""created"":""Tue, 19 May 1998 12:25:39 GMT""}]","2009-10-31"
