"cond-mat/9805406","Michael Koltonyuk","M. Koltonyuk, D. Berman, N. B. Zhitenev, R. C. Ashoori, N. Pfeiffer
  and K. W. West","Single electron capacitance spectroscopy of vertical quantum dots using
  a single electron transistor","Submitted to Applied Physics Letters (reformatted to fit correctly on
  a page)",,"10.1063/1.123143",,"cond-mat.mes-hall",,"  We have incorporated an aluminum single electron transistor (SET) directly on
top of a vertical quantum dot, enabling the use of the SET as an electrometer
that is extremely responsive to the motion of charge into and out of the dot.
Charge induced on the SET central island from single electron additions to the
dot modulates the SET output, and we describe two methods for demodulation that
permit quantitative extraction of the quantum dot capacitance signal. The two
methods produce closely similar results for the determined single electron
capacitance peaks.
","[{""version"":""v1"",""created"":""Fri, 29 May 1998 23:21:33 GMT""},{""version"":""v2"",""created"":""Fri, 12 Jun 1998 05:59:39 GMT""}]","2009-10-31"
"gr-qc/9805103","Helio V. Fagundes","Helio V. Fagundes","Addendum to Paper ""Closed Spaces in Cosmology""","3 pages, no figure",,,,"gr-qc astro-ph hep-th",,"  A few corrections and comments are made upon a previously published paper by
the author (Gen. Rel. Gravit. 24, 199 (1992)), on the subject of cosmological
models with compact spatial sections.
","[{""version"":""v1"",""created"":""Fri, 29 May 1998 16:22:54 GMT""},{""version"":""v2"",""created"":""Sun, 31 May 1998 15:40:00 GMT""}]","2007-05-23"
"gr-qc/9805104","Vladimir Dzhunushaliev","V. Dzhunushaliev and D. Singleton","Flux Tube Solution in 5D Kaluza-Klein Theory","8 pages, revtex, Title changed, references added and discussion of 7D
  solution given. To be published in CQG","Class.Quant.Grav. 16 (1999) 973","10.1088/0264-9381/16/3/024",,"gr-qc hep-th",,"  Spherically symmetric, vacuum solutions in 5D and 7D Kaluza-Klein theory are
obtained. These solutions are flux tubes with constant cross-sectional size,
located between (+) and (-) Kaluza-Klein's ``electrical'' and ``magnetic''
charges disposed respectively at $\pm\infty$ and filled by constant
Kaluza-Klein ``electrical'' and ``magnetic'' fields. These objects are
surprisingly similar to the flux tubes which forms between two monopoles in
Type-II superconductors and also the hypothesized color field flux tube that is
thought to form between two quarks in the QCD vacuum.
","[{""version"":""v1"",""created"":""Fri, 29 May 1998 17:35:57 GMT""},{""version"":""v2"",""created"":""Tue, 9 Feb 1999 17:37:45 GMT""}]","2009-10-31"
"gr-qc/9806001","Dmitri Vassilevich","S.Yu. Alexandrov, D.V. Vassilevich","Path integral for the Hilbert-Palatini and Ashtekar gravity","Revtex, 16 pages","Phys.Rev. D58 (1998) 124029","10.1103/PhysRevD.58.124029","SPb-IP-98","gr-qc",,"  To write down a path integral for the Ashtekar gravity one must solve three
fundamental problems. First, one must understand rules of complex contour
functional integration with holomorphic action. Second, one should find which
gauges are compatible with reality conditions. Third, one should evaluate the
Faddeev-Popov determinant produced by these conditions. In the present paper we
derive the BRST path integral for the Hilbert-Palatini gravity. We show, that
for certain class of gauge conditions this path integral can be re-written in
terms of the Ashtekar variables. Reality conditions define contours of
integration. For our class of gauges all ghost terms coincide with what one
could write naively just ignoring any Jacobian factors arising from the reality
conditions.
","[{""version"":""v1"",""created"":""Sat, 30 May 1998 11:28:56 GMT""}]","2016-08-31"
"gr-qc/9806002","Peter Breitenlohner","Peter Breitenlohner and Dieter Maison","On Nonlinear $\sigma$-Models arizing in (Super-)Gravity","33 pages, 1 table","Commun.Math.Phys. 209 (2000) 785-810","10.1007/s002200050038","MPI-PhT 98-42","gr-qc",,"  In a previous paper with Gibbons [CMP 120 (1987) 295] we derived a list of
three dimensional symmetric space $\sigma$-model obtained by dimensional
reduction of a class of four dimensional gravity theories with abelian gauge
fields and scalars. Here we give a detailed analysis of their group theoretical
structure leading to an abstract parametrization in terms of `triangular' group
elements. This allows for a uniform treatment of all these models. As an
interesting application we give a simple derivation of a `Quadratic Mass
Formula' for strictly stationary black holes.
","[{""version"":""v1"",""created"":""Sat, 30 May 1998 13:33:12 GMT""}]","2009-10-31"
"hep-ex/9805035","Steven Blusk","Steven R. Blusk (for the CDF and D0 Collaborations)","Measurement of the Top Quark Mass","To be published in the 33rd proceedings of the Recontres de Moriond,
  Les Arcs, France, March 21-28, 1998. 6 pages, 3 figures",,,"Fermilab-Conf-98-151-E","hep-ex",,"  In this paper, we report on the most recent measurements of the top quark
mass, performed by the CDF and D0 collaborations at the Fermilab Tevatron. The
CDF collaboration has performed measurements of the top quark mass in three
decay channels from which the top quark mass is measured to be 175.6 +- 6.8
GeV/c^2. The D0 collaboration combines measurements from two decay channels to
obtain a top quark mass of 172.1 +- 7.1 GeV/c^2. Combining the measurements
from the two experiments, assuming a 2 GeV/c^2 correlated systematic
uncertainty, the measurement of the top quark mass at the Tevatron is 173.9 +-
5.2 GeV/c^2. This report presents the measurements of the top quark mass from
each of the decay channels which contribute to this measurement.
","[{""version"":""v1"",""created"":""Fri, 29 May 1998 21:02:50 GMT""},{""version"":""v2"",""created"":""Fri, 5 Jun 1998 22:56:49 GMT""},{""version"":""v3"",""created"":""Tue, 23 Jun 1998 20:57:13 GMT""}]","2019-08-14"
"hep-lat/9805032","Maarten F. L. Golterman","Maarten F.L. Golterman and Ka Chun Leung","On Lattice Computations of K+ --> pi+ pi0 Decay at m_K =2m_pi","4 pages, revtex","Phys. Rev. D 58, 097503 (1998)","10.1103/PhysRevD.58.097503",,"hep-lat hep-ph",,"  We use one-loop chiral perturbation theory to compare potential lattice
computations of the K+ --> pi+ pi0 decay amplitude at m_K=2m_pi with the
experimental value. We find that the combined one-loop effect due to this
unphysical pion to kaon mass ratio and typical finite volume effects is still
of order minus 20-30%, and appears to dominate the effects from quenching.
","[{""version"":""v1"",""created"":""Fri, 29 May 1998 19:27:45 GMT""}]","2016-08-25"
"hep-ph/9805508","Yuval Grossman","Yuval Grossman, Jose R. Pelaez, Mihir P. Worah","Fast CP Violation","9 pages, revtex, no figures. Discussion of new physics effects on CP
  violation with two lepton tags expanded. Factors of 2 corrected","Phys.Rev.D58:096009,1998","10.1103/PhysRevD.58.096009","SLAC-PUB-7834","hep-ph",,"  $B$ flavor tagging will be extensively studied at the asymmetric $B$
factories due to its importance in CP asymmetry measurements. The primary
tagging modes are the semileptonic decays of the $b$ (lepton tag), or the
hadronic $b \to c (\to s)$ decays (kaon tag). We suggest that looking for time
dependent CP asymmetries in events where one $B$ is tagged leptonically and the
other one is tagged with a kaon could result in an early detection of CP
violation. Although in the Standard Model these asymmetries are expected to be
small, $\sim 1%$, they could be measured with about the same amount of data as
in the ``gold-plated'' decay $B_d \to \psi K_S$. In the presence of physics
beyond the Standard Model, these asymmetries could be as large as $\sim 5%$,
and the first CP violation signal in the $B$ system may show up in these
events. We give explicit examples of new physics scenarios where this occurs.
","[{""version"":""v1"",""created"":""Fri, 29 May 1998 17:26:17 GMT""},{""version"":""v2"",""created"":""Mon, 20 Jul 1998 16:07:29 GMT""}]","2011-01-25"
"hep-ph/9805509","Rainer J. Fries","R. J. Fries and A. Schaefer","Polarized rho mesons and the asymmetry between Delta d^bar(x) and Delta
  u^bar(x) in the sea of the nucleon","14 pages LaTeX, 8 figures; v3: some minor changes; this preprint
  supports the version to appear in Phys. Lett. B with an additional appendix","Phys.Lett. B443 (1998) 40-44","10.1016/S0370-2693(98)01307-0",,"hep-ph",,"  We present a calculation of the polarized rho meson cloud in a nucleon using
time-ordered perturbation theory in two different variants advocated in the
literature. We calculate the induced difference between the distributions Delta
d^bar(x) and Delta u^bar(x). We use a recent lattice calculation to motivate an
ansatz for the polarized valence quark distribution of the rho meson. Our
calculations show that the two theoretical approaches give vastly different
results. We conclude that Delta d^bar(x) - Delta u^bar(x) can be of relevant
size with important consequences for the combined fits of polarized
distribution functions.
","[{""version"":""v1"",""created"":""Fri, 29 May 1998 17:29:13 GMT""},{""version"":""v2"",""created"":""Mon, 15 Jun 1998 14:37:07 GMT""},{""version"":""v3"",""created"":""Tue, 27 Oct 1998 14:02:24 GMT""}]","2009-10-31"
"hep-ph/9805510","Howard Georgi","Howard Georgi, Jihn E. Kim, and Hans-Peter Nilles","Hidden Sector Gaugino Condensation and the Model-independent Axion","7 pages, no figures","Phys.Lett.B437:325-330,1998","10.1016/S0370-2693(98)00916-2","SNUTP 98/036, HUTP-98/A024","hep-ph",,"  In the effective field theory framework, we consider the effect of
supersymmetry breaking via gaugino condensation and supergravity in the hidden
sector gauge group on the hidden sector vacuum angle $\theta_h$. The $\theta_h$
parameter dependence of the potential yields phenomenologically acceptable
invisible axion solutions if the $U(1)_R$ symmetry is broken down to a discrete
subgroup $Z_N$ with $N\ge 3$ (N=4 is marginal). Anomalous U(1) superstring
models are good candidates for this invisible axion resolution of the strong CP
puzzle.
","[{""version"":""v1"",""created"":""Fri, 29 May 1998 20:53:01 GMT""}]","2009-09-11"
"hep-ph/9805511","Otto Kong","Otto C. W. Kong (Rochester U.), Feng-Li Lin (Virginia Tech.)","Two-Higgs-Doublet-Models and Radiative CP Violation","8 pages + cover, 3 figures incoporated, in latex with aipproc.sty
  /aipproc.cls, talk given by O.K. at MRST '98",,"10.1063/1.57065","UR-1531, ER/40685/918, VPI-IPPAP-98-2","hep-ph",,"  We discuss the feasibility of spontaneous CP violation being induced by
radiative corrections in 2HDM's. Specifically, we analyze the cases of
gaugino/higgsino effect on MSSM, and a new model with an extra exotic quark
doublet. The new model, while demonstrating well the Georgi-Pais theorem, is
also expected to be phenomenlogically interesting.
","[{""version"":""v1"",""created"":""Fri, 29 May 1998 21:13:50 GMT""}]","2009-10-31"
"hep-ph/9805512","Taekoon Lee","Taekoon Lee and Guo-Hong Wu","Interactions of a Single Goldstino","10 pages, 2 figures, the version to appear in Phys. Lett. B","Phys.Lett. B447 (1999) 83-88","10.1016/S0370-2693(98)01554-8","PURD-TH-98-09, SNUTP-98-131","hep-ph",,"  The single goldstino interaction is given by the goldstino derivative
coupling to the supercurrent. In an alternative description, the goldstino
couples nonderivatively. We give a simple method to establish the equivalence
of the two approaches, valid to all orders in perturbation theory, and for any
scattering process involving an arbitrary number of particles, but with a
single external goldstino. In the meantime, we find in the nonderivative form
of the goldstino interaction a new quartic vertex that has been overlooked, and
terms that were included incorrectly in the literature. The phenomenological
implication of this new quartic operator is discussed.
","[{""version"":""v1"",""created"":""Fri, 29 May 1998 23:26:42 GMT""},{""version"":""v2"",""created"":""Wed, 2 Dec 1998 03:39:16 GMT""},{""version"":""v3"",""created"":""Thu, 10 Dec 1998 04:16:04 GMT""}]","2009-10-31"
"hep-ph/9806201","Arnulfo Zepeda","U. Cotti, R. Gaitan, A. Hernandez, W. Ponce, and A. Zepeda","Lepton mass generation and family number violation mechanism in the
  $SU(6)\otimes U(1)$ model","12 pages, Latex, 7 figures. Accepted for publication in Int. Journ.
  of Mod. Phys. A","Int.J.Mod.Phys. A13 (1998) 5557-5572","10.1142/S0217751X98002535",,"hep-ph",,"  Lepton family number violation processes arise in the $SU(6)_L \otimes
U(1)_Y$ model due to the presence of an extra neutral gauge boson, Z$'$, with
family changing couplings, and due to the fact that this model demands the
existence of heavy exotic leptons. The mixing of the standard Z with Z$'$ and
the mixing of ordinary leptons with exotic ones induce together family changing
couplings on the Z and therefore nonvanishing rates for lepton family number
violation processes, such as $Z \to e \bar{\mu}$, $\mu \to ee\bar{e}$ and $\mu
\to e\gamma$. Additional contributions to the processes $\mu \to e \gamma$ and
$\mu \to ee \bar{e}$ are induced from the mass generation mechanism. This last
type of contributions may compete with the above one, depending on the masses
of the scalars which participate in the diagrams which generate radiatively the
masses of the charged leptons. Using the experimental data we compute some
bounds for the mixings parameters and for the masses of the scalars.
","[{""version"":""v1"",""created"":""Sat, 30 May 1998 00:09:53 GMT""}]","2009-10-31"
"hep-ph/9806202","Ram Brustein","Ram Brustein, Merav Hadad","Dark Matter Axions in Models of String Cosmology","11 pages, no figures, revtex","Phys.Lett. B442 (1998) 74-81","10.1016/S0370-2693(98)01206-4","BGU-PH-98/05, TAUP-2486-98","hep-ph astro-ph hep-th",,"  Axions are produced during a period of dilaton-driven inflation by
amplification of quantum fluctuations. We show that for some range of string
cosmology parameters and some range of axion masses, primordial axions may
constitute a large fraction of the present energy density in the universe in
the form of cold dark matter. Due to the periodic nature of the axion potential
energy density fluctuations are strongly suppressed. The spectrum of primordial
axions is not thermal, allowing a small fraction of the axions to remain
relativistic until quite late.
","[{""version"":""v1"",""created"":""Sat, 30 May 1998 10:39:07 GMT""}]","2009-10-31"
"hep-th/9805211","Sebastian Jaimungal","Sebastian Jaimungal (N. B. I. and British Columbia U.)","T-Duality in Lattice Regularized Sigma Models","LaTeX, 11 pages, no figures","Phys.Lett.B441:147-154,1998","10.1016/S0370-2693(98)01153-8","NBI-HE-98-15","hep-th hep-lat",,"  It is shown that when the underlying sigma model of bosonic string theory is
written in terms of single-valued fields, which live in the covering space of
the target space, Abelian T-duality survives lattice regularization of the
world-sheet. The projection onto the target-space is implemented through a sum
over cohomology, which bears resemblance to summing over topological sectors in
Yang-Mills theories. In particular, the case of string theory on a circle is
shown to be explicitly self-dual in the lattice regulated model and
automatically forbids vortex excitations which would otherwise destroy the
duality. For other target spaces a generalized notion of T-duality is observed
in which the target space and the cohomology coefficient group are interchanged
under duality. Specific examples show that the fundamental group of the target
space may not be preserved in the T-dual theory. Generalized models which
exhibit T-duality behaviour, with dynamical variables that live on the
k-dimensional cells of (p+1)-dimensional world-volumes, are also constructed.
These models correspond to gauge theories, and higher-dimensional analogues, in
which one sums over various topological sectors of the theory.
","[{""version"":""v1"",""created"":""Fri, 29 May 1998 18:43:11 GMT""}]","2008-11-26"
"hep-th/9805216","Michael Lashkevich","Michael Lashkevich and Yaroslav Pugai (Landau Institute for
  Theoretical Physics and University of Melbourne)","Nearest neighbor two-point correlation function of the $Z$-invariant
  eight-vertex model","5 pages, plain TeX, uses pictex.tex","JETP Lett. 68 (1998) 257-262","10.1134/1.567856","LANDAU-98-TMP-1","hep-th math.QA nlin.SI solv-int",,"  The nearest neighbor two-point correlation function of the $Z$-invariant
inhomogeneous eight-vertex model in the thermodynamic limit is computed using
the free field representation.
","[{""version"":""v1"",""created"":""Fri, 29 May 1998 17:05:34 GMT""}]","2009-10-31"
"hep-th/9805217","Joachim Rahmfeld","R. Kallosh, J. Rahmfeld, and A. Rajaraman","Near Horizon Superspace","11 pages, LaTeX","JHEP 9809:002,1998","10.1088/1126-6708/1998/09/002","SLAC-PUB-7840, SU-ITP-98/36","hep-th",,"  The adS_{p+2} x S^{d-p-2} geometry of the near horizon branes is promoted to
a supergeometry: the solution of the supergravity constraints for the vielbein,
connection and form superfields are found. This supergeometry can be used for
the construction of new superconformal theories. We also discuss the
Green-Schwarz action for a type IIB string on adS_5 x S_5.
","[{""version"":""v1"",""created"":""Fri, 29 May 1998 20:04:15 GMT""}]","2010-02-03"
"hep-th/9805218","Martin Schmaltz","Martin Schmaltz (Boston University)","Duality of Non-Supersymmetric Large N Gauge Theories","27 pages, 4 figures","Phys. Rev. D 59, 105018 (1999)","10.1103/PhysRevD.59.105018","BUHEP-98-14","hep-th",,"  Starting from Seiberg's electric-magnetic duality for supersymmetric QCD, we
construct dual pairs of non-supersymmetric gauge theories. This is accomplished
by first taking the large N limit of supersymmetric QCD and its dual partner
and then performing a special ``orbifold projection'' recently introduced by
Kachru and Silverstein. We argue that in the large N limit the two projected
theories remain dual. The non-supersymmetric gauge theories which can be
studied in this fashion have non-supersymmetric field content, chiral fermions
and exactly massless scalar matter.
","[{""version"":""v1"",""created"":""Fri, 29 May 1998 19:17:50 GMT""},{""version"":""v2"",""created"":""Mon, 1 Jun 1998 01:53:13 GMT""}]","2016-08-25"
"hep-th/9805219","Gary Mccartor","Gary McCartor (SMU)","The Mass Operator in the Light-Cone Representation","Revtex, 8 pages","Phys.Rev. D60 (1999) 105004","10.1103/PhysRevD.60.105004","SMUHEP/98-04","hep-th",,"  I argue that for the case of fermions with nonzero bare mass there is a term
in the matter density operator in the light-cone representation which has been
omitted from previous calculations. The new term provides agreement with
previous results in the equal-time representation for mass perturbation theory
in the massive Schwinger model. For the DLCQ case the physics of the new term
can be represented by an effective operator which acts in the DLCQ subspace,
but the form of the term might be hard to guess and I do not know how to
determine its coefficient from symmetry considerations.
","[{""version"":""v1"",""created"":""Fri, 29 May 1998 20:26:28 GMT""}]","2009-10-31"
"hep-th/9805220","Tamas Hauer","Oliver DeWolfe, Tamas Hauer, Amer Iqbal and Barton Zwiebach","Constraints on the BPS Spectrum of N = 2, D = 4 Theories with A-D-E
  Flavor Symmetry","15 pages, LaTeX, 1 eps figure; references added","Nucl.Phys. B534 (1998) 261-274","10.1016/S0550-3213(98)00652-X","MIT-CTP-2747","hep-th",,"  BPS states of N=2, D=4 Super Yang-Mills theories with ADE flavor symmetry
arise as junctions joining a D3-brane to a set of 7-branes defining the
enhanced flavor algebra. We show that the familiar BPS spectrum of SU(2)
theories with N_f <= 4 is simply given by the set of junctions whose
self-intersection is bounded below as required by supersymmetry. This
constraint, together with the relations between junction and weight lattices,
is used to establish the appearance of arbitrarily large flavor representations
for the case of D_{n>=5} and E_n symmetries. Such representations are required
by consistency with decoupling down to smaller flavor symmetries.
","[{""version"":""v1"",""created"":""Fri, 29 May 1998 23:43:30 GMT""},{""version"":""v2"",""created"":""Mon, 29 Jun 1998 20:11:09 GMT""}]","2009-10-31"
"hep-th/9806001","Kazumi Okuyama","Kazumi Okuyama and Yuji Sugawara (Univ. of Tokyo)","Fractional Strings in (p,q) 5-brane and Quiver Matrix String Theory","21 pages, Latex","JHEP 9808:002,1998","10.1088/1126-6708/1998/08/002","UT-820","hep-th",,"  We study the (p,q)5-brane dynamics from the viewpoint of Matrix string theory
in the T-dualized ALE background. The most remarkable feature in the
(p,q)5-brane is the existence of ``fractional string'', which appears as the
instanton of 5-brane gauge theory. We approach to the physical aspects of
fractional string by means of the two types of Matrix string probes: One of
which is that given in hep-th/9710065. As the second probe we present the
Matrix string theory describing the fractional string itself. We calculate the
moduli space metrics in the respective cases and argue on the specific
behaviors of fractional string. Especially, we show that the ``joining''
process of fractional strings can be realized as the transition from the
Coulomb branch to the Higgs branch of the fractional string probe. In this
argument, we emphasize the importance of some monodromies related with the
theta-angle of the 5-brane gauge theory.
","[{""version"":""v1"",""created"":""Sat, 30 May 1998 08:38:44 GMT""}]","2010-02-03"
"math/9805141","Brian Treadway","Palle E.T. Jorgensen","Ruelle operators: Functions which are harmonic with respect to a
  transfer operator","56 pages, 4 figures (some with sub-figures), AMS-LaTeX v1.2r","Mem. Amer. Math. Soc. 152 (2001), no. 720, viii+60 pp.",,,"math.FA math-ph math.MP math.OA",,"  Let $ N \in \mathbb{N} $, $ N \geq 2 $, be given. Motivated by wavelet
analysis, we consider a class of normal representations of the $ C^* $-algebra
$ \mathfrak{A}_{N} $ on two unitary generators $ U $, $ V $ subject to the
relation \[ UVU^{-1}=V^{N}. \] The representations are in one-to-one
correspondence with solutions $ h \in L^{1}(\mathbb{T}) $, $ h \geq 0 $, to $
R(h)=h $ where $ R $ is a certain transfer operator (positivity-preserving)
which was studied previously by D. Ruelle. The representations of $
\mathfrak{A}_{N} $ may also be viewed as representations of a certain
(discrete) $ N $-adic $ ax+b $ group which was considered recently by J.-B.
Bost and A. Connes.
","[{""version"":""v1"",""created"":""Fri, 29 May 1998 21:41:22 GMT""}]","2007-05-23"
"math/9806001","Vladislav Goldberg","Maks A. Akivis and Vladislav V. Goldberg","A conformal differential invariant and the conformal rigidity of
  hypersurfaces","LaTeX, 10 pages","Proc. Amer. Math. Soc. 125 (1997), no. 8, 2415-2424",,"CAMS Research Report 96-12","math.DG",,"  For a hypersurface V of a conformal space, we introduce a conformal
differential invariant I = h^2/g, where g and h are the first and the second
fundamental forms of V connected by the apolarity condition. This invariant is
called the conformal quadratic element of V. The solution of the problem of
conformal rigidity is presented in the framework of conformal differential
geometry and connected with the conformal quadratic element of V. The main
theorem states:
  Let n \geq 4 and V and V' be two nonisotropic hypersurfaces without umbilical
points in a conformal space C^n or a pseudoconformal space C^n_q of signature
(p, q), p = n - q. Suppose that there is a one-to-one correspondence f: V --->
V' between points of these hypersurfaces, and in the corresponding points of V
and V' the following condition holds: I' = f_* I, where f_*: T (V) ---> T (V)
is a mapping induced by the correspondence f. Then the hypersurfaces V and V'
are conformally equivalent.
","[{""version"":""v1"",""created"":""Sat, 30 May 1998 10:07:15 GMT""}]","2007-05-23"
"nucl-ex/9806001","Brian Kurt Fujikawa","B.K. Fujikawa, S.J. Asztalos, R.M. Clark, M.-A. Deleplanque-Stephens,
  P. Fallon, S.J. Freedman, I-Y. Lee, L.J. Lising, A.O. Macchiavelli, R.W.
  MacLeod, J.C. Reich, M.A. Rowe, S.-Q. Shang, F.S. Stephens, E.G. Wasserman,
  and J.P. Greene","A New Measurement of the Partial 0+->0+ Half Life of 10C with
  GAMMASPHERE","5 pages, 3 figures",,,,"nucl-ex",,"  We report on a new measurement of the strength of the superallowed 0+->0+
transition in the beta-decay of 10C: 10C(0+,g.s.)->10B(0+,1.74MeV)+e+nu. The
experiment was done at the LBNL 88-inch cyclotron using forty seven GAMMASPHERE
germanium detectors. Precise knowledge of this branching ratio is necessary to
compute the superallowed Fermi ft, which gives the weak vector coupling
constant and the u to d element of the Cabibbo-Kobayashi- Maskawa quark mixing
matrix.
","[{""version"":""v1"",""created"":""Sat, 30 May 1998 01:12:29 GMT""}]","2007-05-23"
"nucl-th/9805055","John W. Norbury","John W. Norbury and Marsha L. Waldsmith","Heavy ion beam lifetimes at relativistic and ultrarelativistic colliders","10 pages, 2 tables, 4 figures","Phys.Rev.C57:1525-1527,1998","10.1103/PhysRevC.57.1525","WISC-MILW-98-TH-15","nucl-th nucl-ex physics.acc-ph",,"  The effects of higher order corrections in ultra-relativistic nuclear
collisions are considered. It is found that higher order contributions are
small at low energy, large at intermediate energy and small again at very high
energy. An explanation for this effect is given. This means that the
Weizsacker-Williams formula is a good approximation to use in calculating cross
sections and beam lifetimes at energies relevant to RHIC and LHC.
","[{""version"":""v1"",""created"":""Fri, 29 May 1998 16:03:59 GMT""}]","2008-11-26"
