"nucl-th/9805056","Carlos Bertulani","Carlos A. Bertulani","The astrophysical reaction 8Li(n,gamma)9Li from measurements by reverse
  kinematics","4 pages, 3 figures","J.Phys.G25:1959-1963,1999","10.1088/0954-3899/25/9/313",,"nucl-th",,"  We study the breakup of 9Li projectiles in high energy (28.5 MeV/u)
collisions with heavy nuclear targets (208Pb). The wave functions are
calculated using a single-particle model for 9Li, and a simple optical
potential model for the scattering part. A good agreement with measured data is
obtained with insignificant E2 contribution.
","[{""version"":""v1"",""created"":""Fri, 29 May 1998 17:21:39 GMT""}]","2008-11-26"
"nucl-th/9806001","Yasuo Umino","Y. Umino and M.K. Banerjee (University of Maryland College Park)","Baryon resonances in a chiral confining model (I)","ReVTeX, 29 pages, 3 Postscript figures, Submitted to Phys. Rev. C",,,"University of Maryland TQHN Group PP\97-045","nucl-th hep-ph",,"  In this two part series a chiral confining model of baryons is used to
describe low--lying negative parity resonances $N^*$, $\Delta^*$, $\Lambda^*$
and $\Sigma^*$ in the mean field approximation. A physical baryon in this model
consists of interacting valence quarks, mesons and a color and chiral singlet
hybrid field coexisting inside a dynamically generated confining region. This
first paper presents the quark contribution to the masses and wave functions of
negative parity baryons calculated with an effective spin--isospin dependent
instanton induced interaction. It does not include meson exchanges between
quarks. The three--quark wave functions are used to calculate meson--excited
baryon vertex functions to lowest order in meson--quark coupling. When the
baryons are on mass--shell each of these vertex functions is a product of a
coupling constant and a form factor. As examples, quark contributions to $N^*$
hadronic form factors as well as axial coupling constants are extracted from
the vertex functions and problems with the analytical behaviour of the model
form factors are discussed. The second paper will examine the mesonic
corrections to excited baryon properties in the heavy baryon and one--loop
approximations.
","[{""version"":""v1"",""created"":""Sat, 30 May 1998 14:48:44 GMT""}]","2007-05-23"
"physics/9805038","Umar Mohideen","U. Mohideen and Anushree Roy","Precision Measurement of the Casimir Force from 0.1 to 0.9 microns","Minor changes in text and figures; references added","Phys.Rev.Lett.81:4549-4552,1998","10.1103/PhysRevLett.81.4549",,"physics.optics cond-mat quant-ph",,"  We have used an atomic force microscope to make precision measurements of the
Casimir force between a metallized sphere of diameter 196 microns and flat
plate. The force was measured for plate-sphere separations from 0.1 to 0.9
microns. The experimental results are consistent with present theoretical
calculations including the finite conductivity, roughness, and temperature
corrections. The root mean square average deviation of 1.6 pN between theory
and experiment corresponds to a 1% deviation at the smallest separation.
","[{""version"":""v1"",""created"":""Fri, 29 May 1998 22:55:34 GMT""},{""version"":""v2"",""created"":""Wed, 9 Dec 1998 19:32:37 GMT""}]","2009-09-25"
"physics/9806001","Anatoly V. Titov","N.S.Mosyagin, M.G.Kozlov, and A.V.Titov (Petersburg Nuclear Physics
  Institute)","Electric dipole moment of the electron in YbF molecule","7 pages, REVTEX","J. Phys. B 31, L763 (1998)","10.1088/0953-4075/31/19/002",,"physics.atom-ph physics.chem-ph",,"  Ab initio calculation of the hyperfine, P-odd, and P,T-odd constants for the
YbF molecule was performed with the help of the recently developed technique,
which allows to take into account correlations and polarization in the
outercore region. The ground state electronic wave function of the YbF molecule
is found with the help of the Relativistic Effective Core Potential method
followed by the restoration of molecular four-component spinors in the core
region of ytterbium in the framework of a non-variational procedure. Core
polarization effects are included with the help of the atomic Many Body
Perturbation Theory for Yb atom. For the isotropic hyperfine constant A,
accuracy of our calculation is about 3% as compared to the experimental datum.
The dipole constant Ad (which is much smaller in magnitude), though better than
in all previous calculations, is still underestimated by almost 23%. Being
corrected within a semiempirical approach for a perturbation of 4f-shell in the
core of Yb due to the bond making, this error is reduced to 8%. Our value for
the effective electric field on the unpaired electron is 4.9 a.u.=2.5E+10 V/cm.
","[{""version"":""v1"",""created"":""Sat, 30 May 1998 09:58:53 GMT""}]","2015-06-26"
"physics/9806002","Andrei Kirilyuk","Andrei P. Kirilyuk","Universal Concept of Complexity by the Dynamic Redundance Paradigm:
  Causal Randomness, Complete Wave Mechanics, and the Ultimate Unification of
  Knowledge","37 pages, PostScript 3.0 from an MS Word file; a non-technical
  interpretation of the main results of a book with the same title (Kiev,
  Naukova Dumka, 1997; 550 p., in English); refinement of details and minor
  corrections in the revised version, no changes in the essential content",,,,"physics.gen-ph",,"  The fundamental impasses and ruptures in various domains of the canonical,
unitary science, or the 'end of science', become the more and more evident. The
natural unity of being is recovered within a universal nonperturbative method
leading to the dynamic redundance paradigm. It is shown that the unreduced
behaviour of any nontrivial (isolated) system includes many equally real, but
incompatible dynamic regimes, each of them being roughly equivalent to an
ordinary 'complete' solution of the unitary science. Therefore the regimes
should 'spontaneously' and randomly replace one another, which provides a
universal, purely dynamic origin of randomness. The discovered dynamic
redundance leads to the universal, reality-based concept of dynamic complexity
and its permanently developing hierarchical structure, alias the world. Its
lowest levels give the causally complete mechanics of dynamically quantized
elementary fields, extending the double solution found by Louis de Broglie. One
obtains a physically complete solution for the 'mysteries' of quantum
mechanics, unifyng it with the extended, causal versions of relativity
(emergent space and time), quantum and classical gravity (dynamical mass),
field theory (electric charge and spin), particle physics, and cosmology. The
same key features of the unreduced dynamic complexity determine behaviour of
any system at higher levels of complexity described by a case of the single,
universal equation in its two related versions, the extended Lagrange-Hamilton
(trajectorial) and Schroedinger (distributional) equations. The end of the
unitary science opens the renaissance of the ultimately complete and universal
understanding initiated by Rene Descartes (but then mechanistically falsified),
which is confirmed by many sound, practically important results.
","[{""version"":""v1"",""created"":""Sat, 30 May 1998 12:30:22 GMT""},{""version"":""v2"",""created"":""Fri, 2 Oct 1998 17:37:27 GMT""}]","2007-05-23"
"quant-ph/9805088","Adrian Kent","Adrian Kent","Entangled Mixed States and Local Purification","3 pages, Latex with Revtex. Small clarifications and reference added","Phys.Rev.Lett. 81 (1998) 2839-2841","10.1103/PhysRevLett.81.2839","DAMTP/97-128","quant-ph",,"  Linden, Massar and Popescu have recently given an optimization argument to
show that a single two-qubit Werner state, or any other mixture of the
maximally entangled Bell states, cannot be purified by local operations and
classical communications. We generalise their result and give a simple
explanation. In particular, we show that no purification scheme using local
operations and classical communications can produce a pure singlet from any
mixed state of two spin-1/2 particles. More generally, no such scheme can
produce a maximally entangled state of any pair of finite-dimensional systems
from a generic mixed state. We also show that the Werner states belong to a
large class of states whose fidelity cannot be increased by such a scheme.
","[{""version"":""v1"",""created"":""Fri, 29 May 1998 17:48:18 GMT""},{""version"":""v2"",""created"":""Tue, 9 Jun 1998 16:13:40 GMT""},{""version"":""v3"",""created"":""Sun, 23 Aug 1998 20:53:30 GMT""}]","2009-10-31"
