"physics/9806003","Andrew A. Fedyanin","O. A. Aktsipetrov (1), A. A. Fedyanin (1), A. V. Melnikov (1), E. D.
  Mishina (1), A. N. Rubtsov (1), M. H. Anderson (2), P. T. Wilson (2), M. ter
  Beek (2), X. F. Hu (2), J. I. Dadap (2), M. C. Downer (2) ((1) Department of
  Physics, Moscow State University, Moscow, Russia, (2) Department of Physics,
  The University of Texas at Austin, Austin, USA)","DC-electric-field-induced and low-frequency electromodulation
  second-harmonic generation spectroscopy of Si(001)-SiO$_2$ interfaces","31 pages, 14 figures, 1 table, figures are also available at
  http://kali.ilc.msu.su/articles/50/efish.htm",,"10.1103/PhysRevB.60.8924",,"physics.optics",,"  The mechanism of DC-Electric-Field-Induced Second-Harmonic (EFISH) generation
at weakly nonlinear buried Si(001)-SiO$_2$ interfaces is studied experimentally
in planar Si(001)-SiO$_2$-Cr MOS structures by optical second-harmonic
generation (SHG) spectroscopy with a tunable Ti:sapphire femtosecond laser. The
spectral dependence of the EFISH contribution near the direct two-photon $E_1$
transition of silicon is extracted. A systematic phenomenological model of the
EFISH phenomenon, including a detailed description of the space charge region
(SCR) at the semiconductor-dielectric interface in accumulation, depletion, and
inversion regimes, has been developed. The influence of surface quantization
effects, interface states, charge traps in the oxide layer, doping
concentration and oxide thickness on nonlocal screening of the DC-electric
field and on breaking of inversion symmetry in the SCR is considered. The model
describes EFISH generation in the SCR using a Green function formalism which
takes into account all retardation and absorption effects of the fundamental
and second harmonic (SH) waves, optical interference between field-dependent
and field-independent contributions to the SH field and multiple reflection
interference in the SiO$_2$ layer. Good agreement between the phenomenological
model and our recent and new EFISH spectroscopic results is demonstrated.
Finally, low-frequency electromodulated EFISH is demonstrated as a useful
differential spectroscopic technique for studies of the Si-SiO$_2$ interface in
silicon-based MOS structures.
","[{""version"":""v1"",""created"":""Mon, 1 Jun 1998 07:29:16 GMT""},{""version"":""v2"",""created"":""Wed, 3 Jun 1998 11:54:44 GMT""}]","2009-10-31"
"quant-ph/9806001","Yuri I. Ozhigov","Yuri Ozhigov","Lower Bounds of Quantum Search for Extreme Point","Some minor changes","Proc.Roy.Soc.Lond. A455 (1999) 2165-2172","10.1098/rspa.1999.0397",,"quant-ph",,"  We show that Durr-Hoyer's quantum algorithm of searching for extreme point of
integer function can not be sped up for functions chosen randomly. Any other
algorithm acting in substantially shorter time $o(\sqrt{2^n})$ gives incorrect
answer for the functions with the single point of maximum chosen randomly with
probability converging to 1. The lower bound as $\Omega (\sqrt{2^n /b})$ was
established for the quantum search for solution of equations $f(x)=1$ where $f$
is a Boolean function with $b$ such solutions chosen at random with probability
converging to 1.
","[{""version"":""v1"",""created"":""Sun, 31 May 1998 19:40:48 GMT""},{""version"":""v2"",""created"":""Wed, 3 Jun 1998 15:58:50 GMT""},{""version"":""v3"",""created"":""Fri, 18 Dec 1998 10:03:39 GMT""}]","2009-10-31"
"quant-ph/9806002","R. E. Kastner","R. E. Kastner","Time-Symmetrized Quantum Theory, Counterfactuals, and `Advanced Action'","Minor editorial changes and correction to figure 4. To appear in
  ""Studies in History and Philosophy of Modern Physics""","Stud.Hist.Philos.Mod.Phys. 30 (1999) 237-259",,"UMCP-CHPS-1001","quant-ph",,"  Recent authors have raised objections to the counterfactual interpretation of
the Aharonov-Bergmann-Lebowitz (ABL) rule of time symmetrized quantum theory
(TSQT). I distinguish between two different readings of the ABL rule,
counterfactual and non-counterfactual, and confirm that TSQT advocate L.
Vaidman is employing the counterfactual reading to which these authors object.
Vaidman has responded to the objections by proposing a new kind of
time-symmetrized counterfactual, which he has defined in two different ways. It
is argued that neither definition succeeds in overcoming the objections, except
in a special case previously noted by Cohen and Hiley. In addition, a
connection is made between TSQT and Price's concept of `advanced action', which
further supports the special case discussed.
","[{""version"":""v1"",""created"":""Mon, 1 Jun 1998 06:44:44 GMT""},{""version"":""v2"",""created"":""Tue, 2 Jun 1998 12:39:55 GMT""},{""version"":""v3"",""created"":""Wed, 3 Jun 1998 03:55:30 GMT""},{""version"":""v4"",""created"":""Thu, 2 Jul 1998 02:41:27 GMT""},{""version"":""v5"",""created"":""Sat, 18 Jul 1998 20:50:35 GMT""},{""version"":""v6"",""created"":""Tue, 22 Sep 1998 02:12:26 GMT""}]","2007-05-23"
