"cs/9806101",,"A. Darwiche","Model-Based Diagnosis using Structured System Descriptions","See http://www.jair.org/ for any accompanying files","Journal of Artificial Intelligence Research, Vol 8, (1998),
  165-222",,,"cs.AI",,"  This paper presents a comprehensive approach for model-based diagnosis which
includes proposals for characterizing and computing preferred diagnoses,
assuming that the system description is augmented with a system structure (a
directed graph explicating the interconnections between system components).
Specifically, we first introduce the notion of a consequence, which is a
syntactically unconstrained propositional sentence that characterizes all
consistency-based diagnoses and show that standard characterizations of
diagnoses, such as minimal conflicts, correspond to syntactic variations on a
consequence. Second, we propose a new syntactic variation on the consequence
known as negation normal form (NNF) and discuss its merits compared to standard
variations. Third, we introduce a basic algorithm for computing consequences in
NNF given a structured system description. We show that if the system structure
does not contain cycles, then there is always a linear-size consequence in NNF
which can be computed in linear time. For arbitrary system structures, we show
a precise connection between the complexity of computing consequences and the
topology of the underlying system structure. Finally, we present an algorithm
that enumerates the preferred diagnoses characterized by a consequence. The
algorithm is shown to take linear time in the size of the consequence if the
preference criterion satisfies some general conditions.
","[{""version"":""v1"",""created"":""Mon, 1 Jun 1998 00:00:00 GMT""}]","2014-11-17"
"cs/9806102",,"L. Finkelstein, S. Markovitch","A Selective Macro-learning Algorithm and its Application to the NxN
  Sliding-Tile Puzzle","See http://www.jair.org/ for an online appendix and other files
  accompanying this article","Journal of Artificial Intelligence Research, Vol 8, (1998),
  223-263",,,"cs.AI",,"  One of the most common mechanisms used for speeding up problem solvers is
macro-learning. Macros are sequences of basic operators acquired during problem
solving. Macros are used by the problem solver as if they were basic operators.
The major problem that macro-learning presents is the vast number of macros
that are available for acquisition. Macros increase the branching factor of the
search space and can severely degrade problem-solving efficiency. To make macro
learning useful, a program must be selective in acquiring and utilizing macros.
This paper describes a general method for selective acquisition of macros.
Solvable training problems are generated in increasing order of difficulty. The
only macros acquired are those that take the problem solver out of a local
minimum to a better state. The utility of the method is demonstrated in several
domains, including the domain of NxN sliding-tile puzzles. After learning on
small puzzles, the system is able to efficiently solve puzzles of any size.
","[{""version"":""v1"",""created"":""Mon, 1 Jun 1998 00:00:00 GMT""}]","2009-09-25"
"gr-qc/9806006","Alex Kaganovich","E.I.Guendelman and A.B.Kaganovich","Gravity, Cosmology and Particle Physics without the Cosmological
  Constant Problem","7 pages, received an ""honorable mention"" from Gravity Research
  Foundation, 1998","Mod.Phys.Lett. A13 (1998) 1583-1586","10.1142/S0217732398001662",,"gr-qc",,"  This essay elucidates recent achievements of the ""nongravitating vacuum
energy"" (NGVE) theory"" which has the feature that a shift of the Lagrangian
density by a constant does not affect dynamics. In the first order formalism, a
constraint appears that enforces the vanishing of the cosmological constant
\Lambda. Standard dynamics of gauge unified theories (including fermions) and
their SSB appear if a four index field strength condensate is present. At a
vacuum state there is exact balance to zero of the gauge fields condensate and
the original scalar fields potential. As a result it is possible to combine the
solution of the \Lambda problem with inflation and transition to a \Lambda =0
phase without fine tuning after a reheating period. The model opens new
possibilities for a solution of the hierarchy problem.
","[{""version"":""v1"",""created"":""Mon, 1 Jun 1998 08:43:10 GMT""}]","2009-10-31"
"gr-qc/9806007","Kourosh Nozari","Reza Mansouri and Kourosh Nozari","Application of Colombeau's Generalized Functions to Cosmological Models
  with Signature Change","12 pages, Latex, no figures",,,"IPM-283","gr-qc",,"  Colombeau's generalized functions are used to adapt the distributional
approach to singular hypersurfaces in general relativity with signature change.
Equations governing the dynamics of singular hypersurface is obtained and it is
shown that the stress-energy tensor of the surface can be non-vanishing.
","[{""version"":""v1"",""created"":""Mon, 1 Jun 1998 09:30:35 GMT""}]","2007-05-23"
"gr-qc/9806008","Sharon Morsink","Sharon M. Morsink, Nikolaos Stergioulas and Steve R. Blattnig","Quasi-normal modes of rotating relativistic stars - neutral modes for
  realistic equations of state","12 pages, 5 figures, submitted to ApJ","Astrophys.J.510:854-861,1999","10.1086/306630","WISC-MILW-98-TH-19","gr-qc astro-ph",,"  We compute zero-frequency (neutral) quasi-normal f-modes of fully
relativistic and rapidly rotating neutron stars, using several realistic
equations of state (EOSs) for neutron star matter. The zero-frequency modes
signal the onset of the gravitational radiation-driven instability. We find
that the l=m=2 (bar) f-mode is unstable for stars with gravitational mass as
low as 1.0 - 1.2 M_\odot, depending on the EOS. For 1.4 M_\odot neutron stars,
the bar mode becomes unstable at 83 % - 93 % of the maximum allowed rotation
rate. For a wide range of EOSs, the bar mode becomes unstable at a ratio of
rotational to gravitational energies T/W \sim 0.07-0.09 for 1.4 M_\odot stars
and T/W \sim 0.06 for maximum mass stars. This is to be contrasted with the
Newtonian value of T/W \sim 0.14. We construct the following empirical formula
for the critical value of T/W for the bar mode,
  (T/W)_2 = 0.115 - 0.048 M / M_{max}^{sph}, which is insensitive to the EOS to
within 4 - 6 %. This formula yields an estimate for the neutral mode sequence
of the bar mode as a function only of the star's mass, M, given the maximum
allowed mass, M_{max}^{sph}, of a nonrotating neutron star. The recent
discovery of the fast millisecond pulsar in the supernova remnant N157B,
supports the suggestion that a fraction of proto-neutron stars are born in a
supernova collapse with very large initial angular momentum. Thus, in a
fraction of newly born neutron stars the instability is a promising source of
continuous gravitational waves. It could also play a major role in the
rotational evolution (through the emission of angular momentum) of merged
binary neutron stars, if their post-merger angular momentum exceeds the maximum
allowed to form a Kerr black hole.
","[{""version"":""v1"",""created"":""Mon, 1 Jun 1998 15:19:20 GMT""}]","2014-11-17"
"hep-ph/9806207","Eugene Zabrodin","E.E. Zabrodin (1,2), L.V. Bravina (1,2,4), L.P. Csernai (3), H.
  St\""ocker (1) and W. Greiner (1) ((1) Institute for Theoretical Physics,
  University of Frankfurt, Frankfurt, Germany (2) Institute for Nuclear
  Physics, Moscow State University, Moscow, Russia (3) Department of Physics,
  University of Bergen, Bergen, Norway; (4) Alexander von Humboldt Fellow)","Supercooling of rapidly expanding quark-gluon plasma","12 pages, LaTeX, 3 eps figures","Phys.Lett. B423 (1998) 373-378","10.1016/S0370-2693(98)00006-9",,"hep-ph",,"  We reexamine the scenario of homogeneous nucleation of the quark-gluon plasma
produced in ultra-relativistic heavy ion collisions. A generalization of the
standard nucleation theory to rapidly expanding system is proposed. The
nucleation rate is derived via the new scaling parameter $\lambda_Z$. It is
shown that the size distribution of hadronic clusters plays an important role
in the dynamics of the phase transition. The longitudinally expanding system is
supercooled to about 3-6%, then it is reheated, and the hadronization is
completed within 6-10 fm/c, i.e. 5-10 times faster than it was estimated
earlier, in a strongly nonequilibrium way.
","[{""version"":""v1"",""created"":""Sun, 31 May 1998 17:51:30 GMT""}]","2016-08-15"
"hep-ph/9806208","Don Lichtenberg","D.B. Lichtenberg","Are there quasistable strange baryons with anticharm or antibeauty?","7 pages, plaintex, no figures","J.Phys.G24:2065-2071,1998","10.1088/0954-3899/24/11/008","IUHET--391","hep-ph",,"  In some models, exotic baryons with strangeness and anticharm or antibeauty
should exist and even be stable against strong decay. We consider the stability
of such possible exotic baryons, which in the constituent quark picture are
called pentaquarks (each is composed of four quarks and an antiquark). Our
model is based on diquark clustering and supersymmetry in hadrons, and assumes
that the spin-dependent force between quarks arises from one-gluon exchange. In
the model, a pentaquark with strangeness and anticharm can decay strongly, but
an analogous pentaquark with an antibeauty quark is stable except for weak
decay.
","[{""version"":""v1"",""created"":""Sun, 31 May 1998 20:23:33 GMT""}]","2008-11-26"
"hep-ph/9806209","Hai-Yang Cheng","Hai-Yang Cheng and B. Tseng","Exclusive Hadronic D Decays to eta' and eta","15 pages, 1 figure, to appear in Phys. Rev. D. Form factors for D to
  eta and eta' transitions are slightly changed","Phys.Rev. D59 (1999) 014034","10.1103/PhysRevD.59.014034",,"hep-ph hep-ex",,"  Hadronic decay modes $D^0\to(\bar K^0, \bar K^{*0})\eta,\eta'$ and
$(D^+,D_s^+)\to(\pi^+,\rho^+)\eta,\eta'$ are studied in the generalized
factorization approach. Form factors for $(D,D_s^+)\to(\eta,\eta')$ transitions
are carefully evaluated by taking into account the wave function normalization
of the eta and eta'. The predicted branching ratios are generally in agreement
with experiment except for $D^0\to\bar K^0\eta', D^+\to\pi^+\eta$ and
$D_s^+\to\rho^+\eta'$; the calculated decay rates for the first two decay modes
are too small by an order of magnitude. We show that the weak decays $D^0\to
K^-\pi^+$ and $D^+\to K^+\bar K^0$ followed by resonance-induced final-state
interactions (FSI), which are amenable technically, are able to enhance the
branching ratios of $D^0\to\bar K^0\eta'$ and $D^+\to\pi^+\eta$ dramatically
without affecting the agreement between theory and experiment for $D^0\to\bar
K^0\eta$ and $D^+\to\pi^+\eta'$. We argue that it is difficult to understand
the observed large decay rates of $D_s^+\to \rho^+\eta'$ and $\rho^+\eta$
simultaneously; FSI, W-annihilation and the production of excess eta' from
gluons are not helpful in this regard. The large discrepancy between the
factorization hypothesis and experiment for the ratio of $D_s^+\to\rho^+ \eta'$
and $D_s^+\to\eta' e^+\nu$ remains as an enigma.
","[{""version"":""v1"",""created"":""Mon, 1 Jun 1998 06:32:21 GMT""},{""version"":""v2"",""created"":""Mon, 21 Sep 1998 23:24:01 GMT""}]","2009-10-31"
"hep-ph/9806210","D. P. Roy","Ernest Ma (UC, Riverside), D. P. Roy (TIFR)","Phenomenology of the $B - 3 L_\tau$ Gauge Boson","19 pages, LaTeX, including 4 figures","Phys.Rev. D58 (1998) 095005","10.1103/PhysRevD.58.095005","UCRHEP-T224, TIFR/TH/98-20","hep-ph",,"  Assuming the existence of a gauge boson $X$ which couples to $B - 3 L_\tau$,
we discuss the present experimental constraints on $g_X$ and $m_X$ from $Z \to
l^+ l^-$ and $Z \to \bar f f X~(f = q, \nu_\tau, \tau)$. We also discuss the
discovery potential of $X$ at hadron colliders through its decay into $\tau^+
\tau^-$ pairs. In the scenario where all three charged leptons (and their
neutrinos) mix, lepton flavor nonconservation through $X$ becomes possible and
provides another experimental probe into this hypothesis.
","[{""version"":""v1"",""created"":""Mon, 1 Jun 1998 07:20:39 GMT""}]","2009-10-31"
"hep-ph/9806211",,"Hsiang-nan Li","Small-x evolution with Q dependence and unitarity","12 pages in Latex",,,"NCKU-HEP-98-06","hep-ph",,"  We propose a modified Balitsky-Fadin-Kuraev-Lipatov equation from the
viewpoint of the resummation technique, which contains an intrinsic dependence
on momentum transfer Q, and satisfies the unitarity bound. The idea is to relax
the strong rapidity ordering and to restrict phase space for real gluon
emissions in the evaluation of the BFKL kernel. It is shown that the power-law
rise of the gluon distribution function with the small Bjorken variable x turns
into a logarithmic rise, and that the predictions for the proton structure
function $F_2(x,Q^2)$ are consistent with the HERA data.
","[{""version"":""v1"",""created"":""Mon, 1 Jun 1998 07:41:33 GMT""}]","2016-09-06"
"hep-ph/9806212","Anna Stasto","A.D.Martin, M.G.Ryskin and A.M.Stasto","The description of $F_2$ at low $Q^2$","18 pages, Latex, 10 ps figures; references to the photoproduction
  data points have been changed","Eur.Phys.J.C7:643-654,1999","10.1007/s100529801035","DTP/98/20","hep-ph",,"  We analyse the data for the proton structure function $F_2$ over the entire
$Q^2$ domain, including especially low $Q^2$, in terms of perturbative and
non-perturbative QCD contributions. The small distance configurations are given
by perturbative QCD, while the large distance contributions are given by the
vector dominance model and, for the higher mass $q \bar{q}$ states, by the
additive quark approach. The interference between states of different
$q\bar{q}$ mass (in the perturbative contribution) is found to play a crucial
role in obtaining an excellent description of the data throughout the whole
$Q^2$ region, including photoproduction.
","[{""version"":""v1"",""created"":""Mon, 1 Jun 1998 08:07:57 GMT""},{""version"":""v2"",""created"":""Sun, 21 Jun 1998 16:39:48 GMT""}]","2011-09-13"
"hep-ph/9806213","John McDonald","Kari Enqvist and John McDonald","Supersymmetric D-term Inflation and B-ball Baryogenesis","12 pages LaTeX. Final published version (Phys.Rev.Lett. 81 (1998)
  3071)","Phys.Rev.Lett. 81 (1998) 3071-3074","10.1103/PhysRevLett.81.3071",,"hep-ph astro-ph",,"  We consider the B-ball cosmology of the MSSM in the context of D-term
inflation models where the reheating temperature is determined by the
Affleck-Dine mechanism to be of the order of 1 GeV. We show that such a low
reheating temperature can arise quite naturally as the result of a symmetry
which is required to maintain the flatness of the inflaton potential. In this
case the B-balls will decay well after the freeze-out temperature of the LSP,
allowing baryons and cold dark matter to originate primarily from B-ball
decays.
","[{""version"":""v1"",""created"":""Mon, 1 Jun 1998 11:00:02 GMT""},{""version"":""v2"",""created"":""Mon, 22 Jun 1998 13:20:06 GMT""},{""version"":""v3"",""created"":""Wed, 3 Feb 1999 19:26:44 GMT""}]","2009-10-31"
"hep-ph/9806214","Palash B. Pal","Gautam Bhattacharyya, Palash B. Pal","New constraints on R-parity violation from proton stability","4 pages, Latex, uses axodraw.sty (in the revised version all
  combinations of the form $\lambda""_{ijk}\mu_l$ have been constrained, using
  one-loop graphs) To appear in Phys. Lett. B","Phys.Lett. B439 (1998) 81-84","10.1016/S0370-2693(98)01012-0","SINP/TNP/98-13","hep-ph",,"  We derive stringent upper bounds on all the $(\lambda''_{ijk} \mu_l)$-type
combinations from the consideration of proton stability, where
$\lambda''_{ijk}$ are baryon-number-violating trilinear couplings and $\mu_l$
are lepton-number-violating bilinear mass parameters in a R-parity-violating
supersymmetric theory.
","[{""version"":""v1"",""created"":""Mon, 1 Jun 1998 11:16:09 GMT""},{""version"":""v2"",""created"":""Thu, 6 Aug 1998 09:01:50 GMT""}]","2009-10-31"
"hep-ph/9806215","Andrej Arbuzov","A. B. Arbuzov, E. A. Kuraev, B. G. Shaikhatdenov (JINR, Dubna)","Second order contributions to elastic large-angle Bhabha scattering
  cross-section","14 pp, LaTeX 2.09, typos fixed, submitted to Int.J.Mod.Phys. A","Mod.Phys.Lett. A13 (1998) 2305-2316","10.1142/S021773239800245X",,"hep-ph",,"  The cross-section of (quasi-)elastic large-angle electron-positron scattering
at high energies is calculated. Radiative corrections of the orders O(\alpha^2
L^2) and O(\alpha^2 L), besides pure two-loop box contributions, are explicitly
calculated. In the second order we considered the following sources of
corrections: 1) Virtual photonic corrections coming from squares of 1-loop
level amplitudes and their relevant interferences (vertex-type and box-type
Feynman diagrams). 2) Double soft photon emission and one-loop corrections to
single soft photon emission. The results are presented in an analytical form.
","[{""version"":""v1"",""created"":""Mon, 1 Jun 1998 13:45:18 GMT""},{""version"":""v2"",""created"":""Fri, 31 Jul 1998 08:45:45 GMT""}]","2009-10-31"
"hep-th/9806008","Zurab Kakushadze","Zurab Kakushadze","On Four Dimensional N=1 Type I Compactifications","26 pages, revtex, 1 eps figure, minor misprints corrected (to appear
  in Nucl. Phys. B)","Nucl.Phys.B535:311-334,1998","10.1016/S0550-3213(98)00643-9","HUTP-98/A031, NUB 3178","hep-th",,"  We consider four dimensional N=1 supersymmetric Type I compactifications on
toroidal orbifolds T^6/G. In particular, we focus on the Type I vacua which are
perturbative from the orientifold viewpoint, that is, on the compactifications
with well defined world-sheet expansion. The number of such models is rather
constrained. This allows us to study all such vacua. This, in particular,
involves considering compactifications with non-trivial NS-NS antisymmetric
tensor backgrounds. We derive massless spectra for these models, and also
compute superpotentials. We review the reasons responsible for such a limited
number of perturbative Type I compactifications on toroidal orbifolds (which
include Abelian as well as non-Abelian cases). As an aside, we generalized the
recent work on large N gauge theories from orientifolds to include a
non-Abelian orbifold. This also provides an important independent check for
perturbative consistency of the corresponding Type I compactification.
","[{""version"":""v1"",""created"":""Mon, 1 Jun 1998 07:03:11 GMT""},{""version"":""v2"",""created"":""Fri, 5 Jun 1998 17:13:06 GMT""},{""version"":""v3"",""created"":""Sun, 7 Jun 1998 20:30:10 GMT""},{""version"":""v4"",""created"":""Thu, 11 Jun 1998 06:49:05 GMT""},{""version"":""v5"",""created"":""Mon, 14 Sep 1998 16:52:32 GMT""}]","2010-11-19"
"hep-th/9806009","Sergei Ketov","Sergei V. Ketov (ITP, University of Hannover)","Analytic tools to brane technology in N=2 gauge theories with matter","80 pages, LaTeX, 7 pictures, macros included","Fortsch.Phys. 47 (1999) 643-703","10.1002/(SICI)1521-3978(199906)47:6<643::AID-PROP643>3.0.CO;2-X","DESY 98--059 and ITP-UH-12/98","hep-th",,"  Exact solutions to the low-energy effective action (LEEA) of the
four-dimensional N=2 supersymmetric gauge field theories are known to be
obtained either by quantum field theory methods from S-duality in the
Seiberg-Witten approach, or by the Type-IIA superstring/M-Theory methods of
brane technology. After a brief review of the standard field-theoretical
results for the N=2 gauge (Seiberg-Witten) LEEA, we consider a
field-theoretical derivation of the exact hypermultiplet LEEA by using the N=2
harmonic superspace methods. We illustrate our techniques on a number of
explicit examples. Our main purpose, however, is to discuss the existing
analytical (calculational) support for the alternative methods of brane
technology. We summarize known exact solutions to the eleven-dimensional and
ten-dimensional type-IIA supergravities, which describe classical
configurations of intersecting BPS branes with eight supercharges relevant to
the non-perturbative N=2 gauge field theory with fundamental hypermultiplet
matter. The crucial role of M-Theory in providing a classical resolution of
singularities in the ten-dimensional (Type-IIA superstring) brane picture, as
well as the N=2 extended supersymmetry in four dimensions, are made manifest.
The two approaches to a derivation of the exact N=2 gauge theory LEEA are thus
seen to be complementary to each other and mutually dependent.
","[{""version"":""v1"",""created"":""Mon, 1 Jun 1998 08:28:24 GMT""}]","2016-04-13"
"hep-th/9806010","Kazuo Hosomichi","Kazuo Hosomichi","Absorption of Fermions by D3-branes","12 pages, semiclassical analysis revised, note and references added","JHEP 9806 (1998) 009","10.1088/1126-6708/1998/06/009","UT-818","hep-th",,"  The absorption cross section of dilatinos by D3-branes is calculated by means
of both classical type IIB supergravity and the effective gauge field theory on
their worldvolume. The two methods give the same results, supporting the
microscopic description of black holes in terms of D-branes and giving another
evidence of AdS/superconformal reciprocity.
","[{""version"":""v1"",""created"":""Mon, 1 Jun 1998 08:57:59 GMT""},{""version"":""v2"",""created"":""Fri, 5 Jun 1998 04:51:41 GMT""},{""version"":""v3"",""created"":""Tue, 16 Jun 1998 07:23:06 GMT""}]","2009-10-31"
"math/9806002","Lino Notarantonio","Lino Notarantonio","Growth and spectrum of diffusions","AMSLaTeX file, 17 pages. Submitted to Comm. PDE",,,,"math.SP math.AP math.DG",,"  We prove an upper bound on the bottom of the essential spectrum of a
diffusion in term of the growth of the volume of $X$, generalizing a result by
R. Brooks.
","[{""version"":""v1"",""created"":""Mon, 1 Jun 1998 12:41:50 GMT""}]","2007-05-23"
"math/9806003","Dimitri Markushevich","Franck Leprevost (TU Berlin), Dimitri Markushevich (University of
  Lille 1)","A tower of genus 2 curves related to the Kowalewski top","AMS-Latex, 8 pages",,,"USTL 1998","math.AG math.DS",,"  Several curves of genus 2 are known, such that the equations of motion of the
Kowalewski top are linearized on their Jacobians. One can expect from
transcendental approaches via solutions of equations of motion in
theta-functions, that their Jacobians are isogeneous. The paper focuses on two
such curves: Kowalewski's and that of Bobenko-Reyman-Semenov-Tian-Shansky, the
latter arising from the solution of the problem by the method of spectral
curves. An isogeny is established between the Jacobians of these curves by
purely algebraic means, using Richelot's transformation of a genus 2 curve. It
is shown that this isogeny respects the Hamiltonian flows. The two curves are
completed into an infinite tower of genus 2 curves with isogeneous Jacobians.
","[{""version"":""v1"",""created"":""Mon, 1 Jun 1998 13:16:15 GMT""}]","2016-09-07"
"nucl-th/9806002","Silvia M. Lenzi","C.H. Dasso, S.M. Lenzi and A. Vitturi","Dominance of Nuclear Processes in the Dissociation of 8B","TEX file + 11 postscript figures","Nucl.Phys. A639 (1998) 635-653","10.1016/S0375-9474(98)00420-5","DFPD 98/NP/26","nucl-th",,"  We study the break-up of 8B in collisions with heavy-ions. The process is
described in terms of inelastic excitations leading to states in the continuum.
  The effects of the nuclear and coulomb fields are included on the same
footing in the microscopic construction of the transition matrix elements. The
interplay between coulomb and nuclear excitation processes differs
significantly from the situation encountered in reactions involving systems
close to the stability line. In particular, nuclear excitation is found to
remain predominant at energies well below the coulomb barrier,
","[{""version"":""v1"",""created"":""Mon, 1 Jun 1998 14:39:56 GMT""}]","2016-09-08"
"nucl-th/9806003","Adrian Dumitru","A. Dumitru, D.H. Rischke","Collective dynamics in highly relativistic heavy-ion collisions","30 pages, REVTEX, 8 eps-figures, results unchanged, however, major
  revision of parts of the manuscript and some of the figures","Phys.Rev.C59:354-363,1999","10.1103/PhysRevC.59.354","YRHI-98-10","nucl-th",,"  Hydrodynamics with cylindrical symmetry in transverse direction and
longitudinal scaling flow is employed to calculate the transverse momentum
spectra of various hadrons and clusters (e.g. pi, K, N, Phi, Lambda, d, He) in
central heavy-ion collisions at CERN-SPS and BNL-RHIC energies up to pT=4 GeV.
We discuss the sensitivity of these spectra with respect to the initial
transverse density profile as well as to the choice of ``freeze-out''
hypersurface. For SPS energy and pT<2 GeV, overall good agreement of the pT
distributions with data is found when freeze-out occurs along the T=130 MeV
isotherm. Even high-pT neutral pion data can be described for a particular
choice of the initial transverse density profile. It is shown that the average
transverse velocity <vT> of heavy hadrons and hadronic clusters is a good
measure for the collective flow velocity. The latter is found to be rather
similar for SPS and RHIC energies, due to the ``stall'' of the flow within the
long-lived mixed phase at RHIC. In case of thermalization and hydrodynamical
expansion, the mean transverse momentum <pT> increases linearly with the hadron
mass. In contrast, the string model FRITIOF7.02, which does not account for
rescattering of secondary hadrons, predicts a strong dependence of <pT> on the
quark composition of the hadron. Due to the different sensitivity to hard
processes, hadrons with charm (anti-)quarks acquire significantly more
transverse momentum than hadrons without c (or even without s) quarks.
","[{""version"":""v1"",""created"":""Mon, 1 Jun 1998 15:42:54 GMT""},{""version"":""v2"",""created"":""Wed, 10 Jun 1998 14:16:57 GMT""},{""version"":""v3"",""created"":""Sun, 5 Jul 1998 14:46:29 GMT""},{""version"":""v4"",""created"":""Wed, 16 Sep 1998 16:17:13 GMT""}]","2008-11-26"
