"astro-ph/9801145","Leo Alberto Girardi","Leo Girardi (MPA, Garching), Gianpaolo Bertelli (Dep. Astronomia,
  Padova)","The evolution of the V-K colours of single stellar populations","19 pages with 14 figures, submitted to MNRAS; some references
  corrected, main text unchanged","Mon.Not.Roy.Astron.Soc. 300 (1998) 533","10.1046/j.1365-8711.1998.01934.x","MPA 1074","astro-ph",,"  We discuss how the integrated V-K colours of single stellar populations
evolve with age and metallicity. Some of the uncertainties associated to the
properties of the underlying stellar models are throughfully discussed. First,
we present the effects that different formulations for the mass-loss rates
produce on the initial-final mass relation, and hence on the integrated
colours. Second, we describe the colour changes occurring at the onset of the
AGB and RGB stars. The onset of the AGB is marked by a colour jump to the red,
whose amplitude is highly dependent on the metallicity and mass-loss rates
adopted in the models. The overluminosity with respect to the standard Mc-L
relation, that occurs in the most massive AGB stars, causes a smoothing of this
colour jump. On the other hand, we find that a transient red phase takes place
~1.5x10^8 yr after the RGB develops. We then discuss the possible reasons for
the transition of V-K colours (from ~1.5 to 3) that takes place in LMC clusters
of SWB type IV. A revision of the ages attributed to the clusters reveals that
the transition may not be as fast as originally suggested. A gradual (or
delayed) transition of the colours, as predicted by models which include the
overluminosity of the most massive AGB stars, describes better the data than
the sudden colour-jump predicted by classical models.
","[{""version"":""v1"",""created"":""Thu, 15 Jan 1998 09:24:41 GMT""},{""version"":""v2"",""created"":""Wed, 25 Feb 1998 13:45:26 GMT""}]","2009-10-30"
"astro-ph/9801146","Vincet Le Brun","Patrick Boisse (ENS Paris), Vincent Le Brun (LAS du CNRS/IGRAP),
  Jacqueline Bergeron (ESO, IAP), Jean-Michel Deharveng (LAS du CNRS/IGRAP)","A HST Spectroscopic study of QSOs with intermediate redshift damped
  Lyman-alpha systems","23 pages, 19 figures, uses aa.cls",,,,"astro-ph",,"  We present HST spectra for a sample of six QSOs with intermediate redshift
(z_a < 1) damped Ly-alpha systems. These observations aim at measuring the HI
column density and detect metal lines in order to investigate the metal
enrichment of the gas, as well as the presence of neutral species, molecules
and dust. All systems selected on the basis of 21 cm absorption and/or strong
FeII lines relative to MgII ones turn out to have N(HI) larger than 10^20 cm-2.
It appears that although the scatter of metallicities is as large at z_a<1 as
at high redshift, an increasing proportion of systems with metallicities ~ 30%
solar are found when going at lower redshifts. Our results suggest that
available observations may be biased against dust-rich absorbers. Further, when
all available measurements of N(HI) and [Zn/H] are considered, a clear
deficiency of systems with large N(HI) and high metallicity is apparent. We
conclude that dust extinction causes a preferential selection of QSOs with
intervening gas relatively poor in metals, dust and molecules. As a
consequence, the high end of the HI column density distribution (and hence
Omega_g, the contribution of neutral gas to the cosmological mass density) is
probably more heavily underestimated than previously thought, especially at low
redshift. Such a bias could also explain the high incidence of non-spiral
morphologies in our sample. We stress that observation of a larger sample of
low z damped Ly-alpha systems as well as surveys of damped Ly-alpha systems in
fainter QSOs would give a more representative view of the true diversity of
absorber properties and should help to probe the denser phases of the
interstellar medium in distant galaxies.
","[{""version"":""v1"",""created"":""Thu, 15 Jan 1998 09:55:31 GMT""}]","2007-05-23"
"astro-ph/9801147","Axel Lindner","A. Lindner","A New Method to Reconstruct the Energy and Determine the Composition of
  Cosmic Rays from the Measurement of Cherenkov Light and Particle Densities in
  Extensive Air Showers","27 pages, 12 eps figures, accepted in Astroparticle Physics",,,"HH-HEGRA/97-03","astro-ph",,"  A Monte-Carlo study to reconstruct energy and mass of cosmic rays with
energies above 300 TeV using ground based measurements of the electromagnetic
part of showers initiated in the atmosphere is presented. The shower properties
determined with two detector arrays measuring the air Cherenkov light and the
particle densities as realized at the HEGRA experiment are processed to
determine the energy of the primary particle without the need of any hypothesis
concerning its mass. The mass of the primary particle is reconstructed coarsely
from the same observables in parallel to the energy determination.
","[{""version"":""v1"",""created"":""Thu, 15 Jan 1998 10:19:27 GMT""}]","2007-05-23"
"astro-ph/9801148","Andrew Liddle","Andrew R Liddle","Inflation and the cosmic microwave background","8 pages LaTeX file, with two figures incorporated using epsf. To
  appear, proceedings of `The non-sleeping universe', Porto (Astrophysics and
  Space Science)","Phys.Rept. 307 (1998) 53-60","10.1023/A:1002011707987","SUSSEX-AST 98/1-1","astro-ph",,"  I give a status report and outlook concerning the use of the cosmic microwave
background anisotropies to constrain the inflationary cosmology, and stress its
crucial role as an underlying paradigm for the estimation of cosmological
parameters.
","[{""version"":""v1"",""created"":""Thu, 15 Jan 1998 12:17:30 GMT""}]","2009-10-30"
"astro-ph/9801149","Ian Waddington","Ian Waddington (University of Edinburgh)","Near-Infrared Imaging of a Group or Cluster of Galaxies at a Redshift of
  2.39","6 pages, 3 figures, LaTeX, uses paspconf.sty and epsf.sty. To be
  published in ""The Young Universe: Galaxy Formation and Evolution at
  Intermediate and High Redshift"", 1998, S. D'Odorico, A. Fontana & E.
  Giallongo (eds), (ASP)",,,,"astro-ph",,"  At z=2.39, the cluster around 53W002 is one of the most distant groups or
clusters of galaxies known to date. At this redshift the 4000A-break falls
between the J and H bands, thus our infrared observations are designed to
identify cluster members by a red J-H colour. Out of the 42 objects we have
detected in the field, we find ten galaxies with J-H>1.0 and K>18.8, redder and
fainter than the radio galaxy, and consistent with the presence of a
4000A-break at the cluster redshift. Two of these reddest galaxies have been
confirmed spectroscopically. The colours, sizes and location of these
infrared-selected galaxies suggest a cluster much more similar to those nearby
than revealed by Hubble Space Telescope observations alone.
","[{""version"":""v1"",""created"":""Thu, 15 Jan 1998 12:42:58 GMT""}]","2007-05-23"
"astro-ph/9801150","Ignacio Ferreras","I. Ferreras, N. Benitez, E. Martinez-Gonzalez (IFCA-UC)","Imaging around PC1643+4631A at the Lyman limit","5 pages LaTeX (aa.cls), plus 4 EPS figures. Accepted in Astronomy &
  Astrophysics",,,,"astro-ph",,"  We present a list of candidates for high redshift late-type galaxies in the
field around the z=3.79 quasar PC1643+4631A. Deep U,V and R imaging has been
used to search for objects with a strong Lyman break between U and V,
characteristic of galaxies with high hydrogen column densities at $z\sim 3$. A
further study of the red objects detected by Hu & Ridgway (1994) has been done,
allowing the temptative identification of many of them as low redshift ($z\sim
0.4$) elliptical galaxies.
","[{""version"":""v1"",""created"":""Thu, 15 Jan 1998 13:39:08 GMT""}]","2007-05-23"
"astro-ph/9801151","Francesco Sylos Labini","F. Sylos Labini, M. Montuori and L. Pietronero","Comment on the paper by L. Guzzo ""Is the Universe homogeneous ?""","22 pages, latex, 5 postscirpt figures, sub,itted to New Astronomy,
  also available at http://www.phys.uniroma1.it/DOCS/PIL/pil.html",,,,"astro-ph",,"  This comment is in response to the paper by L. Guzzo recently appeared in
``New Astronomy'' related to our work.
  The subject of the discussion concerns the correlation properties of galaxy
distribution in the available 3-d samples. There is a general agreement that
galaxy structures exhibit fractal properties, at least up to some scale.
However the presence of an eventual crossover towards homogenization, as well
as the exact value of the fractal dimension, are still matter of debate.
  Here we briefly summarize our point of view by discussing three main topics.
The first one is methodological, i.e. we clarify which are the correct methods
to detect the real correlations properties of the 3-d galaxy distribution.
  Then we discuss the results of the analysis of several samples in two ranges
of scales. In the first range of scale, below $100 \div 200 \hmp$, the
statistical quality of the data is rather good, and we find that galaxy
distribution has fractal properties with $D \approx2$.
  At larger distances the statistical robustness of the present data is weaker,
but, we show that there is evidence for a continuation of the fractal behavior,
without any tendency towards homogenization.
","[{""version"":""v1"",""created"":""Thu, 15 Jan 1998 14:24:13 GMT""}]","2016-08-30"
"chao-dyn/9801021",,"Awadhesh Prasad and Ramakrishna Ramaswamy","Finite-time Lyapunov exponents of Strange Nonchaotic Attractors","5 postscript figures; to appear in the proceedings of the conf on
  nonlinear dynamics: integrability and chaos (Bharathidasan university, India)",,,,"chao-dyn nlin.CD",,"  The probability distribution of finite-time Lyapunov exponents provides an
important characterization of dynamical attractors. We study such distributions
for strange nonchaotic attractors (SNAs) created through several different
mechanisms in quasiperiodically forced nonlinear dynamical systems. Statistical
properties of the distributions such as the variance and the skewness also
distinguish between SNAs formed by different bifurcation routes.
","[{""version"":""v1"",""created"":""Thu, 15 Jan 1998 07:27:23 GMT""}]","2007-05-23"
"chao-dyn/9801022","Krzysztof Kowalski","Krzysztof Kowalski","A hypothesis concerning ""quantal"" Hilbert space criterion of chaos in
  nonlinear dynamical systems","10 pages LaTeX","Chaos, Solitons & Fractals 7 (1996) 653-657",,"DB-95-15","chao-dyn nlin.CD quant-ph",,"  Based on the Hilbert space approach to the theory of nonlinear dynamical
systems developed by the author a hypothesis is formulated concerning the
""quantal"" criterion for classical ordinary differential systems to exhibit
chaotic behaviour.
","[{""version"":""v1"",""created"":""Thu, 15 Jan 1998 07:53:04 GMT""},{""version"":""v2"",""created"":""Sat, 6 Mar 1999 11:14:14 GMT""}]","2007-05-23"
"chao-dyn/9801023","Matrasulov Davron","D.Matrasulov","Stochastic Ionization of Relativistic Hydrogen-Like Atom","4 pages, no figures, LaTeX",,"10.1134/1.1259295",,"chao-dyn nlin.CD physics.atom-ph",,"  Stochastic ionization of highly excited relativistic hydrogenlike atom in the
monochromatic field is considered. A theoretical analisis of chaotic dynamics
of the electron based on Chirikov's criterion is given. Critical value of the
external field is evaluated analytically.
","[{""version"":""v1"",""created"":""Thu, 15 Jan 1998 08:38:51 GMT""}]","2009-10-31"
"chao-dyn/9801024",,"Ramakrishna Ramaswamy, Sudeshna Sinha and Neelima Gupte","Targetting Chaos through Adaptive Control","3 postscript figures; to appear in Phys Rev E",,"10.1103/PhysRevE.57.R2507",,"chao-dyn nlin.CD",,"  We describe adaptive control algorithms whereby a chaotic dynamical system
can be steered to a target state with desired characteristics. A specific
implementation considered has the objective of directing the system to a state
which is more chaotic or mixed than the uncontrolled one. This methodology is
easy to implement in discrete or continuous dynamical systems. It is robust and
efficient, and has the additional advantage that knowledge of the detailed
behaviour of the system is not required.
","[{""version"":""v1"",""created"":""Thu, 15 Jan 1998 10:39:16 GMT""}]","2009-10-31"
"cmp-lg/9801001","Eric Sven Ristad","Eric Sven Ristad and Robert G. Thomas","Hierarchical Non-Emitting Markov Models","http://www.cs.princeton.edu/~ristad/papers/pu-544-97.ps.gz",,,"CS-TR-544-97","cmp-lg cs.CL",,"  We describe a simple variant of the interpolated Markov model with
non-emitting state transitions and prove that it is strictly more powerful than
any Markov model. More importantly, the non-emitting model outperforms the
classic interpolated model on the natural language texts under a wide range of
experimental conditions, with only a modest increase in computational
requirements. The non-emitting model is also much less prone to overfitting.
  Keywords: Markov model, interpolated Markov model, hidden Markov model,
mixture modeling, non-emitting state transitions, state-conditional
interpolation, statistical language model, discrete time series, Brown corpus,
Wall Street Journal.
","[{""version"":""v1"",""created"":""Wed, 14 Jan 1998 23:20:23 GMT""},{""version"":""v2"",""created"":""Thu, 15 Jan 1998 13:07:11 GMT""},{""version"":""v3"",""created"":""Tue, 20 Jan 1998 17:46:35 GMT""}]","2007-05-23"
"cond-mat/9801141","Vittorio Loreto","A. Puglisi (Univ. ''La Sapienza'' Roma), V. Loreto (ESPCI - Paris), U.
  Marini Bettolo Marconi (Univ. di Camerino), A. Petri (CNR - Istituto di
  Acustica O.M.Corbino), A. Vulpiani (Univ. ''La sapienza'' Roma)","Clustering and Non-Gaussian Behavior in Granular Matter","4 pages including 3 eps figures, LaTex, added references, corrected
  typos, minimally changed contents and abstract, to published in
  Phys.Rev.Lett. (tentatively on 28th of October, 1998)",,"10.1103/PhysRevLett.81.3848",,"cond-mat.stat-mech",,"  We investigate the properties of a model of granular matter consisting of $N$
Brownian particles on a line subject to inelastic mutual collisions. This model
displays a genuine thermodynamic limit for the mean values of the energy and
the energy dissipation. When the typical relaxation time $\tau$ associated with
the Brownian process is small compared with the mean collision time $\tau_c$
the spatial density is nearly homogeneous and the velocity probability
distribution is gaussian. In the opposite limit $\tau \gg \tau_c$ one has
strong spatial clustering, with a fractal distribution of particles, and the
velocity probability distribution strongly deviates from the gaussian one.
","[{""version"":""v1"",""created"":""Wed, 14 Jan 1998 16:00:25 GMT""},{""version"":""v2"",""created"":""Tue, 6 Oct 1998 16:56:24 GMT""}]","2009-10-31"
"cond-mat/9801142","M. A. Baranov","M.A. Baranov","Single-particle excitations and the order parameter for a trapped
  superfluid Fermi gas","5 pages, RevTeX, 2 eps figures",,"10.1134/1.568187",,"cond-mat.stat-mech",,"  We reveal a strong influence of a superfluid phase transition on the
character of single-particle excitations of a trapped neutral-atom Fermi gas.
Below the transition temperature the presence of a spatially inhomogeneous
order parameter (gap) shifts up the excitation eigenenergies and leads to the
appearance of in-gap excitations localized in the outer part of the gas sample.
The eigenenergies become sensitive to the gas temperature and are no longer
multiples of the trap frequencies. These features should manifest themselves in
a strong change of the density oscillations induced by modulations of the trap
frequencies and can be used for identifying the superfluid phase transition.
","[{""version"":""v1"",""created"":""Wed, 14 Jan 1998 16:28:22 GMT""},{""version"":""v2"",""created"":""Tue, 24 Nov 1998 11:36:14 GMT""}]","2009-10-31"
"cond-mat/9801143","Mariusz Bednarz","E.A. Bartnik, M. Bednarz","Influence of exciton-phonon interaction on long energy transport in
  J-aggregates","LaTeX209, 8 pages, 6 Postscript figures, uses epsf",,,"IFT-01-98","cond-mat",,"  This paper presents a theoretical model intended to address the question of
energy transfer in two-dimensional molecular assemblies such as Scheibe
aggregates. A new phonon-exciton interaction is introduced to explain the
exciton width in J aggregates. It is shown that the long range energy transport
can occur for weakly interacting acceptors.
","[{""version"":""v1"",""created"":""Wed, 14 Jan 1998 16:41:32 GMT""}]","2009-09-25"
"cond-mat/9801144","Alex Koshelev","A.E.Koshelev and V.M.Vinokur","Pinning-induced transition to disordered vortex phase in layered
  superconductors","8 pages, 3 Postscript figures. Accepted to Phys. Rev.B. (regular
  article)","Phys. Rev. B, Vol. 57, 8026 (1998)","10.1103/PhysRevB.57.8026",,"cond-mat.supr-con cond-mat.mtrl-sci cond-mat.stat-mech",,"  Destruction of the vortex lattice by random point pinning is considered as a
mechanism of the ``second peak'' transition observed experimentally in weakly
coupled layered high temperature superconductors. The transition field
separating the topologically ordered quasilattice from the amorphous vortex
configuration is strongly influenced by the layered structure and by the
nonlocal nature of the vortex tilt energy due to the magnetic interlayer
coupling. We found three different regimes of transition depending on the
relative strength of the Josephson and magnetic couplings. The regimes can be
distinguished by the dependence of the transition field
","[{""version"":""v1"",""created"":""Wed, 14 Jan 1998 17:36:42 GMT""}]","2009-10-31"
"cond-mat/9801145","Peter Kopietz","Peter Kopietz","Vertex corrections in gauge theories for two-dimensional condensed
  matter systems","6 figures","Int.J.Mod.Phys. B12 (1998) 1673-1692","10.1142/S0217979298000910",,"cond-mat.str-el",,"  We calculate the self-energy of two-dimensional fermions that are coupled to
transverse gauge fields, taking two-loop corrections into account. Given a bare
gauge field propagator that diverges for small momentum transfers q as 1 /
q^{eta}, 1 < eta < 2, the fermionic self-energy without vertex corrections
vanishes for small frequencies omega as Sigma (omega) propto omega^{gamma with
gamma = {frac{2}{1 + eta}} < 1. We show that inclusion of the leading radiative
correction to the fermion - gauge field vertex leads to
  Sigma (omega) propto omega^{gamma} [ 1 - a_{eta} ln (omega_0 / omega) ],
  where a_{\eta} is a positive numerical constant and omega_0 is some finite
energy scale. The negative logarithmic correction is consistent with the
scenario that higher order vertex corrections push the exponent gamma to larger
values.
","[{""version"":""v1"",""created"":""Wed, 14 Jan 1998 17:58:06 GMT""}]","2015-06-25"
"cond-mat/9801146","Tomas Jungwirth","T. Jungwirth and A.H. MacDonald","Circuit model for spin-bottleneck resistance in magnetic-tunnel-junction
  devices","4 pages, 3 figures, submitted to Phys. Rev. B",,"10.1016/S0038-1098(98)00357-3",,"cond-mat",,"  Spin-bottlenecks are created in magnetic-tunnel-junction devices by spatial
inhomogeneity in the relative resistances for up and down spins. We propose a
simple electrical circuit model for these devices which incorporates
spin-bottleneck effects and can be used to calculate their overall resistance
and magnetoresistance. The model permits a simple understanding of the
dependence of device magnetoresistance on spin diffusion lengths, tunneling
magnetoresistance, and majority and minority spin resistivities in the
ferromagnetic electrodes. The circuit model is in a good quantitative agreement
with detailed transport calculations.
","[{""version"":""v1"",""created"":""Wed, 14 Jan 1998 22:13:39 GMT""}]","2009-10-31"
"cond-mat/9801147","Sidney Redner","S. Datta and S. Redner","Gradient Clogging in Depth Filtration","4 pages, 3 figures, RevTeX","Phys. Rev. E 58 R1203-R1206 (1998).","10.1103/PhysRevE.58.R1203",,"cond-mat.stat-mech cond-mat.soft",,"  We investigate clogging in depth filtration, in which a dirty fluid is
``cleaned'' by the trapping of dirt particles within the pore space during flow
through a porous medium. This leads to a gradient percolation process which
exhibits a power law distribution for the density of trapped particles at
downstream distance x from the input. To achieve a non-pathological clogging
(percolation) threshold, the system length L should scale no faster than a
power of ln w, where w is the width. Non-trivial behavior for the permeability
arises only in this extreme anisotropic geometry.
","[{""version"":""v1"",""created"":""Wed, 14 Jan 1998 22:17:12 GMT""}]","2009-10-31"
"cond-mat/9801148","Vladimir Bazhanov","R.J.Baxter","A direct proof of Kim's identities","Latex, 6 pages, accepted by J. Physics A","J.Phys.A31:1105-1108,1998","10.1088/0305-4470/31/3/020",,"cond-mat.stat-mech",,"  As a by-product of a finite-size Bethe Ansatz calculation in statistical
mechanics, Doochul Kim has established, by an indirect route, three
mathematical identities rather similar to the conjugate modulus relations
satisfied by the elliptic theta constants. However, they contain factors like
$1 - q^{\sqrt{n}}$ and $1 - q^{n^2}$, instead of $1 - q^n$. We show here that
there is a fourth relation that naturally completes the set, in much the same
way that there are four relations for the four elliptic theta functions. We
derive all of them directly by proving and using a specialization of
Weierstrass' factorization theorem in complex variable theory.
","[{""version"":""v1"",""created"":""Thu, 15 Jan 1998 03:09:30 GMT""}]","2008-11-26"
"cond-mat/9801149","Yao-Zhong Zhang","Yao-Zhong Zhang and Huan-Qiang Zhou","Nine classes of integrable boundary conditions for the eight-state
  supersymmetric fermion model","7 pages, RevTex; the paper has been shorten and some changes (mainly
  cosmetic) have been made to satisfy referees' comments","J. Phys. A31 (1998) 7051-7059","10.1088/0305-4470/31/34/008","University of Queensland preprint","cond-mat.str-el",,"  Nine classes of integrable boundary conditions for the eight-state
supersymmetric model of strongly correlated fermions are presented. The
boundary systems are solved by using the coordinate Bethe ansatz method and the
Bethe ansatz equations for all nine cases are given.
","[{""version"":""v1"",""created"":""Thu, 15 Jan 1998 04:48:36 GMT""},{""version"":""v2"",""created"":""Sun, 24 May 1998 05:26:24 GMT""}]","2009-10-31"
"cond-mat/9801150","Yong-Jihn Kim","Yong-Jihn Kim","Reinvestigation of Inhomogeneous Superconductors and High $T_{c}$
  Superconductors","41 pages, latex, no figures, appeared in the book entitled
  ""Reinvestigation of inhomogeneous superconductors and high $T_{c}$
  superconductors"" by Yong-Jihn Kim, 220 pages, price : $7, Ockchun Press,
  Seoul, Korea, 1998. For more information, please see
  http://taesan.kaist.ac.kr/~yjkim",,,,"cond-mat.supr-con cond-mat.mes-hall cond-mat.str-el",,"  We review the recent progress in the theory of inhomogeneous superconductors.
It was shown that Gor'kov's self-consistency equation needs a pairing
constraint derived from the Anomalous Green's function. The Bogoliubov-de
Gennes equations also need a pairing constraint in order to obtain a correct
vacuum state by the corresponding unitary transformation. This new study opens
up a reinvestigation of inhomogeneous superconductors. We discuss (i) problems
of the conventional Green's function theory, (ii) reinvestigation of impure
superconductors, and (iii) impurity doping effect in high $T_{c}$
superconductors. It is also pointed out that a new formalism is required to
tackle the macroscopically or mesoscopically inhomogeneous systems such as the
junction and the vortex problems.
","[{""version"":""v1"",""created"":""Thu, 15 Jan 1998 06:42:19 GMT""}]","2007-05-23"
"cond-mat/9801151","Tsuyoshi Hondou","Tsuyoshi Hondou","Transformation of dynamical fluctuation into coherent energy","3 pages, 2 figures; submitted to Phys. Rev. Lett",,"10.1143/JPSJ.67.1818",,"cond-mat.soft cond-mat.stat-mech",,"  Studies of noise-induced motions are showing that coherent energy can be
extracted from some kinds of noise in a periodic ratchet.
  Recently, energetics of Langevin dynamics is formulated by Sekimoto
[J.Phys.Soc.Jpn, 66 1234 (1997)], which can be applied to ratchet systems
described by Fokker-Planck equation. In this paper, we derive an energetics of
ratchet systems that can be applied to dynamical-noise-induced motion in a
static potential. Analytical efficiency of the energy transformation is derived
for the dynamical noise in an overdumping limit of the system.
  Comparison between analytical and numerical studies is performed for chaotic
noise.
","[{""version"":""v1"",""created"":""Thu, 15 Jan 1998 07:51:33 GMT""}]","2009-10-31"
