"cond-mat/9801152","Jonathan Doye","Jonathan Doye, David Wales","Structural Transitions and Global Minima of Sodium Chloride Clusters","extended version, 13 pages, 8 figures, revtex","Physical Review B, 59, 2292-2300 (1999)","10.1103/PhysRevB.59.2292",,"cond-mat physics.atm-clus",,"  In recent experiments on sodium chloride clusters structural transitions
between nanocrystals with different cuboidal shapes were detected. Here we
determine reaction pathways between the low energy isomers of one of these
clusters, (NaCl)35Cl-. The key process in these structural transitions is a
highly cooperative rearrangement in which two parts of the nanocrystal slip
past one another on a {110} plane in a <1-10> direction. In this way the
nanocrystals can plastically deform, in contrast to the brittle behaviour of
bulk sodium chloride crystals at the same temperatures; the nanocrystals have
mechanical properties which are a unique feature of their finite size. We also
report and compare the global potential energy minima for (NaCl)NCl- using two
empirical potentials, and comment on the effect of polarization.
","[{""version"":""v1"",""created"":""Thu, 15 Jan 1998 09:33:40 GMT""},{""version"":""v2"",""created"":""Mon, 27 Jul 1998 18:51:10 GMT""}]","2007-05-23"
"cond-mat/9801153","Albert Toelle","A. Toelle (1), H. Schober, J. Wuttke, F. Fujara ((1) Institut of
  Physics, Dortmund, Germany)","Fast relaxation in a fragile liquid under pressure","4 Pages of RevTeX, 4 figures (submitted to Physical Review Letters)","Phys. Rev. Lett. 80, 2374 (1998)","10.1103/PhysRevLett.80.2374","EIIIb_at_9702","cond-mat.stat-mech cond-mat.dis-nn",,"  The incoherent dynamic structure factor of ortho-terphenyl has been measured
by neutron time-of-flight and backscattering technique in the pressure range
from 0.1 MPa to 240 MPa for temperatures between 301 K and 335 K.
Tagged-particle correlations in the compressed liquid decay in two steps. The
alpha-relaxation lineshape is independent of pressure, and the relaxation time
proportional to viscosity. A kink in the amplitude f_Q(P) reveals the onset of
beta relaxation. The beta-relaxation regime can be described by the
mode-coupling scaling function; amplitudes and time scales allow a consistent
determination of the critical pressure P_c(T). alpha and beta relaxation depend
in the same way on the thermodynamic state; close to the mode-coupling
cross-over, this dependence can be parametrised by an effective coupling Gamma
~ n*T**{-1/4}.
","[{""version"":""v1"",""created"":""Thu, 15 Jan 1998 10:37:49 GMT""}]","2011-04-05"
"cond-mat/9801154","Ulrich Nowak","D. Hinzke and U. Nowak","Magnetization switching in a Heisenberg model for small ferromagnetic
  particles","8 pages, Revtex, 11 Figures included","Phys. Rev. B 58, 265 (1998)","10.1103/PhysRevB.58.265","HR-98","cond-mat.stat-mech",,"  We investigate the thermally activated magnetization switching of small
ferromagnetic particles driven by an external magnetic field. For low uniaxial
anisotropy the spins can be expected to rotate coherently, while for sufficient
large anisotropy they should behave Ising-like, i.e., the switching should then
be due to nucleation. We study this crossover from coherent rotation to
nucleation for the classical three-dimensional Heisenberg model with a finite
anisotropy. The crossover is influenced by the size of the particle, the
strength of the driving magnetic field, and the anisotropy. We discuss the
relevant energy barriers which have to be overcome during the switching, and
find theoretical arguments which yield the energetically favorable reversal
mechanisms for given values of the quantities above. The results are confirmed
by Monte Carlo simulations of Heisenberg and Ising models.
","[{""version"":""v1"",""created"":""Thu, 15 Jan 1998 13:00:56 GMT""},{""version"":""v2"",""created"":""Thu, 17 Sep 1998 10:15:39 GMT""}]","2009-10-31"
"cond-mat/9801155","Silvio Franz","Miguel Cardenas, Silvio Franz and Giorgio Parisi","Constrained Boltzmann-Gibbs measures and effective potential for glasses
  in hypernetted chain approximation and numerical simulations","16 pages, 11 eps figures","J. Chem. Phys. 110 (1999) 1726","10.1063/1.478028",,"cond-mat.stat-mech cond-mat.dis-nn",,"  By means of an effective potential associated to a constrained equilibrium
measure and apt to study frozen systems, we investigate glassy freezing in
simple liquids in the hypernetted chain (HNC) approximation. Differently from
other classical approximations of liquid theory, freezing is naturally embedded
in the HNC approximation. We get a detailed description of the freezing
transition that is analogous to the one got in a large class of mean-field long
range spin glass. We compare our findings with Monte Carlo simulations of the
same system and conclude that many of the qualitative features of the
transition are captured by the approximated theory.
","[{""version"":""v1"",""created"":""Thu, 15 Jan 1998 13:28:52 GMT""}]","2009-10-31"
"cond-mat/9801156","A. Zyuzin","Alexander Zyuzin (A.F.Ioffe Physical-Technical Institute,
  St.Petersburg, Russia)","Superfluorescence of Photonic Paint","12 pages, latex, to be published in Sov.Phys.JETP",,"10.1134/1.558488",,"cond-mat.dis-nn",,"  We consider the cooperative decay of incoherently pumped atoms in a
disordered medium, where light undergoes multiple scattering. It is shown that
the cooperation number, which determines the duration and amplitude of
superfluorescent impulses, is given by the number of atoms along a diffusive
trajectory of the light propagating through the medium. We also consider the
problem of reflection of a probe wave during cooperative emission.
","[{""version"":""v1"",""created"":""Thu, 15 Jan 1998 14:57:07 GMT""}]","2009-10-31"
"cond-mat/9801157",,"E. Louis, F. Guinea, M. P. Lopez Sancho and J. A. Verges","Hole Pairs in the Two-Dimensional Hubbard Model","4 pages",,"10.1209/epl/i1998-00461-5",,"cond-mat.str-el",,"  The interactions between holes in the Hubbard model, in the low density,
intermediate to strong coupling limit, are investigated. Dressed spin polarons
in neighboring sites have an increased kinetic energy and an enhanced hopping
rate. Both effects are of the order of the hopping integral and lead to an
effective attraction at intermediate couplings. Our results are derived by
systematically improving mean field calculations. The method can also be used
to derive known properties of isolated spin polarons.
","[{""version"":""v1"",""created"":""Thu, 15 Jan 1998 15:04:12 GMT""}]","2009-10-31"
"cond-mat/9801158","Paul Zinn-Justin","N. Andrei and P. Zinn-Justin","The generalized multi-channel Kondo model: Thermodynamics and fusion
  equations","41 pages, 8 figures, harvmac","Nucl. Phys. B528 (1998), 648","10.1016/S0550-3213(98)00387-3",,"cond-mat hep-th",,"  The SU(N) generalization of the multi-channel Kondo model with arbitrary
rectangular impurity representations is considered by means of the Bethe
Ansatz. The thermodynamics of the model is analyzed by introducing modified
fusion equations for the impurity, leading to a simple description of the
different IR fixed points of the theory. The entropy at zero temperature is
discussed; in particular the overscreened case is explained in terms of quantum
group representation.
","[{""version"":""v1"",""created"":""Thu, 15 Jan 1998 15:25:24 GMT""}]","2009-10-31"
"cs/9801103","Maggie McLoughlin","Donald E. Knuth","Linear probing and graphs",,"Algorithmica 22 (1998), no. 4, 561--568",,"Knuth migration 11/2004","cs.DS",,"  Mallows and Riordan showed in 1968 that labeled trees with a small number of
inversions are related to labeled graphs that are connected and sparse. Wright
enumerated sparse connected graphs in 1977, and Kreweras related the inversions
of trees to the so-called ``parking problem'' in 1980. A~combination of these
three results leads to a surprisingly simple analysis of the behavior of
hashing by linear probing, including higher moments of the cost of successful
search.
","[{""version"":""v1"",""created"":""Thu, 15 Jan 1998 00:00:00 GMT""}]","2007-05-23"
"gr-qc/9801045","Remo Garattini","Remo Garattini","Space-time Foam, Casimir energy and black hole pair creation","Revtex 3.0, 9 pages, to appear in Mod. Phys. Lett. A","Mod.Phys.Lett. A13 (1998) 159-164","10.1142/S0217732398000206",,"gr-qc hep-th",,"  We conjecture that the neutral black hole pair production is related to the
vacuum fluctuation of pure gravity via the Casimir-like energy. Implications on
the foam-like structure of spacetime are discussed.
","[{""version"":""v1"",""created"":""Wed, 14 Jan 1998 22:55:29 GMT""}]","2009-10-31"
"gr-qc/9801050","Gerard Clement","K.A. Bronnikov, G. Cl\'ement, C.P. Constantinidis and J.C. Fabris","Structure and stability of cold scalar-tensor black holes","8 pages, Latex","Phys.Lett. A243 (1998) 121-127","10.1016/S0375-9601(98)00133-9","GCR-98/01/02","gr-qc",,"  We study the structure and stability of the recently discussed spherically
symmetric Brans-Dicke black-hole type solutions with an infinite horizon area
and zero Hawking temperature, existing for negative values of the coupling
constant $\omega$. These solutions split into two classes: B1, whose horizon is
reached by an infalling particle in a finite proper time, and B2, for which
this proper time is infinite. Class B1 metrics are shown to be extendable
beyond the horizon only for discrete values of mass and scalar charge,
depending on two integers $m$ and $n$. In the case of even $m-n$ the space-time
is globally regular; for odd $m$ the metric changes its signature at the
horizon. All spherically symmetric solutions of the Brans-Dicke theory with
$\omega<-3/2$ are shown to be linearly stable against spherically symmetric
\pns. This result extends to the generic case of the Bergmann-Wagoner class of
scalar-tensor theories of gravity with the coupling function $\omega(\phi) <
-3/2$.
","[{""version"":""v1"",""created"":""Wed, 14 Jan 1998 16:11:52 GMT""}]","2009-10-31"
"gr-qc/9801051","S. Antoci","S. Antoci","Microscopic Fields and Macroscopic Averages in Einstein's Unified Field
  Theory","22 pages, plain TeX","AnnalesFond.Broglie21:11-38,1996",,,"gr-qc",,"  The relation between microscopic and macroscopic entities in the generally
covariant theories is considered, and it is argued that a sensible definition
of the macroscopic averages requires a restriction of the allowed
transformations of coordinates. Spacetime averages of the geometric objects of
Einstein's unified field theory are then defined, and the reconstruction of
some features of macroscopic reality from hypothetic microscopic structures is
attempted. It is shown how a fluctuating microscopic behaviour of the metric
field can rule the constitutive relation for electromagnetism both in vacuo and
in nondispersive material media. Moreover, if both the metric and the skew
tensor density that represents the electric displacement and the magnetic field
are assumed to possess a wavy microscopic structure, nonvanishing generalized
force densities can appear in the continuum. They originate from a resonance
process, in which at least three waves need to be involved. This process only
occurs if the wavevectors fulfil the three-wave resonance condition, so
ubiquitous in quantum physics. The wavy behaviour of the metric is essential
for the occurrence of this resonance phenomenon.
","[{""version"":""v1"",""created"":""Thu, 15 Jan 1998 09:29:21 GMT""}]","2008-11-26"
"gr-qc/9801052","Jiri Podolsky","J. Podolsky","Interpretation of the Siklos solutions as exact gravitational waves in
  the anti-de Sitter universe","17 pages, to be published in Class. Quantum Gravity","Class.Quant.Grav. 15 (1998) 719-733","10.1088/0264-9381/15/3/019","KTF MFF UK JP1","gr-qc",,"  The Siklos class of solutions of Einstein's field equations is investigated
by analytical methods. By studying the behaviour of free particles we reach the
conclusion that the space-times represent exact gravitational waves propagating
in the anti-de Sitter universe. The presence of a negative cosmological
constant implies that the 'background' space is not asymptotically flat and
requires a 'rotating' reference frames in order to fully simplify and view the
behaviour of nearby test particles. The Kaigorodov space-time, which is the
simplest representative of the Siklos class, is analyzed in more detail. It is
argued that it may serve as a 'cosmological' analogue of the well-known
homogeneous pp-waves in the flat universe.
","[{""version"":""v1"",""created"":""Thu, 15 Jan 1998 11:42:37 GMT""}]","2009-10-31"
"gr-qc/9801053","Tomas Ledvinka","T. Ledvinka, M. Zofka and J. Bicak","Relativistic Disks as Sources of Kerr-Newman Fields","3 pages, Latex. To appear in Proceedings of MG8 Meeting, Jerusalem,
  1997 (World Scientific, Singapore)",,,,"gr-qc",,"  If an appropriate region of Kerr-Newman space-time is removed and suitable
identifications are made, the resulting space-time can be interpreted as an
infinitely thin disk producing the original electromagnetic and gravitational
fields. We choose the shape of the regions removed in such a way that radial
pressures in the disks vanish. Even the very inner parts such as ergoregions
may exist around the disks. The surface energy-momentum tensor of the disks is
checked to satisfy the weak and strong energy conditions. To emphasize the
reality of these sources two models of the disks are presented: (i) rotating
conductive charged rings which are supported against collapse by their internal
pressure, (ii) two counter-rotating streams of charged particles moving along
circular electro-geodesics. All these disk sources form a three-dimensional
parameter space with specific electric charge Q/M, angular momentum a/M and the
size of the excluded region being the parameters.
","[{""version"":""v1"",""created"":""Thu, 15 Jan 1998 12:29:39 GMT""}]","2007-05-23"
"gr-qc/9801054","Jiri Podolsky","J. Podolsky, K. Vesely","New examples of sandwich gravitational waves and their impulsive limit","9 pages, to be published in Czech. J. Phys","Czech.J.Phys. 48 (1998) 871-878","10.1023/A:1022869004605","KTF MFF UK JP2","gr-qc",,"  Non-standard sandwich gravitational waves are constructed from the
homogeneous pp vacuum solution and the motions of free test particles in the
space-times are calculated explicitly. They demonstrate the caustic property of
sandwich waves. By performing limits to impulsive gravitational wave it is
demonstrated that the resulting particle motions are identical regardless of
the ''initial'' sandwich.
","[{""version"":""v1"",""created"":""Thu, 15 Jan 1998 15:22:27 GMT""}]","2009-10-31"
"hep-ex/9801013","Robin Devenish","Robin Devenish","PL3: Structure Functions","Extended version of writeup of plenary talk at EPS HEP97 Jerusalem.
  LaTeX 20 pages, 13 figures. Uses psfig and prhep97.sty",,,"OUNP-98-01","hep-ex",,"  Recent measurements of unpolarised and polarised nucleon structure functions
and F_2(gamma) are reviewed. The implications for QCD and the gluon momentum
distribution are discussed. The status of the understanding of the total
virtual-photon proton total cross-section in the transition region between real
photoproduction and deep-inelastic scattering is summarised briefly.
","[{""version"":""v1"",""created"":""Wed, 14 Jan 1998 17:47:11 GMT""}]","2007-05-23"
"hep-ex/9801014","Luc Demortier","F. Abe, et al. (CDF Collaboration)","Measurement of the Top Quark Mass","12 pages, including 2 figures; submitted to Phys. Rev. Lett","Phys.Rev.Lett.80:2767-2772,1998","10.1103/PhysRevLett.80.2767","Fermilab-Pub-97/284-E","hep-ex",,"  We present a measurement of the top quark mass using a sample of t-tbar
decays into an electron or a muon, a neutrino, and four jets. The data were
collected in p-pbar collisions at sqrt(s)=1.8 TeV with the Collider Detector at
Fermilab and correspond to an integrated luminosity of 109 pb^-1. We measure
the top quark mass to be 175.9 +/- 4.8(stat.) +/- 4.9(syst.) GeV/c^2.
","[{""version"":""v1"",""created"":""Thu, 15 Jan 1998 04:52:47 GMT""}]","2010-05-12"
"hep-lat/9801012","Arwed Schiller","M. G\""urtler, E.-M. Ilgenfritz, A. Schiller, C. Strecha","Hot Electroweak Matter Near to the Critical Higgs Mass","6 pages, 5 combined figures, LaTex with buckow1.sty, Talk at 31th
  Ahrenshoop Symp., Buckow, Sept. 1997",,,"HUB-EP-98/05, KANAZAWA 98-01","hep-lat hep-ph",,"  We discuss the end of the first order phase transition and the bound state
spectrum, both at weak transition and at the crossover.
","[{""version"":""v1"",""created"":""Wed, 14 Jan 1998 17:32:11 GMT""},{""version"":""v2"",""created"":""Fri, 16 Jan 1998 09:50:08 GMT""}]","2007-05-23"
"hep-lat/9801013","Don Weingarten","W. Lee and D. Weingarten","The Scalar Quarkonium Spectrum and Quarkonium-Glueball Mixing","3 pages, 4 PostScript figures, talk given at Lattice 97","Nucl.Phys.Proc.Suppl. 63 (1998) 194-196","10.1016/S0920-5632(97)00719-6","IBM-HET-97-1","hep-lat",,"  We evaluate the valence approximation to the mass of scalar quarkonium and to
the mixing energy between scalar quarkonium and the lightest scalar glueball
for a range of different lattice sizes and quark masses. Our results support
the identification of $f_0(1710)$ as the lightest scalar glueball.
","[{""version"":""v1"",""created"":""Wed, 14 Jan 1998 20:01:53 GMT""}]","2009-10-31"
"hep-lat/9801014","Vicente Azcoiti Perez","Vicente Azcoiti","The role of the Polyakov loop in the Dirac operator of QCD at finite
  temperature","Invited talk given at the 31st International Symposium Ahrenshoop on
  the Theory of Elementary Particles, Buckow (Berlin), September 1997. 6 pages,
  latex, file buckow1.sty included",,,"DFTUZ/98/3","hep-lat",,"  We show how all the contributions to the determinant of the
Dirac-Kogut-Susskind operator of QCD at finite temperature containing a net
number of Polyakov loops become irrelevant in the infinite volume limit. We
discuss also on two of the most interesting physical implications of this
result: i) the restoration of the Polyakov symmetry in the full theory with
dynamical fermions and ii) the total suppression of baryonic thermal
fluctuations in QCD at finite temperature.
","[{""version"":""v1"",""created"":""Wed, 14 Jan 1998 21:17:00 GMT""}]","2007-05-23"
"hep-lat/9801015","R. Narayanan","Robert G. Edwards, Urs M. Heller and Rajamani Narayanan","The hermitian Wilson-Dirac operator in smooth SU(2) instanton
  backgrounds","18 pages, Latex file, 12 postscript figures","Nucl.Phys. B522 (1998) 285-297","10.1016/S0550-3213(98)00270-3","FSU-SCRI-98-3","hep-lat",,"  We study the spectral flow of the hermitian Wilson-Dirac operator $\ham(m)$
as a function of $m$ in smooth SU(2) instanton backgrounds on the lattice. For
a single instanton background with Dirichlet boundary conditions on $\ham(m)$,
we find a level crossing in the spectral flow of $\ham(m)$, and we find the
shape of the crossing mode at the crossing point to be in good agreement with
the zero mode associated with the single instanton background. With
anti-periodic boundary conditions on $\ham(m)$, we find that the instanton
background in the singular gauge has the correct spectral flow but the one in
regular gauge does not. We also investigate the spectral flows of two instanton
and instanton-anti-instanton backgrounds.
","[{""version"":""v1"",""created"":""Wed, 14 Jan 1998 23:12:32 GMT""}]","2016-09-01"
"hep-ph/9801301","Thomas Paul","T. Paul and Z. Was","Inclusion of tau anomalous magnetic and electric dipole moments in the
  KORALZ Monte Carlo","14 pages, 9 figures",,,"L3 Note 2184","hep-ph",,"  We describe modifications made to KORALZ version 4.03 in order to allow for
anomalous magnetic and electric dipole moments of the tau. We discuss the
verification of the method at LEP 1 energies.
","[{""version"":""v1"",""created"":""Wed, 14 Jan 1998 16:03:35 GMT""}]","2007-05-23"
"hep-ph/9801302",,"R. Fiore, A. Flachi, L.L. Jenkovszky, F. Paccanoni","Pomeron Non Factorization in Diffractive Scattering at HERA","14 pages, Latex + 2 figures (postscript files)",,,"CS-TH 3/97","hep-ph",,"  Pomeron non factorization for the diffractive scattering is considered and an
analysis of experimental data is performed with different cuts in the momentum
fraction $\xi$. The results of the analysis are compared with the breaking
predicted in the Genovese-Nikolaev-Zakharov model.
","[{""version"":""v1"",""created"":""Wed, 14 Jan 1998 17:17:44 GMT""}]","2007-05-23"
"hep-ph/9801303","Karim Benakli","Karim Benakli","Modulino as natural candidate for a sterile neutrino","12 pages, latex, uses sprocl.sty",,,"CTP-TAMU-4/98","hep-ph hep-th",,"  We discuss the possible generation of R-parity violating bilinear terms $
\mu_i\bar L_i H_2$ in both cases of gravity and gauge mediated supersymmetry
breaking. Some phenomenological aspects are reviewed. In particular for
scenario where $ \mu_i$ depend on the vacuum expectation values of some fields
$S$, its fermionic partner $\tilde S$ plays the role of a sterile neutrino.
This situation is quiet generic in the case of models arising from M-theory
where $S$ is a modulus field. Observable effects are expected to be seen if the
mass and mixing of $\tilde S$ with active neutrinos lie in an interesting
region of parameters. This is naturally the case in gauge mediated
supersymmetry breaking and some class of no-scale supergravity models where the
gravitino mass is very small. For models with gravitino mass $m_{3/2}\sim$ TeV,
we discuss the possibility that the modulino mass is of the order of
$m^2_{3/2}/M_{Pl}$.
","[{""version"":""v1"",""created"":""Wed, 14 Jan 1998 17:19:23 GMT""}]","2007-05-23"
"hep-ph/9801304","Lynne Orr","Lynne H. Orr (Rochester) and W.J. Stirling (Durham)","The Collision Energy Dependence of Dijet Cross Sections as a Probe of
  BFKL Physics","13 pages LaTeX, uses epsf; Fig. 2 corrected; conclusions unchanged;
  version to be published in Phys. Lett. B","Phys.Lett. B429 (1998) 135-144","10.1016/S0370-2693(98)00471-7","UR-1510, DTP/97/116","hep-ph",,"  The dependence of the subprocess cross section for dijet production at fixed
transverse momentum on the (large) rapidity separation Delta y of the dijets
can be used to test for `BFKL physics', i.e. the presence of higher--order
(alphas log(Delta y)^n contributions. Unfortunately in practice these subtle
effects are masked by the additional, stronger dependence arising from the
parton distributions. We propose a simple ratio test using two different
collider energies n which the parton distribution dependence largely cancels.
Such a ratio does distinguish between the `asymptotic' analytic BFKL and
lowest-order QCD predictions. However, when subasymptotic effects from overall
energy-momentum conservation are included, the BFKL predictions for present
collider energies change qualitatively. In particular, the real gluon emission
contributions to the BFKL cross section are suppressed. The proposed ratio
therefore provides an interesting laboratory for studying the interplay of
leading-logarithm and kinematic effects.
","[{""version"":""v1"",""created"":""Wed, 14 Jan 1998 17:45:03 GMT""},{""version"":""v2"",""created"":""Thu, 23 Apr 1998 21:46:02 GMT""}]","2009-10-31"
"hep-ph/9801305","Francisco Guerrero","Francisco Guerrero","Study of the resummation of chiral logarithms in the exponentiated
  expression for the pion form factor","11 pages, LaTeX, 1 PostScript figure. To appear in Physical Review D","Phys.Rev. D57 (1998) 4136-4141","10.1103/PhysRevD.57.4136","FTUV/97-53 IFIC/97-84","hep-ph",,"  From the properties of analyticity and unitarity it has been recently
obtained an exponentiated expression for the pion form factor. In this work I
show the validity of this expression comparing its order p^6 term with the one
exactly calculated in ChPT.
","[{""version"":""v1"",""created"":""Wed, 14 Jan 1998 17:39:25 GMT""}]","2009-10-31"
"hep-ph/9801306",,"E.W. Kolb, A. Riotto and I.I. Tkachev","GUT baryogenesis after preheating: numerical study of the production and
  decay of X-bosons","13 pages, LaTeX file, 3 figures. One reference added and minor
  changes","Phys.Lett. B423 (1998) 348-354","10.1016/S0370-2693(98)00134-8","FERMILAB-Pub-97/433-A, CERN-TH/97-376","hep-ph astro-ph hep-th",,"  We perform a fully non-linear calculation of the production of supermassive
Grand Unified Theory (GUT) $X$ bosons during preheating, taking into account
the fact that they are unstable with a decay width $\Gamma_X$. We show that
parametric resonance does not develop if $\Gamma_X$ is larger than about
$10^{-2} m_X$. We compute the nonthermal number density of superheavy bosons
produced in the preheating phase and demonstrate that the observed baryon
asymmetry may be explained by GUT baryogenesis after preheating if $\Gamma_X$
is smaller than about $10^{-3} m_X$.
","[{""version"":""v1"",""created"":""Wed, 14 Jan 1998 17:42:08 GMT""},{""version"":""v2"",""created"":""Fri, 16 Jan 1998 09:15:36 GMT""}]","2009-10-31"
