"math/9810180","Anders S. Buch","Anders S. Buch","The saturation conjecture (after A. Knutson and T. Tao)","Latex document, 12 pages, 24 figures",,,,"math.CO math.RT",,"  In this exposition we give a simple and complete treatment of A. Knutson and
T. Tao's recent proof (http://front.math.ucdavis.edu/math.RT/9807160) of the
saturation conjecture, which asserts that the Littlewood-Richardson semigroup
is saturated. The main tool is Knutson and Tao's hive model for
Berenstein-Zelevinsky polytopes. In an appendix of W. Fulton it is shown that
the hive model is equivalent to the original Littlewood-Richardson rule.
","[{""version"":""v1"",""created"":""Fri, 30 Oct 1998 23:54:12 GMT""}]","2007-05-23"
"math/9811001","Soloviev","Pavel Etingof, Alexandre Soloviev","Quantization of geometric classical r-matrices","7 pages, AMS LaTex, no figures, corrected a sign error",,,,"math.QA",,"  In this note we define geometric classical r-matrices and quantum R-matrices,
and show how any geometric classical r-matrix can be quantized to a geometric
quantum R-matrix. This is one of the simplest nontrivial examples of
quantization of solutions of the classical Yang-Baxter equation, which can be
explicitly computed.
","[{""version"":""v1"",""created"":""Sat, 31 Oct 1998 01:21:48 GMT""},{""version"":""v2"",""created"":""Mon, 1 Mar 1999 03:48:48 GMT""},{""version"":""v3"",""created"":""Tue, 2 Mar 1999 16:26:04 GMT""}]","2007-05-23"
"nucl-ex/9810018","Rene Bellwied","Rene Bellwied","Is Strangeness still interesting at RHIC ?","12 pages, 7 figures, Invited Talk at the IV International Conference
  on Strangeness in Quark Matter, Padova (Italy), July 20-24, 1998","J.Phys.G25:437-449,1999","10.1088/0954-3899/25/2/034",,"nucl-ex",,"  With the advent of the Relativistic Heavy Ion Collider (RHIC) at Brookhaven
National Laboratory (BNL), Heavy Ion Physics will enter a new energy regime.
The question is whether the signatures proposed for the discovery of a phase
transition from hadronic matter to a Quark Gluon Plasma (QGP), that were
established on the basis of collisions at the BEVALAC, the AGS, and the SPS,
respectively, are still useful and detectable at these high incident energies.
In the past two decades, measurements related to strangeness formation in the
collision were advocated as potential signatures and were tested in numerous
fixed target experiments at the AGS and the SPS. In this article I will review
the capabilities of the RHIC detectors to measure various aspects of
strangeness, and I will try to answer the question whether the information
content of those measurements is comparable to the one at lower energies.
","[{""version"":""v1"",""created"":""Fri, 30 Oct 1998 21:35:55 GMT""}]","2008-11-26"
"nucl-th/9810078","Kai Hencken","Gerhard Baur, Kai Hencken and Dirk Trautmann","Photon-Photon and Photon-Hadron Interactions at Relativistic Heavy Ion
  Colliders","10 pages, Proceedings of the Erice Summer School on Heavy Ion Physics
  1998","Prog.Part.Nucl.Phys. 42 (1999) 357-366","10.1016/S0146-6410(99)00089-7",,"nucl-th",,"  In central collisions at relativistic heavy ion colliders like the
Relativistic Heavy Ion Collider RHIC/Brookhaven and the Large Hadron Collider
LHC (in its heavy ion mode) at CERN/Geneva, one aims at detecting a new form of
hadronic matter --- the Quark Gluon Plasma. We discuss here a complementary
aspect of these collisions, the very peripheral ones. Due to coherence, there
are strong electromagnetic fields of short duration in such collisions. They
give rise to photon-photon and photon-nucleus collisions with high flux up to
an invariant mass region hitherto unexplored experimentally. After a general
survey photon-photon luminosities in relativistic heavy ion collisions are
discussed. Then photon-photon physics at various gamma-gamma-invariant mass
scales is discussed. The region of several GeV, relevant for RHIC is dominated
by QCD phenomena (meson and vector meson pair production). Invariant masses of
up to about 100 GeV can be reached at LHC, and the potential for new physics is
discussed. Lepton-pair production, especially electron-positron pair production
is copious. Due to the strong fields there will be new phenomena, especially
multiple e+e- pair production.
","[{""version"":""v1"",""created"":""Fri, 30 Oct 1998 16:47:03 GMT""}]","2009-10-31"
"nucl-th/9810079","Carbonell","J. Carbonell and V.A. Karmanov","Front-form calculation of the deuteron EM form factors","4 pages, 1 figure. Contribution to the XVI European Conference on
  Few-Body problems in Physics, Autrans june 1998. To appear in Few-Body
  Systems Suppl. Latex.tar.gz file","Few Body Syst.Suppl.10:427-430,1999",,,"nucl-th",,"  The deuteron form factors are calculated in the framework of the relativistic
nucleon-meson dynamics. The relativistic effects change considerably the S- and
D-waves of the deuteron, result in the dominating extra component in the
deuteron wave function and generate the contact interaction between the
nucleon, mesons and photon. The prediction for the polarization observable
$t_{20}$ is in good agreement with the recent data of TJNAF/CEBAF.
","[{""version"":""v1"",""created"":""Fri, 30 Oct 1998 18:08:50 GMT""}]","2011-04-15"
"nucl-th/9810080","Richard F. Lebed","Richard F. Lebed (Jefferson Lab)","Phenomenology of Large N_c QCD","34 pages, 14 eps figures, latex (revtex), uses epsf. Lectures
  presented at 11th Indian-Summer School of Nuclear Physics, Charles
  University, Prague, September, 1998; to appear in Czech J. Phys","Czech.J.Phys.49:1273-1306,1999","10.1023/A:1022820227262","JLAB-THY-98-42","nucl-th hep-ph",,"  These lectures are designed to introduce the methods and results of large N_c
QCD in a presentation intended for nuclear and particle physicists alike.
Beginning with definitions and motivations of the approach, we demonstrate that
all quark and gluon Feynman diagrams are organized into classes based on powers
of 1/N_c. We then show that this result can be translated into definite
statements about mesons and baryons containing arbitrary numbers of
constituents. In the mesons, numerous well-known phenomenological properties
follow as immediate consequences of simply counting powers of N_c, while for
the baryons, quantitative large N_c analyses of masses and other properties are
seen to agree with experiment, even when ``large'' N_c is set equal to its
observed value of 3. Large N_c reasoning is also used to explain some simple
features of nuclear interactions.
","[{""version"":""v1"",""created"":""Fri, 30 Oct 1998 18:35:37 GMT""}]","2014-11-18"
"nucl-th/9810081","Stephen Wong","S.M.H. Wong","Equilibration And Out-Of-Equilibrium Effect In Relativistic Heavy Ion
  Collisions","use sprocl.sty, 6 EPS figures, talk presented at the XXVIII
  International Symposium on Multiparticle Dynamics, Delphi, Greece, Sept 98,
  to appear in the proceedings","Proceedings of the XXVIII ISMD'98 (World Scientific) p.93.",,"IASA 98-3, UA/NPPS-98-13","nucl-th",,"  The approach of a parton plasma at future heavy ion colliders towards kinetic
and chemical equilibrium is considered. A plasma with a self-consistent
evolving parton-parton interaction strength is shown to equilibrate better and
faster than the usual but inconsistent one with a fixed strength. We explain
why as a consequence of this, a parton plasma is a unique kind of many-body
system. Because our time evolution scheme does not require the plasma to be in
either kind of equilibrium from the outset, out-of-equilibrium effect on
particle productions can be revealed. We show this on photon production and
discuss the implications on photon as a signal to detect the quark-gluon
plasma.
","[{""version"":""v1"",""created"":""Sat, 31 Oct 1998 00:02:06 GMT""}]","2007-05-23"
"q-bio/0309031","Jonathan D. Victor","Jonathan D. Victor and Keith P. Purpura","Metric-space analysis of spike trains: theory, algorithms, and
  application","16 Figures (not in this file). Originally submitted to the neuro-sys
  archive which was never publicly announced (was 9810001)","Network 8, 127-164 (1997)",,,"q-bio.NC q-bio.QM",,"  We present the mathematical basis of a new approach to the analysis of
temporal coding. The foundation of the approach is the construction of several
families of novel distances (metrics) between neuronal impulse trains. In
contrast to most previous approaches to the analysis of temporal coding, the
present approach does not attempt to embed impulse trains in a vector space,
and does not assume a Euclidean notion of distance. Rather, the proposed
metrics formalize physiologically-based hypotheses for what aspects of the
firing pattern might be stimulus-dependent, and make essential use of the point
process nature of neural discharges. We show that these families of metrics
endow the space of impulse trains with related but inequivalent topological
structures. We show how these metrics can be used to determine whether a set of
observed responses have stimulus-dependent temporal structure without a
vector-space embedding. We show how multidimensional scaling can be used to
assess the similarity of these metrics to Euclidean distances. For two of these
families of metrics (one based on spike times and one based on spike
intervals), we present highly efficient computational algorithms for
calculating the distances. We illustrate these ideas by application to
artificial datasets and to recordings from auditory and visual cortex.
","[{""version"":""v1"",""created"":""Fri, 30 Oct 1998 22:20:10 GMT""}]","2007-05-23"
"quant-ph/9810094","Robert W. Spekkens","R. W. Spekkens and J. E. Sipe","Spatial fragmentation of a Bose-Einstein condensate in a double-well
  potential","10 pages, 2 figures, submitted to Phys. Rev. A","Phys. Rev. A 59, 3868 (1999)","10.1103/PhysRevA.59.3868",,"quant-ph",,"  We present a theoretical study of the ground state of a Bose-Einstein
condensate with repulsive inter-particle interactions in a double-well
potential, using a restricted variational principle. Within such an approach,
there is a transition from a single condensate to a fragmented condensate as
the strength of the central barrier of the potential is increased. We determine
the nature of this transition through approximate analytic as well as numerical
solutions of our model in the regime where the inter-particle interactions can
be treated perturbatively. The degree of fragmentation of the condensate is
characterized by the degrees of first-order and second-order spatial coherence
across the barrier.
","[{""version"":""v1"",""created"":""Fri, 30 Oct 1998 18:31:55 GMT""}]","2009-10-31"
"quant-ph/9810095","Allan Widom","Y.N. Srivastava, G. Vitiello, A. Widom","Quantum Measurements, Information and Entropy Production","RevTeX 7-Pages No Figures","Int.J.Mod.Phys. B13 (1999) 3369-3382","10.1142/S0217979299003076","MQT 11-3121","quant-ph hep-th",,"  In order to understand the Landau-Lifshitz conjecture on the relationship
between quantum measurements and the thermodynamic second law, we discuss the
notion of ``diabatic'' and ``adiabatic'' forces exerted by the quantum object
on the classical measurement apparatus. The notion of heat and work in
measurements is made manifest in this approach, and the relationship between
information entropy and thermodynamic entropy is explored.
","[{""version"":""v1"",""created"":""Fri, 30 Oct 1998 22:23:30 GMT""}]","2009-10-31"
"quant-ph/9810096","Li You","W.Geist, L.You and T.A.B.Kennedy","Sympathetic cooling of an atomic Bose-Fermi gas mixture","8 pages, 9 figures, accepted for publication in Phys.Rev.Lett",,"10.1103/PhysRevA.59.1500",,"quant-ph cond-mat",,"  Sympathetic cooling of an atomic Fermi gas by a Bose gas is studied by
solution of the coupled quantum Boltzmann equations for the confined gas
mixture. Results for equilibrium temperatures and relaxation dynamics are
presented, and some simple models developed. Our study illustrate that a
combination of sympathetic and forced evaporative cooling enables the Fermi gas
to be cooled to the degenerate regime where quantum statistics, and mean field
effects are important. The influence of mean field effects on the equilibrium
spatial distributions is discussed qualitatively.
","[{""version"":""v1"",""created"":""Fri, 30 Oct 1998 22:44:26 GMT""}]","2009-10-31"
"solv-int/9811002","Angela Foerster","A. Lima-Santos, I. Roditi and A. Foerster","Bethe ansatz solution of the anisotropic correlated electron model
  associated with the Temperley-Lieb algebra","21 pages","Int. Jour. of Mod. Phys. A, Vol. 13, No. 25 (1998) 4309-4324","10.1142/S0217751X98002080",,"solv-int nlin.SI",,"  A recently proposed strongly correlated electron system associated with the
Temperley-Lieb algebra is solved by means of the coordinate Bethe ansatz for
periodic and closed boundary conditions.
","[{""version"":""v1"",""created"":""Fri, 30 Oct 1998 19:16:26 GMT""}]","2009-10-31"
"solv-int/9811003","Sergei M. Sergeev","S. M. Sergeev","Quantum 2+1 evolution model","LaTeX, 37pages",,"10.1088/0305-4470/32/30/313","Branch of INP preprint No. 98-02","solv-int nlin.SI",,"  A quantum evolution model in 2+1 discrete space - time, connected with 3D
fundamental map R, is investigated. Map R is derived as a map providing a zero
curvature of a two dimensional lattice system called ""the current system"". In a
special case of the local Weyl algebra for dynamical variables the map appears
to be canonical one and it corresponds to known operator-valued R-matrix. The
current system is a kind of the linear problem for 2+1 evolution model. A
generating function for the integrals of motion for the evolution is derived
with a help of the current system. The subject of the paper is rather new, and
so the perspectives of further investigations are widely discussed.
","[{""version"":""v1"",""created"":""Sat, 31 Oct 1998 11:43:14 GMT""}]","2009-10-31"
