"astro-ph/9810503","R. Capuzzo-Dolcetta","Roberto Capuzzo-Dolcetta (1), Paolo Miocchi (1 and 2) ((1) Inst.of
  Astronomy, Univ. La Sapienza, Roma, Italy, (2) Dep. of Physics, Univ. La
  Sapienza, Roma, Italy)","Parallelization of a Tree-Code for the Simulation of Self--Gravitating
  Astrophysical Systems","Latex, 3 pages, 2 ps figures; presented at the 1998 Conference on
  Computational Physics, Granada (Spain), sept. 2-5, 1998, in press in Comp.
  Phys. Comm. (Elsevier pub.)",,"10.1016/S0010-4655(99)00373-2",,"astro-ph",,"  We present preliminary results on the parallelization of a Tree-Code for
evaluating gravitational forces in N-body astrophysical systems. Our HPF/CRAFT
implementation on a CRAY T3E machine attained an encouraging speed-up behavior,
reaching a value of 75 with 128 processor elements (PEs). The speed-up tests
regard the evaluation of the forces among N = 130,369 particles distributed
scaling the actual distribution of a sample of galaxies of the Leda catalog.
","[{""version"":""v1"",""created"":""Fri, 30 Oct 1998 16:24:33 GMT""}]","2009-10-31"
"astro-ph/9810504","Manolis Plionis","Cosmology & Xray group: M.Plionis, I.Georgantopoulos, S.Basilakos, T.
  Akylas, O. Giannakis","5 Poster Contributions in the MPA/ESO Conference ""Evolution of
  large-scale structure"", Garching, August 1998","16 pages, colour latex, colour figures",,,,"astro-ph",,"  Poster Titles:
  (1) Optical to IRAS galaxy bias factors using the Local Group Dipole
  (2) The X-ray Luminosity Function of Local Galaxies
  (3) The ROSAT X-ray Background Dipole
  (4) The Angular Correlation Function of RASS Extragalactic Sources
  (5) Galaxy Cluster Shapes
","[{""version"":""v1"",""created"":""Fri, 30 Oct 1998 17:15:31 GMT""}]","2012-08-27"
"astro-ph/9810506","Martin White","Martin White (UIUC)","Polarization of the CMB Anisotropy","To appear in the Proceedings of the MPA/ESO Conference ""Evolution of
  large-scale structure"", Garching, August 1998",,,,"astro-ph",,"  I review why we expect the CMB anisotropy to be polarized, what we can learn
from studying polarization and the level of the experimental challenge it
presents. A discussion of current and future polarization sensitive experiments
will focus on the expected sensitivity of PLANCK.
","[{""version"":""v1"",""created"":""Fri, 30 Oct 1998 17:25:01 GMT""}]","2007-05-23"
"astro-ph/9810507","Gaspard Duchene","Gaspard Duchene","Binary fraction in low-mass star forming regions: a reexamination of the
  possible excesses and implications","7 pages, accepted for publication in Astronomy & Astrophysics",,,,"astro-ph",,"  Various surveys of low-mass binaries in star forming regions have been
performed in recent years. They reached opposite conclusions concerning
possible binary excesses in some of these associations. I develop a consistent
method to reanalyze all these studies, so that I can compare all data
consistently, and understand the previous findings. I also report the detection
of five new companions to Taurus members.
  It appears that binary fraction in Taurus exceeds the main sequence value by
a factor of 1.7 in the range 4-2000 AU. The companion star fraction in this
separation range is the same as the overall main sequence fraction. Ophiuchus,
Chameleon, and possibly Lupus show similar excesses, although with lower
confidence levels. Binaries in Ophiuchus seem to have larger flux ratios
(towards faint companions) than in Taurus.
  It appears very unlikely that all very young star forming regions have binary
excesses. The binary fraction seems to be established after $\sim$ 1 Myr, but
the precise nature of the difference between various regions is still unclear
(overall binary fraction, orbital period distribution). It is not currently
possible to put constraints on the binary formation models: higher angular
resolution and larger sample sizes will be required.
","[{""version"":""v1"",""created"":""Fri, 30 Oct 1998 17:27:52 GMT""}]","2007-05-23"
"astro-ph/9810508","Michael R. Meyer","Bruce A. Wilking, Thomas P. Greene, and Michael R. Meyer","Spectroscopy of Brown Dwarf Candidates in the rho Ophiuchi Molecular
  Core","Astronomical Journal, in press: 25 pages, latex, 5 tables and 6
  figures (separate)","Astrophys.J. 117 (1999) 469","10.1086/300674",,"astro-ph",,"  We present an analysis of low resolution infrared spectra for 20 brown dwarf
candidates in the core of the $\rho$ Ophiuchi molecular cloud. Fifteen of the
sources display absorption-line spectra characteristic of late-type stars. By
comparing the depths of water vapor absorption bands in our candidate objects
with a grid of M dwarf standards, we derive spectral types which are
independent of reddening. Optical spectroscopy of one brown dwarf candidate
confirms the spectral type derived from the water bands. Combining their
spectral types with published near-infrared photometry, effective temperatures
and bolometric stellar luminosities are derived enabling us to place our sample
on the Hertzsprung-Russell diagram. We compare the positions of the brown dwarf
candidates in this diagram with two sets of theoretical models in order to
estimate their masses and ages. Considering uncertainties in placing the
candidates in the H-R diagram, six objects consistently lie in the brown dwarf
regime and another five objects lie in the transition region between stellar
and substellar objects. The ages inferred for the sample are consistent with
those derived for higher mass association members. Three of the newly
identified brown dwarfs display infrared excesses at $\lambda$=2.2 $\mu$m
suggesting that young brown dwarfs can have active accretion disks. Comparing
our mass estimates of the brown dwarf candidates with those derived from
photometric data alone suggests that spectroscopy is an essential component of
investigations of the mass functions of young clusters.
","[{""version"":""v1"",""created"":""Fri, 30 Oct 1998 21:00:29 GMT""}]","2009-10-31"
"astro-ph/9810509","Alexander Vilenkin","P.J.E. Peebles and A. Vilenkin","Quintessential inflation","6 pages, REVTeX, 1 figure","Phys. Rev. D 59, 063505 (1999)","10.1103/PhysRevD.59.063505",,"astro-ph gr-qc hep-th",,"  We present an explicit observationally acceptable model for evolution from
inflation to the present epoch under the assumption that the entropy and matter
of the familiar universe are from gravitational particle production at the end
of inflation. This eliminates the problem of finding a satisfactory coupling of
the inflaton and matter fields. Since the inflaton potential $V(\phi)$ may be a
monotonic function of the inflaton $\phi$, the inflaton energy could produce an
observationally significant effective cosmological constant, as in
quintessence.
","[{""version"":""v1"",""created"":""Fri, 30 Oct 1998 21:10:35 GMT""}]","2016-08-25"
"astro-ph/9810510","Anup Rej","Anup Rej","Gamma-ray bursts, BL Lacs, Supernovae, and Interacting Galaxies","38 pages",,,"Theor. Phys. Seminar NTNU 8/1998","astro-ph",,"  Within the framework of star formation in starburst galaxies undergoing
interactions, connections among the red quasars, the BL Lacs, and the Blazars
with the gamma-ray bursts are discussed in the light of the ""hypernovae""
scenario. It is proposed that the gamma-ray bursts occur primarily in the star
formation regions in starburst environments, and arise from the core-collapse
of super-massive Wolf-Rayet stars, that are formed in interacting systems. In
this interacting environment star formations cause supernovae explosions. As
the stars explode, shock waves propagate outward and collide with the ambient
medium, forming a high-density super-shell, where intense star formation
begins; subsequently supernovae explosions within the shell cause an outward
expansion of the shell. In another scenario of star formation the interactions
among the large gas-rich low-surface brightness (LSB) spiral galaxies give rise
to fragmentation of their tidal tails. These fragmented clouds collapse to
compact dwarfs, which undergo rapid star formation. In such a scenario of
interactions, where most quasars are observed, we discuss the MgII absorption
lines in GRB 970508, whose spectra resemble a BL Lac object, and the spectral
evolution of GRB 971214 that may also indicate a similar connection. Beside the
BL Lac connection, the recent discovery of GRB 980425 in a nearby galaxy
indicates asymmetric supernovae explosions that give rise to relativistic jets.
We propose that the gamma-ray light curves arise due to inverse Compton
scattering of soft-photons from precessing relativistic blobs of plasma moving
in jets. This brings into light the mechanisms of supernova explosions, that
give birth to relativistic jets.
","[{""version"":""v1"",""created"":""Fri, 30 Oct 1998 21:27:07 GMT""}]","2007-05-23"
"astro-ph/9810511","Roelof S. de Jong","Roelof S. de Jong (Univ. of Durham, Steward Observatory) and Cedric
  Lacey (Theoretical Astrophysics Center)","The Space Density of Spiral Galaxies as function of their Luminosity,
  Surface Brightness and Scalesize","8 pages, 3 figures, to appear in the conference proceedings of IAU
  Colloquium 171, ""The Low Surface Brightness Universe""",,,,"astro-ph",,"  The local space density of galaxies as a function of their basic structural
parameters --like luminosity, surface brightness and scalesize-- is still
poorly known. Our poor knowledge is mainly the result of strong selection
biases against low surface brightness and small scalesize galaxies in any
optically selected sample. We show that in order to correct for selection
biases one has to obtain accurate surface photometry and distance estimates for
a large (>~1000) sample of galaxies. We derive bivariate space density
distributions in the (scalesize, surface brightness)-plane and the (luminosity,
scalesize)-plane for a sample of ~1000 local Sb-Sdm spiral galaxies. We present
a parameterization of these bivariate distributions, based on a Schechter type
luminosity function and a log-normal scalesize distribution at a given
luminosity. We show how surface brightness limits and (1+z)^4 cosmological
redshift dimming can influence interpretation of luminosity function
determinations and deep galaxy counts.
","[{""version"":""v1"",""created"":""Sat, 31 Oct 1998 00:39:27 GMT""}]","2007-05-23"
"astro-ph/9811001","Rachel Somerville","Rachel S. Somerville (Hebrew University, Jerusalem), Joel R. Primack
  (University of California, Santa Cruz)","The Star Formation History in a Hierarchical Universe","14 pages, LaTeX, including 8 figures, uses blois.sty, to appear in
  the Proceedings of the Xth Recontre de Blois, June 1998",,,,"astro-ph",,"  Observations now probe the star formation history of the Universe back to a
redshift of $z\sim5$. We investigate whether the predictions of semi-analytic
models of galaxy formation based on hierarchical Cold Dark Matter (CDM) type
models are in agreement with these direct observations and also with the
``fossil'' evidence contained in constraints on the ages of present day
early-type galaxies. Previous models predicted that the star formation rate
density falls off rather steeply at $z\ga 2$, and correspondingly that the
majority of the stars in the Universe formed at relatively low redshift. We
investigate the effect of including a bursting mode of star formation, assuming
that galaxy-galaxy mergers trigger starbursts and using the merger rate that
arises naturally in the CDM merging hierarchy. The resulting starbursts
substantially increase the global star formation rate at high redshift, leading
to predictions that are in good agreement with the star formation rate density
at $z\sim3$ obtained from sub-millimeter observations (SCUBA) and optical/UV
estimates after correction for dust extinction. The mass of stars formed at $z
\ge 3$ is correspondingly in better agreement with the fossil evidence. We also
investigate complementary global quantities such as the mass of cold gas and
the average metallicity of cold gas as a function of redshift, and the
integrated extra-galactic background light. We argue that these observations,
taken together, provide strong constraints on the star formation history of the
Universe, and that hierarchical models of the CDM type are in reasonable
agreement with these observations when starbursts are included.
","[{""version"":""v1"",""created"":""Sat, 31 Oct 1998 10:40:23 GMT""}]","2007-05-23"
"astro-ph/9811002","Giorgio Matt","Giorgio Matt","Studying circumnuclear matter in AGN with X-ray spectroscopy","12 pages. Invited talk at the First XMM Workshop, Sep 30 - Oct 2,
  1998",,,,"astro-ph",,"  I discuss the advances in our understanding of the physics and morphology of
the innermost regions of AGNs which will be possible thanks to the XMM
unprecedented sensitivity and its moderate to high energy resolution.
","[{""version"":""v1"",""created"":""Sat, 31 Oct 1998 13:12:06 GMT""}]","2016-08-30"
"chao-dyn/9811005","Zhigang Zheng","Zhigang Zheng, Gang Hu and Bambi Hu","Phase slips and phase synchronization of coupled oscillators","4 pages with 4 eps figures, to appear in Phys. Rev. Lett",,"10.1103/PhysRevLett.81.5318","HKBU-CNS-9822","chao-dyn nlin.CD",,"  The behaviors of coupled oscillators, each of which has periodic motion with
random natural frequency in the absence of coupling, are investigated. Some
novel collective phenomena are revealed. At the onset of instability of the
phase-locking state, simultaneous phase slips of all oscillators and quantized
phase shifts in these phase slips are observed. By incresing the coupling, a
bifurcation tree from high-dimensional quasiperiodicity to chaos to
quasiperiodicity and periodicity is found. Different orders of phase
synchronizations of chaotic oscillators and chaotic clusters play the key role
for constructing this tree structure.
","[{""version"":""v1"",""created"":""Sat, 31 Oct 1998 03:48:22 GMT""},{""version"":""v2"",""created"":""Wed, 18 Nov 1998 10:11:06 GMT""}]","2009-10-31"
"cond-mat/9810407","Ulf Leonhardt","U. Leonhardt and P. Piwnicki","Quantized Roentgen Effect in Bose-Einstein Condensates",,,"10.1103/PhysRevLett.82.2426",,"cond-mat.soft",,"  A classical dielectric moving in a charged capacitor can create a magnetic
field (Roentgen effect). A quantum dielectric, however, will not produce a
magnetization, except at vortices. The magnetic field outside the quantum
dielectric appears as the field of quantized monopoles.
","[{""version"":""v1"",""created"":""Fri, 30 Oct 1998 16:01:49 GMT""}]","2009-10-31"
"cond-mat/9810408","MSc. Alexei Vazquez","Alexei Vazquez and Oscar Sotolongo-Costa (Havana University)","Self-organized criticality and directed percolation","9 pages, 10 eps figs, revtex, submitted to J. Phys. A",,"10.1088/0305-4470/32/14/004",,"cond-mat",,"  A sandpile model with stochastic toppling rule is studied. The control
parameters and the phase diagram are determined through a MF approach, the
subcritical and critical regions are analyzed. The model is found to have some
similarities with directed percolation, but the existence of different boundary
conditions and conservation law leads to a different universality class, where
the critical state is extended to a line segment due to self-organization.
These results are supported with numerical simulations in one dimension. The
present model constitute a simple model which capture the essential difference
between ordinary nonequilibrium critical phenomena, like DP, and self-organized
criticality.
","[{""version"":""v1"",""created"":""Fri, 30 Oct 1998 16:20:47 GMT""},{""version"":""v2"",""created"":""Wed, 11 Nov 1998 02:54:16 GMT""}]","2009-10-31"
"cond-mat/9810409","M. Steinberg","M.Steinberg, J. Ortner","Correlation energy of an electron gas in strong magnetic fields at high
  densities","10 pages, Accepted for publication in Phys.Rev.B","Phys.Rev.B 58, 15 460 (1998); Erratum: 59, 12 693 (1999)","10.1103/PhysRevB.58.15460",,"cond-mat",,"  The high-density electron gas in a strong magnetic field B and at zero
temperature is investigated. The quantum strong-field limit is considered in
which only the lowest Landau level is occupied. It is shown that the
perturbation series of the ground-state energy can be represented in analogy to
the Gell-Mann Brueckner expression of the ground-state energy of the field-free
electron gas. The role of the expansion parameter is taken by r_B= (2/3 \pi^2)
(B/m^2) (\hbar r_s /e)^3 instead of the field-free Gell-Mann Brueckner
parameter r_s. The perturbation series is given exactly up to o(r_B) for the
case of a small filling factor for the lowest Landau level.
","[{""version"":""v1"",""created"":""Fri, 30 Oct 1998 16:30:10 GMT""}]","2009-10-31"
"cond-mat/9810410","Seung-Hyun Chun","S. H. Chun, M. B. Salamon, and P. D. Han","Hall Effect of La2/3(Ca,Pb)1/3MnO3 Single Crystals near the Critical
  Temperature","revtex, 11 pages, 4 figures","Phys. Rev. B 59, 11155 (1999)","10.1103/PhysRevB.59.11155",,"cond-mat.str-el cond-mat.mtrl-sci",,"  The Hall resistivity rho_{xy} of a La_{2/3}(Ca,Pb)_{1/3}MnO_3 single crystal
has been measured as a function of temperature and field. The overall behavior
is similar to that observed previously in thin-films. At 5 K, rho_{xy} is
positive and linear in field, indicating that the anomalous contribution $R_S$
is negligible. However, the effective carrier density in a free electron model
is n_{eff}=2.4 holes/Mn, even larger than the 0.85-1.9 holes/Mn reported for
thin-films and far larger than the 0.33 holes/Mn expected from the doping
level. As temperature increases, a strong, negative contribution to rho_{xy}
appears, that we ascribe to R_S. Using detailed magnetization data, we separate
the ordinary (\propto B) and anomalous (\propto M) contributions. Below T_C,
R_S \propto rho_{xx}, indicating that magnetic skew scattering is the dominant
mechanism in the metallic ferromagnetic regime. At and above the
resistivity-peak temperature, we find that rho_{xy}/rho_{xx}M is a constant,
independent of temperature and field. This implies that the anomalous Hall
coefficient is proportional to the magnetoresistance. A different explanation
based on two fluid model is also presented.
","[{""version"":""v1"",""created"":""Fri, 30 Oct 1998 20:27:44 GMT""}]","2009-10-31"
"cond-mat/9810411","Douglas Davidson","Douglas Davidson, Marcel den Nijs","Temperature Dependence of Facet Ridges in Crystal Surfaces","12 pages, 19 figures",,"10.1103/PhysRevE.59.5029",,"cond-mat.stat-mech",,"  The equilibrium crystal shape of a body-centered solid-on-solid (BCSOS) model
on a honeycomb lattice is studied numerically. We focus on the facet ridge
endpoints (FRE). These points are equivalent to one dimensional KPZ-type growth
in the exactly soluble square lattice BCSOS model. In our more general context
the transfer matrix is not stochastic at the FRE points, and a more complex
structure develops. We observe ridge lines sticking into the rough phase where
thesurface orientation jumps inside the rounded part of the crystal. Moreover,
the rough-to-faceted edges become first-order with a jump in surface
orientation, between the FRE point and Pokrovsky-Talapov (PT) type critical
endpoints. The latter display anisotropic scaling with exponent $z=3$ instead
of familiar PT value $z=2$.
","[{""version"":""v1"",""created"":""Fri, 30 Oct 1998 22:18:43 GMT""}]","2009-10-31"
"cond-mat/9810412","Shan-Ho Tsai","Shan-Ho Tsai, and Silvio R. A. Salinas","Fourth-Order Cumulants to Characterize the Phase Transitions of a Spin-1
  Ising Model","18 pages, Revtex, 8 encapsulated postscript figures","Braz. J. Phys. 28, 58 (1998)","10.1590/S0103-97331998000100008",,"cond-mat.stat-mech",,"  Fourth-order cumulants of physical quantities have been used to characterize
the nature of a phase transition. In this paper we report some Monte Carlo
simulations to illustrate the behavior of fourth-order cumulants of
magnetization and energy across second and first-order transitions in the phase
diagram of a well known spin-1 Ising model. Simple ideas from the theory of
thermodynamic fluctuations are used to account for the behavior of these
cumulants.
","[{""version"":""v1"",""created"":""Fri, 30 Oct 1998 23:15:18 GMT""}]","2015-06-25"
"cond-mat/9810413","Michael Jack","M. W. Jack, M. Naraschewski, M. J. Collett, and D. F. Walls","The Markov approximation for the atomic output coupler","16 pages, 3 figures",,"10.1103/PhysRevA.59.2962",,"cond-mat.stat-mech",,"  The regions of validity of the Markov approximation for the coupling of atoms
out of an atomic trap are determined. We consider radio-frequency output
coupling in the presence of gravity and collisional repulsion, and Raman output
coupling. The Markov approximation is crucial in most theoretical descriptions
of an atom laser that assume a continuous process of output coupling from a
trapped Bose-Einstein condensate. In this regime many techniques proved to be
useful for modeling the optical laser, such as master equations, can be used to
describe the dynamics of the damping of the condensate mode undergoing output
coupling.
","[{""version"":""v1"",""created"":""Fri, 30 Oct 1998 23:19:26 GMT""}]","2009-10-31"
"cond-mat/9810414","Koga","A. Koga, S. Kumada, and N. Kawakami","Two-Dimensional Quantum Spin Systems with Ladder and Plaquette Structure","8 pages (9 figures), accepted by JPSJ",,"10.1143/JPSJ.68.642",,"cond-mat.str-el",,"  We investigate low-energy properties of two-dimensional quantum spin systems
with the ladder and plaquette structures, which are described by a generalized
antiferromagnetic Heisenberg model with both of the bond and spin alternations.
By exploiting a non-linear $\sigma$ model technique and a modified spin wave
approach, we evaluate the spin gap and the spontaneous magnetization to discuss
the quantum phase transition between the ordered and disordered states. We
argue how the spin-gapped phase is driven to the antiferromagnetic phase in the
phase diagram.
","[{""version"":""v1"",""created"":""Fri, 30 Oct 1998 23:34:58 GMT""}]","2009-10-31"
"cond-mat/9811001","Shuichi Murakami","Shuichi Murakami, Naoto Nagaosa (Dept.Appl.Phys., Univ.of Tokyo),
  Manfred Sigrist (YITP, Kyoto Univ.)","An SO(5) model of p-wave superconductivity and ferromagnetism","5 pages, REVTEX, no figures, References renewed","Phys.Rev.Lett.82(1999)2939-2942","10.1103/PhysRevLett.82.2939",,"cond-mat.supr-con",,"  We study an SO(5) model unifying p-wave superconductivity and ferromagnetism.
If only a single p-wave pairing wavefunction is involved, the p-wave
superconducting (pSC) and ferromagnetic (F) states can be unified to form
10-dimensional multiplet of SO(5). The collective modes in pSC and F states are
studied from this viewpoint in terms of a non-linear sigma model.
","[{""version"":""v1"",""created"":""Sat, 31 Oct 1998 01:13:33 GMT""},{""version"":""v2"",""created"":""Thu, 8 Apr 1999 06:14:01 GMT""},{""version"":""v3"",""created"":""Mon, 12 Apr 1999 09:36:40 GMT""}]","2009-10-31"
"cond-mat/9811002","Ryoichi Yamamoto","Ryoichi Yamamoto and Akira Onuki","Dynamics of Highly Supercooled Liquids","8pages, 6 figures (Proceeding of the 8th Tohwa University
  International Symposium on ""Slow Dynamics in Complex Systems"" Nov. 9-14,
  1998, Fukuoka)",,"10.1063/1.58529",,"cond-mat.soft",,"  The diffusivity of tagged particles is demonstrated to be heterogeneous on
time scales comparable to or less than the structural relaxation time %taking
place at the interparticle distance in a highly supercooled liquid via 3D
molecular dynamics simulation. The particle motions in the relatively active
regions dominantly contribute to the mean square displacement, giving rise to a
diffusion constant systematically larger than the Stokes-Einstein value. The
van Hove self-correlation function $G_s(r,t)$ is shown to have a large $r$ tail
which can be scaled in terms of $r/t^{1/2}$ for $t \ls 3 \tau_\alpha$, where
$\tau_\alpha \cong$ the stress relaxation time. Its presence indicates
heterogeneous diffusion in the active regions. However, the diffusion process
eventually becomes homogeneous on time scales longer than the life time of the
heterogeneity structure ($\sim 3 \tau_{\alpha}$).
","[{""version"":""v1"",""created"":""Sat, 31 Oct 1998 08:10:54 GMT""}]","2009-10-31"
"cs/9811001","Lunjin Lu","Lunjin Lu (University of Waikato)","A Polymorphic Groundness Analysis of Logic Programs","30 pages",,,,"cs.PL",,"  A polymorphic analysis is an analysis whose input and output contain
parameters which serve as placeholders for information that is unknown before
analysis but provided after analysis. In this paper, we present a polymorphic
groundness analysis that infers parameterised groundness descriptions of the
variables of interest at a program point. The polymorphic groundness analysis
is designed by replacing two primitive operators used in a monomorphic
groundness analysis and is shown to be as precise as the monomorphic groundness
analysis for any possible values for mode parameters. Experimental results of a
prototype implementation of the polymorphic groundness analysis are given.
","[{""version"":""v1"",""created"":""Sat, 31 Oct 1998 07:20:37 GMT""}]","2007-05-23"
