"cs/9811002","Serguei P. Tsarev","Serguei P. Tsarev","Factorization of linear partial differential operators and Darboux
  integrability of nonlinear PDEs","LaTeX 2.09, acmconf.sty (included in the tar file), 8 pages.
  Presented at the Poster session of ISSAC'98 (Rostock, Germany)",,,,"cs.SC nlin.SI solv-int",,"  Using a new definition of generalized divisors we prove that the lattice of
such divisors for a given linear partial differential operator is modular and
obtain analogues of the well-known theorems of the Loewy-Ore theory of
factorization of linear ordinary differential operators. Possible applications
to factorized Groebner bases computations in the commutative and
non-commutative cases are discussed, an application to finding criterions of
Darboux integrability of nonlinear PDEs is given.
","[{""version"":""v1"",""created"":""Sat, 31 Oct 1998 09:09:05 GMT""}]","2007-05-23"
"hep-ex/9810048","Horst Fischer","G. Braun, H. Fischer, J. Franz, A. Grunemaier, F.H. Heinsius, K.
  Konigsmann, M. Schierloh, T. Schmidt, H. Schmitt, H.J. Urban (Universitaet
  Freiburg, Fakultaet fuer Physik, Freiburg, Germany)","TDC Chip and Readout Driver Developments for COMPASS and LHC-Experiments","5 pages, 4 figures",,,"EHEP-98-08","hep-ex",,"  A new TDC-chip is under development for the COMPASS experiment at CERN. The
ASIC, which exploits the 0.6 micrometer CMOS sea-of-gate technology, will allow
high resolution time measurements with digitization of 75 ps, and an
unprecedented degree of flexibility accompanied by high rate capability and low
power consumption. Preliminary specifications of this new TDC chip are
presented.
  Furthermore a FPGA based readout-driver and buffer-module as an interface
between the front-end of the COMPASS detector systems and an optical S-LINK is
in development. The same module serves also as remote fan-out for the COMPASS
trigger distribution and time synchronization system. This readout-driver
monitors the trigger and data flow to and from front-ends. In addition, a
specific data buffer structure and sophisticated data flow control is used to
pursue local pre-event building. At start-up the module controls all necessary
front-end initializations.
","[{""version"":""v1"",""created"":""Fri, 30 Oct 1998 17:06:42 GMT""}]","2007-05-23"
"hep-ex/9811001","Jurgen Engelfried","J. Engelfried (1), I. Filimonov (2), J. Kilmer (1), A. Kozhevnikov
  (3), V. Kubarovsky (3), V. Molchanov (3), A. Nemitkin (2), E. Ramberg (1), V.
  Rud (2), L. Stutte (1) ((1) Fermilab, (2) Moscow State University, (3) IHEP
  Serpukhov)","The SELEX Phototube RICH Detector","25 pages with 14 figures included. Submitted to Nuclear Instruments
  and Methods A","Nucl.Instrum.Meth. A431 (1999) 53-69","10.1016/S0168-9002(99)00043-1","FERMILAB-PUB-98/299-E","hep-ex physics.ins-det",,"  In this article, construction, operation, and performance of the RICH
detector of Fermilab experiment 781 (SELEX) are described. The detector
utilizes a matrix of 2848 phototubes for the photocathode to detect Cherenkov
photons generated in a 10m Neon radiator. For the central region an N0 of
104/cm, corresponding to 13.6 hits on a beta=1 ring, was obtained. The ring
radius resolution measured is 1.6%.
","[{""version"":""v1"",""created"":""Sat, 31 Oct 1998 01:19:08 GMT""}]","2009-10-31"
"hep-lat/9810067","Chet Nieter","A. Hasenfratz and C.Nieter","Instanton Content of the SU(3) Vacuum","3 pages,LaTeX,3 eps figures,LATTICE98(confine)","Nucl.Phys.Proc.Suppl. 73 (1999) 503-505","10.1016/S0920-5632(99)85118-4","COLO-HEP-417","hep-lat",,"  We study the topological content of the SU(3) vacuum using a method based on
RG mapping developed for SU(2) gauge theory earlier. RG mapping, in which a
series of APE-smearing steps is done while tracking the observables, reduces
the short range fluctuations in the gauge fields while preserving the long
structure. This allows us to study the instanton size distribution and
topological susceptibility for SU(3) gauge theory. We arrive at a value for the
topological susceptibility ${\chi}^{1/4}$, of 203(5) MeV. The size distribution
peaks at $\rho = 0.3fm$, and is in good agreement with the prediction of the
instanton liquid models.
","[{""version"":""v1"",""created"":""Fri, 30 Oct 1998 17:43:57 GMT""}]","2009-10-31"
"hep-ph/9810538",,"Y. S. Kim","Lorentz Covariance and Internal Space-time Symmetry of Relativistic
  Extended Particles","RevTex 25 pages, 3 psfigs, Contribution to the Nova Collection of
  papers on the Lorentz group (edited by Valeri Dvoeglazov)",,,,"hep-ph hep-th nucl-th quant-ph",,"  The difference between Lorentz invariance and Lorentz covariance is discussed
in detail. A covariant formalism is developed for the internal space-time
symmetry of extended particles, especially in connection with the insightful
observations Feynman made during the period 1969-72. A Lorentz-group formalism
is presented for the harmonic oscillator model of Feynman, Kislinger and
Ravndal, which was originally based on hadronic mass spectra. This covariant
version allows us to construct a parton distribution function by
Lorentz-boosting the oscillator wave function of a hadron at rest. The role of
the time-separation variable is discussed in detail. It is shown that, due to
our inability to make measurements on this variable, it belongs to Feynman's
rest of the universe. Our failure to observe the rest of the universe leads to
an increase in entropy.
","[{""version"":""v1"",""created"":""Fri, 30 Oct 1998 20:59:23 GMT""}]","2007-05-23"
"hep-ph/9810547",,"Miguel A. Sanchis-Lozano","Charmonium Production at Tevatron, HERA and LHC","LaTeX, 4 pages, 2 EPS figures, presented at III Int. Conf. Hyperons,
  Charm and Beauty Hadrons, Genova (Italy), June 30 - July 3, 1998","Nucl.Phys.Proc.Suppl. 75B (1999) 191-194","10.1016/S0920-5632(99)00351-5","FTUV/98-72, IFIC/98-73","hep-ph",,"  Charmonia hadro- and photo-production are analyzed in the framework of the
color-octet model taking into account higher-order effects induced by
initial-state radiation of gluons. We argue that color-octet matrix elements
obtained from Tevatron data might be reconciled with those extracted from HERA
data on inelastic $J/\psi$ photoproduction. Finally we estimate cross sections
for events with muons from prompt $J/\psi$'s as a background for the B physics
programme at LHC experiments.
","[{""version"":""v1"",""created"":""Fri, 30 Oct 1998 16:17:33 GMT""}]","2009-10-31"
"hep-ph/9810548","Xiaofeng Guo","Xiaofeng Guo (Kentucky) and Jianwei Qiu (BNL/Iowa State)","The Leading Power Corrections to the Structure Functions","Latex, 16 pages",,,"UK/TP 98-13; BNL-HET-98/36","hep-ph",,"  We show that when Bjorken $x_B$ is large, the leading order twist-four
contributions to the structure functions can be expressed in terms of the
derivatives of the normal twist-two parton distributions. Our analytical
results are not only consistent with the parameterized power corrections
extracted from the data, but also predict the flavor dependence of the power
corrections. We also discuss the impact of our analytical results on the
extraction and the flavor separation of the parton distributions at large $x$.
","[{""version"":""v1"",""created"":""Fri, 30 Oct 1998 16:18:30 GMT""}]","2007-05-23"
"hep-ph/9810549",,"F. Berto, J.L. Domenech and M.A. Sanchis-Lozano","A heavy quark effective field lagrangian keeping particle and
  antiparticle mixed sectors","LaTeX, 14 pages, 1 EPS figures","Nuovo Cim. A112 (1999) 1181","10.1007/BF03035921","FTUV/98-80 (revised), IFIC/98-81 (revised)","hep-ph",,"  We derive a tree-level heavy quark effective Lagrangian keeping
particle-antiparticle mixed sectors allowing for heavy quark-antiquark pair
annihilation and creation. However, when removing the unwanted degrees of
freedom from the effective Lagrangian one has to be careful in using the
classical equations of motion obeyed by the effective fields in order to get a
convergent expansion on the reciprocal of the heavy quark mass. Then the
application of the effective theory to such hard processes should be sensible
for special kinematic regimes as for example heavy quark pair production near
threshold.
","[{""version"":""v1"",""created"":""Fri, 30 Oct 1998 16:19:41 GMT""},{""version"":""v2"",""created"":""Mon, 2 Nov 1998 10:53:45 GMT""},{""version"":""v3"",""created"":""Sun, 8 Nov 1998 16:00:58 GMT""},{""version"":""v4"",""created"":""Thu, 22 Jul 1999 11:38:09 GMT""}]","2009-10-31"
"hep-ph/9810550","Francesc Ferrer","F. Ferrer and M. Nowakowski","Higgs- and Goldstone bosons-mediated long range forces","13 pages (REVTeX), 2 figures","Phys.Rev. D59 (1999) 075009","10.1103/PhysRevD.59.075009","UAB-FT-456, IFT-P.078/98","hep-ph",,"  In certain mild extensions of the Standard Model, spin-independent long range
forces can arise by exchange of two very light pseudoscalar spin--0 bosons. In
particular, we have in mind models in which these bosons do not have direct
tree level couplings to ordinary fermions. Using the dispersion theoretical
method, we find a $1/r^{3}$ behaviour of the potential for the exchange of very
light pseudoscalars and a $1/r^{7}$ dependence if the pseudoscalars are true
massless Goldstone bosons.
","[{""version"":""v1"",""created"":""Fri, 30 Oct 1998 17:26:44 GMT""}]","2009-10-31"
"hep-ph/9810551","Pierre Marage","P. Marage","Diffraction at HERA - An Experimentalist's View","Review presented at the LISHEP 98 Workshop, Rio de Janeiro, February
  1998. 24 pages, 21 figures",,,,"hep-ph",,"  Diffraction studies at HERA are introduced, with reference to other
communications to this Conference. Motivations and specific features of the
experimental approaches are stressed.
","[{""version"":""v1"",""created"":""Fri, 30 Oct 1998 18:45:37 GMT""}]","2007-05-23"
"hep-ph/9810552","Guo-Hong Wu","Ken Kiers, Amarjit Soni, Guo-Hong Wu","CP Violation in a two-Higgs doublet model for the top quark: B to psi
  K_S","14 pages, 2 figures. Added a new case study and a figure, some
  discussions, and a few references; version to appear in Phys. ReV. D","Phys.Rev. D59 (1999) 096001","10.1103/PhysRevD.59.096001","BNL-HET-98/41, PURD-TH-98-12","hep-ph hep-ex",,"  We explore charged-Higgs CP-violating effects in an intriguing two-Higgs
doublet model which accords special status to the top quark. In this model the
heaviness of the top quark originates naturally from the much larger VEV of the
second Higgs doublet compared to that of the first. The phenomenology of this
model is quite distinct from that of the usual formulations of the two-Higgs
doublet model. In particular, the model can easily account for the observed CP
violation in the kaon sector even if the CKM matrix is real. The associated
non-standard CP phase can be monitored through measurements of the
time-dependent CP asymmetry in B to psi K_S in experiments at the upcoming
B-factories.
","[{""version"":""v1"",""created"":""Fri, 30 Oct 1998 21:32:35 GMT""},{""version"":""v2"",""created"":""Wed, 27 Jan 1999 21:25:18 GMT""}]","2009-10-31"
"hep-ph/9810553","Pierre Binetruy","Pierre Binetruy (LPTHE-Orsay, France)","Models of dynamical supersymmetry breaking and quintessence","4 pages, Latex","Phys.Rev. D60 (1999) 063502","10.1103/PhysRevD.60.063502",,"hep-ph astro-ph hep-th",,"  We study several models of relevance for the dynamical breaking of
supersymmetry which could provide a scalar component with equation of state
$p=w\rho$, $-1<w<0$. Such models would provide a natural explanation for recent
data on the cosmological parameters.
","[{""version"":""v1"",""created"":""Fri, 30 Oct 1998 23:02:09 GMT""}]","2009-10-31"
"hep-ph/9811201","Lee Jae Sik","Eung Jin Chun and Jae Sik Lee","Implication of Super-Kamiokande Data on R-parity Violation","11 pages, LaTeX, to appear in Phys. Rev. D","Phys.Rev. D60 (1999) 075006","10.1103/PhysRevD.60.075006","KIAS-P98039","hep-ph",,"  R-parity violating bilinear (soft) terms in the supersymmetric standard model
would be the leading source for nonzero neutrino masses and mixing. We point
out that the mixing between neutralinos (charginos) and neutrinos (charged
leptons) driven by the bilinear terms take factorized forms, which may enable
us to probe the neutrino mixing parameters in a collider. It is then shown that
the Super-Kamiokande data on atmospheric neutrinos require all the baryon
number violating couplings to be substantially suppressed: $\lambda''_{\rm any}
<10^{-9}$.
","[{""version"":""v1"",""created"":""Sat, 31 Oct 1998 05:14:24 GMT""},{""version"":""v2"",""created"":""Wed, 2 Jun 1999 01:54:11 GMT""}]","2009-10-31"
"hep-ph/9811202","Apostolos Pilaftsis","Darwin Chang, Wai-Yee Keung and Apostolos Pilaftsis","New two-loop contribution to electric dipole moment in supersymmetric
  theories","Erratum appended in the paper: EDM predictions are by a factor 2
  larger than those given in the published version","Phys.Rev.Lett.82:900-903,1999; Erratum-ibid.83:3972,1999","10.1103/PhysRevLett.82.900",,"hep-ph",,"  We calculate a new type of two-loop contributions to the electric dipole
moments of the electron and neutron in supersymmetric theories. The new
contributions are originated from the potential CP violation in the trilinear
couplings of the Higgs bosons to the scalar-top or the scalar-bottom quarks.
These couplings were previously very weakly constrained. The electric dipole
moments are induced through a mechanism analogous to that due to Barr and Zee.
We find observable effects for a sizeable portion of the parameter space
related to the third generation scalar-quarks in the minimal supersymmetric
standard model which cannot be excluded by earlier considerations.
","[{""version"":""v1"",""created"":""Sat, 31 Oct 1998 11:33:28 GMT""},{""version"":""v2"",""created"":""Tue, 7 Sep 1999 15:18:17 GMT""}]","2009-09-01"
"hep-ph/9811203",,"Chun Liu and H. S. Song","MeV Tau Neutrino in Gauge Mediated Supersymmetry Breaking Model","18 pages, latex, two figures","Nucl.Phys. B545 (1999) 183-191","10.1016/S0550-3213(98)00822-0","KIAS-P98023, SNUTP 97-151","hep-ph",,"  A supersymmetric model which naturally accommodates MeV tau neutrino within
the framework of gauge mediated supersymmetry breaking is described. The lepton
number violation is originally introduced in the messenger sector of the
theory. A large slepton-Higgs mixing mass and a small lepton-higgsino mixing
mass are generated at one-loop. Scalar tau neutrino has non-vanishing vacuum
expectation value. These result in a non-zero \nu_{\tau} mass which is in the
range of (1-10) MeV.
","[{""version"":""v1"",""created"":""Sat, 31 Oct 1998 11:47:23 GMT""}]","2009-10-31"
"hep-ph/9811204","Hans C. Eggers","H.C. Eggers, M. Greiner and P. Lipa","Analytical solution for multivariate statistics in random multiplicative
  cascades","Workshop on Correlations and Fluctuations, Matrahaza, June 98, uses
  sprocl.sty, 8 pages, 8 figs, 3 typos corrected",,,"STPHY 29/98","hep-ph chao-dyn nlin.CD",,"  It has long been a puzzle how to solve random multiplicative cascade
structures analytically. We present an analytical solution found recently in
the form of a simple pedagogical example of the general case.
","[{""version"":""v1"",""created"":""Sat, 31 Oct 1998 15:41:41 GMT""},{""version"":""v2"",""created"":""Fri, 20 Nov 1998 15:07:00 GMT""}]","2007-05-23"
"hep-th/9810250","Charles P. Boyer","Charles P. Boyer and Krzysztof Galicki","3-Sasakian Manifolds","59 pages, to appear in Essays on Einstein Manifolds, M. Wang and C.
  LeBrun, eds","Surveys Diff.Geom. 7 (1999) 123-184",,,"hep-th math.DG",,"  This is an expository paper describing the geometry of certain
Sasakian-Einstein manifolds. Such manifolds have recently become of interest
due to Maldacena's AdS/CFT conjecture. They describe near-horizon geometries of
branes at conical singularities.
","[{""version"":""v1"",""created"":""Fri, 30 Oct 1998 23:28:04 GMT""}]","2007-05-23"
"hep-th/9810252","Tsulaia M. M.","A.Pashnev and M.Tsulaia","On a different BRST constructions for a given Lie algebra","10 Pages, LaTeX",,"10.1007/BFb0104616","JINR E2-98-303","hep-th",,"  The method of the BRST quantization is considered for the system of
constraints, which form a Lie algebra. When some of the Cartan generators do
not imply any conditions on the physical states, the system contains the first
and the second class constraints. After the introduction auxiliary bosonic
degrees of freedom for these cases, the corresponding BRST charges with the
nontrivial structure of nonlinear terms in ghosts are constructed.
","[{""version"":""v1"",""created"":""Fri, 30 Oct 1998 16:57:03 GMT""}]","2009-10-31"
"hep-th/9810253","Markus A. Luty","Z. Chacko, Markus A. Luty, Eduardo Ponton","Calculable Dynamical Supersymmetry Breaking on Deformed Moduli Spaces","8 pages, LaTeX2e, no figures","JHEP 9812 (1998) 016","10.1088/1126-6708/1998/12/016","UMD-PP-99-040","hep-th",,"  We consider models of dynamical supersymmetry breaking in which the
extremization of a tree-level superpotential conflicts with a quantum
constraint. We show that in such models the low-energy effective theory near
the origin of moduli space is an O'Raifeartaigh model, and the sign of the
mass-squared for the pseudo-flat direction at the origin is calculable. We
analyze vector-like models with gauge groups SU(N) and Sp(2N) with and without
global symmetries. In all cases there is a stable minimum at the origin with an
unbroken U(1)_R symmetry.
","[{""version"":""v1"",""created"":""Fri, 30 Oct 1998 19:21:41 GMT""}]","2009-10-31"
"hep-th/9810254","Dieter Luest","Andreas Karch, Dieter Lust and Andre Miemiec","N=1 Supersymmetric Gauge Theories and Supersymmetric 3-cycles","36 pages, LaTeX2e, 10 figures, additional references added, minor
  corrections","Nucl.Phys.B553:483-510,1999","10.1016/S0550-3213(99)00260-6","HUB-EP-98/70","hep-th",,"  In this paper we discuss the strong coupling limit of chiral N=1
supersymmetric gauge theory via their embedding into M-theory. In particular we
focus on the brane box models of Hanany and Zaffaroni and show that after a
T-duality transformation their M-theory embedding is described by
supersymmetric 3-cycles; its geometry will encode the holomorphic
non-perturbative information about the gauge theory.
","[{""version"":""v1"",""created"":""Fri, 30 Oct 1998 20:24:00 GMT""},{""version"":""v2"",""created"":""Tue, 3 Nov 1998 16:13:56 GMT""},{""version"":""v3"",""created"":""Fri, 20 Nov 1998 16:51:11 GMT""}]","2009-10-07"
"hep-th/9810255","Pawel Caban","C. Gonera and P. Kosinski (University of Lodz, Poland)","Calogero model and sL(2,R) algebra","10 pages, LaTeX file","Acta Phys.Polon.B30:907-914,1999",,,"hep-th nlin.SI solv-int",,"  The Calogero model with external harmonic oscillator potential is discussed
from sL(2,R) algebra point of view. Explicit formulae for functions with
exponential time behaviour are given; in particular, the integrals of motion
are constructed and their involutiveness demonstrated. The superintegrability
of the model appears to be a simple consequence of the formalism.
","[{""version"":""v1"",""created"":""Fri, 30 Oct 1998 20:37:28 GMT""}]","2014-11-18"
"hep-th/9810256","Shoichi Ichinose","Shoichi Ichinose and Noriaki Ikeda","Weyl Anomaly in Higher Dimensions and Feynman Rules in Coordinate Space","Many figures, 45 pages, some references added (v2)","J.Math.Phys. 40 (1999) 2259-2290","10.1063/1.532863","US-98-07, BNL-preprint","hep-th",,"  An algorithm to obtain the Weyl anomaly in higher dimensions is presented. It
is based on the heat-kernel method. Feynman rules, such as the vertex rule and
the propagator rule, are given in (regularized) coordinate space. Graphical
calculation is introduced. The 6 dimensional scalar-gravity theory is taken as
an example, and its explicit result is obtained.
","[{""version"":""v1"",""created"":""Fri, 30 Oct 1998 21:36:44 GMT""},{""version"":""v2"",""created"":""Fri, 18 Dec 1998 08:14:43 GMT""}]","2009-10-31"
"hep-th/9810257","Anton Kapustin","Micha Berkooz and Anton Kapustin","New IR Dualities in Supersymmetric Gauge Theory in Three Dimensions","15 pages, harvmac, 1 embedded ps figure; a reference has been added","JHEP 9902 (1999) 009","10.1088/1126-6708/1999/02/009","IASSNS-HEP-98/89","hep-th",,"  We present nontrivial examples of d=3 gauge theories with sixteen and eight
supercharges which are infrared dual at special points in the moduli space.
This duality is distinct from mirror symmetry. To demonstrate duality we
construct the gauge theories of interest using D2-branes and orientifolds and
then consider their lift to M-theory. We also discuss the strong coupling limit
of orientifold two-planes and orbifolds of orientifold six-planes.
","[{""version"":""v1"",""created"":""Fri, 30 Oct 1998 21:48:14 GMT""},{""version"":""v2"",""created"":""Mon, 30 Nov 1998 14:45:51 GMT""}]","2009-10-31"
"hep-th/9811001","Aleksandar Bogojevic","A. Bogojevic, B. Sazdovic (Belgrade, Inst. Phys.) and O. Miskovic
  (Vinca Inst.)","Abelian Bosonization, the Wess-Zumino Functional and Conformal Symmetry","7 pages, Latex 2e, no figures",,,"IP-HET-98-30","hep-th",,"  We look at the equivalence of the massive Thirring and sine-Gordon models.
Previously, this equivalence was derived perturbatively in mass (though to all
orders). Our calculation goes beyond that and uncovers an underlying conformal
symmetry.
","[{""version"":""v1"",""created"":""Sat, 31 Oct 1998 11:27:13 GMT""}]","2007-05-23"
"hep-th/9811002","Katsushi Ito","Katsushi Ito","Extended Superconformal Algebras on AdS_{3}","11 pages, latex; a reference added","Phys.Lett. B449 (1999) 48-55","10.1016/S0370-2693(99)00070-2","YITP-98-74","hep-th",,"  We study a supersymmetric extension of the Virasoro algebra on the boundary
of the anti-de Sitter space-time AdS_{3}. Using the free field realization of
the currents, we show that the world-sheet affine Lie superalgebras
osp(1|2)^{(1)}, sl(1|2)^{(1)} and sl(2|2)^{(1)} provide the boundary N=1,2 and
4 extended superconformal algebras, respectively.
","[{""version"":""v1"",""created"":""Sat, 31 Oct 1998 12:58:19 GMT""},{""version"":""v2"",""created"":""Thu, 10 Dec 1998 18:45:47 GMT""}]","2009-10-31"
"hep-th/9811003","Alexey A. Sharapov","S. L. Lyakhovich, A. A. Sharapov and K. M. Shekhter","Massive spinning particle in any dimension. II. (Half-)integer spins","13 pages, tcilatex",,,"TSU-98-10-15","hep-th",,"  The general model of an arbitrary spin massive particle in any dimensional
space-time is derived on the basis of Kirillov - Kostant - Souriau approach.
  Keywords: spinning particles, Poincar\'e group, orbit method, constrained
dynamics, geometric quantization.
","[{""version"":""v1"",""created"":""Sat, 31 Oct 1998 14:34:48 GMT""}]","2007-05-23"
"math/9810175","Julian Dontchev","Julian Dontchev and Takashi Noiri","A note on Saleh's paper `Almost continuity implies closure continuity'","2 pages, to appear in ""Glasgow Math. J.""",,,,"math.GN",,"  Recently, Saleh claimed to have solved `a long standing open question' in
Topology; namely, he proved that every almost continuous function is closure
continuous (= $\theta$-continuous). Unfortunately, this problem was settled
long time ago and even a better result is known.
","[{""version"":""v1"",""created"":""Fri, 30 Oct 1998 19:04:04 GMT""}]","2007-05-23"
"math/9810176","Julian Dontchev","Julian Dontchev","An answer to a question of Pyrih","2 pages, to appear in ""Questions and Answrs in General Topology""",,,,"math.GN",,"  We answer a recent question of Pyrih by proving that a topological space
$(X,\tau)$ is open-normal if and only if it is extremally disconnected.
","[{""version"":""v1"",""created"":""Fri, 30 Oct 1998 19:08:15 GMT""},{""version"":""v2"",""created"":""Sat, 7 Nov 1998 13:46:49 GMT""}]","2007-05-23"
"math/9810177","Julian Dontchev","Julian Dontchev","Survey on preopen sets","To appear in the Proceedings of the 1998 Yatsushiro Topological
  Conference, 22-23 August 1998",,,,"math.GN",,"  The aim of this survey article is to cover most of the recent research on
preopen sets. I try to present majority of the results on preopen sets that I
am aware of.
","[{""version"":""v1"",""created"":""Fri, 30 Oct 1998 19:12:50 GMT""}]","2007-05-23"
"math/9810178","Lee S. Nave","Lee S. Nave","On the nonexistence of Smith-Toda complexes","10 pages, AMSLateX",,,,"math.AT",,"  Let p be a prime. The Smith-Toda complex V(k) is a finite spectrum whose
BP-homology is isomorphic to BP_*/(p,v_1,...,v_k). For example, V(-1) is the
sphere spectrum and V(0) the mod p Moore spectrum. In this paper we show that
if p > 5, then V((p+3)/2) does not exist and V((p+1)/2), if it exists, is not a
ring spectrum. The proof uses the new homotopy fixed point spectral sequences
of Hopkins and Miller.
","[{""version"":""v1"",""created"":""Fri, 30 Oct 1998 22:46:10 GMT""}]","2007-05-23"
"math/9810179","Andrzej Roslanowski","Andrzej Roslanowski and Saharon Shelah","The Yellow Cake",,"Proc. Amer. Math. Soc. 129 (2001) 279-291",,"Shelah [RoSh:686]","math.LO math.CA",,"  We consider the following property:
  (*) For every function f from R^2 to R there are functions g_n,h_n from R to
R (for n<omega) such that for all real numbers x and y, f(x,y) = sum_{n<omega}
g_n(x)h_n(y).
  We show that, despite some expectation suggested by [Sh:675], (*) does not
imply MA(sigma-centered). Next, we introduce cardinal characteristics of the
continuum responsible for the failure of (*).
","[{""version"":""v1"",""created"":""Fri, 30 Oct 1998 23:13:54 GMT""}]","2013-01-04"
