"astro-ph/9808031","Colin Borys","Colin Borys, Scott C. Chapman and Douglas Scott (University of British
  Columbia)","Using SCUBA to place upper limits on arcsecond scale CMB anisotropies at
  850 microns","12 pages, 9 postscript figures, uses mn.sty","Mon.Not.Roy.Astron.Soc. 308 (1999) 527-538","10.1046/j.1365-8711.1999.02753.x","UBC-COS-98-01","astro-ph",,"  The SCUBA instrument on the James Clerk Maxwell Telescope has already had an
impact on cosmology by detecting relatively large numbers of dusty galaxies at
high redshift. Apart from identifying well-detected sources, such data can also
be mined for information about fainter sources and their correlations, as
revealed through low level fluctuations in SCUBA maps. As a first step in this
direction we analyse a small SCUBA data-set as if it were obtained from a
Cosmic Microwave Background (CMB) differencing experiment. This enables us to
place limits on CMB anisotropy at 850 microns. Expressed as Q_{flat}, the
quadrupole expectation value for a flat power spectrum, the limit is 152
microKelvin at 95 per cent confidence, corresponding to C_0^{1/2} < 355
microKelvin for a Gaussian autocorrelation function, with a coherence angle of
about 20--25 arcsec; These results could easily be reinterpretted in terms of
any other fluctuating sky signal. This is currently the best limit for these
scales at high frequency, and comparable to limits at similar angular scales in
the radio. Even with such a modest data-set, it is possible to put a constraint
on the slope of the SCUBA counts at the faint end, since even randomly
distributed sources would lead to fluctuations. Future analysis of sky
correlations in more extensive data-sets ought to yield detections, and hence
additional information on source counts and clustering.
","[{""version"":""v1"",""created"":""Tue, 4 Aug 1998 17:50:44 GMT""}]","2009-10-30"
"astro-ph/9808032","Renyue Cen","Renyue Cen (Princeton University Observatory)","Testing Cold Dark Matter Models At Moderate to High Redshift","ApJ in press (1998), 26 emulateapj pages",,"10.1086/306466",,"astro-ph",,"  The COBE microwave background temperature fluctuations and the abundance of
local rich clusters of galaxies provide the two most powerful constraints on
cosmological models. When all variants of the standard cold dark matter (CDM)
model are subject to the combined constraint, the power spectrum of any model
is fixed to $\sim 10%$ accuracy in both the shape and overall amplitude. These
constrained models are not expected to differ dramatically in their local
large-scale structure properties. However, their evolutionary histories differ,
resulting in dramatic differences towards high redshift. We examine in detail
six standardized, COBE and cluster normalized CDM models with respect to a
large set of independent observations. The observations include correlation
function of rich clusters of galaxies, galaxy power spectrum, evolution of rich
cluster abundance, gravitational lensing by moderate -to-high redshift
clusters, $\lya$ forest, damped $\lya$ systems, high redshift galaxies,
reionization of the universe and future CMB experiments. It seems that each of
the independent observations examined is or potentially is capable of
distinguishing between at least some of the models. The combined power of
several or all of these observations is tremendous. Thus, we appear to be on
the verge of being able to make dramatic tests of all models in the near future
using a rapidly growing set of observations, mostly at moderate to high
redshift. Consistency or inconsistency between different observed phenomena on
different scales and/or at different epochs with respect to the models will
have profound implications for theory of growth of cosmic structure.
","[{""version"":""v1"",""created"":""Tue, 4 Aug 1998 22:46:48 GMT""}]","2009-10-30"
"astro-ph/9808033","Gustavo A. Medina Tanco","Gustavo Medina Tanco (Inst.Astron.e Geof.-USP-Brasil & Univ.of
  Leeds-UK) and Alan A. Watson (Dept.Phys.& Astron. Univ.of Leeds-UK)","The photodisintegration of cosmic ray nuclei by solar photons: the
  Gerasimova-Zatsepin effect revisted","14 pages, 7 figures (3 ps + 4 jpg), Astroparticle Physics (in press)
  - typos corrected and other minor modifications","Astropart.Phys.10:157-164,1999","10.1016/S0927-6505(98)00056-5",,"astro-ph",,"  The interesting possibility of measuring the masses of high energy cosmic ray
particles by observing pairs of extensive air showers arriving at the earth
nearly simultaneously was proposed some years ago by Gerasimova and Zatsepin
(1960). Such showers would be created by the nuclear fragments originating as a
result of the photodisintegration of massive nuclei interacting with the solar
radiation field. In this paper we re-visit this possibility in the context of
existing and proposed detectors of high and ultra-high energy cosmic rays
considering a simple, yet realistic, model of the interplanetary magnetic
field. The possibilty of observing the mass fragmentation of cosmic rays
directly, however, remains challenging.
","[{""version"":""v1"",""created"":""Tue, 4 Aug 1998 23:02:04 GMT""},{""version"":""v2"",""created"":""Wed, 14 Oct 1998 14:27:09 GMT""}]","2011-05-23"
"astro-ph/9808034","Chung-Pei Ma","Chung-Pei Ma (U. Penn.), Todd A. Small (IoA, Cambridge), and Wallace
  L. W. Sargent (Caltech)","Weighing Superclusters","10 pages, 3 postscript figures, LaTex using paspconf.sty. To appear
  in PASP Conference Series ""Cosmic Microwave Background and Large Scale
  Structure of the Universe""","ASP Conf. Ser. vol. 151 (1998) 89-98",,,"astro-ph",,"  We present a summary report on a detailed study of the mass and dynamical
state of the Corona Borealis supercluster using the largest redshift survey of
this object to date. Extensive $N$-body experiments are performed on simulated
superclusters in both critically-flat and low-density cosmological models to
test the robustness and errors of the mass estimators used on the data. From
the redshifts and dynamics of 528 galaxies in the supercluster, the mass of
Corona Borealis is estimated to be at least $3\times 10^{16} h^{-1} M_\odot$,
and the mass-to-light ratio is $560 h (M/L)_\odot$, yielding a matter density
parameter of $\Omega_m\approx 0.4$. We also discuss the prospects for mapping
the mass distribution on supercluster scales with gravitational lensing.
","[{""version"":""v1"",""created"":""Wed, 5 Aug 1998 05:36:55 GMT""}]","2007-05-23"
"astro-ph/9808035","Luciano Burderi","L. Burderi, A. R. King","A Firm Upper Limit to the Radius of the Neutron Star in SAX J1808.4-3658","(7 pages, 1 figure, accepted for publication in ApJ Letters)",,"10.1086/311611",,"astro-ph",,"  We show that observations of X-ray pulsing from SAX J1808.4-3658 place a firm
upper limit of 13.8 m^{1/3} km on the radius of the neutron star, where m is
its mass in solar units. The limit is independent of distance or assumptions
about the magnetospheric geometry, and could be significantly tightened by
observations of the pulsations in the near future. We discuss the implications
for the equation of state and the possible neutron star mass.
","[{""version"":""v1"",""created"":""Wed, 5 Aug 1998 06:41:59 GMT""},{""version"":""v2"",""created"":""Sat, 8 Aug 1998 01:13:24 GMT""}]","2009-10-30"
"astro-ph/9808036","Charles F. Gammie","Charles F. Gammie, Ramesh Narayan, and Roger Blandford","What is the Accretion Rate in NGC 4258?","9 pages, 3 figures, latex, emulateapj.sty, submitted to ApJ",,"10.1086/307089",,"astro-ph",,"  We consider the implications of recent infrared and radio observations of the
nucleus of NGC 4258. There is no direct evidence that the nucleus has been
steadily accreting on the viscous timescale of the outer masing disk, which is
>~ 10^9 \yr. Thus the mass accretion rate in the outer disk need not be the
same as in the inner accretion flow where most of the gravitational binding
energy is released. We show that an advection-dominated flow model with a
transition radius of \sim (10-100) M (where M is the mass of the hole) and
\mdot \approx 10^{-2}\msun \yr^{-1} is consistent with the observed spectrum
from radio to X-rays. We also show that a thin (flat or warped) disk can fit
the observed fluxes outside the X-ray band. The X-rays can be explained by
means of a corona in such a model, but the absence of radio emission from the
location of the putative central black hole provides a serious constraint on
the properties of the corona. A wide range of accretion rates, 10^{-4} <~ \mdot
<~ 10^{-2} \msun\yr^{-1}, can be made to fit the data, but the most ``natural''
models have 10^{-3} <~ \mdot <~ 10^{-2} \msun\yr^{-1}. Physical conditions in
the observed VLBI jet features can also be related to conditions in the inner
accretion flow. We conclude with a list of future observations that might help
to constrain the accretion rate.
","[{""version"":""v1"",""created"":""Wed, 5 Aug 1998 12:19:37 GMT""}]","2009-10-30"
"astro-ph/9808037","Niel Brandt","W.N. Brandt (Penn State), Th. Boller (MPE)","Ultrasoft Narrow-Line Seyfert 1 galaxies: What physical parameter
  ultimately drives the structure and kinematics of their Broad Line Regions?","12 pg, 4 figs, needs paspconf.sty, to be published in the proc. of
  the `Structure and Kinematics of Quasar Broad Line Regions' conference (eds.
  C.M. Gaskell et al.), 23-26 March 1998, Lincoln, Nebraska, also available
  from http://www.astro.psu.edu/users/niel/papers/papers.html","ASP Conf.Ser. 175 (1999) 265",,,"astro-ph",,"  Recent X-ray observations have advanced the study of ultrasoft Narrow-Line
Seyfert 1 galaxies and have revealed strikingly clear correlations between
optical emission line properties and the shape of the X-ray continuum. In
particular, the strength of the soft X-ray excess relative to the hard X-ray
power law appears to be directly related to the `primary eigenvector' of
Boroson & Green. Ultrasoft Narrow-Line Seyfert 1s lie toward one extreme of the
primary eigenvector, and their extreme X-ray spectral, X-ray variability and
optical emission line properties suggest that they have extremal values of a
primary physical parameter. We discuss efforts to identify this parameter and
the observational evidence that it is the fraction of the Eddington rate at
which the supermassive black hole is accreting.
","[{""version"":""v1"",""created"":""Wed, 5 Aug 1998 14:06:42 GMT""}]","2007-05-23"
"chao-dyn/9808003",,"Y. Alhassid and Yan V. Fyodorov","The Spectral Autocorrelation Function in Weakly Open Chaotic Systems:
  Indirect Photodissociation of Molecules","13 pages, 1 Postscript figure included, RevTex",,"10.1021/jp9821836",,"chao-dyn cond-mat nlin.CD",,"  We derive the statistical limit of the spectral autocorrelation function and
of the survival probability for the indirect photodissociation of molecules in
the regime of non-overlapping resonances. The results are derived in the
framework of random matrix theory, and hold more generally for any chaotic
quantum system that is weakly coupled to the continuum. The ""correlation hole""
that characterizes the spectral autocorrelation in the bound molecule
diminishes as the typical average total width of a resonance increases.
","[{""version"":""v1"",""created"":""Wed, 5 Aug 1998 03:43:06 GMT""}]","2016-09-28"
"chao-dyn/9808004","Giovanni Gallavotti","Giovanni Gallavotti (Universita' di Roma 1, Italia)","Chaotic Hypothesis and Universal Large Deviations Properties","29 pages: Plain-TeX, 1 figure","Documenta Mathematica, extra volume ICM98, vol. I, p. 205--233,
  1998",,"FM96-16","chao-dyn nlin.CD",,"  Chaotic systems arise naturally in Statistical Mechanics and in Fluid
Dynamics. A paradigm for their modelization are smooth hyperbolic systems. Are
there consequences that can be drawn simply by assuming that a system is
hyperbolic? here we present a few model independent general consequences which
may have some relevance for the Physics of chaotic systems. Expanded version of
a talk at ICM98, Berlin.
","[{""version"":""v1"",""created"":""Wed, 5 Aug 1998 11:29:57 GMT""}]","2008-02-26"
"chao-dyn/9808005","Giovanni Gallavotti","Giovanni Gallavotti","A local fluctuation theorem","plain TeX, 1 figure","Physica A, 263, 39--50, 1999","10.1016/S0378-4371(98)00502-0","FM 98-15","chao-dyn nlin.CD",,"  A mechanism for the validity of a local version of the fluctuation theorem,
uniform in the system size, is discussed for a reversible chain of weakly
coupled Anosov systems.
","[{""version"":""v1"",""created"":""Wed, 5 Aug 1998 11:47:58 GMT""}]","2009-10-31"
"cmp-lg/9808002","Julio Gonzalo Arroyo","Julio Gonzalo, Felisa Verdejo, Irina Chugur and Juan Cigarran (UNED,
  Spain)","Indexing with WordNet synsets can improve Text Retrieval","7 pages, LaTeX2e, 3 eps figures, uses epsfig, colacl.sty","Proceedings of the COLING/ACL'98 Workshop on Usage of WordNet for
  NLP, Montreal, 1998",,,"cmp-lg cs.CL",,"  The classical, vector space model for text retrieval is shown to give better
results (up to 29% better in our experiments) if WordNet synsets are chosen as
the indexing space, instead of word forms. This result is obtained for a
manually disambiguated test collection (of queries and documents) derived from
the Semcor semantic concordance. The sensitivity of retrieval performance to
(automatic) disambiguation errors when indexing documents is also measured.
Finally, it is observed that if queries are not disambiguated, indexing by
synsets performs (at best) only as good as standard word indexing.
","[{""version"":""v1"",""created"":""Wed, 5 Aug 1998 14:13:08 GMT""}]","2007-05-23"
"cond-mat/9808039","Joerg C. Lemm","Joerg C. Lemm","How to Implement A Priori Information: A Statistical Mechanics Approach","88 pages, 9 figures (enlarged version)",,,"MS-TP1-98-12","cond-mat.dis-nn adap-org cond-mat.stat-mech nlin.AO",,"  A new general framework is presented for implementing complex a priori
knowledge, having in mind especially situations where the number of available
training data is small compared to the complexity of the learning task. A
priori information is hereby decomposed into simple components represented by
quadratic building blocks (quadratic concepts) which are then combined by
conjunctions and disjunctions to built more complex, problem specific error
functionals. While conjunction of quadratic concepts leads to classical
quadratic regularization functionals, disjunctions, representing ambiguous
priors, result in non--convex error functionals. These go beyond classical
quadratic regularization approaches and correspond, in Bayesian interpretation,
to non--gaussian processes. Numerical examples show that the resulting
stationarity equations, despite being in general nonlinear, inhomogeneous
(integro--)differential equations, are not necessarily difficult to solve.
Appendix A relates the formalism of statistical mechanics to statistics and
Appendix B describes the framework of Bayesian decision theory.
","[{""version"":""v1"",""created"":""Tue, 4 Aug 1998 17:45:53 GMT""},{""version"":""v2"",""created"":""Thu, 27 Aug 1998 20:17:40 GMT""},{""version"":""v3"",""created"":""Mon, 14 Dec 1998 23:55:40 GMT""}]","2007-05-23"
"cond-mat/9808040","Andrei Manolescu","A. Manolescu, S. D. M. Zwerschke, M. Nita, U. J. Gossmann, and R. R.
  Gerhardts","Quantum analog of channeled electron trajectories in periodic magnetic
  and electric fields","8 pages with 4 included ps figures, contribution to ""SemiMag 13""
  Nijmegen, August 1998, to appear in Physica B",,"10.1016/S0921-4526(98)00564-X",,"cond-mat.mes-hall",,"  We calculate the quantum states corresponding to the drifting and channeled
classical orbits in a two-dimensional electron gas (2DEG) with strong magnetic
and electric modulations along one spatial direction, $x$. The channeled states
carry high, concentrated currents along the $y$ axis, and are confined in an
effective potential well. The quantum and the classical states are compared.
","[{""version"":""v1"",""created"":""Tue, 4 Aug 1998 18:29:08 GMT""}]","2009-10-31"
"cond-mat/9808041","Rui Vilela Mendes","Joao Martins and R. Vilela Mendes (Laboratorio de Mecatronica, DEEC,
  IST, Portugal)","Neural networks and logical reasoning systems. A translation table",,"International Journal of Neural Systems 11 (2001) 179-186",,,"cond-mat.dis-nn",,"  A correspondence is established between the elements of logic reasoning
systems (knowledge bases, rules, inference and queries) and the hardware and
dynamical operations of neural networks. The correspondence is framed as a
general translation dictionary which, hopefully, will allow to go back and
forth between symbolic and network formulations, a desirable step in
learning-oriented systems and multicomputer networks. In the framework of Horn
clause logics it is found that atomic propositions with n arguments correspond
to nodes with n-th order synapses, rules to synaptic intensity constraints,
forward chaining to synaptic dynamics and queries either to simple node
activation or to a query tensor dynamics.
","[{""version"":""v1"",""created"":""Tue, 4 Aug 1998 18:38:03 GMT""}]","2007-05-23"
"cond-mat/9808042","Matthias Henny","M. Henny, S. Oberholzer, C. Strunk and C. Sch\""onenberger","The 1/3-shot noise suppression in diffusive nanowires","10 figures",,"10.1103/PhysRevB.59.2871",,"cond-mat.mes-hall",,"  We report low-temperature shot noise measurements of short diffusive Au wires
attached to electron reservoirs of varying sizes. The measured noise
suppression factor compared to the classical noise value $2e\left| I\right| $
strongly depends on the electric heat conductance of the reservoirs. For small
reservoirs injection of hot electrons increases the measured noise and hence
the suppression factor. The universal 1/3-suppression factor can only
asymptotically be reached for macroscopically large and thick electron
reservoirs. A heating model based on the Wiedemann-Franz law is used to explain
this effect.
","[{""version"":""v1"",""created"":""Tue, 4 Aug 1998 19:02:57 GMT""}]","2016-08-15"
"cond-mat/9808043","Rui Vilela Mendes","R. Vilela Mendes (Grupo de Fisica-Matematica, Lisboa, Portugal)","Dynamics of networks and applications","Talk at the Heraeus Seminar ""Scientific Applications of Neural Nets"",
  to appear in the proceedings (Springer LNP)","in ""Scientific Applic. of Neural Nets"", Springer Lect. Notes in
  Physics 522, 1999",,,"cond-mat.dis-nn",,"  A survey is made of several aspects of the dynamics of networks, with special
emphasis on unsupervised learning processes, non-Gaussian data analysis and
pattern recognition in networks with complex nodes.
","[{""version"":""v1"",""created"":""Tue, 4 Aug 1998 19:04:49 GMT""}]","2009-09-25"
"cond-mat/9808044","M. Imada","Masatoshi Imada(1), Fakher F. Assaad(2), Hirokazu Tsunetsugu(3) and
  Yukitoshi Motome(4) ((1) ISSP, Univ. Tokyo, (2)Univ. Stuttgart (3)Univ.
  Tsukuba, (4) Tokyo Inst. Technology)","Metal-Insulator and Superconductor-Insulator Transitions in Correlated
  Electron Systems","14 pages, LaTeX, 2 figures included",,,,"cond-mat.str-el",,"  Quantum transitions between the Mott insulator and metals by controlling
filling in two-dimensional square lattice are characterized by a large
dynamical exponent $z=4$ where the origin of unusual metallic properties near
the Mott insulator are ascribed to the proximity of the transition. The scaling
near the transition indicates the formation of flat dispersion area due to
singular momentum dependence of the single-particle renormalization. The flat
dispersion controls critical properties of the Mott transition. An instability
of the flat dispersion to the d-wave superconducting order is discussed. We
also discuss a case of the Mott transition for a model of Mn perovskite
compounds with orbital degeneracy where orbital correlation length shows
critical divergence toward the metal-insulator transition.
","[{""version"":""v1"",""created"":""Wed, 5 Aug 1998 06:36:59 GMT""}]","2007-05-23"
"cond-mat/9808045","Shahverdiev Elman M. Institute of Physics","Shahverdiev E.M","Chaos control in photoconductors","6 pages, LaTeX",,,,"cond-mat chao-dyn nlin.CD",,"  Chaos synchronization in one of charge-carrier dynamical systems in
photoconductors is studied within both the replica and nonreplica approaches.It
has been shown that using the boundedness of the solutions of the dynamical
systems, nonreplica approach to chaos synchronization and Routh-Hurwitz
criteria, it is possible to make negative all the conditional Lyapunov
exponents without complex numerical and analytical calculations.
","[{""version"":""v1"",""created"":""Wed, 5 Aug 1998 06:42:54 GMT""}]","2007-05-23"
"cond-mat/9808046","Raffaella Burioni","Raffaella Burioni, Davide Cassi and Alessandro Vezzani","Magnetization bound for classical spin models on graphs","14 pages",,,"UPRF-98-05","cond-mat.stat-mech",,"  In this paper we prove the existence of phase transitions at finite
temperature for O(n) classical ferromagnetic spin models on infrared finite
graphs. Infrared finite graphs are infinite graphs with $\lim {m\to 0^+} {\bar
Tr (L+m)^{-1} < \infty$, where $L$ is the Laplacian operator of the graph. The
ferromagnetic couplings are only requested to be bounded by two positive
constants. The proof, inspired by the classical result of Fr\""ohlich, Simon and
Spencer on lattices, is given through a rigorous bound on the average
magnetization. The result holds for $n\ge 1$ and it includes as a particular
case the Ising model.
","[{""version"":""v1"",""created"":""Wed, 5 Aug 1998 09:16:22 GMT""}]","2007-05-23"
"cond-mat/9808047","Deepak Dhar","Deepak Dhar (Tata Institute of Fund. Research, Mumbai)","The abelian sandpile and related models","Typos and minor errors fixed and some references added","Physica A 263(1999) 4.","10.1016/S0378-4371(98)00493-2","TIFR/TH/98-32","cond-mat.stat-mech",,"  The Abelian sandpile model is the simplest analytically tractable model of
self-organized criticality. This paper presents a brief review of known results
about the model. The abelian group structure allows an exact calculation of
many of its properties. In particular, one can calculate all the critical
exponents for the directed model in all dimensions. For the undirected case,
the model is related to q= 0 Potts model. This enables exact calculation of
some exponents in two dimensions, and there are some conjectures about others.
We also discuss a generalization of the model to a network of communicating
reactive processors. This includes sandpile models with stochastic toppling
rules as a special case. We also consider a non-abelian stochastic variant,
which lies in a different universality class, related to directed percolation.
","[{""version"":""v1"",""created"":""Wed, 5 Aug 1998 10:39:25 GMT""},{""version"":""v2"",""created"":""Thu, 22 Oct 1998 09:39:43 GMT""}]","2009-10-31"
"cond-mat/9808048","Yasuhiro Matusita","Yasuhiro Matsushita (1), Martin P. Gelfand (2) and Chikara Ishii (1)
  ((1) Science Univ. of Tokyo, (2) Colorado State Univ.)","Bond-Operator Mean Field Theory for the Bilayer Heisenberg Model","10 pages, LaTeX, 8 figures, uses jpsj.sty, revised version: minor
  changes to the text, to appear in J. Phys. Soc. Jpn. Vol.68 No.1 (January
  1999)","J. Phys. Soc. Jpn., 68 (1999) 247","10.1143/JPSJ.68.247",,"cond-mat.str-el",,"  Bond-operator mean field equations for the square-lattice, S=1/2 bilayer
Heisenberg model are developed and solved numerically. In the vicinity of both
the zero-field critical point and the field-induced transitions, comparisons
are made with T=0 and finite-temperature strong coupling expansions. The
mean-field theory suggests that the quantum critical region for the
field-induced transitions is restricted to significantly lower temperatures
than one might have concluded based on strong-coupling expansions or other
numerical studies.
","[{""version"":""v1"",""created"":""Wed, 5 Aug 1998 11:08:03 GMT""},{""version"":""v2"",""created"":""Thu, 6 Aug 1998 01:22:12 GMT""},{""version"":""v3"",""created"":""Mon, 26 Oct 1998 12:11:29 GMT""}]","2009-10-31"
"cond-mat/9808049","Alexander V. Boris","A. V. Boris, N. N. Kovaleva, A. V. Bazhenov, P. J. M. van Bentum, Th.
  Rasing, S-W. Cheong, A. V. Samoilov, N.-C. Yeh","Infrared Studies of a La_{0.67}Ca_{0.33}MnO_3 Single Crystal: Optical
  Magnetoconductivity in a Half-Metallic Ferromagnet","4 pages, 4 figures, Latex, PostScript; The 7th Joint MMM-Intermag
  Conference,San Francisco, January 6-9, 1998; The Int. Conf. on Strongly
  Correlated Electron Systems, Paris, July 15-18,1998",,"10.1103/PhysRevB.59.R697",,"cond-mat.str-el",,"  The infrared reflectivity of a $\rm La_{0.67}Ca_{0.33}MnO_3$ single crystal
is studied over a broad range of temperatures (78-340 K), magnetic fields (0-16
T), and wavenumbers (20-9000 cm$^{-1}$). The optical conductivity gradually
changes from a Drude-like behavior to a broad peak feature near 5000 cm$^{-1}$
in the ferromagnetic state below the Curie temperature $T_C=307 K$. Various
features of the optical conductivity bear striking resemblance to recent
theoretical predictions based on the interplay between the double exchange
interaction and the Jahn-Teller electron-phonon coupling. A large optical
magnetoconductivity is observed near $T_C$.
","[{""version"":""v1"",""created"":""Wed, 5 Aug 1998 13:55:11 GMT""}]","2019-08-17"
