"hep-th/9808014","Jose M. Figueroa-O'Farrill","BS Acharya, JM Figueroa-O'Farrill, CM Hull and B Spence","Branes at conical singularities and holography","38 pages (published version)","Adv.Theor.Math.Phys.2:1249-1286,1999",,"QMW-PH-98-32","hep-th",,"  For supergavrity solutions which are the product of an anti-de Sitter space
with an Einstein space X, we study the relation between the amount of
supersymmetry preserved and the geometry of X. Depending on the dimension and
the amount of supersymmetry, the following geometries for X are possible, in
addition to the maximally supersymmetric spherical geometry: Einstein-Sasaki in
dimension 2k+1, 3-Sasaki in dimension 4k+3, 7-dimensional manifolds of weak G_2
holonomy and 6-dimensional nearly Kaehler manifolds. Many new examples of such
manifolds are presented which are not homogeneous and have escaped earlier
classification efforts. String or M theory in these vacua are conjectured to be
dual to superconformal field theories. The brane solutions interpolating
between these anti-de Sitter near-horizon geometries and the product of
Minkowski space with a cone over X lead to an interpretation of the dual
superconformal field theory as the world-volume theory for branes at a conical
singularity (cone branes). We propose a description of those field theories
whose associated cones are obtained by (hyper-)Kaehler quotients.
","[{""version"":""v1"",""created"":""Tue, 4 Aug 1998 19:29:28 GMT""},{""version"":""v2"",""created"":""Fri, 28 Aug 1998 17:42:52 GMT""},{""version"":""v3"",""created"":""Fri, 14 May 1999 14:29:46 GMT""}]","2008-11-26"
"hep-th/9808015","A. Hatzinikitas","A. Hatzinikitas","Classical and quantum motion on the orbifold limit of the Eguchi-Hanson
  metric","18 pages","Nuovo Cim. B114 (1999) 427-445",,,"hep-th",,"  We investigate the behaviour of a particle moving on the quotient manifold
$M=C^2/Z_$ which is derived from the EH metric as the two centers approach each
other. In the classical region of the configuration space we specify the
physically acceptable solutions and observe a tendency of the radial wave
function to concentrate around the conical singularity. Fot the quantum case,
using Schr\""{o}dinger's equation, we determine the energy spectra and the
radial eigenfunctions for a class of potentials.
","[{""version"":""v1"",""created"":""Tue, 4 Aug 1998 21:41:36 GMT""},{""version"":""v2"",""created"":""Fri, 18 Jun 1999 14:11:26 GMT""}]","2007-05-23"
"hep-th/9808016","Michael Douglas","Tom Banks, Michael R. Douglas, Gary T. Horowitz and Emil Martinec","AdS Dynamics from Conformal Field Theory","harvmac, 26 pp",,,"NSF-ITP-98-082, EFI-98-30, RU-98-xx","hep-th",,"  We explore the extent to which a local string theory dynamics in anti-de
Sitter space can be determined from its proposed Conformal Field Theory (CFT)
description. Free fields in the bulk are constructed from the CFT operators,
but difficulties are encountered when one attempts to incorporate interactions.
We also discuss general features of black hole dynamics as seen from the CFT
perspective. In particular, we argue that the singularity of AdS_3 black holes
is resolved in the CFT description.
","[{""version"":""v1"",""created"":""Tue, 4 Aug 1998 21:49:51 GMT""}]","2007-05-23"
"hep-th/9808017","Vijay Balasubramanian","Vijay Balasubramanian, Per Kraus, Albion Lawrence and Sandip Trivedi","Holographic Probes of Anti-de Sitter Spacetimes","28 pages, LaTex. References added","Phys.Rev. D59 (1999) 104021","10.1103/PhysRevD.59.104021","HUTP-98/A057, CALT68-2189, Fermilab-Pub-98/240-T","hep-th",,"  We describe probes of anti-de Sitter spacetimes in terms of conformal field
theories on the AdS boundary. Our basic tool is a formula that relates bulk and
boundary states -- classical bulk field configurations are dual to expectation
values of operators on the boundary. At the quantum level we relate the
operator expansions of bulk and boundary fields. Using our methods, we discuss
the CFT description of local bulk probes including normalizable wavepackets,
fundamental and D-strings, and D-instantons. Radial motions of probes in the
bulk spacetime are related to motions in scale on the boundary, demonstrating a
scale-radius duality. We discuss the implications of these results for the
holographic description of black hole horizons in the boundary field theory.
","[{""version"":""v1"",""created"":""Tue, 4 Aug 1998 23:08:50 GMT""},{""version"":""v2"",""created"":""Wed, 12 Aug 1998 18:13:34 GMT""}]","2009-10-31"
"hep-th/9808019","Zurab Kakushadze","Zurab Kakushadze","String Expansion as 't Hooft's Expansion","14 pages, latex with sprocl.sty, talk presented at PASCOS'98","Published in Proceedings of PASCOS 98 (Boston, 1998), ed. P. Nath
  (World Scientific, Singapore, 1999), pp. 635-648",,"HUTP-98/A053, NUB 3182","hep-th",,"  We briefly review some recent developments in large N gauge theories which
utilize the power of string perturbation techniques.
","[{""version"":""v1"",""created"":""Wed, 5 Aug 1998 05:56:31 GMT""}]","2014-05-08"
"hep-th/9808020","Pesando Igor","I. Pesando","A k Gauge Fixed Type IIB Superstring Action on AdS_{5} X S_{5}","5 pages. Corrected some typos and added a COMPLETE explanation of why
  kappa symmetry is fixed using a supersolvable algebra. FINAL version
  pubblished in JHEP 11(1998)002","JHEP 9811:002,1998","10.1088/1126-6708/1998/11/002","DFTT-45/98","hep-th",,"  We describe the type IIB supergravity background on AdS_{5} X S_{5} using the
potentials of AdS_{5|4} X S_{5} and we use the supersolvable algebra associated
to AdS_{5|4} to compute the k gauge fixed type IIB string action.
","[{""version"":""v1"",""created"":""Wed, 5 Aug 1998 09:27:31 GMT""},{""version"":""v2"",""created"":""Thu, 20 Aug 1998 09:06:57 GMT""},{""version"":""v3"",""created"":""Wed, 13 Jan 1999 11:18:40 GMT""}]","2010-02-03"
"hep-th/9808021","Marek Pawlowski","Marek Pawlowski (Soltan Institute for Nuclear Studies, Warsaw)","Conformal Symmetry and Unification","10 pages, latex, aipproc.sty, no figures, talk given at the
  International Conference Particles, Fields and Gravitation, Lodz, April 1998","AIP Conf.Proc.453:394-403,1998","10.1063/1.57106",,"hep-th gr-qc hep-ph",,"  The Weyl-Weinberg-Salam model is presented. It is based on the local
conformal gauge symmetry. The model identifies the Higgs scalar field in SM
with the Penrose-Chernikov-Tagirov scalar field of the conformal theory of
gravity. Higgs mechanism for generation of particle masses is replaced by the
originated in Weyl's ideas conformal gauge scale fixing. Scalar field is no
longer a dynamical field of the model and does not lead to quantum
particle-like excitations that could be observed in HE experiments.
Cosmological constant is naturally generated by the scalar quadric term. The
model admits Weyl vector bosons that can mix with photon and weak bosons.
","[{""version"":""v1"",""created"":""Wed, 5 Aug 1998 13:27:48 GMT""}]","2010-12-13"
"hep-th/9808022","Seiji Terashima","Seiji Terashima and Sung-Kil Yang","Seiberg-Witten Geometry with Various Matter Contents","21 pages, LaTex, 1 figure","Nucl.Phys. B537 (1999) 344-360","10.1016/S0550-3213(98)00646-4","UTHEP-385","hep-th",,"  We obtain the Seiberg-Witten geometry for four-dimensional N=2 gauge theory
with gauge group SO(2N_c) (N_c \leq 5) with massive spinor and vector
hypermultiplets by considering the gauge symmetry breaking in the N=2 $E_6$
theory with massive fundamental hypermultiplets. In a similar way the
Seiberg-Witten geometry is determined for N=2 SU(N_c) (N_c \leq 6) gauge theory
with massive antisymmetric and fundamental hypermultiplets. Whenever possible
we compare our results expressed in the form of ALE fibrations with those
obtained by geometric engineering and brane dynamics, and find a remarkable
agreement. We also show that these results are reproduced by using N=1
confining phase superpotentials.
","[{""version"":""v1"",""created"":""Wed, 5 Aug 1998 13:34:04 GMT""}]","2009-10-31"
"hep-th/9808023","Peter Bantay","Peter Bantay","Orbifoldization, covering surfaces and uniformization theory","6 pages","Lett.Math.Phys. 57 (2001) 1-5",,"ITP Budapest 542","hep-th",,"  The connection between the theory of permutation orbifolds, covering surfaces
and uniformization is investigated, and the higher genus partition functions of
an arbitrary permutation orbifold are expressed in terms of those of the
original theory.
","[{""version"":""v1"",""created"":""Wed, 5 Aug 1998 14:12:08 GMT""}]","2007-05-23"
"hep-th/9808024","Costas Kounnas","Andrea Gregori, Costas Kounnas and P. Marios Petropoulos","Non-Perturbative Gravitational Corrections in a Class of N=2 String
  Duals","24 pages, latex, no figures, typos and minor misprints corrected,
  references added","Nucl.Phys.B537:317-343,1999","10.1016/S0550-3213(98)00698-1","CERN-TH/98-195, LPTENS-98/15, CPTH-S609.0498","hep-th",,"  We investigate the non-perturbative equivalence of some heterotic/type II
dual pairs with N=2 supersymmetry. The perturbative heterotic scalar manifolds
are respectively SU(1, 1)/U(1) x SO(2, 2+NV)/ SO(2) x SO(2+NV) and SO(4, 4+NH)/
SO(4) x SO(4+NH) for moduli in the vector multiplets and hypermultiplets. The
models under consideration correspond, on the type II side, to self-mirror
Calabi-Yau threefolds with Hodge numbers h(1,1)= NV +3= h(2,1)= NH +3, which
are K3 fibrations. We consider three classes of dual pairs, with NV=NH=8, 4 and
2. The models with h(1,1)=7 and 5 provide new constructions, while the
h(1,1)=11, already studied in the literature, is reconsidered here.
Perturbative R2-like corrections are computed on the heterotic side by using a
universal operator whose amplitude has no singularities in the (T,U) space, and
can therefore be compared with the type II side result. We point out several
properties connecting K3 fibrations and spontaneous breaking of the N=4
supersymmetry to N=2. As a consequence of the reduced S- and T- duality
symmetries, the instanton numbers in these three classes are restricted to
integers, which are multiples of 2, 2 and 4, for NV=8, 4 and 2, respectively.
","[{""version"":""v1"",""created"":""Wed, 5 Aug 1998 15:32:20 GMT""},{""version"":""v2"",""created"":""Wed, 12 Aug 1998 16:57:46 GMT""},{""version"":""v3"",""created"":""Tue, 5 Jan 1999 16:39:40 GMT""}]","2014-11-18"
"math/9808016",,"P. Podles (Warsaw University)","Quantum Minkowski spaces","one reference added, 13 pages, LaTeX file","``Particles, Fields, and Gravitation'', J. Rembielinski (ed.),
  Lodz, Poland, AIP Conference Proceedings 453 (1998), 97-106","10.1063/1.57123",,"math.QA math-ph math.MP",,"  A survey of results on quantum Poincare groups and quantum Minkowski spaces
is presented.
","[{""version"":""v1"",""created"":""Tue, 4 Aug 1998 18:42:13 GMT""},{""version"":""v2"",""created"":""Wed, 6 Jan 1999 14:12:02 GMT""},{""version"":""v3"",""created"":""Fri, 8 Jan 1999 12:18:12 GMT""}]","2009-10-31"
"math/9808017","Mihai Ciucu","Mihai Ciucu","Plane partitions I: a generalization of MacMahon's formula","35 pages, 34 figures. New to this version: a few typos were
  corrected, and the journal information is included. Memoirs of Amer. Math.
  Soc., accepted, to appear",,,,"math.CO",,"  The number of plane partitions contained in a given box was shown by MacMahon
to be given by a simple product formula. By a simple bijection, this formula
also enumerates lozenge tilings of hexagons of side-lengths $a,b,c,a,b,c$ (in
cyclic order) and angles of 120 degrees. We present a generalization in the
case $b=c$ by giving simple product formulas enumerating lozenge tilings of
regions obtained from a hexagon of side-lengths $a,b+k,b,a+k,b,b+k$ (where $k$
is an arbitrary non-negative integer) and angles of 120 degrees by removing
certain triangular regions along its symmetry axis.
","[{""version"":""v1"",""created"":""Tue, 4 Aug 1998 19:17:13 GMT""},{""version"":""v2"",""created"":""Mon, 25 Aug 2003 18:24:45 GMT""},{""version"":""v3"",""created"":""Thu, 4 Sep 2003 17:39:08 GMT""},{""version"":""v4"",""created"":""Fri, 29 Oct 2004 21:54:56 GMT""}]","2007-05-23"
"math/9808018","Mihai Ciucu","Mihai Ciucu and Christian Krattenthaler","Plane partitions II: 5 1/2 symmetry classes","17 pages, 16 figures","in: ""Combinatorial Methods in Representation Theory,"" M.
  Kashiwara, K. Koike, S. Okada, I. Terada, H. Yamada, eds., Advanced Studies
  in Pure Mathematics, vol. 28, RIMS, Kyoto, 2000, pp. 83-103",,,"math.CO",,"  We present new, simple proofs for the enumeration of five of the ten symmetry
classes of plane partitions contained in a given box. Four of them are derived
from a simple determinant evaluation, using combinatorial arguments. The
previous proofs of these four cases were quite complicated. For one more
symmetry class we give an elementary proof in the case when two of the sides of
the box are equal. Our results include simple evaluations of the determinants
$\det(\delta_{ij}+{x+i+j\choose i})_{0\leq i,j\leq n-1}$ and
$\det({x+i+j\choose 2j-i})_{0\leq i,j\leq n-1}$, notorious in plane partition
enumeration, whose previous evaluations were quite intricate.
","[{""version"":""v1"",""created"":""Tue, 4 Aug 1998 19:50:27 GMT""}]","2021-06-01"
"math/9808019","Mihai Ciucu","Mihai Ciucu","The equivalence between enumerating cyclically symmetric,
  self-complementary and totally symmetric, self-complementary plane partitions",,,,,"math.CO",,"  We prove that the number of cyclically symmetric, self-complementary plane
partitions contained in a cube of side $2n$ equals the square of the number of
totally symmetric, self-complementary plane partitions contained in the same
cube, without explicitly evaluating either of these numbers. This appears to be
the first direct proof of this fact. The problem of finding such a proof was
suggested by Stanley.
","[{""version"":""v1"",""created"":""Tue, 4 Aug 1998 20:07:27 GMT""}]","2007-05-23"
"math/9808020","Wolfgang M. Ruppert","Wolfgang M. Ruppert","Two-dimensional complex tori with multiplication by $\sqrt{d}$","Latex, 4 pages",,,,"math.AG",,"  We give an elementary argument for the well known fact that the endomorphism
algebra $End_Q(A)$ of a simple complex abelian surface $A$ can neither be an
imaginary quadratic field nor a definite quaternion algebra. Another
consequence of our argument is that a two-dimensional complex torus $T$ with
$Q(\sqrt{d})\subseteq End_Q(A)$ where $Q(\sqrt{d})$ is real quadratic, is
algebraic.
","[{""version"":""v1"",""created"":""Wed, 5 Aug 1998 01:29:24 GMT""}]","2007-05-23"
"math/9808021","Wolfgang M. Ruppert","Wolfgang M. Ruppert","Reducibility of polynomials $f(x,y)$ modulo $p$","Latex, 7 pages",,,,"math.NT math.AG",,"  We consider absolutely irreducible polynomials $f \in Z[x,y]$ with
$\deg_x(f)=m$, $\deg_y(f)=n$ and height $H$. We show that for any prime $p$
with $p>c_{mn} H^{2mn+n-1}$ the reduction $f \bmod p$ is also absolutely
irreducible. Furthermore if the Bouniakowsky conjecture is true we show that
there are infinitely many absolutely irreducible polynomials $f \in Z[x,y]$
which are reducible mod $p$ where $p$ is a prime with $p>H^{2m}$.
","[{""version"":""v1"",""created"":""Wed, 5 Aug 1998 02:00:19 GMT""}]","2007-05-23"
"math/9808023","Kei Miki","Kei Miki","Toroidal and level 0 U'_q(\hat{sl_{n+1}}) actions on U_q(\hat{gl_{n+1}})
  modules","Latex, 20 pages",,"10.1063/1.533078",,"math.QA",,"  (1) Utilizing a Braid group action on a completion of U_q(\hat{sl_{n+1}}), an
algebra homomorphism from the toroidal algebra U_q(sl_{n+1,tor}) (n\ge 2) with
fixed parameter to a completion of U_q(\hat{gl_{n+1}}) is obtained.
  (2) The toroidal actions by Saito induces a level 0 U'_q(\hat{sl_{n+1}})
action on level 1 integrable highest weight modules of U_q(\hat{sl_{n+1}}).
Another level 0 U'_q(\hat{sl_{n+1}}) action is defined by Jimbo, et al., in the
case n=1. Using the fact that the intertwiners of U_q(\hat{sl_{n+1}}) modules
are intertwiners of toroidal modules for an appropriate comultiplication, the
relation between these two level 0 U'_q(\hat{sl_{n+1}}) actions is clarified.
","[{""version"":""v1"",""created"":""Wed, 5 Aug 1998 10:52:23 GMT""}]","2015-06-26"
"math/9808142","Kalman Gyory","Kalman Gyory, Min Ru","Integer solutions of a sequence of decomposable form inequalities",,,,"ANT-0124","math.NT",,"  In this paper, we prove the finiteness of the number of integer solutions of
the decomposable form inequalities. We also study the number of integer
solutions of a sequence of decomposable form inequalities.
","[{""version"":""v1"",""created"":""Wed, 5 Aug 1998 00:00:00 GMT""}]","2007-05-23"
"quant-ph/9808006","kazutomu Shiokawa","K. Shiokawa, B. L. Hu","Finite Number and Finite Size Effects in Relativistic Bose-Einstein
  Condensation","18 pages, 9 figures, Fig.3 replaced, to appear in Physical Review D","Phys.Rev. D60 (1999) 105016","10.1103/PhysRevD.60.105016","UMDPP98-102","quant-ph cond-mat",,"  Bose-Einstein condensation of a relativistic ideal Bose gas in a rectangular
cavity is studied. Finite size corrections to the critical temperature are
obtained by the heat kernel method. Using zeta-function regularization of
one-loop effective potential, lower dimensional critical temperatures are
calculated. In the presence of strong anisotropy, the condensation is shown to
occur in multisteps. The criteria of this behavior is that critical
temperatures corresponding to lower dimensional systems are smaller than the
three dimensional critical temperature.
","[{""version"":""v1"",""created"":""Tue, 4 Aug 1998 16:11:10 GMT""},{""version"":""v2"",""created"":""Fri, 18 Jun 1999 20:08:03 GMT""}]","2009-10-31"
"quant-ph/9808007","Robert Garisto","Robert Garisto and Lucien Hardy","Entanglement of projection and a new class of quantum erasers","12pp, 2 figs, LATEX (Revtex)","Phys.Rev. A60 (1999) 827","10.1103/PhysRevA.60.827",,"quant-ph hep-th",,"  We define a new measurement of entanglement, the entanglement of projection,
and find that it is natural to write the entanglements of formation and
assistance in terms of it. Our measure allows us to describe a new class of
quantum erasers which restore entanglement rather than just interference. Such
erasers can be implemented with simple quantum computer components. We propose
realistic optical versions of these erasers.
","[{""version"":""v1"",""created"":""Tue, 4 Aug 1998 23:00:00 GMT""}]","2009-10-31"
"quant-ph/9808008","Vladimir Z. Nuri","V. Z. Nuri","Local, deterministic hidden variable theories based on a loophole in
  Bell's theorem","21 pages, 7 figures, LaTeX2e",,,,"quant-ph",,"  This paper furthers the long historical examination of and debate on the
foundations of quantum mechanics (QM) by presenting two local hidden variable
(LHV) rules in the context of the EPRB experiment which violate Bell's
inequality, but which are nevertheless local and deterministic under reasonable
definitions of the terms, and coincide approximately with the conventional QM
prediction. The theories are based on the general idea of probabilistic
detection of particles depending on an interaction of hidden variables within
the measuring device and particle, and relate mathematically to Fourier
analysis. The crucial discrepancy of variations in the hidden variable
distribution based on relative polarizer orientations is isolated which
invalidates assumptions in Bell-type theorems. The first theory can be analyzed
completely symbolically whereas the second was analyzed using numerical
methods. The properties of the second in particular are shown to be
approximately consistent with the reported results and uncertainties in all
three Aspect experiments. Variation in the total photon pairs detected over
orientations is shown to be a basic characteristic of these theories. Some
comments on the relevance of active vs. passive locality are made. Two sections
consider these ideas relative to energy conservation and the measurement
problem (collapse of the wavefunction). One section proposes new experiments.
","[{""version"":""v1"",""created"":""Wed, 5 Aug 1998 01:03:57 GMT""},{""version"":""v2"",""created"":""Wed, 5 Aug 1998 22:18:11 GMT""}]","2007-05-23"
"quant-ph/9808009","Soren Have Hansen","O.E. Barndorff-Nielsen and R.D. Gill","Fisher information in quantum statistics","This version replaces the previous versions of February 1999 (titled
  'An Example of Non-Attainability of Expected Quantum Information') and that
  of November 1999. Proofs and results are much improved. To appear in J. Phys.
  A","J.Phys. A30 (2000) 4481-4490","10.1088/0305-4470/33/24/306",,"quant-ph math.ST stat.TH",,"  Braunstein and Caves (1994) proposed to use Helstrom's {\em quantum
information} number to define, meaningfully, a metric on the set of all
possible states of a given quantum system. They showed that the quantum
information is nothing else than the maximal Fisher information in a
measurement of the quantum system, maximized over all possible measurements.
Combining this fact with classical statistical results, they argued that the
quantum information determines the asymptotically optimal rate at which
neighbouring states on some smooth curve can be distinguished, based on
arbitrary measurements on $n$ identical copies of the given quantum system.
  We show that the measurement which maximizes the Fisher information typically
depends on the true, unknown, state of the quantum system. We close the
resulting loophole in the argument by showing that one can still achieve the
same, optimal, rate of distinguishability, by a two stage adaptive measurement
procedure.
  When we consider states lying not on a smooth curve, but on a manifold of
higher dimension, the situation becomes much more complex. We show that the
notion of ``distinguishability of close-by states'' depends strongly on the
measurement resources one allows oneself, and on a further specification of the
task at hand. The quantum information matrix no longer seems to play a central
role.
","[{""version"":""v1"",""created"":""Wed, 5 Aug 1998 11:04:35 GMT""},{""version"":""v2"",""created"":""Tue, 9 Feb 1999 11:39:15 GMT""},{""version"":""v3"",""created"":""Mon, 15 Nov 1999 11:46:29 GMT""},{""version"":""v4"",""created"":""Wed, 23 Feb 2000 11:44:32 GMT""}]","2009-10-31"
"solv-int/9808002","Antonio Lima Santos","A. Lima-Santos","Polynomial rings of the chiral $SU(N)_{2}$ models","10 pages, LaTex (ioplppt.sty)","J. Phys. A: Math. Gen 30 (1997) 8653-8660","10.1088/0305-4470/30/24/024",,"solv-int nlin.SI",,"  Via explicit diagonalization of the chiral $SU(N)_{2}$ fusion matrices, we
discuss the possibility of representing the fusion ring of the chiral SU(N)
models, at level K=2, by a polynomial ring in a single variable when $N$ is odd
and by a polynomial ring in two variables when $N$ is even.
","[{""version"":""v1"",""created"":""Tue, 4 Aug 1998 16:41:06 GMT""}]","2009-10-31"
