"cond-mat/9808050","Grigori Volovik","A. Calogeracos and G.E. Volovik","Critical Velocity in 3He-B Vibrating Wire Experiments as Analog of
  Vacuum Instability in a Slowly Oscillating Electric Field","RevTex file, 6 pages, 4 figures","J.Exp.Theor.Phys. 88 (1999) 40-45; Zh.Eksp.Teor.Fiz. 115 (1999)
  70-79","10.1134/1.558761",,"cond-mat hep-ph nucl-th quant-ph",,"  The Lancaster experiments with a cylindrical wire moving in superfluid 3He-B
are discussed, where the measured critical velocity of pair creation is much
below the Landau critical velocity. The phenomenon is shown to be analogous to
the instability of the electron-positron vacuum in an adiabatically alternating
strong electric potential of both signs, where the positive- and negative-root
levels cross and thus the instability treshold is twice less than in the
conventional case of a single static potential well.
","[{""version"":""v1"",""created"":""Wed, 5 Aug 1998 14:03:22 GMT""}]","2009-10-31"
"cond-mat/9808051","B. C. den Hertog","B.C. den Hertog (University of Waterloo)","Groundstate properties of the BCS-Bose Einstein crossover in a
  $d_{x^{2}-y^{2}}$ wave superconductor","Comments added to text. Scheduled to appear in Phys. Rev. B, Jun 1
  1999. RevTex, 5 pages, 4 figures",,,,"cond-mat.supr-con cond-mat.str-el",,"  We examine the groundstate properties of the crossover between BCS
superconductivity and Bose Einstein condensation within a model which exhibits
$d_{x^{2} - y^{2}}$ pairing symmetry. We compare results for zero temperature
with known features of s-wave systems and show that bosonic degrees of freedom
are likely to emerge only in the dilute limit. We relate the change in
properties of the groundstate as a function of density to the effect of the
exclusion principle and show that the one particle distribution function
undergoes a significant change when bosonic behavior appears.
","[{""version"":""v1"",""created"":""Wed, 5 Aug 1998 14:17:46 GMT""},{""version"":""v2"",""created"":""Mon, 29 Mar 1999 20:10:00 GMT""}]","2007-05-23"
"cond-mat/9808052","Alexander J. Wagner","Alexander J. Wagner","An H-Theorem for the Lattice Boltzmann Approach to Hydrodynamics","6 pages, latex, no figures, accepted for publication in Europhys.
  Lett",,"10.1209/epl/i1998-00448-8",,"cond-mat.stat-mech comp-gas cond-mat.soft nlin.CG",,"  The lattice Boltzmann equation can be viewed as a discretization of the
continuous Boltzmann equation. Because of this connection it has long been
speculated that lattice Boltzmann algorithms might obey an H-theorem. In this
letter we prove that usual nine-velocity models do not obey an H-theorem but
models that do obey an H-theorem can be constructed. We consider the general
conditions a lattice Boltzmann scheme must satisfy in order to obey an
H-theorem and show why on a lattice, unlike the continuous case, dynamics that
decrease an H-functional do not necessarily lead to a unique ground state.
","[{""version"":""v1"",""created"":""Wed, 5 Aug 1998 14:24:01 GMT""}]","2009-10-31"
"gr-qc/9808012","Norimasa Sugiura","Norimasa Sugiura, Ken-ichi Nakao and Tomohiro Harada","Distance-redshift relation in an isotropic inhomogeneous universe:
  Spherically symmertic dust-shell universe","latex, 18 pages, 10 figures. Accepted for publication in Physical
  Review D","Phys.Rev. D58 (1998) 103504","10.1103/PhysRevD.58.103504","KUNS-1514","gr-qc",,"  The relation between angular diameter distance and redshift in a spherically
symmetric dust-shell universe is studied. This model has large inhomogeneities
of matter distribution on small scales. We have discovered that the relation
agrees with that of an appropriate Friedmann-Lemaitre(FL) model if we set a
``homogeneous'' expansion law and a ``homogeneous'' averaged density field.
This will support the averaging hypothesis that a universe looks like a FL
model in spite of small-scale fluctuations of density field, if its averaged
density field is homogeneous on large scales.
","[{""version"":""v1"",""created"":""Wed, 5 Aug 1998 07:08:52 GMT""}]","2009-10-31"
"gr-qc/9808013","Norimasa Sugiura","Norimasa Sugiura","Friedmann Limit of a point mass universe (is not
  Friedmann):Gravinational Lens Effect","4 pages, Latex, 1 figure",,,"KUNS-1521","gr-qc",,"  We study the distance-redshift relation in a universe filled with point
particles, and discuss what the universe looks like when we make the number of
particles N very large, while fixing the averaged mass density. Using the
Raychaudhuri equation and a simple analysis of the probability of strong
lensing effects, we show that the statistical nature of the amplification is
independent of N, and clarify the appearance of the point particle universe.
","[{""version"":""v1"",""created"":""Wed, 5 Aug 1998 10:00:05 GMT""}]","2007-05-23"
"gr-qc/9808014","James Vickers","S.B.Edgar and J.A.Vickers","Integration using invariant operators:Conformally flat radiation metrics","23 pages, TeX (uses iopppt.tex)","Class.Quant.Grav. 16 (1999) 589-604","10.1088/0264-9381/16/2/020",,"gr-qc",,"  A new method is presented for obtaining the general conformally flat
radiation metric by using the differential operators of Machado Ramos and
Vickers (a generalisation of the GHP operators) which are invariant under null
rotations and spin and boosts. The solution is found by constructing involutive
tables of these derivatives applied to the quantities which arise in the
Karlhede classification of metrics.
","[{""version"":""v1"",""created"":""Wed, 5 Aug 1998 11:49:43 GMT""}]","2009-10-31"
"gr-qc/9808015",,"David Matravers","Fractal local galaxy number counts may imply strong bias","Minor correction to abstract and two references corrected. To appear
  in the Proceedings of the International Seminar on Mathematical Cosmology,
  Potsdam, 30 March-4 April 1998, ed. M. Rainer and H-J Schmidt, World
  Scientific PC. 7 pages LaTeX, sproc style, no figures",,,,"gr-qc",,"  Exact Tolman solutions are used to analyse the implications if the galactic
number has a fractal form out to a distance of about 150 Mpc in a universe
which is homogeneous on the large scale. It is concluded that such a model
requires either a non-linear Hubble law or a very low density if galaxies trace
the total matter distribution.
","[{""version"":""v1"",""created"":""Wed, 5 Aug 1998 14:39:23 GMT""},{""version"":""v2"",""created"":""Fri, 25 Sep 1998 11:14:37 GMT""}]","2007-05-23"
"gr-qc/9808016","Adrian Kent","Adrian Kent","Consistent Sets and Contrary Inferences: Reply to Griffiths and Hartle","4 pages, TeX with harvmac; typo fixed. To appear in Phys. Rev. Lett","Phys.Rev.Lett. 81 (1998) 1982","10.1103/PhysRevLett.81.1982","DAMTP-97/126","gr-qc hep-th quant-ph",,"  It was pointed out recently [A. Kent, Phys. Rev. Lett. 78 (1997) 2874] that
the consistent histories approach allows contrary inferences to be made from
the same data. These inferences correspond to projections $P$ and $Q$,
belonging to different consistent sets, with the properties that $PQ = QP = 0$
and $P \neq 1 -Q$. To many, this seems undesirable in a theory of physical
inferences. It also raises a specific problem for the consistent histories
formalism, since that formalism is set up so as to eliminate contradictory
inferences, i.e. inferences $P$ and $Q$ where $P = 1 - Q$. Yet there seems to
be no sensible physical distinction between contradictory and contrary
inferences.
  It seems particularly hard to defend the asymmetry, since (i) there is a
well-defined quantum histories formalisms which admits both contradictory and
contrary inferences, and (ii) there is also a well-defined formalism, based on
ordered consistent sets of histories, which excludes both.
  In a recent comment, Griffiths and Hartle, while accepting the validity of
the examples given in the above paper, restate their own preference for the
consistent histories formalism. As this brief reply explains, in so doing, they
fail to address the arguments made against their approach to quantum theory.
","[{""version"":""v1"",""created"":""Wed, 5 Aug 1998 14:55:24 GMT""},{""version"":""v2"",""created"":""Fri, 14 Aug 1998 20:05:16 GMT""}]","2009-10-31"
"gr-qc/9808017","Frank Gronwald","H.I.M. Lichtenegger, F. Gronwald, and B. Mashhoon","On detecting the gravitomagnetic field of the earth by means of orbiting
  clocks","Talk given at the 32nd COSPAR Scientific Assembly, held at Nagoya,
  Japan, 12-19 July 1998, 4 pages LATEX",,,,"gr-qc",,"  Based on the recent finding that the difference in proper time of two clocks
in prograde and retrograde equatorial orbits about the Earth is of the order
10^{-7}s per revolution, the possibility of detecting the terrestrial
gravitomagnetic field by means of clocks carried by satellites is discussed. A
mission taking advantage of this influence of the rotating Earth on the proper
time is outlined and the conceptual difficulties are briefly examined.
","[{""version"":""v1"",""created"":""Wed, 5 Aug 1998 15:06:17 GMT""}]","2007-05-23"
"hep-ex/9808003","Manfred Paulini","F. Abe, et al. (The CDF Collaboration)","Measurement of the Bs0 Meson Lifetime Using Semileptonic Decays","Revised version as accepted for publiaction in Phys.Rev.D; 32 pages,
  8 figures","Phys.Rev.D59:032004,1999","10.1103/PhysRevD.59.032004","Fermilab-Pub-98/172-E","hep-ex",,"  The lifetime of the Bs0 meson is measured using the semileptonic decay Bs0
--> Ds- l+ nu X. The data sample consists of about 110 pb^-1 of pp= collisions
at sqrt{s} = 1.8 TeV collected by the CDF detector at Fermilab. Four different
Ds- decay modes are reconstructed resulting in approximately 600 Ds-l+ signal
events. The Bs0 meson lifetime is determined to be tau(Bs0) = (1.36 +- 0.09
+0.06-0.05) ps, where the first and second uncertainties are statistical and
systematic, respectively. The Bs0 meson decay length distribution is examined
for a lifetime difference Delta_Gamma/Gamma between the two mass eigenstates of
the Bs0 meson. An upper limit of Delta_Gamma/Gamma < 0.83 is set at 95%
confidence level.
","[{""version"":""v1"",""created"":""Tue, 4 Aug 1998 17:22:52 GMT""},{""version"":""v2"",""created"":""Sat, 31 Oct 1998 00:23:53 GMT""}]","2010-05-12"
"hep-ex/9808004","Mark Strovink","Mark Strovink","Rencontres de Moriond '98 -- QCD and Hadronic Interactions: Experimental
  Summary","11 pages with 6 eps figures and 1 eps table included in the body of
  the article. To appear in Proceedings, XXXIst Rencontres de Moriond, QCD and
  Hadronic Interactions (Les Arcs, Savoie, France, 21-28 March 1998)",,,"Fermilab-Conf-98/238","hep-ex",,"  I discuss new experimental results reported at this conference that bear
directly on three previously reported anomalies: the excess of high Q^2 events
at HERA; the excess of W + 1 jet events, relative to W's without jets, in D0
data; and the excess of high E_T inclusive jets observed by CDF. The new
results all point in the direction of reducing the experimental significance of
these excesses.
","[{""version"":""v1"",""created"":""Tue, 4 Aug 1998 22:35:50 GMT""}]","2007-05-23"
"hep-ph/9808220","Leonid Burakovsky","L. Burakovsky and T. Goldman","Comment on ""Regge Trajectories for All Flavors""","2 pages, LaTeX","Phys.Rev.Lett.82:457,1999","10.1103/PhysRevLett.82.457","LA-UR-98-3390","hep-ph nucl-th",,"  We show that Regge trajectories for all flavors suggested recently by
Filipponi et al. cannot combine both meson spectroscopy and additivity of
intercepts. Other defects of these trajectories are also discussed.
","[{""version"":""v1"",""created"":""Tue, 4 Aug 1998 17:51:50 GMT""}]","2008-11-26"
"hep-ph/9808221","Leonid Burakovsky","L. Burakovsky and T. Goldman","New Mass and Mass-Mixing Angle Relations for Pseudoscalar Mesons","12 pages, LaTeX. Shortened version of hep-ph/9802404 published in
  Physics Letters B 427 (1998) 361",,,"LA-UR-98-3795/short","hep-ph",,"  We study the origins of the inaccuracies of Schwinger's nonet mass, and the
Sakurai mass-mixing angle, formulae for the pseudoscalar meson nonet, and
suggest new versions of them, modified by the inclusion of the pseudoscalar
decay constants. We use these new formulae to determine the pseudoscalar decay
constants and mixing angle. The results obtained, $f_8/f_\pi = 1.185\pm 0.040,$
$f_9/f_\pi =1.095\pm 0.020,$ $f_\eta /f_\pi = 1.085\pm 0.025,$ $f_{\eta
^{'}}/f_\pi =1.195\pm 0.035,$ $\theta = (-21.4\pm 1.0)^o,$ are in excellent
agreement with experiment.
","[{""version"":""v1"",""created"":""Tue, 4 Aug 1998 17:52:26 GMT""}]","2007-05-23"
"hep-ph/9808222","Xavier Martin","X. Martin and P. Peter","Current-carrying string loop motion: Limits on the classical description
  and shocks","13 pages including 16 figures, submitted to Phys. Rev. D. Major
  changes: the title changed, new figures were added, new physics was found,
  the conclusions have changed. Overall, the article has doubled in size",,,"DARC/99-12","hep-ph astro-ph gr-qc",,"  The dynamical evolution of superconducting cosmic strings is much more
complicated than that of simple Goto-Nambu strings. For this reason, there are
only a few known analytical solutions and no numerical ones. The goal of this
paper is to present numerical solutions for the dynamics of planar
superconducting cosmic string loops. In most cases, a purely dynamical approach
turns out to be insufficient to describe correctly the evolution of a loop due
mainly to the appearance of shocks when spacelike currents are present and
kinks for timelike currents, leading to yet unaccounted for quantum effects.
The consequences of the quantum effects are mostly unknown at this time because
the problem requires a dynamical field theory treatment. It is however likely
that ultimately the result will be massive radiation in the form of charge
carriers from the string.
","[{""version"":""v1"",""created"":""Tue, 4 Aug 1998 19:08:53 GMT""},{""version"":""v2"",""created"":""Wed, 25 Aug 1999 15:55:34 GMT""}]","2007-05-23"
"hep-ph/9808223","Michael Klasen","Michael Klasen (ANL)","Three jet cross sections in photoproduction at HERA","9 pages, 8 figures","Eur.Phys.J.C7:225-232,1999","10.1007/s100529801006","ANL-HEP-PR-98-91","hep-ph",,"  We calculate three jet cross sections in photoproduction using exact matrix
elements for the direct and resolved contributions. Numerical distributions are
presented in a generic, irreducible set of variables that allows to disentangle
the dynamics of partonic QCD subprocesses from each other and from pure phase
space distributions. The results are compared to preliminary data from the ZEUS
collaboration at HERA. It is found that the largest contribution comes from
photon-gluon fusion in the mass range 36 GeV $< M_{\rm 3-jet} <$ 80 GeV. The
measured leading jet scattering angle distribution is consistent with the
$t$-channel exchange of a massless fermion in $2\to 2$ scattering, where the
third parton is assumed to arise from soft bremsstrahlung. The data are
inconsistent with pure phase space and Rutherford scattering distributions.
","[{""version"":""v1"",""created"":""Tue, 4 Aug 1998 21:27:03 GMT""}]","2014-11-17"
"hep-ph/9808224","Sergey Kovalenko","Vadim Bednyakov, Amand Faessler and Sergey Kovalenko","Super-Kamiokande Constraints on R-parity Violating Supersymmetry","8 pages, added one reference","Phys.Lett. B442 (1998) 203-208","10.1016/S0370-2693(98)01209-X",,"hep-ph",,"  We consider the neutrino oscillations within the minimal supersymmetric
standard model with R-parity violation. The Super-Kamiokande atmospheric
neutrino data are used to set limits on the bilinear R-parity violating terms.
These very stringent limits are out of reach of the other experiments at
present and in the near future.
","[{""version"":""v1"",""created"":""Tue, 4 Aug 1998 21:15:19 GMT""},{""version"":""v2"",""created"":""Thu, 6 Aug 1998 18:45:54 GMT""}]","2009-10-31"
"hep-ph/9808226","Arkady Vainshtein","Arkady Vainshtein","Heavy flavor decays and OPE in two-dimensional 't Hooft model","LaTex, 11 pages, 2 figures. Talk presented at the 3rd workshop on
  Continious Advances in QCD, University of Minnesota, Minneapolis, April
  16-19, 1998",,,"TPI-MINN-98/13-T, UMN-TH-1713-98","hep-ph",,"  The 't Hooft model (two-dimensional QCD in the limit of large number of
colors) is used as a testground for calculations of nonleptonic and
semileptonic inclusive widths of heavy flavors based on the operator product
expansion (OPE). The OPE-based predictions up to terms ${\cal O}(1/m_Q^4)$,
inclusively, are confronted with the ""phenomenological"" results, obtained by
summation of all open exclusive decay channels, one by one, a perfect match is
found. The issue of duality violations is discussed, the amplitude of
oscillating terms is estimated. The method is applied to the realistic case of
hadronic $\tau$ decays.
","[{""version"":""v1"",""created"":""Wed, 5 Aug 1998 00:59:27 GMT""}]","2007-05-23"
"hep-ph/9808227",,"S.Y. Choi, J.S.Shim, H.S.Song and W.Y. Song","Phenomenological Impacts of the CP-odd Rephase-Invariant Phase of the
  Chargino Mass Matrix in the Production of Light Chargino-Pair in $e^+e^-$
  Collisions","9 pages, latex with 3 eps figure",,,"YUMS 98-12, SNUTP 98-084","hep-ph",,"  One CP--odd rephase-invariant phase appears in the chargino mass matrix in
the minimal Supersymmetric Standard Model. We investigate in detail the
phenomenological impacts of the CP-odd complex phase in the production of light
charginos in $e^+e^-$ annihilation. The values of the chargino masses and the
mixing angles, determining the size of the wino and higgsino components in the
chargino wave functions, are so sensitive to the CP-odd phase that the
constraints on the supersymmetric parameters based on the conventional
assumptions for the parameters are recommended to be re-evaluated including the
CP-odd phase.
","[{""version"":""v1"",""created"":""Wed, 5 Aug 1998 02:53:19 GMT""}]","2007-05-23"
"hep-ph/9808228","Thomas Gutsche","M. Strohmeier-Presicek, T. Gutsche, A. Faessler and R. Vinh Mau","$4\pi$ Decay Modes of the $f_0(1500)$ Resonance","11 pages, 1 figure","Phys.Lett.B438:21-26,1998","10.1016/S0370-2693(98)01044-2",,"hep-ph",,"  We investigate the two-body decay modes $\rho\rho, \pi\pi^{\ast}(1300)$ and
$\sigma \sigma$ of the $f_0(1500)$, all leading to the $4\pi$ decay channel, in
a three-state mixing scheme, where the $f_0(1500)$ is a mixture of the
lowest-lying scalar glueball with the nearby isoscalar states of the $0^{++}
Q\bar{Q}$ nonet. In the leading order of this scheme, the decay mechanism of
the $f_0(1500)$ proceeds dominantly via its quarkonia components, which can be
described in the framework of the $^3P_0$ $Q\bar Q$ pair creation model. We
predict the hierarchy of decay branching ratios B with $B(\rho \rho)
^{>}_{\sim} B(\pi\pi) ^{>}_{\sim} B(\sigma \sigma) > B(\pi\pi^{\ast})$,
providing a key signature for the proposed mixing scheme in this leading order
approach.
","[{""version"":""v1"",""created"":""Wed, 5 Aug 1998 08:29:27 GMT""}]","2008-11-26"
"hep-ph/9808229","Vladimir Braun","Patricia Ball, V.M. Braun","Handbook of Higher Twist Distribution Amplitudes of Vector Mesons in QCD","Talk presented by V.M. Braun at 3rd workshop ``Continuous Advances in
  QCD'', Minneapolis, MN, USA, April 16--19, 1998; 17 pages, 2 figures,
  requires sprocl.sty (included)",,,"NORDITA-98/51-HE","hep-ph",,"  We give a summary of existing results on higher twist distribution amplitudes
of vector mesons in QCD. Special attention is payed to meson mass corrections
which turn out to be large. A ``shopping list'' is presented of most important
nonperturbative parameters which enter distribution amplitudes.
","[{""version"":""v1"",""created"":""Wed, 5 Aug 1998 08:44:27 GMT""}]","2007-05-23"
"hep-ph/9808230","Gaston Krein","D. Drechsel and G. Krein","The Gerasimov-Drell-Hearn sum rule and the single-pion photoproduction
  multipole E0+ close to threshold","9 pages, latex, 1 figure, to appear in Phys. Rev. D","Phys.Rev. D58 (1998) 116009","10.1103/PhysRevD.58.116009",,"hep-ph nucl-ex nucl-th",,"  The long-standing discrepancy between the Gerasimov-Drell-Hearn sum rule and
the analysis of pion photoproduction multipoles is greatly diminished by use of
s-wave multipoles that are in accord with the predictions of chiral
perturbation theory and describe the experimental data in the threshold region.
The remaining difference may be due to contributions of channels with more
pions and/or heavier mesons whose contributions to the sum rule remain to be
investigated by a direct measurement of the photoabsorption cross sections.
","[{""version"":""v1"",""created"":""Wed, 5 Aug 1998 09:28:31 GMT""}]","2009-10-31"
"hep-ph/9808231","Asmita","A.Harindranath, Rajen Kundu, Asmita Mukherjee, James P. Vary","Twist Four Longitudinal Structure Function in Light-Front QCD","25 pages, 2 ps figures, accepted for publication in Physical Review D","Phys.Rev.D58:114022,1998","10.1103/PhysRevD.58.114022",,"hep-ph",,"  To resolve various outstanding issues associated with the twist four
longitudinal structure function ${F_L^{\tau=4}(x)}$ we perform an analysis
based on the BJL expansion for the forward virtual photon-hadron Compton
scattering amplitude and equal (light-front) time current algebra. Using the
Fock space expansion for states and operators, we evaluate the twist four
longitudinal structure function for dressed quark and gluon targets in
perturbation theory. With the help of a new sum rule which we have derived
recently we show that the quadratic and logarithmic divergences generated in
the bare theory are related to corresponding mass shifts in old-fashioned
light-front perturbation theory. We present numerical results for the $F_2$ and
$F_L$ structure functions for the meson in two-dimensional QCD in the one pair
approximation. We discuss the relevance of our results for the problem of the
partitioning of hadron mass in QCD.
","[{""version"":""v1"",""created"":""Wed, 5 Aug 1998 09:39:45 GMT""}]","2010-11-19"
"hep-ph/9808232","Sudhir K. Vempati","Anjan S. Joshipura and Sudhir K. Vempati","Gauge mediated supersymmetry breaking and neutrino anomalies","25 pages including 7 figues","Phys.Rev. D60 (1999) 095009","10.1103/PhysRevD.60.095009","PRL-TH- 98/008","hep-ph",,"  Supersymmetric standard model with softly broken lepton symmetry provides a
suitable framework to accommodate the solar and atmospheric neutrino anomalies.
This model contains a natural explanation for large mixing and hierarchal
masses without fine tuning of the parameters. Neutrino spectrum is particularly
constrained in the minimal messenger model (MMM) of gauge mediated SUSY
breaking, since all SUSY breaking effects are controlled in MMM by a single
parameter. We study the structure of neutrino masses and mixing both in MMM and
in simple extensions of it in the context of solar and atmospheric neutrino
anomalies.
","[{""version"":""v1"",""created"":""Wed, 5 Aug 1998 13:07:41 GMT""}]","2009-10-31"
"hep-ph/9808233","O. Nachtmann","P. V. Landshoff, O. Nachtmann","Some Remarks on the Pomeron and the Odderon in Theory and Experiment","12 pages, 4 figures",,,"DAMTP-1998-99, HD-THEP-98-28","hep-ph",,"  On March 19-21, 1998, a workshop devoted to questions of the pomeron and the
odderon in high energy scattering was held in Heidelberg. This note gives a
personal account of some of the issues discussed at this workshop. Of course,
misconceptions and misunderstandings are to be blamed on us, not on the other
participants of the workshop. A puzzle of odderon physics is identified and a
convenient reaction for its experimental study is discussed.
","[{""version"":""v1"",""created"":""Wed, 5 Aug 1998 14:07:18 GMT""}]","2007-05-23"
"hep-th/9808012","Rafael I. Nepomechie","Anastasia Doikou and Rafael I. Nepomechie","Discrete Symmetries and S Matrix of the XXZ Chain","9 pages, LaTeX","J.Phys. A31 (1998) L621-L628","10.1088/0305-4470/31/37/001","UMTG-213","hep-th nlin.SI solv-int",,"  We formulate the notion of parity for the periodic XXZ spin chain within the
Quantum Inverse Scattering Method. We also propose an expression for the
eigenvalues of the charge conjugation operator. We use these discrete
symmetries to help classify low-lying S^z=0 states in the critical regime, and
we give a direct computation of the S matrix.
","[{""version"":""v1"",""created"":""Tue, 4 Aug 1998 17:21:08 GMT""}]","2009-10-31"
"hep-th/9808013","Barry McCoy","A. Berkovich and B.M. McCoy","The universal chiral partition function for exclusion statistics","14 pages in revtex. References added and the section on multiple
  representations of u(1) expanded",,,"ITPSB-98-50","hep-th cond-mat",,"  We demonstrate the equality between the universal chiral partition function,
which was first found in the context of conformal field theory and
Rogers-Ramanujan identities, and the exclusion statistics introduced by Haldane
in the study of the fractional quantum Hall effect. The phenomena of multiple
representations of the same conformal field theory by different sets of
exclusion statistics is discussed in the context of the ${\hat u}(1)$ theory of
a compactified boson of radius $R.$
","[{""version"":""v1"",""created"":""Tue, 4 Aug 1998 18:41:13 GMT""},{""version"":""v2"",""created"":""Tue, 22 Sep 1998 19:31:18 GMT""}]","2007-05-23"
