"cond-mat/9808252","Alfonso Romano","J.-M. Robin (1), A. Romano (2) and J. Ranninger (3) ((1) Max Planck
  Institut, Dresden, Germany, (2) Universita' di Salerno, Italy, (3)
  CRTBT-CNRS, Grenoble, France)","Metal-insulator crossover in the Boson-Fermion model in infinite
  dimensions","4 pages, 3 figures, to be published in Phys. Rev. Lett","Phys. Rev. Lett. 81, 2755 (1998)","10.1103/PhysRevLett.81.2755",,"cond-mat.supr-con",,"  The Boson-Fermion model, describing a mixture of tightly bound electron pairs
and quasi-free electrons hybridized with each other via a charge exchange term,
is studied in the limit of infinite dimensions, using the Non-Crossing
Approximation within the Dynamical Mean Field Theory. It is shown that a
metal-insulator crossover, driven by strong pair fluctuations, takes place as
the temperature is lowered. It manifests itself in the opening of a pseudogap
in the electron density of states, accompanied by a corresponding effect in the
optical and dc conductivity.
","[{""version"":""v1"",""created"":""Mon, 24 Aug 1998 09:12:39 GMT""}]","2009-10-31"
"cond-mat/9808253","Arno Kampf","G. I. Japaridze (Georgian Academy) and A. P. Kampf (U. of Augsburg)","Phase Diagram of the Extended Hubbard Model with Correlated Hopping
  Interaction","8 pages, 4 eps-figures",,"10.1103/PhysRevB.59.12822","EKM-TP3/12-98","cond-mat.str-el",,"  A one-dimensional model of interacting electrons with on-site $U$,
nearest-neighbor $V$, and correlated-hopping interaction $T^{\ast}$ is studied
at half-filling using the continuum-limit field theory approach. The ground
state phase diagram is obtained for a wide range of coupling constants. In
addition to the insulating spin- and charge-density wave phases for large $U$
and $V$, respectively, we identify bond-located ordered phases corresponding to
an enhanced Peierls instability in the system for $T^\ast>0$,
$|U-2V|<8T^\ast/\pi$ and to a staggered magnetization located on bonds between
sites for $T^\ast<0$, $|U-2V|<8|T^\ast|/\pi$. The general ground state phase
diagram including insulating, metallic, and superconducting phases is
discussed.
","[{""version"":""v1"",""created"":""Mon, 24 Aug 1998 10:36:27 GMT""}]","2009-10-31"
"cond-mat/9808254",,"Hiroshi Kuratsuji (Ritsumeikan Univ.) and Hiroyuki Yabu (Tokyo
  Metropolitan Univ.)","Dynamics of a Vortex in Two-Dimensional Superfluid He3-A: Force Caused
  by the l-Texture","4 pages, RevTex(twocolumn)",,"10.1103/PhysRevB.59.11175",,"cond-mat",,"  Based on the Landau-Ginzburg Lagrangian, the dynamics of a vortex is studied
for superfluid He3-A characterized by the l-texture. The resultant equation of
motion for a vortex leads to the Magnus-type force caused by the l-texture. The
force is explicitly written in terms of the mapping degree from the
compactified 2-dimensional plane to the space of l-vector, which reflects the
quantitative differences of vortex configurations, especially the Mermin-Ho and
Anderson-Toulouse vortices. The formulation is applied to anisotropic
superconductors in which the Hall current is shown to incorporate changes
between vortex configurations.
","[{""version"":""v1"",""created"":""Mon, 24 Aug 1998 11:36:12 GMT""}]","2009-10-31"
"cond-mat/9808255","Max Petersen","C. Stampfl and M. Scheffler","Coadsorption of CO and O on Ru(0001): A structural analysis by density
  functional theory","6 pages, 1 figure, submitted to Israel Journal of Chemistry (June 29,
  1998). Other related publications can be found at
  http://www.rz-berlin.mpg.de/th/paper.html",,,,"cond-mat.mtrl-sci",,"  Knowledge of the atomic geometry of a surface is a prerequisite for any
detailed understanding of the surface's electronic structure and chemical
properties. Previous studies have convincingly demonstrated that density
functional theory (DFT) yields accurate surface atomic geometries and that
reliable predictions concerning stable and metastable phases can be made on the
basis of the calculated energetics. In the present work we use DFT to
investigate the atomic structure of four ordered coadsorbate phases of carbon
monoxide and oxygen on Ru(0001). All of the structures have a (2x2) periodicity
with differing concentrations of CO molecules and O atoms. For two of these
phases dynamical low-energy electron diffraction (LEED) intensity analyses have
been performed and the agreement between our DFT- and the LEED-determined
structures is found to be very good. We predict the atomic geometry of the
third phase for which no structural determination based on experiments has been
made to date. We also predict the stability of a new ordered mixed phase.
","[{""version"":""v1"",""created"":""Mon, 24 Aug 1998 12:27:59 GMT""}]","2007-05-23"
"cond-mat/9808256","Max Petersen","Axel Gross","Reactions at surfaces studied by ab initio dynamics calculations","33 pages, 19 figures, submitted to Surf. Sci. Rep. Other related
  publications can be found at http://www.rz-berlin.mpg.de/th/paper.html",,,,"cond-mat",,"  Due to the development of efficient algorithms and the improvement of
computer power it is now possible to map out potential energy surfaces (PES) of
reactions at surfaces in great detail. This achievement has been accompanied by
an increased effort in the dynamical simulation of processes on surfaces. The
paradigm for simple reactions at surfaces -- the dissociation of hydrogen on
metal surfaces -- can now be treated fully quantum dynamically in the molecular
degrees of freedom from first principles, i.e., without invoking any adjustable
parameters. This relatively new field of ab initio dynamics simulations of
reactions at surfaces will be reviewed. Mainly the dissociation of hydrogen on
clean and adsorbate covered metal surfaces and on semiconductor surfaces will
be discussed. In addition, the ab initio molecular dynamics treatment of
reactions of hydrogen atoms with hydrogen-passivated semiconductor surfaces and
recent achievements in the ab initio description of laser-induced desorption
and further developments will be addressed.
","[{""version"":""v1"",""created"":""Mon, 24 Aug 1998 14:40:58 GMT""}]","2007-05-23"
"cond-mat/9808257","Max Petersen","Axel Gross, Ching-Ming Wei, and Matthias Scheffler","Poisoning of Hydrogen Dissociation at Pd (100) by Adsorbed Sulfur
  Studied by ab initio Quantum Dynamics and ab initio Molecular Dynamics","4 pages, 3 figures, submitted to Surf. Sci. Lett. Other related
  publications can be found at http://www.rz-berlin.mpg.de/th/paper.html",,"10.1016/S0039-6028(98)00649-9",,"cond-mat",,"  We report calculations of the dissociative adsorption of H_2 at Pd (100)
covered with 1/4 monolayer of sulfur using quantum dynamics as well as
molecular dynamics and taking all six degrees of freedom of the two H atoms
fully into account. The ab initio potential-energy surface (PES) is found to be
very strongly corrugated. In particular we discuss the influence of tunneling,
zero-point vibrations, localization of the nuclei's wave function when narrow
valleys of the PES are passed, steering of the approaching H_2 molecules
towards low energy barrier configurations, and the time scales of the center of
mass motion and the other degrees of freedom. Several ``established'' concepts,
which were derived from low-dimensional dynamical studies, are shown to be not
valid.
","[{""version"":""v1"",""created"":""Mon, 24 Aug 1998 13:29:12 GMT""}]","2009-10-31"
"cond-mat/9808258","Franz Gerl","Franz Gerl and Annette Zippelius","Coefficient of restitution for elastic disks","25 pages, 12 Postscript figures, LaTex2e",,"10.1103/PhysRevE.59.2361",,"cond-mat",,"  We calculate the coefficient of restitution, $\epsilon$, starting from a
microscopic model of elastic disks. The theory is shown to agree with the
approach of Hertz in the quasistatic limit, but predicts inelastic collisions
for finite relative velocities of two approaching disks. The velocity
dependence of $\epsilon$ is calculated numerically for a wide range of
velocities. The coefficient of restitution furthermore depends on the elastic
constants of the material via Poisson's number. The elastic vibrations absorb
kinetic energy more effectively for materials with low values of the shear
modulus.
","[{""version"":""v1"",""created"":""Mon, 24 Aug 1998 14:22:36 GMT""},{""version"":""v2"",""created"":""Mon, 16 Nov 1998 14:58:50 GMT""}]","2009-10-31"
"cond-mat/9808259","Max Petersen","Axel Gross","Hydrogen dissociation on metal surfaces - a model system for reactions
  on surfaces","10 pages, 9 figures, submitted to Appl. Phys. Other related
  publications can be found at http://www.rz-berlin.mpg.de/th/paper.html",,"10.1007/s003390050834",,"cond-mat.mtrl-sci",,"  Reactions on surfaces play an important role in many technological
applications. Since these processes are often rather complex, one tries to
understand single steps of these complicated reactions by investigating simpler
system. In particular the hydrogen dissociation on surfaces serves as such a
model system. There has been much progress in recent years in the theoretical
description of reactions on surfaces by high-dimensional dynamics simulations
on potential energy surfaces which are derived from ab initio total energy
calculations. In this brief review I will focus on the hydrogen dissociation on
the clean and sulfur-covered Pd(100) surface. These calculations established
the importance of dynamical concepts like the steering effect. The electronic
structure calculations allow furthermore the determination of the factors that
determine the reactivity of a particular surface. This will be demonstrated for
the poisoning of hydrogen dissociation by sulfur adsorption on the Pd(100)
surface. In addition, quantum effects in the dynamics can be assessed by
comparing the results of classical with quantum dynamical calculations on the
same potential energy surface.
","[{""version"":""v1"",""created"":""Mon, 24 Aug 1998 14:30:50 GMT""}]","2009-10-31"
"cond-mat/9808260","Marek Wodawski","K. Walasek, K. Lukierska- Walasek, M. Wodawski","Ising spin glass with arbitrary spin beyond the mean field theory","11 pages (RevTeX), 4 figures (JPEG)",,"10.1103/PhysRevE.59.5187",,"cond-mat.dis-nn",,"  We consider the Ising spin glass for the arbitrary spin S with the short-
ranged interaction using the Bethe- Peierls approximation previously formulated
by Serva and Paladin for the same system but limited to S=1/2. Results obtained
by us for arbitrary S are not a simple generalization of those for S=1/2. In
this paper we mainly concentrate our studies on the calcutation of the citical
temperature and the linear susceptibility in the paramagnetic phase as
functions of the dimension of the system and spin number S. These dependences
are illustrated by corresponding plots.
","[{""version"":""v1"",""created"":""Mon, 24 Aug 1998 14:37:23 GMT""}]","2009-10-31"
"cond-mat/9808261","Robert Eder","R. Eder","Theory of magnetic excitations in the Kondo lattice","RevTex-file, 4 PRB pages with 4 embedded eps files. Hardcopies of
  figures (or the entire manuscript) can be obtained by e-mail request to:
  eder@physik.uni-wuerzburg.de",,,,"cond-mat",,"  We present a theory for the spin excitations of the Kondo lattice. We derive
an effective Hamiltonian, which describes Fermionic spin 1/2 charge
fluctuations interacting with Bosonic triplet spin fluctuations. We show that
already the simplest approximation possible, i.e. replacing the magnon
self-energy by the free polarization bubble for the charge excitation Greens
function, gives a quantitative description of the `spin gap' and `charge gap'
as obtained in numerical calculations for the Kondo insulator.
","[{""version"":""v1"",""created"":""Mon, 24 Aug 1998 15:28:01 GMT""}]","2007-05-23"
"cond-mat/9808262","Rama Cont","Rama Cont (Swiss Federal Institute of Technology, Lausanne)","Beyond implied volatility","26 pages, 2 postscript figures. Style file crckapb.sty included.
  Related papers available on
  http://www.eleves.ens.fr:8080/home/cont/papers.html ; To appear in: J.
  Kertesz & I. Kondor (Eds.): Econophysics: an emerging science, Dordrecht:
  Kluwer, 1998",,,,"cond-mat",,"  After a brief review of option pricing theory, we introduce various methods
proposed for extracting the statistical information implicit in options prices.
We discuss the advantages and drawbacks of each method, the interpretation of
their results in economic terms, their theoretical consequences and their
relevance for applications.
","[{""version"":""v1"",""created"":""Mon, 24 Aug 1998 15:46:07 GMT""}]","2007-05-23"
"cs/9808003","Lane A. Hemaspaandra","Lane A. Hemaspaandra and Joerg Rothe","Creating Strong Total Commutative Associative Complexity-Theoretic
  One-Way Functions from Any Complexity-Theoretic One-Way Function",,,,"see UR-CS-TR-98-688","cs.CC cs.CR",,"  Rabi and Sherman [RS97] presented novel digital signature and unauthenticated
secret-key agreement protocols, developed by themselves and by Rivest and
Sherman. These protocols use ``strong,'' total, commutative (in the case of
multi-party secret-key agreement), associative one-way functions as their key
building blocks. Though Rabi and Sherman did prove that associative one-way
functions exist if $\p \neq \np$, they left as an open question whether any
natural complexity-theoretic assumption is sufficient to ensure the existence
of ``strong,'' total, commutative, associative one-way functions. In this
paper, we prove that if $\p \neq \np$ then ``strong,'' total, commutative,
associative one-way functions exist.
","[{""version"":""v1"",""created"":""Sun, 23 Aug 1998 18:22:06 GMT""}]","2007-05-23"
"gr-qc/9808060","Hans-Juergen Schmidt","H.-J. Schmidt","Exact Cosmological Solutions of Nonlinear F(R)-Gravity","5 pages, LaTeX sprocl style, no figures, to appear in Proceedings of
  the International Seminar on Mathematical Cosmology, Potsdam March 30 - April
  4, 1998, M. Rainer and H.-J. Schmidt (eds.), World Scientific PC Singapore","Current topics in mathematical cosmology, Eds.: M. Rainer et al.,
  WSPC Singapore 1998, 288-292.",,"Preprint UNIPO-MATH-98-August-21","gr-qc",,"  We report on the cited papers refs. 1 - 18 from the following points of view:
What do we exactly know about solutions when no exact solution (in the sense of
""solution in closed form"") is available? In which sense do these solutions
possess a singularity? In which cases do conformal relations and/or dimensional
reductions simplify the deduction? Furthermore, we outline some open questions
worth of being studied in future research.
","[{""version"":""v1"",""created"":""Mon, 24 Aug 1998 08:49:07 GMT""}]","2007-05-23"
"gr-qc/9808061","Jerry B. Griffiths","J. B. Griffiths and J. Podolsky","Interpreting a conformally flat pure radiation space-time","9 pages, Plain TeX, 2 figures. To appear in Class. Quantum Grav.
  Reference added","Class.Quant.Grav. 15 (1998) 3863-3871","10.1088/0264-9381/15/12/015",,"gr-qc",,"  A physical interpretation is presented of the general class of conformally
flat pure radiation metrics that has recently been identified by Edgar and
Ludwig. It is shown that, at least in the weak field limit, successive wave
surfaces can be represented as null (half) hyperplanes rolled around a
two-dimensional null cone. In the impulsive limit, the solution reduces to a
pp-wave whose direction of propagation depends on retarded time. In the general
case, there is a coordinate singularity which corresponds to an envelope of the
wave surfaces. The global structure is discussed and a possible vacuum
extension through the envelope is proposed.
","[{""version"":""v1"",""created"":""Mon, 24 Aug 1998 15:13:23 GMT""},{""version"":""v2"",""created"":""Mon, 14 Sep 1998 11:12:58 GMT""}]","2009-10-31"
"gr-qc/9808062","Mattias Marklund","M. Marklund (U. of Umea), M. Bradley (U. of Umea)","Invariant construction of solutions to Einstein's field equations - LRS
  perfect fluids II","24 pages, 1 figure","Class.Quant.Grav. 16 (1999) 1577-1597","10.1088/0264-9381/16/5/308","mth.uct.ac.za-9808","gr-qc",,"  The properties of LRS class II perfect fluid space-times are analyzed using
the description of geometries in terms of the Riemann tensor and a finite
number of its covariant derivatives. In this manner it is straightforward to
obtain the plane and hyperbolic analogues to the spherical symmetric case. For
spherically symmetric static models the set of equations is reduced to the
Tolman-Oppenheimer-Volkoff equation only. Some new non-stationary and
inhomogeneous solutions with shear, expansion, and acceleration of the fluid
are presented. Among these are a class of temporally self-similar solutions
with equation of state given by $p=(\gamma-1)\mu, 1<\gamma<2$, and a class of
solutions characterized by $\sigma=-\Theta/6$. We give an example of geometry
where the Riemann tensor and the Ricci rotation coefficients are not sufficient
to give a complete description of the geometry. Using an extension of the
method, we find the full metric in terms of curvature quantities.
","[{""version"":""v1"",""created"":""Mon, 24 Aug 1998 13:03:41 GMT""}]","2009-10-31"
"gr-qc/9808063","Zoltan Perjes","L\'aszl\'o \'A. Gergely, Zolt\'an I. Perj\'es and M\'aty\'as Vas\'uth","Spin effects in gravitational radiation backreaction III. Compact
  binaries with two spinning components","10 pages, 1 figure","Phys.Rev. D58 (1998) 124001","10.1103/PhysRevD.58.124001",,"gr-qc",,"  The secular evolution of a spinning, massive binary system in eccentric orbit
is analyzed, expanding and generalizing our previous treatments of the
Lense-Thirring motion and the one-spin limit. The spin-orbit and spin-spin
effects up to the 3/2 post-Newtonian order are considered, both in the
equations of motion and in the radiative losses. The description of the orbit
in terms of the true anomaly parametrization provides a simple averaging
technique, based on the residue theorem, over eccentric orbits. The evolution
equations of the angle variables characterizing the relative orientation of the
spin and orbital angular momenta reveal a speed-up effect due to the
eccentricity. The dissipative evolutions of the relevant dynamical and angular
variables is presented in the form of a closed system of differential
equations.
","[{""version"":""v1"",""created"":""Mon, 24 Aug 1998 14:29:18 GMT""}]","2009-10-31"
"hep-ex/9808025","Richard J. Hemingway","The OPAL Collaboration, K. Ackerstaff et al","Production of Chi_c2 Mesons in Photon-Photon Collisions at LEP","18 pages, LaTeX, 6 eps figures included, submitted to Physics Letters
  B","Phys.Lett.B439:197-208,1998","10.1016/S0370-2693(98)01128-9","CERN-EP/98-106","hep-ex",,"  We present an observation at LEP of the production of chi_c2 mesons in the
collisions of two quasi-real photons using the OPAL detector. The chi_c2 mesons
are reconstructed in the decay channel Chi_c2 to J/psi gamma to l+l- gamma
(with l= e,mu) using all data taken at e+e- centre-of-mass energies of 91 and
183 GeV, corresponding to integrated luminosities of 167 and 55 pb-1
respectively. The two-photon width of the Chi_2 is determined to be 1.76 +-
0.47 +- 0.37 +- 0.15 keV where the first error is statistical, the second is
systematic and the third comes from branching ratio uncertainties.
","[{""version"":""v1"",""created"":""Mon, 24 Aug 1998 06:44:09 GMT""}]","2008-11-26"
"hep-lat/9808029",,"Xiang-Qian Luo","Eigenmodes of the Dirac Operator and Chiral Properties of QCD with Sea
  Quarks","LATTICE98(confine)","Nucl.Phys.Proc.Suppl. 73 (1999) 614-616","10.1016/S0920-5632(99)85152-4",,"hep-lat",,"  I describe a mechanism to understand the relation between chiral-symmetry
breaking and eigenmodes of the Dirac operator in lattice QCD with
Kogut-Susskind sea quarks. It can be shown that if chiral symmetry is
spontaneously broken, the eigenvalues $\lambda_i$ should behave as $z(i)/V$ for
large volume $V$, where $z(i)$ is the i-th zero of the Bessel function. With
neither chiral nor $\lambda$ extrapolation, one can precisely calculate the
chiral condensate using only a small set of eigenvalues. Therefore, it is
economical and free of systematic uncertainties. I present the first QCD data
to support this mechanism and encourage the lattice community to test and use
it.
","[{""version"":""v1"",""created"":""Mon, 24 Aug 1998 07:04:10 GMT""}]","2009-10-31"
"hep-lat/9808030","Yuval Blum","Y. Blum, P.K. Coyle, S. Elitzur, E. Rabinovici, S. Solomon, H.
  Rubinstein","Investigation of the Critical Behavior of the Critical Point of the Z2
  Gauge Lattice","4 pages, 6 figures, LaTex","Nucl.Phys. B535 (1998) 731-738","10.1016/S0550-3213(98)00636-1",,"hep-lat",,"  We investigate, through Monte-Carlo simulations, the nature of the second
order point in a $Z_2$ (Bosonic) + $Z_2$ gauge theory in four dimensions.
Detailed analysis of the critical exponents point to the Ising universality
class. Relevancy to extended models and possible Non-Gaussian behavior is
discussed.
","[{""version"":""v1"",""created"":""Mon, 24 Aug 1998 10:03:05 GMT""},{""version"":""v2"",""created"":""Wed, 16 Sep 1998 10:30:37 GMT""}]","2009-10-31"
"hep-ph/9808388","Raymond R. Volkas","R. Foot and R. R. Volkas","Do the SuperKamiokande atmospheric neutrino results explain electric
  charge quantisation?","6 pages, ReVTeX, no figures","Phys.Rev.D59:097301,1999","10.1103/PhysRevD.59.097301","UM-P-98/41","hep-ph",,"  We show that the SuperKamiokande atmospheric neutrino results explain
electric charge quantisation, provided that the oscillation mode is $\nu_{\mu}
\to \nu_{\tau}$ and that the neutrino mass is of Majorana type.
","[{""version"":""v1"",""created"":""Mon, 24 Aug 1998 04:41:27 GMT""}]","2011-02-07"
"hep-ph/9808389","Andrei Belitsky","A.V. Belitsky","Two-loop renormalization of Wilson loop for Drell-Yan production","9 pages, LaTeX, 1 figure","Phys.Lett. B442 (1998) 307-314","10.1016/S0370-2693(98)01249-0",,"hep-ph",,"  We study the renormalization of the Wilson loop with a path corresponding to
the Drell-Yan lepton pair production in two-loop approximation of perturbation
theory. We establish the renormalization group equation in next-to-leading
order and find a process specific anomalous dimension Gamma_DY in the
corresponding approximation.
","[{""version"":""v1"",""created"":""Mon, 24 Aug 1998 08:23:20 GMT""}]","2009-10-31"
"hep-ph/9808390","Dario Grasso","Dario Grasso (Valencia) and Victor Semikoz (IZMIRAN/Valencia)","Radiative Neutrino Decay in Media","11 pages, 3 encapsulated figures","Phys.Rev. D60 (1999) 053010","10.1103/PhysRevD.60.053010","FTUV/98-58; IFIC/98-59","hep-ph astro-ph",,"  In this letter we introduce a new method to determine the radiative neutrino
decay rate in the presence of a medium. Our approach is based on the
generalisation of the optical theorem at finite temperature and density.
Differently from previous works on this subject, our method allows to account
for dispersive and dissipative electromagnetic properties of the medium. Some
inconsistencies that are present in the literature are pointed-out and
corrected here. We shortly discuss the relevance of our results for neutrino
evolution in the early universe.
","[{""version"":""v1"",""created"":""Mon, 24 Aug 1998 08:34:17 GMT""}]","2009-10-31"
"hep-ph/9808391","Juraev Obid Muminovich","Obid Juraev, Tulkun Nasyrov","Decay constant of pion in the quark model","7 pages, 2 postscript figures, use psfig.sty","Turk.J.Phys. 21 (1997) 813-821",,,"hep-ph",,"  To describe pion as a bound state of two quark, when their current masses are
non equal to zero, is considered. In the framefowrk of the potential
approximate the Schwinger-Dyson and Bethe-Salpeter equations are solved. The
quark-antiquark interaction as sum of the oscillator and Coulomb potential is
chosen. The mass and constant of pion are calculated.
","[{""version"":""v1"",""created"":""Mon, 24 Aug 1998 10:23:27 GMT""},{""version"":""v2"",""created"":""Thu, 27 Aug 1998 06:26:14 GMT""}]","2007-05-23"
"hep-ph/9808392","Claudio Parrinello","J.R. Forshaw, J. Papavassiliou, C. Parrinello","The Massive Yang-Mills Model and Diffractive Scattering","38 pages, Latex, with 7 PostScript pictures. Introduction and Section
  6 further enlarged, minor typos corrected","Phys.Rev.D59:074008,1999","10.1103/PhysRevD.59.074008","CERN-TH-98-275, MC-TH-98/6, Liverpool LTH 431","hep-ph",,"  We argue that the massive Yang-Mills model of Kunimasa and Goto, Slavnov, and
Cornwall, in which massive gauge vector bosons are introduced in a
gauge-invariant way without resorting to the Higgs mechanism, may be useful for
studying diffractive scattering of strongly interacting particles. We perform
in this model explicit calculations of S-matrix elements between quark states,
at tree level, one loop, and two loops, and discuss issues of renormalisability
and unitarity. In particular, it is shown that the S-matrix element for quark
scattering is renormalisable at one-loop order and is only logarithmically
non-renormalisable at two loops. The discrepancies in the ultraviolet regime
between the one-loop predictions of this model and those of massless QCD are
discussed in detail. Also, some of the similarities and differences between the
massive Yang-Mills model and theories with a Higgs mechanism are analysed at
the level of the S-matrix. Finally, we briefly discuss the high-energy
behaviour of the leading-order amplitude for quark-quark elastic scattering in
the diffractive region. The above analysis sets up the stage for carrying out a
systematic computation of the higher order corrections to the two-gluon
exchange model of the Pomeron using massive gluons inside quantum loops.
","[{""version"":""v1"",""created"":""Mon, 24 Aug 1998 10:21:02 GMT""},{""version"":""v2"",""created"":""Mon, 28 Sep 1998 15:12:19 GMT""},{""version"":""v3"",""created"":""Mon, 8 Feb 1999 14:19:57 GMT""}]","2008-11-26"
