"hep-ph/9808393","Thomas Binoth","T. Binoth (Lab. d'Annecy-le-Vieux de Physique Theorique), A. Ghinculov
  (Univ. of Michigan)","New developments in the 1/N expansion and nonperturbative Higgs physics","23 pages, latex, eps-figures included","Nucl.Phys. B550 (1999) 77-98","10.1016/S0550-3213(99)00189-3","LAPTH-692-98, UM-TH 98-12, CERN-TH/98-244","hep-ph",,"  We show in this paper that the 1/N expansion is a reliable tool to calculate
the properties of a heavy Higgs boson. The 1/N expansion sums up all orders in
perturbation theory, and therefore avoids the renormalization scheme dependence
of the conventional perturbative approach. It is explained how effects due to
the Landau pole of the Higgs sector are isolated and subtracted, and how to
perform actual calculations, by computing the Higgs line shape for the
processes f\bar f\to H \to ZZ,f'\bar f' at next-to-leading order in the 1/N
expansion. The results are compared to the perturbative results to show the
agreement between the perturbative and the nonperturbative approach for Higgs
masses up to 1 TeV. We conclude that the theoretical predictions for Higgs
observables are well under control for the entire kinematical region of the
LHC.
","[{""version"":""v1"",""created"":""Mon, 24 Aug 1998 15:34:37 GMT""}]","2009-10-31"
"hep-ph/9808394","Biro Tamas","T.S.Biro, P.Levai, J.Zimanyi (MTA KFKI RMKI) and C.T.Traxler (JLU
  Giessen)","Hadronization in Heavy-Ion Reactions","9 pages LaTeX, 5 figures, contribution to the Proceedings of the
  Conference on Correlations and Fluctuations '98, June 14-21, 1998, Matrahaza,
  Hungary. (Macros: psfig.sty, sprocl.sty)",,,,"hep-ph",,"  We present a model of fast hadronization of constituent quark matter in
relativistic heavy ion collisions based on rate equations and capture cross
sections in non-relativistic potential. We utilize a thermodynamically
consistent approach with a non-ideal equation of state including correlation
terms based on string phenomenology. We investigate strange and non-strange
particle ratios observed in CERN SPS experiments.
","[{""version"":""v1"",""created"":""Mon, 24 Aug 1998 11:49:37 GMT""}]","2007-05-23"
"hep-ph/9808395","Omar Miranda","O. G. Miranda, V. B. Semikoz, and J.W.F. Valle","Neutrino electron scattering and electroweak gauge structure: Probing
  the masses of a new Z boson","10 pages, 3 figures included, talk given at the International
  symposium on lepton and baryon number violation, Trento, Italy, April 1998",,,,"hep-ph",,"  Low-energy high-resolution neutrino-electron scattering experiments may play
an important role in testing the gauge structure of the electroweak
interaction. We discuss the use of strong radioactive neutrino sources (e.g.
$^{51}$Cr) in underground experiments such as BOREXINO, HELLAZ and LAMA. We
display the sensitivity of these detectors in testing the possible existence of
extra neutral $E_6$ gauge bosons.
","[{""version"":""v1"",""created"":""Mon, 24 Aug 1998 14:42:38 GMT""}]","2007-05-23"
"hep-ph/9808396","Oleg Zenin V.","Yu. F. Pirogov and O. V. Zenin (IHEP, Protvino, Russia and MIPT,
  Dolgoprudny, Russia)","Two-loop renormalization group restrictions on the standard model and
  the fourth chiral family","22 LaTeX pages, 17 PostScript figures. In the 2nd version of the
  e-print a typo in the 2-loop beta function of a charged lepton is corrected","Eur.Phys.J.C10:629-638,1999","10.1007/s100520050602","IHEP 98-50","hep-ph hep-th","http://arxiv.org/licenses/nonexclusive-distrib/1.0/","  In the framework of the two-loop renormalization group, the global profile of
the Standard Model (SM) in its full parameter space is investigated up to the
scale of the gauge singularity. The critical Higgs masses bordering the strong
coupling, unstable and the safe regions are explicitly found. Restrictions on
the Higgs boson mass as a function of a cutoff scale are obtained from the
stability of the electroweak vacuum and from the absence of the strong coupling
both in the Higgs and Yukawa sectors. The cutoff being equal to the Plank scale
requires the Higgs mass to be M=(161.3+-20.6)+4-10 GeV and M>=140.7+-10 GeV,
where the M corridor is the theoretical one and the errors are due to the top
mass uncertainty.
  The SM two-loop beta-functions are generalized to the massive neutrino case.
Modification of the two-loop global profile of the SM extended by one new
chiral family is studied, and bounds on the masses of the family are found. The
requirement of self-consistency of the perturbative SM as an underlying theory
up to the Planck or GUT scale excludes the fourth chiral family with the mass
up to 250 GeV depending on the Higgs mass and the cutoff scale. Under precision
experiment restriction M<=200 GeV, the fourth chiral family, taken alone, is
excluded. Nevertheless a pair of the chiral families constituting the
vector-like one could still exist.
","[{""version"":""v1"",""created"":""Mon, 24 Aug 1998 15:10:25 GMT""},{""version"":""v2"",""created"":""Thu, 29 Dec 2011 12:57:39 GMT""}]","2011-12-30"
"hep-ph/9808397",,"E. Baron, R. N. Mohapatra and V. L. Teplitz","Limits on Pauli principle violation by nucleons","11 pages; UMD-PP-99-014","Phys.Rev. D59 (1999) 036003","10.1103/PhysRevD.59.036003",,"hep-ph",,"  We consider nuclei produced in core collapse supernovae and subjected to a
high neutron flux. We show that an accelerator mass spectrometry experiment
that searched for traces of anomalous iron isotopes could set limits on the
order of $10^{-20}-10^{-25}$ on (or perhaps discover) Pauli principle violation
by neutrons. A similar search for anomalous Co isotopes could set limits in the
range $10^{-13}-10^{-18}$ on Pauli principle violation by protons. We show that
existing data on Oxygen can be used to set a limit of about $10^{-17}$ in one
proposed model of such violation.
","[{""version"":""v1"",""created"":""Mon, 24 Aug 1998 15:29:30 GMT""}]","2009-10-31"
"hep-ph/9808398","Keith Richardson","Michael C. Birse, Judith A. McGovern, Keith G. Richardson (University
  of Manchester)","The Wilson Renormalisation Group Applied to the Potential in NN
  Scattering","11 pages (RevTeX), Talk given by K. Richardson at The 11th Summer
  School and Symposium on Nuclear Physics (NuSS'98) ``Effective Theories of
  Matter'', held in Seoul National University, June 23-26, 1998",,,"MC/TH 98/14","hep-ph",,"  Nonrelativistic two-body scattering by a short-ranged potential is studied
using the renormalisation group. Two fixed points are identified: a trivial one
and one describing systems with a bound state at zero energy. The eigenvalues
of the linearised renormalisation group are used to assign a systematic
power-counting to terms in the potential near each of these fixed points. The
expansion around the nontrivial fixed point defines a power counting scheme
which is equivalent to the effective-range expansion.
","[{""version"":""v1"",""created"":""Mon, 24 Aug 1998 15:30:49 GMT""}]","2007-05-23"
"hep-th/9808141","Ashoke Sen","Ashoke Sen","SO(32) Spinors of Type I and Other Solitons on Brane-Antibrane Pair","LaTeX file, 31 pages","JHEP 9809:023,1998","10.1088/1126-6708/1998/09/023","MRI-PHY/P980858","hep-th",,"  We construct the SO(32) spinor state in weakly coupled type I string theory
as a kink solution of the tachyon field on the D-string - anti-D-string pair
and calculate its mass. We also give a description of this system in terms of
an exact boundary conformal field theory and show that in this description this
state can be regarded as a non-supersymmetric D0-brane in type I string theory.
This construction can be generalised to represent the D0-brane in type IIA
string theory as a vortex solution of the tachyon field on the membrane
anti-membrane pair, and the D-string of type I string theory as a topological
soliton of the tachyon field on the D5-brane anti- D5-brane pair.
","[{""version"":""v1"",""created"":""Mon, 24 Aug 1998 15:18:12 GMT""}]","2009-10-31"
"hep-th/9808143","Changhyun Ahn","Changhyun Ahn, Kyungho Oh and Radu Tatar","The Large N Limit of ${\cal N}=1$ Field Theories from F Theory","12 pages, latex, v2: reference on eq. (4.3) added, v3: corrected the
  discussion on chiral primary field and its analysis in page 7, v4: corrected
  the statement between (3.3) and (3.4)","Mod.Phys.Lett. A14 (1999) 369-378","10.1142/S0217732399000420","SNUTP-98-085, APCTP-98-019, UM-TG-210, BROWN-HET-1144","hep-th",,"  We study AdS/CFT correspondence in four dimensional N=1 field theories
realized on the worldvolume of D3 branes near the intersections between D7 and
D7' branes in F theory studied by Aharony et al. We consider the
compactification of F theory on elliptically fibered Calabi-Yau threefolds
corresponding to two sets of parallel D7 branes sharing six spacetime
directions. This can be viewed as orbifolds of six torus T^6 by Z_p x Z_q (p,
q=2, 3, 4, 6). We find the large N spectrum of chiral primary operators by
exploiting the property of AdS/CFT correspondence. Moreover, we discuss
supergravity solutions for D3 branes in D7 and D7' branes background.
","[{""version"":""v1"",""created"":""Mon, 24 Aug 1998 01:52:51 GMT""},{""version"":""v2"",""created"":""Tue, 25 Aug 1998 11:44:37 GMT""},{""version"":""v3"",""created"":""Fri, 2 Oct 1998 02:37:56 GMT""},{""version"":""v4"",""created"":""Wed, 10 Mar 1999 10:39:36 GMT""}]","2009-10-31"
"hep-th/9808144","Kim Bom-Soo","Dongsu Bak, Sang Pyo Kim, Sung Ku Kim, Kwang-Sup Soh, and Jae Hyung
  Yee","Factorization and q-Deformed Algebra of Quantum Anharmonic Oscillator","6 pages, no figures, revtex","J.KoreanPhys.Soc.34:463-469,1999",,"SNUTP-98-076","hep-th",,"  We have studied the underlying algebraic structure of the anharmonic
oscillator by using the variational perturbation theory. To the first order of
the variational perturbation, the Hamiltonian is found to be factorized into a
supersymmetric form in terms of the annihilation and creation operators, which
satisfy a q-deformed algebra. This algebraic structure is used to construct all
the eigenstates of the Hamiltonian.
","[{""version"":""v1"",""created"":""Mon, 24 Aug 1998 03:08:35 GMT""}]","2016-09-06"
"hep-th/9808145","Hagen Kleinert","Hagen Kleinert","Variational Resummation of $\epsilon$-Expansions of Critical Exponents
  of Nonlinear O(N)-Symmetric $\sigma$-Model in $2+\epsilon$ Dimensions","Author Information under
  http://www.physik.fu-berlin.de/~kleinert/institution.html . Latest update of
  paper also at http://www.physik.fu-berlin.de/~kleinert/kleiner_re275","Phys.Lett. A264 (2000) 357-365","10.1016/S0375-9601(99)00833-6",,"hep-th cond-mat",,"  We develop a method for extracting accurate critical exponents from
perturbation expansions of the O(n)-symmetric nonlinear sigma-model in D=2+
epsilon dimensions. This is possible by considering the epsilon-expansions in
this model as strong-coupling expansions of functions of the variable
tildevarepsilon = 2(4-D)/(D-2), whose first five weak-coupling expansion
coefficients of powers of tildevarepsilon are known from varepsilon-expansions
of critical exponents in O(n)-symmetric phi^4-theory in D=4-epsilon dimensions.
","[{""version"":""v1"",""created"":""Mon, 24 Aug 1998 13:43:10 GMT""},{""version"":""v2"",""created"":""Sun, 28 Nov 1999 07:27:28 GMT""}]","2009-10-31"
"hep-th/9808146","Pesando Igor","Igor Pesando","All roads lead to Rome: Supersolvables and Supercosets","1+4 pages. Corrected some typos","Mod.Phys.Lett. A14 (1999) 343-348","10.1142/S0217732399000390","DFTT-47/98","hep-th",,"  We show explicitly that the two recently proposed actions for the type IIB
superstring propagating on AdS_{5} X S_{5} agree completely.
","[{""version"":""v1"",""created"":""Mon, 24 Aug 1998 11:05:36 GMT""},{""version"":""v2"",""created"":""Wed, 26 Aug 1998 11:43:59 GMT""}]","2009-10-31"
"hep-th/9808147","J. W. van Holten","S. Groot Nibbelink and J.W. van Holten","Matter coupling and anomaly cancellation in supersymmetric sigma-models","10 pages, no figures","Phys.Lett.B442:185-191,1998","10.1016/S0370-2693(98)01213-1","NIKHEF/98-028","hep-th hep-ph",,"  Generalized matter couplings to four-dimensional supersymmetric sigma models
on general Kaehler manifolds are presented, preserving all holomorphic
symmetries. Our generalization allows assignment of arbitrary U(1) charges to
additional matter fermions, in all representations of (the holomorphic part of)
the isometry group. This can be used to eliminate unwanted gamma_5 anomalies,
in particular for the U(1) symmetry arising from the complex structure of the
target space. A consistent gauging of this isometry group, or any of its
subgroups, then becomes possible. When gauged in the presence of a chiral
scalar multiplet, the U(1) symmetry is broken spontaneously, generating a mass
for the U(1) vector multiplet via the supersymmetric Higgs effect. As an
example we discuss the case of the homogeneous coset space E6/SO(10) x U(1).
","[{""version"":""v1"",""created"":""Mon, 24 Aug 1998 13:11:24 GMT""}]","2011-10-11"
"math/9808100","Bill Arveson","William Arveson","The curvature invariant of a Hilbert module over C[z_1,...,z_d]","75 pp. AMS-TeX 2.0",,,,"math.OA",,"  A notion of curvature is introduced in multivariable operator theory and an
analogue of the Gauss-Bonnet-Chern theorem is established for graded
(contractive) Hilbert modules over the complex polynomial algebra in d
variables, d=1,2,3,....
  The curvature invariant, Euler characteristic, and degree are computed for
some explicit examples based on varieties in (multidimensional) complex
projective space, and applications are given to the structure of graded ideals
in C[z_1,...,z_d] and to the existence of ""inner sequences"" for closed
submodules of the free Hilbert module H^2(C^d).
","[{""version"":""v1"",""created"":""Sun, 23 Aug 1998 21:57:10 GMT""}]","2007-05-23"
"math/9808101","Martin Markl","Martin Markl","Homotopy Algebras via Resolutions of Operads","LaTeX 2.09, 9 pages; `indecomposables' changed to `decomposables'",,,,"math.AT",,"  The aim of this brief note is mainly to advocate our approach to homotopy
algebras based on the minimal model of an operad. Our exposition is motivated
by two examples which we discuss very explicitly - the example of strongly
homotopy associative algebras and the example of strongly homotopy Lie
algebras.
  We then indicate what must be proved in order to show that these homotopy
algebraic structures are really `stable under a homotopy.'
  The paper is based on a talk given by the author on June 16, 1998, at
University of Osnabrueck, Germany.
","[{""version"":""v1"",""created"":""Sun, 23 Aug 1998 22:26:52 GMT""},{""version"":""v2"",""created"":""Wed, 10 Mar 1999 14:00:22 GMT""}]","2007-05-23"
"math/9808102","Russo Barbara","E. Ballico, B. Russo","Exact sequence of semistable vector bundles on algebraic curves","11 pages, Latex",,,,"math.AG",,"  Let X be a smooth complex projective curve of genus g bigger or equal to 1.
If g is bigger than 1 assume further that X is either bielliptic or with
general moduli. Under a natural condition on slopes, we prove that there exists
a short exact sequence of semistable vector bundles with given ranks and
degrees. The importance of the paper consists of the new method adopted for the
proves.
","[{""version"":""v1"",""created"":""Mon, 24 Aug 1998 13:40:46 GMT""}]","2007-05-23"
"patt-sol/9808009","Gafiychuk","Vasyl Gafiychuk, Ihor Lubashevsky and Roman Andrushkiw","Two boundary model for freezing front propagation in biological tissue",,,,,"patt-sol nlin.PS physics.bio-ph physics.med-ph q-bio",,"  The response of the living tissue to the effects of strong heating or cooling
can cause the blood flow rate to vary by an order of magnitude. A mathematical
model for the freezing of living tissue is formulated which takes into account
the nonlocal temperature dependence of the blood flow rate when the temperature
distribution in the tissue is substantially nonuniform, as in cryosurgery.
","[{""version"":""v1"",""created"":""Mon, 24 Aug 1998 13:57:27 GMT""}]","2019-08-17"
"physics/9808030","Paolo Sibani","Paolo Sibani, Ruud van der Pas and J. Christian Schoen","The lid method for exhaustive exploration of metastable states of
  complex systems","RevTeX, 11 pages, 1 figure","Comp. Phys. Comm. 116, 17-27 (1999)","10.1016/S0010-4655(98)00176-3",,"physics.comp-ph",,"  The `lid' algorithm performs an exhaustive exploration of neighborhoods of
local energy minima of energy landscapes. This paper describes an
implementation of the algorithm, including issues of parallel performance and
scalability. To illustrate the versatility of the approach and to stress the
common features present in landscapes of quite different systems, we present
selected results for 1) a spin glass, 2) a ferromagnet, 3) a covalent network
model for glassy systems, and 4) a polymer. The exponential nature of the local
density of states found in these systems and its relation to the ordering
transition is briefly commented upon.
","[{""version"":""v1"",""created"":""Mon, 24 Aug 1998 14:40:21 GMT""}]","2009-10-31"
"quant-ph/9808042","Vladimir Buzek","V. Buzek, R. Derka, and S. Massar","Optimal Quantum Clocks","4 pages, revtex, 1 figure, revision contains some new results","Phys.Rev.Lett. 82 (1999) 2207-2210","10.1103/PhysRevLett.82.2207",,"quant-ph",,"  A quantum clock must satisfy two basic constraints. The first is a bound on
the time resolution of the clock given by the difference between its maximum
and minimum energy eigenvalues. The second follows from Holevo's bound on how
much classical information can be encoded in a quantum system. We show that
asymptotically, as the dimension of the Hilbert space of the clock tends to
infinity, both constraints can be satisfied simultaneously. The experimental
realization of such an optimal quantum clock using trapped ions is discussed.
","[{""version"":""v1"",""created"":""Mon, 24 Aug 1998 08:48:37 GMT""},{""version"":""v2"",""created"":""Tue, 1 Dec 1998 10:03:16 GMT""}]","2009-10-31"
"quant-ph/9808043","Pawel M. Masiak","Pawel Masiak and Peter L. Knight","Copying of entangled states and the degradation of correlations","8 pages, RevTex, 6 EPS figures, submitted to Phys. Rev. A","Fortsch.Phys. 49 (2001) 1001-1009","10.1002/1521-3978(200110)49:10/11<1001::AID-PROP1001>3.0.CO;2-B",,"quant-ph",,"  We investigate the degree to which entanglement survives when a correlated
pair of two-state systems are copied using either local or non-local processes.
We show how the copying process degrades the entanglement, due to a residual
correlation between the copied output and the copying machine (itself made of
qubits).
","[{""version"":""v1"",""created"":""Mon, 24 Aug 1998 15:52:07 GMT""}]","2015-06-26"
"solv-int/9808012","Antonio Lima Santos","A. Lima-Santos and Wagner Utiel","On The KMS Condition for the critical Ising model","8 pages, TcilaTex","Physics Letter A 226 (1997) 65-68","10.1016/S0375-9601(96)00919-X",,"solv-int hep-th nlin.SI",,"  Using the KMS condition and exchange algebras we discuss the monodromy and
modular properties of two-point KMS states of the critical Ising model.
","[{""version"":""v1"",""created"":""Mon, 24 Aug 1998 14:34:15 GMT""}]","2009-10-31"
"solv-int/9808013","Antonio Lima Santos","A. Lima-Santos","On fusion algebra of chiral $SU(N)_{k}$ models","11 pages, ioplppt","J.Phys.A: Math. Gen. 30 (1997) 5123-5131","10.1088/0305-4470/30/14/021",,"solv-int nlin.SI",,"  We discuss some algebraic setting of chiral $SU(N)_{k}$ models in terms of
the statistical dimensions of their fields. In particular, the conformal
dimensions and the central charge of the chiral $SU(N)_{k}$ models are
calculated from their braid matrices. Futhermore, at level K=2, we present the
characteristic polynomials of their fusion matrices in a factored form.
","[{""version"":""v1"",""created"":""Mon, 24 Aug 1998 14:56:07 GMT""}]","2009-10-31"
